data,flowmember,label,classes
b'her / IP / TCP 59.38.123.207:45902 > 192.168.0.106:9181 ',1,,
b'her / IP / TCP 59.38.123.207:45902 > 192.168.0.106:9181 ',1,,
b'her / IP / TCP 59.38.123.207:45902 > 192.168.0.106:9181 ',1,,
b'her / IP / TCP 59.38.123.207:45902 > 192.168.0.106:9181 A / Ra',1,,
b'her / IP / TCP 59.38.123.207:45902 > 192.168.0.106:9181 PA / Ra',1,,
b'her / IP / TCP 59.38.123.207:45902 > 192.168.0.106:9181 A / Ra',1,,
b'her / IP / TCP 59.38.123.207:45902 > 192.168.0.106:9181 PA / Ra',2,,
b'her / IP / TCP 59.38.123.207:45902 > 192.168.0.106:9181 A / Ra',2,,
b'her / IP / TCP 59.38.123.207:45902 > 192.168.0.106:9181 PA / Ra',2,,
b'her / IP / TCP 59.38.123.207:45902 > 192.168.0.106:9181 ',2,,
b'her / IP / TCP 59.38.123.207:45902 > 192.168.0.106:9181 PA / Ra',2,,
b'her / IP / TCP 59.38.123.207:45902 > 192.168.0.106:9181 ',2,,
b'her / IP / TCP 59.38.123.207:45902 > 192.168.0.106:9181 A / Ra',2,,
b'her / IP / TCP 59.38.123.207:45902 > 192.168.0.106:9181 PA / Ra',3,,
b'her / IP / TCP 59.38.123.207:45902 > 192.168.0.106:9181 F',3,,
b'her / IP / TCP 59.38.123.207:45902 > 192.168.0.106:9181 ',3,,
b'her / IP / TCP 192.168.0.106:9181 > 59.38.123.207:45902 ',4,,
b'her / IP / TCP 192.168.0.106:9181 > 59.38.123.207:45902 PA / Ra',4,,
b'her / IP / TCP 192.168.0.106:9181 > 59.38.123.207:45902 PA / Ra',4,,
b'her / IP / TCP 192.168.0.106:9181 > 59.38.123.207:45902 A / Ra',4,,
b'her / IP / TCP 192.168.0.106:9181 > 59.38.123.207:45902 PA / Ra',4,,
b'her / IP / TCP 192.168.0.106:9181 > 59.38.123.207:45902 ',4,,
b'her / IP / TCP 192.168.0.106:9181 > 59.38.123.207:45902 F',5,,
b'her / IP / TCP 192.168.0.106:8947 > 59.38.123.207:45902 PA / Ra',5,,
b'her / IP / TCP 192.168.0.106:8947 > 59.38.123.207:45902 PA / Ra',5,,
b'her / IP / TCP 192.168.0.106:8947 > 59.38.123.207:45902 ',5,,
b'her / IP / TCP 192.168.0.106:8947 > 59.38.123.207:45902 PA / Ra',5,,
b'her / IP / TCP 192.168.0.106:8947 > 59.38.123.207:45902 PA / Ra',5,,
b'her / IP / TCP 192.168.0.106:8947 > 59.38.123.207:45902 ',5,,
b'her / IP / TCP 192.168.0.106:8947 > 59.38.123.207:45902 PA / Ra',6,,
b'her / IP / TCP 192.168.0.106:8947 > 59.38.123.207:45902 PA / Ra',6,,
b'her / IP / TCP 192.168.0.106:8947 > 59.38.123.207:45902 ',6,,
b'her / IP / TCP 192.168.0.106:8962 > 220.194.116.51:https F',7,,
b'her / IP / TCP 192.168.0.106:8963 > 220.194.116.51:https F',8,,
b'her / IP / TCP 192.168.0.106:9007 > 61.54.91.215:https F',9,,
b'her / IP / TCP 192.168.0.106:9182 > 220.194.116.51:https ',10,,
b'her / IP / TCP 192.168.0.106:9182 > 220.194.116.51:https ',10,,
b'her / IP / TCP 192.168.0.106:9182 > 220.194.116.51:https PA / Ra',10,,
b'her / IP / TCP 192.168.0.106:9182 > 220.194.116.51:https ',10,,
b'her / IP / TCP 192.168.0.106:9182 > 220.194.116.51:https PA / Ra',10,,
b'her / IP / TCP 192.168.0.106:9182 > 220.194.116.51:https PA / Ra',10,,
b'her / IP / TCP 192.168.0.106:9182 > 220.194.116.51:https PA / Ra',11,,
b'her / IP / TCP 192.168.0.106:9182 > 220.194.116.51:https ',11,,
b'her / IP / TCP 192.168.0.106:9183 > 220.194.116.51:https ',12,,
b'her / IP / TCP 192.168.0.106:9183 > 220.194.116.51:https ',12,,
b'her / IP / TCP 192.168.0.106:9183 > 220.194.116.51:https PA / Ra',12,,
b'her / IP / TCP 192.168.0.106:9183 > 220.194.116.51:https ',12,,
b'her / IP / TCP 192.168.0.106:9183 > 220.194.116.51:https PA / Ra',12,,
b'her / IP / TCP 192.168.0.106:9183 > 220.194.116.51:https PA / Ra',12,,
b'her / IP / TCP 192.168.0.106:9183 > 220.194.116.51:https PA / Ra',13,,
b'her / IP / TCP 192.168.0.106:9183 > 220.194.116.51:https ',13,,
b'her / IP / TCP 61.54.91.215:https > 192.168.0.106:9007 ',14,,
b'her / IP / TCP 59.38.123.207:45902 > 192.168.0.106:8947 A / Paddin',15,,
b'her / IP / TCP 59.38.123.207:45902 > 192.168.0.106:8947 A / Paddin',15,,
b'her / IP / TCP 59.38.123.207:45902 > 192.168.0.106:8947 PA / Ra',15,,
b'her / IP / TCP 59.38.123.207:45902 > 192.168.0.106:8947 A / Paddin',15,,
b'her / IP / TCP 59.38.123.207:45902 > 192.168.0.106:8947 A / Paddin',15,,
b'her / IP / TCP 59.38.123.207:45902 > 192.168.0.106:8947 PA / Ra',15,,
b'her / IP / TCP 59.38.123.207:45902 > 192.168.0.106:8947 A / Paddin',16,,
b'her / IP / TCP 59.38.123.207:45902 > 192.168.0.106:8947 A / Paddin',16,,
b'her / IP / TCP 59.38.123.207:45902 > 192.168.0.106:8947 PA / Ra',16,,
b'her / IP / TCP 220.194.116.51:https > 192.168.0.106:8962 ',17,,
b'her / IP / TCP 220.194.116.51:https > 192.168.0.106:8963 ',18,,
b'her / IP / TCP 220.194.116.51:https > 192.168.0.106:9183 S',19,,
b'her / IP / TCP 220.194.116.51:https > 192.168.0.106:9183 ',19,,
b'her / IP / TCP 220.194.116.51:https > 192.168.0.106:9183 A / Ra',19,,
b'her / IP / TCP 220.194.116.51:https > 192.168.0.106:9183 PA / Ra',19,,
b'her / IP / TCP 220.194.116.51:https > 192.168.0.106:9183 PA / Ra',19,,
b'her / IP / TCP 220.194.116.51:https > 192.168.0.106:9183 ',19,,
b'her / IP / TCP 220.194.116.51:https > 192.168.0.106:9183 PA / Ra',20,,
b'her / IP / TCP 220.194.116.51:https > 192.168.0.106:9183 ',20,,
b'her / IP / TCP 220.194.116.51:https > 192.168.0.106:9183 ',20,,
b'her / IP / TCP 220.194.116.51:https > 192.168.0.106:9183 PA / Ra',20,,
b'her / IP / TCP 220.194.116.51:https > 192.168.0.106:9183 FPA / Ra',20,,
b'her / IP / TCP 220.194.116.51:https > 192.168.0.106:9182 S',21,,
b'her / IP / TCP 220.194.116.51:https > 192.168.0.106:9182 ',21,,
b'her / IP / TCP 220.194.116.51:https > 192.168.0.106:9182 A / Ra',21,,
b'her / IP / TCP 220.194.116.51:https > 192.168.0.106:9182 PA / Ra',21,,
b'her / IP / TCP 220.194.116.51:https > 192.168.0.106:9182 PA / Ra',21,,
b'her / IP / TCP 220.194.116.51:https > 192.168.0.106:9182 ',21,,
b'her / IP / TCP 220.194.116.51:https > 192.168.0.106:9182 PA / Ra',22,,
b'her / IP / TCP 220.194.116.51:https > 192.168.0.106:9182 ',22,,
b'her / IP / TCP 220.194.116.51:https > 192.168.0.106:9182 ',22,,
b'her / IP / TCP 220.194.116.51:https > 192.168.0.106:9182 PA / Ra',22,,
b'her / IP / TCP 220.194.116.51:https > 192.168.0.106:9182 FPA / Ra',22,,
b'her / IP / TCP 192.168.0.106:9149 > 59.38.123.207:45902 A / Ra',23,,
b'her / IP / TCP 59.38.123.207:45902 > 192.168.0.106:9149 ',24,,
b'her / IP / TCP 192.168.0.106:13282 > 116.130.224.46:https PA / Ra',25,,
b'her / IP / TCP 192.168.0.106:13282 > 116.130.224.46:https ',25,,
b'her / IP / TCP 116.130.224.46:https > 192.168.0.106:13282 A / Paddin',26,,
b'her / IP / TCP 116.130.224.46:https > 192.168.0.106:13282 PA / Ra',26,,
b'her / IP / TCP 192.168.0.106:9184 > 116.132.235.228:http ',27,,
b'her / IP / TCP 192.168.0.106:9184 > 116.132.235.228:http ',27,,
b'her / IP / TCP 192.168.0.106:9184 > 116.132.235.228:http PA / Ra',27,,
b'her / IP / TCP 192.168.0.106:9184 > 116.132.235.228:http A / Ra',27,,
b'her / IP / TCP 192.168.0.106:9184 > 116.132.235.228:http A / Ra',27,,
b'her / IP / TCP 192.168.0.106:9184 > 116.132.235.228:http PA / Ra',27,,
b'her / IP / TCP 192.168.0.106:9184 > 116.132.235.228:http ',28,,
b'her / IP / TCP 192.168.0.106:9184 > 116.132.235.228:http F',28,,
b'her / IP / TCP 116.132.235.228:http > 192.168.0.106:9184 S',29,,
b'her / IP / TCP 116.132.235.228:http > 192.168.0.106:9184 ',29,,
b'her / IP / TCP 116.132.235.228:http > 192.168.0.106:9184 ',29,,
b'her / IP / TCP 116.132.235.228:http > 192.168.0.106:9184 ',29,,
b'her / IP / TCP 116.132.235.228:http > 192.168.0.106:9184 PA / Ra',29,,
b'her / IP / TCP 116.132.235.228:http > 192.168.0.106:9184 F',29,,
b'her / IP / TCP 116.132.235.228:http > 192.168.0.106:9184 ',30,,
b'her / IP / TCP 192.168.0.106:9185 > 116.132.235.228:http ',30,,
b'her / IP / TCP 192.168.0.106:9185 > 116.132.235.228:http ',30,,
b'her / IP / TCP 192.168.0.106:9185 > 116.132.235.228:http PA / Ra',30,,
b'her / IP / TCP 192.168.0.106:9185 > 116.132.235.228:http A / Ra',30,,
b'her / IP / TCP 192.168.0.106:9185 > 116.132.235.228:http A / Ra',30,,
b'her / IP / TCP 192.168.0.106:9185 > 116.132.235.228:http PA / Ra',30,,
b'her / IP / TCP 192.168.0.106:9185 > 116.132.235.228:http ',31,,
b'her / IP / TCP 192.168.0.106:9185 > 116.132.235.228:http F',31,,
b'her / IP / TCP 116.132.235.228:http > 192.168.0.106:9185 S',32,,
b'her / IP / TCP 116.132.235.228:http > 192.168.0.106:9185 ',32,,
b'her / IP / TCP 116.132.235.228:http > 192.168.0.106:9185 ',32,,
b'her / IP / TCP 116.132.235.228:http > 192.168.0.106:9185 ',32,,
b'her / IP / TCP 116.132.235.228:http > 192.168.0.106:9185 PA / Ra',32,,
b'her / IP / TCP 116.132.235.228:http > 192.168.0.106:9185 F',32,,
b'her / IP / TCP 116.132.235.228:http > 192.168.0.106:9185 ',33,,
"b'her / IP / UDP / DNS Qry ""b\'_companion-link._tcp.local.\'""'",33,,
"b'her / IP / UDP / DNS Qry ""b\'_companion-link._tcp.local.\'""'",33,,
"b'her / IP / UDP / DNS Qry ""b\'_companion-link._tcp.local.\'""'",33,,
"b'her / IPv6 / UDP / DNS Qry ""b\'_companion-link._tcp.local.\'""'",34,,
"b'her / IPv6 / UDP / DNS Qry ""b\'_companion-link._tcp.local.\'""'",34,,
"b'her / IPv6 / UDP / DNS Qry ""b\'_companion-link._tcp.local.\'""'",34,,
b'her / IP / TCP 192.168.0.106:9186 > 116.132.235.228:http ',35,,
b'her / IP / TCP 192.168.0.106:9186 > 116.132.235.228:http ',35,,
b'her / IP / TCP 192.168.0.106:9186 > 116.132.235.228:http PA / Ra',35,,
b'her / IP / TCP 192.168.0.106:9186 > 116.132.235.228:http A / Ra',35,,
b'her / IP / TCP 192.168.0.106:9186 > 116.132.235.228:http A / Ra',35,,
b'her / IP / TCP 192.168.0.106:9186 > 116.132.235.228:http PA / Ra',35,,
b'her / IP / TCP 192.168.0.106:9186 > 116.132.235.228:http ',36,,
b'her / IP / TCP 192.168.0.106:9186 > 116.132.235.228:http F',36,,
b'her / IP / TCP 116.132.235.228:http > 192.168.0.106:9186 S',37,,
b'her / IP / TCP 116.132.235.228:http > 192.168.0.106:9186 ',37,,
b'her / IP / TCP 116.132.235.228:http > 192.168.0.106:9186 ',37,,
b'her / IP / TCP 116.132.235.228:http > 192.168.0.106:9186 ',37,,
b'her / IP / TCP 116.132.235.228:http > 192.168.0.106:9186 PA / Ra',37,,
b'her / IP / TCP 116.132.235.228:http > 192.168.0.106:9186 F',37,,
b'her / IP / TCP 116.132.235.228:http > 192.168.0.106:9186 ',38,,
b'her / IP / TCP 192.168.0.106:9187 > 116.132.235.228:http ',38,,
b'her / IP / TCP 192.168.0.106:9187 > 116.132.235.228:http ',38,,
b'her / IP / TCP 192.168.0.106:9187 > 116.132.235.228:http PA / Ra',38,,
b'her / IP / TCP 192.168.0.106:9187 > 116.132.235.228:http A / Ra',38,,
b'her / IP / TCP 192.168.0.106:9187 > 116.132.235.228:http A / Ra',38,,
b'her / IP / TCP 192.168.0.106:9187 > 116.132.235.228:http PA / Ra',38,,
b'her / IP / TCP 192.168.0.106:9187 > 116.132.235.228:http ',39,,
b'her / IP / TCP 192.168.0.106:9187 > 116.132.235.228:http F',39,,
b'her / IP / TCP 116.132.235.228:http > 192.168.0.106:9187 S',40,,
b'her / IP / TCP 116.132.235.228:http > 192.168.0.106:9187 ',40,,
b'her / IP / TCP 116.132.235.228:http > 192.168.0.106:9187 ',40,,
b'her / IP / TCP 116.132.235.228:http > 192.168.0.106:9187 ',40,,
b'her / IP / TCP 116.132.235.228:http > 192.168.0.106:9187 PA / Ra',40,,
b'her / IP / TCP 116.132.235.228:http > 192.168.0.106:9187 F',40,,
b'her / IP / TCP 116.132.235.228:http > 192.168.0.106:9187 ',41,,
b'her / IP / TCP 192.168.0.106:9188 > 116.132.235.228:http ',41,,
b'her / IP / TCP 192.168.0.106:9188 > 116.132.235.228:http ',41,,
b'her / IP / TCP 192.168.0.106:9188 > 116.132.235.228:http PA / Ra',41,,
b'her / IP / TCP 192.168.0.106:9188 > 116.132.235.228:http A / Ra',41,,
b'her / IP / TCP 192.168.0.106:9188 > 116.132.235.228:http A / Ra',41,,
b'her / IP / TCP 192.168.0.106:9188 > 116.132.235.228:http PA / Ra',41,,
b'her / IP / TCP 192.168.0.106:9188 > 116.132.235.228:http ',42,,
b'her / IP / TCP 192.168.0.106:9188 > 116.132.235.228:http F',42,,
b'her / IP / TCP 192.168.0.106:9188 > 116.132.235.228:http F',42,,
b'her / IP / TCP 192.168.0.106:9188 > 116.132.235.228:http F',42,,
b'her / IP / TCP 192.168.0.106:9188 > 116.132.235.228:http F',42,,
b'her / IP / TCP 116.132.235.228:http > 192.168.0.106:9188 S',43,,
b'her / IP / TCP 116.132.235.228:http > 192.168.0.106:9188 ',43,,
b'her / IP / TCP 116.132.235.228:http > 192.168.0.106:9188 ',43,,
b'her / IP / TCP 116.132.235.228:http > 192.168.0.106:9188 ',43,,
b'her / IP / TCP 116.132.235.228:http > 192.168.0.106:9188 PA / Ra',43,,
b'her / IP / TCP 116.132.235.228:http > 192.168.0.106:9188 F',43,,
b'her / IP / TCP 192.168.0.106:9189 > 116.132.235.228:http ',44,,
b'her / IP / TCP 192.168.0.106:9189 > 116.132.235.228:http ',44,,
b'her / IP / TCP 192.168.0.106:9189 > 116.132.235.228:http PA / Ra',44,,
b'her / IP / TCP 192.168.0.106:9189 > 116.132.235.228:http A / Ra',44,,
b'her / IP / TCP 192.168.0.106:9189 > 116.132.235.228:http A / Ra',44,,
b'her / IP / TCP 192.168.0.106:9189 > 116.132.235.228:http PA / Ra',44,,
b'her / IP / TCP 192.168.0.106:9189 > 116.132.235.228:http ',45,,
b'her / IP / TCP 192.168.0.106:9189 > 116.132.235.228:http F',45,,
b'her / IP / TCP 192.168.0.106:9189 > 116.132.235.228:http F',45,,
b'her / IP / TCP 192.168.0.106:9189 > 116.132.235.228:http F',45,,
b'her / IP / TCP 192.168.0.106:9189 > 116.132.235.228:http F',45,,
b'her / IP / TCP 116.132.235.228:http > 192.168.0.106:9189 S',46,,
b'her / IP / TCP 116.132.235.228:http > 192.168.0.106:9189 ',46,,
b'her / IP / TCP 116.132.235.228:http > 192.168.0.106:9189 ',46,,
b'her / IP / TCP 116.132.235.228:http > 192.168.0.106:9189 ',46,,
b'her / IP / TCP 116.132.235.228:http > 192.168.0.106:9189 PA / Ra',46,,
b'her / IP / TCP 116.132.235.228:http > 192.168.0.106:9189 F',46,,
b'her / IP / TCP 192.168.0.106:1063 > 54.148.245.131:https PA / Ra',47,,
b'her / IP / TCP 192.168.0.106:1063 > 54.148.245.131:https ',47,,
b'her / IP / TCP 54.148.245.131:https > 192.168.0.106:1063 PA / Ra',48,,
b'her / IP / TCP 192.168.0.106:9190 > 110.242.68.3:http ',49,,
b'her / IP / TCP 192.168.0.106:9190 > 110.242.68.3:http ',49,,
b'her / IP / TCP 192.168.0.106:9190 > 110.242.68.3:http F',49,,
b'her / IP / TCP 192.168.0.106:9190 > 110.242.68.3:http ',49,,
b'her / IP / TCP 110.242.68.3:http > 192.168.0.106:9190 S',50,,
b'her / IP / TCP 110.242.68.3:http > 192.168.0.106:9190 ',50,,
b'her / IP / TCP 110.242.68.3:http > 192.168.0.106:9190 F',50,,
b'her / IP / TCP 192.168.0.106:9191 > 116.132.235.228:http ',51,,
b'her / IP / TCP 192.168.0.106:9191 > 116.132.235.228:http ',51,,
b'her / IP / TCP 192.168.0.106:9191 > 116.132.235.228:http PA / Ra',51,,
b'her / IP / TCP 192.168.0.106:9191 > 116.132.235.228:http A / Ra',51,,
b'her / IP / TCP 192.168.0.106:9191 > 116.132.235.228:http A / Ra',51,,
b'her / IP / TCP 192.168.0.106:9191 > 116.132.235.228:http PA / Ra',51,,
b'her / IP / TCP 192.168.0.106:9191 > 116.132.235.228:http ',52,,
b'her / IP / TCP 192.168.0.106:9191 > 116.132.235.228:http F',52,,
b'her / IP / TCP 116.132.235.228:http > 192.168.0.106:9191 S',53,,
b'her / IP / TCP 116.132.235.228:http > 192.168.0.106:9191 ',53,,
b'her / IP / TCP 116.132.235.228:http > 192.168.0.106:9191 ',53,,
b'her / IP / TCP 116.132.235.228:http > 192.168.0.106:9191 ',53,,
b'her / IP / TCP 116.132.235.228:http > 192.168.0.106:9191 PA / Ra',53,,
b'her / IP / TCP 116.132.235.228:http > 192.168.0.106:9191 F',53,,
b'her / IP / TCP 116.132.235.228:http > 192.168.0.106:9191 ',54,,
b'her / IP / TCP 192.168.0.106:8982 > 59.38.123.207:45902 PA / Ra',54,,
b'her / IP / TCP 192.168.0.106:8982 > 59.38.123.207:45902 PA / Ra',54,,
b'her / IP / TCP 192.168.0.106:8982 > 59.38.123.207:45902 ',54,,
b'her / IP / TCP 59.38.123.207:45902 > 192.168.0.106:8982 A / Paddin',55,,
b'her / IP / TCP 59.38.123.207:45902 > 192.168.0.106:8982 A / Paddin',55,,
b'her / IP / TCP 59.38.123.207:45902 > 192.168.0.106:8982 PA / Ra',55,,
"b'her / IP / UDP / DNS Qry ""b\'dldir1.qq.com.\'""'",56,,
"b'her / IP / UDP / DNS Ans ""b\'dldir1.qq.com.tcdn.qq.com.\'""'",57,,
b'her / IP / TCP 192.168.0.106:9192 > 14.204.51.128:https ',58,,
b'her / IP / TCP 192.168.0.106:9192 > 14.204.51.128:https ',58,,
b'her / IP / TCP 192.168.0.106:9192 > 14.204.51.128:https PA / Ra',58,,
b'her / IP / TCP 192.168.0.106:9192 > 14.204.51.128:https ',58,,
b'her / IP / TCP 192.168.0.106:9192 > 14.204.51.128:https ',58,,
b'her / IP / TCP 192.168.0.106:9192 > 14.204.51.128:https PA / Ra',58,,
b'her / IP / TCP 192.168.0.106:9192 > 14.204.51.128:https ',59,,
b'her / IP / TCP 192.168.0.106:9192 > 14.204.51.128:https PA / Ra',59,,
b'her / IP / TCP 192.168.0.106:9192 > 14.204.51.128:https ',59,,
b'her / IP / TCP 192.168.0.106:9192 > 14.204.51.128:https ',59,,
b'her / IP / TCP 192.168.0.106:9192 > 14.204.51.128:https ',59,,
b'her / IP / TCP 192.168.0.106:9192 > 14.204.51.128:https ',59,,
b'her / IP / TCP 192.168.0.106:9192 > 14.204.51.128:https ',59,,
b'her / IP / TCP 192.168.0.106:9192 > 14.204.51.128:https ',60,,
b'her / IP / TCP 192.168.0.106:9192 > 14.204.51.128:https ',60,,
b'her / IP / TCP 192.168.0.106:9192 > 14.204.51.128:https ',60,,
b'her / IP / TCP 192.168.0.106:9192 > 14.204.51.128:https F',60,,
b'her / IP / TCP 192.168.0.106:9192 > 14.204.51.128:https ',60,,
b'her / IP / TCP 14.204.51.128:https > 192.168.0.106:9192 S',61,,
b'her / IP / TCP 14.204.51.128:https > 192.168.0.106:9192 ',61,,
b'her / IP / TCP 14.204.51.128:https > 192.168.0.106:9192 A / Ra',61,,
b'her / IP / TCP 14.204.51.128:https > 192.168.0.106:9192 A / Ra',61,,
b'her / IP / TCP 14.204.51.128:https > 192.168.0.106:9192 PA / Ra',61,,
b'her / IP / TCP 14.204.51.128:https > 192.168.0.106:9192 PA / Ra',61,,
b'her / IP / TCP 14.204.51.128:https > 192.168.0.106:9192 PA / Ra',62,,
b'her / IP / TCP 14.204.51.128:https > 192.168.0.106:9192 ',62,,
b'her / IP / TCP 14.204.51.128:https > 192.168.0.106:9192 PA / Ra',62,,
b'her / IP / TCP 14.204.51.128:https > 192.168.0.106:9192 PA / Ra',62,,
b'her / IP / TCP 14.204.51.128:https > 192.168.0.106:9192 PA / Ra',62,,
b'her / IP / TCP 14.204.51.128:https > 192.168.0.106:9192 ',62,,
b'her / IP / TCP 14.204.51.128:https > 192.168.0.106:9192 PA / Ra',62,,
b'her / IP / TCP 14.204.51.128:https > 192.168.0.106:9192 A / Ra',63,,
b'her / IP / TCP 14.204.51.128:https > 192.168.0.106:9192 A / Ra',63,,
b'her / IP / TCP 14.204.51.128:https > 192.168.0.106:9192 A / Ra',63,,
b'her / IP / TCP 14.204.51.128:https > 192.168.0.106:9192 A / Ra',63,,
b'her / IP / TCP 14.204.51.128:https > 192.168.0.106:9192 A / Ra',63,,
b'her / IP / TCP 14.204.51.128:https > 192.168.0.106:9192 A / Ra',63,,
b'her / IP / TCP 14.204.51.128:https > 192.168.0.106:9192 A / Ra',63,,
b'her / IP / TCP 14.204.51.128:https > 192.168.0.106:9192 A / Ra',64,,
b'her / IP / TCP 14.204.51.128:https > 192.168.0.106:9192 A / Ra',64,,
b'her / IP / TCP 14.204.51.128:https > 192.168.0.106:9192 A / Ra',64,,
b'her / IP / TCP 14.204.51.128:https > 192.168.0.106:9192 A / Ra',64,,
b'her / IP / TCP 14.204.51.128:https > 192.168.0.106:9192 A / Ra',64,,
b'her / IP / TCP 14.204.51.128:https > 192.168.0.106:9192 A / Ra',64,,
b'her / IP / TCP 14.204.51.128:https > 192.168.0.106:9192 A / Ra',64,,
b'her / IP / TCP 14.204.51.128:https > 192.168.0.106:9192 A / Ra',65,,
b'her / IP / TCP 14.204.51.128:https > 192.168.0.106:9192 A / Ra',65,,
b'her / IP / TCP 14.204.51.128:https > 192.168.0.106:9192 A / Ra',65,,
b'her / IP / TCP 14.204.51.128:https > 192.168.0.106:9192 A / Ra',65,,
b'her / IP / TCP 14.204.51.128:https > 192.168.0.106:9192 A / Ra',65,,
b'her / IP / TCP 14.204.51.128:https > 192.168.0.106:9192 A / Ra',65,,
b'her / IP / TCP 14.204.51.128:https > 192.168.0.106:9192 A / Ra',65,,
b'her / IP / TCP 14.204.51.128:https > 192.168.0.106:9192 A / Ra',66,,
b'her / IP / TCP 14.204.51.128:https > 192.168.0.106:9192 A / Ra',66,,
b'her / IP / TCP 14.204.51.128:https > 192.168.0.106:9192 A / Ra',66,,
b'her / IP / TCP 14.204.51.128:https > 192.168.0.106:9192 A / Ra',66,,
b'her / IP / TCP 14.204.51.128:https > 192.168.0.106:9192 A / Ra',66,,
b'her / IP / TCP 14.204.51.128:https > 192.168.0.106:9192 PA / Ra',66,,
b'her / IP / TCP 14.204.51.128:https > 192.168.0.106:9192 F',66,,
b'her / IP / TCP 192.168.0.106:9193 > 116.132.235.228:http ',67,,
b'her / IP / TCP 192.168.0.106:9193 > 116.132.235.228:http ',67,,
b'her / IP / TCP 192.168.0.106:9193 > 116.132.235.228:http PA / Ra',67,,
b'her / IP / TCP 192.168.0.106:9193 > 116.132.235.228:http A / Ra',67,,
b'her / IP / TCP 192.168.0.106:9193 > 116.132.235.228:http A / Ra',67,,
b'her / IP / TCP 192.168.0.106:9193 > 116.132.235.228:http PA / Ra',67,,
b'her / IP / TCP 192.168.0.106:9193 > 116.132.235.228:http ',68,,
b'her / IP / TCP 192.168.0.106:9193 > 116.132.235.228:http F',68,,
b'her / IP / TCP 116.132.235.228:http > 192.168.0.106:9193 S',69,,
b'her / IP / TCP 116.132.235.228:http > 192.168.0.106:9193 ',69,,
b'her / IP / TCP 116.132.235.228:http > 192.168.0.106:9193 ',69,,
b'her / IP / TCP 116.132.235.228:http > 192.168.0.106:9193 ',69,,
b'her / IP / TCP 116.132.235.228:http > 192.168.0.106:9193 PA / Ra',69,,
b'her / IP / TCP 116.132.235.228:http > 192.168.0.106:9193 F',69,,
b'her / IP / TCP 116.132.235.228:http > 192.168.0.106:9193 ',70,,
b'her / IP / TCP 192.168.0.106:13344 > 220.194.116.51:https F',70,,
b'her / IP / TCP 192.168.0.106:13344 > 220.194.116.51:https F',70,,
b'her / IP / TCP 192.168.0.106:13344 > 220.194.116.51:https F',70,,
b'her / IP / TCP 192.168.0.106:9073 > 122.96.96.252:http F',71,,
b'her / IP / TCP 192.168.0.106:9194 > 220.194.116.51:https ',72,,
b'her / IP / TCP 192.168.0.106:9194 > 220.194.116.51:https ',72,,
b'her / IP / TCP 192.168.0.106:9194 > 220.194.116.51:https PA / Ra',72,,
b'her / IP / TCP 192.168.0.106:9194 > 220.194.116.51:https ',72,,
b'her / IP / TCP 192.168.0.106:9194 > 220.194.116.51:https PA / Ra',72,,
b'her / IP / TCP 192.168.0.106:9194 > 220.194.116.51:https PA / Ra',72,,
b'her / IP / TCP 192.168.0.106:9194 > 220.194.116.51:https PA / Ra',73,,
b'her / IP / TCP 192.168.0.106:9194 > 220.194.116.51:https ',73,,
b'her / IP / TCP 220.194.116.51:https > 192.168.0.106:9194 S',74,,
b'her / IP / TCP 220.194.116.51:https > 192.168.0.106:9194 ',74,,
b'her / IP / TCP 220.194.116.51:https > 192.168.0.106:9194 A / Ra',74,,
b'her / IP / TCP 220.194.116.51:https > 192.168.0.106:9194 PA / Ra',74,,
b'her / IP / TCP 220.194.116.51:https > 192.168.0.106:9194 PA / Ra',74,,
b'her / IP / TCP 220.194.116.51:https > 192.168.0.106:9194 ',74,,
b'her / IP / TCP 220.194.116.51:https > 192.168.0.106:9194 PA / Ra',75,,
b'her / IP / TCP 220.194.116.51:https > 192.168.0.106:9194 ',75,,
b'her / IP / TCP 220.194.116.51:https > 192.168.0.106:9194 ',75,,
b'her / IP / TCP 220.194.116.51:https > 192.168.0.106:9194 PA / Ra',75,,
b'her / IP / TCP 220.194.116.51:https > 192.168.0.106:9194 FPA / Ra',75,,
b'her / IP / TCP 122.96.96.252:http > 192.168.0.106:9073 ',76,,
b'her / IP / TCP 192.168.0.106:9195 > 116.132.235.228:http ',77,,
b'her / IP / TCP 192.168.0.106:9195 > 116.132.235.228:http ',77,,
b'her / IP / TCP 192.168.0.106:9195 > 116.132.235.228:http PA / Ra',77,,
b'her / IP / TCP 192.168.0.106:9195 > 116.132.235.228:http A / Ra',77,,
b'her / IP / TCP 192.168.0.106:9195 > 116.132.235.228:http A / Ra',77,,
b'her / IP / TCP 192.168.0.106:9195 > 116.132.235.228:http PA / Ra',77,,
b'her / IP / TCP 192.168.0.106:9195 > 116.132.235.228:http ',78,,
b'her / IP / TCP 192.168.0.106:9195 > 116.132.235.228:http F',78,,
b'her / IP / TCP 116.132.235.228:http > 192.168.0.106:9195 S',79,,
b'her / IP / TCP 116.132.235.228:http > 192.168.0.106:9195 ',79,,
b'her / IP / TCP 116.132.235.228:http > 192.168.0.106:9195 ',79,,
b'her / IP / TCP 116.132.235.228:http > 192.168.0.106:9195 ',79,,
b'her / IP / TCP 116.132.235.228:http > 192.168.0.106:9195 PA / Ra',79,,
b'her / IP / TCP 116.132.235.228:http > 192.168.0.106:9195 F',79,,
b'her / IP / TCP 116.132.235.228:http > 192.168.0.106:9195 ',80,,
b'her / IP / TCP 192.168.0.106:9196 > 116.132.235.228:http ',80,,
b'her / IP / TCP 192.168.0.106:9196 > 116.132.235.228:http ',80,,
b'her / IP / TCP 192.168.0.106:9196 > 116.132.235.228:http PA / Ra',80,,
b'her / IP / TCP 192.168.0.106:9196 > 116.132.235.228:http A / Ra',80,,
b'her / IP / TCP 192.168.0.106:9196 > 116.132.235.228:http A / Ra',80,,
b'her / IP / TCP 192.168.0.106:9196 > 116.132.235.228:http PA / Ra',80,,
b'her / IP / TCP 192.168.0.106:9196 > 116.132.235.228:http ',81,,
b'her / IP / TCP 192.168.0.106:9196 > 116.132.235.228:http F',81,,
b'her / IP / TCP 192.168.0.106:9196 > 116.132.235.228:http F',81,,
b'her / IP / TCP 116.132.235.228:http > 192.168.0.106:9196 S',82,,
b'her / IP / TCP 116.132.235.228:http > 192.168.0.106:9196 ',82,,
b'her / IP / TCP 116.132.235.228:http > 192.168.0.106:9196 ',82,,
b'her / IP / TCP 116.132.235.228:http > 192.168.0.106:9196 ',82,,
b'her / IP / TCP 116.132.235.228:http > 192.168.0.106:9196 PA / Ra',82,,
b'her / IP / TCP 116.132.235.228:http > 192.168.0.106:9196 F',82,,
b'her / IP / TCP 192.168.0.106:11251 > 60.28.172.104:https PA / Ra',83,,
b'her / IP / TCP 192.168.0.106:11251 > 60.28.172.104:https PA / Ra',83,,
b'her / IP / TCP 192.168.0.106:11251 > 60.28.172.104:https PA / Ra',83,,
b'her / IP / TCP 192.168.0.106:11251 > 60.28.172.104:https PA / Ra',83,,
b'her / IP / TCP 192.168.0.106:11251 > 60.28.172.104:https PA / Ra',83,,
b'her / IP / TCP 192.168.0.106:11251 > 60.28.172.104:https PA / Ra',83,,
b'her / IP / TCP 192.168.0.106:11251 > 60.28.172.104:https ',84,,
b'her / IP / TCP 192.168.0.106:11251 > 60.28.172.104:https ',84,,
b'her / IP / TCP 192.168.0.106:11251 > 60.28.172.104:https PA / Ra',84,,
b'her / IP / TCP 192.168.0.106:11251 > 60.28.172.104:https PA / Ra',84,,
b'her / IP / TCP 192.168.0.106:9197 > 220.194.81.125:http ',85,,
b'her / IP / TCP 192.168.0.106:9197 > 220.194.81.125:http ',85,,
b'her / IP / TCP 192.168.0.106:9197 > 220.194.81.125:http PA / Ra',85,,
b'her / IP / TCP 192.168.0.106:9197 > 220.194.81.125:http PA / Ra',85,,
b'her / IP / TCP 192.168.0.106:9197 > 220.194.81.125:http ',85,,
b'her / IP / TCP 192.168.0.106:9197 > 220.194.81.125:http PA / Ra',85,,
b'her / IP / TCP 192.168.0.106:9197 > 220.194.81.125:http PA / Ra',86,,
b'her / IP / TCP 220.194.81.125:http > 192.168.0.106:9197 S',86,,
b'her / IP / TCP 220.194.81.125:http > 192.168.0.106:9197 ',86,,
b'her / IP / TCP 220.194.81.125:http > 192.168.0.106:9197 ',86,,
b'her / IP / TCP 220.194.81.125:http > 192.168.0.106:9197 PA / Ra',86,,
b'her / IP / TCP 220.194.81.125:http > 192.168.0.106:9197 ',86,,
b'her / IP / TCP 220.194.81.125:http > 192.168.0.106:9197 ',86,,
b'her / IP / TCP 60.28.172.104:https > 192.168.0.106:11251 PA / Ra',87,,
b'her / IP / TCP 60.28.172.104:https > 192.168.0.106:11251 PA / Ra',87,,
b'her / IP / TCP 60.28.172.104:https > 192.168.0.106:11251 PA / Ra',87,,
b'her / IP / TCP 60.28.172.104:https > 192.168.0.106:11251 A / Paddin',87,,
b'her / IP / TCP 60.28.172.104:https > 192.168.0.106:11251 A / Ra',87,,
b'her / IP / TCP 60.28.172.104:https > 192.168.0.106:11251 PA / Ra',87,,
b'her / IP / TCP 60.28.172.104:https > 192.168.0.106:11251 A / Ra',88,,
b'her / IP / TCP 60.28.172.104:https > 192.168.0.106:11251 PA / Ra',88,,
b'her / IP / TCP 60.28.172.104:https > 192.168.0.106:11251 A / Paddin',88,,
b'her / IP / TCP 60.28.172.104:https > 192.168.0.106:11251 PA / Ra',88,,
"b'her / IP / UDP / DNS Qry ""b\'ii.gdt.qq.com.\'""'",89,,
"b'her / IP / UDP / DNS Ans ""111.161.64.19""'",90,,
b'her / IP / TCP 192.168.0.106:9198 > 111.161.64.19:https ',91,,
b'her / IP / TCP 192.168.0.106:9198 > 111.161.64.19:https ',91,,
b'her / IP / TCP 192.168.0.106:9198 > 111.161.64.19:https PA / Ra',91,,
b'her / IP / TCP 192.168.0.106:9198 > 111.161.64.19:https ',91,,
b'her / IP / TCP 192.168.0.106:9198 > 111.161.64.19:https PA / Ra',91,,
b'her / IP / TCP 192.168.0.106:9198 > 111.161.64.19:https PA / Ra',91,,
b'her / IP / TCP 111.161.64.19:https > 192.168.0.106:9198 S',92,,
b'her / IP / TCP 111.161.64.19:https > 192.168.0.106:9198 ',92,,
b'her / IP / TCP 111.161.64.19:https > 192.168.0.106:9198 A / Ra',92,,
b'her / IP / TCP 111.161.64.19:https > 192.168.0.106:9198 PA / Ra',92,,
b'her / IP / TCP 111.161.64.19:https > 192.168.0.106:9198 PA / Ra',92,,
b'her / IP / TCP 111.161.64.19:https > 192.168.0.106:9198 ',92,,
b'her / IP / TCP 111.161.64.19:https > 192.168.0.106:9198 PA / Ra',93,,
