srcip,dstip,sport,dport,proto,data
59.38.123.207,192.168.0.106,45902,10996,6,"Ether / IP / TCP 59.38.123.207:45902 > 192.168.0.106:10996 A"
59.38.123.207,192.168.0.106,45902,10996,6,"Ether / IP / TCP 59.38.123.207:45902 > 192.168.0.106:10996 A"
59.38.123.207,192.168.0.106,45902,10996,6,"Ether / IP / TCP 59.38.123.207:45902 > 192.168.0.106:10996 A"
192.168.0.106,110.242.68.3,10997,80,6,"Ether / IP / TCP 192.168.0.106:10997 > 110.242.68.3:http S"
59.38.123.207,192.168.0.106,45902,10996,6,"Ether / IP / TCP 59.38.123.207:45902 > 192.168.0.106:10996 A / Raw"
59.38.123.207,192.168.0.106,45902,10996,6,"Ether / IP / TCP 59.38.123.207:45902 > 192.168.0.106:10996 PA / Raw"
59.38.123.207,192.168.0.106,45902,10996,6,"Ether / IP / TCP 59.38.123.207:45902 > 192.168.0.106:10996 A / Raw"
59.38.123.207,192.168.0.106,45902,10996,6,"Ether / IP / TCP 59.38.123.207:45902 > 192.168.0.106:10996 PA / Raw"
59.38.123.207,192.168.0.106,45902,10996,6,"Ether / IP / TCP 59.38.123.207:45902 > 192.168.0.106:10996 A / Raw"
192.168.0.106,59.38.123.207,10996,45902,6,"Ether / IP / TCP 192.168.0.106:10996 > 59.38.123.207:45902 A"
59.38.123.207,192.168.0.106,45902,10996,6,"Ether / IP / TCP 59.38.123.207:45902 > 192.168.0.106:10996 PA / Raw"
192.168.0.106,59.38.123.207,10996,45902,6,"Ether / IP / TCP 192.168.0.106:10996 > 59.38.123.207:45902 A"
192.168.0.106,59.38.123.207,10996,45902,6,"Ether / IP / TCP 192.168.0.106:10996 > 59.38.123.207:45902 PA / Raw"
110.242.68.3,192.168.0.106,80,10997,6,"Ether / IP / TCP 110.242.68.3:http > 192.168.0.106:10997 SA"
192.168.0.106,110.242.68.3,10997,80,6,"Ether / IP / TCP 192.168.0.106:10997 > 110.242.68.3:http A"
192.168.0.106,110.242.68.3,10997,80,6,"Ether / IP / TCP 192.168.0.106:10997 > 110.242.68.3:http FA"
110.242.68.3,192.168.0.106,80,10997,6,"Ether / IP / TCP 110.242.68.3:http > 192.168.0.106:10997 A"
110.242.68.3,192.168.0.106,80,10997,6,"Ether / IP / TCP 110.242.68.3:http > 192.168.0.106:10997 FA"
192.168.0.106,110.242.68.3,10997,80,6,"Ether / IP / TCP 192.168.0.106:10997 > 110.242.68.3:http A"
59.38.123.207,192.168.0.106,45902,10996,6,"Ether / IP / TCP 59.38.123.207:45902 > 192.168.0.106:10996 A"
59.38.123.207,192.168.0.106,45902,10996,6,"Ether / IP / TCP 59.38.123.207:45902 > 192.168.0.106:10996 PA / Raw"
192.168.0.106,59.38.123.207,10996,45902,6,"Ether / IP / TCP 192.168.0.106:10996 > 59.38.123.207:45902 PA / Raw"
192.168.0.106,59.38.123.207,10996,45902,6,"Ether / IP / TCP 192.168.0.106:10996 > 59.38.123.207:45902 A / Raw"
192.168.0.106,59.38.123.207,10996,45902,6,"Ether / IP / TCP 192.168.0.106:10996 > 59.38.123.207:45902 PA / Raw"
59.38.123.207,192.168.0.106,45902,10996,6,"Ether / IP / TCP 59.38.123.207:45902 > 192.168.0.106:10996 A"
59.38.123.207,192.168.0.106,45902,10996,6,"Ether / IP / TCP 59.38.123.207:45902 > 192.168.0.106:10996 A / Raw"
59.38.123.207,192.168.0.106,45902,10996,6,"Ether / IP / TCP 59.38.123.207:45902 > 192.168.0.106:10996 PA / Raw"
59.38.123.207,192.168.0.106,45902,10996,6,"Ether / IP / TCP 59.38.123.207:45902 > 192.168.0.106:10996 FA"
192.168.0.106,59.38.123.207,10996,45902,6,"Ether / IP / TCP 192.168.0.106:10996 > 59.38.123.207:45902 A"
192.168.0.106,59.38.123.207,10996,45902,6,"Ether / IP / TCP 192.168.0.106:10996 > 59.38.123.207:45902 FA"
59.38.123.207,192.168.0.106,45902,10996,6,"Ether / IP / TCP 59.38.123.207:45902 > 192.168.0.106:10996 A"
192.168.0.106,116.132.235.228,10998,80,6,"Ether / IP / TCP 192.168.0.106:10998 > 116.132.235.228:http S"
116.132.235.228,192.168.0.106,80,10998,6,"Ether / IP / TCP 116.132.235.228:http > 192.168.0.106:10998 SA"
192.168.0.106,116.132.235.228,10998,80,6,"Ether / IP / TCP 192.168.0.106:10998 > 116.132.235.228:http A"
192.168.0.106,116.132.235.228,10998,80,6,"Ether / IP / TCP 192.168.0.106:10998 > 116.132.235.228:http PA / Raw"
192.168.0.106,116.132.235.228,10998,80,6,"Ether / IP / TCP 192.168.0.106:10998 > 116.132.235.228:http A / Raw"
192.168.0.106,116.132.235.228,10998,80,6,"Ether / IP / TCP 192.168.0.106:10998 > 116.132.235.228:http A / Raw"
192.168.0.106,116.132.235.228,10998,80,6,"Ether / IP / TCP 192.168.0.106:10998 > 116.132.235.228:http PA / Raw"
116.132.235.228,192.168.0.106,80,10998,6,"Ether / IP / TCP 116.132.235.228:http > 192.168.0.106:10998 A"
116.132.235.228,192.168.0.106,80,10998,6,"Ether / IP / TCP 116.132.235.228:http > 192.168.0.106:10998 A"
116.132.235.228,192.168.0.106,80,10998,6,"Ether / IP / TCP 116.132.235.228:http > 192.168.0.106:10998 A"
116.132.235.228,192.168.0.106,80,10998,6,"Ether / IP / TCP 116.132.235.228:http > 192.168.0.106:10998 PA / Raw"
116.132.235.228,192.168.0.106,80,10998,6,"Ether / IP / TCP 116.132.235.228:http > 192.168.0.106:10998 FA"
192.168.0.106,116.132.235.228,10998,80,6,"Ether / IP / TCP 192.168.0.106:10998 > 116.132.235.228:http A"
192.168.0.106,116.132.235.228,10998,80,6,"Ether / IP / TCP 192.168.0.106:10998 > 116.132.235.228:http FA"
116.132.235.228,192.168.0.106,80,10998,6,"Ether / IP / TCP 116.132.235.228:http > 192.168.0.106:10998 A"
192.168.0.106,59.38.123.207,10292,45902,6,"Ether / IP / TCP 192.168.0.106:10292 > 59.38.123.207:45902 PA / Raw"
192.168.0.106,59.38.123.207,10292,45902,6,"Ether / IP / TCP 192.168.0.106:10292 > 59.38.123.207:45902 PA / Raw"
59.38.123.207,192.168.0.106,45902,10292,6,"Ether / IP / TCP 59.38.123.207:45902 > 192.168.0.106:10292 A / Padding"
59.38.123.207,192.168.0.106,45902,10292,6,"Ether / IP / TCP 59.38.123.207:45902 > 192.168.0.106:10292 A / Padding"
59.38.123.207,192.168.0.106,45902,10292,6,"Ether / IP / TCP 59.38.123.207:45902 > 192.168.0.106:10292 PA / Raw"
59.38.123.207,192.168.0.106,45902,10292,6,"Ether / IP / TCP 59.38.123.207:45902 > 192.168.0.106:10292 PA / Raw"
192.168.0.106,59.38.123.207,10292,45902,6,"Ether / IP / TCP 192.168.0.106:10292 > 59.38.123.207:45902 A"
192.168.0.106,116.132.235.228,10999,80,6,"Ether / IP / TCP 192.168.0.106:10999 > 116.132.235.228:http S"
116.132.235.228,192.168.0.106,80,10999,6,"Ether / IP / TCP 116.132.235.228:http > 192.168.0.106:10999 SA"
192.168.0.106,116.132.235.228,10999,80,6,"Ether / IP / TCP 192.168.0.106:10999 > 116.132.235.228:http A"
192.168.0.106,116.132.235.228,10999,80,6,"Ether / IP / TCP 192.168.0.106:10999 > 116.132.235.228:http PA / Raw"
192.168.0.106,116.132.235.228,10999,80,6,"Ether / IP / TCP 192.168.0.106:10999 > 116.132.235.228:http A / Raw"
192.168.0.106,116.132.235.228,10999,80,6,"Ether / IP / TCP 192.168.0.106:10999 > 116.132.235.228:http A / Raw"
192.168.0.106,116.132.235.228,10999,80,6,"Ether / IP / TCP 192.168.0.106:10999 > 116.132.235.228:http PA / Raw"
116.132.235.228,192.168.0.106,80,10999,6,"Ether / IP / TCP 116.132.235.228:http > 192.168.0.106:10999 A"
116.132.235.228,192.168.0.106,80,10999,6,"Ether / IP / TCP 116.132.235.228:http > 192.168.0.106:10999 A"
116.132.235.228,192.168.0.106,80,10999,6,"Ether / IP / TCP 116.132.235.228:http > 192.168.0.106:10999 A"
116.132.235.228,192.168.0.106,80,10999,6,"Ether / IP / TCP 116.132.235.228:http > 192.168.0.106:10999 PA / Raw"
116.132.235.228,192.168.0.106,80,10999,6,"Ether / IP / TCP 116.132.235.228:http > 192.168.0.106:10999 FA"
192.168.0.106,116.132.235.228,10999,80,6,"Ether / IP / TCP 192.168.0.106:10999 > 116.132.235.228:http A"
192.168.0.106,116.132.235.228,10999,80,6,"Ether / IP / TCP 192.168.0.106:10999 > 116.132.235.228:http FA"
116.132.235.228,192.168.0.106,80,10999,6,"Ether / IP / TCP 116.132.235.228:http > 192.168.0.106:10999 A"
192.168.0.106,59.38.123.207,10292,45902,6,"Ether / IP / TCP 192.168.0.106:10292 > 59.38.123.207:45902 PA / Raw"
192.168.0.106,59.38.123.207,10292,45902,6,"Ether / IP / TCP 192.168.0.106:10292 > 59.38.123.207:45902 PA / Raw"
59.38.123.207,192.168.0.106,45902,10292,6,"Ether / IP / TCP 59.38.123.207:45902 > 192.168.0.106:10292 A / Padding"
59.38.123.207,192.168.0.106,45902,10292,6,"Ether / IP / TCP 59.38.123.207:45902 > 192.168.0.106:10292 A / Padding"
59.38.123.207,192.168.0.106,45902,10292,6,"Ether / IP / TCP 59.38.123.207:45902 > 192.168.0.106:10292 PA / Raw"
59.38.123.207,192.168.0.106,45902,10292,6,"Ether / IP / TCP 59.38.123.207:45902 > 192.168.0.106:10292 PA / Raw"
192.168.0.106,59.38.123.207,10292,45902,6,"Ether / IP / TCP 192.168.0.106:10292 > 59.38.123.207:45902 A"
192.168.0.106,116.132.235.228,11000,80,6,"Ether / IP / TCP 192.168.0.106:11000 > 116.132.235.228:http S"
116.132.235.228,192.168.0.106,80,11000,6,"Ether / IP / TCP 116.132.235.228:http > 192.168.0.106:11000 SA"
192.168.0.106,116.132.235.228,11000,80,6,"Ether / IP / TCP 192.168.0.106:11000 > 116.132.235.228:http A"
192.168.0.106,116.132.235.228,11000,80,6,"Ether / IP / TCP 192.168.0.106:11000 > 116.132.235.228:http PA / Raw"
192.168.0.106,116.132.235.228,11000,80,6,"Ether / IP / TCP 192.168.0.106:11000 > 116.132.235.228:http A / Raw"
192.168.0.106,116.132.235.228,11000,80,6,"Ether / IP / TCP 192.168.0.106:11000 > 116.132.235.228:http A / Raw"
192.168.0.106,116.132.235.228,11000,80,6,"Ether / IP / TCP 192.168.0.106:11000 > 116.132.235.228:http PA / Raw"
116.132.235.228,192.168.0.106,80,11000,6,"Ether / IP / TCP 116.132.235.228:http > 192.168.0.106:11000 A"
116.132.235.228,192.168.0.106,80,11000,6,"Ether / IP / TCP 116.132.235.228:http > 192.168.0.106:11000 A"
116.132.235.228,192.168.0.106,80,11000,6,"Ether / IP / TCP 116.132.235.228:http > 192.168.0.106:11000 A"
116.132.235.228,192.168.0.106,80,11000,6,"Ether / IP / TCP 116.132.235.228:http > 192.168.0.106:11000 A"
116.132.235.228,192.168.0.106,80,11000,6,"Ether / IP / TCP 116.132.235.228:http > 192.168.0.106:11000 PA / Raw"
116.132.235.228,192.168.0.106,80,11000,6,"Ether / IP / TCP 116.132.235.228:http > 192.168.0.106:11000 FA"
192.168.0.106,116.132.235.228,11000,80,6,"Ether / IP / TCP 192.168.0.106:11000 > 116.132.235.228:http A"
192.168.0.106,116.132.235.228,11000,80,6,"Ether / IP / TCP 192.168.0.106:11000 > 116.132.235.228:http FA"
116.132.235.228,192.168.0.106,80,11000,6,"Ether / IP / TCP 116.132.235.228:http > 192.168.0.106:11000 A"
192.168.0.106,116.132.235.228,11001,80,6,"Ether / IP / TCP 192.168.0.106:11001 > 116.132.235.228:http S"
116.132.235.228,192.168.0.106,80,11001,6,"Ether / IP / TCP 116.132.235.228:http > 192.168.0.106:11001 SA"
192.168.0.106,116.132.235.228,11001,80,6,"Ether / IP / TCP 192.168.0.106:11001 > 116.132.235.228:http A"
192.168.0.106,116.132.235.228,11001,80,6,"Ether / IP / TCP 192.168.0.106:11001 > 116.132.235.228:http PA / Raw"
192.168.0.106,116.132.235.228,11001,80,6,"Ether / IP / TCP 192.168.0.106:11001 > 116.132.235.228:http A / Raw"
192.168.0.106,116.132.235.228,11001,80,6,"Ether / IP / TCP 192.168.0.106:11001 > 116.132.235.228:http A / Raw"
192.168.0.106,116.132.235.228,11001,80,6,"Ether / IP / TCP 192.168.0.106:11001 > 116.132.235.228:http PA / Raw"
116.132.235.228,192.168.0.106,80,11001,6,"Ether / IP / TCP 116.132.235.228:http > 192.168.0.106:11001 A"
116.132.235.228,192.168.0.106,80,11001,6,"Ether / IP / TCP 116.132.235.228:http > 192.168.0.106:11001 A"
116.132.235.228,192.168.0.106,80,11001,6,"Ether / IP / TCP 116.132.235.228:http > 192.168.0.106:11001 A"
116.132.235.228,192.168.0.106,80,11001,6,"Ether / IP / TCP 116.132.235.228:http > 192.168.0.106:11001 A"
116.132.235.228,192.168.0.106,80,11001,6,"Ether / IP / TCP 116.132.235.228:http > 192.168.0.106:11001 PA / Raw"
116.132.235.228,192.168.0.106,80,11001,6,"Ether / IP / TCP 116.132.235.228:http > 192.168.0.106:11001 FA"
192.168.0.106,116.132.235.228,11001,80,6,"Ether / IP / TCP 192.168.0.106:11001 > 116.132.235.228:http A"
192.168.0.106,116.132.235.228,11001,80,6,"Ether / IP / TCP 192.168.0.106:11001 > 116.132.235.228:http FA"
116.132.235.228,192.168.0.106,80,11001,6,"Ether / IP / TCP 116.132.235.228:http > 192.168.0.106:11001 A"
192.168.0.106,59.38.123.207,10292,45902,6,"Ether / IP / TCP 192.168.0.106:10292 > 59.38.123.207:45902 PA / Raw"
192.168.0.106,59.38.123.207,10292,45902,6,"Ether / IP / TCP 192.168.0.106:10292 > 59.38.123.207:45902 PA / Raw"
59.38.123.207,192.168.0.106,45902,10292,6,"Ether / IP / TCP 59.38.123.207:45902 > 192.168.0.106:10292 A / Padding"
59.38.123.207,192.168.0.106,45902,10292,6,"Ether / IP / TCP 59.38.123.207:45902 > 192.168.0.106:10292 A / Padding"
59.38.123.207,192.168.0.106,45902,10292,6,"Ether / IP / TCP 59.38.123.207:45902 > 192.168.0.106:10292 PA / Raw"
59.38.123.207,192.168.0.106,45902,10292,6,"Ether / IP / TCP 59.38.123.207:45902 > 192.168.0.106:10292 PA / Raw"
192.168.0.106,59.38.123.207,10292,45902,6,"Ether / IP / TCP 192.168.0.106:10292 > 59.38.123.207:45902 A"
192.168.0.106,116.132.235.228,11002,80,6,"Ether / IP / TCP 192.168.0.106:11002 > 116.132.235.228:http S"
116.132.235.228,192.168.0.106,80,11002,6,"Ether / IP / TCP 116.132.235.228:http > 192.168.0.106:11002 SA"
192.168.0.106,116.132.235.228,11002,80,6,"Ether / IP / TCP 192.168.0.106:11002 > 116.132.235.228:http A"
192.168.0.106,116.132.235.228,11002,80,6,"Ether / IP / TCP 192.168.0.106:11002 > 116.132.235.228:http PA / Raw"
192.168.0.106,116.132.235.228,11002,80,6,"Ether / IP / TCP 192.168.0.106:11002 > 116.132.235.228:http A / Raw"
192.168.0.106,116.132.235.228,11002,80,6,"Ether / IP / TCP 192.168.0.106:11002 > 116.132.235.228:http A / Raw"
192.168.0.106,116.132.235.228,11002,80,6,"Ether / IP / TCP 192.168.0.106:11002 > 116.132.235.228:http PA / Raw"
116.132.235.228,192.168.0.106,80,11002,6,"Ether / IP / TCP 116.132.235.228:http > 192.168.0.106:11002 A"
116.132.235.228,192.168.0.106,80,11002,6,"Ether / IP / TCP 116.132.235.228:http > 192.168.0.106:11002 A"
116.132.235.228,192.168.0.106,80,11002,6,"Ether / IP / TCP 116.132.235.228:http > 192.168.0.106:11002 A"
116.132.235.228,192.168.0.106,80,11002,6,"Ether / IP / TCP 116.132.235.228:http > 192.168.0.106:11002 PA / Raw"
116.132.235.228,192.168.0.106,80,11002,6,"Ether / IP / TCP 116.132.235.228:http > 192.168.0.106:11002 FA"
192.168.0.106,116.132.235.228,11002,80,6,"Ether / IP / TCP 192.168.0.106:11002 > 116.132.235.228:http A"
192.168.0.106,116.132.235.228,11002,80,6,"Ether / IP / TCP 192.168.0.106:11002 > 116.132.235.228:http FA"
192.168.0.106,116.132.235.228,11002,80,6,"Ether / IP / TCP 192.168.0.106:11002 > 116.132.235.228:http FA"
192.168.0.106,116.132.235.228,11002,80,6,"Ether / IP / TCP 192.168.0.106:11002 > 116.132.235.228:http FA"
192.168.0.106,116.132.235.228,11003,80,6,"Ether / IP / TCP 192.168.0.106:11003 > 116.132.235.228:http S"
116.132.235.228,192.168.0.106,80,11003,6,"Ether / IP / TCP 116.132.235.228:http > 192.168.0.106:11003 SA"
192.168.0.106,116.132.235.228,11003,80,6,"Ether / IP / TCP 192.168.0.106:11003 > 116.132.235.228:http A"
192.168.0.106,116.132.235.228,11003,80,6,"Ether / IP / TCP 192.168.0.106:11003 > 116.132.235.228:http PA / Raw"
192.168.0.106,116.132.235.228,11003,80,6,"Ether / IP / TCP 192.168.0.106:11003 > 116.132.235.228:http A / Raw"
192.168.0.106,116.132.235.228,11003,80,6,"Ether / IP / TCP 192.168.0.106:11003 > 116.132.235.228:http A / Raw"
192.168.0.106,116.132.235.228,11003,80,6,"Ether / IP / TCP 192.168.0.106:11003 > 116.132.235.228:http PA / Raw"
116.132.235.228,192.168.0.106,80,11003,6,"Ether / IP / TCP 116.132.235.228:http > 192.168.0.106:11003 A"
116.132.235.228,192.168.0.106,80,11003,6,"Ether / IP / TCP 116.132.235.228:http > 192.168.0.106:11003 A"
116.132.235.228,192.168.0.106,80,11003,6,"Ether / IP / TCP 116.132.235.228:http > 192.168.0.106:11003 A"
116.132.235.228,192.168.0.106,80,11003,6,"Ether / IP / TCP 116.132.235.228:http > 192.168.0.106:11003 PA / Raw"
116.132.235.228,192.168.0.106,80,11003,6,"Ether / IP / TCP 116.132.235.228:http > 192.168.0.106:11003 FA"
192.168.0.106,116.132.235.228,11003,80,6,"Ether / IP / TCP 192.168.0.106:11003 > 116.132.235.228:http A"
192.168.0.106,116.132.235.228,11003,80,6,"Ether / IP / TCP 192.168.0.106:11003 > 116.132.235.228:http FA"
116.132.235.228,192.168.0.106,80,11003,6,"Ether / IP / TCP 116.132.235.228:http > 192.168.0.106:11003 A"
192.168.0.106,116.132.235.228,11002,80,6,"Ether / IP / TCP 192.168.0.106:11002 > 116.132.235.228:http FA"
192.168.0.106,116.132.235.228,11004,80,6,"Ether / IP / TCP 192.168.0.106:11004 > 116.132.235.228:http S"
116.132.235.228,192.168.0.106,80,11004,6,"Ether / IP / TCP 116.132.235.228:http > 192.168.0.106:11004 SA"
192.168.0.106,116.132.235.228,11004,80,6,"Ether / IP / TCP 192.168.0.106:11004 > 116.132.235.228:http A"
192.168.0.106,116.132.235.228,11004,80,6,"Ether / IP / TCP 192.168.0.106:11004 > 116.132.235.228:http PA / Raw"
192.168.0.106,116.132.235.228,11004,80,6,"Ether / IP / TCP 192.168.0.106:11004 > 116.132.235.228:http A / Raw"
192.168.0.106,116.132.235.228,11004,80,6,"Ether / IP / TCP 192.168.0.106:11004 > 116.132.235.228:http A / Raw"
192.168.0.106,116.132.235.228,11004,80,6,"Ether / IP / TCP 192.168.0.106:11004 > 116.132.235.228:http PA / Raw"
116.132.235.228,192.168.0.106,80,11004,6,"Ether / IP / TCP 116.132.235.228:http > 192.168.0.106:11004 A"
116.132.235.228,192.168.0.106,80,11004,6,"Ether / IP / TCP 116.132.235.228:http > 192.168.0.106:11004 A"
116.132.235.228,192.168.0.106,80,11004,6,"Ether / IP / TCP 116.132.235.228:http > 192.168.0.106:11004 PA / Raw"
116.132.235.228,192.168.0.106,80,11004,6,"Ether / IP / TCP 116.132.235.228:http > 192.168.0.106:11004 FA"
192.168.0.106,116.132.235.228,11004,80,6,"Ether / IP / TCP 192.168.0.106:11004 > 116.132.235.228:http A"
192.168.0.106,116.132.235.228,11004,80,6,"Ether / IP / TCP 192.168.0.106:11004 > 116.132.235.228:http FA"
116.132.235.228,192.168.0.106,80,11004,6,"Ether / IP / TCP 116.132.235.228:http > 192.168.0.106:11004 A"
192.168.0.106,116.132.235.228,11005,80,6,"Ether / IP / TCP 192.168.0.106:11005 > 116.132.235.228:http S"
116.132.235.228,192.168.0.106,80,11005,6,"Ether / IP / TCP 116.132.235.228:http > 192.168.0.106:11005 SA"
192.168.0.106,116.132.235.228,11005,80,6,"Ether / IP / TCP 192.168.0.106:11005 > 116.132.235.228:http A"
192.168.0.106,116.132.235.228,11005,80,6,"Ether / IP / TCP 192.168.0.106:11005 > 116.132.235.228:http PA / Raw"
192.168.0.106,116.132.235.228,11005,80,6,"Ether / IP / TCP 192.168.0.106:11005 > 116.132.235.228:http A / Raw"
192.168.0.106,116.132.235.228,11005,80,6,"Ether / IP / TCP 192.168.0.106:11005 > 116.132.235.228:http A / Raw"
192.168.0.106,116.132.235.228,11005,80,6,"Ether / IP / TCP 192.168.0.106:11005 > 116.132.235.228:http PA / Raw"
116.132.235.228,192.168.0.106,80,11005,6,"Ether / IP / TCP 116.132.235.228:http > 192.168.0.106:11005 A"
116.132.235.228,192.168.0.106,80,11005,6,"Ether / IP / TCP 116.132.235.228:http > 192.168.0.106:11005 A"
116.132.235.228,192.168.0.106,80,11005,6,"Ether / IP / TCP 116.132.235.228:http > 192.168.0.106:11005 A"
116.132.235.228,192.168.0.106,80,11005,6,"Ether / IP / TCP 116.132.235.228:http > 192.168.0.106:11005 PA / Raw"
116.132.235.228,192.168.0.106,80,11005,6,"Ether / IP / TCP 116.132.235.228:http > 192.168.0.106:11005 FA"
192.168.0.106,116.132.235.228,11005,80,6,"Ether / IP / TCP 192.168.0.106:11005 > 116.132.235.228:http A"
192.168.0.106,116.132.235.228,11005,80,6,"Ether / IP / TCP 192.168.0.106:11005 > 116.132.235.228:http FA"
116.132.235.228,192.168.0.106,80,11005,6,"Ether / IP / TCP 116.132.235.228:http > 192.168.0.106:11005 A"
52.108.46.20,192.168.0.106,443,1285,6,"Ether / IP / TCP 52.108.46.20:https > 192.168.0.106:1285 PA / Raw"
192.168.0.106,52.108.46.20,1285,443,6,"Ether / IP / TCP 192.168.0.106:1285 > 52.108.46.20:https A"
192.168.0.106,116.132.235.228,11006,80,6,"Ether / IP / TCP 192.168.0.106:11006 > 116.132.235.228:http S"
116.132.235.228,192.168.0.106,80,11006,6,"Ether / IP / TCP 116.132.235.228:http > 192.168.0.106:11006 SA"
192.168.0.106,116.132.235.228,11006,80,6,"Ether / IP / TCP 192.168.0.106:11006 > 116.132.235.228:http A"
192.168.0.106,116.132.235.228,11006,80,6,"Ether / IP / TCP 192.168.0.106:11006 > 116.132.235.228:http PA / Raw"
192.168.0.106,116.132.235.228,11006,80,6,"Ether / IP / TCP 192.168.0.106:11006 > 116.132.235.228:http A / Raw"
192.168.0.106,116.132.235.228,11006,80,6,"Ether / IP / TCP 192.168.0.106:11006 > 116.132.235.228:http A / Raw"
192.168.0.106,116.132.235.228,11006,80,6,"Ether / IP / TCP 192.168.0.106:11006 > 116.132.235.228:http PA / Raw"
116.132.235.228,192.168.0.106,80,11006,6,"Ether / IP / TCP 116.132.235.228:http > 192.168.0.106:11006 A"
116.132.235.228,192.168.0.106,80,11006,6,"Ether / IP / TCP 116.132.235.228:http > 192.168.0.106:11006 A"
116.132.235.228,192.168.0.106,80,11006,6,"Ether / IP / TCP 116.132.235.228:http > 192.168.0.106:11006 A"
116.132.235.228,192.168.0.106,80,11006,6,"Ether / IP / TCP 116.132.235.228:http > 192.168.0.106:11006 PA / Raw"
116.132.235.228,192.168.0.106,80,11006,6,"Ether / IP / TCP 116.132.235.228:http > 192.168.0.106:11006 FA"
192.168.0.106,116.132.235.228,11006,80,6,"Ether / IP / TCP 192.168.0.106:11006 > 116.132.235.228:http A"
192.168.0.106,116.132.235.228,11006,80,6,"Ether / IP / TCP 192.168.0.106:11006 > 116.132.235.228:http FA"
192.168.0.106,59.38.123.207,10292,45902,6,"Ether / IP / TCP 192.168.0.106:10292 > 59.38.123.207:45902 PA / Raw"
192.168.0.106,59.38.123.207,10292,45902,6,"Ether / IP / TCP 192.168.0.106:10292 > 59.38.123.207:45902 PA / Raw"
116.132.235.228,192.168.0.106,80,11006,6,"Ether / IP / TCP 116.132.235.228:http > 192.168.0.106:11006 A"
59.38.123.207,192.168.0.106,45902,10292,6,"Ether / IP / TCP 59.38.123.207:45902 > 192.168.0.106:10292 A / Padding"
59.38.123.207,192.168.0.106,45902,10292,6,"Ether / IP / TCP 59.38.123.207:45902 > 192.168.0.106:10292 A / Padding"
59.38.123.207,192.168.0.106,45902,10292,6,"Ether / IP / TCP 59.38.123.207:45902 > 192.168.0.106:10292 PA / Raw"
59.38.123.207,192.168.0.106,45902,10292,6,"Ether / IP / TCP 59.38.123.207:45902 > 192.168.0.106:10292 PA / Raw"
192.168.0.106,59.38.123.207,10292,45902,6,"Ether / IP / TCP 192.168.0.106:10292 > 59.38.123.207:45902 A"
192.168.0.106,192.168.0.1,50998,53,17,"Ether / IP / UDP / DNS Qry ""b'static-pcs-sdk-server.alibaba.com.'"" "
192.168.0.1,192.168.0.106,53,50998,17,"Ether / IP / UDP / DNS Ans ""116.132.235.228"" "
192.168.0.106,116.132.235.228,11007,80,6,"Ether / IP / TCP 192.168.0.106:11007 > 116.132.235.228:http S"
192.168.0.106,116.132.235.228,11002,80,6,"Ether / IP / TCP 192.168.0.106:11002 > 116.132.235.228:http FA"
116.132.235.228,192.168.0.106,80,11007,6,"Ether / IP / TCP 116.132.235.228:http > 192.168.0.106:11007 SA"
192.168.0.106,116.132.235.228,11007,80,6,"Ether / IP / TCP 192.168.0.106:11007 > 116.132.235.228:http A"
192.168.0.106,116.132.235.228,11007,80,6,"Ether / IP / TCP 192.168.0.106:11007 > 116.132.235.228:http PA / Raw"
192.168.0.106,116.132.235.228,11007,80,6,"Ether / IP / TCP 192.168.0.106:11007 > 116.132.235.228:http A / Raw"
192.168.0.106,116.132.235.228,11007,80,6,"Ether / IP / TCP 192.168.0.106:11007 > 116.132.235.228:http A / Raw"
192.168.0.106,116.132.235.228,11007,80,6,"Ether / IP / TCP 192.168.0.106:11007 > 116.132.235.228:http PA / Raw"
116.132.235.228,192.168.0.106,80,11007,6,"Ether / IP / TCP 116.132.235.228:http > 192.168.0.106:11007 A"
116.132.235.228,192.168.0.106,80,11007,6,"Ether / IP / TCP 116.132.235.228:http > 192.168.0.106:11007 A"
116.132.235.228,192.168.0.106,80,11007,6,"Ether / IP / TCP 116.132.235.228:http > 192.168.0.106:11007 A"
116.132.235.228,192.168.0.106,80,11007,6,"Ether / IP / TCP 116.132.235.228:http > 192.168.0.106:11007 PA / Raw"
116.132.235.228,192.168.0.106,80,11007,6,"Ether / IP / TCP 116.132.235.228:http > 192.168.0.106:11007 FA"
192.168.0.106,116.132.235.228,11007,80,6,"Ether / IP / TCP 192.168.0.106:11007 > 116.132.235.228:http A"
192.168.0.106,116.132.235.228,11007,80,6,"Ether / IP / TCP 192.168.0.106:11007 > 116.132.235.228:http FA"
116.132.235.228,192.168.0.106,80,11007,6,"Ether / IP / TCP 116.132.235.228:http > 192.168.0.106:11007 A"
192.168.0.106,192.168.0.1,62543,53,17,"Ether / IP / UDP / DNS Qry ""b'static-pcs-sdk-server.alibaba.com.'"" "
192.168.0.1,192.168.0.106,53,62543,17,"Ether / IP / UDP / DNS Ans ""116.132.235.228"" "
192.168.0.106,116.132.235.228,11008,80,6,"Ether / IP / TCP 192.168.0.106:11008 > 116.132.235.228:http S"
116.132.235.228,192.168.0.106,80,11008,6,"Ether / IP / TCP 116.132.235.228:http > 192.168.0.106:11008 SA"
192.168.0.106,116.132.235.228,11008,80,6,"Ether / IP / TCP 192.168.0.106:11008 > 116.132.235.228:http A"
192.168.0.106,116.132.235.228,11008,80,6,"Ether / IP / TCP 192.168.0.106:11008 > 116.132.235.228:http PA / Raw"
192.168.0.106,116.132.235.228,11008,80,6,"Ether / IP / TCP 192.168.0.106:11008 > 116.132.235.228:http A / Raw"
192.168.0.106,116.132.235.228,11008,80,6,"Ether / IP / TCP 192.168.0.106:11008 > 116.132.235.228:http A / Raw"
192.168.0.106,116.132.235.228,11008,80,6,"Ether / IP / TCP 192.168.0.106:11008 > 116.132.235.228:http PA / Raw"
116.132.235.228,192.168.0.106,80,11008,6,"Ether / IP / TCP 116.132.235.228:http > 192.168.0.106:11008 A"
116.132.235.228,192.168.0.106,80,11008,6,"Ether / IP / TCP 116.132.235.228:http > 192.168.0.106:11008 A"
116.132.235.228,192.168.0.106,80,11008,6,"Ether / IP / TCP 116.132.235.228:http > 192.168.0.106:11008 A"
116.132.235.228,192.168.0.106,80,11008,6,"Ether / IP / TCP 116.132.235.228:http > 192.168.0.106:11008 PA / Raw"
116.132.235.228,192.168.0.106,80,11008,6,"Ether / IP / TCP 116.132.235.228:http > 192.168.0.106:11008 FA"
192.168.0.106,116.132.235.228,11008,80,6,"Ether / IP / TCP 192.168.0.106:11008 > 116.132.235.228:http A"
192.168.0.106,116.132.235.228,11008,80,6,"Ether / IP / TCP 192.168.0.106:11008 > 116.132.235.228:http FA"
116.132.235.228,192.168.0.106,80,11008,6,"Ether / IP / TCP 116.132.235.228:http > 192.168.0.106:11008 A"
192.168.0.106,192.168.0.1,56717,53,17,"Ether / IP / UDP / DNS Qry ""b'static-pcs-sdk-server.alibaba.com.'"" "
192.168.0.1,192.168.0.106,53,56717,17,"Ether / IP / UDP / DNS Ans ""b'static-pcs-sdk-server.alibaba.com.gds.alibabadns.com.'"" "
192.168.0.106,116.132.235.204,11009,80,6,"Ether / IP / TCP 192.168.0.106:11009 > 116.132.235.204:http S"
116.132.235.204,192.168.0.106,80,11009,6,"Ether / IP / TCP 116.132.235.204:http > 192.168.0.106:11009 SA"
192.168.0.106,116.132.235.204,11009,80,6,"Ether / IP / TCP 192.168.0.106:11009 > 116.132.235.204:http A"
192.168.0.106,116.132.235.204,11009,80,6,"Ether / IP / TCP 192.168.0.106:11009 > 116.132.235.204:http PA / Raw"
192.168.0.106,116.132.235.204,11009,80,6,"Ether / IP / TCP 192.168.0.106:11009 > 116.132.235.204:http A / Raw"
192.168.0.106,116.132.235.204,11009,80,6,"Ether / IP / TCP 192.168.0.106:11009 > 116.132.235.204:http A / Raw"
192.168.0.106,116.132.235.204,11009,80,6,"Ether / IP / TCP 192.168.0.106:11009 > 116.132.235.204:http PA / Raw"
116.132.235.204,192.168.0.106,80,11009,6,"Ether / IP / TCP 116.132.235.204:http > 192.168.0.106:11009 A"
116.132.235.204,192.168.0.106,80,11009,6,"Ether / IP / TCP 116.132.235.204:http > 192.168.0.106:11009 A"
116.132.235.204,192.168.0.106,80,11009,6,"Ether / IP / TCP 116.132.235.204:http > 192.168.0.106:11009 A"
116.132.235.204,192.168.0.106,80,11009,6,"Ether / IP / TCP 116.132.235.204:http > 192.168.0.106:11009 PA / Raw"
116.132.235.204,192.168.0.106,80,11009,6,"Ether / IP / TCP 116.132.235.204:http > 192.168.0.106:11009 FA"
192.168.0.106,116.132.235.204,11009,80,6,"Ether / IP / TCP 192.168.0.106:11009 > 116.132.235.204:http A"
192.168.0.106,116.132.235.204,11009,80,6,"Ether / IP / TCP 192.168.0.106:11009 > 116.132.235.204:http FA"
116.132.235.204,192.168.0.106,80,11009,6,"Ether / IP / TCP 116.132.235.204:http > 192.168.0.106:11009 A"
192.168.0.106,110.242.68.3,11010,80,6,"Ether / IP / TCP 192.168.0.106:11010 > 110.242.68.3:http S"
110.242.68.3,192.168.0.106,80,11010,6,"Ether / IP / TCP 110.242.68.3:http > 192.168.0.106:11010 SA"
192.168.0.106,110.242.68.3,11010,80,6,"Ether / IP / TCP 192.168.0.106:11010 > 110.242.68.3:http A"
192.168.0.106,110.242.68.3,11010,80,6,"Ether / IP / TCP 192.168.0.106:11010 > 110.242.68.3:http FA"
110.242.68.3,192.168.0.106,80,11010,6,"Ether / IP / TCP 110.242.68.3:http > 192.168.0.106:11010 A"
110.242.68.3,192.168.0.106,80,11010,6,"Ether / IP / TCP 110.242.68.3:http > 192.168.0.106:11010 FA"
192.168.0.106,110.242.68.3,11010,80,6,"Ether / IP / TCP 192.168.0.106:11010 > 110.242.68.3:http A"
192.168.0.106,116.132.235.204,11011,80,6,"Ether / IP / TCP 192.168.0.106:11011 > 116.132.235.204:http S"
116.132.235.204,192.168.0.106,80,11011,6,"Ether / IP / TCP 116.132.235.204:http > 192.168.0.106:11011 SA"
192.168.0.106,116.132.235.204,11011,80,6,"Ether / IP / TCP 192.168.0.106:11011 > 116.132.235.204:http A"
192.168.0.106,116.132.235.204,11011,80,6,"Ether / IP / TCP 192.168.0.106:11011 > 116.132.235.204:http PA / Raw"
192.168.0.106,116.132.235.204,11011,80,6,"Ether / IP / TCP 192.168.0.106:11011 > 116.132.235.204:http A / Raw"
192.168.0.106,116.132.235.204,11011,80,6,"Ether / IP / TCP 192.168.0.106:11011 > 116.132.235.204:http A / Raw"
192.168.0.106,116.132.235.204,11011,80,6,"Ether / IP / TCP 192.168.0.106:11011 > 116.132.235.204:http PA / Raw"
116.132.235.204,192.168.0.106,80,11011,6,"Ether / IP / TCP 116.132.235.204:http > 192.168.0.106:11011 A"
116.132.235.204,192.168.0.106,80,11011,6,"Ether / IP / TCP 116.132.235.204:http > 192.168.0.106:11011 A"
116.132.235.204,192.168.0.106,80,11011,6,"Ether / IP / TCP 116.132.235.204:http > 192.168.0.106:11011 A"
116.132.235.204,192.168.0.106,80,11011,6,"Ether / IP / TCP 116.132.235.204:http > 192.168.0.106:11011 PA / Raw"
116.132.235.204,192.168.0.106,80,11011,6,"Ether / IP / TCP 116.132.235.204:http > 192.168.0.106:11011 FA"
192.168.0.106,116.132.235.204,11011,80,6,"Ether / IP / TCP 192.168.0.106:11011 > 116.132.235.204:http A"
192.168.0.106,116.132.235.204,11011,80,6,"Ether / IP / TCP 192.168.0.106:11011 > 116.132.235.204:http FA"
116.132.235.204,192.168.0.106,80,11011,6,"Ether / IP / TCP 116.132.235.204:http > 192.168.0.106:11011 A"
192.168.0.106,116.132.235.204,11012,80,6,"Ether / IP / TCP 192.168.0.106:11012 > 116.132.235.204:http S"
116.132.235.204,192.168.0.106,80,11012,6,"Ether / IP / TCP 116.132.235.204:http > 192.168.0.106:11012 SA"
192.168.0.106,116.132.235.204,11012,80,6,"Ether / IP / TCP 192.168.0.106:11012 > 116.132.235.204:http A"
192.168.0.106,116.132.235.204,11012,80,6,"Ether / IP / TCP 192.168.0.106:11012 > 116.132.235.204:http PA / Raw"
192.168.0.106,116.132.235.204,11012,80,6,"Ether / IP / TCP 192.168.0.106:11012 > 116.132.235.204:http A / Raw"
192.168.0.106,116.132.235.204,11012,80,6,"Ether / IP / TCP 192.168.0.106:11012 > 116.132.235.204:http A / Raw"
192.168.0.106,116.132.235.204,11012,80,6,"Ether / IP / TCP 192.168.0.106:11012 > 116.132.235.204:http PA / Raw"
116.132.235.204,192.168.0.106,80,11012,6,"Ether / IP / TCP 116.132.235.204:http > 192.168.0.106:11012 A"
116.132.235.204,192.168.0.106,80,11012,6,"Ether / IP / TCP 116.132.235.204:http > 192.168.0.106:11012 A"
116.132.235.204,192.168.0.106,80,11012,6,"Ether / IP / TCP 116.132.235.204:http > 192.168.0.106:11012 A"
116.132.235.204,192.168.0.106,80,11012,6,"Ether / IP / TCP 116.132.235.204:http > 192.168.0.106:11012 PA / Raw"
116.132.235.204,192.168.0.106,80,11012,6,"Ether / IP / TCP 116.132.235.204:http > 192.168.0.106:11012 FA"
192.168.0.106,116.132.235.204,11012,80,6,"Ether / IP / TCP 192.168.0.106:11012 > 116.132.235.204:http A"
192.168.0.106,116.132.235.204,11012,80,6,"Ether / IP / TCP 192.168.0.106:11012 > 116.132.235.204:http FA"
116.132.235.204,192.168.0.106,80,11012,6,"Ether / IP / TCP 116.132.235.204:http > 192.168.0.106:11012 A"
192.168.0.106,116.132.235.204,11013,80,6,"Ether / IP / TCP 192.168.0.106:11013 > 116.132.235.204:http S"
116.132.235.204,192.168.0.106,80,11013,6,"Ether / IP / TCP 116.132.235.204:http > 192.168.0.106:11013 SA"
192.168.0.106,116.132.235.204,11013,80,6,"Ether / IP / TCP 192.168.0.106:11013 > 116.132.235.204:http A"
192.168.0.106,116.132.235.204,11013,80,6,"Ether / IP / TCP 192.168.0.106:11013 > 116.132.235.204:http PA / Raw"
192.168.0.106,116.132.235.204,11013,80,6,"Ether / IP / TCP 192.168.0.106:11013 > 116.132.235.204:http A / Raw"
192.168.0.106,116.132.235.204,11013,80,6,"Ether / IP / TCP 192.168.0.106:11013 > 116.132.235.204:http A / Raw"
192.168.0.106,116.132.235.204,11013,80,6,"Ether / IP / TCP 192.168.0.106:11013 > 116.132.235.204:http PA / Raw"
116.132.235.204,192.168.0.106,80,11013,6,"Ether / IP / TCP 116.132.235.204:http > 192.168.0.106:11013 A"
116.132.235.204,192.168.0.106,80,11013,6,"Ether / IP / TCP 116.132.235.204:http > 192.168.0.106:11013 A"
116.132.235.204,192.168.0.106,80,11013,6,"Ether / IP / TCP 116.132.235.204:http > 192.168.0.106:11013 A"
116.132.235.204,192.168.0.106,80,11013,6,"Ether / IP / TCP 116.132.235.204:http > 192.168.0.106:11013 PA / Raw"
116.132.235.204,192.168.0.106,80,11013,6,"Ether / IP / TCP 116.132.235.204:http > 192.168.0.106:11013 FA"
192.168.0.106,116.132.235.204,11013,80,6,"Ether / IP / TCP 192.168.0.106:11013 > 116.132.235.204:http A"
192.168.0.106,116.132.235.204,11013,80,6,"Ether / IP / TCP 192.168.0.106:11013 > 116.132.235.204:http FA"
116.132.235.204,192.168.0.106,80,11013,6,"Ether / IP / TCP 116.132.235.204:http > 192.168.0.106:11013 A"
192.168.0.106,116.132.235.204,11014,80,6,"Ether / IP / TCP 192.168.0.106:11014 > 116.132.235.204:http S"
116.132.235.204,192.168.0.106,80,11014,6,"Ether / IP / TCP 116.132.235.204:http > 192.168.0.106:11014 SA"
192.168.0.106,116.132.235.204,11014,80,6,"Ether / IP / TCP 192.168.0.106:11014 > 116.132.235.204:http A"
192.168.0.106,116.132.235.204,11014,80,6,"Ether / IP / TCP 192.168.0.106:11014 > 116.132.235.204:http PA / Raw"
192.168.0.106,116.132.235.204,11014,80,6,"Ether / IP / TCP 192.168.0.106:11014 > 116.132.235.204:http A / Raw"
192.168.0.106,116.132.235.204,11014,80,6,"Ether / IP / TCP 192.168.0.106:11014 > 116.132.235.204:http A / Raw"
192.168.0.106,116.132.235.204,11014,80,6,"Ether / IP / TCP 192.168.0.106:11014 > 116.132.235.204:http PA / Raw"
116.132.235.204,192.168.0.106,80,11014,6,"Ether / IP / TCP 116.132.235.204:http > 192.168.0.106:11014 A"
116.132.235.204,192.168.0.106,80,11014,6,"Ether / IP / TCP 116.132.235.204:http > 192.168.0.106:11014 A"
116.132.235.204,192.168.0.106,80,11014,6,"Ether / IP / TCP 116.132.235.204:http > 192.168.0.106:11014 A"
116.132.235.204,192.168.0.106,80,11014,6,"Ether / IP / TCP 116.132.235.204:http > 192.168.0.106:11014 PA / Raw"
116.132.235.204,192.168.0.106,80,11014,6,"Ether / IP / TCP 116.132.235.204:http > 192.168.0.106:11014 FA"
192.168.0.106,116.132.235.204,11014,80,6,"Ether / IP / TCP 192.168.0.106:11014 > 116.132.235.204:http A"
192.168.0.106,116.132.235.204,11014,80,6,"Ether / IP / TCP 192.168.0.106:11014 > 116.132.235.204:http FA"
116.132.235.204,192.168.0.106,80,11014,6,"Ether / IP / TCP 116.132.235.204:http > 192.168.0.106:11014 A"
192.168.0.106,116.132.235.228,11002,80,6,"Ether / IP / TCP 192.168.0.106:11002 > 116.132.235.228:http FA"
192.168.0.106,59.38.123.207,9954,45902,6,"Ether / IP / TCP 192.168.0.106:9954 > 59.38.123.207:45902 A / Raw"
59.38.123.207,192.168.0.106,45902,9954,6,"Ether / IP / TCP 59.38.123.207:45902 > 192.168.0.106:9954 A"
192.168.0.106,59.38.123.207,10746,45902,6,"Ether / IP / TCP 192.168.0.106:10746 > 59.38.123.207:45902 A / Raw"
59.38.123.207,192.168.0.106,45902,10746,6,"Ether / IP / TCP 59.38.123.207:45902 > 192.168.0.106:10746 A"
192.168.0.106,157.255.209.167,11230,80,6,"Ether / IP / TCP 192.168.0.106:11230 > 157.255.209.167:http PA / Raw"
157.255.209.167,192.168.0.106,80,11230,6,"Ether / IP / TCP 157.255.209.167:http > 192.168.0.106:11230 PA / Raw"
192.168.0.106,157.255.209.167,11230,80,6,"Ether / IP / TCP 192.168.0.106:11230 > 157.255.209.167:http A"
192.168.0.106,192.168.0.1,57657,53,17,"Ether / IP / UDP / DNS Qry ""b'szminorshort.weixin.qq.com.'"" "
192.168.0.1,192.168.0.106,53,57657,17,"Ether / IP / UDP / DNS Ans ""157.148.48.247"" "
192.168.0.106,157.148.57.58,11015,80,6,"Ether / IP / TCP 192.168.0.106:11015 > 157.148.57.58:http S"
157.148.57.58,192.168.0.106,80,11015,6,"Ether / IP / TCP 157.148.57.58:http > 192.168.0.106:11015 SA"
192.168.0.106,157.148.57.58,11015,80,6,"Ether / IP / TCP 192.168.0.106:11015 > 157.148.57.58:http A"
192.168.0.106,157.148.57.58,11015,80,6,"Ether / IP / TCP 192.168.0.106:11015 > 157.148.57.58:http PA / Raw"
157.148.57.58,192.168.0.106,80,11015,6,"Ether / IP / TCP 157.148.57.58:http > 192.168.0.106:11015 A"
157.148.57.58,192.168.0.106,80,11015,6,"Ether / IP / TCP 157.148.57.58:http > 192.168.0.106:11015 PA / Raw"
157.148.57.58,192.168.0.106,80,11015,6,"Ether / IP / TCP 157.148.57.58:http > 192.168.0.106:11015 FA"
192.168.0.106,157.148.57.58,11015,80,6,"Ether / IP / TCP 192.168.0.106:11015 > 157.148.57.58:http A"
192.168.0.106,157.148.57.58,11015,80,6,"Ether / IP / TCP 192.168.0.106:11015 > 157.148.57.58:http FA"
157.148.57.58,192.168.0.106,80,11015,6,"Ether / IP / TCP 157.148.57.58:http > 192.168.0.106:11015 A"
192.168.0.106,110.242.68.3,11016,80,6,"Ether / IP / TCP 192.168.0.106:11016 > 110.242.68.3:http S"
110.242.68.3,192.168.0.106,80,11016,6,"Ether / IP / TCP 110.242.68.3:http > 192.168.0.106:11016 SA"
192.168.0.106,110.242.68.3,11016,80,6,"Ether / IP / TCP 192.168.0.106:11016 > 110.242.68.3:http A"
192.168.0.106,110.242.68.3,11016,80,6,"Ether / IP / TCP 192.168.0.106:11016 > 110.242.68.3:http FA"
110.242.68.3,192.168.0.106,80,11016,6,"Ether / IP / TCP 110.242.68.3:http > 192.168.0.106:11016 A"
110.242.68.3,192.168.0.106,80,11016,6,"Ether / IP / TCP 110.242.68.3:http > 192.168.0.106:11016 FA"
192.168.0.106,110.242.68.3,11016,80,6,"Ether / IP / TCP 192.168.0.106:11016 > 110.242.68.3:http A"
192.168.0.106,192.168.0.1,63275,53,17,"Ether / IP / UDP / DNS Qry ""b'zyx.qq.com.'"" "
192.168.0.1,192.168.0.106,53,63275,17,"Ether / IP / UDP / DNS Ans ""157.255.13.233"" "
192.168.0.106,157.255.13.233,62655,8000,17,"Ether / IP / UDP 192.168.0.106:62655 > 157.255.13.233:8000 / Raw"
192.168.0.106,157.255.13.233,62656,8000,17,"Ether / IP / UDP 192.168.0.106:62656 > 157.255.13.233:8000 / Raw"
157.255.13.233,192.168.0.106,8000,62656,17,"Ether / IP / UDP 157.255.13.233:8000 > 192.168.0.106:62656 / Raw"
192.168.0.106,157.255.13.233,62656,8000,17,"Ether / IP / UDP 192.168.0.106:62656 > 157.255.13.233:8000 / Raw"
157.255.13.233,192.168.0.106,8000,62656,17,"Ether / IP / UDP 157.255.13.233:8000 > 192.168.0.106:62656 / Raw"
192.168.0.106,157.255.13.233,62656,8000,17,"Ether / IP / UDP 192.168.0.106:62656 > 157.255.13.233:8000 / Raw"
192.168.0.106,157.255.13.233,62656,8000,17,"Ether / IP / UDP 192.168.0.106:62656 > 157.255.13.233:8000 / Raw"
157.255.13.233,192.168.0.106,8000,62656,17,"Ether / IP / UDP 157.255.13.233:8000 > 192.168.0.106:62656 / Raw"
192.168.0.106,157.255.13.233,62656,8000,17,"Ether / IP / UDP 192.168.0.106:62656 > 157.255.13.233:8000 / Raw"
157.255.13.233,192.168.0.106,8000,62656,17,"Ether / IP / UDP 157.255.13.233:8000 > 192.168.0.106:62656 / Raw"
192.168.0.106,157.255.13.233,62656,8000,17,"Ether / IP / UDP 192.168.0.106:62656 > 157.255.13.233:8000 / Raw"
192.168.0.106,157.255.13.233,62656,8000,17,"Ether / IP / UDP 192.168.0.106:62656 > 157.255.13.233:8000 / Raw"
192.168.0.106,157.255.13.233,62656,8000,17,"Ether / IP / UDP 192.168.0.106:62656 > 157.255.13.233:8000 / Raw"
157.255.13.233,192.168.0.106,8000,62656,17,"Ether / IP / UDP 157.255.13.233:8000 > 192.168.0.106:62656 / Raw"
157.255.13.233,192.168.0.106,8000,62656,17,"Ether / IP / UDP 157.255.13.233:8000 > 192.168.0.106:62656 / Raw"
157.255.13.233,192.168.0.106,8000,62656,17,"Ether / IP / UDP 157.255.13.233:8000 > 192.168.0.106:62656 / Raw"
192.168.0.106,220.194.116.51,10649,443,6,"Ether / IP / TCP 192.168.0.106:10649 > 220.194.116.51:https FA"
192.168.0.106,220.194.116.51,10648,443,6,"Ether / IP / TCP 192.168.0.106:10648 > 220.194.116.51:https FA"
192.168.0.106,119.167.131.37,10742,80,6,"Ether / IP / TCP 192.168.0.106:10742 > 119.167.131.37:http FA"
192.168.0.106,192.168.0.1,59496,53,17,"Ether / IP / UDP / DNS Qry ""b'h5.qzone.qq.com.'"" "
192.168.0.1,192.168.0.106,53,59496,17,"Ether / IP / UDP / DNS Ans ""220.194.116.51"" "
192.168.0.106,220.194.116.51,11017,443,6,"Ether / IP / TCP 192.168.0.106:11017 > 220.194.116.51:https S"
192.168.0.106,220.194.116.51,11018,443,6,"Ether / IP / TCP 192.168.0.106:11018 > 220.194.116.51:https S"
220.194.116.51,192.168.0.106,443,10649,6,"Ether / IP / TCP 220.194.116.51:https > 192.168.0.106:10649 R"
119.167.131.37,192.168.0.106,80,10742,6,"Ether / IP / TCP 119.167.131.37:http > 192.168.0.106:10742 R"
220.194.116.51,192.168.0.106,443,10648,6,"Ether / IP / TCP 220.194.116.51:https > 192.168.0.106:10648 R"
220.194.116.51,192.168.0.106,443,11017,6,"Ether / IP / TCP 220.194.116.51:https > 192.168.0.106:11017 SA"
220.194.116.51,192.168.0.106,443,11018,6,"Ether / IP / TCP 220.194.116.51:https > 192.168.0.106:11018 SA"
192.168.0.106,220.194.116.51,11017,443,6,"Ether / IP / TCP 192.168.0.106:11017 > 220.194.116.51:https A"
192.168.0.106,220.194.116.51,11018,443,6,"Ether / IP / TCP 192.168.0.106:11018 > 220.194.116.51:https A"
192.168.0.106,220.194.116.51,11017,443,6,"Ether / IP / TCP 192.168.0.106:11017 > 220.194.116.51:https PA / Raw"
192.168.0.106,220.194.116.51,11018,443,6,"Ether / IP / TCP 192.168.0.106:11018 > 220.194.116.51:https PA / Raw"
220.194.116.51,192.168.0.106,443,11017,6,"Ether / IP / TCP 220.194.116.51:https > 192.168.0.106:11017 A"
220.194.116.51,192.168.0.106,443,11018,6,"Ether / IP / TCP 220.194.116.51:https > 192.168.0.106:11018 A"
220.194.116.51,192.168.0.106,443,11017,6,"Ether / IP / TCP 220.194.116.51:https > 192.168.0.106:11017 A / Raw"
220.194.116.51,192.168.0.106,443,11017,6,"Ether / IP / TCP 220.194.116.51:https > 192.168.0.106:11017 PA / Raw"
220.194.116.51,192.168.0.106,443,11017,6,"Ether / IP / TCP 220.194.116.51:https > 192.168.0.106:11017 PA / Raw"
220.194.116.51,192.168.0.106,443,11018,6,"Ether / IP / TCP 220.194.116.51:https > 192.168.0.106:11018 A / Raw"
192.168.0.106,220.194.116.51,11017,443,6,"Ether / IP / TCP 192.168.0.106:11017 > 220.194.116.51:https A"
220.194.116.51,192.168.0.106,443,11018,6,"Ether / IP / TCP 220.194.116.51:https > 192.168.0.106:11018 PA / Raw"
220.194.116.51,192.168.0.106,443,11018,6,"Ether / IP / TCP 220.194.116.51:https > 192.168.0.106:11018 PA / Raw"
192.168.0.106,220.194.116.51,11018,443,6,"Ether / IP / TCP 192.168.0.106:11018 > 220.194.116.51:https A"
192.168.0.106,220.194.116.51,11017,443,6,"Ether / IP / TCP 192.168.0.106:11017 > 220.194.116.51:https PA / Raw"
192.168.0.106,220.194.116.51,11018,443,6,"Ether / IP / TCP 192.168.0.106:11018 > 220.194.116.51:https PA / Raw"
220.194.116.51,192.168.0.106,443,11017,6,"Ether / IP / TCP 220.194.116.51:https > 192.168.0.106:11017 A"
220.194.116.51,192.168.0.106,443,11018,6,"Ether / IP / TCP 220.194.116.51:https > 192.168.0.106:11018 A"
220.194.116.51,192.168.0.106,443,11017,6,"Ether / IP / TCP 220.194.116.51:https > 192.168.0.106:11017 PA / Raw"
220.194.116.51,192.168.0.106,443,11018,6,"Ether / IP / TCP 220.194.116.51:https > 192.168.0.106:11018 PA / Raw"
192.168.0.106,220.194.116.51,11017,443,6,"Ether / IP / TCP 192.168.0.106:11017 > 220.194.116.51:https PA / Raw"
192.168.0.106,220.194.116.51,11018,443,6,"Ether / IP / TCP 192.168.0.106:11018 > 220.194.116.51:https PA / Raw"
220.194.116.51,192.168.0.106,443,11017,6,"Ether / IP / TCP 220.194.116.51:https > 192.168.0.106:11017 A"
220.194.116.51,192.168.0.106,443,11018,6,"Ether / IP / TCP 220.194.116.51:https > 192.168.0.106:11018 A"
192.168.0.106,220.194.116.51,11017,443,6,"Ether / IP / TCP 192.168.0.106:11017 > 220.194.116.51:https PA / Raw"
