data,flowmember,label,classes
b'her / IP / TCP 192.168.180.164:14032 > 210.22.155.34:8080 F',1,,
b'her / IP / TCP 192.168.180.164:14032 > 210.22.155.34:8080 F',1,,
b'her / IP / TCP 192.168.180.164:14032 > 210.22.155.34:8080 F',1,,
b'her / IP / TCP 192.168.180.164:14032 > 210.22.155.34:8080 R',1,,
b'her / IP / TCP 210.22.155.34:8080 > 192.168.180.164:14044 ',2,,
b'her / IP / TCP 210.22.155.34:8080 > 192.168.180.164:14044 PA / Ra',2,,
b'her / IP / TCP 210.22.155.34:8080 > 192.168.180.164:14044 F',2,,
b'her / IP / TCP 192.168.180.164:14044 > 210.22.155.34:8080 R',3,,
b'her / IP / TCP 210.22.155.34:8080 > 192.168.180.164:14042 ',4,,
b'her / IP / TCP 210.22.155.34:8080 > 192.168.180.164:14042 ',4,,
b'her / IP / TCP 210.22.155.34:8080 > 192.168.180.164:14042 PA / Ra',4,,
b'her / IP / TCP 210.22.155.34:8080 > 192.168.180.164:14042 F',4,,
b'her / IP / TCP 192.168.180.164:14042 > 210.22.155.34:8080 R',5,,
"b'her / IP / UDP / DNS Qry ""b\'static-pcs-sdk-server.alibaba.com.\'""'",6,,
"b'her / IP / UDP / DNS Qry ""b\'api1.origin.com.\'""'",6,,
"b'her / IP / UDP / DNS Qry ""b\'www.msftconnecttest.com.\'""'",6,,
"b'her / IP / UDP / DNS Qry ""b\'catalog.gamepass.com.\'""'",6,,
"b'her / IP / UDP / DNS Ans ""b\'static-pcs-sdk-server.alibaba.com.gds.alibabadns.com.\'""'",7,,
"b'her / IP / UDP / DNS Ans ""b\'cname.api.origin.com.\'""'",7,,
"b'her / IP / UDP / DNS Ans ""b\'ncsi-geo.trafficmanager.net.\'""'",7,,
"b'her / IP / UDP / DNS Ans ""b\'catalog.gamepass.com.edgesuite.net.\'""'",7,,
b'her / IP / TCP 192.168.180.164:14050 > 203.119.169.168:http ',8,,
b'her / IP / TCP 192.168.180.164:14050 > 203.119.169.168:http ',8,,
b'her / IP / TCP 192.168.180.164:14050 > 203.119.169.168:http PA / Ra',8,,
b'her / IP / TCP 192.168.180.164:14050 > 203.119.169.168:http A / Ra',8,,
b'her / IP / TCP 192.168.180.164:14050 > 203.119.169.168:http A / Ra',8,,
b'her / IP / TCP 192.168.180.164:14050 > 203.119.169.168:http PA / Ra',8,,
b'her / IP / TCP 192.168.180.164:14050 > 203.119.169.168:http ',9,,
b'her / IP / TCP 192.168.180.164:14050 > 203.119.169.168:http PA / Ra',9,,
b'her / IP / TCP 192.168.180.164:14050 > 203.119.169.168:http A / Ra',9,,
b'her / IP / TCP 192.168.180.164:14050 > 203.119.169.168:http A / Ra',9,,
b'her / IP / TCP 192.168.180.164:14050 > 203.119.169.168:http PA / Ra',9,,
b'her / IP / TCP 192.168.180.164:14050 > 203.119.169.168:http ',9,,
b'her / IP / TCP 192.168.180.164:14050 > 203.119.169.168:http PA / Ra',9,,
b'her / IP / TCP 192.168.180.164:14050 > 203.119.169.168:http A / Ra',10,,
b'her / IP / TCP 192.168.180.164:14050 > 203.119.169.168:http A / Ra',10,,
b'her / IP / TCP 192.168.180.164:14050 > 203.119.169.168:http PA / Ra',10,,
b'her / IP / TCP 192.168.180.164:14050 > 203.119.169.168:http ',10,,
b'her / IP / TCP 192.168.180.164:14050 > 203.119.169.168:http PA / Ra',10,,
b'her / IP / TCP 192.168.180.164:14050 > 203.119.169.168:http A / Ra',10,,
b'her / IP / TCP 192.168.180.164:14050 > 203.119.169.168:http A / Ra',10,,
b'her / IP / TCP 192.168.180.164:14050 > 203.119.169.168:http PA / Ra',11,,
b'her / IP / TCP 192.168.180.164:14050 > 203.119.169.168:http ',11,,
b'her / IP / TCP 192.168.180.164:14050 > 203.119.169.168:http PA / Ra',11,,
b'her / IP / TCP 192.168.180.164:14050 > 203.119.169.168:http A / Ra',11,,
b'her / IP / TCP 192.168.180.164:14050 > 203.119.169.168:http A / Ra',11,,
b'her / IP / TCP 192.168.180.164:14050 > 203.119.169.168:http PA / Ra',11,,
b'her / IP / TCP 192.168.180.164:14050 > 203.119.169.168:http ',11,,
b'her / IP / TCP 192.168.180.164:14050 > 203.119.169.168:http PA / Ra',12,,
b'her / IP / TCP 192.168.180.164:14050 > 203.119.169.168:http A / Ra',12,,
b'her / IP / TCP 192.168.180.164:14050 > 203.119.169.168:http A / Ra',12,,
b'her / IP / TCP 192.168.180.164:14050 > 203.119.169.168:http PA / Ra',12,,
b'her / IP / TCP 192.168.180.164:14050 > 203.119.169.168:http ',12,,
b'her / IP / TCP 192.168.180.164:14050 > 203.119.169.168:http PA / Ra',12,,
b'her / IP / TCP 192.168.180.164:14050 > 203.119.169.168:http A / Ra',12,,
b'her / IP / TCP 192.168.180.164:14050 > 203.119.169.168:http A / Ra',13,,
b'her / IP / TCP 192.168.180.164:14050 > 203.119.169.168:http PA / Ra',13,,
b'her / IP / TCP 192.168.180.164:14050 > 203.119.169.168:http ',13,,
b'her / IP / TCP 192.168.180.164:14050 > 203.119.169.168:http PA / Ra',13,,
b'her / IP / TCP 192.168.180.164:14050 > 203.119.169.168:http A / Ra',13,,
b'her / IP / TCP 192.168.180.164:14050 > 203.119.169.168:http A / Ra',13,,
b'her / IP / TCP 192.168.180.164:14050 > 203.119.169.168:http PA / Ra',13,,
b'her / IP / TCP 192.168.180.164:14050 > 203.119.169.168:http ',14,,
b'her / IP / TCP 192.168.180.164:14050 > 203.119.169.168:http PA / Ra',14,,
b'her / IP / TCP 192.168.180.164:14050 > 203.119.169.168:http A / Ra',14,,
b'her / IP / TCP 192.168.180.164:14050 > 203.119.169.168:http A / Ra',14,,
b'her / IP / TCP 192.168.180.164:14050 > 203.119.169.168:http PA / Ra',14,,
b'her / IP / TCP 192.168.180.164:14050 > 203.119.169.168:http ',14,,
b'her / IP / TCP 192.168.180.164:14050 > 203.119.169.168:http PA / Ra',14,,
b'her / IP / TCP 192.168.180.164:14050 > 203.119.169.168:http A / Ra',15,,
b'her / IP / TCP 192.168.180.164:14050 > 203.119.169.168:http A / Ra',15,,
b'her / IP / TCP 192.168.180.164:14050 > 203.119.169.168:http PA / Ra',15,,
b'her / IP / TCP 192.168.180.164:14050 > 203.119.169.168:http ',15,,
b'her / IP / TCP 192.168.180.164:14050 > 203.119.169.168:http PA / Ra',15,,
b'her / IP / TCP 192.168.180.164:14050 > 203.119.169.168:http A / Ra',15,,
b'her / IP / TCP 192.168.180.164:14050 > 203.119.169.168:http A / Ra',15,,
b'her / IP / TCP 192.168.180.164:14050 > 203.119.169.168:http PA / Ra',16,,
b'her / IP / TCP 192.168.180.164:14050 > 203.119.169.168:http ',16,,
b'her / IP / TCP 192.168.180.164:14050 > 203.119.169.168:http PA / Ra',16,,
b'her / IP / TCP 192.168.180.164:14050 > 203.119.169.168:http A / Ra',16,,
b'her / IP / TCP 192.168.180.164:14050 > 203.119.169.168:http A / Ra',16,,
b'her / IP / TCP 192.168.180.164:14050 > 203.119.169.168:http PA / Ra',16,,
b'her / IP / TCP 192.168.180.164:14050 > 203.119.169.168:http ',16,,
b'her / IP / TCP 192.168.180.164:14050 > 203.119.169.168:http PA / Ra',17,,
b'her / IP / TCP 192.168.180.164:14050 > 203.119.169.168:http A / Ra',17,,
b'her / IP / TCP 192.168.180.164:14050 > 203.119.169.168:http A / Ra',17,,
b'her / IP / TCP 192.168.180.164:14050 > 203.119.169.168:http PA / Ra',17,,
b'her / IP / TCP 192.168.180.164:14050 > 203.119.169.168:http ',17,,
b'her / IP / TCP 192.168.180.164:14050 > 203.119.169.168:http PA / Ra',17,,
b'her / IP / TCP 192.168.180.164:14050 > 203.119.169.168:http A / Ra',17,,
b'her / IP / TCP 192.168.180.164:14050 > 203.119.169.168:http A / Ra',18,,
b'her / IP / TCP 192.168.180.164:14050 > 203.119.169.168:http PA / Ra',18,,
b'her / IP / TCP 192.168.180.164:14050 > 203.119.169.168:http ',18,,
b'her / IP / TCP 192.168.180.164:14050 > 203.119.169.168:http PA / Ra',18,,
b'her / IP / TCP 192.168.180.164:14050 > 203.119.169.168:http A / Ra',18,,
b'her / IP / TCP 192.168.180.164:14050 > 203.119.169.168:http A / Ra',18,,
b'her / IP / TCP 192.168.180.164:14050 > 203.119.169.168:http PA / Ra',18,,
b'her / IP / TCP 192.168.180.164:14050 > 203.119.169.168:http ',19,,
b'her / IP / TCP 192.168.180.164:14050 > 203.119.169.168:http PA / Ra',19,,
b'her / IP / TCP 192.168.180.164:14050 > 203.119.169.168:http A / Ra',19,,
b'her / IP / TCP 192.168.180.164:14050 > 203.119.169.168:http A / Ra',19,,
b'her / IP / TCP 192.168.180.164:14050 > 203.119.169.168:http PA / Ra',19,,
b'her / IP / TCP 192.168.180.164:14050 > 203.119.169.168:http ',19,,
b'her / IP / TCP 192.168.180.164:14050 > 203.119.169.168:http PA / Ra',19,,
b'her / IP / TCP 192.168.180.164:14050 > 203.119.169.168:http A / Ra',20,,
b'her / IP / TCP 192.168.180.164:14050 > 203.119.169.168:http PA / Ra',20,,
b'her / IP / TCP 192.168.180.164:14050 > 203.119.169.168:http ',20,,
b'her / IP / TCP 192.168.180.164:14050 > 203.119.169.168:http PA / Ra',20,,
b'her / IP / TCP 192.168.180.164:14050 > 203.119.169.168:http A / Ra',20,,
b'her / IP / TCP 192.168.180.164:14050 > 203.119.169.168:http PA / Ra',20,,
b'her / IP / TCP 192.168.180.164:14050 > 203.119.169.168:http ',20,,
b'her / IP / TCP 192.168.180.164:14050 > 203.119.169.168:http PA / Ra',21,,
b'her / IP / TCP 192.168.180.164:14050 > 203.119.169.168:http A / Ra',21,,
b'her / IP / TCP 192.168.180.164:14050 > 203.119.169.168:http PA / Ra',21,,
b'her / IP / TCP 192.168.180.164:14050 > 203.119.169.168:http ',21,,
b'her / IP / TCP 203.119.169.168:http > 192.168.180.164:14050 S',22,,
b'her / IP / TCP 203.119.169.168:http > 192.168.180.164:14050 ',22,,
b'her / IP / TCP 203.119.169.168:http > 192.168.180.164:14050 ',22,,
b'her / IP / TCP 203.119.169.168:http > 192.168.180.164:14050 ',22,,
b'her / IP / TCP 203.119.169.168:http > 192.168.180.164:14050 PA / Ra',22,,
b'her / IP / TCP 203.119.169.168:http > 192.168.180.164:14050 PA / Ra',22,,
b'her / IP / TCP 203.119.169.168:http > 192.168.180.164:14050 ',23,,
b'her / IP / TCP 203.119.169.168:http > 192.168.180.164:14050 PA / Ra',23,,
b'her / IP / TCP 203.119.169.168:http > 192.168.180.164:14050 PA / Ra',23,,
b'her / IP / TCP 203.119.169.168:http > 192.168.180.164:14050 ',23,,
b'her / IP / TCP 203.119.169.168:http > 192.168.180.164:14050 PA / Ra',23,,
b'her / IP / TCP 203.119.169.168:http > 192.168.180.164:14050 PA / Ra',23,,
b'her / IP / TCP 203.119.169.168:http > 192.168.180.164:14050 ',23,,
b'her / IP / TCP 203.119.169.168:http > 192.168.180.164:14050 PA / Ra',24,,
b'her / IP / TCP 203.119.169.168:http > 192.168.180.164:14050 PA / Ra',24,,
b'her / IP / TCP 203.119.169.168:http > 192.168.180.164:14050 ',24,,
b'her / IP / TCP 203.119.169.168:http > 192.168.180.164:14050 PA / Ra',24,,
b'her / IP / TCP 203.119.169.168:http > 192.168.180.164:14050 PA / Ra',24,,
b'her / IP / TCP 203.119.169.168:http > 192.168.180.164:14050 ',24,,
b'her / IP / TCP 203.119.169.168:http > 192.168.180.164:14050 PA / Ra',24,,
b'her / IP / TCP 203.119.169.168:http > 192.168.180.164:14050 PA / Ra',25,,
b'her / IP / TCP 203.119.169.168:http > 192.168.180.164:14050 ',25,,
b'her / IP / TCP 203.119.169.168:http > 192.168.180.164:14050 PA / Ra',25,,
b'her / IP / TCP 203.119.169.168:http > 192.168.180.164:14050 PA / Ra',25,,
b'her / IP / TCP 203.119.169.168:http > 192.168.180.164:14050 ',25,,
b'her / IP / TCP 203.119.169.168:http > 192.168.180.164:14050 ',25,,
b'her / IP / TCP 203.119.169.168:http > 192.168.180.164:14050 PA / Ra',25,,
b'her / IP / TCP 203.119.169.168:http > 192.168.180.164:14050 PA / Ra',26,,
b'her / IP / TCP 203.119.169.168:http > 192.168.180.164:14050 ',26,,
b'her / IP / TCP 203.119.169.168:http > 192.168.180.164:14050 PA / Ra',26,,
b'her / IP / TCP 203.119.169.168:http > 192.168.180.164:14050 PA / Ra',26,,
b'her / IP / TCP 203.119.169.168:http > 192.168.180.164:14050 ',26,,
b'her / IP / TCP 203.119.169.168:http > 192.168.180.164:14050 PA / Ra',26,,
b'her / IP / TCP 203.119.169.168:http > 192.168.180.164:14050 PA / Ra',26,,
b'her / IP / TCP 203.119.169.168:http > 192.168.180.164:14050 ',27,,
b'her / IP / TCP 203.119.169.168:http > 192.168.180.164:14050 PA / Ra',27,,
b'her / IP / TCP 203.119.169.168:http > 192.168.180.164:14050 PA / Ra',27,,
b'her / IP / TCP 203.119.169.168:http > 192.168.180.164:14050 ',27,,
b'her / IP / TCP 203.119.169.168:http > 192.168.180.164:14050 ',27,,
b'her / IP / TCP 203.119.169.168:http > 192.168.180.164:14050 PA / Ra',27,,
b'her / IP / TCP 203.119.169.168:http > 192.168.180.164:14050 PA / Ra',27,,
b'her / IP / TCP 203.119.169.168:http > 192.168.180.164:14050 ',28,,
b'her / IP / TCP 203.119.169.168:http > 192.168.180.164:14050 PA / Ra',28,,
b'her / IP / TCP 203.119.169.168:http > 192.168.180.164:14050 PA / Ra',28,,
b'her / IP / TCP 203.119.169.168:http > 192.168.180.164:14050 ',28,,
b'her / IP / TCP 203.119.169.168:http > 192.168.180.164:14050 PA / Ra',28,,
b'her / IP / TCP 203.119.169.168:http > 192.168.180.164:14050 PA / Ra',28,,
b'her / IP / TCP 203.119.169.168:http > 192.168.180.164:14050 ',28,,
b'her / IP / TCP 203.119.169.168:http > 192.168.180.164:14050 ',29,,
b'her / IP / TCP 203.119.169.168:http > 192.168.180.164:14050 PA / Ra',29,,
b'her / IP / TCP 203.119.169.168:http > 192.168.180.164:14050 PA / Ra',29,,
b'her / IP / TCP 203.119.169.168:http > 192.168.180.164:14050 ',29,,
b'her / IP / TCP 203.119.169.168:http > 192.168.180.164:14050 PA / Ra',29,,
b'her / IP / TCP 203.119.169.168:http > 192.168.180.164:14050 PA / Ra',29,,
b'her / IP / TCP 203.119.169.168:http > 192.168.180.164:14050 ',29,,
b'her / IP / TCP 203.119.169.168:http > 192.168.180.164:14050 PA / Ra',30,,
b'her / IP / TCP 203.119.169.168:http > 192.168.180.164:14050 PA / Ra',30,,
b'her / IP / TCP 203.119.169.168:http > 192.168.180.164:14050 ',30,,
b'her / IP / TCP 203.119.169.168:http > 192.168.180.164:14050 PA / Ra',30,,
b'her / IP / TCP 203.119.169.168:http > 192.168.180.164:14050 PA / Ra',30,,
b'her / IP / TCP 203.119.169.168:http > 192.168.180.164:14050 ',30,,
b'her / IP / TCP 203.119.169.168:http > 192.168.180.164:14050 PA / Ra',30,,
b'her / IP / TCP 203.119.169.168:http > 192.168.180.164:14050 PA / Ra',31,,
b'her / IP / TCP 192.168.180.164:14051 > 104.65.228.154:https ',31,,
b'her / IP / TCP 192.168.180.164:14051 > 104.65.228.154:https ',31,,
b'her / IP / TCP 192.168.180.164:14051 > 104.65.228.154:https ',31,,
b'her / IP / TCP 192.168.180.164:14051 > 104.65.228.154:https ',31,,
b'her / IP / TCP 192.168.180.164:14051 > 104.65.228.154:https ',31,,
b'her / IP / TCP 192.168.180.164:14051 > 104.65.228.154:https PA / Ra',31,,
b'her / IP / TCP 192.168.180.164:14051 > 104.65.228.154:https ',32,,
b'her / IP / TCP 192.168.180.164:14051 > 104.65.228.154:https ',32,,
b'her / IP / TCP 192.168.180.164:14051 > 104.65.228.154:https PA / Ra',32,,
b'her / IP / TCP 192.168.180.164:14051 > 104.65.228.154:https PA / Ra',32,,
b'her / IP / TCP 192.168.180.164:14051 > 104.65.228.154:https ',32,,
b'her / IP / TCP 192.168.180.164:14051 > 104.65.228.154:https PA / Ra',32,,
b'her / IP / TCP 192.168.180.164:14051 > 104.65.228.154:https ',32,,
b'her / IP / TCP 192.168.180.164:14051 > 104.65.228.154:https ',33,,
b'her / IP / TCP 192.168.180.164:14051 > 104.65.228.154:https ',33,,
b'her / IP / TCP 192.168.180.164:14051 > 104.65.228.154:https ',33,,
b'her / IP / UDP 192.168.180.164:65222 > 239.255.255.250:ssdp / Ra',34,,
b'her / IP / UDP 192.168.180.164:65222 > 239.255.255.250:ssdp / Ra',34,,
b'her / IP / UDP 192.168.180.164:65222 > 239.255.255.250:ssdp / Ra',34,,
b'her / IP / UDP 192.168.180.164:65222 > 239.255.255.250:ssdp / Ra',34,,
b'her / IP / TCP 220.181.174.162:https > 192.168.180.164:2327 PA / Ra',35,,
b'her / IP / TCP 220.181.174.162:https > 192.168.180.164:2327 F',35,,
b'her / IP / TCP 192.168.180.164:2327 > 220.181.174.162:https F',36,,
b'her / IP / TCP 192.168.180.164:2327 > 220.181.174.162:https ',36,,
"b'her / IP / UDP / DNS Qry ""b\'edge.microsoft.com.\'""'",37,,
"b'her / IP / UDP / DNS Qry ""b\'edge.microsoft.com.\'""'",38,,
"b'her / IP / UDP / DNS Ans ""b\'edge-microsoft-com.dual-a-0036.a-msedge.net.\'""'",39,,
"b'her / IP / UDP / DNS Ans ""b\'edge-microsoft-com.dual-a-0036.a-msedge.net.\'""'",40,,
b'her / IP / TCP 192.168.180.164:14052 > 13.107.21.239:https ',41,,
b'her / IP / TCP 192.168.180.164:14052 > 13.107.21.239:https ',41,,
b'her / IP / TCP 192.168.180.164:14052 > 13.107.21.239:https PA / Ra',41,,
b'her / IP / TCP 192.168.180.164:14052 > 13.107.21.239:https ',41,,
b'her / IP / TCP 192.168.180.164:14052 > 13.107.21.239:https PA / Ra',41,,
b'her / IP / TCP 192.168.180.164:14052 > 13.107.21.239:https PA / Ra',41,,
b'her / IP / TCP 192.168.180.164:14052 > 13.107.21.239:https PA / Ra',42,,
b'her / IP / TCP 192.168.180.164:14052 > 13.107.21.239:https ',42,,
b'her / IP / TCP 192.168.180.164:14052 > 13.107.21.239:https PA / Ra',42,,
b'her / IP / TCP 192.168.180.164:14052 > 13.107.21.239:https ',42,,
b'her / IP / TCP 192.168.180.164:14052 > 13.107.21.239:https A / Ra',42,,
b'her / IP / TCP 13.107.21.239:https > 192.168.180.164:14052 S',43,,
b'her / IP / TCP 13.107.21.239:https > 192.168.180.164:14052 ',43,,
b'her / IP / TCP 13.107.21.239:https > 192.168.180.164:14052 A / Ra',43,,
b'her / IP / TCP 13.107.21.239:https > 192.168.180.164:14052 A / Ra',43,,
b'her / IP / TCP 13.107.21.239:https > 192.168.180.164:14052 A / Ra',43,,
b'her / IP / TCP 13.107.21.239:https > 192.168.180.164:14052 A / Ra',43,,
b'her / IP / TCP 13.107.21.239:https > 192.168.180.164:14052 PA / Ra',44,,
b'her / IP / TCP 13.107.21.239:https > 192.168.180.164:14052 ',44,,
b'her / IP / TCP 13.107.21.239:https > 192.168.180.164:14052 ',44,,
b'her / IP / TCP 13.107.21.239:https > 192.168.180.164:14052 PA / Ra',44,,
b'her / IP / TCP 13.107.21.239:https > 192.168.180.164:14052 PA / Ra',44,,
b'her / IP / TCP 13.107.21.239:https > 192.168.180.164:14052 PA / Ra',44,,
b'her / IP / TCP 13.107.21.239:https > 192.168.180.164:14052 PA / Ra',44,,
b'her / IP / TCP 13.107.21.239:https > 192.168.180.164:14052 ',45,,
b'her / IP / TCP 13.107.21.239:https > 192.168.180.164:14052 ',45,,
b'her / IP / TCP 192.168.180.164:10548 > 23.41.74.108:https A / Ra',46,,
b'her / IP / TCP 192.168.180.164:10548 > 23.41.74.108:https A / Ra',46,,
b'her / IP / TCP 23.41.74.108:https > 192.168.180.164:10548 ',47,,
b'her / IP / TCP 23.41.74.108:https > 192.168.180.164:10548 ',47,,
b'her / IP / TCP 192.168.180.164:10552 > 20.42.65.89:https PA / Ra',48,,
b'her / IP / TCP 192.168.180.164:10552 > 20.42.65.89:https PA / Ra',48,,
b'her / IP / TCP 192.168.180.164:10552 > 20.42.65.89:https ',48,,
b'her / IP / TCP 192.168.180.164:10552 > 20.42.65.89:https PA / Ra',48,,
b'her / IP / TCP 192.168.180.164:10552 > 20.42.65.89:https PA / Ra',48,,
b'her / IP / TCP 192.168.180.164:10552 > 20.42.65.89:https ',48,,
b'her / IP / TCP 192.168.180.164:10552 > 20.42.65.89:https PA / Ra',49,,
b'her / IP / TCP 192.168.180.164:10552 > 20.42.65.89:https PA / Ra',49,,
b'her / IP / TCP 192.168.180.164:10552 > 20.42.65.89:https ',49,,
b'her / IP / TCP 192.168.180.164:10552 > 20.42.65.89:https PA / Ra',49,,
b'her / IP / TCP 192.168.180.164:10552 > 20.42.65.89:https PA / Ra',49,,
b'her / IP / TCP 192.168.180.164:10552 > 20.42.65.89:https ',49,,
b'her / IP / TCP 192.168.180.164:10552 > 20.42.65.89:https PA / Ra',49,,
b'her / IP / TCP 192.168.180.164:10552 > 20.42.65.89:https PA / Ra',50,,
b'her / IP / TCP 192.168.180.164:10552 > 20.42.65.89:https ',50,,
b'her / IP / TCP 192.168.180.164:10552 > 20.42.65.89:https PA / Ra',50,,
b'her / IP / TCP 192.168.180.164:10552 > 20.42.65.89:https PA / Ra',50,,
b'her / IP / TCP 192.168.180.164:10552 > 20.42.65.89:https ',50,,
b'her / IP / TCP 192.168.180.164:10552 > 20.42.65.89:https PA / Ra',50,,
b'her / IP / TCP 192.168.180.164:10552 > 20.42.65.89:https PA / Ra',50,,
b'her / IP / TCP 192.168.180.164:10552 > 20.42.65.89:https ',51,,
b'her / IP / TCP 192.168.180.164:10552 > 20.42.65.89:https PA / Ra',51,,
b'her / IP / TCP 192.168.180.164:10552 > 20.42.65.89:https PA / Ra',51,,
b'her / IP / TCP 192.168.180.164:10552 > 20.42.65.89:https ',51,,
b'her / IP / TCP 192.168.180.164:10552 > 20.42.65.89:https PA / Ra',51,,
b'her / IP / TCP 192.168.180.164:10552 > 20.42.65.89:https PA / Ra',51,,
b'her / IP / TCP 20.42.65.89:https > 192.168.180.164:10552 ',52,,
b'her / IP / TCP 20.42.65.89:https > 192.168.180.164:10552 PA / Ra',52,,
b'her / IP / TCP 20.42.65.89:https > 192.168.180.164:10552 ',52,,
b'her / IP / TCP 20.42.65.89:https > 192.168.180.164:10552 PA / Ra',52,,
b'her / IP / TCP 20.42.65.89:https > 192.168.180.164:10552 ',52,,
b'her / IP / TCP 20.42.65.89:https > 192.168.180.164:10552 PA / Ra',52,,
b'her / IP / TCP 20.42.65.89:https > 192.168.180.164:10552 ',53,,
b'her / IP / TCP 20.42.65.89:https > 192.168.180.164:10552 PA / Ra',53,,
b'her / IP / TCP 20.42.65.89:https > 192.168.180.164:10552 ',53,,
b'her / IP / TCP 20.42.65.89:https > 192.168.180.164:10552 PA / Ra',53,,
b'her / IP / TCP 20.42.65.89:https > 192.168.180.164:10552 ',53,,
b'her / IP / TCP 20.42.65.89:https > 192.168.180.164:10552 PA / Ra',53,,
b'her / IP / TCP 20.42.65.89:https > 192.168.180.164:10552 ',53,,
b'her / IP / TCP 20.42.65.89:https > 192.168.180.164:10552 PA / Ra',54,,
b'her / IP / TCP 20.42.65.89:https > 192.168.180.164:10552 ',54,,
b'her / IP / TCP 20.42.65.89:https > 192.168.180.164:10552 PA / Ra',54,,
b'her / IP / TCP 20.42.65.89:https > 192.168.180.164:10552 ',54,,
b'her / IP / TCP 20.42.65.89:https > 192.168.180.164:10552 PA / Ra',54,,
b'her / IP / TCP 192.168.180.164:13998 > 210.22.155.34:8080 R',55,,
b'her / IP / TCP 192.168.180.164:10437 > 23.200.74.17:https A / Ra',56,,
b'her / IP / TCP 192.168.180.164:10437 > 23.200.74.17:https A / Ra',56,,
b'her / IP / TCP 23.200.74.17:https > 192.168.180.164:10437 ',57,,
b'her / IP / TCP 23.200.74.17:https > 192.168.180.164:10437 ',57,,
"b'her / IP / UDP / DNS Qry ""b\'dns.msftncsi.com.\'""'",58,,
"b'her / IP / UDP / DNS Qry ""b\'dns.msftncsi.com.\'""'",58,,
"b'her / IP / UDP / DNS Ans ""fd3e:4f5a:5b81::1""'",59,,
"b'her / IP / UDP / DNS Ans ""fd3e:4f5a:5b81::1""'",59,,
"b'her / IP / UDP / DNS Qry ""b\'ipv6.msftconnecttest.com.\'""'",60,,
"b'her / IP / UDP / DNS Qry ""b\'ipv6.msftconnecttest.com.\'""'",60,,
"b'her / IP / UDP / DNS Ans ""b\'v6ncsi.msedge.net.\'""'",61,,
"b'her / IP / UDP / DNS Ans ""b\'v6ncsi.msedge.net.\'""'",61,,
b'her / IP / TCP 192.168.180.164:14054 > 23.49.104.173:http ',62,,
b'her / IP / TCP 192.168.180.164:14054 > 23.49.104.173:http ',62,,
b'her / IP / TCP 192.168.180.164:14054 > 23.49.104.173:http PA / Ra',62,,
b'her / IP / TCP 192.168.180.164:14054 > 23.49.104.173:http ',62,,
b'her / IP / TCP 192.168.180.164:14054 > 23.49.104.173:http F',62,,
b'her / IP / TCP 192.168.180.164:14054 > 23.49.104.173:http F',62,,
b'her / IP / TCP 192.168.180.164:14053 > 23.49.104.173:http ',63,,
b'her / IP / TCP 192.168.180.164:14053 > 23.49.104.173:http ',63,,
b'her / IP / TCP 192.168.180.164:14053 > 23.49.104.173:http PA / Ra',63,,
b'her / IP / TCP 192.168.180.164:14053 > 23.49.104.173:http F',63,,
b'her / IP / TCP 192.168.180.164:14053 > 23.49.104.173:http ',63,,
b'her / IP / TCP 23.49.104.173:http > 192.168.180.164:14053 S',64,,
b'her / IP / TCP 23.49.104.173:http > 192.168.180.164:14053 ',64,,
b'her / IP / TCP 23.49.104.173:http > 192.168.180.164:14053 PA / Ra',64,,
b'her / IP / TCP 23.49.104.173:http > 192.168.180.164:14053 F',64,,
b'her / IP / TCP 23.49.104.173:http > 192.168.180.164:14053 ',64,,
b'her / IP / TCP 23.49.104.173:http > 192.168.180.164:14054 S',65,,
b'her / IP / TCP 23.49.104.173:http > 192.168.180.164:14054 ',65,,
b'her / IP / TCP 23.49.104.173:http > 192.168.180.164:14054 PA / Ra',65,,
b'her / IP / TCP 23.49.104.173:http > 192.168.180.164:14054 F',65,,
b'her / IP / TCP 23.49.104.173:http > 192.168.180.164:14054 ',65,,
"b'her / IP / UDP / DNS Qry ""b\'ipv6.msftconnecttest.com.\'""'",66,,
"b'her / IP / UDP / DNS Ans ""b\'v6ncsi.msedge.net.\'""'",67,,
b'her / IP / TCP 104.65.228.154:https > 192.168.180.164:14051 S',68,,
b'her / IP / TCP 104.65.228.154:https > 192.168.180.164:14051 ',68,,
b'her / IP / TCP 104.65.228.154:https > 192.168.180.164:14051 A / Ra',68,,
b'her / IP / TCP 104.65.228.154:https > 192.168.180.164:14051 PA / Ra',68,,
b'her / IP / TCP 104.65.228.154:https > 192.168.180.164:14051 PA / Ra',68,,
b'her / IP / TCP 104.65.228.154:https > 192.168.180.164:14051 A / Ra',68,,
b'her / IP / TCP 104.65.228.154:https > 192.168.180.164:14051 PA / Ra',69,,
b'her / IP / TCP 104.65.228.154:https > 192.168.180.164:14051 A / Ra',69,,
b'her / IP / TCP 104.65.228.154:https > 192.168.180.164:14051 ',69,,
b'her / IP / TCP 104.65.228.154:https > 192.168.180.164:14051 PA / Ra',69,,
b'her / IP / TCP 104.65.228.154:https > 192.168.180.164:14051 ',69,,
b'her / IP / TCP 104.65.228.154:https > 192.168.180.164:14051 PA / Ra',69,,
b'her / IP / TCP 104.65.228.154:https > 192.168.180.164:14051 PA / Ra',69,,
b'her / IP / TCP 104.65.228.154:https > 192.168.180.164:14051 PA / Ra',70,,
b'her / IP / TCP 104.65.228.154:https > 192.168.180.164:14051 PA / Ra',70,,
b'her / IP / TCP 202.89.233.100:https > 192.168.180.164:10555 R',71,,
b'her / IP / TCP 192.168.180.164:12757 > 72.25.64.32:https A / Ra',72,,
b'her / IP / TCP 72.25.64.32:https > 192.168.180.164:12757 ',73,,
b'her / IP / TCP 192.168.180.164:8314 > 192.168.180.229:domain ',74,,
b'her / IP / TCP 192.168.180.164:8314 > 192.168.180.229:domain ',74,,
"b'her / IP / TCP / DNS Qry ""b\'dns.msftncsi.com.\'""'",74,,
b'her / IP / TCP 192.168.180.164:8314 > 192.168.180.229:domain ',74,,
b'her / IP / TCP 192.168.180.164:8314 > 192.168.180.229:domain F',74,,
b'her / IP / TCP 192.168.180.164:8314 > 192.168.180.229:domain ',74,,
b'her / IP / TCP 192.168.180.229:domain > 192.168.180.164:8314 S',75,,
b'her / IP / TCP 192.168.180.229:domain > 192.168.180.164:8314 ',75,,
b'her / IP / TCP 192.168.180.229:domain > 192.168.180.164:8314 PA / Ra',75,,
b'her / IP / TCP 192.168.180.229:domain > 192.168.180.164:8314 PA / Ra',75,,
b'her / IP / TCP 192.168.180.229:domain > 192.168.180.164:8314 F',75,,
b'her / IP / UDP 192.168.192.1:netbios_ns > 192.168.192.2:netbios_ns / NBNSHeader / Ra',76,,
b'her / IP / UDP 192.168.192.1:netbios_ns > 192.168.192.2:netbios_ns / NBNSHeader / Ra',76,,
b'her / IP / UDP 192.168.192.1:netbios_ns > 192.168.192.2:netbios_ns / NBNSHeader / Ra',76,,
b'her / IP / UDP 192.168.192.1:netbios_ns > 192.168.192.2:netbios_ns / NBNSHeader / Ra',76,,
b'her / IP / UDP 192.168.192.1:netbios_ns > 192.168.192.2:netbios_ns / NBNSHeader / Ra',76,,
b'her / IP / UDP 192.168.192.1:netbios_ns > 192.168.192.2:netbios_ns / NBNSHeader / Ra',76,,
b'her / IP / UDP 192.168.192.1:netbios_ns > 192.168.192.2:netbios_ns / NBNSHeader / Ra',77,,
b'her / IP / UDP 192.168.192.1:netbios_ns > 192.168.192.2:netbios_ns / NBNSHeader / Ra',77,,
b'her / IP / TCP 192.168.180.164:10566 > 202.112.14.6:https F',78,,
b'her / IP / TCP 192.168.180.164:10566 > 202.112.14.6:https R',78,,
b'her / IP / TCP 192.168.180.164:8316 > 23.200.74.11:https ',79,,
b'her / IP / TCP 192.168.180.164:8316 > 23.200.74.11:https ',79,,
b'her / IP / TCP 192.168.180.164:8316 > 23.200.74.11:https PA / Ra',79,,
b'her / IP / TCP 192.168.180.164:8316 > 23.200.74.11:https ',79,,
b'her / IP / TCP 192.168.180.164:8316 > 23.200.74.11:https PA / Ra',79,,
b'her / IP / TCP 192.168.180.164:8316 > 23.200.74.11:https PA / Ra',79,,
b'her / IP / TCP 192.168.180.164:8316 > 23.200.74.11:https PA / Ra',80,,
b'her / IP / TCP 192.168.180.164:8316 > 23.200.74.11:https ',80,,
b'her / IP / TCP 192.168.180.164:8316 > 23.200.74.11:https ',80,,
b'her / IP / TCP 192.168.180.164:8316 > 23.200.74.11:https PA / Ra',80,,
b'her / IP / TCP 192.168.180.164:8316 > 23.200.74.11:https F',80,,
b'her / IP / TCP 192.168.180.164:8316 > 23.200.74.11:https R',80,,
b'her / IP / TCP 23.200.74.11:https > 192.168.180.164:8316 S',81,,
b'her / IP / TCP 23.200.74.11:https > 192.168.180.164:8316 ',81,,
b'her / IP / TCP 23.200.74.11:https > 192.168.180.164:8316 A / Ra',81,,
b'her / IP / TCP 23.200.74.11:https > 192.168.180.164:8316 PA / Ra',81,,
b'her / IP / TCP 23.200.74.11:https > 192.168.180.164:8316 PA / Ra',81,,
b'her / IP / TCP 23.200.74.11:https > 192.168.180.164:8316 ',81,,
b'her / IP / TCP 23.200.74.11:https > 192.168.180.164:8316 ',82,,
b'her / IP / TCP 23.200.74.11:https > 192.168.180.164:8316 ',82,,
b'her / IP / TCP 23.200.74.11:https > 192.168.180.164:8316 PA / Ra',82,,
b'her / IP / TCP 23.200.74.11:https > 192.168.180.164:8316 PA / Ra',82,,
b'her / IP / TCP 23.200.74.11:https > 192.168.180.164:8316 PA / Ra',82,,
b'her / IP / TCP 23.200.74.11:https > 192.168.180.164:8316 PA / Ra',82,,
b'her / IP / TCP 23.200.74.11:https > 192.168.180.164:8316 PA / Ra',82,,
b'her / IP / TCP 23.200.74.11:https > 192.168.180.164:8316 ',83,,
b'her / IP / TCP 23.200.74.11:https > 192.168.180.164:8316 PA / Ra',83,,
b'her / IP / TCP 23.200.74.11:https > 192.168.180.164:8316 F',83,,
"b'her / IP / UDP / DNS Qry ""b\'substrate.office.com.\'""'",84,,
"b'her / IP / UDP / DNS Qry ""b\'substrate.office.com.\'""'",85,,
"b'her / IP / UDP / DNS Ans ""b\'outlook.office365.com.\'""'",86,,
"b'her / IP / UDP / DNS Ans ""b\'outlook.office365.com.\'""'",87,,
b'her / IP / UDP 192.168.180.164:52178 > 52.96.166.194:https / Ra',88,,
b'her / IP / UDP 192.168.180.164:52178 > 52.96.166.194:https / Ra',88,,
b'her / IP / UDP 192.168.180.164:52178 > 52.96.166.194:https / Ra',88,,
b'her / IP / UDP 192.168.180.164:52178 > 52.96.166.194:https / Ra',88,,
b'her / IP / UDP 192.168.180.164:52178 > 52.96.166.194:https / Ra',88,,
b'her / IP / UDP 192.168.180.164:52178 > 52.96.166.194:https / Ra',88,,
b'her / IP / UDP 52.96.166.194:https > 192.168.180.164:52178 / Ra',89,,
b'her / IP / UDP 52.96.166.194:https > 192.168.180.164:52178 / Ra',89,,
b'her / IP / UDP 52.96.166.194:https > 192.168.180.164:52178 / Ra',89,,
b'her / IP / UDP 52.96.166.194:https > 192.168.180.164:52178 / Ra',89,,
b'her / IP / UDP 52.96.166.194:https > 192.168.180.164:52178 / Ra',89,,
b'her / IP / TCP 192.168.180.164:8317 > 52.96.166.194:https ',90,,
b'her / IP / TCP 52.96.166.194:https > 192.168.180.164:8317 S',91,,
