data,flowmember,label,classes
b'her / IP / TCP 58.49.35.34:8080 > 192.168.180.164:10543 ',1,,
b'her / IP / TCP 58.49.35.34:8080 > 192.168.180.164:10543 ',1,,
b'her / IP / TCP 58.49.35.34:8080 > 192.168.180.164:10543 ',1,,
b'her / IP / TCP 58.49.35.34:8080 > 192.168.180.164:10543 ',1,,
b'her / IP / TCP 58.49.35.34:8080 > 192.168.180.164:10543 ',1,,
b'her / IP / TCP 58.49.35.34:8080 > 192.168.180.164:10543 ',1,,
b'her / IP / TCP 58.49.35.34:8080 > 192.168.180.164:10543 ',2,,
b'her / IP / TCP 58.49.35.34:8080 > 192.168.180.164:10543 PA / Ra',2,,
b'her / IP / TCP 58.49.35.34:8080 > 192.168.180.164:10543 F',2,,
b'her / IP / TCP 58.49.35.34:8080 > 192.168.180.164:10543 ',2,,
b'her / IP / TCP 58.49.35.34:8080 > 192.168.180.164:10541 ',3,,
b'her / IP / TCP 58.49.35.34:8080 > 192.168.180.164:10541 PA / Ra',3,,
b'her / IP / TCP 58.49.35.34:8080 > 192.168.180.164:10541 F',3,,
b'her / IP / TCP 58.49.35.34:8080 > 192.168.180.164:10539 ',4,,
b'her / IP / TCP 58.49.35.34:8080 > 192.168.180.164:10539 ',4,,
b'her / IP / TCP 58.49.35.34:8080 > 192.168.180.164:10539 ',4,,
b'her / IP / TCP 58.49.35.34:8080 > 192.168.180.164:10539 PA / Ra',4,,
b'her / IP / TCP 58.49.35.34:8080 > 192.168.180.164:10539 F',4,,
b'her / IP / TCP 58.49.35.34:8080 > 192.168.180.164:10544 ',5,,
b'her / IP / TCP 58.49.35.34:8080 > 192.168.180.164:10544 ',5,,
b'her / IP / TCP 58.49.35.34:8080 > 192.168.180.164:10544 ',5,,
b'her / IP / TCP 58.49.35.34:8080 > 192.168.180.164:10544 ',5,,
b'her / IP / TCP 58.49.35.34:8080 > 192.168.180.164:10544 PA / Ra',5,,
b'her / IP / TCP 58.49.35.34:8080 > 192.168.180.164:10544 F',5,,
b'her / IP / TCP 58.49.35.34:8080 > 192.168.180.164:10546 ',6,,
b'her / IP / TCP 58.49.35.34:8080 > 192.168.180.164:10546 ',6,,
b'her / IP / TCP 58.49.35.34:8080 > 192.168.180.164:10546 PA / Ra',6,,
b'her / IP / TCP 58.49.35.34:8080 > 192.168.180.164:10546 F',6,,
b'her / IP / TCP 192.168.180.164:10541 > 58.49.35.34:8080 R',7,,
b'her / IP / TCP 192.168.180.164:10543 > 58.49.35.34:8080 A / Ra',8,,
b'her / IP / TCP 192.168.180.164:10543 > 58.49.35.34:8080 A / Ra',8,,
b'her / IP / TCP 192.168.180.164:10543 > 58.49.35.34:8080 A / Ra',8,,
b'her / IP / TCP 192.168.180.164:10543 > 58.49.35.34:8080 FPA / Ra',8,,
b'her / IP / TCP 192.168.180.164:10543 > 58.49.35.34:8080 R',8,,
b'her / IP / TCP 192.168.180.164:10539 > 58.49.35.34:8080 A / Ra',9,,
b'her / IP / TCP 192.168.180.164:10539 > 58.49.35.34:8080 A / Ra',9,,
b'her / IP / TCP 192.168.180.164:10539 > 58.49.35.34:8080 FPA / Ra',9,,
b'her / IP / TCP 192.168.180.164:10539 > 58.49.35.34:8080 R',9,,
b'her / IP / TCP 58.49.35.34:8080 > 192.168.180.164:10542 ',10,,
b'her / IP / TCP 58.49.35.34:8080 > 192.168.180.164:10542 ',10,,
b'her / IP / TCP 58.49.35.34:8080 > 192.168.180.164:10542 ',10,,
b'her / IP / TCP 58.49.35.34:8080 > 192.168.180.164:10542 ',10,,
b'her / IP / TCP 58.49.35.34:8080 > 192.168.180.164:10542 PA / Ra',10,,
b'her / IP / TCP 58.49.35.34:8080 > 192.168.180.164:10542 F',10,,
b'her / IP / TCP 192.168.180.164:10542 > 58.49.35.34:8080 R',11,,
b'her / IP / TCP 192.168.180.164:10544 > 58.49.35.34:8080 R',12,,
b'her / IP / TCP 192.168.180.164:10546 > 58.49.35.34:8080 R',13,,
b'her / IP / TCP 192.168.180.164:10530 > 58.49.35.34:8080 F',14,,
b'her / IP / TCP 192.168.180.164:10530 > 58.49.35.34:8080 F',14,,
b'her / IP / TCP 192.168.180.164:10530 > 58.49.35.34:8080 R',14,,
b'her / IP / TCP 173.222.248.134:https > 192.168.180.164:10510 PA / Ra',15,,
b'her / IP / TCP 173.222.248.134:https > 192.168.180.164:10510 PA / Ra',15,,
b'her / IP / TCP 173.222.248.134:https > 192.168.180.164:10510 F',15,,
b'her / IP / TCP 192.168.180.164:10510 > 173.222.248.134:https ',16,,
"b'her / IP / UDP / DNS Qry ""b\'static-pcs-sdk-server.alibaba.com.\'""'",17,,
"b'her / IP / UDP / DNS Ans ""b\'static-pcs-sdk-server.alibaba.com.gds.alibabadns.com.\'""'",18,,
b'her / IP / TCP 192.168.180.164:10547 > 203.119.144.59:http ',19,,
b'her / IP / TCP 192.168.180.164:10547 > 203.119.144.59:http ',19,,
b'her / IP / TCP 192.168.180.164:10547 > 203.119.144.59:http PA / Ra',19,,
b'her / IP / TCP 192.168.180.164:10547 > 203.119.144.59:http A / Ra',19,,
b'her / IP / TCP 192.168.180.164:10547 > 203.119.144.59:http A / Ra',19,,
b'her / IP / TCP 192.168.180.164:10547 > 203.119.144.59:http PA / Ra',19,,
b'her / IP / TCP 192.168.180.164:10547 > 203.119.144.59:http ',20,,
b'her / IP / TCP 192.168.180.164:10547 > 203.119.144.59:http PA / Ra',20,,
b'her / IP / TCP 192.168.180.164:10547 > 203.119.144.59:http A / Ra',20,,
b'her / IP / TCP 192.168.180.164:10547 > 203.119.144.59:http A / Ra',20,,
b'her / IP / TCP 192.168.180.164:10547 > 203.119.144.59:http PA / Ra',20,,
b'her / IP / TCP 192.168.180.164:10547 > 203.119.144.59:http ',20,,
b'her / IP / TCP 192.168.180.164:10547 > 203.119.144.59:http PA / Ra',20,,
b'her / IP / TCP 192.168.180.164:10547 > 203.119.144.59:http A / Ra',21,,
b'her / IP / TCP 192.168.180.164:10547 > 203.119.144.59:http A / Ra',21,,
b'her / IP / TCP 192.168.180.164:10547 > 203.119.144.59:http PA / Ra',21,,
b'her / IP / TCP 192.168.180.164:10547 > 203.119.144.59:http ',21,,
b'her / IP / TCP 192.168.180.164:10547 > 203.119.144.59:http PA / Ra',21,,
b'her / IP / TCP 192.168.180.164:10547 > 203.119.144.59:http A / Ra',21,,
b'her / IP / TCP 192.168.180.164:10547 > 203.119.144.59:http A / Ra',21,,
b'her / IP / TCP 192.168.180.164:10547 > 203.119.144.59:http PA / Ra',22,,
b'her / IP / TCP 192.168.180.164:10547 > 203.119.144.59:http ',22,,
b'her / IP / TCP 192.168.180.164:10547 > 203.119.144.59:http PA / Ra',22,,
b'her / IP / TCP 192.168.180.164:10547 > 203.119.144.59:http A / Ra',22,,
b'her / IP / TCP 192.168.180.164:10547 > 203.119.144.59:http A / Ra',22,,
b'her / IP / TCP 192.168.180.164:10547 > 203.119.144.59:http PA / Ra',22,,
b'her / IP / TCP 192.168.180.164:10547 > 203.119.144.59:http ',22,,
b'her / IP / TCP 192.168.180.164:10547 > 203.119.144.59:http PA / Ra',23,,
b'her / IP / TCP 192.168.180.164:10547 > 203.119.144.59:http A / Ra',23,,
b'her / IP / TCP 192.168.180.164:10547 > 203.119.144.59:http A / Ra',23,,
b'her / IP / TCP 192.168.180.164:10547 > 203.119.144.59:http PA / Ra',23,,
b'her / IP / TCP 192.168.180.164:10547 > 203.119.144.59:http ',23,,
b'her / IP / TCP 192.168.180.164:10547 > 203.119.144.59:http PA / Ra',23,,
b'her / IP / TCP 192.168.180.164:10547 > 203.119.144.59:http A / Ra',23,,
b'her / IP / TCP 192.168.180.164:10547 > 203.119.144.59:http A / Ra',24,,
b'her / IP / TCP 192.168.180.164:10547 > 203.119.144.59:http PA / Ra',24,,
b'her / IP / TCP 192.168.180.164:10547 > 203.119.144.59:http ',24,,
b'her / IP / TCP 192.168.180.164:10547 > 203.119.144.59:http PA / Ra',24,,
b'her / IP / TCP 192.168.180.164:10547 > 203.119.144.59:http A / Ra',24,,
b'her / IP / TCP 192.168.180.164:10547 > 203.119.144.59:http A / Ra',24,,
b'her / IP / TCP 192.168.180.164:10547 > 203.119.144.59:http PA / Ra',24,,
b'her / IP / TCP 192.168.180.164:10547 > 203.119.144.59:http ',25,,
b'her / IP / TCP 192.168.180.164:10547 > 203.119.144.59:http PA / Ra',25,,
b'her / IP / TCP 192.168.180.164:10547 > 203.119.144.59:http A / Ra',25,,
b'her / IP / TCP 192.168.180.164:10547 > 203.119.144.59:http A / Ra',25,,
b'her / IP / TCP 192.168.180.164:10547 > 203.119.144.59:http PA / Ra',25,,
b'her / IP / TCP 192.168.180.164:10547 > 203.119.144.59:http ',25,,
b'her / IP / TCP 192.168.180.164:10547 > 203.119.144.59:http PA / Ra',25,,
b'her / IP / TCP 192.168.180.164:10547 > 203.119.144.59:http A / Ra',26,,
b'her / IP / TCP 192.168.180.164:10547 > 203.119.144.59:http A / Ra',26,,
b'her / IP / TCP 192.168.180.164:10547 > 203.119.144.59:http PA / Ra',26,,
b'her / IP / TCP 192.168.180.164:10547 > 203.119.144.59:http ',26,,
b'her / IP / TCP 192.168.180.164:10547 > 203.119.144.59:http PA / Ra',26,,
b'her / IP / TCP 192.168.180.164:10547 > 203.119.144.59:http A / Ra',26,,
b'her / IP / TCP 192.168.180.164:10547 > 203.119.144.59:http A / Ra',26,,
b'her / IP / TCP 192.168.180.164:10547 > 203.119.144.59:http PA / Ra',27,,
b'her / IP / TCP 192.168.180.164:10547 > 203.119.144.59:http ',27,,
b'her / IP / TCP 192.168.180.164:10547 > 203.119.144.59:http PA / Ra',27,,
b'her / IP / TCP 192.168.180.164:10547 > 203.119.144.59:http A / Ra',27,,
b'her / IP / TCP 192.168.180.164:10547 > 203.119.144.59:http A / Ra',27,,
b'her / IP / TCP 192.168.180.164:10547 > 203.119.144.59:http PA / Ra',27,,
b'her / IP / TCP 192.168.180.164:10547 > 203.119.144.59:http ',27,,
b'her / IP / TCP 192.168.180.164:10547 > 203.119.144.59:http PA / Ra',28,,
b'her / IP / TCP 192.168.180.164:10547 > 203.119.144.59:http A / Ra',28,,
b'her / IP / TCP 192.168.180.164:10547 > 203.119.144.59:http A / Ra',28,,
b'her / IP / TCP 192.168.180.164:10547 > 203.119.144.59:http PA / Ra',28,,
b'her / IP / TCP 192.168.180.164:10547 > 203.119.144.59:http ',28,,
b'her / IP / TCP 192.168.180.164:10547 > 203.119.144.59:http PA / Ra',28,,
b'her / IP / TCP 192.168.180.164:10547 > 203.119.144.59:http A / Ra',28,,
b'her / IP / TCP 192.168.180.164:10547 > 203.119.144.59:http A / Ra',29,,
b'her / IP / TCP 192.168.180.164:10547 > 203.119.144.59:http PA / Ra',29,,
b'her / IP / TCP 192.168.180.164:10547 > 203.119.144.59:http ',29,,
b'her / IP / TCP 192.168.180.164:10547 > 203.119.144.59:http PA / Ra',29,,
b'her / IP / TCP 192.168.180.164:10547 > 203.119.144.59:http A / Ra',29,,
b'her / IP / TCP 192.168.180.164:10547 > 203.119.144.59:http A / Ra',29,,
b'her / IP / TCP 192.168.180.164:10547 > 203.119.144.59:http PA / Ra',29,,
b'her / IP / TCP 192.168.180.164:10547 > 203.119.144.59:http ',30,,
b'her / IP / TCP 192.168.180.164:10547 > 203.119.144.59:http PA / Ra',30,,
b'her / IP / TCP 192.168.180.164:10547 > 203.119.144.59:http A / Ra',30,,
b'her / IP / TCP 192.168.180.164:10547 > 203.119.144.59:http A / Ra',30,,
b'her / IP / TCP 192.168.180.164:10547 > 203.119.144.59:http PA / Ra',30,,
b'her / IP / TCP 192.168.180.164:10547 > 203.119.144.59:http ',30,,
b'her / IP / TCP 203.119.144.59:http > 192.168.180.164:10547 S',31,,
b'her / IP / TCP 203.119.144.59:http > 192.168.180.164:10547 ',31,,
b'her / IP / TCP 203.119.144.59:http > 192.168.180.164:10547 ',31,,
b'her / IP / TCP 203.119.144.59:http > 192.168.180.164:10547 ',31,,
b'her / IP / TCP 203.119.144.59:http > 192.168.180.164:10547 PA / Ra',31,,
b'her / IP / TCP 203.119.144.59:http > 192.168.180.164:10547 PA / Ra',31,,
b'her / IP / TCP 203.119.144.59:http > 192.168.180.164:10547 ',32,,
b'her / IP / TCP 203.119.144.59:http > 192.168.180.164:10547 ',32,,
b'her / IP / TCP 203.119.144.59:http > 192.168.180.164:10547 PA / Ra',32,,
b'her / IP / TCP 203.119.144.59:http > 192.168.180.164:10547 PA / Ra',32,,
b'her / IP / TCP 203.119.144.59:http > 192.168.180.164:10547 ',32,,
b'her / IP / TCP 203.119.144.59:http > 192.168.180.164:10547 ',32,,
b'her / IP / TCP 203.119.144.59:http > 192.168.180.164:10547 PA / Ra',32,,
b'her / IP / TCP 203.119.144.59:http > 192.168.180.164:10547 PA / Ra',33,,
b'her / IP / TCP 203.119.144.59:http > 192.168.180.164:10547 ',33,,
b'her / IP / TCP 203.119.144.59:http > 192.168.180.164:10547 ',33,,
b'her / IP / TCP 203.119.144.59:http > 192.168.180.164:10547 PA / Ra',33,,
b'her / IP / TCP 203.119.144.59:http > 192.168.180.164:10547 PA / Ra',33,,
b'her / IP / TCP 203.119.144.59:http > 192.168.180.164:10547 ',33,,
b'her / IP / TCP 203.119.144.59:http > 192.168.180.164:10547 PA / Ra',33,,
b'her / IP / TCP 203.119.144.59:http > 192.168.180.164:10547 PA / Ra',34,,
b'her / IP / TCP 203.119.144.59:http > 192.168.180.164:10547 ',34,,
b'her / IP / TCP 203.119.144.59:http > 192.168.180.164:10547 PA / Ra',34,,
b'her / IP / TCP 203.119.144.59:http > 192.168.180.164:10547 PA / Ra',34,,
b'her / IP / TCP 203.119.144.59:http > 192.168.180.164:10547 ',34,,
b'her / IP / TCP 203.119.144.59:http > 192.168.180.164:10547 PA / Ra',34,,
b'her / IP / TCP 203.119.144.59:http > 192.168.180.164:10547 PA / Ra',34,,
b'her / IP / TCP 203.119.144.59:http > 192.168.180.164:10547 ',35,,
b'her / IP / TCP 203.119.144.59:http > 192.168.180.164:10547 PA / Ra',35,,
b'her / IP / TCP 203.119.144.59:http > 192.168.180.164:10547 PA / Ra',35,,
b'her / IP / TCP 203.119.144.59:http > 192.168.180.164:10547 ',35,,
b'her / IP / TCP 203.119.144.59:http > 192.168.180.164:10547 ',35,,
b'her / IP / TCP 203.119.144.59:http > 192.168.180.164:10547 PA / Ra',35,,
b'her / IP / TCP 203.119.144.59:http > 192.168.180.164:10547 PA / Ra',35,,
b'her / IP / TCP 203.119.144.59:http > 192.168.180.164:10547 ',36,,
b'her / IP / TCP 203.119.144.59:http > 192.168.180.164:10547 PA / Ra',36,,
b'her / IP / TCP 203.119.144.59:http > 192.168.180.164:10547 PA / Ra',36,,
b'her / IP / TCP 203.119.144.59:http > 192.168.180.164:10547 ',36,,
b'her / IP / TCP 203.119.144.59:http > 192.168.180.164:10547 PA / Ra',36,,
b'her / IP / TCP 203.119.144.59:http > 192.168.180.164:10547 PA / Ra',36,,
b'her / IP / TCP 203.119.144.59:http > 192.168.180.164:10547 ',36,,
b'her / IP / TCP 203.119.144.59:http > 192.168.180.164:10547 PA / Ra',37,,
b'her / IP / TCP 203.119.144.59:http > 192.168.180.164:10547 PA / Ra',37,,
b'her / IP / TCP 203.119.144.59:http > 192.168.180.164:10547 ',37,,
b'her / IP / TCP 203.119.144.59:http > 192.168.180.164:10547 ',37,,
b'her / IP / TCP 203.119.144.59:http > 192.168.180.164:10547 PA / Ra',37,,
b'her / IP / TCP 203.119.144.59:http > 192.168.180.164:10547 PA / Ra',37,,
b'her / IP / TCP 203.119.144.59:http > 192.168.180.164:10547 ',37,,
b'her / IP / TCP 203.119.144.59:http > 192.168.180.164:10547 PA / Ra',38,,
b'her / IP / TCP 203.119.144.59:http > 192.168.180.164:10547 PA / Ra',38,,
b'her / IP / TCP 203.119.144.59:http > 192.168.180.164:10547 ',38,,
b'her / IP / TCP 203.119.144.59:http > 192.168.180.164:10547 ',38,,
b'her / IP / TCP 203.119.144.59:http > 192.168.180.164:10547 PA / Ra',38,,
b'her / IP / TCP 203.119.144.59:http > 192.168.180.164:10547 PA / Ra',38,,
b'her / IP / TCP 203.119.144.59:http > 192.168.180.164:10547 ',38,,
b'her / IP / TCP 203.119.144.59:http > 192.168.180.164:10547 PA / Ra',39,,
b'her / IP / TCP 203.119.144.59:http > 192.168.180.164:10547 PA / Ra',39,,
b'her / IP / TCP 192.168.180.164:12757 > 72.25.64.32:https A / Ra',40,,
b'her / IP / TCP 72.25.64.32:https > 192.168.180.164:12757 ',41,,
b'her / IP / TCP 192.168.180.164:6141 > 69.16.175.10:http A / Ra',42,,
b'her / IP / TCP 192.168.180.164:6141 > 69.16.175.10:http R',42,,
b'her / IP / TCP 192.168.180.164:10481 > 58.49.35.34:8080 R',43,,
b'her / IP / TCP 192.168.180.164:10483 > 58.49.35.34:8080 R',44,,
b'her / IP / TCP 192.168.180.164:10439 > 13.107.21.239:https PA / Ra',45,,
b'her / IP / TCP 192.168.180.164:10439 > 13.107.21.239:https PA / Ra',45,,
b'her / IP / TCP 192.168.180.164:10439 > 13.107.21.239:https PA / Ra',45,,
b'her / IP / TCP 192.168.180.164:10439 > 13.107.21.239:https ',45,,
b'her / IP / TCP 192.168.180.164:10439 > 13.107.21.239:https ',45,,
b'her / IP / TCP 192.168.180.164:10439 > 13.107.21.239:https PA / Ra',45,,
b'her / IP / TCP 13.107.21.239:https > 192.168.180.164:10439 ',46,,
b'her / IP / TCP 13.107.21.239:https > 192.168.180.164:10439 ',46,,
b'her / IP / TCP 13.107.21.239:https > 192.168.180.164:10439 PA / Ra',46,,
b'her / IP / TCP 13.107.21.239:https > 192.168.180.164:10439 PA / Ra',46,,
b'her / IP / TCP 13.107.21.239:https > 192.168.180.164:10439 PA / Ra',46,,
b'her / IP / TCP 13.107.21.239:https > 192.168.180.164:10439 PA / Ra',46,,
b'her / IP / TCP 13.107.21.239:https > 192.168.180.164:10439 ',47,,
b'her / IP / UDP 192.168.192.1:netbios_ns > 192.168.192.2:netbios_ns / NBNSHeader / Ra',47,,
b'her / IP / UDP 192.168.192.1:netbios_ns > 192.168.192.2:netbios_ns / NBNSHeader / Ra',47,,
b'her / IP / UDP 192.168.192.1:netbios_ns > 192.168.192.2:netbios_ns / NBNSHeader / Ra',47,,
b'her / IP / UDP 192.168.192.1:netbios_ns > 192.168.192.2:netbios_ns / NBNSHeader / Ra',47,,
b'her / IP / UDP 192.168.192.1:netbios_ns > 192.168.192.2:netbios_ns / NBNSHeader / Ra',47,,
b'her / IP / UDP 192.168.192.1:netbios_ns > 192.168.192.2:netbios_ns / NBNSHeader / Ra',47,,
b'her / IP / UDP 192.168.192.1:netbios_ns > 192.168.192.2:netbios_ns / NBNSHeader / Ra',48,,
b'her / IP / UDP 192.168.192.1:netbios_ns > 192.168.192.2:netbios_ns / NBNSHeader / Ra',48,,
b'her / IP / UDP 192.168.192.1:netbios_ns > 192.168.192.2:netbios_ns / NBNSHeader / Ra',48,,
b'her / IP / UDP 192.168.192.1:netbios_ns > 192.168.192.2:netbios_ns / NBNSHeader / Ra',48,,
b'her / IP / UDP 192.168.192.1:netbios_ns > 192.168.192.2:netbios_ns / NBNSHeader / Ra',48,,
b'her / IP / UDP 192.168.192.1:netbios_ns > 192.168.192.2:netbios_ns / NBNSHeader / Ra',48,,
b'her / IP / UDP 192.168.192.1:netbios_ns > 192.168.192.2:netbios_ns / NBNSHeader / Ra',48,,
b'her / IP / UDP 192.168.192.1:netbios_ns > 192.168.192.2:netbios_ns / NBNSHeader / Ra',49,,
b'her / IP / UDP 192.168.192.1:netbios_ns > 192.168.192.2:netbios_ns / NBNSHeader / Ra',49,,
"b'her / IP / UDP / DNS Qry ""b\'WHS_527609.local.\'""'",50,,
"b'her / IP / UDP / DNS Ans ""fe80::51be:5405:4d6a:bfb3""'",50,,
"b'her / IPv6 / UDP / DNS Qry ""b\'WHS_527609.local.\'""'",51,,
"b'her / IPv6 / UDP / DNS Ans ""fe80::51be:5405:4d6a:bfb3""'",51,,
"b""her / IPv6 / UDP fe80::51be:5405:4d6a:bfb3:50248 > ff02::1:3:llmnr / LLMNRQuery who has 'WHS_527609.""",51,,
"b""her / IP / UDP 192.168.180.164:50248 > 224.0.0.252:llmnr / LLMNRQuery who has 'WHS_527609.""",52,,
b'her / IP / TCP 192.168.180.164:2325 > 13.107.21.239:https A / Ra',53,,
b'her / IP / TCP 192.168.180.164:2325 > 13.107.21.239:https PA / Ra',53,,
b'her / IP / TCP 192.168.180.164:2325 > 13.107.21.239:https PA / Ra',53,,
b'her / IP / TCP 192.168.180.164:2325 > 13.107.21.239:https ',53,,
b'her / IP / TCP 192.168.180.164:2325 > 13.107.21.239:https ',53,,
b'her / IP / TCP 13.107.21.239:https > 192.168.180.164:2325 ',54,,
b'her / IP / TCP 13.107.21.239:https > 192.168.180.164:2325 ',54,,
b'her / IP / TCP 13.107.21.239:https > 192.168.180.164:2325 PA / Ra',54,,
b'her / IP / TCP 13.107.21.239:https > 192.168.180.164:2325 PA / Ra',54,,
b'her / IP / TCP 192.168.180.164:2327 > 220.181.174.162:https A / Ra',55,,
b'her / IP / TCP 192.168.180.164:2326 > 202.89.233.100:https A / Ra',56,,
b'her / IP / TCP 220.181.174.162:https > 192.168.180.164:2327 ',57,,
b'her / IP / TCP 202.89.233.100:https > 192.168.180.164:2326 ',58,,
b'her / IP / TCP 192.168.180.164:2328 > 52.96.110.18:https A / Ra',59,,
b'her / IP / TCP 192.168.180.164:2328 > 52.96.110.18:https F',59,,
b'her / IP / TCP 52.96.110.18:https > 192.168.180.164:2328 ',60,,
b'her / IP / TCP 52.96.110.18:https > 192.168.180.164:2328 R',60,,
b'her / IP / TCP 192.168.180.164:2333 > 13.107.6.158:https A / Ra',61,,
b'her / IP / TCP 13.107.6.158:https > 192.168.180.164:2333 ',62,,
b'her / IP / TCP 192.168.180.164:2324 > 13.107.21.239:https A / Ra',63,,
b'her / IP / TCP 13.107.21.239:https > 192.168.180.164:2324 ',64,,
b'her / IP / TCP 192.168.180.164:10437 > 23.200.74.17:https A / Ra',65,,
b'her / IP / TCP 192.168.180.164:10437 > 23.200.74.17:https PA / Ra',65,,
b'her / IP / TCP 192.168.180.164:10437 > 23.200.74.17:https PA / Ra',65,,
b'her / IP / TCP 192.168.180.164:10437 > 23.200.74.17:https ',65,,
b'her / IP / TCP 23.200.74.17:https > 192.168.180.164:10437 ',66,,
b'her / IP / TCP 23.200.74.17:https > 192.168.180.164:10437 ',66,,
b'her / IP / TCP 23.200.74.17:https > 192.168.180.164:10437 PA / Ra',66,,
b'her / IP / TCP 23.200.74.17:https > 192.168.180.164:10437 ',66,,
b'her / IP / TCP 23.200.74.17:https > 192.168.180.164:10437 PA / Ra',66,,
b'her / IP / TCP 192.168.180.164:10441 > 13.107.5.80:https A / Ra',67,,
b'her / IP / TCP 13.107.5.80:https > 192.168.180.164:10441 ',68,,
b'her / IP / TCP 192.168.180.164:10448 > 119.28.20.150:https A / Ra',69,,
b'her / IP / TCP 192.168.180.164:10448 > 119.28.20.150:https ',69,,
b'her / IP / TCP 119.28.20.150:https > 192.168.180.164:10448 ',70,,
b'her / IP / TCP 119.28.20.150:https > 192.168.180.164:10448 PA / Ra',70,,
b'her / IP / TCP 119.28.20.150:https > 192.168.180.164:10448 F',70,,
b'her / IP / UDP 45.40.228.59:8000 > 192.168.180.164:4010 / Ra',71,,
b'her / IP / UDP 45.40.228.59:8000 > 192.168.180.164:4010 / Ra',71,,
"b'her / IP / UDP / DNS Qry ""b\'go.microsoft.com.\'""'",72,,
"b'her / IP / UDP / DNS Qry ""b\'go.microsoft.com.\'""'",73,,
"b'her / IP / UDP / DNS Ans ""b\'go.microsoft.com.edgekey.net.\'""'",74,,
"b'her / IP / UDP / DNS Ans ""b\'go.microsoft.com.edgekey.net.\'""'",75,,
b'her / IP / TCP 192.168.180.164:10548 > 23.41.74.108:https ',76,,
b'her / IP / TCP 192.168.180.164:10548 > 23.41.74.108:https ',76,,
b'her / IP / TCP 192.168.180.164:10548 > 23.41.74.108:https PA / Ra',76,,
b'her / IP / TCP 192.168.180.164:10548 > 23.41.74.108:https ',76,,
b'her / IP / TCP 192.168.180.164:10548 > 23.41.74.108:https ',76,,
b'her / IP / TCP 192.168.180.164:10548 > 23.41.74.108:https PA / Ra',76,,
b'her / IP / TCP 192.168.180.164:10548 > 23.41.74.108:https PA / Ra',77,,
b'her / IP / TCP 192.168.180.164:10548 > 23.41.74.108:https ',77,,
b'her / IP / TCP 192.168.180.164:10548 > 23.41.74.108:https ',77,,
"b'her / IP / UDP / DNS Qry ""b\'edge.microsoft.com.\'""'",78,,
"b'her / IP / UDP / DNS Qry ""b\'edge.microsoft.com.\'""'",79,,
"b'her / IP / UDP / DNS Ans ""b\'edge-microsoft-com.dual-a-0036.a-msedge.net.\'""'",80,,
"b'her / IP / UDP / DNS Ans ""b\'edge-microsoft-com.dual-a-0036.a-msedge.net.\'""'",81,,
b'her / IP / TCP 192.168.180.164:10549 > 204.79.197.239:https ',82,,
b'her / IP / TCP 192.168.180.164:10549 > 204.79.197.239:https ',82,,
b'her / IP / TCP 192.168.180.164:10549 > 204.79.197.239:https PA / Ra',82,,
b'her / IP / TCP 192.168.180.164:10549 > 204.79.197.239:https ',82,,
b'her / IP / TCP 192.168.180.164:10549 > 204.79.197.239:https PA / Ra',82,,
b'her / IP / TCP 192.168.180.164:10549 > 204.79.197.239:https PA / Ra',82,,
b'her / IP / TCP 192.168.180.164:10549 > 204.79.197.239:https PA / Ra',83,,
b'her / IP / TCP 192.168.180.164:10549 > 204.79.197.239:https A / Ra',83,,
b'her / IP / TCP 192.168.180.164:10549 > 204.79.197.239:https A / Ra',83,,
b'her / IP / TCP 192.168.180.164:10549 > 204.79.197.239:https A / Ra',83,,
b'her / IP / TCP 192.168.180.164:10549 > 204.79.197.239:https A / Ra',83,,
b'her / IP / TCP 192.168.180.164:10549 > 204.79.197.239:https A / Ra',83,,
b'her / IP / TCP 192.168.180.164:10549 > 204.79.197.239:https A / Ra',83,,
b'her / IP / TCP 192.168.180.164:10549 > 204.79.197.239:https PA / Ra',84,,
b'her / IP / TCP 192.168.180.164:10549 > 204.79.197.239:https ',84,,
b'her / IP / TCP 192.168.180.164:10549 > 204.79.197.239:https PA / Ra',84,,
b'her / IP / TCP 192.168.180.164:10549 > 204.79.197.239:https ',84,,
b'her / IP / TCP 204.79.197.239:https > 192.168.180.164:10549 S',85,,
b'her / IP / TCP 204.79.197.239:https > 192.168.180.164:10549 ',85,,
b'her / IP / TCP 204.79.197.239:https > 192.168.180.164:10549 A / Ra',85,,
b'her / IP / TCP 204.79.197.239:https > 192.168.180.164:10549 A / Ra',85,,
b'her / IP / TCP 204.79.197.239:https > 192.168.180.164:10549 A / Ra',85,,
b'her / IP / TCP 204.79.197.239:https > 192.168.180.164:10549 A / Ra',85,,
b'her / IP / TCP 204.79.197.239:https > 192.168.180.164:10549 PA / Ra',86,,
b'her / IP / TCP 204.79.197.239:https > 192.168.180.164:10549 ',86,,
b'her / IP / TCP 204.79.197.239:https > 192.168.180.164:10549 PA / Ra',86,,
b'her / IP / TCP 204.79.197.239:https > 192.168.180.164:10549 PA / Ra',86,,
b'her / IP / TCP 204.79.197.239:https > 192.168.180.164:10549 PA / Ra',86,,
b'her / IP / TCP 204.79.197.239:https > 192.168.180.164:10549 ',86,,
b'her / IP / TCP 204.79.197.239:https > 192.168.180.164:10549 ',86,,
b'her / IP / TCP 204.79.197.239:https > 192.168.180.164:10549 ',87,,
b'her / IP / TCP 204.79.197.239:https > 192.168.180.164:10549 ',87,,
b'her / IP / TCP 204.79.197.239:https > 192.168.180.164:10549 PA / Ra',87,,
b'her / IP / TCP 204.79.197.239:https > 192.168.180.164:10549 PA / Ra',87,,
b'her / IP / TCP 204.79.197.239:https > 192.168.180.164:10549 ',87,,
b'her / IP / TCP 23.41.74.108:https > 192.168.180.164:10548 S',88,,
b'her / IP / TCP 23.41.74.108:https > 192.168.180.164:10548 ',88,,
b'her / IP / TCP 23.41.74.108:https > 192.168.180.164:10548 A / Ra',88,,
b'her / IP / TCP 23.41.74.108:https > 192.168.180.164:10548 PA / Ra',88,,
b'her / IP / TCP 23.41.74.108:https > 192.168.180.164:10548 PA / Ra',88,,
b'her / IP / TCP 23.41.74.108:https > 192.168.180.164:10548 A / Ra',88,,
b'her / IP / TCP 23.41.74.108:https > 192.168.180.164:10548 PA / Ra',89,,
b'her / IP / TCP 23.41.74.108:https > 192.168.180.164:10548 ',89,,
b'her / IP / TCP 23.41.74.108:https > 192.168.180.164:10548 ',89,,
b'her / IP / TCP 23.41.74.108:https > 192.168.180.164:10548 PA / Ra',89,,
b'her / IP / TCP 23.41.74.108:https > 192.168.180.164:10548 PA / Ra',89,,
b'her / IP / TCP 23.41.74.108:https > 192.168.180.164:10548 PA / Ra',89,,
b'her / IP / TCP 192.168.180.164:10496 > 202.89.233.96:https A / Ra',90,,
b'her / IP / TCP 202.89.233.96:https > 192.168.180.164:10496 ',91,,
b'her / IP / TCP 192.168.180.164:10508 > 202.89.233.101:https A / Ra',92,,
b'her / IP / TCP 192.168.180.164:10505 > 20.205.115.81:https A / Ra',93,,
b'her / IP / TCP 192.168.180.164:10511 > 202.89.233.96:https A / Ra',94,,
b'her / IP / TCP 202.89.233.101:https > 192.168.180.164:10508 ',95,,
b'her / IP / TCP 20.205.115.81:https > 192.168.180.164:10505 ',96,,
b'her / IP / TCP 202.89.233.96:https > 192.168.180.164:10511 ',97,,
b'her / IP / TCP 192.168.180.164:10509 > 13.225.114.52:https A / Ra',98,,
b'her / IP / TCP 192.168.180.164:2329 > 52.96.110.18:https A / Ra',99,,
b'her / IP / TCP 13.225.114.52:https > 192.168.180.164:10509 ',100,,
b'her / IP / TCP 52.96.110.18:https > 192.168.180.164:2329 ',101,,
b'her / IP / TCP 192.168.180.164:10514 > 220.181.174.34:https A / Ra',102,,
b'her / IP / TCP 220.181.174.34:https > 192.168.180.164:10514 ',103,,
b'her / IP / TCP 192.168.180.164:10495 > 202.89.233.96:https A / Ra',104,,
b'her / IP / TCP 192.168.180.164:10494 > 204.79.197.203:https A / Ra',105,,
b'her / IP / TCP 202.89.233.96:https > 192.168.180.164:10495 ',106,,
b'her / IP / TCP 204.79.197.203:https > 192.168.180.164:10494 ',107,,
b'her / IP / UDP 192.168.180.164:4010 > 45.40.228.59:8000 / Ra',108,,
"b'her / IP / UDP / DNS Qry ""b\'functional.events.data.microsoft.com.\'""'",109,,
"b'her / IP / UDP / DNS Qry ""b\'functional.events.data.microsoft.com.\'""'",110,,
"b'her / IP / UDP / DNS Ans ""b\'global.asimov.events.data.trafficmanager.net.\'""'",111,,
"b'her / IP / UDP / DNS Ans ""b\'global.asimov.events.data.trafficmanager.net.\'""'",112,,
b'her / IP / TCP 192.168.180.164:10552 > 20.42.65.89:https ',113,,
b'her / IP / TCP 192.168.180.164:10552 > 20.42.65.89:https ',113,,
b'her / IP / TCP 192.168.180.164:10552 > 20.42.65.89:https PA / Ra',113,,
b'her / IP / TCP 192.168.180.164:10552 > 20.42.65.89:https ',113,,
b'her / IP / TCP 192.168.180.164:10552 > 20.42.65.89:https PA / Ra',113,,
b'her / IP / TCP 192.168.180.164:10552 > 20.42.65.89:https PA / Ra',113,,
b'her / IP / TCP 192.168.180.164:10552 > 20.42.65.89:https A / Ra',114,,
b'her / IP / TCP 192.168.180.164:10552 > 20.42.65.89:https PA / Ra',114,,
b'her / IP / TCP 192.168.180.164:11549 > 42.187.184.67:https PA / Ra',115,,
b'her / IP / TCP 192.168.180.164:11549 > 42.187.184.67:https ',115,,
b'her / IP / TCP 42.187.184.67:https > 192.168.180.164:11549 PA / Ra',116,,
b'her / IP / TCP 192.168.180.164:10553 > 20.42.65.89:https ',117,,
b'her / IP / TCP 192.168.180.164:10553 > 20.42.65.89:https ',117,,
b'her / IP / TCP 192.168.180.164:10553 > 20.42.65.89:https PA / Ra',117,,
b'her / IP / TCP 192.168.180.164:10553 > 20.42.65.89:https ',117,,
b'her / IP / TCP 192.168.180.164:10553 > 20.42.65.89:https ',117,,
b'her / IP / TCP 192.168.180.164:10553 > 20.42.65.89:https PA / Ra',117,,
b'her / IP / TCP 20.42.65.89:https > 192.168.180.164:10552 S',118,,
b'her / IP / TCP 20.42.65.89:https > 192.168.180.164:10552 A / Ra',118,,
b'her / IP / TCP 20.42.65.89:https > 192.168.180.164:10552 A / Ra',118,,
b'her / IP / TCP 20.42.65.89:https > 192.168.180.164:10552 A / Ra',118,,
b'her / IP / TCP 20.42.65.89:https > 192.168.180.164:10552 A / Ra',118,,
b'her / IP / TCP 20.42.65.89:https > 192.168.180.164:10552 PA / Ra',118,,
b'her / IP / TCP 20.42.65.89:https > 192.168.180.164:10552 PA / Ra',119,,
b'her / IP / TCP 20.42.65.89:https > 192.168.180.164:10552 ',119,,
b'her / IP / TCP 20.42.65.89:https > 192.168.180.164:10552 PA / Ra',119,,
b'her / IP / TCP 20.42.65.89:https > 192.168.180.164:10553 S',120,,
b'her / IP / TCP 20.42.65.89:https > 192.168.180.164:10553 A / Ra',120,,
b'her / IP / TCP 20.42.65.89:https > 192.168.180.164:10553 A / Ra',120,,
b'her / IP / TCP 20.42.65.89:https > 192.168.180.164:10553 A / Ra',120,,
b'her / IP / TCP 20.42.65.89:https > 192.168.180.164:10553 A / Ra',120,,
b'her / IP / TCP 20.42.65.89:https > 192.168.180.164:10553 PA / Ra',120,,
b'her / IP / TCP 20.42.65.89:https > 192.168.180.164:10553 PA / Ra',121,,
b'her / IP / TCP 192.168.180.164:10506 > 218.58.102.48:https A / Ra',121,,
b'her / IP / TCP 218.58.102.48:https > 192.168.180.164:10506 ',122,,
b'her / IP / TCP 192.168.180.164:6133 > 13.225.114.20:https F',123,,
b'her / IP / TCP 192.168.180.164:6133 > 13.225.114.20:https ',123,,
b'her / IP / TCP 13.225.114.20:https > 192.168.180.164:6133 F',124,,
b'her / IP / TCP 192.168.180.164:10507 > 218.58.102.48:https A / Ra',125,,
