srcip,dstip,sport,dport,proto,data
192.168.0.106,116.132.235.204,14826,80,6,"Ether / IP / TCP 192.168.0.106:14826 > 116.132.235.204:http FA"
192.168.0.106,192.168.0.1,58956,53,17,"Ether / IP / UDP / DNS Qry ""b'static-pcs-sdk-server.alibaba.com.'"" "
192.168.0.1,192.168.0.106,53,58956,17,"Ether / IP / UDP / DNS Ans ""116.132.235.204"" "
192.168.0.106,116.132.235.204,14835,80,6,"Ether / IP / TCP 192.168.0.106:14835 > 116.132.235.204:http S"
116.132.235.204,192.168.0.106,80,14835,6,"Ether / IP / TCP 116.132.235.204:http > 192.168.0.106:14835 SA"
192.168.0.106,116.132.235.204,14835,80,6,"Ether / IP / TCP 192.168.0.106:14835 > 116.132.235.204:http A"
192.168.0.106,116.132.235.204,14835,80,6,"Ether / IP / TCP 192.168.0.106:14835 > 116.132.235.204:http PA / Raw"
192.168.0.106,116.132.235.204,14835,80,6,"Ether / IP / TCP 192.168.0.106:14835 > 116.132.235.204:http A / Raw"
192.168.0.106,116.132.235.204,14835,80,6,"Ether / IP / TCP 192.168.0.106:14835 > 116.132.235.204:http A / Raw"
192.168.0.106,116.132.235.204,14835,80,6,"Ether / IP / TCP 192.168.0.106:14835 > 116.132.235.204:http PA / Raw"
116.132.235.204,192.168.0.106,80,14835,6,"Ether / IP / TCP 116.132.235.204:http > 192.168.0.106:14835 A"
116.132.235.204,192.168.0.106,80,14835,6,"Ether / IP / TCP 116.132.235.204:http > 192.168.0.106:14835 A"
116.132.235.204,192.168.0.106,80,14835,6,"Ether / IP / TCP 116.132.235.204:http > 192.168.0.106:14835 A"
116.132.235.204,192.168.0.106,80,14835,6,"Ether / IP / TCP 116.132.235.204:http > 192.168.0.106:14835 PA / Raw"
116.132.235.204,192.168.0.106,80,14835,6,"Ether / IP / TCP 116.132.235.204:http > 192.168.0.106:14835 FA"
192.168.0.106,116.132.235.204,14835,80,6,"Ether / IP / TCP 192.168.0.106:14835 > 116.132.235.204:http A"
192.168.0.106,116.132.235.204,14835,80,6,"Ether / IP / TCP 192.168.0.106:14835 > 116.132.235.204:http FA"
116.132.235.204,192.168.0.106,80,14835,6,"Ether / IP / TCP 116.132.235.204:http > 192.168.0.106:14835 A"
192.168.0.106,192.168.0.1,58956,53,17,"Ether / IP / UDP / DNS Qry ""b'static-pcs-sdk-server.alibaba.com.'"" "
192.168.0.106,192.168.0.1,58956,53,17,"Ether / IP / UDP / DNS Qry ""b'static-pcs-sdk-server.alibaba.com.'"" "
192.168.0.1,192.168.0.106,53,58956,17,"Ether / IP / UDP / DNS Ans ""116.132.235.204"" "
192.168.0.1,192.168.0.106,53,58956,17,"Ether / IP / UDP / DNS Ans ""116.132.235.204"" "
192.168.0.106,116.132.235.204,14836,80,6,"Ether / IP / TCP 192.168.0.106:14836 > 116.132.235.204:http S"
116.132.235.204,192.168.0.106,80,14836,6,"Ether / IP / TCP 116.132.235.204:http > 192.168.0.106:14836 SA"
192.168.0.106,116.132.235.204,14836,80,6,"Ether / IP / TCP 192.168.0.106:14836 > 116.132.235.204:http A"
192.168.0.106,116.132.235.204,14836,80,6,"Ether / IP / TCP 192.168.0.106:14836 > 116.132.235.204:http PA / Raw"
192.168.0.106,116.132.235.204,14836,80,6,"Ether / IP / TCP 192.168.0.106:14836 > 116.132.235.204:http A / Raw"
192.168.0.106,116.132.235.204,14836,80,6,"Ether / IP / TCP 192.168.0.106:14836 > 116.132.235.204:http A / Raw"
192.168.0.106,116.132.235.204,14836,80,6,"Ether / IP / TCP 192.168.0.106:14836 > 116.132.235.204:http PA / Raw"
116.132.235.204,192.168.0.106,80,14836,6,"Ether / IP / TCP 116.132.235.204:http > 192.168.0.106:14836 A"
116.132.235.204,192.168.0.106,80,14836,6,"Ether / IP / TCP 116.132.235.204:http > 192.168.0.106:14836 A"
116.132.235.204,192.168.0.106,80,14836,6,"Ether / IP / TCP 116.132.235.204:http > 192.168.0.106:14836 A"
116.132.235.204,192.168.0.106,80,14836,6,"Ether / IP / TCP 116.132.235.204:http > 192.168.0.106:14836 PA / Raw"
116.132.235.204,192.168.0.106,80,14836,6,"Ether / IP / TCP 116.132.235.204:http > 192.168.0.106:14836 FA"
192.168.0.106,116.132.235.204,14836,80,6,"Ether / IP / TCP 192.168.0.106:14836 > 116.132.235.204:http A"
192.168.0.106,116.132.235.204,14836,80,6,"Ether / IP / TCP 192.168.0.106:14836 > 116.132.235.204:http FA"
192.168.0.106,192.168.0.1,61047,53,17,"Ether / IP / UDP / DNS Qry ""b'www.google-analytics.com.'"" "
192.168.0.106,192.168.0.1,51273,53,17,"Ether / IP / UDP / DNS Qry ""b'hm.baidu.com.'"" "
192.168.0.106,192.168.0.1,51273,53,17,"Ether / IP / UDP / DNS Qry ""b'hm.baidu.com.'"" "
192.168.0.106,192.168.0.1,61047,53,17,"Ether / IP / UDP / DNS Qry ""b'www.google-analytics.com.'"" "
192.168.0.106,116.132.235.204,14836,80,6,"Ether / IP / TCP 192.168.0.106:14836 > 116.132.235.204:http FA"
192.168.0.1,192.168.0.106,53,61047,17,"Ether / IP / UDP / DNS Ans ""203.208.50.97"" "
192.168.0.1,192.168.0.106,53,51273,17,"Ether / IP / UDP / DNS Ans ""b'hm.e.shifen.com.'"" "
192.168.0.106,203.208.50.97,14837,443,6,"Ether / IP / TCP 192.168.0.106:14837 > 203.208.50.97:https S"
192.168.0.106,111.206.209.249,14838,443,6,"Ether / IP / TCP 192.168.0.106:14838 > 111.206.209.249:https S"
203.208.50.97,192.168.0.106,443,14837,6,"Ether / IP / TCP 203.208.50.97:https > 192.168.0.106:14837 SA"
111.206.209.249,192.168.0.106,443,14838,6,"Ether / IP / TCP 111.206.209.249:https > 192.168.0.106:14838 SA"
192.168.0.106,203.208.50.97,14837,443,6,"Ether / IP / TCP 192.168.0.106:14837 > 203.208.50.97:https A"
192.168.0.106,111.206.209.249,14838,443,6,"Ether / IP / TCP 192.168.0.106:14838 > 111.206.209.249:https A"
192.168.0.106,203.208.50.97,14837,443,6,"Ether / IP / TCP 192.168.0.106:14837 > 203.208.50.97:https PA / Raw"
192.168.0.106,111.206.209.249,14838,443,6,"Ether / IP / TCP 192.168.0.106:14838 > 111.206.209.249:https PA / Raw"
203.208.50.97,192.168.0.106,443,14837,6,"Ether / IP / TCP 203.208.50.97:https > 192.168.0.106:14837 A"
111.206.209.249,192.168.0.106,443,14838,6,"Ether / IP / TCP 111.206.209.249:https > 192.168.0.106:14838 A"
111.206.209.249,192.168.0.106,443,14838,6,"Ether / IP / TCP 111.206.209.249:https > 192.168.0.106:14838 PA / Raw"
203.208.50.97,192.168.0.106,443,14837,6,"Ether / IP / TCP 203.208.50.97:https > 192.168.0.106:14837 PA / Raw"
192.168.0.106,111.206.209.249,14838,443,6,"Ether / IP / TCP 192.168.0.106:14838 > 111.206.209.249:https PA / Raw"
192.168.0.106,203.208.50.97,14837,443,6,"Ether / IP / TCP 192.168.0.106:14837 > 203.208.50.97:https PA / Raw"
192.168.0.106,111.206.209.249,14838,443,6,"Ether / IP / TCP 192.168.0.106:14838 > 111.206.209.249:https PA / Raw"
192.168.0.106,203.208.50.97,14837,443,6,"Ether / IP / TCP 192.168.0.106:14837 > 203.208.50.97:https PA / Raw"
192.168.0.106,203.208.50.97,14837,443,6,"Ether / IP / TCP 192.168.0.106:14837 > 203.208.50.97:https PA / Raw"
203.208.50.97,192.168.0.106,443,14837,6,"Ether / IP / TCP 203.208.50.97:https > 192.168.0.106:14837 PA / Raw"
203.208.50.97,192.168.0.106,443,14837,6,"Ether / IP / TCP 203.208.50.97:https > 192.168.0.106:14837 PA / Raw"
203.208.50.97,192.168.0.106,443,14837,6,"Ether / IP / TCP 203.208.50.97:https > 192.168.0.106:14837 PA / Raw"
203.208.50.97,192.168.0.106,443,14837,6,"Ether / IP / TCP 203.208.50.97:https > 192.168.0.106:14837 PA / Raw"
203.208.50.97,192.168.0.106,443,14837,6,"Ether / IP / TCP 203.208.50.97:https > 192.168.0.106:14837 PA / Raw"
203.208.50.97,192.168.0.106,443,14837,6,"Ether / IP / TCP 203.208.50.97:https > 192.168.0.106:14837 PA / Raw"
157.148.62.149,192.168.0.106,443,9708,6,"Ether / IP / TCP 157.148.62.149:https > 192.168.0.106:9708 PA / Raw"
111.206.209.249,192.168.0.106,443,14838,6,"Ether / IP / TCP 111.206.209.249:https > 192.168.0.106:14838 PA / Raw"
192.168.0.106,203.208.50.97,14837,443,6,"Ether / IP / TCP 192.168.0.106:14837 > 203.208.50.97:https A"
192.168.0.106,203.208.50.97,14837,443,6,"Ether / IP / TCP 192.168.0.106:14837 > 203.208.50.97:https PA / Raw"
192.168.0.106,203.208.50.97,14837,443,6,"Ether / IP / TCP 192.168.0.106:14837 > 203.208.50.97:https PA / Raw"
192.168.0.106,157.148.62.149,9708,443,6,"Ether / IP / TCP 192.168.0.106:9708 > 157.148.62.149:https PA / Raw"
203.208.50.97,192.168.0.106,443,14837,6,"Ether / IP / TCP 203.208.50.97:https > 192.168.0.106:14837 A"
192.168.0.106,111.206.209.249,14838,443,6,"Ether / IP / TCP 192.168.0.106:14838 > 111.206.209.249:https A"
157.148.62.149,192.168.0.106,443,9708,6,"Ether / IP / TCP 157.148.62.149:https > 192.168.0.106:9708 PA / Raw"
192.168.0.106,157.148.62.149,9708,443,6,"Ether / IP / TCP 192.168.0.106:9708 > 157.148.62.149:https A"
192.168.0.106,116.132.235.204,14836,80,6,"Ether / IP / TCP 192.168.0.106:14836 > 116.132.235.204:http FA"
192.168.0.106,192.168.0.1,53202,53,17,"Ether / IP / UDP / DNS Qry ""b'static-pcs-sdk-server.alibaba.com.'"" "
192.168.0.1,192.168.0.106,53,53202,17,"Ether / IP / UDP / DNS Ans ""116.132.235.204"" "
192.168.0.106,111.206.209.249,14838,443,6,"Ether / IP / TCP 192.168.0.106:14838 > 111.206.209.249:https FA"
192.168.0.106,60.28.198.86,9711,443,6,"Ether / IP / TCP 192.168.0.106:9711 > 60.28.198.86:https FA"
192.168.0.106,203.208.50.97,14837,443,6,"Ether / IP / TCP 192.168.0.106:14837 > 203.208.50.97:https FA"
203.208.50.97,192.168.0.106,443,14837,6,"Ether / IP / TCP 203.208.50.97:https > 192.168.0.106:14837 FA"
192.168.0.106,203.208.50.97,14837,443,6,"Ether / IP / TCP 192.168.0.106:14837 > 203.208.50.97:https A"
111.206.209.249,192.168.0.106,443,14838,6,"Ether / IP / TCP 111.206.209.249:https > 192.168.0.106:14838 A"
111.206.209.249,192.168.0.106,443,14838,6,"Ether / IP / TCP 111.206.209.249:https > 192.168.0.106:14838 PA / Raw"
111.206.209.249,192.168.0.106,443,14838,6,"Ether / IP / TCP 111.206.209.249:https > 192.168.0.106:14838 FA"
192.168.0.106,111.206.209.249,14838,443,6,"Ether / IP / TCP 192.168.0.106:14838 > 111.206.209.249:https RA"
60.28.198.86,192.168.0.106,443,9711,6,"Ether / IP / TCP 60.28.198.86:https > 192.168.0.106:9711 FA"
192.168.0.106,60.28.198.86,9711,443,6,"Ether / IP / TCP 192.168.0.106:9711 > 60.28.198.86:https A"
192.168.0.106,116.132.235.204,14839,80,6,"Ether / IP / TCP 192.168.0.106:14839 > 116.132.235.204:http S"
116.132.235.204,192.168.0.106,80,14839,6,"Ether / IP / TCP 116.132.235.204:http > 192.168.0.106:14839 SA"
192.168.0.106,116.132.235.204,14839,80,6,"Ether / IP / TCP 192.168.0.106:14839 > 116.132.235.204:http A"
192.168.0.106,116.132.235.204,14839,80,6,"Ether / IP / TCP 192.168.0.106:14839 > 116.132.235.204:http PA / Raw"
116.132.235.204,192.168.0.106,80,14839,6,"Ether / IP / TCP 116.132.235.204:http > 192.168.0.106:14839 A"
192.168.0.106,116.132.235.204,14839,80,6,"Ether / IP / TCP 192.168.0.106:14839 > 116.132.235.204:http A / Raw"
192.168.0.106,116.132.235.204,14839,80,6,"Ether / IP / TCP 192.168.0.106:14839 > 116.132.235.204:http A / Raw"
192.168.0.106,116.132.235.204,14839,80,6,"Ether / IP / TCP 192.168.0.106:14839 > 116.132.235.204:http PA / Raw"
116.132.235.204,192.168.0.106,80,14839,6,"Ether / IP / TCP 116.132.235.204:http > 192.168.0.106:14839 A"
116.132.235.204,192.168.0.106,80,14839,6,"Ether / IP / TCP 116.132.235.204:http > 192.168.0.106:14839 A"
116.132.235.204,192.168.0.106,80,14839,6,"Ether / IP / TCP 116.132.235.204:http > 192.168.0.106:14839 PA / Raw"
116.132.235.204,192.168.0.106,80,14839,6,"Ether / IP / TCP 116.132.235.204:http > 192.168.0.106:14839 FA"
192.168.0.106,116.132.235.204,14839,80,6,"Ether / IP / TCP 192.168.0.106:14839 > 116.132.235.204:http A"
192.168.0.106,116.132.235.204,14839,80,6,"Ether / IP / TCP 192.168.0.106:14839 > 116.132.235.204:http FA"
116.132.235.204,192.168.0.106,80,14839,6,"Ether / IP / TCP 116.132.235.204:http > 192.168.0.106:14839 A"
192.168.0.106,192.168.0.1,53202,53,17,"Ether / IP / UDP / DNS Qry ""b'static-pcs-sdk-server.alibaba.com.'"" "
192.168.0.1,192.168.0.106,53,53202,17,"Ether / IP / UDP / DNS Ans ""116.132.235.204"" "
192.168.0.106,116.132.235.204,14840,80,6,"Ether / IP / TCP 192.168.0.106:14840 > 116.132.235.204:http S"
116.132.235.204,192.168.0.106,80,14840,6,"Ether / IP / TCP 116.132.235.204:http > 192.168.0.106:14840 SA"
192.168.0.106,116.132.235.204,14840,80,6,"Ether / IP / TCP 192.168.0.106:14840 > 116.132.235.204:http A"
192.168.0.106,116.132.235.204,14840,80,6,"Ether / IP / TCP 192.168.0.106:14840 > 116.132.235.204:http PA / Raw"
192.168.0.106,116.132.235.204,14840,80,6,"Ether / IP / TCP 192.168.0.106:14840 > 116.132.235.204:http A / Raw"
192.168.0.106,116.132.235.204,14840,80,6,"Ether / IP / TCP 192.168.0.106:14840 > 116.132.235.204:http A / Raw"
192.168.0.106,116.132.235.204,14840,80,6,"Ether / IP / TCP 192.168.0.106:14840 > 116.132.235.204:http PA / Raw"
192.168.0.106,116.132.235.204,14836,80,6,"Ether / IP / TCP 192.168.0.106:14836 > 116.132.235.204:http FA"
116.132.235.204,192.168.0.106,80,14840,6,"Ether / IP / TCP 116.132.235.204:http > 192.168.0.106:14840 A"
116.132.235.204,192.168.0.106,80,14840,6,"Ether / IP / TCP 116.132.235.204:http > 192.168.0.106:14840 A"
116.132.235.204,192.168.0.106,80,14840,6,"Ether / IP / TCP 116.132.235.204:http > 192.168.0.106:14840 PA / Raw"
116.132.235.204,192.168.0.106,80,14840,6,"Ether / IP / TCP 116.132.235.204:http > 192.168.0.106:14840 FA"
192.168.0.106,116.132.235.204,14840,80,6,"Ether / IP / TCP 192.168.0.106:14840 > 116.132.235.204:http A"
192.168.0.106,116.132.235.204,14840,80,6,"Ether / IP / TCP 192.168.0.106:14840 > 116.132.235.204:http FA"
192.168.0.106,116.132.235.204,14840,80,6,"Ether / IP / TCP 192.168.0.106:14840 > 116.132.235.204:http FA"
192.168.0.106,116.132.235.204,14840,80,6,"Ether / IP / TCP 192.168.0.106:14840 > 116.132.235.204:http FA"
192.168.0.106,192.168.0.1,53202,53,17,"Ether / IP / UDP / DNS Qry ""b'static-pcs-sdk-server.alibaba.com.'"" "
192.168.0.1,192.168.0.106,53,53202,17,"Ether / IP / UDP / DNS Ans ""116.132.235.204"" "
192.168.0.106,116.132.235.204,14841,80,6,"Ether / IP / TCP 192.168.0.106:14841 > 116.132.235.204:http S"
116.132.235.204,192.168.0.106,80,14841,6,"Ether / IP / TCP 116.132.235.204:http > 192.168.0.106:14841 SA"
192.168.0.106,116.132.235.204,14841,80,6,"Ether / IP / TCP 192.168.0.106:14841 > 116.132.235.204:http A"
192.168.0.106,116.132.235.204,14841,80,6,"Ether / IP / TCP 192.168.0.106:14841 > 116.132.235.204:http PA / Raw"
192.168.0.106,116.132.235.204,14841,80,6,"Ether / IP / TCP 192.168.0.106:14841 > 116.132.235.204:http A / Raw"
192.168.0.106,116.132.235.204,14841,80,6,"Ether / IP / TCP 192.168.0.106:14841 > 116.132.235.204:http A / Raw"
192.168.0.106,116.132.235.204,14841,80,6,"Ether / IP / TCP 192.168.0.106:14841 > 116.132.235.204:http PA / Raw"
116.132.235.204,192.168.0.106,80,14841,6,"Ether / IP / TCP 116.132.235.204:http > 192.168.0.106:14841 A"
116.132.235.204,192.168.0.106,80,14841,6,"Ether / IP / TCP 116.132.235.204:http > 192.168.0.106:14841 A"
116.132.235.204,192.168.0.106,80,14841,6,"Ether / IP / TCP 116.132.235.204:http > 192.168.0.106:14841 A"
116.132.235.204,192.168.0.106,80,14841,6,"Ether / IP / TCP 116.132.235.204:http > 192.168.0.106:14841 PA / Raw"
116.132.235.204,192.168.0.106,80,14841,6,"Ether / IP / TCP 116.132.235.204:http > 192.168.0.106:14841 FA"
192.168.0.106,116.132.235.204,14841,80,6,"Ether / IP / TCP 192.168.0.106:14841 > 116.132.235.204:http A"
192.168.0.106,116.132.235.204,14841,80,6,"Ether / IP / TCP 192.168.0.106:14841 > 116.132.235.204:http FA"
116.132.235.204,192.168.0.106,80,14841,6,"Ether / IP / TCP 116.132.235.204:http > 192.168.0.106:14841 A"
157.148.62.149,192.168.0.106,443,9708,6,"Ether / IP / TCP 157.148.62.149:https > 192.168.0.106:9708 PA / Raw"
192.168.0.106,157.148.62.149,9708,443,6,"Ether / IP / TCP 192.168.0.106:9708 > 157.148.62.149:https PA / Raw"
157.148.62.149,192.168.0.106,443,9708,6,"Ether / IP / TCP 157.148.62.149:https > 192.168.0.106:9708 PA / Raw"
192.168.0.106,157.148.62.149,9708,443,6,"Ether / IP / TCP 192.168.0.106:9708 > 157.148.62.149:https A"
157.148.62.149,192.168.0.106,443,9708,6,"Ether / IP / TCP 157.148.62.149:https > 192.168.0.106:9708 PA / Raw"
192.168.0.106,157.148.62.149,9708,443,6,"Ether / IP / TCP 192.168.0.106:9708 > 157.148.62.149:https PA / Raw"
157.148.62.149,192.168.0.106,443,9708,6,"Ether / IP / TCP 157.148.62.149:https > 192.168.0.106:9708 PA / Raw"
192.168.0.106,157.148.62.149,9708,443,6,"Ether / IP / TCP 192.168.0.106:9708 > 157.148.62.149:https A"
157.148.62.149,192.168.0.106,443,9708,6,"Ether / IP / TCP 157.148.62.149:https > 192.168.0.106:9708 PA / Raw"
192.168.0.106,157.148.62.149,9708,443,6,"Ether / IP / TCP 192.168.0.106:9708 > 157.148.62.149:https PA / Raw"
157.148.62.149,192.168.0.106,443,9708,6,"Ether / IP / TCP 157.148.62.149:https > 192.168.0.106:9708 PA / Raw"
192.168.0.106,157.148.62.149,9708,443,6,"Ether / IP / TCP 192.168.0.106:9708 > 157.148.62.149:https A"
192.168.0.106,116.132.235.204,14840,80,6,"Ether / IP / TCP 192.168.0.106:14840 > 116.132.235.204:http FA"
192.168.0.106,192.168.0.1,53202,53,17,"Ether / IP / UDP / DNS Qry ""b'static-pcs-sdk-server.alibaba.com.'"" "
192.168.0.1,192.168.0.106,53,53202,17,"Ether / IP / UDP / DNS Ans ""116.132.235.204"" "
192.168.0.106,116.132.235.204,14842,80,6,"Ether / IP / TCP 192.168.0.106:14842 > 116.132.235.204:http S"
116.132.235.204,192.168.0.106,80,14842,6,"Ether / IP / TCP 116.132.235.204:http > 192.168.0.106:14842 SA"
192.168.0.106,116.132.235.204,14842,80,6,"Ether / IP / TCP 192.168.0.106:14842 > 116.132.235.204:http A"
192.168.0.106,116.132.235.204,14842,80,6,"Ether / IP / TCP 192.168.0.106:14842 > 116.132.235.204:http PA / Raw"
192.168.0.106,116.132.235.204,14842,80,6,"Ether / IP / TCP 192.168.0.106:14842 > 116.132.235.204:http A / Raw"
192.168.0.106,116.132.235.204,14842,80,6,"Ether / IP / TCP 192.168.0.106:14842 > 116.132.235.204:http A / Raw"
192.168.0.106,116.132.235.204,14842,80,6,"Ether / IP / TCP 192.168.0.106:14842 > 116.132.235.204:http PA / Raw"
116.132.235.204,192.168.0.106,80,14842,6,"Ether / IP / TCP 116.132.235.204:http > 192.168.0.106:14842 A"
116.132.235.204,192.168.0.106,80,14842,6,"Ether / IP / TCP 116.132.235.204:http > 192.168.0.106:14842 A"
116.132.235.204,192.168.0.106,80,14842,6,"Ether / IP / TCP 116.132.235.204:http > 192.168.0.106:14842 A"
116.132.235.204,192.168.0.106,80,14842,6,"Ether / IP / TCP 116.132.235.204:http > 192.168.0.106:14842 PA / Raw"
116.132.235.204,192.168.0.106,80,14842,6,"Ether / IP / TCP 116.132.235.204:http > 192.168.0.106:14842 FA"
192.168.0.106,116.132.235.204,14842,80,6,"Ether / IP / TCP 192.168.0.106:14842 > 116.132.235.204:http A"
192.168.0.106,116.132.235.204,14842,80,6,"Ether / IP / TCP 192.168.0.106:14842 > 116.132.235.204:http FA"
116.132.235.204,192.168.0.106,80,14842,6,"Ether / IP / TCP 116.132.235.204:http > 192.168.0.106:14842 A"
192.168.0.106,192.168.0.1,53202,53,17,"Ether / IP / UDP / DNS Qry ""b'static-pcs-sdk-server.alibaba.com.'"" "
192.168.0.1,192.168.0.106,53,53202,17,"Ether / IP / UDP / DNS Ans ""116.132.235.204"" "
192.168.0.106,116.132.235.204,14843,80,6,"Ether / IP / TCP 192.168.0.106:14843 > 116.132.235.204:http S"
192.168.0.106,116.132.235.204,14836,80,6,"Ether / IP / TCP 192.168.0.106:14836 > 116.132.235.204:http FA"
116.132.235.204,192.168.0.106,80,14843,6,"Ether / IP / TCP 116.132.235.204:http > 192.168.0.106:14843 SA"
192.168.0.106,116.132.235.204,14843,80,6,"Ether / IP / TCP 192.168.0.106:14843 > 116.132.235.204:http A"
192.168.0.106,116.132.235.204,14843,80,6,"Ether / IP / TCP 192.168.0.106:14843 > 116.132.235.204:http PA / Raw"
192.168.0.106,116.132.235.204,14843,80,6,"Ether / IP / TCP 192.168.0.106:14843 > 116.132.235.204:http A / Raw"
192.168.0.106,116.132.235.204,14843,80,6,"Ether / IP / TCP 192.168.0.106:14843 > 116.132.235.204:http A / Raw"
192.168.0.106,116.132.235.204,14843,80,6,"Ether / IP / TCP 192.168.0.106:14843 > 116.132.235.204:http PA / Raw"
116.132.235.204,192.168.0.106,80,14843,6,"Ether / IP / TCP 116.132.235.204:http > 192.168.0.106:14843 A"
116.132.235.204,192.168.0.106,80,14843,6,"Ether / IP / TCP 116.132.235.204:http > 192.168.0.106:14843 A"
116.132.235.204,192.168.0.106,80,14843,6,"Ether / IP / TCP 116.132.235.204:http > 192.168.0.106:14843 A"
116.132.235.204,192.168.0.106,80,14843,6,"Ether / IP / TCP 116.132.235.204:http > 192.168.0.106:14843 PA / Raw"
116.132.235.204,192.168.0.106,80,14843,6,"Ether / IP / TCP 116.132.235.204:http > 192.168.0.106:14843 FA"
192.168.0.106,116.132.235.204,14843,80,6,"Ether / IP / TCP 192.168.0.106:14843 > 116.132.235.204:http A"
192.168.0.106,116.132.235.204,14843,80,6,"Ether / IP / TCP 192.168.0.106:14843 > 116.132.235.204:http FA"
116.132.235.204,192.168.0.106,80,14843,6,"Ether / IP / TCP 116.132.235.204:http > 192.168.0.106:14843 A"
192.168.0.106,13.107.43.12,12204,443,6,"Ether / IP / TCP 192.168.0.106:12204 > 13.107.43.12:https PA / Raw"
192.168.0.106,13.107.43.12,12204,443,6,"Ether / IP / TCP 192.168.0.106:12204 > 13.107.43.12:https PA / Raw"
13.107.43.12,192.168.0.106,443,12204,6,"Ether / IP / TCP 13.107.43.12:https > 192.168.0.106:12204 A / Padding"
13.107.43.12,192.168.0.106,443,12204,6,"Ether / IP / TCP 13.107.43.12:https > 192.168.0.106:12204 A / Padding"
13.107.43.12,192.168.0.106,443,12204,6,"Ether / IP / TCP 13.107.43.12:https > 192.168.0.106:12204 PA / Raw"
13.107.43.12,192.168.0.106,443,12204,6,"Ether / IP / TCP 13.107.43.12:https > 192.168.0.106:12204 PA / Raw"
192.168.0.106,13.107.43.12,12204,443,6,"Ether / IP / TCP 192.168.0.106:12204 > 13.107.43.12:https A"
192.168.0.106,192.168.0.1,53202,53,17,"Ether / IP / UDP / DNS Qry ""b'static-pcs-sdk-server.alibaba.com.'"" "
192.168.0.1,192.168.0.106,53,53202,17,"Ether / IP / UDP / DNS Ans ""116.132.235.204"" "
192.168.0.106,116.132.235.204,14844,80,6,"Ether / IP / TCP 192.168.0.106:14844 > 116.132.235.204:http S"
116.132.235.204,192.168.0.106,80,14844,6,"Ether / IP / TCP 116.132.235.204:http > 192.168.0.106:14844 SA"
192.168.0.106,116.132.235.204,14844,80,6,"Ether / IP / TCP 192.168.0.106:14844 > 116.132.235.204:http A"
192.168.0.106,116.132.235.204,14844,80,6,"Ether / IP / TCP 192.168.0.106:14844 > 116.132.235.204:http PA / Raw"
192.168.0.106,116.132.235.204,14844,80,6,"Ether / IP / TCP 192.168.0.106:14844 > 116.132.235.204:http A / Raw"
192.168.0.106,116.132.235.204,14844,80,6,"Ether / IP / TCP 192.168.0.106:14844 > 116.132.235.204:http A / Raw"
192.168.0.106,116.132.235.204,14844,80,6,"Ether / IP / TCP 192.168.0.106:14844 > 116.132.235.204:http PA / Raw"
116.132.235.204,192.168.0.106,80,14844,6,"Ether / IP / TCP 116.132.235.204:http > 192.168.0.106:14844 A"
116.132.235.204,192.168.0.106,80,14844,6,"Ether / IP / TCP 116.132.235.204:http > 192.168.0.106:14844 A"
116.132.235.204,192.168.0.106,80,14844,6,"Ether / IP / TCP 116.132.235.204:http > 192.168.0.106:14844 PA / Raw"
116.132.235.204,192.168.0.106,80,14844,6,"Ether / IP / TCP 116.132.235.204:http > 192.168.0.106:14844 FA"
192.168.0.106,116.132.235.204,14844,80,6,"Ether / IP / TCP 192.168.0.106:14844 > 116.132.235.204:http A"
192.168.0.106,116.132.235.204,14844,80,6,"Ether / IP / TCP 192.168.0.106:14844 > 116.132.235.204:http FA"
116.132.235.204,192.168.0.106,80,14844,6,"Ether / IP / TCP 116.132.235.204:http > 192.168.0.106:14844 A"
192.168.0.106,116.132.235.204,14840,80,6,"Ether / IP / TCP 192.168.0.106:14840 > 116.132.235.204:http FA"
192.168.0.106,192.168.0.1,53202,53,17,"Ether / IP / UDP / DNS Qry ""b'static-pcs-sdk-server.alibaba.com.'"" "
192.168.0.1,192.168.0.106,53,53202,17,"Ether / IP / UDP / DNS Ans ""116.132.235.204"" "
192.168.0.106,116.132.235.204,14845,80,6,"Ether / IP / TCP 192.168.0.106:14845 > 116.132.235.204:http S"
116.132.235.204,192.168.0.106,80,14845,6,"Ether / IP / TCP 116.132.235.204:http > 192.168.0.106:14845 SA"
192.168.0.106,116.132.235.204,14845,80,6,"Ether / IP / TCP 192.168.0.106:14845 > 116.132.235.204:http A"
192.168.0.106,116.132.235.204,14845,80,6,"Ether / IP / TCP 192.168.0.106:14845 > 116.132.235.204:http PA / Raw"
192.168.0.106,116.132.235.204,14845,80,6,"Ether / IP / TCP 192.168.0.106:14845 > 116.132.235.204:http A / Raw"
192.168.0.106,116.132.235.204,14845,80,6,"Ether / IP / TCP 192.168.0.106:14845 > 116.132.235.204:http A / Raw"
192.168.0.106,116.132.235.204,14845,80,6,"Ether / IP / TCP 192.168.0.106:14845 > 116.132.235.204:http PA / Raw"
116.132.235.204,192.168.0.106,80,14845,6,"Ether / IP / TCP 116.132.235.204:http > 192.168.0.106:14845 A"
116.132.235.204,192.168.0.106,80,14845,6,"Ether / IP / TCP 116.132.235.204:http > 192.168.0.106:14845 A"
116.132.235.204,192.168.0.106,80,14845,6,"Ether / IP / TCP 116.132.235.204:http > 192.168.0.106:14845 A"
116.132.235.204,192.168.0.106,80,14845,6,"Ether / IP / TCP 116.132.235.204:http > 192.168.0.106:14845 PA / Raw"
116.132.235.204,192.168.0.106,80,14845,6,"Ether / IP / TCP 116.132.235.204:http > 192.168.0.106:14845 FA"
192.168.0.106,116.132.235.204,14845,80,6,"Ether / IP / TCP 192.168.0.106:14845 > 116.132.235.204:http A"
192.168.0.106,116.132.235.204,14845,80,6,"Ether / IP / TCP 192.168.0.106:14845 > 116.132.235.204:http FA"
116.132.235.204,192.168.0.106,80,14845,6,"Ether / IP / TCP 116.132.235.204:http > 192.168.0.106:14845 A"
119.3.227.186,192.168.0.106,11113,13060,6,"Ether / IP / TCP 119.3.227.186:11113 > 192.168.0.106:13060 A / Padding"
192.168.0.106,119.3.227.186,13060,11113,6,"Ether / IP / TCP 192.168.0.106:13060 > 119.3.227.186:11113 A"
192.168.0.106,110.242.68.3,14846,80,6,"Ether / IP / TCP 192.168.0.106:14846 > 110.242.68.3:http S"
110.242.68.3,192.168.0.106,80,14846,6,"Ether / IP / TCP 110.242.68.3:http > 192.168.0.106:14846 SA"
192.168.0.106,110.242.68.3,14846,80,6,"Ether / IP / TCP 192.168.0.106:14846 > 110.242.68.3:http A"
192.168.0.106,110.242.68.3,14846,80,6,"Ether / IP / TCP 192.168.0.106:14846 > 110.242.68.3:http FA"
110.242.68.3,192.168.0.106,80,14846,6,"Ether / IP / TCP 110.242.68.3:http > 192.168.0.106:14846 A"
110.242.68.3,192.168.0.106,80,14846,6,"Ether / IP / TCP 110.242.68.3:http > 192.168.0.106:14846 FA"
192.168.0.106,110.242.68.3,14846,80,6,"Ether / IP / TCP 192.168.0.106:14846 > 110.242.68.3:http A"
192.168.0.106,192.168.0.1,53202,53,17,"Ether / IP / UDP / DNS Qry ""b'static-pcs-sdk-server.alibaba.com.'"" "
192.168.0.1,192.168.0.106,53,53202,17,"Ether / IP / UDP / DNS Ans ""116.132.235.204"" "
192.168.0.106,116.132.235.204,14847,80,6,"Ether / IP / TCP 192.168.0.106:14847 > 116.132.235.204:http S"
116.132.235.204,192.168.0.106,80,14847,6,"Ether / IP / TCP 116.132.235.204:http > 192.168.0.106:14847 SA"
192.168.0.106,116.132.235.204,14847,80,6,"Ether / IP / TCP 192.168.0.106:14847 > 116.132.235.204:http A"
192.168.0.106,116.132.235.204,14847,80,6,"Ether / IP / TCP 192.168.0.106:14847 > 116.132.235.204:http PA / Raw"
192.168.0.106,116.132.235.204,14847,80,6,"Ether / IP / TCP 192.168.0.106:14847 > 116.132.235.204:http A / Raw"
192.168.0.106,116.132.235.204,14847,80,6,"Ether / IP / TCP 192.168.0.106:14847 > 116.132.235.204:http A / Raw"
192.168.0.106,116.132.235.204,14847,80,6,"Ether / IP / TCP 192.168.0.106:14847 > 116.132.235.204:http PA / Raw"
116.132.235.204,192.168.0.106,80,14847,6,"Ether / IP / TCP 116.132.235.204:http > 192.168.0.106:14847 A"
116.132.235.204,192.168.0.106,80,14847,6,"Ether / IP / TCP 116.132.235.204:http > 192.168.0.106:14847 A"
116.132.235.204,192.168.0.106,80,14847,6,"Ether / IP / TCP 116.132.235.204:http > 192.168.0.106:14847 A"
116.132.235.204,192.168.0.106,80,14847,6,"Ether / IP / TCP 116.132.235.204:http > 192.168.0.106:14847 PA / Raw"
116.132.235.204,192.168.0.106,80,14847,6,"Ether / IP / TCP 116.132.235.204:http > 192.168.0.106:14847 FA"
192.168.0.106,116.132.235.204,14847,80,6,"Ether / IP / TCP 192.168.0.106:14847 > 116.132.235.204:http A"
192.168.0.106,116.132.235.204,14847,80,6,"Ether / IP / TCP 192.168.0.106:14847 > 116.132.235.204:http FA"
116.132.235.204,192.168.0.106,80,14847,6,"Ether / IP / TCP 116.132.235.204:http > 192.168.0.106:14847 A"
192.168.0.106,192.168.0.1,53202,53,17,"Ether / IP / UDP / DNS Qry ""b'static-pcs-sdk-server.alibaba.com.'"" "
192.168.0.1,192.168.0.106,53,53202,17,"Ether / IP / UDP / DNS Ans ""116.132.235.204"" "
192.168.0.106,116.132.235.204,14848,80,6,"Ether / IP / TCP 192.168.0.106:14848 > 116.132.235.204:http S"
116.132.235.204,192.168.0.106,80,14848,6,"Ether / IP / TCP 116.132.235.204:http > 192.168.0.106:14848 SA"
192.168.0.106,116.132.235.204,14848,80,6,"Ether / IP / TCP 192.168.0.106:14848 > 116.132.235.204:http A"
192.168.0.106,116.132.235.204,14848,80,6,"Ether / IP / TCP 192.168.0.106:14848 > 116.132.235.204:http PA / Raw"
192.168.0.106,116.132.235.204,14848,80,6,"Ether / IP / TCP 192.168.0.106:14848 > 116.132.235.204:http A / Raw"
192.168.0.106,116.132.235.204,14848,80,6,"Ether / IP / TCP 192.168.0.106:14848 > 116.132.235.204:http A / Raw"
192.168.0.106,116.132.235.204,14848,80,6,"Ether / IP / TCP 192.168.0.106:14848 > 116.132.235.204:http PA / Raw"
116.132.235.204,192.168.0.106,80,14848,6,"Ether / IP / TCP 116.132.235.204:http > 192.168.0.106:14848 A"
116.132.235.204,192.168.0.106,80,14848,6,"Ether / IP / TCP 116.132.235.204:http > 192.168.0.106:14848 A"
116.132.235.204,192.168.0.106,80,14848,6,"Ether / IP / TCP 116.132.235.204:http > 192.168.0.106:14848 A"
116.132.235.204,192.168.0.106,80,14848,6,"Ether / IP / TCP 116.132.235.204:http > 192.168.0.106:14848 PA / Raw"
116.132.235.204,192.168.0.106,80,14848,6,"Ether / IP / TCP 116.132.235.204:http > 192.168.0.106:14848 FA"
192.168.0.106,116.132.235.204,14848,80,6,"Ether / IP / TCP 192.168.0.106:14848 > 116.132.235.204:http A"
192.168.0.106,116.132.235.204,14848,80,6,"Ether / IP / TCP 192.168.0.106:14848 > 116.132.235.204:http FA"
116.132.235.204,192.168.0.106,80,14848,6,"Ether / IP / TCP 116.132.235.204:http > 192.168.0.106:14848 A"
192.168.0.106,116.132.235.204,14826,80,6,"Ether / IP / TCP 192.168.0.106:14826 > 116.132.235.204:http RA"
192.168.0.106,123.151.54.161,1963,80,6,"Ether / IP / TCP 192.168.0.106:1963 > 123.151.54.161:http PA / Raw"
192.168.0.106,192.168.0.1,53202,53,17,"Ether / IP / UDP / DNS Qry ""b'pub.idqqimg.com.'"" "
192.168.0.1,192.168.0.106,53,53202,17,"Ether / IP / UDP / DNS Ans ""b'pub.idqqimg.com.tc.qq.com.'"" "
192.168.0.106,61.54.91.215,14849,443,6,"Ether / IP / TCP 192.168.0.106:14849 > 61.54.91.215:https S"
61.54.91.215,192.168.0.106,443,14849,6,"Ether / IP / TCP 61.54.91.215:https > 192.168.0.106:14849 SA"
192.168.0.106,61.54.91.215,14849,443,6,"Ether / IP / TCP 192.168.0.106:14849 > 61.54.91.215:https A"
192.168.0.106,61.54.91.215,14849,443,6,"Ether / IP / TCP 192.168.0.106:14849 > 61.54.91.215:https PA / Raw"
123.151.54.161,192.168.0.106,80,1963,6,"Ether / IP / TCP 123.151.54.161:http > 192.168.0.106:1963 A / Padding"
61.54.91.215,192.168.0.106,443,14849,6,"Ether / IP / TCP 61.54.91.215:https > 192.168.0.106:14849 A"
123.151.54.161,192.168.0.106,80,1963,6,"Ether / IP / TCP 123.151.54.161:http > 192.168.0.106:1963 PA / Raw"
61.54.91.215,192.168.0.106,443,14849,6,"Ether / IP / TCP 61.54.91.215:https > 192.168.0.106:14849 A / Raw"
61.54.91.215,192.168.0.106,443,14849,6,"Ether / IP / TCP 61.54.91.215:https > 192.168.0.106:14849 A / Raw"
61.54.91.215,192.168.0.106,443,14849,6,"Ether / IP / TCP 61.54.91.215:https > 192.168.0.106:14849 PA / Raw"
61.54.91.215,192.168.0.106,443,14849,6,"Ether / IP / TCP 61.54.91.215:https > 192.168.0.106:14849 PA / Raw"
192.168.0.106,61.54.91.215,14849,443,6,"Ether / IP / TCP 192.168.0.106:14849 > 61.54.91.215:https A"
192.168.0.106,61.54.91.215,14849,443,6,"Ether / IP / TCP 192.168.0.106:14849 > 61.54.91.215:https PA / Raw"
61.54.91.215,192.168.0.106,443,14849,6,"Ether / IP / TCP 61.54.91.215:https > 192.168.0.106:14849 PA / Raw"
192.168.0.106,61.54.91.215,14849,443,6,"Ether / IP / TCP 192.168.0.106:14849 > 61.54.91.215:https A"
61.54.91.215,192.168.0.106,443,14849,6,"Ether / IP / TCP 61.54.91.215:https > 192.168.0.106:14849 A"
61.54.91.215,192.168.0.106,443,14849,6,"Ether / IP / TCP 61.54.91.215:https > 192.168.0.106:14849 PA / Raw"
61.54.91.215,192.168.0.106,443,14849,6,"Ether / IP / TCP 61.54.91.215:https > 192.168.0.106:14849 PA / Raw"
192.168.0.106,61.54.91.215,14849,443,6,"Ether / IP / TCP 192.168.0.106:14849 > 61.54.91.215:https A"
61.54.91.215,192.168.0.106,443,14849,6,"Ether / IP / TCP 61.54.91.215:https > 192.168.0.106:14849 PA / Raw"
192.168.0.106,61.54.91.215,14849,443,6,"Ether / IP / TCP 192.168.0.106:14849 > 61.54.91.215:https A"
61.54.91.215,192.168.0.106,443,14849,6,"Ether / IP / TCP 61.54.91.215:https > 192.168.0.106:14849 PA / Raw"
192.168.0.106,61.54.91.215,14849,443,6,"Ether / IP / TCP 192.168.0.106:14849 > 61.54.91.215:https A"
192.168.0.106,123.151.54.161,1963,80,6,"Ether / IP / TCP 192.168.0.106:1963 > 123.151.54.161:http A"
192.168.0.106,192.168.0.1,53202,53,17,"Ether / IP / UDP / DNS Qry ""b'static-pcs-sdk-server.alibaba.com.'"" "
192.168.0.1,192.168.0.106,53,53202,17,"Ether / IP / UDP / DNS Ans ""116.132.235.204"" "
192.168.0.106,116.132.235.204,14850,80,6,"Ether / IP / TCP 192.168.0.106:14850 > 116.132.235.204:http S"
116.132.235.204,192.168.0.106,80,14850,6,"Ether / IP / TCP 116.132.235.204:http > 192.168.0.106:14850 SA"
192.168.0.106,116.132.235.204,14850,80,6,"Ether / IP / TCP 192.168.0.106:14850 > 116.132.235.204:http A"
192.168.0.106,116.132.235.204,14850,80,6,"Ether / IP / TCP 192.168.0.106:14850 > 116.132.235.204:http PA / Raw"
192.168.0.106,116.132.235.204,14850,80,6,"Ether / IP / TCP 192.168.0.106:14850 > 116.132.235.204:http A / Raw"
192.168.0.106,116.132.235.204,14850,80,6,"Ether / IP / TCP 192.168.0.106:14850 > 116.132.235.204:http A / Raw"
192.168.0.106,116.132.235.204,14850,80,6,"Ether / IP / TCP 192.168.0.106:14850 > 116.132.235.204:http PA / Raw"
116.132.235.204,192.168.0.106,80,14850,6,"Ether / IP / TCP 116.132.235.204:http > 192.168.0.106:14850 A"
116.132.235.204,192.168.0.106,80,14850,6,"Ether / IP / TCP 116.132.235.204:http > 192.168.0.106:14850 A"
116.132.235.204,192.168.0.106,80,14850,6,"Ether / IP / TCP 116.132.235.204:http > 192.168.0.106:14850 A"
116.132.235.204,192.168.0.106,80,14850,6,"Ether / IP / TCP 116.132.235.204:http > 192.168.0.106:14850 PA / Raw"
116.132.235.204,192.168.0.106,80,14850,6,"Ether / IP / TCP 116.132.235.204:http > 192.168.0.106:14850 FA"
192.168.0.106,116.132.235.204,14850,80,6,"Ether / IP / TCP 192.168.0.106:14850 > 116.132.235.204:http A"
192.168.0.106,116.132.235.204,14850,80,6,"Ether / IP / TCP 192.168.0.106:14850 > 116.132.235.204:http FA"
116.132.235.204,192.168.0.106,80,14850,6,"Ether / IP / TCP 116.132.235.204:http > 192.168.0.106:14850 A"
192.168.0.106,116.132.235.204,14836,80,6,"Ether / IP / TCP 192.168.0.106:14836 > 116.132.235.204:http FA"
192.168.0.106,192.168.0.1,53202,53,17,"Ether / IP / UDP / DNS Qry ""b'static-pcs-sdk-server.alibaba.com.'"" "
192.168.0.1,192.168.0.106,53,53202,17,"Ether / IP / UDP / DNS Ans ""116.132.235.204"" "
192.168.0.106,116.132.235.204,14851,80,6,"Ether / IP / TCP 192.168.0.106:14851 > 116.132.235.204:http S"
116.132.235.204,192.168.0.106,80,14851,6,"Ether / IP / TCP 116.132.235.204:http > 192.168.0.106:14851 SA"
192.168.0.106,116.132.235.204,14851,80,6,"Ether / IP / TCP 192.168.0.106:14851 > 116.132.235.204:http A"
192.168.0.106,116.132.235.204,14851,80,6,"Ether / IP / TCP 192.168.0.106:14851 > 116.132.235.204:http PA / Raw"
192.168.0.106,116.132.235.204,14851,80,6,"Ether / IP / TCP 192.168.0.106:14851 > 116.132.235.204:http A / Raw"
192.168.0.106,116.132.235.204,14851,80,6,"Ether / IP / TCP 192.168.0.106:14851 > 116.132.235.204:http A / Raw"
192.168.0.106,116.132.235.204,14851,80,6,"Ether / IP / TCP 192.168.0.106:14851 > 116.132.235.204:http PA / Raw"
116.132.235.204,192.168.0.106,80,14851,6,"Ether / IP / TCP 116.132.235.204:http > 192.168.0.106:14851 A"
116.132.235.204,192.168.0.106,80,14851,6,"Ether / IP / TCP 116.132.235.204:http > 192.168.0.106:14851 A"
116.132.235.204,192.168.0.106,80,14851,6,"Ether / IP / TCP 116.132.235.204:http > 192.168.0.106:14851 A"
116.132.235.204,192.168.0.106,80,14851,6,"Ether / IP / TCP 116.132.235.204:http > 192.168.0.106:14851 PA / Raw"
116.132.235.204,192.168.0.106,80,14851,6,"Ether / IP / TCP 116.132.235.204:http > 192.168.0.106:14851 FA"
192.168.0.106,116.132.235.204,14851,80,6,"Ether / IP / TCP 192.168.0.106:14851 > 116.132.235.204:http A"
192.168.0.106,116.132.235.204,14851,80,6,"Ether / IP / TCP 192.168.0.106:14851 > 116.132.235.204:http FA"
116.132.235.204,192.168.0.106,80,14851,6,"Ether / IP / TCP 116.132.235.204:http > 192.168.0.106:14851 A"
192.168.0.106,192.168.0.1,53202,53,17,"Ether / IP / UDP / DNS Qry ""b'static-pcs-sdk-server.alibaba.com.'"" "
192.168.0.1,192.168.0.106,53,53202,17,"Ether / IP / UDP / DNS Ans ""116.132.235.204"" "
192.168.0.106,116.132.235.204,14852,80,6,"Ether / IP / TCP 192.168.0.106:14852 > 116.132.235.204:http S"
116.132.235.204,192.168.0.106,80,14852,6,"Ether / IP / TCP 116.132.235.204:http > 192.168.0.106:14852 SA"
192.168.0.106,116.132.235.204,14852,80,6,"Ether / IP / TCP 192.168.0.106:14852 > 116.132.235.204:http A"
192.168.0.106,116.132.235.204,14852,80,6,"Ether / IP / TCP 192.168.0.106:14852 > 116.132.235.204:http PA / Raw"
192.168.0.106,116.132.235.204,14852,80,6,"Ether / IP / TCP 192.168.0.106:14852 > 116.132.235.204:http A / Raw"
192.168.0.106,116.132.235.204,14852,80,6,"Ether / IP / TCP 192.168.0.106:14852 > 116.132.235.204:http A / Raw"
192.168.0.106,116.132.235.204,14852,80,6,"Ether / IP / TCP 192.168.0.106:14852 > 116.132.235.204:http PA / Raw"
116.132.235.204,192.168.0.106,80,14852,6,"Ether / IP / TCP 116.132.235.204:http > 192.168.0.106:14852 A"
116.132.235.204,192.168.0.106,80,14852,6,"Ether / IP / TCP 116.132.235.204:http > 192.168.0.106:14852 A"
116.132.235.204,192.168.0.106,80,14852,6,"Ether / IP / TCP 116.132.235.204:http > 192.168.0.106:14852 A"
116.132.235.204,192.168.0.106,80,14852,6,"Ether / IP / TCP 116.132.235.204:http > 192.168.0.106:14852 PA / Raw"
116.132.235.204,192.168.0.106,80,14852,6,"Ether / IP / TCP 116.132.235.204:http > 192.168.0.106:14852 FA"
192.168.0.106,116.132.235.204,14852,80,6,"Ether / IP / TCP 192.168.0.106:14852 > 116.132.235.204:http A"
192.168.0.106,116.132.235.204,14852,80,6,"Ether / IP / TCP 192.168.0.106:14852 > 116.132.235.204:http FA"
192.168.0.106,116.132.235.204,14852,80,6,"Ether / IP / TCP 192.168.0.106:14852 > 116.132.235.204:http FA"
192.168.0.106,116.132.235.204,14852,80,6,"Ether / IP / TCP 192.168.0.106:14852 > 116.132.235.204:http FA"
192.168.0.106,111.206.209.249,14853,443,6,"Ether / IP / TCP 192.168.0.106:14853 > 111.206.209.249:https S"
192.168.0.106,111.206.209.249,14854,443,6,"Ether / IP / TCP 192.168.0.106:14854 > 111.206.209.249:https S"
192.168.0.106,192.168.0.1,53202,53,17,"Ether / IP / UDP / DNS Qry ""b'static-pcs-sdk-server.alibaba.com.'"" "
111.206.209.249,192.168.0.106,443,14853,6,"Ether / IP / TCP 111.206.209.249:https > 192.168.0.106:14853 SA"
111.206.209.249,192.168.0.106,443,14854,6,"Ether / IP / TCP 111.206.209.249:https > 192.168.0.106:14854 SA"
192.168.0.106,111.206.209.249,14853,443,6,"Ether / IP / TCP 192.168.0.106:14853 > 111.206.209.249:https A"
192.168.0.106,111.206.209.249,14854,443,6,"Ether / IP / TCP 192.168.0.106:14854 > 111.206.209.249:https A"
192.168.0.106,111.206.209.249,14854,443,6,"Ether / IP / TCP 192.168.0.106:14854 > 111.206.209.249:https PA / Raw"
192.168.0.106,111.206.209.249,14853,443,6,"Ether / IP / TCP 192.168.0.106:14853 > 111.206.209.249:https PA / Raw"
192.168.0.1,192.168.0.106,53,53202,17,"Ether / IP / UDP / DNS Ans ""116.132.235.204"" "
192.168.0.106,116.132.235.204,14855,80,6,"Ether / IP / TCP 192.168.0.106:14855 > 116.132.235.204:http S"
111.206.209.249,192.168.0.106,443,14853,6,"Ether / IP / TCP 111.206.209.249:https > 192.168.0.106:14853 A"
111.206.209.249,192.168.0.106,443,14854,6,"Ether / IP / TCP 111.206.209.249:https > 192.168.0.106:14854 A"
116.132.235.204,192.168.0.106,80,14855,6,"Ether / IP / TCP 116.132.235.204:http > 192.168.0.106:14855 SA"
192.168.0.106,116.132.235.204,14855,80,6,"Ether / IP / TCP 192.168.0.106:14855 > 116.132.235.204:http A"
192.168.0.106,116.132.235.204,14855,80,6,"Ether / IP / TCP 192.168.0.106:14855 > 116.132.235.204:http PA / Raw"
192.168.0.106,116.132.235.204,14855,80,6,"Ether / IP / TCP 192.168.0.106:14855 > 116.132.235.204:http A / Raw"
192.168.0.106,116.132.235.204,14855,80,6,"Ether / IP / TCP 192.168.0.106:14855 > 116.132.235.204:http A / Raw"
192.168.0.106,116.132.235.204,14855,80,6,"Ether / IP / TCP 192.168.0.106:14855 > 116.132.235.204:http PA / Raw"
192.168.0.106,116.132.235.204,14840,80,6,"Ether / IP / TCP 192.168.0.106:14840 > 116.132.235.204:http FA"
111.206.209.249,192.168.0.106,443,14854,6,"Ether / IP / TCP 111.206.209.249:https > 192.168.0.106:14854 A / Raw"
111.206.209.249,192.168.0.106,443,14854,6,"Ether / IP / TCP 111.206.209.249:https > 192.168.0.106:14854 A / Raw"
111.206.209.249,192.168.0.106,443,14854,6,"Ether / IP / TCP 111.206.209.249:https > 192.168.0.106:14854 A / Raw"
111.206.209.249,192.168.0.106,443,14854,6,"Ether / IP / TCP 111.206.209.249:https > 192.168.0.106:14854 PA / Raw"
192.168.0.106,111.206.209.249,14854,443,6,"Ether / IP / TCP 192.168.0.106:14854 > 111.206.209.249:https A"
192.168.0.106,111.206.209.249,14854,443,6,"Ether / IP / TCP 192.168.0.106:14854 > 111.206.209.249:https PA / Raw"
192.168.0.106,111.206.209.249,14854,443,6,"Ether / IP / TCP 192.168.0.106:14854 > 111.206.209.249:https PA / Raw"
111.206.209.249,192.168.0.106,443,14853,6,"Ether / IP / TCP 111.206.209.249:https > 192.168.0.106:14853 A / Raw"
111.206.209.249,192.168.0.106,443,14853,6,"Ether / IP / TCP 111.206.209.249:https > 192.168.0.106:14853 A / Raw"
111.206.209.249,192.168.0.106,443,14853,6,"Ether / IP / TCP 111.206.209.249:https > 192.168.0.106:14853 A / Raw"
111.206.209.249,192.168.0.106,443,14853,6,"Ether / IP / TCP 111.206.209.249:https > 192.168.0.106:14853 PA / Raw"
192.168.0.106,111.206.209.249,14853,443,6,"Ether / IP / TCP 192.168.0.106:14853 > 111.206.209.249:https A"
192.168.0.106,111.206.209.249,14853,443,6,"Ether / IP / TCP 192.168.0.106:14853 > 111.206.209.249:https PA / Raw"
192.168.0.106,111.206.209.249,14853,443,6,"Ether / IP / TCP 192.168.0.106:14853 > 111.206.209.249:https PA / Raw"
111.206.209.249,192.168.0.106,443,14854,6,"Ether / IP / TCP 111.206.209.249:https > 192.168.0.106:14854 PA / Raw"
111.206.209.249,192.168.0.106,443,14853,6,"Ether / IP / TCP 111.206.209.249:https > 192.168.0.106:14853 PA / Raw"
192.168.0.106,111.206.209.249,14854,443,6,"Ether / IP / TCP 192.168.0.106:14854 > 111.206.209.249:https A"
192.168.0.106,111.206.209.249,14853,443,6,"Ether / IP / TCP 192.168.0.106:14853 > 111.206.209.249:https A"
116.132.235.204,192.168.0.106,80,14855,6,"Ether / IP / TCP 116.132.235.204:http > 192.168.0.106:14855 A"
111.206.209.249,192.168.0.106,443,14853,6,"Ether / IP / TCP 111.206.209.249:https > 192.168.0.106:14853 A"
116.132.235.204,192.168.0.106,80,14855,6,"Ether / IP / TCP 116.132.235.204:http > 192.168.0.106:14855 A"
111.206.209.249,192.168.0.106,443,14853,6,"Ether / IP / TCP 111.206.209.249:https > 192.168.0.106:14853 PA / Raw"
116.132.235.204,192.168.0.106,80,14855,6,"Ether / IP / TCP 116.132.235.204:http > 192.168.0.106:14855 A"
111.206.209.249,192.168.0.106,443,14854,6,"Ether / IP / TCP 111.206.209.249:https > 192.168.0.106:14854 A"
111.206.209.249,192.168.0.106,443,14854,6,"Ether / IP / TCP 111.206.209.249:https > 192.168.0.106:14854 A"
111.206.209.249,192.168.0.106,443,14854,6,"Ether / IP / TCP 111.206.209.249:https > 192.168.0.106:14854 PA / Raw"
111.206.209.249,192.168.0.106,443,14853,6,"Ether / IP / TCP 111.206.209.249:https > 192.168.0.106:14853 A"
