srcip,dstip,sport,dport,proto,data
192.168.192.1,192.168.192.2,137,137,17,"Ether / IP / UDP 192.168.192.1:netbios_ns > 192.168.192.2:netbios_ns / NBNSHeader / Raw"
182.61.200.166,192.168.1.116,443,6193,6,"Ether / IP / TCP 182.61.200.166:https > 192.168.1.116:6193 PA / Raw"
182.61.200.166,192.168.1.116,443,6193,6,"Ether / IP / TCP 182.61.200.166:https > 192.168.1.116:6193 FA"
192.168.1.116,182.61.200.166,6193,443,6,"Ether / IP / TCP 192.168.1.116:6193 > 182.61.200.166:https A"
182.61.200.166,192.168.1.116,443,6193,6,"Ether / IP / TCP 182.61.200.166:https > 192.168.1.116:6193 FA"
192.168.1.116,182.61.200.166,6193,443,6,"Ether / IP / TCP 192.168.1.116:6193 > 182.61.200.166:https A"
192.168.1.116,203.119.169.16,3299,80,6,"Ether / IP / TCP 192.168.1.116:3299 > 203.119.169.16:http PA / Raw"
192.168.1.116,203.119.169.16,3299,80,6,"Ether / IP / TCP 192.168.1.116:3299 > 203.119.169.16:http A / Raw"
192.168.1.116,203.119.169.16,3299,80,6,"Ether / IP / TCP 192.168.1.116:3299 > 203.119.169.16:http A / Raw"
192.168.1.116,203.119.169.16,3299,80,6,"Ether / IP / TCP 192.168.1.116:3299 > 203.119.169.16:http PA / Raw"
203.119.169.16,192.168.1.116,80,3299,6,"Ether / IP / TCP 203.119.169.16:http > 192.168.1.116:3299 A"
203.119.169.16,192.168.1.116,80,3299,6,"Ether / IP / TCP 203.119.169.16:http > 192.168.1.116:3299 PA / Raw"
203.119.169.16,192.168.1.116,80,3299,6,"Ether / IP / TCP 203.119.169.16:http > 192.168.1.116:3299 PA / Raw"
192.168.1.116,203.119.169.16,3299,80,6,"Ether / IP / TCP 192.168.1.116:3299 > 203.119.169.16:http A"
192.168.1.116,182.61.200.7,6208,80,6,"Ether / IP / TCP 192.168.1.116:6208 > 182.61.200.7:http S"
182.61.200.7,192.168.1.116,80,6208,6,"Ether / IP / TCP 182.61.200.7:http > 192.168.1.116:6208 SA"
192.168.1.116,182.61.200.7,6208,80,6,"Ether / IP / TCP 192.168.1.116:6208 > 182.61.200.7:http A"
192.168.1.116,182.61.200.7,6208,80,6,"Ether / IP / TCP 192.168.1.116:6208 > 182.61.200.7:http FA"
182.61.200.7,192.168.1.116,80,6208,6,"Ether / IP / TCP 182.61.200.7:http > 192.168.1.116:6208 A"
182.61.200.7,192.168.1.116,80,6208,6,"Ether / IP / TCP 182.61.200.7:http > 192.168.1.116:6208 FA"
192.168.1.116,182.61.200.7,6208,80,6,"Ether / IP / TCP 192.168.1.116:6208 > 182.61.200.7:http A"
192.168.192.1,192.168.192.2,137,137,17,"Ether / IP / UDP 192.168.192.1:netbios_ns > 192.168.192.2:netbios_ns / NBNSHeader / Raw"
192.168.1.116,203.119.169.16,3299,80,6,"Ether / IP / TCP 192.168.1.116:3299 > 203.119.169.16:http PA / Raw"
192.168.1.116,203.119.169.16,3299,80,6,"Ether / IP / TCP 192.168.1.116:3299 > 203.119.169.16:http A / Raw"
192.168.1.116,203.119.169.16,3299,80,6,"Ether / IP / TCP 192.168.1.116:3299 > 203.119.169.16:http A / Raw"
192.168.1.116,203.119.169.16,3299,80,6,"Ether / IP / TCP 192.168.1.116:3299 > 203.119.169.16:http PA / Raw"
203.119.169.16,192.168.1.116,80,3299,6,"Ether / IP / TCP 203.119.169.16:http > 192.168.1.116:3299 A"
203.119.169.16,192.168.1.116,80,3299,6,"Ether / IP / TCP 203.119.169.16:http > 192.168.1.116:3299 PA / Raw"
203.119.169.16,192.168.1.116,80,3299,6,"Ether / IP / TCP 203.119.169.16:http > 192.168.1.116:3299 PA / Raw"
192.168.1.116,203.119.169.16,3299,80,6,"Ether / IP / TCP 192.168.1.116:3299 > 203.119.169.16:http A"
192.168.1.116,203.119.169.16,3299,80,6,"Ether / IP / TCP 192.168.1.116:3299 > 203.119.169.16:http PA / Raw"
192.168.1.116,203.119.169.16,3299,80,6,"Ether / IP / TCP 192.168.1.116:3299 > 203.119.169.16:http A / Raw"
192.168.1.116,203.119.169.16,3299,80,6,"Ether / IP / TCP 192.168.1.116:3299 > 203.119.169.16:http A / Raw"
192.168.1.116,203.119.169.16,3299,80,6,"Ether / IP / TCP 192.168.1.116:3299 > 203.119.169.16:http PA / Raw"
203.119.169.16,192.168.1.116,80,3299,6,"Ether / IP / TCP 203.119.169.16:http > 192.168.1.116:3299 A"
203.119.169.16,192.168.1.116,80,3299,6,"Ether / IP / TCP 203.119.169.16:http > 192.168.1.116:3299 PA / Raw"
203.119.169.16,192.168.1.116,80,3299,6,"Ether / IP / TCP 203.119.169.16:http > 192.168.1.116:3299 PA / Raw"
192.168.1.116,203.119.169.16,3299,80,6,"Ether / IP / TCP 192.168.1.116:3299 > 203.119.169.16:http A"
192.168.1.116,203.119.169.16,3299,80,6,"Ether / IP / TCP 192.168.1.116:3299 > 203.119.169.16:http PA / Raw"
192.168.1.116,203.119.169.16,3299,80,6,"Ether / IP / TCP 192.168.1.116:3299 > 203.119.169.16:http A / Raw"
192.168.1.116,203.119.169.16,3299,80,6,"Ether / IP / TCP 192.168.1.116:3299 > 203.119.169.16:http A / Raw"
192.168.1.116,203.119.169.16,3299,80,6,"Ether / IP / TCP 192.168.1.116:3299 > 203.119.169.16:http PA / Raw"
203.119.169.16,192.168.1.116,80,3299,6,"Ether / IP / TCP 203.119.169.16:http > 192.168.1.116:3299 A"
203.119.169.16,192.168.1.116,80,3299,6,"Ether / IP / TCP 203.119.169.16:http > 192.168.1.116:3299 PA / Raw"
203.119.169.16,192.168.1.116,80,3299,6,"Ether / IP / TCP 203.119.169.16:http > 192.168.1.116:3299 PA / Raw"
192.168.1.116,203.119.169.16,3299,80,6,"Ether / IP / TCP 192.168.1.116:3299 > 203.119.169.16:http A"
192.168.1.116,42.81.192.141,9008,443,6,"Ether / IP / TCP 192.168.1.116:9008 > 42.81.192.141:https PA / Raw"
42.81.192.141,192.168.1.116,443,9008,6,"Ether / IP / TCP 42.81.192.141:https > 192.168.1.116:9008 PA / Raw"
192.168.1.116,42.81.192.141,9008,443,6,"Ether / IP / TCP 192.168.1.116:9008 > 42.81.192.141:https A"
192.168.1.116,203.119.169.16,3299,80,6,"Ether / IP / TCP 192.168.1.116:3299 > 203.119.169.16:http PA / Raw"
192.168.1.116,203.119.169.16,3299,80,6,"Ether / IP / TCP 192.168.1.116:3299 > 203.119.169.16:http A / Raw"
192.168.1.116,203.119.169.16,3299,80,6,"Ether / IP / TCP 192.168.1.116:3299 > 203.119.169.16:http A / Raw"
192.168.1.116,203.119.169.16,3299,80,6,"Ether / IP / TCP 192.168.1.116:3299 > 203.119.169.16:http PA / Raw"
203.119.169.16,192.168.1.116,80,3299,6,"Ether / IP / TCP 203.119.169.16:http > 192.168.1.116:3299 A"
203.119.169.16,192.168.1.116,80,3299,6,"Ether / IP / TCP 203.119.169.16:http > 192.168.1.116:3299 PA / Raw"
203.119.169.16,192.168.1.116,80,3299,6,"Ether / IP / TCP 203.119.169.16:http > 192.168.1.116:3299 PA / Raw"
192.168.1.116,203.119.169.16,3299,80,6,"Ether / IP / TCP 192.168.1.116:3299 > 203.119.169.16:http A"
192.168.1.116,203.119.169.16,3299,80,6,"Ether / IP / TCP 192.168.1.116:3299 > 203.119.169.16:http PA / Raw"
192.168.1.116,203.119.169.16,3299,80,6,"Ether / IP / TCP 192.168.1.116:3299 > 203.119.169.16:http A / Raw"
192.168.1.116,203.119.169.16,3299,80,6,"Ether / IP / TCP 192.168.1.116:3299 > 203.119.169.16:http A / Raw"
192.168.1.116,203.119.169.16,3299,80,6,"Ether / IP / TCP 192.168.1.116:3299 > 203.119.169.16:http PA / Raw"
203.119.169.16,192.168.1.116,80,3299,6,"Ether / IP / TCP 203.119.169.16:http > 192.168.1.116:3299 A"
203.119.169.16,192.168.1.116,80,3299,6,"Ether / IP / TCP 203.119.169.16:http > 192.168.1.116:3299 A"
203.119.169.16,192.168.1.116,80,3299,6,"Ether / IP / TCP 203.119.169.16:http > 192.168.1.116:3299 PA / Raw"
203.119.169.16,192.168.1.116,80,3299,6,"Ether / IP / TCP 203.119.169.16:http > 192.168.1.116:3299 PA / Raw"
192.168.1.116,203.119.169.16,3299,80,6,"Ether / IP / TCP 192.168.1.116:3299 > 203.119.169.16:http A"
192.168.1.116,203.119.169.16,3299,80,6,"Ether / IP / TCP 192.168.1.116:3299 > 203.119.169.16:http PA / Raw"
192.168.1.116,203.119.169.16,3299,80,6,"Ether / IP / TCP 192.168.1.116:3299 > 203.119.169.16:http A / Raw"
192.168.1.116,203.119.169.16,3299,80,6,"Ether / IP / TCP 192.168.1.116:3299 > 203.119.169.16:http A / Raw"
192.168.1.116,203.119.169.16,3299,80,6,"Ether / IP / TCP 192.168.1.116:3299 > 203.119.169.16:http PA / Raw"
192.168.1.116,117.149.203.65,3419,443,6,"Ether / IP / TCP 192.168.1.116:3419 > 117.149.203.65:https FA"
192.168.1.116,117.149.203.65,3457,443,6,"Ether / IP / TCP 192.168.1.116:3457 > 117.149.203.65:https FA"
192.168.1.116,117.149.203.65,3440,443,6,"Ether / IP / TCP 192.168.1.116:3440 > 117.149.203.65:https FA"
192.168.1.116,117.149.203.65,3456,443,6,"Ether / IP / TCP 192.168.1.116:3456 > 117.149.203.65:https FA"
192.168.1.116,122.205.109.49,6201,443,6,"Ether / IP / TCP 192.168.1.116:6201 > 122.205.109.49:https FA"
192.168.1.116,222.192.187.167,6204,443,6,"Ether / IP / TCP 192.168.1.116:6204 > 222.192.187.167:https FA"
192.168.1.116,182.61.200.166,6193,443,6,"Ether / IP / TCP 192.168.1.116:6193 > 182.61.200.166:https FA"
192.168.1.116,182.61.200.166,6193,443,6,"Ether / IP / TCP 192.168.1.116:6193 > 182.61.200.166:https RA"
192.168.1.116,20.189.173.5,3404,443,6,"Ether / IP / TCP 192.168.1.116:3404 > 20.189.173.5:https FA"
192.168.1.116,222.192.187.164,6167,443,6,"Ether / IP / TCP 192.168.1.116:6167 > 222.192.187.164:https FA"
192.168.1.116,121.194.10.213,3398,443,6,"Ether / IP / TCP 192.168.1.116:3398 > 121.194.10.213:https FA"
222.192.187.167,192.168.1.116,443,6204,6,"Ether / IP / TCP 222.192.187.167:https > 192.168.1.116:6204 FA"
192.168.1.116,222.192.187.167,6204,443,6,"Ether / IP / TCP 192.168.1.116:6204 > 222.192.187.167:https A"
222.192.187.164,192.168.1.116,443,6167,6,"Ether / IP / TCP 222.192.187.164:https > 192.168.1.116:6167 FA"
192.168.1.116,222.192.187.164,6167,443,6,"Ether / IP / TCP 192.168.1.116:6167 > 222.192.187.164:https A"
203.119.169.16,192.168.1.116,80,3299,6,"Ether / IP / TCP 203.119.169.16:http > 192.168.1.116:3299 A"
203.119.169.16,192.168.1.116,80,3299,6,"Ether / IP / TCP 203.119.169.16:http > 192.168.1.116:3299 A"
203.119.169.16,192.168.1.116,80,3299,6,"Ether / IP / TCP 203.119.169.16:http > 192.168.1.116:3299 PA / Raw"
203.119.169.16,192.168.1.116,80,3299,6,"Ether / IP / TCP 203.119.169.16:http > 192.168.1.116:3299 PA / Raw"
192.168.1.116,203.119.169.16,3299,80,6,"Ether / IP / TCP 192.168.1.116:3299 > 203.119.169.16:http A"
122.205.109.49,192.168.1.116,443,6201,6,"Ether / IP / TCP 122.205.109.49:https > 192.168.1.116:6201 A"
122.205.109.49,192.168.1.116,443,6201,6,"Ether / IP / TCP 122.205.109.49:https > 192.168.1.116:6201 FA"
192.168.1.116,122.205.109.49,6201,443,6,"Ether / IP / TCP 192.168.1.116:6201 > 122.205.109.49:https A"
121.194.10.213,192.168.1.116,443,3398,6,"Ether / IP / TCP 121.194.10.213:https > 192.168.1.116:3398 FA"
192.168.1.116,121.194.10.213,3398,443,6,"Ether / IP / TCP 192.168.1.116:3398 > 121.194.10.213:https A"
117.149.203.65,192.168.1.116,443,3457,6,"Ether / IP / TCP 117.149.203.65:https > 192.168.1.116:3457 FA"
117.149.203.65,192.168.1.116,443,3419,6,"Ether / IP / TCP 117.149.203.65:https > 192.168.1.116:3419 FA"
192.168.1.116,117.149.203.65,3457,443,6,"Ether / IP / TCP 192.168.1.116:3457 > 117.149.203.65:https A"
192.168.1.116,117.149.203.65,3419,443,6,"Ether / IP / TCP 192.168.1.116:3419 > 117.149.203.65:https A"
117.149.203.65,192.168.1.116,443,3456,6,"Ether / IP / TCP 117.149.203.65:https > 192.168.1.116:3456 FA"
192.168.1.116,117.149.203.65,3456,443,6,"Ether / IP / TCP 192.168.1.116:3456 > 117.149.203.65:https A"
117.149.203.65,192.168.1.116,443,3440,6,"Ether / IP / TCP 117.149.203.65:https > 192.168.1.116:3440 FA"
192.168.1.116,117.149.203.65,3440,443,6,"Ether / IP / TCP 192.168.1.116:3440 > 117.149.203.65:https A"
20.189.173.5,192.168.1.116,443,3404,6,"Ether / IP / TCP 20.189.173.5:https > 192.168.1.116:3404 FA"
192.168.1.116,20.189.173.5,3404,443,6,"Ether / IP / TCP 192.168.1.116:3404 > 20.189.173.5:https A"
192.168.1.116,203.119.169.16,3299,80,6,"Ether / IP / TCP 192.168.1.116:3299 > 203.119.169.16:http PA / Raw"
192.168.1.116,203.119.169.16,3299,80,6,"Ether / IP / TCP 192.168.1.116:3299 > 203.119.169.16:http A / Raw"
192.168.1.116,203.119.169.16,3299,80,6,"Ether / IP / TCP 192.168.1.116:3299 > 203.119.169.16:http A / Raw"
192.168.1.116,203.119.169.16,3299,80,6,"Ether / IP / TCP 192.168.1.116:3299 > 203.119.169.16:http PA / Raw"
203.119.169.16,192.168.1.116,80,3299,6,"Ether / IP / TCP 203.119.169.16:http > 192.168.1.116:3299 A"
203.119.169.16,192.168.1.116,80,3299,6,"Ether / IP / TCP 203.119.169.16:http > 192.168.1.116:3299 A"
203.119.169.16,192.168.1.116,80,3299,6,"Ether / IP / TCP 203.119.169.16:http > 192.168.1.116:3299 PA / Raw"
203.119.169.16,192.168.1.116,80,3299,6,"Ether / IP / TCP 203.119.169.16:http > 192.168.1.116:3299 PA / Raw"
192.168.1.116,203.119.169.16,3299,80,6,"Ether / IP / TCP 192.168.1.116:3299 > 203.119.169.16:http A"
192.168.192.1,192.168.192.2,137,137,17,"Ether / IP / UDP 192.168.192.1:netbios_ns > 192.168.192.2:netbios_ns / NBNSHeader / Raw"
202.112.14.6,192.168.1.116,443,6205,6,"Ether / IP / TCP 202.112.14.6:https > 192.168.1.116:6205 PA / Raw"
202.112.14.6,192.168.1.116,443,6205,6,"Ether / IP / TCP 202.112.14.6:https > 192.168.1.116:6205 FA"
192.168.1.116,202.112.14.6,6205,443,6,"Ether / IP / TCP 192.168.1.116:6205 > 202.112.14.6:https A"
192.168.1.116,203.119.169.16,3299,80,6,"Ether / IP / TCP 192.168.1.116:3299 > 203.119.169.16:http PA / Raw"
192.168.1.116,203.119.169.16,3299,80,6,"Ether / IP / TCP 192.168.1.116:3299 > 203.119.169.16:http A / Raw"
192.168.1.116,203.119.169.16,3299,80,6,"Ether / IP / TCP 192.168.1.116:3299 > 203.119.169.16:http A / Raw"
192.168.1.116,203.119.169.16,3299,80,6,"Ether / IP / TCP 192.168.1.116:3299 > 203.119.169.16:http PA / Raw"
203.119.169.16,192.168.1.116,80,3299,6,"Ether / IP / TCP 203.119.169.16:http > 192.168.1.116:3299 A"
203.119.169.16,192.168.1.116,80,3299,6,"Ether / IP / TCP 203.119.169.16:http > 192.168.1.116:3299 PA / Raw"
203.119.169.16,192.168.1.116,80,3299,6,"Ether / IP / TCP 203.119.169.16:http > 192.168.1.116:3299 PA / Raw"
192.168.1.116,203.119.169.16,3299,80,6,"Ether / IP / TCP 192.168.1.116:3299 > 203.119.169.16:http A"
202.112.14.6,192.168.1.116,443,6206,6,"Ether / IP / TCP 202.112.14.6:https > 192.168.1.116:6206 PA / Raw"
202.112.14.6,192.168.1.116,443,6206,6,"Ether / IP / TCP 202.112.14.6:https > 192.168.1.116:6206 FA"
192.168.1.116,202.112.14.6,6206,443,6,"Ether / IP / TCP 192.168.1.116:6206 > 202.112.14.6:https A"
192.168.1.116,203.119.169.16,3299,80,6,"Ether / IP / TCP 192.168.1.116:3299 > 203.119.169.16:http PA / Raw"
192.168.1.116,203.119.169.16,3299,80,6,"Ether / IP / TCP 192.168.1.116:3299 > 203.119.169.16:http A / Raw"
192.168.1.116,203.119.169.16,3299,80,6,"Ether / IP / TCP 192.168.1.116:3299 > 203.119.169.16:http A / Raw"
192.168.1.116,203.119.169.16,3299,80,6,"Ether / IP / TCP 192.168.1.116:3299 > 203.119.169.16:http PA / Raw"
203.119.169.16,192.168.1.116,80,3299,6,"Ether / IP / TCP 203.119.169.16:http > 192.168.1.116:3299 A"
203.119.169.16,192.168.1.116,80,3299,6,"Ether / IP / TCP 203.119.169.16:http > 192.168.1.116:3299 A"
203.119.169.16,192.168.1.116,80,3299,6,"Ether / IP / TCP 203.119.169.16:http > 192.168.1.116:3299 PA / Raw"
203.119.169.16,192.168.1.116,80,3299,6,"Ether / IP / TCP 203.119.169.16:http > 192.168.1.116:3299 PA / Raw"
192.168.1.116,203.119.169.16,3299,80,6,"Ether / IP / TCP 192.168.1.116:3299 > 203.119.169.16:http A"
192.168.1.116,203.119.169.16,3299,80,6,"Ether / IP / TCP 192.168.1.116:3299 > 203.119.169.16:http PA / Raw"
192.168.1.116,203.119.169.16,3299,80,6,"Ether / IP / TCP 192.168.1.116:3299 > 203.119.169.16:http A / Raw"
192.168.1.116,203.119.169.16,3299,80,6,"Ether / IP / TCP 192.168.1.116:3299 > 203.119.169.16:http A / Raw"
192.168.1.116,203.119.169.16,3299,80,6,"Ether / IP / TCP 192.168.1.116:3299 > 203.119.169.16:http PA / Raw"
203.119.169.16,192.168.1.116,80,3299,6,"Ether / IP / TCP 203.119.169.16:http > 192.168.1.116:3299 A"
203.119.169.16,192.168.1.116,80,3299,6,"Ether / IP / TCP 203.119.169.16:http > 192.168.1.116:3299 PA / Raw"
203.119.169.16,192.168.1.116,80,3299,6,"Ether / IP / TCP 203.119.169.16:http > 192.168.1.116:3299 PA / Raw"
192.168.1.116,203.119.169.16,3299,80,6,"Ether / IP / TCP 192.168.1.116:3299 > 203.119.169.16:http A"
192.168.192.1,192.168.192.2,137,137,17,"Ether / IP / UDP 192.168.192.1:netbios_ns > 192.168.192.2:netbios_ns / NBNSHeader / Raw"
192.168.1.1,255.255.255.255,1024,5001,17,"Ether / IP / UDP 192.168.1.1:1024 > 255.255.255.255:5001 / Raw"
192.168.1.1,239.255.255.250,1900,1900,17,"Ether / IP / UDP 192.168.1.1:ssdp > 239.255.255.250:ssdp / Raw"
192.168.1.1,239.255.255.250,1900,1900,17,"Ether / IP / UDP 192.168.1.1:ssdp > 239.255.255.250:ssdp / Raw"
192.168.1.1,239.255.255.250,1900,1900,17,"Ether / IP / UDP 192.168.1.1:ssdp > 239.255.255.250:ssdp / Raw"
192.168.1.1,239.255.255.250,1900,1900,17,"Ether / IP / UDP 192.168.1.1:ssdp > 239.255.255.250:ssdp / Raw"
192.168.1.1,239.255.255.250,1900,1900,17,"Ether / IP / UDP 192.168.1.1:ssdp > 239.255.255.250:ssdp / Raw"
192.168.1.1,239.255.255.250,1900,1900,17,"Ether / IP / UDP 192.168.1.1:ssdp > 239.255.255.250:ssdp / Raw"
192.168.1.1,239.255.255.250,1900,1900,17,"Ether / IP / UDP 192.168.1.1:ssdp > 239.255.255.250:ssdp / Raw"
192.168.1.1,239.255.255.250,1900,1900,17,"Ether / IP / UDP 192.168.1.1:ssdp > 239.255.255.250:ssdp / Raw"
192.168.1.1,239.255.255.250,1900,1900,17,"Ether / IP / UDP 192.168.1.1:ssdp > 239.255.255.250:ssdp / Raw"
192.168.1.1,239.255.255.250,1900,1900,17,"Ether / IP / UDP 192.168.1.1:ssdp > 239.255.255.250:ssdp / Raw"
192.168.1.116,203.119.169.16,3299,80,6,"Ether / IP / TCP 192.168.1.116:3299 > 203.119.169.16:http PA / Raw"
192.168.1.116,203.119.169.16,3299,80,6,"Ether / IP / TCP 192.168.1.116:3299 > 203.119.169.16:http A / Raw"
192.168.1.116,203.119.169.16,3299,80,6,"Ether / IP / TCP 192.168.1.116:3299 > 203.119.169.16:http A / Raw"
192.168.1.116,203.119.169.16,3299,80,6,"Ether / IP / TCP 192.168.1.116:3299 > 203.119.169.16:http PA / Raw"
203.119.169.16,192.168.1.116,80,3299,6,"Ether / IP / TCP 203.119.169.16:http > 192.168.1.116:3299 A"
203.119.169.16,192.168.1.116,80,3299,6,"Ether / IP / TCP 203.119.169.16:http > 192.168.1.116:3299 PA / Raw"
203.119.169.16,192.168.1.116,80,3299,6,"Ether / IP / TCP 203.119.169.16:http > 192.168.1.116:3299 PA / Raw"
192.168.1.116,203.119.169.16,3299,80,6,"Ether / IP / TCP 192.168.1.116:3299 > 203.119.169.16:http A"
192.168.192.1,192.168.192.2,137,137,17,"Ether / IP / UDP 192.168.192.1:netbios_ns > 192.168.192.2:netbios_ns / NBNSHeader / Raw"
192.168.1.116,202.112.14.21,6209,53,6,"Ether / IP / TCP 192.168.1.116:6209 > 202.112.14.21:domain S"
202.112.14.21,192.168.1.116,53,6209,6,"Ether / IP / TCP 202.112.14.21:domain > 192.168.1.116:6209 SA"
192.168.1.116,202.112.14.21,6209,53,6,"Ether / IP / TCP 192.168.1.116:6209 > 202.112.14.21:domain A"
192.168.1.116,202.112.14.21,6209,53,6,"Ether / IP / TCP 192.168.1.116:6209 > 202.112.14.21:domain PA / Raw"
192.168.1.116,202.112.14.21,6209,53,6,"Ether / IP / TCP 192.168.1.116:6209 > 202.112.14.21:domain PA / Raw"
202.112.14.21,192.168.1.116,53,6209,6,"Ether / IP / TCP 202.112.14.21:domain > 192.168.1.116:6209 A"
202.112.14.21,192.168.1.116,53,6209,6,"Ether / IP / TCP 202.112.14.21:domain > 192.168.1.116:6209 A"
202.112.14.21,192.168.1.116,53,6209,6,"Ether / IP / TCP / DNS Ans ""b'www-msn-com.a-0003.a-msedge.net.'"" "
192.168.1.116,202.112.14.21,6209,53,6,"Ether / IP / TCP 192.168.1.116:6209 > 202.112.14.21:domain FA"
202.112.14.21,192.168.1.116,53,6209,6,"Ether / IP / TCP 202.112.14.21:domain > 192.168.1.116:6209 FA"
192.168.1.116,202.112.14.21,6209,53,6,"Ether / IP / TCP 192.168.1.116:6209 > 202.112.14.21:domain A"
192.168.1.116,202.112.14.21,6210,53,6,"Ether / IP / TCP 192.168.1.116:6210 > 202.112.14.21:domain S"
192.168.1.116,202.112.14.21,6211,53,6,"Ether / IP / TCP 192.168.1.116:6211 > 202.112.14.21:domain S"
202.112.14.21,192.168.1.116,53,6210,6,"Ether / IP / TCP 202.112.14.21:domain > 192.168.1.116:6210 SA"
202.112.14.21,192.168.1.116,53,6211,6,"Ether / IP / TCP 202.112.14.21:domain > 192.168.1.116:6211 SA"
192.168.1.116,202.112.14.21,6210,53,6,"Ether / IP / TCP 192.168.1.116:6210 > 202.112.14.21:domain A"
192.168.1.116,202.112.14.21,6211,53,6,"Ether / IP / TCP 192.168.1.116:6211 > 202.112.14.21:domain A"
192.168.1.116,202.112.14.21,6211,53,6,"Ether / IP / TCP 192.168.1.116:6211 > 202.112.14.21:domain PA / Raw"
192.168.1.116,202.112.14.21,6211,53,6,"Ether / IP / TCP 192.168.1.116:6211 > 202.112.14.21:domain PA / Raw"
192.168.1.116,202.112.14.21,6210,53,6,"Ether / IP / TCP 192.168.1.116:6210 > 202.112.14.21:domain PA / Raw"
192.168.1.116,202.112.14.21,6210,53,6,"Ether / IP / TCP 192.168.1.116:6210 > 202.112.14.21:domain PA / Raw"
202.112.14.21,192.168.1.116,53,6211,6,"Ether / IP / TCP 202.112.14.21:domain > 192.168.1.116:6211 A"
202.112.14.21,192.168.1.116,53,6211,6,"Ether / IP / TCP 202.112.14.21:domain > 192.168.1.116:6211 A"
202.112.14.21,192.168.1.116,53,6210,6,"Ether / IP / TCP 202.112.14.21:domain > 192.168.1.116:6210 A"
202.112.14.21,192.168.1.116,53,6210,6,"Ether / IP / TCP 202.112.14.21:domain > 192.168.1.116:6210 A"
202.112.14.21,192.168.1.116,53,6211,6,"Ether / IP / TCP / DNS Ans ""b'www-msn-com.a-0003.a-msedge.net.'"" "
202.112.14.21,192.168.1.116,53,6210,6,"Ether / IP / TCP / DNS Ans ""b'www-msn-com.a-0003.a-msedge.net.'"" "
192.168.1.116,202.112.14.21,6211,53,6,"Ether / IP / TCP 192.168.1.116:6211 > 202.112.14.21:domain FA"
192.168.1.116,204.79.197.203,6212,443,6,"Ether / IP / TCP 192.168.1.116:6212 > 204.79.197.203:https S"
192.168.1.116,202.112.14.21,6210,53,6,"Ether / IP / TCP 192.168.1.116:6210 > 202.112.14.21:domain FA"
202.112.14.21,192.168.1.116,53,6211,6,"Ether / IP / TCP 202.112.14.21:domain > 192.168.1.116:6211 FA"
192.168.1.116,202.112.14.21,6211,53,6,"Ether / IP / TCP 192.168.1.116:6211 > 202.112.14.21:domain A"
202.112.14.21,192.168.1.116,53,6210,6,"Ether / IP / TCP 202.112.14.21:domain > 192.168.1.116:6210 FA"
192.168.1.116,202.112.14.21,6210,53,6,"Ether / IP / TCP 192.168.1.116:6210 > 202.112.14.21:domain A"
204.79.197.203,192.168.1.116,443,6212,6,"Ether / IP / TCP 204.79.197.203:https > 192.168.1.116:6212 SA"
192.168.1.116,204.79.197.203,6212,443,6,"Ether / IP / TCP 192.168.1.116:6212 > 204.79.197.203:https A"
192.168.1.116,204.79.197.203,6212,443,6,"Ether / IP / TCP 192.168.1.116:6212 > 204.79.197.203:https PA / Raw"
204.79.197.203,192.168.1.116,443,6212,6,"Ether / IP / TCP 204.79.197.203:https > 192.168.1.116:6212 A"
204.79.197.203,192.168.1.116,443,6212,6,"Ether / IP / TCP 204.79.197.203:https > 192.168.1.116:6212 A / Raw"
204.79.197.203,192.168.1.116,443,6212,6,"Ether / IP / TCP 204.79.197.203:https > 192.168.1.116:6212 A / Raw"
204.79.197.203,192.168.1.116,443,6212,6,"Ether / IP / TCP 204.79.197.203:https > 192.168.1.116:6212 A / Raw"
204.79.197.203,192.168.1.116,443,6212,6,"Ether / IP / TCP 204.79.197.203:https > 192.168.1.116:6212 PA / Raw"
192.168.1.116,204.79.197.203,6212,443,6,"Ether / IP / TCP 192.168.1.116:6212 > 204.79.197.203:https A"
192.168.1.116,204.79.197.203,6212,443,6,"Ether / IP / TCP 192.168.1.116:6212 > 204.79.197.203:https PA / Raw"
192.168.1.116,204.79.197.203,6212,443,6,"Ether / IP / TCP 192.168.1.116:6212 > 204.79.197.203:https PA / Raw"
192.168.1.116,204.79.197.203,6212,443,6,"Ether / IP / TCP 192.168.1.116:6212 > 204.79.197.203:https A / Raw"
192.168.1.116,204.79.197.203,6212,443,6,"Ether / IP / TCP 192.168.1.116:6212 > 204.79.197.203:https PA / Raw"
204.79.197.203,192.168.1.116,443,6212,6,"Ether / IP / TCP 204.79.197.203:https > 192.168.1.116:6212 A"
204.79.197.203,192.168.1.116,443,6212,6,"Ether / IP / TCP 204.79.197.203:https > 192.168.1.116:6212 A"
204.79.197.203,192.168.1.116,443,6212,6,"Ether / IP / TCP 204.79.197.203:https > 192.168.1.116:6212 PA / Raw"
204.79.197.203,192.168.1.116,443,6212,6,"Ether / IP / TCP 204.79.197.203:https > 192.168.1.116:6212 PA / Raw"
192.168.1.116,204.79.197.203,6212,443,6,"Ether / IP / TCP 192.168.1.116:6212 > 204.79.197.203:https A"
192.168.1.116,204.79.197.203,6212,443,6,"Ether / IP / TCP 192.168.1.116:6212 > 204.79.197.203:https PA / Raw"
204.79.197.203,192.168.1.116,443,6212,6,"Ether / IP / TCP 204.79.197.203:https > 192.168.1.116:6212 PA / Raw"
204.79.197.203,192.168.1.116,443,6212,6,"Ether / IP / TCP 204.79.197.203:https > 192.168.1.116:6212 A"
192.168.1.116,202.112.14.21,6213,53,6,"Ether / IP / TCP 192.168.1.116:6213 > 202.112.14.21:domain S"
202.112.14.21,192.168.1.116,53,6213,6,"Ether / IP / TCP 202.112.14.21:domain > 192.168.1.116:6213 SA"
192.168.1.116,202.112.14.21,6213,53,6,"Ether / IP / TCP 192.168.1.116:6213 > 202.112.14.21:domain A"
192.168.1.116,202.112.14.21,6213,53,6,"Ether / IP / TCP 192.168.1.116:6213 > 202.112.14.21:domain PA / Raw"
192.168.1.116,202.112.14.21,6213,53,6,"Ether / IP / TCP 192.168.1.116:6213 > 202.112.14.21:domain PA / Raw"
202.112.14.21,192.168.1.116,53,6213,6,"Ether / IP / TCP 202.112.14.21:domain > 192.168.1.116:6213 A"
202.112.14.21,192.168.1.116,53,6213,6,"Ether / IP / TCP 202.112.14.21:domain > 192.168.1.116:6213 A"
202.112.14.21,192.168.1.116,53,6213,6,"Ether / IP / TCP / DNS Ans ""b'msn-cn.a-0032.a-msedge.net.'"" "
192.168.1.116,202.112.14.21,6213,53,6,"Ether / IP / TCP 192.168.1.116:6213 > 202.112.14.21:domain FA"
202.112.14.21,192.168.1.116,53,6213,6,"Ether / IP / TCP 202.112.14.21:domain > 192.168.1.116:6213 FA"
192.168.1.116,202.112.14.21,6213,53,6,"Ether / IP / TCP 192.168.1.116:6213 > 202.112.14.21:domain A"
192.168.1.116,202.112.14.21,6214,53,6,"Ether / IP / TCP 192.168.1.116:6214 > 202.112.14.21:domain S"
192.168.1.116,202.112.14.21,6215,53,6,"Ether / IP / TCP 192.168.1.116:6215 > 202.112.14.21:domain S"
202.112.14.21,192.168.1.116,53,6214,6,"Ether / IP / TCP 202.112.14.21:domain > 192.168.1.116:6214 SA"
202.112.14.21,192.168.1.116,53,6215,6,"Ether / IP / TCP 202.112.14.21:domain > 192.168.1.116:6215 SA"
192.168.1.116,202.112.14.21,6214,53,6,"Ether / IP / TCP 192.168.1.116:6214 > 202.112.14.21:domain A"
192.168.1.116,202.112.14.21,6215,53,6,"Ether / IP / TCP 192.168.1.116:6215 > 202.112.14.21:domain A"
192.168.1.116,202.112.14.21,6215,53,6,"Ether / IP / TCP 192.168.1.116:6215 > 202.112.14.21:domain PA / Raw"
192.168.1.116,202.112.14.21,6215,53,6,"Ether / IP / TCP 192.168.1.116:6215 > 202.112.14.21:domain PA / Raw"
192.168.1.116,202.112.14.21,6214,53,6,"Ether / IP / TCP 192.168.1.116:6214 > 202.112.14.21:domain PA / Raw"
192.168.1.116,202.112.14.21,6214,53,6,"Ether / IP / TCP 192.168.1.116:6214 > 202.112.14.21:domain PA / Raw"
202.112.14.21,192.168.1.116,53,6214,6,"Ether / IP / TCP 202.112.14.21:domain > 192.168.1.116:6214 A"
202.112.14.21,192.168.1.116,53,6215,6,"Ether / IP / TCP 202.112.14.21:domain > 192.168.1.116:6215 A"
202.112.14.21,192.168.1.116,53,6214,6,"Ether / IP / TCP 202.112.14.21:domain > 192.168.1.116:6214 A"
202.112.14.21,192.168.1.116,53,6215,6,"Ether / IP / TCP 202.112.14.21:domain > 192.168.1.116:6215 A"
202.112.14.21,192.168.1.116,53,6214,6,"Ether / IP / TCP / DNS Ans ""b'msn-cn.a-0032.a-msedge.net.'"" "
202.112.14.21,192.168.1.116,53,6215,6,"Ether / IP / TCP / DNS Ans ""b'msn-cn.a-0032.a-msedge.net.'"" "
192.168.1.116,202.112.14.21,6215,53,6,"Ether / IP / TCP 192.168.1.116:6215 > 202.112.14.21:domain FA"
192.168.1.116,202.89.233.96,6216,443,6,"Ether / IP / TCP 192.168.1.116:6216 > 202.89.233.96:https S"
192.168.1.116,202.112.14.21,6214,53,6,"Ether / IP / TCP 192.168.1.116:6214 > 202.112.14.21:domain FA"
202.112.14.21,192.168.1.116,53,6215,6,"Ether / IP / TCP 202.112.14.21:domain > 192.168.1.116:6215 FA"
192.168.1.116,202.112.14.21,6215,53,6,"Ether / IP / TCP 192.168.1.116:6215 > 202.112.14.21:domain A"
202.112.14.21,192.168.1.116,53,6214,6,"Ether / IP / TCP 202.112.14.21:domain > 192.168.1.116:6214 FA"
192.168.1.116,202.112.14.21,6214,53,6,"Ether / IP / TCP 192.168.1.116:6214 > 202.112.14.21:domain A"
192.168.1.116,204.79.197.203,6212,443,6,"Ether / IP / TCP 192.168.1.116:6212 > 204.79.197.203:https A"
202.89.233.96,192.168.1.116,443,6216,6,"Ether / IP / TCP 202.89.233.96:https > 192.168.1.116:6216 SA"
192.168.1.116,202.89.233.96,6216,443,6,"Ether / IP / TCP 192.168.1.116:6216 > 202.89.233.96:https A"
192.168.1.116,202.89.233.96,6216,443,6,"Ether / IP / TCP 192.168.1.116:6216 > 202.89.233.96:https PA / Raw"
192.168.1.116,202.112.14.21,49905,53,17,"Ether / IP / UDP / DNS Qry ""b'www.baidu.com.'"" "
202.112.14.21,192.168.1.116,53,49905,17,"Ether / IP / UDP / DNS Ans ""b'www.a.shifen.com.'"" "
192.168.1.116,182.61.200.7,6217,80,6,"Ether / IP / TCP 192.168.1.116:6217 > 182.61.200.7:http S"
182.61.200.7,192.168.1.116,80,6217,6,"Ether / IP / TCP 182.61.200.7:http > 192.168.1.116:6217 SA"
192.168.1.116,182.61.200.7,6217,80,6,"Ether / IP / TCP 192.168.1.116:6217 > 182.61.200.7:http A"
202.89.233.96,192.168.1.116,443,6216,6,"Ether / IP / TCP 202.89.233.96:https > 192.168.1.116:6216 A"
202.89.233.96,192.168.1.116,443,6216,6,"Ether / IP / TCP 202.89.233.96:https > 192.168.1.116:6216 A / Raw"
202.89.233.96,192.168.1.116,443,6216,6,"Ether / IP / TCP 202.89.233.96:https > 192.168.1.116:6216 A / Raw"
202.89.233.96,192.168.1.116,443,6216,6,"Ether / IP / TCP 202.89.233.96:https > 192.168.1.116:6216 A / Raw"
202.89.233.96,192.168.1.116,443,6216,6,"Ether / IP / TCP 202.89.233.96:https > 192.168.1.116:6216 PA / Raw"
192.168.1.116,202.89.233.96,6216,443,6,"Ether / IP / TCP 192.168.1.116:6216 > 202.89.233.96:https A"
192.168.1.116,202.89.233.96,6216,443,6,"Ether / IP / TCP 192.168.1.116:6216 > 202.89.233.96:https PA / Raw"
192.168.1.116,202.89.233.96,6216,443,6,"Ether / IP / TCP 192.168.1.116:6216 > 202.89.233.96:https PA / Raw"
192.168.1.116,202.89.233.96,6216,443,6,"Ether / IP / TCP 192.168.1.116:6216 > 202.89.233.96:https A / Raw"
192.168.1.116,202.89.233.96,6216,443,6,"Ether / IP / TCP 192.168.1.116:6216 > 202.89.233.96:https A / Raw"
192.168.1.116,202.89.233.96,6216,443,6,"Ether / IP / TCP 192.168.1.116:6216 > 202.89.233.96:https A / Raw"
192.168.1.116,202.89.233.96,6216,443,6,"Ether / IP / TCP 192.168.1.116:6216 > 202.89.233.96:https PA / Raw"
192.168.1.116,182.61.200.7,6217,80,6,"Ether / IP / TCP 192.168.1.116:6217 > 182.61.200.7:http FA"
182.61.200.7,192.168.1.116,80,6217,6,"Ether / IP / TCP 182.61.200.7:http > 192.168.1.116:6217 A"
182.61.200.7,192.168.1.116,80,6217,6,"Ether / IP / TCP 182.61.200.7:http > 192.168.1.116:6217 FA"
192.168.1.116,182.61.200.7,6217,80,6,"Ether / IP / TCP 192.168.1.116:6217 > 182.61.200.7:http A"
192.168.1.116,203.119.169.16,3299,80,6,"Ether / IP / TCP 192.168.1.116:3299 > 203.119.169.16:http PA / Raw"
192.168.1.116,203.119.169.16,3299,80,6,"Ether / IP / TCP 192.168.1.116:3299 > 203.119.169.16:http A / Raw"
192.168.1.116,203.119.169.16,3299,80,6,"Ether / IP / TCP 192.168.1.116:3299 > 203.119.169.16:http A / Raw"
192.168.1.116,203.119.169.16,3299,80,6,"Ether / IP / TCP 192.168.1.116:3299 > 203.119.169.16:http PA / Raw"
202.89.233.96,192.168.1.116,443,6216,6,"Ether / IP / TCP 202.89.233.96:https > 192.168.1.116:6216 A"
202.89.233.96,192.168.1.116,443,6216,6,"Ether / IP / TCP 202.89.233.96:https > 192.168.1.116:6216 A"
202.89.233.96,192.168.1.116,443,6216,6,"Ether / IP / TCP 202.89.233.96:https > 192.168.1.116:6216 A"
202.89.233.96,192.168.1.116,443,6216,6,"Ether / IP / TCP 202.89.233.96:https > 192.168.1.116:6216 A"
202.89.233.96,192.168.1.116,443,6216,6,"Ether / IP / TCP 202.89.233.96:https > 192.168.1.116:6216 PA / Raw"
202.89.233.96,192.168.1.116,443,6216,6,"Ether / IP / TCP 202.89.233.96:https > 192.168.1.116:6216 PA / Raw"
192.168.1.116,202.89.233.96,6216,443,6,"Ether / IP / TCP 192.168.1.116:6216 > 202.89.233.96:https A"
192.168.1.116,202.89.233.96,6216,443,6,"Ether / IP / TCP 192.168.1.116:6216 > 202.89.233.96:https PA / Raw"
203.119.169.16,192.168.1.116,80,3299,6,"Ether / IP / TCP 203.119.169.16:http > 192.168.1.116:3299 A"
203.119.169.16,192.168.1.116,80,3299,6,"Ether / IP / TCP 203.119.169.16:http > 192.168.1.116:3299 PA / Raw"
203.119.169.16,192.168.1.116,80,3299,6,"Ether / IP / TCP 203.119.169.16:http > 192.168.1.116:3299 PA / Raw"
192.168.1.116,203.119.169.16,3299,80,6,"Ether / IP / TCP 192.168.1.116:3299 > 203.119.169.16:http A"
202.89.233.96,192.168.1.116,443,6216,6,"Ether / IP / TCP 202.89.233.96:https > 192.168.1.116:6216 PA / Raw"
202.89.233.96,192.168.1.116,443,6216,6,"Ether / IP / TCP 202.89.233.96:https > 192.168.1.116:6216 A / Raw"
202.89.233.96,192.168.1.116,443,6216,6,"Ether / IP / TCP 202.89.233.96:https > 192.168.1.116:6216 A / Raw"
202.89.233.96,192.168.1.116,443,6216,6,"Ether / IP / TCP 202.89.233.96:https > 192.168.1.116:6216 A / Raw"
202.89.233.96,192.168.1.116,443,6216,6,"Ether / IP / TCP 202.89.233.96:https > 192.168.1.116:6216 A / Raw"
202.89.233.96,192.168.1.116,443,6216,6,"Ether / IP / TCP 202.89.233.96:https > 192.168.1.116:6216 PA / Raw"
202.89.233.96,192.168.1.116,443,6216,6,"Ether / IP / TCP 202.89.233.96:https > 192.168.1.116:6216 PA / Raw"
202.89.233.96,192.168.1.116,443,6216,6,"Ether / IP / TCP 202.89.233.96:https > 192.168.1.116:6216 PA / Raw"
202.89.233.96,192.168.1.116,443,6216,6,"Ether / IP / TCP 202.89.233.96:https > 192.168.1.116:6216 PA / Raw"
202.89.233.96,192.168.1.116,443,6216,6,"Ether / IP / TCP 202.89.233.96:https > 192.168.1.116:6216 A / Raw"
202.89.233.96,192.168.1.116,443,6216,6,"Ether / IP / TCP 202.89.233.96:https > 192.168.1.116:6216 A / Raw"
202.89.233.96,192.168.1.116,443,6216,6,"Ether / IP / TCP 202.89.233.96:https > 192.168.1.116:6216 PA / Raw"
202.89.233.96,192.168.1.116,443,6216,6,"Ether / IP / TCP 202.89.233.96:https > 192.168.1.116:6216 A / Raw"
202.89.233.96,192.168.1.116,443,6216,6,"Ether / IP / TCP 202.89.233.96:https > 192.168.1.116:6216 A / Raw"
202.89.233.96,192.168.1.116,443,6216,6,"Ether / IP / TCP 202.89.233.96:https > 192.168.1.116:6216 PA / Raw"
202.89.233.96,192.168.1.116,443,6216,6,"Ether / IP / TCP 202.89.233.96:https > 192.168.1.116:6216 A / Raw"
202.89.233.96,192.168.1.116,443,6216,6,"Ether / IP / TCP 202.89.233.96:https > 192.168.1.116:6216 A / Raw"
202.89.233.96,192.168.1.116,443,6216,6,"Ether / IP / TCP 202.89.233.96:https > 192.168.1.116:6216 PA / Raw"
192.168.1.116,202.89.233.96,6216,443,6,"Ether / IP / TCP 192.168.1.116:6216 > 202.89.233.96:https A"
202.89.233.96,192.168.1.116,443,6216,6,"Ether / IP / TCP 202.89.233.96:https > 192.168.1.116:6216 PA / Raw"
202.89.233.96,192.168.1.116,443,6216,6,"Ether / IP / TCP 202.89.233.96:https > 192.168.1.116:6216 A / Raw"
202.89.233.96,192.168.1.116,443,6216,6,"Ether / IP / TCP 202.89.233.96:https > 192.168.1.116:6216 PA / Raw"
202.89.233.96,192.168.1.116,443,6216,6,"Ether / IP / TCP 202.89.233.96:https > 192.168.1.116:6216 A / Raw"
202.89.233.96,192.168.1.116,443,6216,6,"Ether / IP / TCP 202.89.233.96:https > 192.168.1.116:6216 A / Raw"
202.89.233.96,192.168.1.116,443,6216,6,"Ether / IP / TCP 202.89.233.96:https > 192.168.1.116:6216 PA / Raw"
202.89.233.96,192.168.1.116,443,6216,6,"Ether / IP / TCP 202.89.233.96:https > 192.168.1.116:6216 PA / Raw"
202.89.233.96,192.168.1.116,443,6216,6,"Ether / IP / TCP 202.89.233.96:https > 192.168.1.116:6216 A / Raw"
202.89.233.96,192.168.1.116,443,6216,6,"Ether / IP / TCP 202.89.233.96:https > 192.168.1.116:6216 A / Raw"
192.168.1.116,202.89.233.96,6216,443,6,"Ether / IP / TCP 192.168.1.116:6216 > 202.89.233.96:https A"
202.89.233.96,192.168.1.116,443,6216,6,"Ether / IP / TCP 202.89.233.96:https > 192.168.1.116:6216 PA / Raw"
202.89.233.96,192.168.1.116,443,6216,6,"Ether / IP / TCP 202.89.233.96:https > 192.168.1.116:6216 A / Raw"
202.89.233.96,192.168.1.116,443,6216,6,"Ether / IP / TCP 202.89.233.96:https > 192.168.1.116:6216 A / Raw"
202.89.233.96,192.168.1.116,443,6216,6,"Ether / IP / TCP 202.89.233.96:https > 192.168.1.116:6216 A / Raw"
202.89.233.96,192.168.1.116,443,6216,6,"Ether / IP / TCP 202.89.233.96:https > 192.168.1.116:6216 PA / Raw"
202.89.233.96,192.168.1.116,443,6216,6,"Ether / IP / TCP 202.89.233.96:https > 192.168.1.116:6216 A / Raw"
202.89.233.96,192.168.1.116,443,6216,6,"Ether / IP / TCP 202.89.233.96:https > 192.168.1.116:6216 PA / Raw"
202.89.233.96,192.168.1.116,443,6216,6,"Ether / IP / TCP 202.89.233.96:https > 192.168.1.116:6216 A / Raw"
202.89.233.96,192.168.1.116,443,6216,6,"Ether / IP / TCP 202.89.233.96:https > 192.168.1.116:6216 PA / Raw"
192.168.1.116,202.89.233.96,6216,443,6,"Ether / IP / TCP 192.168.1.116:6216 > 202.89.233.96:https A"
192.168.1.116,202.89.233.96,6216,443,6,"Ether / IP / TCP 192.168.1.116:6216 > 202.89.233.96:https A"
192.168.1.116,202.89.233.96,6216,443,6,"Ether / IP / TCP 192.168.1.116:6216 > 202.89.233.96:https A"
192.168.1.116,202.112.14.21,6218,53,6,"Ether / IP / TCP 192.168.1.116:6218 > 202.112.14.21:domain S"
192.168.1.116,202.112.14.21,6219,53,6,"Ether / IP / TCP 192.168.1.116:6219 > 202.112.14.21:domain S"
192.168.1.116,202.112.14.21,6220,53,6,"Ether / IP / TCP 192.168.1.116:6220 > 202.112.14.21:domain S"
192.168.1.116,202.112.14.21,6221,53,6,"Ether / IP / TCP 192.168.1.116:6221 > 202.112.14.21:domain S"
192.168.1.116,202.112.14.21,6222,53,6,"Ether / IP / TCP 192.168.1.116:6222 > 202.112.14.21:domain S"
192.168.1.116,202.112.14.21,6223,53,6,"Ether / IP / TCP 192.168.1.116:6223 > 202.112.14.21:domain S"
202.112.14.21,192.168.1.116,53,6218,6,"Ether / IP / TCP 202.112.14.21:domain > 192.168.1.116:6218 SA"
202.112.14.21,192.168.1.116,53,6219,6,"Ether / IP / TCP 202.112.14.21:domain > 192.168.1.116:6219 SA"
202.112.14.21,192.168.1.116,53,6220,6,"Ether / IP / TCP 202.112.14.21:domain > 192.168.1.116:6220 SA"
202.112.14.21,192.168.1.116,53,6221,6,"Ether / IP / TCP 202.112.14.21:domain > 192.168.1.116:6221 SA"
202.112.14.21,192.168.1.116,53,6222,6,"Ether / IP / TCP 202.112.14.21:domain > 192.168.1.116:6222 SA"
192.168.1.116,202.112.14.21,6218,53,6,"Ether / IP / TCP 192.168.1.116:6218 > 202.112.14.21:domain A"
192.168.1.116,202.112.14.21,6219,53,6,"Ether / IP / TCP 192.168.1.116:6219 > 202.112.14.21:domain A"
192.168.1.116,202.112.14.21,6220,53,6,"Ether / IP / TCP 192.168.1.116:6220 > 202.112.14.21:domain A"
192.168.1.116,202.112.14.21,6221,53,6,"Ether / IP / TCP 192.168.1.116:6221 > 202.112.14.21:domain A"
192.168.1.116,202.112.14.21,6218,53,6,"Ether / IP / TCP 192.168.1.116:6218 > 202.112.14.21:domain PA / Raw"
192.168.1.116,202.112.14.21,6222,53,6,"Ether / IP / TCP 192.168.1.116:6222 > 202.112.14.21:domain A"
192.168.1.116,202.112.14.21,6218,53,6,"Ether / IP / TCP 192.168.1.116:6218 > 202.112.14.21:domain PA / Raw"
192.168.1.116,202.112.14.21,6219,53,6,"Ether / IP / TCP 192.168.1.116:6219 > 202.112.14.21:domain PA / Raw"
192.168.1.116,202.112.14.21,6219,53,6,"Ether / IP / TCP 192.168.1.116:6219 > 202.112.14.21:domain PA / Raw"
192.168.1.116,202.112.14.21,6220,53,6,"Ether / IP / TCP 192.168.1.116:6220 > 202.112.14.21:domain PA / Raw"
192.168.1.116,202.112.14.21,6220,53,6,"Ether / IP / TCP 192.168.1.116:6220 > 202.112.14.21:domain PA / Raw"
192.168.1.116,202.112.14.21,6221,53,6,"Ether / IP / TCP 192.168.1.116:6221 > 202.112.14.21:domain PA / Raw"
192.168.1.116,202.112.14.21,6221,53,6,"Ether / IP / TCP 192.168.1.116:6221 > 202.112.14.21:domain PA / Raw"
192.168.1.116,202.112.14.21,6222,53,6,"Ether / IP / TCP 192.168.1.116:6222 > 202.112.14.21:domain PA / Raw"
192.168.1.116,202.112.14.21,6222,53,6,"Ether / IP / TCP 192.168.1.116:6222 > 202.112.14.21:domain PA / Raw"
202.112.14.21,192.168.1.116,53,6223,6,"Ether / IP / TCP 202.112.14.21:domain > 192.168.1.116:6223 SA"
192.168.1.116,202.112.14.21,6223,53,6,"Ether / IP / TCP 192.168.1.116:6223 > 202.112.14.21:domain A"
192.168.1.116,202.112.14.21,6223,53,6,"Ether / IP / TCP 192.168.1.116:6223 > 202.112.14.21:domain PA / Raw"
192.168.1.116,202.112.14.21,6223,53,6,"Ether / IP / TCP 192.168.1.116:6223 > 202.112.14.21:domain PA / Raw"
202.112.14.21,192.168.1.116,53,6218,6,"Ether / IP / TCP 202.112.14.21:domain > 192.168.1.116:6218 A"
202.112.14.21,192.168.1.116,53,6218,6,"Ether / IP / TCP 202.112.14.21:domain > 192.168.1.116:6218 A"
202.112.14.21,192.168.1.116,53,6219,6,"Ether / IP / TCP 202.112.14.21:domain > 192.168.1.116:6219 A"
202.112.14.21,192.168.1.116,53,6219,6,"Ether / IP / TCP 202.112.14.21:domain > 192.168.1.116:6219 A"
202.112.14.21,192.168.1.116,53,6220,6,"Ether / IP / TCP 202.112.14.21:domain > 192.168.1.116:6220 A"
202.112.14.21,192.168.1.116,53,6220,6,"Ether / IP / TCP 202.112.14.21:domain > 192.168.1.116:6220 A"
202.112.14.21,192.168.1.116,53,6219,6,"Ether / IP / TCP / DNS Ans ""b'a1834.dscg2.akamai.net.'"" "
202.112.14.21,192.168.1.116,53,6218,6,"Ether / IP / TCP / DNS Ans ""b'a1834.dscg2.akamai.net.'"" "
202.112.14.21,192.168.1.116,53,6220,6,"Ether / IP / TCP / DNS Ans ""13.226.120.77"" "
202.112.14.21,192.168.1.116,53,6221,6,"Ether / IP / TCP 202.112.14.21:domain > 192.168.1.116:6221 A"
202.112.14.21,192.168.1.116,53,6221,6,"Ether / IP / TCP 202.112.14.21:domain > 192.168.1.116:6221 A"
202.112.14.21,192.168.1.116,53,6222,6,"Ether / IP / TCP 202.112.14.21:domain > 192.168.1.116:6222 A"
202.112.14.21,192.168.1.116,53,6222,6,"Ether / IP / TCP 202.112.14.21:domain > 192.168.1.116:6222 A"
202.112.14.21,192.168.1.116,53,6221,6,"Ether / IP / TCP / DNS Ans "
202.112.14.21,192.168.1.116,53,6223,6,"Ether / IP / TCP 202.112.14.21:domain > 192.168.1.116:6223 A"
202.112.14.21,192.168.1.116,53,6223,6,"Ether / IP / TCP 202.112.14.21:domain > 192.168.1.116:6223 A"
202.112.14.21,192.168.1.116,53,6222,6,"Ether / IP / TCP / DNS Ans ""b'p-th.bing.com.trafficmanager.net.'"" "
202.112.14.21,192.168.1.116,53,6223,6,"Ether / IP / TCP / DNS Ans ""b'p-th.bing.com.trafficmanager.net.'"" "
192.168.1.116,202.112.14.21,6219,53,6,"Ether / IP / TCP 192.168.1.116:6219 > 202.112.14.21:domain FA"
192.168.1.116,202.112.14.21,6218,53,6,"Ether / IP / TCP 192.168.1.116:6218 > 202.112.14.21:domain FA"
192.168.1.116,202.112.14.21,6220,53,6,"Ether / IP / TCP 192.168.1.116:6220 > 202.112.14.21:domain FA"
192.168.1.116,202.112.14.21,6223,53,6,"Ether / IP / TCP 192.168.1.116:6223 > 202.112.14.21:domain FA"
192.168.1.116,202.112.14.21,6222,53,6,"Ether / IP / TCP 192.168.1.116:6222 > 202.112.14.21:domain FA"
192.168.1.116,202.112.14.21,6221,53,6,"Ether / IP / TCP 192.168.1.116:6221 > 202.112.14.21:domain FA"
202.112.14.21,192.168.1.116,53,6219,6,"Ether / IP / TCP 202.112.14.21:domain > 192.168.1.116:6219 FA"
192.168.1.116,202.112.14.21,6219,53,6,"Ether / IP / TCP 192.168.1.116:6219 > 202.112.14.21:domain A"
192.168.1.116,202.112.14.21,6224,53,6,"Ether / IP / TCP 192.168.1.116:6224 > 202.112.14.21:domain S"
202.112.14.21,192.168.1.116,53,6222,6,"Ether / IP / TCP 202.112.14.21:domain > 192.168.1.116:6222 FA"
202.112.14.21,192.168.1.116,53,6218,6,"Ether / IP / TCP 202.112.14.21:domain > 192.168.1.116:6218 FA"
202.112.14.21,192.168.1.116,53,6220,6,"Ether / IP / TCP 202.112.14.21:domain > 192.168.1.116:6220 FA"
202.112.14.21,192.168.1.116,53,6223,6,"Ether / IP / TCP 202.112.14.21:domain > 192.168.1.116:6223 FA"
192.168.1.116,202.112.14.21,6222,53,6,"Ether / IP / TCP 192.168.1.116:6222 > 202.112.14.21:domain A"
