srcip,dstip,sport,dport,proto,data
58.223.1.234,192.168.0.106,8080,3571,6,"Ether / IP / TCP 58.223.1.234:8080 > 192.168.0.106:3571 A / Padding"
58.223.1.234,192.168.0.106,8080,3571,6,"Ether / IP / TCP 58.223.1.234:8080 > 192.168.0.106:3571 A / Padding"
58.223.1.234,192.168.0.106,8080,3571,6,"Ether / IP / TCP 58.223.1.234:8080 > 192.168.0.106:3571 PA / Raw"
58.223.1.234,192.168.0.106,8080,3571,6,"Ether / IP / TCP 58.223.1.234:8080 > 192.168.0.106:3571 FA"
192.168.0.106,58.223.1.234,3571,8080,6,"Ether / IP / TCP 192.168.0.106:3571 > 58.223.1.234:8080 RA"
192.168.0.103,224.0.0.251,5353,5353,17,"Ether / IP / UDP / DNS Qry ""b'_sleep-proxy._udp.local.'"" "
0,0,0,0,0,"Ether / IPv6 / UDP / DNS Qry ""b'_sleep-proxy._udp.local.'"" "
192.168.0.106,116.132.235.228,3580,80,6,"Ether / IP / TCP 192.168.0.106:3580 > 116.132.235.228:http S"
116.132.235.228,192.168.0.106,80,3580,6,"Ether / IP / TCP 116.132.235.228:http > 192.168.0.106:3580 SA"
192.168.0.106,116.132.235.228,3580,80,6,"Ether / IP / TCP 192.168.0.106:3580 > 116.132.235.228:http A"
192.168.0.106,116.132.235.228,3580,80,6,"Ether / IP / TCP 192.168.0.106:3580 > 116.132.235.228:http PA / Raw"
192.168.0.106,116.132.235.228,3580,80,6,"Ether / IP / TCP 192.168.0.106:3580 > 116.132.235.228:http A / Raw"
192.168.0.106,116.132.235.228,3580,80,6,"Ether / IP / TCP 192.168.0.106:3580 > 116.132.235.228:http A / Raw"
192.168.0.106,116.132.235.228,3580,80,6,"Ether / IP / TCP 192.168.0.106:3580 > 116.132.235.228:http PA / Raw"
192.168.0.103,224.0.0.251,5353,5353,17,"Ether / IP / UDP / DNS Ans ""[b'rpBA=7F:AE:68:13:0B:8B', b'rpVr=440.9', b'rpAD=8df32772270f']"" "
0,0,0,0,0,"Ether / IPv6 / UDP / DNS Ans ""[b'rpBA=7F:AE:68:13:0B:8B', b'rpVr=440.9', b'rpAD=8df32772270f']"" "
116.132.235.228,192.168.0.106,80,3580,6,"Ether / IP / TCP 116.132.235.228:http > 192.168.0.106:3580 A"
116.132.235.228,192.168.0.106,80,3580,6,"Ether / IP / TCP 116.132.235.228:http > 192.168.0.106:3580 A"
116.132.235.228,192.168.0.106,80,3580,6,"Ether / IP / TCP 116.132.235.228:http > 192.168.0.106:3580 A"
116.132.235.228,192.168.0.106,80,3580,6,"Ether / IP / TCP 116.132.235.228:http > 192.168.0.106:3580 PA / Raw"
116.132.235.228,192.168.0.106,80,3580,6,"Ether / IP / TCP 116.132.235.228:http > 192.168.0.106:3580 FA"
192.168.0.106,116.132.235.228,3580,80,6,"Ether / IP / TCP 192.168.0.106:3580 > 116.132.235.228:http A"
192.168.0.106,116.132.235.228,3580,80,6,"Ether / IP / TCP 192.168.0.106:3580 > 116.132.235.228:http FA"
116.132.235.228,192.168.0.106,80,3580,6,"Ether / IP / TCP 116.132.235.228:http > 192.168.0.106:3580 A"
157.255.191.89,192.168.0.106,8080,14800,6,"Ether / IP / TCP 157.255.191.89:8080 > 192.168.0.106:14800 PA / Raw"
192.168.0.106,157.255.191.89,14800,8080,6,"Ether / IP / TCP 192.168.0.106:14800 > 157.255.191.89:8080 PA / Raw"
157.255.191.89,192.168.0.106,8080,14800,6,"Ether / IP / TCP 157.255.191.89:8080 > 192.168.0.106:14800 PA / Raw"
192.168.0.106,157.255.191.89,14800,8080,6,"Ether / IP / TCP 192.168.0.106:14800 > 157.255.191.89:8080 A"
192.168.0.106,116.132.235.228,3581,80,6,"Ether / IP / TCP 192.168.0.106:3581 > 116.132.235.228:http S"
116.132.235.228,192.168.0.106,80,3581,6,"Ether / IP / TCP 116.132.235.228:http > 192.168.0.106:3581 SA"
192.168.0.106,116.132.235.228,3581,80,6,"Ether / IP / TCP 192.168.0.106:3581 > 116.132.235.228:http A"
192.168.0.106,116.132.235.228,3581,80,6,"Ether / IP / TCP 192.168.0.106:3581 > 116.132.235.228:http PA / Raw"
192.168.0.106,116.132.235.228,3581,80,6,"Ether / IP / TCP 192.168.0.106:3581 > 116.132.235.228:http A / Raw"
192.168.0.106,116.132.235.228,3581,80,6,"Ether / IP / TCP 192.168.0.106:3581 > 116.132.235.228:http A / Raw"
192.168.0.106,116.132.235.228,3581,80,6,"Ether / IP / TCP 192.168.0.106:3581 > 116.132.235.228:http PA / Raw"
116.132.235.228,192.168.0.106,80,3581,6,"Ether / IP / TCP 116.132.235.228:http > 192.168.0.106:3581 A"
116.132.235.228,192.168.0.106,80,3581,6,"Ether / IP / TCP 116.132.235.228:http > 192.168.0.106:3581 A"
116.132.235.228,192.168.0.106,80,3581,6,"Ether / IP / TCP 116.132.235.228:http > 192.168.0.106:3581 A"
116.132.235.228,192.168.0.106,80,3581,6,"Ether / IP / TCP 116.132.235.228:http > 192.168.0.106:3581 PA / Raw"
116.132.235.228,192.168.0.106,80,3581,6,"Ether / IP / TCP 116.132.235.228:http > 192.168.0.106:3581 FA"
192.168.0.106,116.132.235.228,3581,80,6,"Ether / IP / TCP 192.168.0.106:3581 > 116.132.235.228:http A"
192.168.0.106,116.132.235.228,3581,80,6,"Ether / IP / TCP 192.168.0.106:3581 > 116.132.235.228:http FA"
192.168.0.106,116.132.235.228,3581,80,6,"Ether / IP / TCP 192.168.0.106:3581 > 116.132.235.228:http FA"
192.168.0.106,116.132.235.228,3581,80,6,"Ether / IP / TCP 192.168.0.106:3581 > 116.132.235.228:http FA"
192.168.0.106,116.132.235.228,3582,80,6,"Ether / IP / TCP 192.168.0.106:3582 > 116.132.235.228:http S"
116.132.235.228,192.168.0.106,80,3582,6,"Ether / IP / TCP 116.132.235.228:http > 192.168.0.106:3582 SA"
192.168.0.106,116.132.235.228,3582,80,6,"Ether / IP / TCP 192.168.0.106:3582 > 116.132.235.228:http A"
192.168.0.106,116.132.235.228,3582,80,6,"Ether / IP / TCP 192.168.0.106:3582 > 116.132.235.228:http PA / Raw"
192.168.0.106,116.132.235.228,3582,80,6,"Ether / IP / TCP 192.168.0.106:3582 > 116.132.235.228:http A / Raw"
192.168.0.106,116.132.235.228,3582,80,6,"Ether / IP / TCP 192.168.0.106:3582 > 116.132.235.228:http A / Raw"
192.168.0.106,116.132.235.228,3582,80,6,"Ether / IP / TCP 192.168.0.106:3582 > 116.132.235.228:http PA / Raw"
116.132.235.228,192.168.0.106,80,3582,6,"Ether / IP / TCP 116.132.235.228:http > 192.168.0.106:3582 A"
116.132.235.228,192.168.0.106,80,3582,6,"Ether / IP / TCP 116.132.235.228:http > 192.168.0.106:3582 A"
116.132.235.228,192.168.0.106,80,3582,6,"Ether / IP / TCP 116.132.235.228:http > 192.168.0.106:3582 A"
116.132.235.228,192.168.0.106,80,3582,6,"Ether / IP / TCP 116.132.235.228:http > 192.168.0.106:3582 PA / Raw"
116.132.235.228,192.168.0.106,80,3582,6,"Ether / IP / TCP 116.132.235.228:http > 192.168.0.106:3582 FA"
192.168.0.106,116.132.235.228,3582,80,6,"Ether / IP / TCP 192.168.0.106:3582 > 116.132.235.228:http A"
192.168.0.106,116.132.235.228,3582,80,6,"Ether / IP / TCP 192.168.0.106:3582 > 116.132.235.228:http FA"
192.168.0.106,116.132.235.228,3583,80,6,"Ether / IP / TCP 192.168.0.106:3583 > 116.132.235.228:http S"
116.132.235.228,192.168.0.106,80,3583,6,"Ether / IP / TCP 116.132.235.228:http > 192.168.0.106:3583 SA"
192.168.0.106,116.132.235.228,3583,80,6,"Ether / IP / TCP 192.168.0.106:3583 > 116.132.235.228:http A"
192.168.0.106,116.132.235.228,3583,80,6,"Ether / IP / TCP 192.168.0.106:3583 > 116.132.235.228:http PA / Raw"
192.168.0.106,116.132.235.228,3583,80,6,"Ether / IP / TCP 192.168.0.106:3583 > 116.132.235.228:http A / Raw"
192.168.0.106,116.132.235.228,3583,80,6,"Ether / IP / TCP 192.168.0.106:3583 > 116.132.235.228:http A / Raw"
192.168.0.106,116.132.235.228,3583,80,6,"Ether / IP / TCP 192.168.0.106:3583 > 116.132.235.228:http PA / Raw"
116.132.235.228,192.168.0.106,80,3583,6,"Ether / IP / TCP 116.132.235.228:http > 192.168.0.106:3583 A"
116.132.235.228,192.168.0.106,80,3583,6,"Ether / IP / TCP 116.132.235.228:http > 192.168.0.106:3583 A"
116.132.235.228,192.168.0.106,80,3583,6,"Ether / IP / TCP 116.132.235.228:http > 192.168.0.106:3583 A"
116.132.235.228,192.168.0.106,80,3583,6,"Ether / IP / TCP 116.132.235.228:http > 192.168.0.106:3583 PA / Raw"
116.132.235.228,192.168.0.106,80,3583,6,"Ether / IP / TCP 116.132.235.228:http > 192.168.0.106:3583 FA"
192.168.0.106,116.132.235.228,3583,80,6,"Ether / IP / TCP 192.168.0.106:3583 > 116.132.235.228:http A"
192.168.0.106,116.132.235.228,3583,80,6,"Ether / IP / TCP 192.168.0.106:3583 > 116.132.235.228:http FA"
192.168.0.106,116.132.235.228,3582,80,6,"Ether / IP / TCP 192.168.0.106:3582 > 116.132.235.228:http FA"
192.168.0.106,116.132.235.228,3583,80,6,"Ether / IP / TCP 192.168.0.106:3583 > 116.132.235.228:http FA"
192.168.0.106,116.132.235.228,3582,80,6,"Ether / IP / TCP 192.168.0.106:3582 > 116.132.235.228:http FA"
192.168.0.106,116.132.235.228,3581,80,6,"Ether / IP / TCP 192.168.0.106:3581 > 116.132.235.228:http FA"
192.168.0.106,116.132.235.228,3583,80,6,"Ether / IP / TCP 192.168.0.106:3583 > 116.132.235.228:http FA"
192.168.0.106,116.132.235.228,3584,80,6,"Ether / IP / TCP 192.168.0.106:3584 > 116.132.235.228:http S"
116.132.235.228,192.168.0.106,80,3584,6,"Ether / IP / TCP 116.132.235.228:http > 192.168.0.106:3584 SA"
192.168.0.106,116.132.235.228,3584,80,6,"Ether / IP / TCP 192.168.0.106:3584 > 116.132.235.228:http A"
192.168.0.106,116.132.235.228,3584,80,6,"Ether / IP / TCP 192.168.0.106:3584 > 116.132.235.228:http PA / Raw"
192.168.0.106,116.132.235.228,3584,80,6,"Ether / IP / TCP 192.168.0.106:3584 > 116.132.235.228:http A / Raw"
192.168.0.106,116.132.235.228,3584,80,6,"Ether / IP / TCP 192.168.0.106:3584 > 116.132.235.228:http A / Raw"
192.168.0.106,116.132.235.228,3584,80,6,"Ether / IP / TCP 192.168.0.106:3584 > 116.132.235.228:http PA / Raw"
116.132.235.228,192.168.0.106,80,3584,6,"Ether / IP / TCP 116.132.235.228:http > 192.168.0.106:3584 A"
116.132.235.228,192.168.0.106,80,3584,6,"Ether / IP / TCP 116.132.235.228:http > 192.168.0.106:3584 A"
116.132.235.228,192.168.0.106,80,3584,6,"Ether / IP / TCP 116.132.235.228:http > 192.168.0.106:3584 A"
116.132.235.228,192.168.0.106,80,3584,6,"Ether / IP / TCP 116.132.235.228:http > 192.168.0.106:3584 PA / Raw"
116.132.235.228,192.168.0.106,80,3584,6,"Ether / IP / TCP 116.132.235.228:http > 192.168.0.106:3584 FA"
192.168.0.106,116.132.235.228,3584,80,6,"Ether / IP / TCP 192.168.0.106:3584 > 116.132.235.228:http A"
192.168.0.106,116.132.235.228,3584,80,6,"Ether / IP / TCP 192.168.0.106:3584 > 116.132.235.228:http FA"
192.168.0.106,116.132.235.228,3584,80,6,"Ether / IP / TCP 192.168.0.106:3584 > 116.132.235.228:http FA"
192.168.0.106,116.132.235.228,3584,80,6,"Ether / IP / TCP 192.168.0.106:3584 > 116.132.235.228:http FA"
192.168.0.106,116.132.235.228,3582,80,6,"Ether / IP / TCP 192.168.0.106:3582 > 116.132.235.228:http FA"
192.168.0.106,116.132.235.228,3583,80,6,"Ether / IP / TCP 192.168.0.106:3583 > 116.132.235.228:http FA"
192.168.0.106,116.132.235.228,3585,80,6,"Ether / IP / TCP 192.168.0.106:3585 > 116.132.235.228:http S"
116.132.235.228,192.168.0.106,80,3585,6,"Ether / IP / TCP 116.132.235.228:http > 192.168.0.106:3585 SA"
192.168.0.106,116.132.235.228,3585,80,6,"Ether / IP / TCP 192.168.0.106:3585 > 116.132.235.228:http A"
192.168.0.106,116.132.235.228,3585,80,6,"Ether / IP / TCP 192.168.0.106:3585 > 116.132.235.228:http PA / Raw"
192.168.0.106,116.132.235.228,3585,80,6,"Ether / IP / TCP 192.168.0.106:3585 > 116.132.235.228:http A / Raw"
192.168.0.106,116.132.235.228,3585,80,6,"Ether / IP / TCP 192.168.0.106:3585 > 116.132.235.228:http A / Raw"
192.168.0.106,116.132.235.228,3585,80,6,"Ether / IP / TCP 192.168.0.106:3585 > 116.132.235.228:http PA / Raw"
116.132.235.228,192.168.0.106,80,3585,6,"Ether / IP / TCP 116.132.235.228:http > 192.168.0.106:3585 A"
116.132.235.228,192.168.0.106,80,3585,6,"Ether / IP / TCP 116.132.235.228:http > 192.168.0.106:3585 A"
116.132.235.228,192.168.0.106,80,3585,6,"Ether / IP / TCP 116.132.235.228:http > 192.168.0.106:3585 A"
116.132.235.228,192.168.0.106,80,3585,6,"Ether / IP / TCP 116.132.235.228:http > 192.168.0.106:3585 PA / Raw"
116.132.235.228,192.168.0.106,80,3585,6,"Ether / IP / TCP 116.132.235.228:http > 192.168.0.106:3585 FA"
192.168.0.106,116.132.235.228,3585,80,6,"Ether / IP / TCP 192.168.0.106:3585 > 116.132.235.228:http A"
192.168.0.106,116.132.235.228,3585,80,6,"Ether / IP / TCP 192.168.0.106:3585 > 116.132.235.228:http FA"
192.168.0.106,116.132.235.228,3585,80,6,"Ether / IP / TCP 192.168.0.106:3585 > 116.132.235.228:http FA"
192.168.192.1,192.168.192.2,137,137,17,"Ether / IP / UDP 192.168.192.1:netbios_ns > 192.168.192.2:netbios_ns / NBNSHeader / Raw"
192.168.0.106,116.132.235.228,3585,80,6,"Ether / IP / TCP 192.168.0.106:3585 > 116.132.235.228:http FA"
192.168.0.106,110.242.68.3,3586,80,6,"Ether / IP / TCP 192.168.0.106:3586 > 110.242.68.3:http S"
192.168.0.106,116.132.235.228,3584,80,6,"Ether / IP / TCP 192.168.0.106:3584 > 116.132.235.228:http FA"
110.242.68.3,192.168.0.106,80,3586,6,"Ether / IP / TCP 110.242.68.3:http > 192.168.0.106:3586 SA"
192.168.0.106,110.242.68.3,3586,80,6,"Ether / IP / TCP 192.168.0.106:3586 > 110.242.68.3:http A"
192.168.0.106,110.242.68.3,3586,80,6,"Ether / IP / TCP 192.168.0.106:3586 > 110.242.68.3:http FA"
110.242.68.3,192.168.0.106,80,3586,6,"Ether / IP / TCP 110.242.68.3:http > 192.168.0.106:3586 A"
110.242.68.3,192.168.0.106,80,3586,6,"Ether / IP / TCP 110.242.68.3:http > 192.168.0.106:3586 FA"
192.168.0.106,110.242.68.3,3586,80,6,"Ether / IP / TCP 192.168.0.106:3586 > 110.242.68.3:http A"
192.168.0.106,116.132.235.228,3587,80,6,"Ether / IP / TCP 192.168.0.106:p2pgroup > 116.132.235.228:http S"
192.168.0.106,116.132.235.228,3581,80,6,"Ether / IP / TCP 192.168.0.106:3581 > 116.132.235.228:http FA"
116.132.235.228,192.168.0.106,80,3587,6,"Ether / IP / TCP 116.132.235.228:http > 192.168.0.106:p2pgroup SA"
192.168.0.106,116.132.235.228,3587,80,6,"Ether / IP / TCP 192.168.0.106:p2pgroup > 116.132.235.228:http A"
192.168.0.106,116.132.235.228,3587,80,6,"Ether / IP / TCP 192.168.0.106:p2pgroup > 116.132.235.228:http PA / Raw"
192.168.0.106,116.132.235.228,3587,80,6,"Ether / IP / TCP 192.168.0.106:p2pgroup > 116.132.235.228:http A / Raw"
192.168.0.106,116.132.235.228,3587,80,6,"Ether / IP / TCP 192.168.0.106:p2pgroup > 116.132.235.228:http A / Raw"
192.168.0.106,116.132.235.228,3587,80,6,"Ether / IP / TCP 192.168.0.106:p2pgroup > 116.132.235.228:http PA / Raw"
116.132.235.228,192.168.0.106,80,3587,6,"Ether / IP / TCP 116.132.235.228:http > 192.168.0.106:p2pgroup A"
116.132.235.228,192.168.0.106,80,3587,6,"Ether / IP / TCP 116.132.235.228:http > 192.168.0.106:p2pgroup A"
116.132.235.228,192.168.0.106,80,3587,6,"Ether / IP / TCP 116.132.235.228:http > 192.168.0.106:p2pgroup A"
116.132.235.228,192.168.0.106,80,3587,6,"Ether / IP / TCP 116.132.235.228:http > 192.168.0.106:p2pgroup PA / Raw"
116.132.235.228,192.168.0.106,80,3587,6,"Ether / IP / TCP 116.132.235.228:http > 192.168.0.106:p2pgroup FA"
192.168.0.106,116.132.235.228,3587,80,6,"Ether / IP / TCP 192.168.0.106:p2pgroup > 116.132.235.228:http A"
192.168.0.106,116.132.235.228,3587,80,6,"Ether / IP / TCP 192.168.0.106:p2pgroup > 116.132.235.228:http FA"
192.168.0.106,116.132.235.228,3588,80,6,"Ether / IP / TCP 192.168.0.106:3588 > 116.132.235.228:http S"
116.132.235.228,192.168.0.106,80,3588,6,"Ether / IP / TCP 116.132.235.228:http > 192.168.0.106:3588 SA"
192.168.0.106,116.132.235.228,3588,80,6,"Ether / IP / TCP 192.168.0.106:3588 > 116.132.235.228:http A"
192.168.0.106,116.132.235.228,3588,80,6,"Ether / IP / TCP 192.168.0.106:3588 > 116.132.235.228:http PA / Raw"
192.168.0.106,116.132.235.228,3588,80,6,"Ether / IP / TCP 192.168.0.106:3588 > 116.132.235.228:http A / Raw"
192.168.0.106,116.132.235.228,3588,80,6,"Ether / IP / TCP 192.168.0.106:3588 > 116.132.235.228:http A / Raw"
192.168.0.106,116.132.235.228,3588,80,6,"Ether / IP / TCP 192.168.0.106:3588 > 116.132.235.228:http PA / Raw"
116.132.235.228,192.168.0.106,80,3588,6,"Ether / IP / TCP 116.132.235.228:http > 192.168.0.106:3588 A"
116.132.235.228,192.168.0.106,80,3588,6,"Ether / IP / TCP 116.132.235.228:http > 192.168.0.106:3588 A"
116.132.235.228,192.168.0.106,80,3588,6,"Ether / IP / TCP 116.132.235.228:http > 192.168.0.106:3588 A"
116.132.235.228,192.168.0.106,80,3588,6,"Ether / IP / TCP 116.132.235.228:http > 192.168.0.106:3588 PA / Raw"
116.132.235.228,192.168.0.106,80,3588,6,"Ether / IP / TCP 116.132.235.228:http > 192.168.0.106:3588 FA"
192.168.0.106,116.132.235.228,3588,80,6,"Ether / IP / TCP 192.168.0.106:3588 > 116.132.235.228:http A"
192.168.0.106,116.132.235.228,3588,80,6,"Ether / IP / TCP 192.168.0.106:3588 > 116.132.235.228:http FA"
192.168.0.106,116.132.235.228,3587,80,6,"Ether / IP / TCP 192.168.0.106:p2pgroup > 116.132.235.228:http FA"
192.168.0.106,116.132.235.228,3588,80,6,"Ether / IP / TCP 192.168.0.106:3588 > 116.132.235.228:http FA"
192.168.192.1,192.168.192.2,137,137,17,"Ether / IP / UDP 192.168.192.1:netbios_ns > 192.168.192.2:netbios_ns / NBNSHeader / Raw"
192.168.0.106,116.132.235.228,3587,80,6,"Ether / IP / TCP 192.168.0.106:p2pgroup > 116.132.235.228:http FA"
192.168.0.106,116.132.235.228,3585,80,6,"Ether / IP / TCP 192.168.0.106:3585 > 116.132.235.228:http FA"
192.168.0.106,116.132.235.228,3588,80,6,"Ether / IP / TCP 192.168.0.106:3588 > 116.132.235.228:http FA"
192.168.0.106,116.132.235.228,3582,80,6,"Ether / IP / TCP 192.168.0.106:3582 > 116.132.235.228:http FA"
192.168.0.106,116.132.235.228,3589,80,6,"Ether / IP / TCP 192.168.0.106:3589 > 116.132.235.228:http S"
192.168.0.106,116.132.235.228,3583,80,6,"Ether / IP / TCP 192.168.0.106:3583 > 116.132.235.228:http FA"
116.132.235.228,192.168.0.106,80,3589,6,"Ether / IP / TCP 116.132.235.228:http > 192.168.0.106:3589 SA"
192.168.0.106,116.132.235.228,3589,80,6,"Ether / IP / TCP 192.168.0.106:3589 > 116.132.235.228:http A"
192.168.0.106,116.132.235.228,3589,80,6,"Ether / IP / TCP 192.168.0.106:3589 > 116.132.235.228:http PA / Raw"
192.168.0.106,116.132.235.228,3589,80,6,"Ether / IP / TCP 192.168.0.106:3589 > 116.132.235.228:http A / Raw"
192.168.0.106,116.132.235.228,3589,80,6,"Ether / IP / TCP 192.168.0.106:3589 > 116.132.235.228:http A / Raw"
192.168.0.106,116.132.235.228,3589,80,6,"Ether / IP / TCP 192.168.0.106:3589 > 116.132.235.228:http PA / Raw"
116.132.235.228,192.168.0.106,80,3589,6,"Ether / IP / TCP 116.132.235.228:http > 192.168.0.106:3589 A"
116.132.235.228,192.168.0.106,80,3589,6,"Ether / IP / TCP 116.132.235.228:http > 192.168.0.106:3589 A"
116.132.235.228,192.168.0.106,80,3589,6,"Ether / IP / TCP 116.132.235.228:http > 192.168.0.106:3589 PA / Raw"
116.132.235.228,192.168.0.106,80,3589,6,"Ether / IP / TCP 116.132.235.228:http > 192.168.0.106:3589 FA"
192.168.0.106,116.132.235.228,3589,80,6,"Ether / IP / TCP 192.168.0.106:3589 > 116.132.235.228:http A"
192.168.0.106,116.132.235.228,3589,80,6,"Ether / IP / TCP 192.168.0.106:3589 > 116.132.235.228:http FA"
192.168.0.103,224.0.0.251,5353,5353,17,"Ether / IP / UDP / DNS Qry ""b'_companion-link._tcp.local.'"" "
0,0,0,0,0,"Ether / IPv6 / UDP / DNS Qry ""b'_companion-link._tcp.local.'"" "
192.168.0.106,116.132.235.228,3589,80,6,"Ether / IP / TCP 192.168.0.106:3589 > 116.132.235.228:http FA"
192.168.0.106,192.168.0.1,63713,53,17,"Ether / IP / UDP / DNS Qry ""b'szextshort.weixin.qq.com.'"" "
192.168.0.1,192.168.0.106,53,63713,17,"Ether / IP / UDP / DNS Ans ""b'szshort.weixin.qq.com.'"" "
192.168.0.106,157.255.191.46,3590,80,6,"Ether / IP / TCP 192.168.0.106:3590 > 157.255.191.46:http S"
157.255.191.46,192.168.0.106,80,3590,6,"Ether / IP / TCP 157.255.191.46:http > 192.168.0.106:3590 SA"
192.168.0.106,157.255.191.46,3590,80,6,"Ether / IP / TCP 192.168.0.106:3590 > 157.255.191.46:http A"
192.168.0.106,157.255.191.46,3590,80,6,"Ether / IP / TCP 192.168.0.106:3590 > 157.255.191.46:http PA / Raw"
157.255.191.46,192.168.0.106,80,3590,6,"Ether / IP / TCP 157.255.191.46:http > 192.168.0.106:3590 A"
157.255.191.46,192.168.0.106,80,3590,6,"Ether / IP / TCP 157.255.191.46:http > 192.168.0.106:3590 PA / Raw"
157.255.191.46,192.168.0.106,80,3590,6,"Ether / IP / TCP 157.255.191.46:http > 192.168.0.106:3590 FA"
192.168.0.106,157.255.191.46,3590,80,6,"Ether / IP / TCP 192.168.0.106:3590 > 157.255.191.46:http A"
192.168.0.106,157.255.191.46,3590,80,6,"Ether / IP / TCP 192.168.0.106:3590 > 157.255.191.46:http FA"
192.168.0.106,157.255.191.46,3590,80,6,"Ether / IP / TCP 192.168.0.106:3590 > 157.255.191.46:http FA"
157.255.191.46,192.168.0.106,80,3590,6,"Ether / IP / TCP 157.255.191.46:http > 192.168.0.106:3590 R"
192.168.0.106,116.132.235.228,3587,80,6,"Ether / IP / TCP 192.168.0.106:p2pgroup > 116.132.235.228:http FA"
192.168.0.106,116.132.235.228,3589,80,6,"Ether / IP / TCP 192.168.0.106:3589 > 116.132.235.228:http FA"
192.168.0.106,116.132.235.228,3588,80,6,"Ether / IP / TCP 192.168.0.106:3588 > 116.132.235.228:http FA"
192.168.0.106,116.132.235.228,3584,80,6,"Ether / IP / TCP 192.168.0.106:3584 > 116.132.235.228:http FA"
192.168.0.106,116.132.235.228,3591,80,6,"Ether / IP / TCP 192.168.0.106:3591 > 116.132.235.228:http S"
116.132.235.228,192.168.0.106,80,3591,6,"Ether / IP / TCP 116.132.235.228:http > 192.168.0.106:3591 SA"
192.168.0.106,116.132.235.228,3591,80,6,"Ether / IP / TCP 192.168.0.106:3591 > 116.132.235.228:http A"
192.168.0.106,116.132.235.228,3591,80,6,"Ether / IP / TCP 192.168.0.106:3591 > 116.132.235.228:http PA / Raw"
192.168.0.106,116.132.235.228,3591,80,6,"Ether / IP / TCP 192.168.0.106:3591 > 116.132.235.228:http A / Raw"
192.168.0.106,116.132.235.228,3591,80,6,"Ether / IP / TCP 192.168.0.106:3591 > 116.132.235.228:http A / Raw"
192.168.0.106,116.132.235.228,3591,80,6,"Ether / IP / TCP 192.168.0.106:3591 > 116.132.235.228:http PA / Raw"
116.132.235.228,192.168.0.106,80,3591,6,"Ether / IP / TCP 116.132.235.228:http > 192.168.0.106:3591 A"
116.132.235.228,192.168.0.106,80,3591,6,"Ether / IP / TCP 116.132.235.228:http > 192.168.0.106:3591 A"
116.132.235.228,192.168.0.106,80,3591,6,"Ether / IP / TCP 116.132.235.228:http > 192.168.0.106:3591 A"
116.132.235.228,192.168.0.106,80,3591,6,"Ether / IP / TCP 116.132.235.228:http > 192.168.0.106:3591 PA / Raw"
116.132.235.228,192.168.0.106,80,3591,6,"Ether / IP / TCP 116.132.235.228:http > 192.168.0.106:3591 FA"
192.168.0.106,116.132.235.228,3591,80,6,"Ether / IP / TCP 192.168.0.106:3591 > 116.132.235.228:http A"
192.168.0.106,116.132.235.228,3591,80,6,"Ether / IP / TCP 192.168.0.106:3591 > 116.132.235.228:http FA"
116.132.235.228,192.168.0.106,80,3591,6,"Ether / IP / TCP 116.132.235.228:http > 192.168.0.106:3591 A"
192.168.0.106,116.132.235.228,3592,80,6,"Ether / IP / TCP 192.168.0.106:3592 > 116.132.235.228:http S"
192.168.192.1,192.168.192.2,137,137,17,"Ether / IP / UDP 192.168.192.1:netbios_ns > 192.168.192.2:netbios_ns / NBNSHeader / Raw"
116.132.235.228,192.168.0.106,80,3592,6,"Ether / IP / TCP 116.132.235.228:http > 192.168.0.106:3592 SA"
192.168.0.106,116.132.235.228,3592,80,6,"Ether / IP / TCP 192.168.0.106:3592 > 116.132.235.228:http A"
192.168.0.106,116.132.235.228,3592,80,6,"Ether / IP / TCP 192.168.0.106:3592 > 116.132.235.228:http PA / Raw"
192.168.0.106,116.132.235.228,3592,80,6,"Ether / IP / TCP 192.168.0.106:3592 > 116.132.235.228:http A / Raw"
192.168.0.106,116.132.235.228,3592,80,6,"Ether / IP / TCP 192.168.0.106:3592 > 116.132.235.228:http A / Raw"
192.168.0.106,116.132.235.228,3592,80,6,"Ether / IP / TCP 192.168.0.106:3592 > 116.132.235.228:http PA / Raw"
116.132.235.228,192.168.0.106,80,3592,6,"Ether / IP / TCP 116.132.235.228:http > 192.168.0.106:3592 A"
116.132.235.228,192.168.0.106,80,3592,6,"Ether / IP / TCP 116.132.235.228:http > 192.168.0.106:3592 A"
116.132.235.228,192.168.0.106,80,3592,6,"Ether / IP / TCP 116.132.235.228:http > 192.168.0.106:3592 A"
116.132.235.228,192.168.0.106,80,3592,6,"Ether / IP / TCP 116.132.235.228:http > 192.168.0.106:3592 PA / Raw"
116.132.235.228,192.168.0.106,80,3592,6,"Ether / IP / TCP 116.132.235.228:http > 192.168.0.106:3592 FA"
192.168.0.106,116.132.235.228,3592,80,6,"Ether / IP / TCP 192.168.0.106:3592 > 116.132.235.228:http A"
192.168.0.106,116.132.235.228,3592,80,6,"Ether / IP / TCP 192.168.0.106:3592 > 116.132.235.228:http FA"
116.132.235.228,192.168.0.106,80,3592,6,"Ether / IP / TCP 116.132.235.228:http > 192.168.0.106:3592 A"
192.168.0.106,116.132.235.228,3589,80,6,"Ether / IP / TCP 192.168.0.106:3589 > 116.132.235.228:http FA"
192.168.0.106,116.132.235.228,3585,80,6,"Ether / IP / TCP 192.168.0.106:3585 > 116.132.235.228:http FA"
192.168.0.106,116.132.235.228,3593,80,6,"Ether / IP / TCP 192.168.0.106:3593 > 116.132.235.228:http S"
116.132.235.228,192.168.0.106,80,3593,6,"Ether / IP / TCP 116.132.235.228:http > 192.168.0.106:3593 SA"
192.168.0.106,116.132.235.228,3593,80,6,"Ether / IP / TCP 192.168.0.106:3593 > 116.132.235.228:http A"
192.168.0.106,116.132.235.228,3593,80,6,"Ether / IP / TCP 192.168.0.106:3593 > 116.132.235.228:http PA / Raw"
192.168.0.106,116.132.235.228,3593,80,6,"Ether / IP / TCP 192.168.0.106:3593 > 116.132.235.228:http A / Raw"
192.168.0.106,116.132.235.228,3593,80,6,"Ether / IP / TCP 192.168.0.106:3593 > 116.132.235.228:http A / Raw"
192.168.0.106,116.132.235.228,3593,80,6,"Ether / IP / TCP 192.168.0.106:3593 > 116.132.235.228:http PA / Raw"
116.132.235.228,192.168.0.106,80,3593,6,"Ether / IP / TCP 116.132.235.228:http > 192.168.0.106:3593 A"
116.132.235.228,192.168.0.106,80,3593,6,"Ether / IP / TCP 116.132.235.228:http > 192.168.0.106:3593 A"
116.132.235.228,192.168.0.106,80,3593,6,"Ether / IP / TCP 116.132.235.228:http > 192.168.0.106:3593 A"
116.132.235.228,192.168.0.106,80,3593,6,"Ether / IP / TCP 116.132.235.228:http > 192.168.0.106:3593 PA / Raw"
116.132.235.228,192.168.0.106,80,3593,6,"Ether / IP / TCP 116.132.235.228:http > 192.168.0.106:3593 FA"
192.168.0.106,116.132.235.228,3593,80,6,"Ether / IP / TCP 192.168.0.106:3593 > 116.132.235.228:http A"
192.168.0.106,116.132.235.228,3593,80,6,"Ether / IP / TCP 192.168.0.106:3593 > 116.132.235.228:http FA"
116.132.235.228,192.168.0.106,80,3593,6,"Ether / IP / TCP 116.132.235.228:http > 192.168.0.106:3593 A"
192.168.0.106,119.28.20.150,1838,443,6,"Ether / IP / TCP 192.168.0.106:1838 > 119.28.20.150:https A / Raw"
119.28.20.150,192.168.0.106,443,1838,6,"Ether / IP / TCP 119.28.20.150:https > 192.168.0.106:1838 A"
192.168.0.106,116.132.235.228,3587,80,6,"Ether / IP / TCP 192.168.0.106:p2pgroup > 116.132.235.228:http FA"
192.168.0.106,116.132.235.228,3594,80,6,"Ether / IP / TCP 192.168.0.106:3594 > 116.132.235.228:http S"
192.168.0.106,116.132.235.228,3588,80,6,"Ether / IP / TCP 192.168.0.106:3588 > 116.132.235.228:http FA"
116.132.235.228,192.168.0.106,80,3594,6,"Ether / IP / TCP 116.132.235.228:http > 192.168.0.106:3594 SA"
192.168.0.106,116.132.235.228,3594,80,6,"Ether / IP / TCP 192.168.0.106:3594 > 116.132.235.228:http A"
192.168.0.106,116.132.235.228,3594,80,6,"Ether / IP / TCP 192.168.0.106:3594 > 116.132.235.228:http PA / Raw"
192.168.0.106,116.132.235.228,3594,80,6,"Ether / IP / TCP 192.168.0.106:3594 > 116.132.235.228:http A / Raw"
192.168.0.106,116.132.235.228,3594,80,6,"Ether / IP / TCP 192.168.0.106:3594 > 116.132.235.228:http A / Raw"
192.168.0.106,116.132.235.228,3594,80,6,"Ether / IP / TCP 192.168.0.106:3594 > 116.132.235.228:http PA / Raw"
116.132.235.228,192.168.0.106,80,3594,6,"Ether / IP / TCP 116.132.235.228:http > 192.168.0.106:3594 A"
116.132.235.228,192.168.0.106,80,3594,6,"Ether / IP / TCP 116.132.235.228:http > 192.168.0.106:3594 A"
116.132.235.228,192.168.0.106,80,3594,6,"Ether / IP / TCP 116.132.235.228:http > 192.168.0.106:3594 A"
116.132.235.228,192.168.0.106,80,3594,6,"Ether / IP / TCP 116.132.235.228:http > 192.168.0.106:3594 PA / Raw"
116.132.235.228,192.168.0.106,80,3594,6,"Ether / IP / TCP 116.132.235.228:http > 192.168.0.106:3594 FA"
192.168.0.106,116.132.235.228,3594,80,6,"Ether / IP / TCP 192.168.0.106:3594 > 116.132.235.228:http A"
192.168.0.106,116.132.235.228,3594,80,6,"Ether / IP / TCP 192.168.0.106:3594 > 116.132.235.228:http FA"
116.132.235.228,192.168.0.106,80,3594,6,"Ether / IP / TCP 116.132.235.228:http > 192.168.0.106:3594 A"
192.168.0.106,116.132.235.228,3581,80,6,"Ether / IP / TCP 192.168.0.106:3581 > 116.132.235.228:http FA"
192.168.0.104,224.0.0.251,5353,5353,17,"Ether / IP / UDP / DNS Qry ""b'_companion-link._tcp.local.'"" "
0,0,0,0,0,"Ether / IPv6 / UDP / DNS Qry ""b'_companion-link._tcp.local.'"" "
192.168.0.104,224.0.0.251,5353,5353,17,"Ether / IP / UDP / DNS Ans ""[b'model=J517AP']"" "
0,0,0,0,0,"Ether / IPv6 / UDP / DNS Ans ""[b'model=J517AP']"" "
192.168.0.104,224.0.0.251,5353,5353,17,"Ether / IP / UDP / DNS Qry ""b'iPad (305)._rdlink._tcp.local.'"" "
0,0,0,0,0,"Ether / IPv6 / UDP / DNS Qry ""b'iPad (305)._rdlink._tcp.local.'"" "
192.168.0.104,224.0.0.251,5353,5353,17,"Ether / IP / UDP / DNS Qry ""b'iPad-305.local.'"" "
0,0,0,0,0,"Ether / IPv6 / UDP / DNS Qry ""b'iPad-305.local.'"" "
192.168.0.104,224.0.0.251,5353,5353,17,"Ether / IP / UDP / DNS Qry ""b'iPad (305)._rdlink._tcp.local.'"" "
0,0,0,0,0,"Ether / IPv6 / UDP / DNS Qry ""b'iPad (305)._rdlink._tcp.local.'"" "
192.168.0.106,116.132.235.228,3595,80,6,"Ether / IP / TCP 192.168.0.106:3595 > 116.132.235.228:http S"
192.168.0.106,116.132.235.228,3589,80,6,"Ether / IP / TCP 192.168.0.106:3589 > 116.132.235.228:http FA"
116.132.235.228,192.168.0.106,80,3595,6,"Ether / IP / TCP 116.132.235.228:http > 192.168.0.106:3595 SA"
192.168.0.106,116.132.235.228,3595,80,6,"Ether / IP / TCP 192.168.0.106:3595 > 116.132.235.228:http A"
192.168.0.106,116.132.235.228,3595,80,6,"Ether / IP / TCP 192.168.0.106:3595 > 116.132.235.228:http PA / Raw"
192.168.0.106,116.132.235.228,3595,80,6,"Ether / IP / TCP 192.168.0.106:3595 > 116.132.235.228:http A / Raw"
192.168.0.106,116.132.235.228,3595,80,6,"Ether / IP / TCP 192.168.0.106:3595 > 116.132.235.228:http A / Raw"
192.168.0.106,116.132.235.228,3595,80,6,"Ether / IP / TCP 192.168.0.106:3595 > 116.132.235.228:http PA / Raw"
116.132.235.228,192.168.0.106,80,3595,6,"Ether / IP / TCP 116.132.235.228:http > 192.168.0.106:3595 A"
116.132.235.228,192.168.0.106,80,3595,6,"Ether / IP / TCP 116.132.235.228:http > 192.168.0.106:3595 A"
116.132.235.228,192.168.0.106,80,3595,6,"Ether / IP / TCP 116.132.235.228:http > 192.168.0.106:3595 A"
116.132.235.228,192.168.0.106,80,3595,6,"Ether / IP / TCP 116.132.235.228:http > 192.168.0.106:3595 PA / Raw"
116.132.235.228,192.168.0.106,80,3595,6,"Ether / IP / TCP 116.132.235.228:http > 192.168.0.106:3595 FA"
192.168.0.106,116.132.235.228,3595,80,6,"Ether / IP / TCP 192.168.0.106:3595 > 116.132.235.228:http A"
192.168.0.106,116.132.235.228,3595,80,6,"Ether / IP / TCP 192.168.0.106:3595 > 116.132.235.228:http FA"
192.168.0.104,224.0.0.251,5353,5353,17,"Ether / IP / UDP / DNS Qry ""b'iPad-305.local.'"" "
0,0,0,0,0,"Ether / IPv6 / UDP / DNS Qry ""b'iPad-305.local.'"" "
192.168.0.106,116.132.235.228,3582,80,6,"Ether / IP / TCP 192.168.0.106:3582 > 116.132.235.228:http FA"
192.168.0.106,116.132.235.228,3596,80,6,"Ether / IP / TCP 192.168.0.106:3596 > 116.132.235.228:http S"
116.132.235.228,192.168.0.106,80,3596,6,"Ether / IP / TCP 116.132.235.228:http > 192.168.0.106:3596 SA"
192.168.0.106,116.132.235.228,3596,80,6,"Ether / IP / TCP 192.168.0.106:3596 > 116.132.235.228:http A"
192.168.0.106,116.132.235.228,3596,80,6,"Ether / IP / TCP 192.168.0.106:3596 > 116.132.235.228:http PA / Raw"
192.168.0.106,116.132.235.228,3596,80,6,"Ether / IP / TCP 192.168.0.106:3596 > 116.132.235.228:http A / Raw"
192.168.0.106,116.132.235.228,3596,80,6,"Ether / IP / TCP 192.168.0.106:3596 > 116.132.235.228:http A / Raw"
192.168.0.106,116.132.235.228,3596,80,6,"Ether / IP / TCP 192.168.0.106:3596 > 116.132.235.228:http PA / Raw"
116.132.235.228,192.168.0.106,80,3596,6,"Ether / IP / TCP 116.132.235.228:http > 192.168.0.106:3596 A"
116.132.235.228,192.168.0.106,80,3596,6,"Ether / IP / TCP 116.132.235.228:http > 192.168.0.106:3596 A"
116.132.235.228,192.168.0.106,80,3596,6,"Ether / IP / TCP 116.132.235.228:http > 192.168.0.106:3596 A"
116.132.235.228,192.168.0.106,80,3596,6,"Ether / IP / TCP 116.132.235.228:http > 192.168.0.106:3596 PA / Raw"
116.132.235.228,192.168.0.106,80,3596,6,"Ether / IP / TCP 116.132.235.228:http > 192.168.0.106:3596 FA"
192.168.0.106,116.132.235.228,3596,80,6,"Ether / IP / TCP 192.168.0.106:3596 > 116.132.235.228:http A"
192.168.0.106,116.132.235.228,3596,80,6,"Ether / IP / TCP 192.168.0.106:3596 > 116.132.235.228:http FA"
192.168.0.104,224.0.0.251,5353,5353,17,"Ether / IP / UDP / DNS Ans ""[b'model=J517AP']"" "
0,0,0,0,0,"Ether / IPv6 / UDP / DNS Ans ""[b'model=J517AP']"" "
192.168.0.106,116.132.235.228,3583,80,6,"Ether / IP / TCP 192.168.0.106:3583 > 116.132.235.228:http FA"
192.168.0.104,224.0.0.251,5353,5353,17,"Ether / IP / UDP / DNS Qry ""b'iPad-305.local.'"" "
0,0,0,0,0,"Ether / IPv6 / UDP / DNS Qry ""b'iPad-305.local.'"" "
192.168.0.104,224.0.0.251,5353,5353,17,"Ether / IP / UDP / DNS Ans ""b'_rdlink._tcp.local.'"" "
0,0,0,0,0,"Ether / IPv6 / UDP / DNS Ans ""b'_rdlink._tcp.local.'"" "
192.168.0.106,116.132.235.228,3595,80,6,"Ether / IP / TCP 192.168.0.106:3595 > 116.132.235.228:http FA"
192.168.0.104,224.0.0.251,5353,5353,17,"Ether / IP / UDP / DNS Qry ""b'_companion-link._tcp.local.'"" "
0,0,0,0,0,"Ether / IPv6 / UDP / DNS Qry ""b'_companion-link._tcp.local.'"" "
192.168.0.106,192.168.0.1,49962,53,17,"Ether / IP / UDP / DNS Qry ""b'cn.bing.com.'"" "
192.168.0.1,192.168.0.106,53,49962,17,"Ether / IP / UDP / DNS Ans ""b'cn-bing-com.cn.a-0001.a-msedge.net.'"" "
192.168.0.106,116.132.235.228,3596,80,6,"Ether / IP / TCP 192.168.0.106:3596 > 116.132.235.228:http FA"
192.168.0.104,224.0.0.251,5353,5353,17,"Ether / IP / UDP / DNS Ans ""fe80::c09:5d3e:ea0f:a477"" "
0,0,0,0,0,"Ether / IPv6 / UDP / DNS Ans ""fe80::c09:5d3e:ea0f:a477"" "
192.168.0.106,116.132.235.228,3595,80,6,"Ether / IP / TCP 192.168.0.106:3595 > 116.132.235.228:http FA"
192.168.0.106,116.132.235.228,3596,80,6,"Ether / IP / TCP 192.168.0.106:3596 > 116.132.235.228:http FA"
192.168.0.104,224.0.0.251,5353,5353,17,"Ether / IP / UDP / DNS Ans ""[b'model=J517AP']"" "
0,0,0,0,0,"Ether / IPv6 / UDP / DNS Ans ""[b'model=J517AP']"" "
192.168.0.106,116.132.235.228,3597,80,6,"Ether / IP / TCP 192.168.0.106:3597 > 116.132.235.228:http S"
116.132.235.228,192.168.0.106,80,3597,6,"Ether / IP / TCP 116.132.235.228:http > 192.168.0.106:3597 SA"
192.168.0.106,116.132.235.228,3597,80,6,"Ether / IP / TCP 192.168.0.106:3597 > 116.132.235.228:http A"
192.168.0.106,116.132.235.228,3597,80,6,"Ether / IP / TCP 192.168.0.106:3597 > 116.132.235.228:http PA / Raw"
192.168.0.106,116.132.235.228,3597,80,6,"Ether / IP / TCP 192.168.0.106:3597 > 116.132.235.228:http A / Raw"
192.168.0.106,116.132.235.228,3597,80,6,"Ether / IP / TCP 192.168.0.106:3597 > 116.132.235.228:http A / Raw"
192.168.0.106,116.132.235.228,3597,80,6,"Ether / IP / TCP 192.168.0.106:3597 > 116.132.235.228:http PA / Raw"
116.132.235.228,192.168.0.106,80,3597,6,"Ether / IP / TCP 116.132.235.228:http > 192.168.0.106:3597 A"
116.132.235.228,192.168.0.106,80,3597,6,"Ether / IP / TCP 116.132.235.228:http > 192.168.0.106:3597 A"
116.132.235.228,192.168.0.106,80,3597,6,"Ether / IP / TCP 116.132.235.228:http > 192.168.0.106:3597 A"
116.132.235.228,192.168.0.106,80,3597,6,"Ether / IP / TCP 116.132.235.228:http > 192.168.0.106:3597 A"
116.132.235.228,192.168.0.106,80,3597,6,"Ether / IP / TCP 116.132.235.228:http > 192.168.0.106:3597 PA / Raw"
116.132.235.228,192.168.0.106,80,3597,6,"Ether / IP / TCP 116.132.235.228:http > 192.168.0.106:3597 FA"
192.168.0.106,116.132.235.228,3597,80,6,"Ether / IP / TCP 192.168.0.106:3597 > 116.132.235.228:http A"
192.168.0.106,116.132.235.228,3597,80,6,"Ether / IP / TCP 192.168.0.106:3597 > 116.132.235.228:http FA"
192.168.0.106,116.132.235.228,3584,80,6,"Ether / IP / TCP 192.168.0.106:3584 > 116.132.235.228:http FA"
192.168.0.106,116.132.235.228,3597,80,6,"Ether / IP / TCP 192.168.0.106:3597 > 116.132.235.228:http FA"
192.168.0.106,116.132.235.228,3595,80,6,"Ether / IP / TCP 192.168.0.106:3595 > 116.132.235.228:http FA"
192.168.0.106,116.132.235.228,3597,80,6,"Ether / IP / TCP 192.168.0.106:3597 > 116.132.235.228:http FA"
192.168.0.106,116.132.235.228,3596,80,6,"Ether / IP / TCP 192.168.0.106:3596 > 116.132.235.228:http FA"
192.168.0.104,224.0.0.251,5353,5353,17,"Ether / IP / UDP / DNS Ans ""[b'model=J517AP']"" "
0,0,0,0,0,"Ether / IPv6 / UDP / DNS Ans ""[b'model=J517AP']"" "
192.168.0.106,116.132.235.228,3585,80,6,"Ether / IP / TCP 192.168.0.106:3585 > 116.132.235.228:http FA"
192.168.192.1,192.168.192.2,137,137,17,"Ether / IP / UDP 192.168.192.1:netbios_ns > 192.168.192.2:netbios_ns / NBNSHeader / Raw"
192.168.0.106,101.72.199.41,1849,443,6,"Ether / IP / TCP 192.168.0.106:1849 > 101.72.199.41:https A / Raw"
192.168.0.106,122.190.57.41,1848,443,6,"Ether / IP / TCP 192.168.0.106:1848 > 122.190.57.41:https A / Raw"
122.190.57.41,192.168.0.106,443,1848,6,"Ether / IP / TCP 122.190.57.41:https > 192.168.0.106:1848 A"
101.72.199.41,192.168.0.106,443,1849,6,"Ether / IP / TCP 101.72.199.41:https > 192.168.0.106:1849 A"
192.168.0.104,224.0.0.251,5353,5353,17,"Ether / IP / UDP / DNS Qry ""b'_companion-link._tcp.local.'"" "
0,0,0,0,0,"Ether / IPv6 / UDP / DNS Qry ""b'_companion-link._tcp.local.'"" "
192.168.0.106,116.132.235.228,3597,80,6,"Ether / IP / TCP 192.168.0.106:3597 > 116.132.235.228:http FA"
192.168.0.106,116.132.235.228,3587,80,6,"Ether / IP / TCP 192.168.0.106:p2pgroup > 116.132.235.228:http FA"
192.168.0.106,116.132.235.228,3588,80,6,"Ether / IP / TCP 192.168.0.106:3588 > 116.132.235.228:http FA"
192.168.0.106,110.242.68.3,3598,80,6,"Ether / IP / TCP 192.168.0.106:3598 > 110.242.68.3:http S"
110.242.68.3,192.168.0.106,80,3598,6,"Ether / IP / TCP 110.242.68.3:http > 192.168.0.106:3598 SA"
192.168.0.106,110.242.68.3,3598,80,6,"Ether / IP / TCP 192.168.0.106:3598 > 110.242.68.3:http A"
192.168.0.106,110.242.68.3,3598,80,6,"Ether / IP / TCP 192.168.0.106:3598 > 110.242.68.3:http FA"
110.242.68.3,192.168.0.106,80,3598,6,"Ether / IP / TCP 110.242.68.3:http > 192.168.0.106:3598 A"
110.242.68.3,192.168.0.106,80,3598,6,"Ether / IP / TCP 110.242.68.3:http > 192.168.0.106:3598 FA"
192.168.0.106,110.242.68.3,3598,80,6,"Ether / IP / TCP 192.168.0.106:3598 > 110.242.68.3:http A"
192.168.192.1,192.168.192.2,137,137,17,"Ether / IP / UDP 192.168.192.1:netbios_ns > 192.168.192.2:netbios_ns / NBNSHeader / Raw"
192.168.0.106,116.132.235.228,3595,80,6,"Ether / IP / TCP 192.168.0.106:3595 > 116.132.235.228:http FA"
192.168.0.106,116.132.235.228,3596,80,6,"Ether / IP / TCP 192.168.0.106:3596 > 116.132.235.228:http FA"
192.168.0.106,116.132.235.228,3589,80,6,"Ether / IP / TCP 192.168.0.106:3589 > 116.132.235.228:http FA"
192.168.0.106,202.89.233.100,1794,443,6,"Ether / IP / TCP 192.168.0.106:1794 > 202.89.233.100:https A / Raw"
202.89.233.100,192.168.0.106,443,1794,6,"Ether / IP / TCP 202.89.233.100:https > 192.168.0.106:1794 A"
192.168.0.104,224.0.0.251,5353,5353,17,"Ether / IP / UDP / DNS Ans ""[b'model=J517AP']"" "
0,0,0,0,0,"Ether / IPv6 / UDP / DNS Ans ""[b'model=J517AP']"" "
192.168.192.1,192.168.192.2,137,137,17,"Ether / IP / UDP 192.168.192.1:netbios_ns > 192.168.192.2:netbios_ns / NBNSHeader / Raw"
192.168.0.106,116.132.235.228,3597,80,6,"Ether / IP / TCP 192.168.0.106:3597 > 116.132.235.228:http FA"
157.255.191.89,192.168.0.106,8080,14800,6,"Ether / IP / TCP 157.255.191.89:8080 > 192.168.0.106:14800 PA / Raw"
192.168.0.106,157.255.191.89,14800,8080,6,"Ether / IP / TCP 192.168.0.106:14800 > 157.255.191.89:8080 PA / Raw"
157.255.191.89,192.168.0.106,8080,14800,6,"Ether / IP / TCP 157.255.191.89:8080 > 192.168.0.106:14800 PA / Raw"
192.168.0.106,157.255.191.89,14800,8080,6,"Ether / IP / TCP 192.168.0.106:14800 > 157.255.191.89:8080 A"
192.168.0.106,218.29.205.230,3480,443,6,"Ether / IP / TCP 192.168.0.106:3480 > 218.29.205.230:https A / Raw"
218.29.205.230,192.168.0.106,443,3480,6,"Ether / IP / TCP 218.29.205.230:https > 192.168.0.106:3480 A"
192.168.0.106,157.148.32.174,3478,8106,6,"Ether / IP / TCP 192.168.0.106:3478 > 157.148.32.174:8106 A / Raw"
157.148.32.174,192.168.0.106,8106,3478,6,"Ether / IP / TCP 157.148.32.174:8106 > 192.168.0.106:3478 A"
192.168.0.106,116.132.235.228,3581,80,6,"Ether / IP / TCP 192.168.0.106:3581 > 116.132.235.228:http RA"
192.168.0.106,116.132.235.228,3595,80,6,"Ether / IP / TCP 192.168.0.106:3595 > 116.132.235.228:http FA"
192.168.0.104,224.0.0.251,5353,5353,17,"Ether / IP / UDP / DNS Ans ""[b'model=J517AP']"" "
0,0,0,0,0,"Ether / IPv6 / UDP / DNS Ans ""[b'model=J517AP']"" "
192.168.0.106,116.132.235.228,3596,80,6,"Ether / IP / TCP 192.168.0.106:3596 > 116.132.235.228:http FA"
192.168.0.106,116.132.235.228,3582,80,6,"Ether / IP / TCP 192.168.0.106:3582 > 116.132.235.228:http RA"
192.168.0.106,116.132.235.228,3583,80,6,"Ether / IP / TCP 192.168.0.106:3583 > 116.132.235.228:http RA"
192.168.0.106,116.132.235.228,3597,80,6,"Ether / IP / TCP 192.168.0.106:3597 > 116.132.235.228:http FA"
192.168.0.106,116.132.235.228,3584,80,6,"Ether / IP / TCP 192.168.0.106:3584 > 116.132.235.228:http RA"
192.168.0.106,116.132.235.228,3585,80,6,"Ether / IP / TCP 192.168.0.106:3585 > 116.132.235.228:http RA"
192.168.0.106,218.12.116.247,1850,443,6,"Ether / IP / TCP 192.168.0.106:1850 > 218.12.116.247:https A / Raw"
218.12.116.247,192.168.0.106,443,1850,6,"Ether / IP / TCP 218.12.116.247:https > 192.168.0.106:1850 R"
192.168.0.106,20.189.173.10,1762,443,6,"Ether / IP / TCP 192.168.0.106:1762 > 20.189.173.10:https A / Raw"
192.168.0.106,116.132.235.228,3587,80,6,"Ether / IP / TCP 192.168.0.106:p2pgroup > 116.132.235.228:http RA"
20.189.173.10,192.168.0.106,443,1762,6,"Ether / IP / TCP 20.189.173.10:https > 192.168.0.106:1762 A"
119.28.20.150,192.168.0.106,443,1838,6,"Ether / IP / TCP 119.28.20.150:https > 192.168.0.106:1838 PA / Raw"
119.28.20.150,192.168.0.106,443,1838,6,"Ether / IP / TCP 119.28.20.150:https > 192.168.0.106:1838 FA"
192.168.0.106,119.28.20.150,1838,443,6,"Ether / IP / TCP 192.168.0.106:1838 > 119.28.20.150:https A"
192.168.0.106,116.132.235.228,3588,80,6,"Ether / IP / TCP 192.168.0.106:3588 > 116.132.235.228:http RA"
192.168.0.106,111.206.209.249,1852,443,6,"Ether / IP / TCP 192.168.0.106:1852 > 111.206.209.249:https A / Raw"
192.168.0.106,110.242.68.3,3599,80,6,"Ether / IP / TCP 192.168.0.106:3599 > 110.242.68.3:http S"
110.242.68.3,192.168.0.106,80,3599,6,"Ether / IP / TCP 110.242.68.3:http > 192.168.0.106:3599 SA"
192.168.0.106,110.242.68.3,3599,80,6,"Ether / IP / TCP 192.168.0.106:3599 > 110.242.68.3:http A"
