data,flowmember,label,classes
b'her / IP / TCP 59.38.123.207:45902 > 192.168.0.106:10292 ',1,,
b'her / IP / TCP 59.38.123.207:45902 > 192.168.0.106:10292 ',1,,
b'her / IP / TCP 59.38.123.207:45902 > 192.168.0.106:10292 ',1,,
b'her / IP / TCP 59.38.123.207:45902 > 192.168.0.106:10292 PA / Ra',1,,
b'her / IP / TCP 59.38.123.207:45902 > 192.168.0.106:10304 ',2,,
b'her / IP / TCP 59.38.123.207:45902 > 192.168.0.106:10304 ',2,,
b'her / IP / TCP 59.38.123.207:45902 > 192.168.0.106:10304 ',2,,
b'her / IP / TCP 59.38.123.207:45902 > 192.168.0.106:10304 A / Ra',2,,
b'her / IP / TCP 59.38.123.207:45902 > 192.168.0.106:10304 PA / Ra',2,,
b'her / IP / TCP 59.38.123.207:45902 > 192.168.0.106:10304 A / Ra',2,,
b'her / IP / TCP 59.38.123.207:45902 > 192.168.0.106:10304 A / Ra',3,,
b'her / IP / TCP 59.38.123.207:45902 > 192.168.0.106:10304 PA / Ra',3,,
b'her / IP / TCP 59.38.123.207:45902 > 192.168.0.106:10304 A / Ra',3,,
b'her / IP / TCP 59.38.123.207:45902 > 192.168.0.106:10304 ',3,,
b'her / IP / TCP 59.38.123.207:45902 > 192.168.0.106:10304 PA / Ra',3,,
b'her / IP / TCP 59.38.123.207:45902 > 192.168.0.106:10304 ',3,,
b'her / IP / TCP 59.38.123.207:45902 > 192.168.0.106:10304 A / Ra',3,,
b'her / IP / TCP 59.38.123.207:45902 > 192.168.0.106:10304 PA / Ra',4,,
b'her / IP / TCP 59.38.123.207:45902 > 192.168.0.106:10304 F',4,,
b'her / IP / TCP 59.38.123.207:45902 > 192.168.0.106:10304 ',4,,
b'her / IP / TCP 192.168.0.106:10304 > 59.38.123.207:45902 ',5,,
b'her / IP / TCP 192.168.0.106:10304 > 59.38.123.207:45902 ',5,,
b'her / IP / TCP 192.168.0.106:10304 > 59.38.123.207:45902 ',5,,
b'her / IP / TCP 192.168.0.106:10304 > 59.38.123.207:45902 PA / Ra',5,,
b'her / IP / TCP 192.168.0.106:10304 > 59.38.123.207:45902 PA / Ra',5,,
b'her / IP / TCP 192.168.0.106:10304 > 59.38.123.207:45902 A / Ra',5,,
b'her / IP / TCP 192.168.0.106:10304 > 59.38.123.207:45902 PA / Ra',6,,
b'her / IP / TCP 192.168.0.106:10304 > 59.38.123.207:45902 ',6,,
b'her / IP / TCP 192.168.0.106:10304 > 59.38.123.207:45902 ',6,,
b'her / IP / TCP 192.168.0.106:10304 > 59.38.123.207:45902 F',6,,
b'her / IP / TCP 192.168.0.106:10304 > 59.38.123.207:45902 F',6,,
b'her / IP / TCP 192.168.0.106:10292 > 59.38.123.207:45902 ',7,,
b'her / IP / TCP 192.168.0.106:10277 > 116.132.235.228:http F',8,,
b'her / IP / TCP 192.168.0.106:10277 > 116.132.235.228:http R',8,,
b'her / IP / TCP 192.168.0.106:10278 > 116.132.235.228:http F',9,,
b'her / IP / TCP 192.168.0.106:10278 > 116.132.235.228:http R',9,,
b'her / IP / TCP 192.168.0.106:10305 > 116.132.235.228:http ',10,,
b'her / IP / TCP 192.168.0.106:10305 > 116.132.235.228:http ',10,,
b'her / IP / TCP 192.168.0.106:10305 > 116.132.235.228:http PA / Ra',10,,
b'her / IP / TCP 192.168.0.106:10305 > 116.132.235.228:http A / Ra',10,,
b'her / IP / TCP 192.168.0.106:10305 > 116.132.235.228:http A / Ra',10,,
b'her / IP / TCP 192.168.0.106:10305 > 116.132.235.228:http PA / Ra',10,,
b'her / IP / TCP 192.168.0.106:10305 > 116.132.235.228:http ',11,,
b'her / IP / TCP 192.168.0.106:10305 > 116.132.235.228:http F',11,,
b'her / IP / TCP 116.132.235.228:http > 192.168.0.106:10305 S',12,,
b'her / IP / TCP 116.132.235.228:http > 192.168.0.106:10305 ',12,,
b'her / IP / TCP 116.132.235.228:http > 192.168.0.106:10305 ',12,,
b'her / IP / TCP 116.132.235.228:http > 192.168.0.106:10305 ',12,,
b'her / IP / TCP 116.132.235.228:http > 192.168.0.106:10305 PA / Ra',12,,
b'her / IP / TCP 116.132.235.228:http > 192.168.0.106:10305 F',12,,
b'her / IP / TCP 116.132.235.228:http > 192.168.0.106:10305 ',13,,
b'her / IP / TCP 192.168.0.106:10306 > 116.132.235.228:http ',13,,
b'her / IP / TCP 192.168.0.106:10306 > 116.132.235.228:http ',13,,
b'her / IP / TCP 192.168.0.106:10306 > 116.132.235.228:http PA / Ra',13,,
b'her / IP / TCP 192.168.0.106:10306 > 116.132.235.228:http A / Ra',13,,
b'her / IP / TCP 192.168.0.106:10306 > 116.132.235.228:http A / Ra',13,,
b'her / IP / TCP 192.168.0.106:10306 > 116.132.235.228:http PA / Ra',13,,
b'her / IP / TCP 192.168.0.106:10306 > 116.132.235.228:http ',14,,
b'her / IP / TCP 192.168.0.106:10306 > 116.132.235.228:http F',14,,
b'her / IP / TCP 116.132.235.228:http > 192.168.0.106:10306 S',15,,
b'her / IP / TCP 116.132.235.228:http > 192.168.0.106:10306 ',15,,
b'her / IP / TCP 116.132.235.228:http > 192.168.0.106:10306 ',15,,
b'her / IP / TCP 116.132.235.228:http > 192.168.0.106:10306 ',15,,
b'her / IP / TCP 116.132.235.228:http > 192.168.0.106:10306 PA / Ra',15,,
b'her / IP / TCP 116.132.235.228:http > 192.168.0.106:10306 F',15,,
b'her / IP / TCP 116.132.235.228:http > 192.168.0.106:10306 ',16,,
b'her / IP / TCP 192.168.0.106:10281 > 116.132.235.228:http F',16,,
b'her / IP / TCP 192.168.0.106:10281 > 116.132.235.228:http R',16,,
b'her / IP / TCP 192.168.0.106:10307 > 116.132.235.228:http ',17,,
b'her / IP / TCP 192.168.0.106:10307 > 116.132.235.228:http ',17,,
b'her / IP / TCP 192.168.0.106:10307 > 116.132.235.228:http PA / Ra',17,,
b'her / IP / TCP 192.168.0.106:10307 > 116.132.235.228:http A / Ra',17,,
b'her / IP / TCP 192.168.0.106:10307 > 116.132.235.228:http A / Ra',17,,
b'her / IP / TCP 192.168.0.106:10307 > 116.132.235.228:http PA / Ra',17,,
b'her / IP / TCP 192.168.0.106:10307 > 116.132.235.228:http ',18,,
b'her / IP / TCP 192.168.0.106:10307 > 116.132.235.228:http F',18,,
b'her / IP / TCP 116.132.235.228:http > 192.168.0.106:10307 S',19,,
b'her / IP / TCP 116.132.235.228:http > 192.168.0.106:10307 ',19,,
b'her / IP / TCP 116.132.235.228:http > 192.168.0.106:10307 ',19,,
b'her / IP / TCP 116.132.235.228:http > 192.168.0.106:10307 ',19,,
b'her / IP / TCP 116.132.235.228:http > 192.168.0.106:10307 PA / Ra',19,,
b'her / IP / TCP 116.132.235.228:http > 192.168.0.106:10307 F',19,,
b'her / IP / TCP 116.132.235.228:http > 192.168.0.106:10307 ',20,,
b'her / IP / TCP 192.168.0.106:10308 > 157.255.191.46:http ',20,,
b'her / IP / TCP 192.168.0.106:10308 > 157.255.191.46:http ',20,,
b'her / IP / TCP 192.168.0.106:10308 > 157.255.191.46:http PA / Ra',20,,
b'her / IP / TCP 192.168.0.106:10308 > 157.255.191.46:http ',20,,
b'her / IP / TCP 192.168.0.106:10308 > 157.255.191.46:http F',20,,
b'her / IP / TCP 192.168.0.106:10309 > 125.39.104.15:http ',21,,
b'her / IP / TCP 192.168.0.106:10309 > 125.39.104.15:http ',21,,
b'her / IP / TCP 192.168.0.106:10309 > 125.39.104.15:http PA / Ra',21,,
b'her / IP / TCP 192.168.0.106:10309 > 125.39.104.15:http ',21,,
b'her / IP / TCP 192.168.0.106:10309 > 125.39.104.15:http F',21,,
b'her / IP / TCP 192.168.0.106:10309 > 125.39.104.15:http ',21,,
b'her / IP / TCP 125.39.104.15:http > 192.168.0.106:10309 S',22,,
b'her / IP / TCP 125.39.104.15:http > 192.168.0.106:10309 ',22,,
b'her / IP / TCP 125.39.104.15:http > 192.168.0.106:10309 A / Ra',22,,
b'her / IP / TCP 125.39.104.15:http > 192.168.0.106:10309 A / Ra',22,,
b'her / IP / TCP 125.39.104.15:http > 192.168.0.106:10309 A / Ra',22,,
b'her / IP / TCP 125.39.104.15:http > 192.168.0.106:10309 PA / Ra',22,,
b'her / IP / TCP 125.39.104.15:http > 192.168.0.106:10309 F',23,,
b'her / IP / TCP 125.39.104.15:http > 192.168.0.106:10309 ',23,,
b'her / IP / TCP 157.255.191.46:http > 192.168.0.106:10308 S',24,,
b'her / IP / TCP 157.255.191.46:http > 192.168.0.106:10308 ',24,,
b'her / IP / TCP 157.255.191.46:http > 192.168.0.106:10308 PA / Ra',24,,
b'her / IP / TCP 157.255.191.46:http > 192.168.0.106:10308 F',24,,
b'her / IP / TCP 157.255.191.46:http > 192.168.0.106:10308 ',24,,
b'her / IP / TCP 192.168.0.106:10310 > 116.132.235.228:http ',25,,
b'her / IP / TCP 192.168.0.106:10310 > 116.132.235.228:http ',25,,
b'her / IP / TCP 192.168.0.106:10310 > 116.132.235.228:http PA / Ra',25,,
b'her / IP / TCP 192.168.0.106:10310 > 116.132.235.228:http A / Ra',25,,
b'her / IP / TCP 192.168.0.106:10310 > 116.132.235.228:http A / Ra',25,,
b'her / IP / TCP 192.168.0.106:10310 > 116.132.235.228:http PA / Ra',25,,
b'her / IP / TCP 192.168.0.106:10310 > 116.132.235.228:http ',26,,
b'her / IP / TCP 192.168.0.106:10310 > 116.132.235.228:http F',26,,
b'her / IP / TCP 116.132.235.228:http > 192.168.0.106:10310 S',27,,
b'her / IP / TCP 116.132.235.228:http > 192.168.0.106:10310 ',27,,
b'her / IP / TCP 116.132.235.228:http > 192.168.0.106:10310 ',27,,
b'her / IP / TCP 116.132.235.228:http > 192.168.0.106:10310 ',27,,
b'her / IP / TCP 116.132.235.228:http > 192.168.0.106:10310 PA / Ra',27,,
b'her / IP / TCP 116.132.235.228:http > 192.168.0.106:10310 F',27,,
b'her / IP / TCP 116.132.235.228:http > 192.168.0.106:10310 ',28,,
b'her / IP / TCP 192.168.0.106:10311 > 116.132.235.228:http ',28,,
b'her / IP / TCP 192.168.0.106:10311 > 116.132.235.228:http ',28,,
b'her / IP / TCP 192.168.0.106:10311 > 116.132.235.228:http PA / Ra',28,,
b'her / IP / TCP 192.168.0.106:10311 > 116.132.235.228:http A / Ra',28,,
b'her / IP / TCP 192.168.0.106:10311 > 116.132.235.228:http A / Ra',28,,
b'her / IP / TCP 192.168.0.106:10311 > 116.132.235.228:http PA / Ra',28,,
b'her / IP / TCP 192.168.0.106:10311 > 116.132.235.228:http ',29,,
b'her / IP / TCP 192.168.0.106:10311 > 116.132.235.228:http F',29,,
b'her / IP / TCP 116.132.235.228:http > 192.168.0.106:10311 S',30,,
b'her / IP / TCP 116.132.235.228:http > 192.168.0.106:10311 ',30,,
b'her / IP / TCP 116.132.235.228:http > 192.168.0.106:10311 ',30,,
b'her / IP / TCP 116.132.235.228:http > 192.168.0.106:10311 ',30,,
b'her / IP / TCP 116.132.235.228:http > 192.168.0.106:10311 PA / Ra',30,,
b'her / IP / TCP 116.132.235.228:http > 192.168.0.106:10311 F',30,,
b'her / IP / TCP 116.132.235.228:http > 192.168.0.106:10311 ',31,,
b'her / IP / TCP 192.168.0.106:13282 > 116.130.224.46:https PA / Ra',31,,
b'her / IP / TCP 192.168.0.106:13282 > 116.130.224.46:https ',31,,
b'her / IP / TCP 192.168.0.106:13282 > 116.130.224.46:https PA / Ra',31,,
b'her / IP / TCP 192.168.0.106:13282 > 116.130.224.46:https ',31,,
b'her / IP / TCP 116.130.224.46:https > 192.168.0.106:13282 PA / Ra',32,,
b'her / IP / TCP 116.130.224.46:https > 192.168.0.106:13282 PA / Ra',32,,
b'her / IP / TCP 192.168.0.106:10312 > 116.132.235.228:http ',33,,
b'her / IP / TCP 192.168.0.106:10312 > 116.132.235.228:http ',33,,
b'her / IP / TCP 192.168.0.106:10312 > 116.132.235.228:http PA / Ra',33,,
b'her / IP / TCP 192.168.0.106:10312 > 116.132.235.228:http A / Ra',33,,
b'her / IP / TCP 192.168.0.106:10312 > 116.132.235.228:http A / Ra',33,,
b'her / IP / TCP 192.168.0.106:10312 > 116.132.235.228:http PA / Ra',33,,
b'her / IP / TCP 192.168.0.106:10312 > 116.132.235.228:http ',34,,
b'her / IP / TCP 192.168.0.106:10312 > 116.132.235.228:http F',34,,
b'her / IP / TCP 192.168.0.106:10312 > 116.132.235.228:http F',34,,
b'her / IP / TCP 192.168.0.106:10312 > 116.132.235.228:http F',34,,
b'her / IP / TCP 192.168.0.106:10312 > 116.132.235.228:http F',34,,
b'her / IP / TCP 192.168.0.106:10312 > 116.132.235.228:http F',34,,
b'her / IP / TCP 192.168.0.106:10312 > 116.132.235.228:http F',34,,
b'her / IP / TCP 116.132.235.228:http > 192.168.0.106:10312 S',35,,
b'her / IP / TCP 116.132.235.228:http > 192.168.0.106:10312 ',35,,
b'her / IP / TCP 116.132.235.228:http > 192.168.0.106:10312 ',35,,
b'her / IP / TCP 116.132.235.228:http > 192.168.0.106:10312 ',35,,
b'her / IP / TCP 116.132.235.228:http > 192.168.0.106:10312 PA / Ra',35,,
b'her / IP / TCP 116.132.235.228:http > 192.168.0.106:10312 F',35,,
b'her / IP / TCP 192.168.0.106:10313 > 116.132.235.228:http ',36,,
b'her / IP / TCP 192.168.0.106:10313 > 116.132.235.228:http ',36,,
b'her / IP / TCP 192.168.0.106:10313 > 116.132.235.228:http PA / Ra',36,,
b'her / IP / TCP 192.168.0.106:10313 > 116.132.235.228:http A / Ra',36,,
b'her / IP / TCP 192.168.0.106:10313 > 116.132.235.228:http A / Ra',36,,
b'her / IP / TCP 192.168.0.106:10313 > 116.132.235.228:http PA / Ra',36,,
b'her / IP / TCP 192.168.0.106:10313 > 116.132.235.228:http ',37,,
b'her / IP / TCP 192.168.0.106:10313 > 116.132.235.228:http F',37,,
b'her / IP / TCP 116.132.235.228:http > 192.168.0.106:10313 S',38,,
b'her / IP / TCP 116.132.235.228:http > 192.168.0.106:10313 ',38,,
b'her / IP / TCP 116.132.235.228:http > 192.168.0.106:10313 ',38,,
b'her / IP / TCP 116.132.235.228:http > 192.168.0.106:10313 ',38,,
b'her / IP / TCP 116.132.235.228:http > 192.168.0.106:10313 PA / Ra',38,,
b'her / IP / TCP 116.132.235.228:http > 192.168.0.106:10313 F',38,,
b'her / IP / TCP 116.132.235.228:http > 192.168.0.106:10313 ',39,,
b'her / IP / TCP 192.168.0.106:10202 > 220.194.116.51:https F',39,,
b'her / IP / TCP 192.168.0.106:10201 > 220.194.116.51:https F',40,,
b'her / IP / TCP 192.168.0.106:10314 > 220.194.116.51:https ',41,,
b'her / IP / TCP 192.168.0.106:10314 > 220.194.116.51:https ',41,,
b'her / IP / TCP 192.168.0.106:10314 > 220.194.116.51:https PA / Ra',41,,
b'her / IP / TCP 192.168.0.106:10314 > 220.194.116.51:https ',41,,
b'her / IP / TCP 192.168.0.106:10314 > 220.194.116.51:https PA / Ra',41,,
b'her / IP / TCP 192.168.0.106:10314 > 220.194.116.51:https PA / Ra',41,,
b'her / IP / TCP 192.168.0.106:10314 > 220.194.116.51:https PA / Ra',42,,
b'her / IP / TCP 192.168.0.106:10314 > 220.194.116.51:https ',42,,
b'her / IP / TCP 192.168.0.106:10315 > 220.194.116.51:https ',43,,
b'her / IP / TCP 192.168.0.106:10315 > 220.194.116.51:https ',43,,
b'her / IP / TCP 192.168.0.106:10315 > 220.194.116.51:https PA / Ra',43,,
b'her / IP / TCP 192.168.0.106:10315 > 220.194.116.51:https ',43,,
b'her / IP / TCP 192.168.0.106:10315 > 220.194.116.51:https PA / Ra',43,,
b'her / IP / TCP 192.168.0.106:10315 > 220.194.116.51:https PA / Ra',43,,
b'her / IP / TCP 192.168.0.106:10315 > 220.194.116.51:https PA / Ra',44,,
b'her / IP / TCP 192.168.0.106:10315 > 220.194.116.51:https ',44,,
b'her / IP / TCP 220.194.116.51:https > 192.168.0.106:10202 ',45,,
b'her / IP / TCP 220.194.116.51:https > 192.168.0.106:10201 ',46,,
b'her / IP / TCP 220.194.116.51:https > 192.168.0.106:10314 S',47,,
b'her / IP / TCP 220.194.116.51:https > 192.168.0.106:10314 ',47,,
b'her / IP / TCP 220.194.116.51:https > 192.168.0.106:10314 A / Ra',47,,
b'her / IP / TCP 220.194.116.51:https > 192.168.0.106:10314 PA / Ra',47,,
b'her / IP / TCP 220.194.116.51:https > 192.168.0.106:10314 PA / Ra',47,,
b'her / IP / TCP 220.194.116.51:https > 192.168.0.106:10314 ',47,,
b'her / IP / TCP 220.194.116.51:https > 192.168.0.106:10314 PA / Ra',48,,
b'her / IP / TCP 220.194.116.51:https > 192.168.0.106:10314 ',48,,
b'her / IP / TCP 220.194.116.51:https > 192.168.0.106:10314 ',48,,
b'her / IP / TCP 220.194.116.51:https > 192.168.0.106:10314 PA / Ra',48,,
b'her / IP / TCP 220.194.116.51:https > 192.168.0.106:10314 FPA / Ra',48,,
b'her / IP / TCP 220.194.116.51:https > 192.168.0.106:10315 S',49,,
b'her / IP / TCP 220.194.116.51:https > 192.168.0.106:10315 ',49,,
b'her / IP / TCP 220.194.116.51:https > 192.168.0.106:10315 A / Ra',49,,
b'her / IP / TCP 220.194.116.51:https > 192.168.0.106:10315 PA / Ra',49,,
b'her / IP / TCP 220.194.116.51:https > 192.168.0.106:10315 PA / Ra',49,,
b'her / IP / TCP 220.194.116.51:https > 192.168.0.106:10315 ',49,,
b'her / IP / TCP 220.194.116.51:https > 192.168.0.106:10315 PA / Ra',50,,
b'her / IP / TCP 220.194.116.51:https > 192.168.0.106:10315 ',50,,
b'her / IP / TCP 220.194.116.51:https > 192.168.0.106:10315 ',50,,
b'her / IP / TCP 220.194.116.51:https > 192.168.0.106:10315 PA / Ra',50,,
b'her / IP / TCP 220.194.116.51:https > 192.168.0.106:10315 FPA / Ra',50,,
b'her / IP / TCP 192.168.0.106:10316 > 116.132.235.228:http ',51,,
b'her / IP / TCP 192.168.0.106:10316 > 116.132.235.228:http ',51,,
b'her / IP / TCP 192.168.0.106:10316 > 116.132.235.228:http PA / Ra',51,,
b'her / IP / TCP 192.168.0.106:10316 > 116.132.235.228:http A / Ra',51,,
b'her / IP / TCP 192.168.0.106:10316 > 116.132.235.228:http A / Ra',51,,
b'her / IP / TCP 192.168.0.106:10316 > 116.132.235.228:http PA / Ra',51,,
b'her / IP / TCP 192.168.0.106:10316 > 116.132.235.228:http ',52,,
b'her / IP / TCP 192.168.0.106:10316 > 116.132.235.228:http F',52,,
b'her / IP / TCP 116.132.235.228:http > 192.168.0.106:10316 S',53,,
b'her / IP / TCP 116.132.235.228:http > 192.168.0.106:10316 ',53,,
b'her / IP / TCP 116.132.235.228:http > 192.168.0.106:10316 ',53,,
b'her / IP / TCP 116.132.235.228:http > 192.168.0.106:10316 ',53,,
b'her / IP / TCP 116.132.235.228:http > 192.168.0.106:10316 ',53,,
b'her / IP / TCP 116.132.235.228:http > 192.168.0.106:10316 PA / Ra',53,,
b'her / IP / TCP 116.132.235.228:http > 192.168.0.106:10316 F',54,,
b'her / IP / TCP 116.132.235.228:http > 192.168.0.106:10316 ',54,,
b'her / IP / TCP 192.168.0.106:10317 > 116.132.235.228:http ',55,,
b'her / IP / TCP 192.168.0.106:10317 > 116.132.235.228:http ',55,,
b'her / IP / TCP 192.168.0.106:10317 > 116.132.235.228:http PA / Ra',55,,
b'her / IP / TCP 192.168.0.106:10317 > 116.132.235.228:http A / Ra',55,,
b'her / IP / TCP 192.168.0.106:10317 > 116.132.235.228:http A / Ra',55,,
b'her / IP / TCP 192.168.0.106:10317 > 116.132.235.228:http PA / Ra',55,,
b'her / IP / TCP 192.168.0.106:10317 > 116.132.235.228:http ',56,,
b'her / IP / TCP 192.168.0.106:10317 > 116.132.235.228:http F',56,,
b'her / IP / TCP 116.132.235.228:http > 192.168.0.106:10317 S',57,,
b'her / IP / TCP 116.132.235.228:http > 192.168.0.106:10317 ',57,,
b'her / IP / TCP 116.132.235.228:http > 192.168.0.106:10317 ',57,,
b'her / IP / TCP 116.132.235.228:http > 192.168.0.106:10317 ',57,,
b'her / IP / TCP 116.132.235.228:http > 192.168.0.106:10317 PA / Ra',57,,
b'her / IP / TCP 116.132.235.228:http > 192.168.0.106:10317 F',57,,
b'her / IP / TCP 116.132.235.228:http > 192.168.0.106:10317 ',58,,
b'her / IP / TCP 192.168.0.106:11251 > 60.28.172.104:https PA / Ra',58,,
b'her / IP / TCP 192.168.0.106:11251 > 60.28.172.104:https ',58,,
b'her / IP / TCP 60.28.172.104:https > 192.168.0.106:11251 A / Paddin',59,,
b'her / IP / TCP 60.28.172.104:https > 192.168.0.106:11251 PA / Ra',59,,
b'her / IP / TCP 192.168.0.106:10318 > 110.242.68.3:http ',60,,
b'her / IP / TCP 192.168.0.106:10318 > 110.242.68.3:http ',60,,
b'her / IP / TCP 192.168.0.106:10318 > 110.242.68.3:http F',60,,
b'her / IP / TCP 192.168.0.106:10318 > 110.242.68.3:http ',60,,
b'her / IP / TCP 110.242.68.3:http > 192.168.0.106:10318 S',61,,
b'her / IP / TCP 110.242.68.3:http > 192.168.0.106:10318 ',61,,
b'her / IP / TCP 110.242.68.3:http > 192.168.0.106:10318 F',61,,
b'her / IP / TCP 192.168.0.106:10319 > 116.132.235.228:http ',62,,
b'her / IP / TCP 192.168.0.106:10319 > 116.132.235.228:http ',62,,
b'her / IP / TCP 192.168.0.106:10319 > 116.132.235.228:http PA / Ra',62,,
b'her / IP / TCP 192.168.0.106:10319 > 116.132.235.228:http A / Ra',62,,
b'her / IP / TCP 192.168.0.106:10319 > 116.132.235.228:http A / Ra',62,,
b'her / IP / TCP 192.168.0.106:10319 > 116.132.235.228:http PA / Ra',62,,
b'her / IP / TCP 192.168.0.106:10319 > 116.132.235.228:http ',63,,
b'her / IP / TCP 192.168.0.106:10319 > 116.132.235.228:http F',63,,
b'her / IP / TCP 116.132.235.228:http > 192.168.0.106:10319 S',64,,
b'her / IP / TCP 116.132.235.228:http > 192.168.0.106:10319 ',64,,
b'her / IP / TCP 116.132.235.228:http > 192.168.0.106:10319 ',64,,
b'her / IP / TCP 116.132.235.228:http > 192.168.0.106:10319 ',64,,
b'her / IP / TCP 116.132.235.228:http > 192.168.0.106:10319 PA / Ra',64,,
b'her / IP / TCP 116.132.235.228:http > 192.168.0.106:10319 F',64,,
b'her / IP / TCP 116.132.235.228:http > 192.168.0.106:10319 ',65,,
b'her / IP / TCP 192.168.0.106:10320 > 116.132.235.228:http ',65,,
b'her / IP / TCP 192.168.0.106:10320 > 116.132.235.228:http ',65,,
b'her / IP / TCP 192.168.0.106:10320 > 116.132.235.228:http PA / Ra',65,,
b'her / IP / TCP 192.168.0.106:10320 > 116.132.235.228:http A / Ra',65,,
b'her / IP / TCP 192.168.0.106:10320 > 116.132.235.228:http A / Ra',65,,
b'her / IP / TCP 192.168.0.106:10320 > 116.132.235.228:http PA / Ra',65,,
b'her / IP / TCP 192.168.0.106:10320 > 116.132.235.228:http ',66,,
b'her / IP / TCP 192.168.0.106:10320 > 116.132.235.228:http F',66,,
b'her / IP / TCP 116.132.235.228:http > 192.168.0.106:10320 S',67,,
b'her / IP / TCP 116.132.235.228:http > 192.168.0.106:10320 ',67,,
b'her / IP / TCP 116.132.235.228:http > 192.168.0.106:10320 ',67,,
b'her / IP / TCP 116.132.235.228:http > 192.168.0.106:10320 ',67,,
b'her / IP / TCP 116.132.235.228:http > 192.168.0.106:10320 PA / Ra',67,,
b'her / IP / TCP 116.132.235.228:http > 192.168.0.106:10320 F',67,,
b'her / IP / TCP 116.132.235.228:http > 192.168.0.106:10320 ',68,,
b'her / IP / TCP 192.168.0.106:10321 > 116.132.235.228:http ',68,,
b'her / IP / TCP 192.168.0.106:10321 > 116.132.235.228:http ',68,,
b'her / IP / TCP 192.168.0.106:10321 > 116.132.235.228:http PA / Ra',68,,
b'her / IP / TCP 192.168.0.106:10321 > 116.132.235.228:http A / Ra',68,,
b'her / IP / TCP 192.168.0.106:10321 > 116.132.235.228:http A / Ra',68,,
b'her / IP / TCP 192.168.0.106:10321 > 116.132.235.228:http PA / Ra',68,,
b'her / IP / TCP 192.168.0.106:10321 > 116.132.235.228:http ',69,,
b'her / IP / TCP 192.168.0.106:10321 > 116.132.235.228:http F',69,,
b'her / IP / TCP 116.132.235.228:http > 192.168.0.106:10321 S',70,,
b'her / IP / TCP 116.132.235.228:http > 192.168.0.106:10321 ',70,,
b'her / IP / TCP 116.132.235.228:http > 192.168.0.106:10321 ',70,,
b'her / IP / TCP 116.132.235.228:http > 192.168.0.106:10321 ',70,,
b'her / IP / TCP 116.132.235.228:http > 192.168.0.106:10321 PA / Ra',70,,
b'her / IP / TCP 116.132.235.228:http > 192.168.0.106:10321 F',70,,
b'her / IP / TCP 116.132.235.228:http > 192.168.0.106:10321 ',71,,
b'her / IP / TCP 192.168.0.106:10322 > 116.132.235.228:http ',71,,
b'her / IP / TCP 192.168.0.106:10322 > 116.132.235.228:http ',71,,
b'her / IP / TCP 192.168.0.106:10322 > 116.132.235.228:http PA / Ra',71,,
b'her / IP / TCP 192.168.0.106:10322 > 116.132.235.228:http A / Ra',71,,
b'her / IP / TCP 192.168.0.106:10322 > 116.132.235.228:http A / Ra',71,,
b'her / IP / TCP 192.168.0.106:10322 > 116.132.235.228:http PA / Ra',71,,
b'her / IP / TCP 192.168.0.106:10322 > 116.132.235.228:http ',72,,
b'her / IP / TCP 192.168.0.106:10322 > 116.132.235.228:http F',72,,
b'her / IP / TCP 116.132.235.228:http > 192.168.0.106:10322 S',73,,
b'her / IP / TCP 116.132.235.228:http > 192.168.0.106:10322 ',73,,
b'her / IP / TCP 116.132.235.228:http > 192.168.0.106:10322 ',73,,
b'her / IP / TCP 116.132.235.228:http > 192.168.0.106:10322 ',73,,
b'her / IP / TCP 116.132.235.228:http > 192.168.0.106:10322 PA / Ra',73,,
b'her / IP / TCP 116.132.235.228:http > 192.168.0.106:10322 F',73,,
b'her / IP / TCP 116.132.235.228:http > 192.168.0.106:10322 ',74,,
b'her / IP / TCP 192.168.0.106:10323 > 116.132.235.228:http ',74,,
b'her / IP / TCP 192.168.0.106:10323 > 116.132.235.228:http ',74,,
b'her / IP / TCP 192.168.0.106:10323 > 116.132.235.228:http PA / Ra',74,,
b'her / IP / TCP 192.168.0.106:10323 > 116.132.235.228:http A / Ra',74,,
b'her / IP / TCP 192.168.0.106:10323 > 116.132.235.228:http A / Ra',74,,
b'her / IP / TCP 192.168.0.106:10323 > 116.132.235.228:http PA / Ra',74,,
b'her / IP / TCP 192.168.0.106:10323 > 116.132.235.228:http ',75,,
b'her / IP / TCP 192.168.0.106:10323 > 116.132.235.228:http F',75,,
b'her / IP / TCP 116.132.235.228:http > 192.168.0.106:10323 S',76,,
b'her / IP / TCP 116.132.235.228:http > 192.168.0.106:10323 ',76,,
b'her / IP / TCP 116.132.235.228:http > 192.168.0.106:10323 ',76,,
b'her / IP / TCP 116.132.235.228:http > 192.168.0.106:10323 ',76,,
b'her / IP / TCP 116.132.235.228:http > 192.168.0.106:10323 PA / Ra',76,,
b'her / IP / TCP 116.132.235.228:http > 192.168.0.106:10323 F',76,,
b'her / IP / TCP 116.132.235.228:http > 192.168.0.106:10323 ',77,,
b'her / IP / TCP 192.168.0.106:10324 > 116.132.235.228:http ',77,,
b'her / IP / TCP 192.168.0.106:10324 > 116.132.235.228:http ',77,,
b'her / IP / TCP 192.168.0.106:10324 > 116.132.235.228:http PA / Ra',77,,
b'her / IP / TCP 192.168.0.106:10324 > 116.132.235.228:http A / Ra',77,,
b'her / IP / TCP 192.168.0.106:10324 > 116.132.235.228:http A / Ra',77,,
b'her / IP / TCP 192.168.0.106:10324 > 116.132.235.228:http PA / Ra',77,,
b'her / IP / TCP 192.168.0.106:10324 > 116.132.235.228:http ',78,,
b'her / IP / TCP 192.168.0.106:10324 > 116.132.235.228:http F',78,,
b'her / IP / TCP 116.132.235.228:http > 192.168.0.106:10324 S',79,,
b'her / IP / TCP 116.132.235.228:http > 192.168.0.106:10324 ',79,,
b'her / IP / TCP 116.132.235.228:http > 192.168.0.106:10324 ',79,,
b'her / IP / TCP 116.132.235.228:http > 192.168.0.106:10324 ',79,,
b'her / IP / TCP 116.132.235.228:http > 192.168.0.106:10324 PA / Ra',79,,
b'her / IP / TCP 116.132.235.228:http > 192.168.0.106:10324 F',79,,
b'her / IP / TCP 116.132.235.228:http > 192.168.0.106:10324 ',80,,
b'her / IP / TCP 192.168.0.106:10325 > 116.132.235.228:http ',80,,
b'her / IP / TCP 192.168.0.106:10325 > 116.132.235.228:http ',80,,
b'her / IP / TCP 192.168.0.106:10325 > 116.132.235.228:http PA / Ra',80,,
b'her / IP / TCP 192.168.0.106:10325 > 116.132.235.228:http A / Ra',80,,
b'her / IP / TCP 192.168.0.106:10325 > 116.132.235.228:http A / Ra',80,,
b'her / IP / TCP 192.168.0.106:10325 > 116.132.235.228:http PA / Ra',80,,
b'her / IP / TCP 192.168.0.106:10325 > 116.132.235.228:http ',81,,
b'her / IP / TCP 192.168.0.106:10325 > 116.132.235.228:http F',81,,
b'her / IP / TCP 192.168.0.106:10325 > 116.132.235.228:http F',81,,
b'her / IP / TCP 192.168.0.106:10325 > 116.132.235.228:http F',81,,
b'her / IP / TCP 192.168.0.106:10325 > 116.132.235.228:http F',81,,
b'her / IP / TCP 192.168.0.106:10325 > 116.132.235.228:http F',81,,
b'her / IP / TCP 192.168.0.106:10325 > 116.132.235.228:http F',81,,
b'her / IP / TCP 116.132.235.228:http > 192.168.0.106:10325 S',82,,
b'her / IP / TCP 116.132.235.228:http > 192.168.0.106:10325 ',82,,
b'her / IP / TCP 116.132.235.228:http > 192.168.0.106:10325 ',82,,
b'her / IP / TCP 116.132.235.228:http > 192.168.0.106:10325 ',82,,
b'her / IP / TCP 116.132.235.228:http > 192.168.0.106:10325 PA / Ra',82,,
b'her / IP / TCP 116.132.235.228:http > 192.168.0.106:10325 F',82,,
b'her / IP / TCP 52.108.46.20:https > 192.168.0.106:1285 PA / Ra',83,,
b'her / IP / TCP 192.168.0.106:1285 > 52.108.46.20:https ',84,,
b'her / IP / TCP 192.168.0.106:13267 > 125.39.196.167:14000 PA / Ra',85,,
b'her / IP / TCP 192.168.0.106:13267 > 125.39.196.167:14000 ',85,,
b'her / IP / TCP 125.39.196.167:14000 > 192.168.0.106:13267 PA / Ra',86,,
b'her / IP / TCP 59.38.123.207:45902 > 192.168.0.106:9954 PA / Ra',87,,
b'her / IP / TCP 59.38.123.207:45902 > 192.168.0.106:9954 A / Paddin',87,,
b'her / IP / TCP 192.168.0.106:9954 > 59.38.123.207:45902 PA / Ra',88,,
b'her / IP / TCP 192.168.0.106:10326 > 110.242.68.3:http ',89,,
b'her / IP / TCP 192.168.0.106:10326 > 110.242.68.3:http ',89,,
b'her / IP / TCP 192.168.0.106:10326 > 110.242.68.3:http F',89,,
b'her / IP / TCP 192.168.0.106:10326 > 110.242.68.3:http ',89,,
b'her / IP / TCP 110.242.68.3:http > 192.168.0.106:10326 S',90,,
b'her / IP / TCP 110.242.68.3:http > 192.168.0.106:10326 ',90,,
b'her / IP / TCP 110.242.68.3:http > 192.168.0.106:10326 F',90,,
b'her / IP / TCP 192.168.0.106:10195 > 59.38.123.207:45902 A / Ra',91,,
b'her / IP / TCP 192.168.0.106:10195 > 59.38.123.207:45902 PA / Ra',91,,
b'her / IP / TCP 192.168.0.106:10195 > 59.38.123.207:45902 PA / Ra',91,,
b'her / IP / TCP 192.168.0.106:10195 > 59.38.123.207:45902 ',91,,
b'her / IP / TCP 59.38.123.207:45902 > 192.168.0.106:10195 ',92,,
b'her / IP / TCP 59.38.123.207:45902 > 192.168.0.106:10195 A / Paddin',92,,
b'her / IP / TCP 59.38.123.207:45902 > 192.168.0.106:10195 A / Paddin',92,,
b'her / IP / TCP 59.38.123.207:45902 > 192.168.0.106:10195 PA / Ra',92,,
b'her / IP / TCP 192.168.0.106:10255 > 59.38.123.207:45902 A / Ra',93,,
b'her / IP / TCP 59.38.123.207:45902 > 192.168.0.106:10255 ',94,,
b'her / IP / TCP 192.168.0.106:10328 > 59.38.123.207:45902 ',95,,
b'her / IP / TCP 192.168.0.106:10328 > 59.38.123.207:45902 ',95,,
b'her / IP / TCP 192.168.0.106:10328 > 59.38.123.207:45902 PA / Ra',95,,
b'her / IP / TCP 192.168.0.106:10328 > 59.38.123.207:45902 PA / Ra',95,,
b'her / IP / TCP 59.38.123.207:45902 > 192.168.0.106:10328 S',96,,
