data,flowmember,label,classes
b'her / IP / TCP 192.168.0.106:5624 > 192.168.0.1:domain ',1,,
b'her / IP / TCP 192.168.0.106:5624 > 192.168.0.1:domain ',1,,
b'her / IP / TCP 192.168.0.106:5624 > 192.168.0.1:domain ',1,,
b'her / IP / TCP 192.168.0.106:5624 > 192.168.0.1:domain ',1,,
b'her / IP / TCP 192.168.0.106:5625 > 192.168.0.1:domain ',2,,
b'her / IP / TCP 192.168.0.106:5625 > 192.168.0.1:domain ',2,,
b'her / IP / TCP 192.168.0.106:5625 > 192.168.0.1:domain ',2,,
b'her / IP / TCP 192.168.0.106:5625 > 192.168.0.1:domain ',2,,
b'her / IP / TCP 192.168.0.106:5614 > 192.168.0.1:domain ',3,,
b'her / IP / TCP 192.168.0.106:5614 > 192.168.0.1:domain ',3,,
b'her / IP / TCP 192.168.0.106:5614 > 192.168.0.1:domain ',3,,
b'her / IP / TCP 192.168.0.1:domain > 192.168.0.106:5624 R',4,,
b'her / IP / TCP 192.168.0.1:domain > 192.168.0.106:5624 R',4,,
b'her / IP / TCP 192.168.0.1:domain > 192.168.0.106:5624 R',4,,
b'her / IP / TCP 192.168.0.1:domain > 192.168.0.106:5624 R',4,,
b'her / IP / TCP 192.168.0.1:domain > 192.168.0.106:5625 R',5,,
b'her / IP / TCP 192.168.0.1:domain > 192.168.0.106:5625 R',5,,
b'her / IP / TCP 192.168.0.1:domain > 192.168.0.106:5625 R',5,,
b'her / IP / TCP 192.168.0.1:domain > 192.168.0.106:5625 R',5,,
b'her / IP / TCP 192.168.0.1:domain > 192.168.0.106:5614 R',6,,
b'her / IP / TCP 192.168.0.1:domain > 192.168.0.106:5614 R',6,,
b'her / IP / TCP 192.168.0.1:domain > 192.168.0.106:5614 R',6,,
b'her / IP / TCP 192.168.0.106:5615 > 192.168.0.1:domain ',7,,
b'her / IP / TCP 192.168.0.106:5615 > 192.168.0.1:domain ',7,,
b'her / IP / TCP 192.168.0.106:5615 > 192.168.0.1:domain ',7,,
b'her / IP / TCP 192.168.0.1:domain > 192.168.0.106:5615 R',8,,
b'her / IP / TCP 192.168.0.1:domain > 192.168.0.106:5615 R',8,,
b'her / IP / TCP 192.168.0.1:domain > 192.168.0.106:5615 R',8,,
b'her / IP / TCP 192.168.0.106:7120 > 40.74.98.192:https PA / Ra',9,,
b'her / IP / TCP 192.168.0.106:7120 > 40.74.98.192:https PA / Ra',9,,
b'her / IP / TCP 192.168.0.106:7120 > 40.74.98.192:https ',9,,
b'her / IP / TCP 40.74.98.192:https > 192.168.0.106:7120 A / Paddin',10,,
b'her / IP / TCP 40.74.98.192:https > 192.168.0.106:7120 PA / Ra',10,,
b'her / IP / TCP 40.74.98.192:https > 192.168.0.106:7120 PA / Ra',10,,
b'her / IP / TCP 192.168.0.106:5626 > 116.132.235.228:http ',11,,
b'her / IP / TCP 192.168.0.106:5626 > 116.132.235.228:http ',11,,
b'her / IP / TCP 192.168.0.106:5626 > 116.132.235.228:http PA / Ra',11,,
b'her / IP / TCP 192.168.0.106:5626 > 116.132.235.228:http A / Ra',11,,
b'her / IP / TCP 192.168.0.106:5626 > 116.132.235.228:http A / Ra',11,,
b'her / IP / TCP 192.168.0.106:5626 > 116.132.235.228:http PA / Ra',11,,
b'her / IP / TCP 192.168.0.106:5626 > 116.132.235.228:http ',12,,
b'her / IP / TCP 192.168.0.106:5626 > 116.132.235.228:http F',12,,
b'her / IP / TCP 192.168.0.106:5626 > 116.132.235.228:http F',12,,
b'her / IP / TCP 192.168.0.106:5626 > 116.132.235.228:http F',12,,
b'her / IP / TCP 192.168.0.106:5626 > 116.132.235.228:http F',12,,
b'her / IP / TCP 192.168.0.106:5626 > 116.132.235.228:http F',12,,
b'her / IP / TCP 192.168.0.106:5626 > 116.132.235.228:http F',12,,
b'her / IP / TCP 116.132.235.228:http > 192.168.0.106:5626 S',13,,
b'her / IP / TCP 116.132.235.228:http > 192.168.0.106:5626 ',13,,
b'her / IP / TCP 116.132.235.228:http > 192.168.0.106:5626 ',13,,
b'her / IP / TCP 116.132.235.228:http > 192.168.0.106:5626 ',13,,
b'her / IP / TCP 116.132.235.228:http > 192.168.0.106:5626 PA / Ra',13,,
b'her / IP / TCP 116.132.235.228:http > 192.168.0.106:5626 F',13,,
b'her / IP / TCP 192.168.0.106:5613 > 116.132.235.228:http F',14,,
b'her / IP / TCP 192.168.0.106:5613 > 116.132.235.228:http F',14,,
b'her / IP / TCP 192.168.0.106:5613 > 116.132.235.228:http F',14,,
b'her / IP / TCP 192.168.0.106:11670 > 116.130.230.27:https PA / Ra',15,,
b'her / IP / TCP 192.168.0.106:11670 > 116.130.230.27:https ',15,,
b'her / IP / TCP 192.168.0.106:11670 > 116.130.230.27:https ',15,,
b'her / IP / TCP 116.130.230.27:https > 192.168.0.106:11670 PA / Ra',16,,
b'her / IP / TCP 116.130.230.27:https > 192.168.0.106:11670 PA / Ra',16,,
b'her / IP / TCP 192.168.0.106:5601 > 116.132.235.228:http F',17,,
b'her / IP / TCP 192.168.0.106:5601 > 116.132.235.228:http R',17,,
b'her / IP / TCP 192.168.0.106:5627 > 116.132.235.228:http ',18,,
b'her / IP / TCP 192.168.0.106:5627 > 116.132.235.228:http ',18,,
b'her / IP / TCP 192.168.0.106:5627 > 116.132.235.228:http PA / Ra',18,,
b'her / IP / TCP 192.168.0.106:5627 > 116.132.235.228:http A / Ra',18,,
b'her / IP / TCP 192.168.0.106:5627 > 116.132.235.228:http A / Ra',18,,
b'her / IP / TCP 192.168.0.106:5627 > 116.132.235.228:http PA / Ra',18,,
b'her / IP / TCP 192.168.0.106:5627 > 116.132.235.228:http ',19,,
b'her / IP / TCP 192.168.0.106:5627 > 116.132.235.228:http F',19,,
b'her / IP / TCP 192.168.0.106:5627 > 116.132.235.228:http F',19,,
b'her / IP / TCP 192.168.0.106:5627 > 116.132.235.228:http F',19,,
b'her / IP / TCP 192.168.0.106:5627 > 116.132.235.228:http F',19,,
b'her / IP / TCP 192.168.0.106:5627 > 116.132.235.228:http F',19,,
b'her / IP / TCP 192.168.0.106:5627 > 116.132.235.228:http F',19,,
b'her / IP / TCP 116.132.235.228:http > 192.168.0.106:5627 S',20,,
b'her / IP / TCP 116.132.235.228:http > 192.168.0.106:5627 ',20,,
b'her / IP / TCP 116.132.235.228:http > 192.168.0.106:5627 ',20,,
b'her / IP / TCP 116.132.235.228:http > 192.168.0.106:5627 ',20,,
b'her / IP / TCP 116.132.235.228:http > 192.168.0.106:5627 PA / Ra',20,,
b'her / IP / TCP 116.132.235.228:http > 192.168.0.106:5627 F',20,,
b'her / IP / TCP 192.168.0.106:5628 > 116.132.235.228:http ',21,,
b'her / IP / TCP 192.168.0.106:5628 > 116.132.235.228:http ',21,,
b'her / IP / TCP 192.168.0.106:5628 > 116.132.235.228:http PA / Ra',21,,
b'her / IP / TCP 192.168.0.106:5628 > 116.132.235.228:http A / Ra',21,,
b'her / IP / TCP 192.168.0.106:5628 > 116.132.235.228:http A / Ra',21,,
b'her / IP / TCP 192.168.0.106:5628 > 116.132.235.228:http PA / Ra',21,,
b'her / IP / TCP 192.168.0.106:5628 > 116.132.235.228:http ',22,,
b'her / IP / TCP 192.168.0.106:5628 > 116.132.235.228:http F',22,,
b'her / IP / TCP 192.168.0.106:5628 > 116.132.235.228:http F',22,,
b'her / IP / TCP 192.168.0.106:5628 > 116.132.235.228:http F',22,,
b'her / IP / TCP 192.168.0.106:5628 > 116.132.235.228:http F',22,,
b'her / IP / TCP 192.168.0.106:5628 > 116.132.235.228:http F',22,,
b'her / IP / TCP 192.168.0.106:5628 > 116.132.235.228:http F',22,,
b'her / IP / TCP 116.132.235.228:http > 192.168.0.106:5628 S',23,,
b'her / IP / TCP 116.132.235.228:http > 192.168.0.106:5628 ',23,,
b'her / IP / TCP 116.132.235.228:http > 192.168.0.106:5628 ',23,,
b'her / IP / TCP 116.132.235.228:http > 192.168.0.106:5628 ',23,,
b'her / IP / TCP 116.132.235.228:http > 192.168.0.106:5628 PA / Ra',23,,
b'her / IP / TCP 116.132.235.228:http > 192.168.0.106:5628 F',23,,
"b'her / IP / UDP / DNS Qry ""b\'nav-edge.smartscreen.microsoft.com.\'""'",24,,
"b'her / IP / UDP / DNS Ans ""b\'tm-prod-wd-csp-edge.trafficmanager.net.\'""'",25,,
b'her / IP / TCP 192.168.0.106:5629 > 20.198.213.74:https ',26,,
b'her / IP / TCP 192.168.0.106:5629 > 20.198.213.74:https ',26,,
b'her / IP / TCP 192.168.0.106:5629 > 20.198.213.74:https PA / Ra',26,,
b'her / IP / TCP 192.168.0.106:5629 > 20.198.213.74:https ',26,,
b'her / IP / TCP 192.168.0.106:5629 > 20.198.213.74:https ',26,,
b'her / IP / TCP 192.168.0.106:5629 > 20.198.213.74:https ',26,,
b'her / IP / TCP 192.168.0.106:5629 > 20.198.213.74:https ',27,,
b'her / IP / TCP 192.168.0.106:5629 > 20.198.213.74:https ',27,,
b'her / IP / TCP 192.168.0.106:5629 > 20.198.213.74:https ',27,,
b'her / IP / TCP 192.168.0.106:5629 > 20.198.213.74:https PA / Ra',27,,
b'her / IP / TCP 192.168.0.106:5629 > 20.198.213.74:https PA / Ra',27,,
b'her / IP / TCP 192.168.0.106:5629 > 20.198.213.74:https A / Ra',27,,
b'her / IP / TCP 192.168.0.106:5629 > 20.198.213.74:https PA / Ra',27,,
b'her / IP / TCP 192.168.0.106:5629 > 20.198.213.74:https ',28,,
b'her / IP / TCP 192.168.0.106:5629 > 20.198.213.74:https ',28,,
b'her / IP / TCP 192.168.0.106:5629 > 20.198.213.74:https F',28,,
b'her / IP / TCP 192.168.0.106:5629 > 20.198.213.74:https F',28,,
b'her / IP / TCP 192.168.0.106:5629 > 20.198.213.74:https F',28,,
b'her / IP / TCP 192.168.0.106:5629 > 20.198.213.74:https F',28,,
b'her / IP / TCP 192.168.0.106:5629 > 20.198.213.74:https F',28,,
b'her / IP / TCP 192.168.0.106:5629 > 20.198.213.74:https F',29,,
b'her / IP / TCP 192.168.0.106:5630 > 20.198.213.74:https ',29,,
b'her / IP / TCP 192.168.0.106:5630 > 20.198.213.74:https ',29,,
b'her / IP / TCP 192.168.0.106:5630 > 20.198.213.74:https PA / Ra',29,,
b'her / IP / TCP 192.168.0.106:5630 > 20.198.213.74:https ',29,,
b'her / IP / TCP 192.168.0.106:5630 > 20.198.213.74:https ',29,,
b'her / IP / TCP 192.168.0.106:5630 > 20.198.213.74:https PA / Ra',29,,
b'her / IP / TCP 192.168.0.106:5630 > 20.198.213.74:https PA / Ra',30,,
b'her / IP / TCP 192.168.0.106:5630 > 20.198.213.74:https A / Ra',30,,
b'her / IP / TCP 192.168.0.106:5630 > 20.198.213.74:https PA / Ra',30,,
b'her / IP / TCP 192.168.0.106:5630 > 20.198.213.74:https ',30,,
b'her / IP / TCP 192.168.0.106:5630 > 20.198.213.74:https F',30,,
b'her / IP / TCP 192.168.0.106:5630 > 20.198.213.74:https F',30,,
b'her / IP / TCP 192.168.0.106:5630 > 20.198.213.74:https F',30,,
b'her / IP / TCP 192.168.0.106:5630 > 20.198.213.74:https F',31,,
b'her / IP / TCP 192.168.0.106:5630 > 20.198.213.74:https F',31,,
b'her / IP / TCP 192.168.0.106:5630 > 20.198.213.74:https F',31,,
b'her / IP / TCP 192.168.0.106:5631 > 20.198.213.74:https ',32,,
b'her / IP / TCP 192.168.0.106:5631 > 20.198.213.74:https ',32,,
b'her / IP / TCP 192.168.0.106:5631 > 20.198.213.74:https PA / Ra',32,,
b'her / IP / TCP 192.168.0.106:5631 > 20.198.213.74:https ',32,,
b'her / IP / TCP 192.168.0.106:5631 > 20.198.213.74:https ',32,,
b'her / IP / TCP 192.168.0.106:5631 > 20.198.213.74:https PA / Ra',32,,
b'her / IP / TCP 192.168.0.106:5631 > 20.198.213.74:https ',33,,
b'her / IP / TCP 20.198.213.74:https > 192.168.0.106:5630 S',33,,
b'her / IP / TCP 20.198.213.74:https > 192.168.0.106:5630 A / Ra',33,,
b'her / IP / TCP 20.198.213.74:https > 192.168.0.106:5630 A / Ra',33,,
b'her / IP / TCP 20.198.213.74:https > 192.168.0.106:5630 A / Ra',33,,
b'her / IP / TCP 20.198.213.74:https > 192.168.0.106:5630 A / Ra',33,,
b'her / IP / TCP 20.198.213.74:https > 192.168.0.106:5630 PA / Ra',33,,
b'her / IP / TCP 20.198.213.74:https > 192.168.0.106:5630 A / Ra',34,,
b'her / IP / TCP 20.198.213.74:https > 192.168.0.106:5630 PA / Ra',34,,
b'her / IP / TCP 20.198.213.74:https > 192.168.0.106:5630 ',34,,
b'her / IP / TCP 20.198.213.74:https > 192.168.0.106:5630 FPA / Ra',34,,
b'her / IP / TCP 20.198.213.74:https > 192.168.0.106:5629 S',35,,
b'her / IP / TCP 20.198.213.74:https > 192.168.0.106:5629 A / Ra',35,,
b'her / IP / TCP 20.198.213.74:https > 192.168.0.106:5629 A / Ra',35,,
b'her / IP / TCP 20.198.213.74:https > 192.168.0.106:5629 PA / Ra',35,,
b'her / IP / TCP 20.198.213.74:https > 192.168.0.106:5629 A / Ra',35,,
b'her / IP / TCP 20.198.213.74:https > 192.168.0.106:5629 A / Ra',35,,
b'her / IP / TCP 20.198.213.74:https > 192.168.0.106:5629 A / Ra',36,,
b'her / IP / TCP 20.198.213.74:https > 192.168.0.106:5629 PA / Ra',36,,
b'her / IP / TCP 20.198.213.74:https > 192.168.0.106:5629 ',36,,
b'her / IP / TCP 20.198.213.74:https > 192.168.0.106:5629 ',36,,
b'her / IP / TCP 20.198.213.74:https > 192.168.0.106:5629 FPA / Ra',36,,
b'her / IP / TCP 20.198.213.74:https > 192.168.0.106:5629 A / Ra',36,,
b'her / IP / TCP 20.198.213.74:https > 192.168.0.106:5631 S',37,,
b'her / IP / TCP 20.198.213.74:https > 192.168.0.106:5631 A / Ra',37,,
b'her / IP / TCP 20.198.213.74:https > 192.168.0.106:5631 A / Ra',37,,
b'her / IP / TCP 20.198.213.74:https > 192.168.0.106:5631 A / Ra',37,,
b'her / IP / TCP 20.198.213.74:https > 192.168.0.106:5631 A / Ra',37,,
b'her / IP / TCP 20.198.213.74:https > 192.168.0.106:5631 A / Ra',37,,
b'her / IP / TCP 20.198.213.74:https > 192.168.0.106:5631 PA / Ra',38,,
b'her / IP / TCP 20.198.213.74:https > 192.168.0.106:5631 PA / Ra',38,,
b'her / IP / TCP 192.168.0.106:5632 > 110.242.68.3:http ',39,,
b'her / IP / TCP 192.168.0.106:5632 > 110.242.68.3:http ',39,,
b'her / IP / TCP 192.168.0.106:5632 > 110.242.68.3:http F',39,,
b'her / IP / TCP 192.168.0.106:5632 > 110.242.68.3:http ',39,,
b'her / IP / TCP 110.242.68.3:http > 192.168.0.106:5632 S',40,,
b'her / IP / TCP 110.242.68.3:http > 192.168.0.106:5632 ',40,,
b'her / IP / TCP 110.242.68.3:http > 192.168.0.106:5632 F',40,,
b'her / IP / TCP 192.168.0.106:5604 > 116.132.235.228:http F',41,,
b'her / IP / TCP 192.168.0.106:5604 > 116.132.235.228:http R',41,,
b'her / IP / TCP 192.168.0.106:5605 > 116.132.235.228:http F',42,,
b'her / IP / TCP 192.168.0.106:5605 > 116.132.235.228:http R',42,,
b'her / IP / TCP 192.168.0.106:5633 > 116.132.235.228:http ',43,,
b'her / IP / TCP 192.168.0.106:5633 > 116.132.235.228:http ',43,,
b'her / IP / TCP 192.168.0.106:5633 > 116.132.235.228:http PA / Ra',43,,
b'her / IP / TCP 192.168.0.106:5633 > 116.132.235.228:http A / Ra',43,,
b'her / IP / TCP 192.168.0.106:5633 > 116.132.235.228:http A / Ra',43,,
b'her / IP / TCP 192.168.0.106:5633 > 116.132.235.228:http PA / Ra',43,,
b'her / IP / TCP 192.168.0.106:5633 > 116.132.235.228:http ',44,,
b'her / IP / TCP 192.168.0.106:5633 > 116.132.235.228:http F',44,,
b'her / IP / TCP 192.168.0.106:5633 > 116.132.235.228:http F',44,,
b'her / IP / TCP 192.168.0.106:5633 > 116.132.235.228:http F',44,,
b'her / IP / TCP 192.168.0.106:5633 > 116.132.235.228:http F',44,,
b'her / IP / TCP 192.168.0.106:5633 > 116.132.235.228:http F',44,,
b'her / IP / TCP 192.168.0.106:5633 > 116.132.235.228:http F',44,,
b'her / IP / TCP 116.132.235.228:http > 192.168.0.106:5633 S',45,,
b'her / IP / TCP 116.132.235.228:http > 192.168.0.106:5633 ',45,,
b'her / IP / TCP 116.132.235.228:http > 192.168.0.106:5633 ',45,,
b'her / IP / TCP 116.132.235.228:http > 192.168.0.106:5633 ',45,,
b'her / IP / TCP 116.132.235.228:http > 192.168.0.106:5633 PA / Ra',45,,
b'her / IP / TCP 116.132.235.228:http > 192.168.0.106:5633 F',45,,
b'her / IP / TCP 192.168.0.106:5634 > 116.132.235.228:http ',46,,
b'her / IP / TCP 192.168.0.106:5634 > 116.132.235.228:http ',46,,
b'her / IP / TCP 192.168.0.106:5634 > 116.132.235.228:http PA / Ra',46,,
b'her / IP / TCP 192.168.0.106:5634 > 116.132.235.228:http A / Ra',46,,
b'her / IP / TCP 192.168.0.106:5634 > 116.132.235.228:http A / Ra',46,,
b'her / IP / TCP 192.168.0.106:5634 > 116.132.235.228:http PA / Ra',46,,
b'her / IP / TCP 192.168.0.106:5634 > 116.132.235.228:http ',47,,
b'her / IP / TCP 192.168.0.106:5634 > 116.132.235.228:http F',47,,
b'her / IP / TCP 116.132.235.228:http > 192.168.0.106:5634 S',48,,
b'her / IP / TCP 116.132.235.228:http > 192.168.0.106:5634 ',48,,
b'her / IP / TCP 116.132.235.228:http > 192.168.0.106:5634 ',48,,
b'her / IP / TCP 116.132.235.228:http > 192.168.0.106:5634 ',48,,
b'her / IP / TCP 116.132.235.228:http > 192.168.0.106:5634 PA / Ra',48,,
b'her / IP / TCP 116.132.235.228:http > 192.168.0.106:5634 F',48,,
b'her / IP / TCP 116.132.235.228:http > 192.168.0.106:5634 ',49,,
b'her / IP / TCP 192.168.0.106:5635 > 116.132.235.228:http ',49,,
b'her / IP / TCP 192.168.0.106:5635 > 116.132.235.228:http ',49,,
b'her / IP / TCP 192.168.0.106:5635 > 116.132.235.228:http PA / Ra',49,,
b'her / IP / TCP 192.168.0.106:5635 > 116.132.235.228:http A / Ra',49,,
b'her / IP / TCP 192.168.0.106:5635 > 116.132.235.228:http A / Ra',49,,
b'her / IP / TCP 192.168.0.106:5635 > 116.132.235.228:http PA / Ra',49,,
b'her / IP / TCP 192.168.0.106:5635 > 116.132.235.228:http ',50,,
b'her / IP / TCP 192.168.0.106:5635 > 116.132.235.228:http F',50,,
b'her / IP / TCP 116.132.235.228:http > 192.168.0.106:5635 S',51,,
b'her / IP / TCP 116.132.235.228:http > 192.168.0.106:5635 ',51,,
b'her / IP / TCP 116.132.235.228:http > 192.168.0.106:5635 ',51,,
b'her / IP / TCP 116.132.235.228:http > 192.168.0.106:5635 ',51,,
b'her / IP / TCP 116.132.235.228:http > 192.168.0.106:5635 PA / Ra',51,,
b'her / IP / TCP 116.132.235.228:http > 192.168.0.106:5635 F',51,,
b'her / IP / TCP 116.132.235.228:http > 192.168.0.106:5635 ',52,,
b'her / IP / UDP 192.168.192.1:netbios_ns > 192.168.192.2:netbios_ns / NBNSHeader / Ra',52,,
b'her / IP / UDP 192.168.192.1:netbios_ns > 192.168.192.2:netbios_ns / NBNSHeader / Ra',52,,
b'her / IP / UDP 192.168.192.1:netbios_ns > 192.168.192.2:netbios_ns / NBNSHeader / Ra',52,,
b'her / IP / TCP 192.168.0.106:5636 > 116.132.235.228:http ',53,,
b'her / IP / TCP 192.168.0.106:5636 > 116.132.235.228:http ',53,,
b'her / IP / TCP 192.168.0.106:5636 > 116.132.235.228:http PA / Ra',53,,
b'her / IP / TCP 192.168.0.106:5636 > 116.132.235.228:http A / Ra',53,,
b'her / IP / TCP 192.168.0.106:5636 > 116.132.235.228:http A / Ra',53,,
b'her / IP / TCP 192.168.0.106:5636 > 116.132.235.228:http PA / Ra',53,,
b'her / IP / TCP 192.168.0.106:5636 > 116.132.235.228:http ',54,,
b'her / IP / TCP 192.168.0.106:5636 > 116.132.235.228:http F',54,,
b'her / IP / TCP 116.132.235.228:http > 192.168.0.106:5636 S',55,,
b'her / IP / TCP 116.132.235.228:http > 192.168.0.106:5636 ',55,,
b'her / IP / TCP 116.132.235.228:http > 192.168.0.106:5636 ',55,,
b'her / IP / TCP 116.132.235.228:http > 192.168.0.106:5636 ',55,,
b'her / IP / TCP 116.132.235.228:http > 192.168.0.106:5636 PA / Ra',55,,
b'her / IP / TCP 116.132.235.228:http > 192.168.0.106:5636 F',55,,
b'her / IP / TCP 116.132.235.228:http > 192.168.0.106:5636 ',56,,
b'her / IP / TCP 69.16.175.10:http > 192.168.0.106:5608 F',56,,
b'her / IP / TCP 192.168.0.106:5608 > 69.16.175.10:http ',57,,
b'her / IP / TCP 192.168.0.106:5637 > 116.132.235.228:http ',58,,
b'her / IP / TCP 192.168.0.106:5637 > 116.132.235.228:http ',58,,
b'her / IP / TCP 192.168.0.106:5637 > 116.132.235.228:http PA / Ra',58,,
b'her / IP / TCP 192.168.0.106:5637 > 116.132.235.228:http A / Ra',58,,
b'her / IP / TCP 192.168.0.106:5637 > 116.132.235.228:http A / Ra',58,,
b'her / IP / TCP 192.168.0.106:5637 > 116.132.235.228:http PA / Ra',58,,
b'her / IP / TCP 192.168.0.106:5637 > 116.132.235.228:http ',59,,
b'her / IP / TCP 192.168.0.106:5637 > 116.132.235.228:http F',59,,
b'her / IP / TCP 192.168.0.106:5637 > 116.132.235.228:http F',59,,
b'her / IP / TCP 192.168.0.106:5637 > 116.132.235.228:http F',59,,
b'her / IP / TCP 192.168.0.106:5637 > 116.132.235.228:http F',59,,
b'her / IP / TCP 192.168.0.106:5637 > 116.132.235.228:http F',59,,
b'her / IP / TCP 116.132.235.228:http > 192.168.0.106:5637 S',60,,
b'her / IP / TCP 116.132.235.228:http > 192.168.0.106:5637 ',60,,
b'her / IP / TCP 116.132.235.228:http > 192.168.0.106:5637 ',60,,
b'her / IP / TCP 116.132.235.228:http > 192.168.0.106:5637 ',60,,
b'her / IP / TCP 116.132.235.228:http > 192.168.0.106:5637 PA / Ra',60,,
b'her / IP / TCP 116.132.235.228:http > 192.168.0.106:5637 F',60,,
b'her / IP / TCP 192.168.0.106:5638 > 116.132.235.228:http ',61,,
b'her / IP / TCP 192.168.0.106:5638 > 116.132.235.228:http ',61,,
b'her / IP / TCP 192.168.0.106:5638 > 116.132.235.228:http PA / Ra',61,,
b'her / IP / TCP 192.168.0.106:5638 > 116.132.235.228:http A / Ra',61,,
b'her / IP / TCP 192.168.0.106:5638 > 116.132.235.228:http A / Ra',61,,
b'her / IP / TCP 192.168.0.106:5638 > 116.132.235.228:http PA / Ra',61,,
b'her / IP / TCP 192.168.0.106:5638 > 116.132.235.228:http ',62,,
b'her / IP / TCP 192.168.0.106:5638 > 116.132.235.228:http F',62,,
b'her / IP / TCP 116.132.235.228:http > 192.168.0.106:5638 S',63,,
b'her / IP / TCP 116.132.235.228:http > 192.168.0.106:5638 ',63,,
b'her / IP / TCP 116.132.235.228:http > 192.168.0.106:5638 ',63,,
b'her / IP / TCP 116.132.235.228:http > 192.168.0.106:5638 PA / Ra',63,,
b'her / IP / TCP 116.132.235.228:http > 192.168.0.106:5638 F',63,,
b'her / IP / TCP 116.132.235.228:http > 192.168.0.106:5638 ',63,,
b'her / IP / TCP 192.168.0.106:5639 > 116.132.235.228:http ',64,,
b'her / IP / TCP 192.168.0.106:5639 > 116.132.235.228:http ',64,,
b'her / IP / TCP 192.168.0.106:5639 > 116.132.235.228:http PA / Ra',64,,
b'her / IP / TCP 192.168.0.106:5639 > 116.132.235.228:http A / Ra',64,,
b'her / IP / TCP 192.168.0.106:5639 > 116.132.235.228:http A / Ra',64,,
b'her / IP / TCP 192.168.0.106:5639 > 116.132.235.228:http PA / Ra',64,,
b'her / IP / TCP 192.168.0.106:5639 > 116.132.235.228:http ',65,,
b'her / IP / TCP 192.168.0.106:5639 > 116.132.235.228:http F',65,,
b'her / IP / TCP 116.132.235.228:http > 192.168.0.106:5639 S',66,,
b'her / IP / TCP 116.132.235.228:http > 192.168.0.106:5639 ',66,,
b'her / IP / TCP 116.132.235.228:http > 192.168.0.106:5639 ',66,,
b'her / IP / TCP 116.132.235.228:http > 192.168.0.106:5639 ',66,,
b'her / IP / TCP 116.132.235.228:http > 192.168.0.106:5639 PA / Ra',66,,
b'her / IP / TCP 116.132.235.228:http > 192.168.0.106:5639 F',66,,
b'her / IP / TCP 116.132.235.228:http > 192.168.0.106:5639 ',67,,
b'her / IP / TCP 139.224.70.134:https > 192.168.0.106:7027 PA / Ra',67,,
b'her / IP / TCP 139.224.70.134:https > 192.168.0.106:7027 A / Paddin',67,,
b'her / IP / TCP 192.168.0.106:7027 > 139.224.70.134:https PA / Ra',68,,
b'her / IP / TCP 192.168.0.106:5640 > 116.132.235.228:http ',69,,
b'her / IP / TCP 192.168.0.106:5640 > 116.132.235.228:http ',69,,
b'her / IP / TCP 192.168.0.106:5640 > 116.132.235.228:http PA / Ra',69,,
b'her / IP / TCP 192.168.0.106:5640 > 116.132.235.228:http A / Ra',69,,
b'her / IP / TCP 192.168.0.106:5640 > 116.132.235.228:http A / Ra',69,,
b'her / IP / TCP 192.168.0.106:5640 > 116.132.235.228:http PA / Ra',69,,
b'her / IP / TCP 192.168.0.106:5640 > 116.132.235.228:http ',70,,
b'her / IP / TCP 192.168.0.106:5640 > 116.132.235.228:http F',70,,
b'her / IP / TCP 192.168.0.106:5640 > 116.132.235.228:http F',70,,
b'her / IP / TCP 192.168.0.106:5640 > 116.132.235.228:http F',70,,
b'her / IP / TCP 192.168.0.106:5640 > 116.132.235.228:http F',70,,
b'her / IP / TCP 116.132.235.228:http > 192.168.0.106:5640 S',71,,
b'her / IP / TCP 116.132.235.228:http > 192.168.0.106:5640 ',71,,
b'her / IP / TCP 116.132.235.228:http > 192.168.0.106:5640 ',71,,
b'her / IP / TCP 116.132.235.228:http > 192.168.0.106:5640 ',71,,
b'her / IP / TCP 116.132.235.228:http > 192.168.0.106:5640 PA / Ra',71,,
b'her / IP / TCP 116.132.235.228:http > 192.168.0.106:5640 F',71,,
b'her / IP / TCP 192.168.0.106:5641 > 116.132.235.228:http ',72,,
b'her / IP / TCP 192.168.0.106:5641 > 116.132.235.228:http ',72,,
b'her / IP / TCP 192.168.0.106:5641 > 116.132.235.228:http PA / Ra',72,,
b'her / IP / TCP 192.168.0.106:5641 > 116.132.235.228:http A / Ra',72,,
b'her / IP / TCP 192.168.0.106:5641 > 116.132.235.228:http A / Ra',72,,
b'her / IP / TCP 192.168.0.106:5641 > 116.132.235.228:http PA / Ra',72,,
b'her / IP / TCP 192.168.0.106:5641 > 116.132.235.228:http ',73,,
b'her / IP / TCP 192.168.0.106:5641 > 116.132.235.228:http F',73,,
b'her / IP / TCP 192.168.0.106:5641 > 116.132.235.228:http F',73,,
b'her / IP / TCP 192.168.0.106:5641 > 116.132.235.228:http F',73,,
b'her / IP / TCP 192.168.0.106:5641 > 116.132.235.228:http F',73,,
b'her / IP / TCP 116.132.235.228:http > 192.168.0.106:5641 S',74,,
b'her / IP / TCP 116.132.235.228:http > 192.168.0.106:5641 ',74,,
b'her / IP / TCP 116.132.235.228:http > 192.168.0.106:5641 ',74,,
b'her / IP / TCP 116.132.235.228:http > 192.168.0.106:5641 ',74,,
b'her / IP / TCP 116.132.235.228:http > 192.168.0.106:5641 PA / Ra',74,,
b'her / IP / TCP 116.132.235.228:http > 192.168.0.106:5641 F',74,,
b'her / IP / TCP 192.168.0.106:5642 > 116.132.235.228:http ',75,,
b'her / IP / TCP 192.168.0.106:5642 > 116.132.235.228:http ',75,,
b'her / IP / TCP 192.168.0.106:5642 > 116.132.235.228:http PA / Ra',75,,
b'her / IP / TCP 192.168.0.106:5642 > 116.132.235.228:http A / Ra',75,,
b'her / IP / TCP 192.168.0.106:5642 > 116.132.235.228:http A / Ra',75,,
b'her / IP / TCP 192.168.0.106:5642 > 116.132.235.228:http PA / Ra',75,,
b'her / IP / TCP 192.168.0.106:5642 > 116.132.235.228:http ',76,,
b'her / IP / TCP 192.168.0.106:5642 > 116.132.235.228:http F',76,,
b'her / IP / TCP 192.168.0.106:5642 > 116.132.235.228:http F',76,,
b'her / IP / TCP 192.168.0.106:5642 > 116.132.235.228:http F',76,,
b'her / IP / TCP 192.168.0.106:5642 > 116.132.235.228:http F',76,,
b'her / IP / TCP 116.132.235.228:http > 192.168.0.106:5642 S',77,,
b'her / IP / TCP 116.132.235.228:http > 192.168.0.106:5642 ',77,,
b'her / IP / TCP 116.132.235.228:http > 192.168.0.106:5642 ',77,,
b'her / IP / TCP 116.132.235.228:http > 192.168.0.106:5642 ',77,,
b'her / IP / TCP 116.132.235.228:http > 192.168.0.106:5642 PA / Ra',77,,
b'her / IP / TCP 116.132.235.228:http > 192.168.0.106:5642 F',77,,
b'her / IP / TCP 192.168.0.106:5643 > 116.132.235.228:http ',78,,
b'her / IP / TCP 192.168.0.106:5643 > 116.132.235.228:http ',78,,
b'her / IP / TCP 192.168.0.106:5643 > 116.132.235.228:http PA / Ra',78,,
b'her / IP / TCP 192.168.0.106:5643 > 116.132.235.228:http A / Ra',78,,
b'her / IP / TCP 192.168.0.106:5643 > 116.132.235.228:http A / Ra',78,,
b'her / IP / TCP 192.168.0.106:5643 > 116.132.235.228:http PA / Ra',78,,
b'her / IP / TCP 192.168.0.106:5643 > 116.132.235.228:http ',79,,
b'her / IP / TCP 192.168.0.106:5643 > 116.132.235.228:http F',79,,
b'her / IP / TCP 116.132.235.228:http > 192.168.0.106:5643 S',80,,
b'her / IP / TCP 116.132.235.228:http > 192.168.0.106:5643 ',80,,
b'her / IP / TCP 116.132.235.228:http > 192.168.0.106:5643 ',80,,
b'her / IP / TCP 116.132.235.228:http > 192.168.0.106:5643 ',80,,
b'her / IP / TCP 116.132.235.228:http > 192.168.0.106:5643 PA / Ra',80,,
b'her / IP / TCP 116.132.235.228:http > 192.168.0.106:5643 F',80,,
b'her / IP / TCP 116.132.235.228:http > 192.168.0.106:5643 ',81,,
b'her / IP / TCP 192.168.0.106:6806 > 119.3.178.178:21113 A / Ra',81,,
b'her / IP / TCP 119.3.178.178:21113 > 192.168.0.106:6806 ',82,,
b'her / IP / TCP 192.168.0.106:5644 > 116.132.235.228:http ',83,,
b'her / IP / TCP 192.168.0.106:5644 > 116.132.235.228:http ',83,,
b'her / IP / TCP 192.168.0.106:5644 > 116.132.235.228:http PA / Ra',83,,
b'her / IP / TCP 192.168.0.106:5644 > 116.132.235.228:http A / Ra',83,,
b'her / IP / TCP 192.168.0.106:5644 > 116.132.235.228:http A / Ra',83,,
b'her / IP / TCP 192.168.0.106:5644 > 116.132.235.228:http PA / Ra',83,,
b'her / IP / TCP 192.168.0.106:5644 > 116.132.235.228:http ',84,,
b'her / IP / TCP 192.168.0.106:5644 > 116.132.235.228:http F',84,,
b'her / IP / TCP 192.168.0.106:5644 > 116.132.235.228:http F',84,,
b'her / IP / TCP 116.132.235.228:http > 192.168.0.106:5644 S',85,,
b'her / IP / TCP 116.132.235.228:http > 192.168.0.106:5644 ',85,,
b'her / IP / TCP 116.132.235.228:http > 192.168.0.106:5644 ',85,,
b'her / IP / TCP 116.132.235.228:http > 192.168.0.106:5644 ',85,,
b'her / IP / TCP 116.132.235.228:http > 192.168.0.106:5644 PA / Ra',85,,
b'her / IP / TCP 116.132.235.228:http > 192.168.0.106:5644 F',85,,
b'her / IP / TCP 192.168.0.106:5645 > 110.242.68.3:http ',86,,
b'her / IP / TCP 192.168.0.106:5645 > 110.242.68.3:http ',86,,
b'her / IP / TCP 192.168.0.106:5645 > 110.242.68.3:http F',86,,
b'her / IP / TCP 192.168.0.106:5645 > 110.242.68.3:http ',86,,
b'her / IP / TCP 110.242.68.3:http > 192.168.0.106:5645 S',87,,
b'her / IP / TCP 110.242.68.3:http > 192.168.0.106:5645 ',87,,
b'her / IP / TCP 110.242.68.3:http > 192.168.0.106:5645 F',87,,
b'her / IP / TCP 192.168.0.106:5646 > 157.148.62.140:http ',88,,
b'her / IP / TCP 192.168.0.106:5646 > 157.148.62.140:http ',88,,
b'her / IP / TCP 157.148.62.140:http > 192.168.0.106:5646 S',89,,
