data,flowmember,label,classes
b'her / IP / TCP 20.195.114.44:https > 192.168.180.164:9083 A / Ra',1,,
b'her / IP / TCP 20.195.114.44:https > 192.168.180.164:9083 A / Ra',1,,
b'her / IP / TCP 20.195.114.44:https > 192.168.180.164:9083 A / Ra',1,,
b'her / IP / TCP 20.195.114.44:https > 192.168.180.164:9083 A / Ra',1,,
b'her / IP / TCP 20.195.114.44:https > 192.168.180.164:9083 PA / Ra',1,,
b'her / IP / TCP 20.195.114.44:https > 192.168.180.164:9083 PA / Ra',1,,
b'her / IP / TCP 20.195.114.44:https > 192.168.180.164:9083 ',2,,
b'her / IP / TCP 20.195.114.44:https > 192.168.180.164:9083 FPA / Ra',2,,
b'her / IP / TCP 20.195.114.44:https > 192.168.180.164:9083 ',2,,
b'her / IP / TCP 192.168.180.164:9083 > 20.195.114.44:https ',3,,
b'her / IP / TCP 192.168.180.164:9083 > 20.195.114.44:https ',3,,
b'her / IP / TCP 192.168.180.164:9083 > 20.195.114.44:https PA / Ra',3,,
b'her / IP / TCP 192.168.180.164:9083 > 20.195.114.44:https PA / Ra',3,,
b'her / IP / TCP 192.168.180.164:9083 > 20.195.114.44:https A / Ra',3,,
b'her / IP / TCP 192.168.180.164:9083 > 20.195.114.44:https PA / Ra',3,,
b'her / IP / TCP 192.168.180.164:9083 > 20.195.114.44:https ',4,,
b'her / IP / TCP 192.168.180.164:9083 > 20.195.114.44:https F',4,,
b'her / IP / TCP 192.168.180.164:9081 > 142.251.43.10:https ',5,,
b'her / IP / TCP 192.168.180.164:9081 > 142.251.43.10:https ',5,,
b'her / IP / TCP 192.168.180.164:9081 > 142.251.43.10:https ',5,,
b'her / IP / TCP 192.168.180.164:9081 > 142.251.43.10:https ',5,,
b'her / IP / TCP 192.168.180.164:6058 > 20.42.73.25:https PA / Ra',6,,
b'her / IP / TCP 192.168.180.164:6058 > 20.42.73.25:https PA / Ra',6,,
b'her / IP / TCP 192.168.180.164:6058 > 20.42.73.25:https ',6,,
b'her / IP / TCP 192.168.180.164:6058 > 20.42.73.25:https A / Ra',6,,
b'her / IP / TCP 20.42.73.25:https > 192.168.180.164:6058 ',7,,
b'her / IP / TCP 20.42.73.25:https > 192.168.180.164:6058 PA / Ra',7,,
b'her / IP / TCP 20.42.73.25:https > 192.168.180.164:6058 ',7,,
b'her / IP / UDP 192.168.180.164:50605 > 142.251.43.10:https / Ra',8,,
b'her / IP / UDP 192.168.180.164:50605 > 142.251.43.10:https / Ra',8,,
b'her / IP / TCP 192.168.180.164:5845 > 203.119.144.59:http PA / Ra',9,,
b'her / IP / TCP 192.168.180.164:5845 > 203.119.144.59:http A / Ra',9,,
b'her / IP / TCP 192.168.180.164:5845 > 203.119.144.59:http A / Ra',9,,
b'her / IP / TCP 192.168.180.164:5845 > 203.119.144.59:http PA / Ra',9,,
b'her / IP / TCP 192.168.180.164:5845 > 203.119.144.59:http ',9,,
b'her / IP / TCP 192.168.180.164:5845 > 203.119.144.59:http PA / Ra',9,,
b'her / IP / TCP 192.168.180.164:5845 > 203.119.144.59:http A / Ra',10,,
b'her / IP / TCP 192.168.180.164:5845 > 203.119.144.59:http A / Ra',10,,
b'her / IP / TCP 192.168.180.164:5845 > 203.119.144.59:http PA / Ra',10,,
b'her / IP / TCP 192.168.180.164:5845 > 203.119.144.59:http ',10,,
b'her / IP / TCP 192.168.180.164:5845 > 203.119.144.59:http PA / Ra',10,,
b'her / IP / TCP 192.168.180.164:5845 > 203.119.144.59:http A / Ra',10,,
b'her / IP / TCP 192.168.180.164:5845 > 203.119.144.59:http A / Ra',10,,
b'her / IP / TCP 192.168.180.164:5845 > 203.119.144.59:http PA / Ra',11,,
b'her / IP / TCP 192.168.180.164:5845 > 203.119.144.59:http ',11,,
b'her / IP / TCP 192.168.180.164:5845 > 203.119.144.59:http PA / Ra',11,,
b'her / IP / TCP 192.168.180.164:5845 > 203.119.144.59:http A / Ra',11,,
b'her / IP / TCP 192.168.180.164:5845 > 203.119.144.59:http A / Ra',11,,
b'her / IP / TCP 192.168.180.164:5845 > 203.119.144.59:http PA / Ra',11,,
b'her / IP / TCP 192.168.180.164:5845 > 203.119.144.59:http ',11,,
b'her / IP / TCP 192.168.180.164:5845 > 203.119.144.59:http PA / Ra',12,,
b'her / IP / TCP 192.168.180.164:5845 > 203.119.144.59:http A / Ra',12,,
b'her / IP / TCP 192.168.180.164:5845 > 203.119.144.59:http A / Ra',12,,
b'her / IP / TCP 192.168.180.164:5845 > 203.119.144.59:http PA / Ra',12,,
b'her / IP / TCP 192.168.180.164:5845 > 203.119.144.59:http ',12,,
b'her / IP / TCP 192.168.180.164:5845 > 203.119.144.59:http PA / Ra',12,,
b'her / IP / TCP 192.168.180.164:5845 > 203.119.144.59:http A / Ra',12,,
b'her / IP / TCP 192.168.180.164:5845 > 203.119.144.59:http A / Ra',13,,
b'her / IP / TCP 192.168.180.164:5845 > 203.119.144.59:http PA / Ra',13,,
b'her / IP / TCP 192.168.180.164:5845 > 203.119.144.59:http ',13,,
b'her / IP / TCP 192.168.180.164:5845 > 203.119.144.59:http PA / Ra',13,,
b'her / IP / TCP 192.168.180.164:5845 > 203.119.144.59:http A / Ra',13,,
b'her / IP / TCP 192.168.180.164:5845 > 203.119.144.59:http A / Ra',13,,
b'her / IP / TCP 192.168.180.164:5845 > 203.119.144.59:http PA / Ra',13,,
b'her / IP / TCP 192.168.180.164:5845 > 203.119.144.59:http ',14,,
b'her / IP / TCP 192.168.180.164:5845 > 203.119.144.59:http PA / Ra',14,,
b'her / IP / TCP 192.168.180.164:5845 > 203.119.144.59:http A / Ra',14,,
b'her / IP / TCP 192.168.180.164:5845 > 203.119.144.59:http PA / Ra',14,,
b'her / IP / TCP 192.168.180.164:5845 > 203.119.144.59:http ',14,,
b'her / IP / TCP 192.168.180.164:5845 > 203.119.144.59:http PA / Ra',14,,
b'her / IP / TCP 192.168.180.164:5845 > 203.119.144.59:http A / Ra',14,,
b'her / IP / TCP 192.168.180.164:5845 > 203.119.144.59:http PA / Ra',15,,
b'her / IP / TCP 192.168.180.164:5845 > 203.119.144.59:http ',15,,
b'her / IP / TCP 192.168.180.164:5845 > 203.119.144.59:http PA / Ra',15,,
b'her / IP / TCP 192.168.180.164:5845 > 203.119.144.59:http A / Ra',15,,
b'her / IP / TCP 192.168.180.164:5845 > 203.119.144.59:http PA / Ra',15,,
b'her / IP / TCP 192.168.180.164:5845 > 203.119.144.59:http ',15,,
b'her / IP / TCP 192.168.180.164:5845 > 203.119.144.59:http PA / Ra',15,,
b'her / IP / TCP 192.168.180.164:5845 > 203.119.144.59:http A / Ra',16,,
b'her / IP / TCP 192.168.180.164:5845 > 203.119.144.59:http A / Ra',16,,
b'her / IP / TCP 192.168.180.164:5845 > 203.119.144.59:http PA / Ra',16,,
b'her / IP / TCP 192.168.180.164:5845 > 203.119.144.59:http ',16,,
b'her / IP / TCP 192.168.180.164:5845 > 203.119.144.59:http PA / Ra',16,,
b'her / IP / TCP 192.168.180.164:5845 > 203.119.144.59:http A / Ra',16,,
b'her / IP / TCP 192.168.180.164:5845 > 203.119.144.59:http A / Ra',16,,
b'her / IP / TCP 192.168.180.164:5845 > 203.119.144.59:http PA / Ra',17,,
b'her / IP / TCP 192.168.180.164:5845 > 203.119.144.59:http ',17,,
b'her / IP / TCP 192.168.180.164:5845 > 203.119.144.59:http PA / Ra',17,,
b'her / IP / TCP 192.168.180.164:5845 > 203.119.144.59:http A / Ra',17,,
b'her / IP / TCP 192.168.180.164:5845 > 203.119.144.59:http A / Ra',17,,
b'her / IP / TCP 192.168.180.164:5845 > 203.119.144.59:http PA / Ra',17,,
b'her / IP / TCP 192.168.180.164:5845 > 203.119.144.59:http A / Ra',17,,
b'her / IP / TCP 192.168.180.164:5845 > 203.119.144.59:http ',18,,
b'her / IP / TCP 192.168.180.164:5845 > 203.119.144.59:http PA / Ra',18,,
b'her / IP / TCP 192.168.180.164:5845 > 203.119.144.59:http A / Ra',18,,
b'her / IP / TCP 192.168.180.164:5845 > 203.119.144.59:http A / Ra',18,,
b'her / IP / TCP 192.168.180.164:5845 > 203.119.144.59:http PA / Ra',18,,
b'her / IP / TCP 192.168.180.164:5845 > 203.119.144.59:http ',18,,
b'her / IP / TCP 192.168.180.164:5845 > 203.119.144.59:http PA / Ra',18,,
b'her / IP / TCP 192.168.180.164:5845 > 203.119.144.59:http A / Ra',19,,
b'her / IP / TCP 192.168.180.164:5845 > 203.119.144.59:http PA / Ra',19,,
b'her / IP / TCP 192.168.180.164:5845 > 203.119.144.59:http ',19,,
b'her / IP / TCP 192.168.180.164:5845 > 203.119.144.59:http PA / Ra',19,,
b'her / IP / TCP 192.168.180.164:5845 > 203.119.144.59:http A / Ra',19,,
b'her / IP / TCP 192.168.180.164:5845 > 203.119.144.59:http A / Ra',19,,
b'her / IP / TCP 192.168.180.164:5845 > 203.119.144.59:http PA / Ra',19,,
b'her / IP / TCP 192.168.180.164:5845 > 203.119.144.59:http ',20,,
b'her / IP / TCP 192.168.180.164:5845 > 203.119.144.59:http PA / Ra',20,,
b'her / IP / TCP 192.168.180.164:5845 > 203.119.144.59:http A / Ra',20,,
b'her / IP / TCP 192.168.180.164:5845 > 203.119.144.59:http A / Ra',20,,
b'her / IP / TCP 192.168.180.164:5845 > 203.119.144.59:http PA / Ra',20,,
b'her / IP / TCP 192.168.180.164:5845 > 203.119.144.59:http ',20,,
b'her / IP / TCP 192.168.180.164:5845 > 203.119.144.59:http PA / Ra',20,,
b'her / IP / TCP 192.168.180.164:5845 > 203.119.144.59:http A / Ra',21,,
b'her / IP / TCP 192.168.180.164:5845 > 203.119.144.59:http A / Ra',21,,
b'her / IP / TCP 192.168.180.164:5845 > 203.119.144.59:http PA / Ra',21,,
b'her / IP / TCP 192.168.180.164:5845 > 203.119.144.59:http ',21,,
b'her / IP / TCP 192.168.180.164:5845 > 203.119.144.59:http PA / Ra',21,,
b'her / IP / TCP 192.168.180.164:5845 > 203.119.144.59:http A / Ra',21,,
b'her / IP / TCP 192.168.180.164:5845 > 203.119.144.59:http PA / Ra',21,,
b'her / IP / TCP 192.168.180.164:5845 > 203.119.144.59:http ',22,,
b'her / IP / TCP 192.168.180.164:5845 > 203.119.144.59:http PA / Ra',22,,
b'her / IP / TCP 192.168.180.164:5845 > 203.119.144.59:http A / Ra',22,,
b'her / IP / TCP 192.168.180.164:5845 > 203.119.144.59:http A / Ra',22,,
b'her / IP / TCP 192.168.180.164:5845 > 203.119.144.59:http PA / Ra',22,,
b'her / IP / TCP 192.168.180.164:5845 > 203.119.144.59:http ',22,,
b'her / IP / TCP 192.168.180.164:5845 > 203.119.144.59:http PA / Ra',22,,
b'her / IP / TCP 192.168.180.164:5845 > 203.119.144.59:http A / Ra',23,,
b'her / IP / TCP 192.168.180.164:5845 > 203.119.144.59:http A / Ra',23,,
b'her / IP / TCP 192.168.180.164:5845 > 203.119.144.59:http PA / Ra',23,,
b'her / IP / TCP 192.168.180.164:5845 > 203.119.144.59:http ',23,,
b'her / IP / TCP 192.168.180.164:5845 > 203.119.144.59:http PA / Ra',23,,
b'her / IP / TCP 192.168.180.164:5845 > 203.119.144.59:http A / Ra',23,,
b'her / IP / TCP 192.168.180.164:5845 > 203.119.144.59:http A / Ra',23,,
b'her / IP / TCP 192.168.180.164:5845 > 203.119.144.59:http PA / Ra',24,,
b'her / IP / TCP 192.168.180.164:5845 > 203.119.144.59:http ',24,,
b'her / IP / TCP 192.168.180.164:5845 > 203.119.144.59:http PA / Ra',24,,
b'her / IP / TCP 192.168.180.164:5845 > 203.119.144.59:http A / Ra',24,,
b'her / IP / TCP 192.168.180.164:5845 > 203.119.144.59:http A / Ra',24,,
b'her / IP / TCP 192.168.180.164:5845 > 203.119.144.59:http PA / Ra',24,,
b'her / IP / TCP 192.168.180.164:5845 > 203.119.144.59:http ',24,,
b'her / IP / TCP 192.168.180.164:5845 > 203.119.144.59:http PA / Ra',25,,
b'her / IP / TCP 192.168.180.164:5845 > 203.119.144.59:http A / Ra',25,,
b'her / IP / TCP 192.168.180.164:5845 > 203.119.144.59:http A / Ra',25,,
b'her / IP / TCP 192.168.180.164:5845 > 203.119.144.59:http PA / Ra',25,,
b'her / IP / TCP 192.168.180.164:5845 > 203.119.144.59:http ',25,,
b'her / IP / TCP 192.168.180.164:5845 > 203.119.144.59:http PA / Ra',25,,
b'her / IP / TCP 192.168.180.164:5845 > 203.119.144.59:http A / Ra',25,,
b'her / IP / TCP 192.168.180.164:5845 > 203.119.144.59:http A / Ra',26,,
b'her / IP / TCP 192.168.180.164:5845 > 203.119.144.59:http PA / Ra',26,,
b'her / IP / TCP 192.168.180.164:5845 > 203.119.144.59:http ',26,,
b'her / IP / TCP 203.119.144.59:http > 192.168.180.164:5845 ',27,,
b'her / IP / TCP 203.119.144.59:http > 192.168.180.164:5845 ',27,,
b'her / IP / TCP 203.119.144.59:http > 192.168.180.164:5845 PA / Ra',27,,
b'her / IP / TCP 203.119.144.59:http > 192.168.180.164:5845 PA / Ra',27,,
b'her / IP / TCP 203.119.144.59:http > 192.168.180.164:5845 ',27,,
b'her / IP / TCP 203.119.144.59:http > 192.168.180.164:5845 PA / Ra',27,,
b'her / IP / TCP 203.119.144.59:http > 192.168.180.164:5845 PA / Ra',28,,
b'her / IP / TCP 203.119.144.59:http > 192.168.180.164:5845 ',28,,
b'her / IP / TCP 203.119.144.59:http > 192.168.180.164:5845 ',28,,
b'her / IP / TCP 203.119.144.59:http > 192.168.180.164:5845 PA / Ra',28,,
b'her / IP / TCP 203.119.144.59:http > 192.168.180.164:5845 PA / Ra',28,,
b'her / IP / TCP 203.119.144.59:http > 192.168.180.164:5845 ',28,,
b'her / IP / TCP 203.119.144.59:http > 192.168.180.164:5845 PA / Ra',28,,
b'her / IP / TCP 203.119.144.59:http > 192.168.180.164:5845 PA / Ra',29,,
b'her / IP / TCP 203.119.144.59:http > 192.168.180.164:5845 ',29,,
b'her / IP / TCP 203.119.144.59:http > 192.168.180.164:5845 PA / Ra',29,,
b'her / IP / TCP 203.119.144.59:http > 192.168.180.164:5845 PA / Ra',29,,
b'her / IP / TCP 203.119.144.59:http > 192.168.180.164:5845 ',29,,
b'her / IP / TCP 203.119.144.59:http > 192.168.180.164:5845 ',29,,
b'her / IP / TCP 203.119.144.59:http > 192.168.180.164:5845 PA / Ra',29,,
b'her / IP / TCP 203.119.144.59:http > 192.168.180.164:5845 PA / Ra',30,,
b'her / IP / TCP 203.119.144.59:http > 192.168.180.164:5845 ',30,,
b'her / IP / TCP 203.119.144.59:http > 192.168.180.164:5845 PA / Ra',30,,
b'her / IP / TCP 203.119.144.59:http > 192.168.180.164:5845 PA / Ra',30,,
b'her / IP / TCP 203.119.144.59:http > 192.168.180.164:5845 ',30,,
b'her / IP / TCP 203.119.144.59:http > 192.168.180.164:5845 PA / Ra',30,,
b'her / IP / TCP 203.119.144.59:http > 192.168.180.164:5845 PA / Ra',30,,
b'her / IP / TCP 203.119.144.59:http > 192.168.180.164:5845 ',31,,
b'her / IP / TCP 203.119.144.59:http > 192.168.180.164:5845 PA / Ra',31,,
b'her / IP / TCP 203.119.144.59:http > 192.168.180.164:5845 PA / Ra',31,,
b'her / IP / TCP 203.119.144.59:http > 192.168.180.164:5845 ',31,,
b'her / IP / TCP 203.119.144.59:http > 192.168.180.164:5845 PA / Ra',31,,
b'her / IP / TCP 203.119.144.59:http > 192.168.180.164:5845 PA / Ra',31,,
b'her / IP / TCP 203.119.144.59:http > 192.168.180.164:5845 ',31,,
b'her / IP / TCP 203.119.144.59:http > 192.168.180.164:5845 ',32,,
b'her / IP / TCP 203.119.144.59:http > 192.168.180.164:5845 PA / Ra',32,,
b'her / IP / TCP 203.119.144.59:http > 192.168.180.164:5845 PA / Ra',32,,
b'her / IP / TCP 203.119.144.59:http > 192.168.180.164:5845 ',32,,
b'her / IP / TCP 203.119.144.59:http > 192.168.180.164:5845 PA / Ra',32,,
b'her / IP / TCP 203.119.144.59:http > 192.168.180.164:5845 PA / Ra',32,,
b'her / IP / TCP 203.119.144.59:http > 192.168.180.164:5845 ',32,,
b'her / IP / TCP 203.119.144.59:http > 192.168.180.164:5845 ',33,,
b'her / IP / TCP 203.119.144.59:http > 192.168.180.164:5845 ',33,,
b'her / IP / TCP 203.119.144.59:http > 192.168.180.164:5845 PA / Ra',33,,
b'her / IP / TCP 203.119.144.59:http > 192.168.180.164:5845 PA / Ra',33,,
b'her / IP / TCP 203.119.144.59:http > 192.168.180.164:5845 ',33,,
b'her / IP / TCP 203.119.144.59:http > 192.168.180.164:5845 PA / Ra',33,,
b'her / IP / TCP 203.119.144.59:http > 192.168.180.164:5845 PA / Ra',33,,
b'her / IP / TCP 203.119.144.59:http > 192.168.180.164:5845 ',34,,
b'her / IP / TCP 203.119.144.59:http > 192.168.180.164:5845 PA / Ra',34,,
b'her / IP / TCP 203.119.144.59:http > 192.168.180.164:5845 PA / Ra',34,,
b'her / IP / TCP 203.119.144.59:http > 192.168.180.164:5845 ',34,,
b'her / IP / TCP 203.119.144.59:http > 192.168.180.164:5845 PA / Ra',34,,
b'her / IP / TCP 203.119.144.59:http > 192.168.180.164:5845 PA / Ra',34,,
b'her / IP / TCP 203.119.144.59:http > 192.168.180.164:5845 ',34,,
b'her / IP / TCP 203.119.144.59:http > 192.168.180.164:5845 ',35,,
b'her / IP / TCP 203.119.144.59:http > 192.168.180.164:5845 PA / Ra',35,,
b'her / IP / TCP 203.119.144.59:http > 192.168.180.164:5845 PA / Ra',35,,
b'her / IP / TCP 203.119.144.59:http > 192.168.180.164:5845 ',35,,
b'her / IP / TCP 203.119.144.59:http > 192.168.180.164:5845 PA / Ra',35,,
b'her / IP / TCP 203.119.144.59:http > 192.168.180.164:5845 PA / Ra',35,,
b'her / IP / TCP 203.119.144.59:http > 192.168.180.164:5845 ',35,,
b'her / IP / TCP 203.119.144.59:http > 192.168.180.164:5845 PA / Ra',36,,
b'her / IP / TCP 203.119.144.59:http > 192.168.180.164:5845 PA / Ra',36,,
b'her / IP / TCP 203.119.144.59:http > 192.168.180.164:5845 ',36,,
b'her / IP / TCP 203.119.144.59:http > 192.168.180.164:5845 PA / Ra',36,,
b'her / IP / TCP 203.119.144.59:http > 192.168.180.164:5845 PA / Ra',36,,
b'her / IP / TCP 203.119.144.59:http > 192.168.180.164:5845 ',36,,
b'her / IP / TCP 203.119.144.59:http > 192.168.180.164:5845 PA / Ra',36,,
b'her / IP / TCP 203.119.144.59:http > 192.168.180.164:5845 PA / Ra',37,,
b'her / IP / TCP 203.119.144.59:http > 192.168.180.164:5845 ',37,,
b'her / IP / TCP 203.119.144.59:http > 192.168.180.164:5845 PA / Ra',37,,
b'her / IP / TCP 203.119.144.59:http > 192.168.180.164:5845 PA / Ra',37,,
b'her / IP / TCP 203.119.144.59:http > 192.168.180.164:5845 ',37,,
b'her / IP / TCP 203.119.144.59:http > 192.168.180.164:5845 PA / Ra',37,,
b'her / IP / TCP 203.119.144.59:http > 192.168.180.164:5845 PA / Ra',37,,
b'her / IP / TCP 203.119.144.59:http > 192.168.180.164:5845 ',38,,
b'her / IP / TCP 203.119.144.59:http > 192.168.180.164:5845 PA / Ra',38,,
b'her / IP / TCP 203.119.144.59:http > 192.168.180.164:5845 PA / Ra',38,,
b'her / IP / TCP 203.119.144.59:http > 192.168.180.164:5845 ',38,,
b'her / IP / TCP 203.119.144.59:http > 192.168.180.164:5845 PA / Ra',38,,
b'her / IP / TCP 203.119.144.59:http > 192.168.180.164:5845 PA / Ra',38,,
b'her / IP / TCP 192.168.180.164:9080 > 142.251.43.10:https ',39,,
b'her / IP / TCP 192.168.180.164:9080 > 142.251.43.10:https ',39,,
b'her / IP / TCP 192.168.180.164:9080 > 142.251.43.10:https ',39,,
b'her / IP / TCP 192.168.180.164:5884 > 23.41.74.108:https A / Ra',40,,
b'her / IP / TCP 192.168.180.164:5884 > 23.41.74.108:https F',40,,
b'her / IP / TCP 192.168.180.164:5884 > 23.41.74.108:https R',40,,
b'her / IP / TCP 23.41.74.108:https > 192.168.180.164:5884 ',41,,
b'her / IP / TCP 23.41.74.108:https > 192.168.180.164:5884 PA / Ra',41,,
b'her / IP / TCP 23.41.74.108:https > 192.168.180.164:5884 F',41,,
b'her / IP / TCP 69.16.175.10:http > 192.168.180.164:9073 F',42,,
b'her / IP / TCP 192.168.180.164:9073 > 69.16.175.10:http ',43,,
b'her / IP / TCP 192.168.180.164:9073 > 69.16.175.10:http F',43,,
b'her / IP / TCP 192.168.180.164:9073 > 69.16.175.10:http F',43,,
b'her / IP / TCP 192.168.180.164:9073 > 69.16.175.10:http F',43,,
b'her / IP / TCP 192.168.180.164:9073 > 69.16.175.10:http F',43,,
b'her / IP / TCP 192.168.180.164:9073 > 69.16.175.10:http F',43,,
b'her / IP / TCP 192.168.180.164:9073 > 69.16.175.10:http A / Ra',44,,
b'her / IP / TCP 192.168.180.164:8989 > 117.12.41.57:http F',44,,
b'her / IP / TCP 192.168.180.164:8989 > 117.12.41.57:http ',44,,
b'her / IP / TCP 117.12.41.57:http > 192.168.180.164:8989 F',45,,
b'her / IP / TCP 13.107.5.80:https > 192.168.180.164:6048 R',46,,
b'her / IP / TCP 192.168.180.164:9050 > 52.98.89.2:https A / Ra',47,,
b'her / IP / TCP 192.168.180.164:9050 > 52.98.89.2:https F',47,,
b'her / IP / TCP 52.98.89.2:https > 192.168.180.164:9050 ',48,,
b'her / IP / TCP 52.98.89.2:https > 192.168.180.164:9050 R',48,,
b'her / IP / TCP 13.107.6.158:https > 192.168.180.164:6045 R',49,,
b'her / IP / TCP 13.107.21.239:https > 192.168.180.164:6041 R',50,,
b'her / IP / TCP 192.168.180.164:6047 > 13.107.21.239:https PA / Ra',51,,
b'her / IP / TCP 192.168.180.164:6047 > 13.107.21.239:https PA / Ra',51,,
b'her / IP / TCP 192.168.180.164:6047 > 13.107.21.239:https PA / Ra',51,,
b'her / IP / TCP 192.168.180.164:6047 > 13.107.21.239:https ',51,,
b'her / IP / TCP 192.168.180.164:6047 > 13.107.21.239:https ',51,,
b'her / IP / TCP 192.168.180.164:6047 > 13.107.21.239:https PA / Ra',51,,
b'her / IP / TCP 13.107.21.239:https > 192.168.180.164:6047 ',52,,
b'her / IP / TCP 13.107.21.239:https > 192.168.180.164:6047 PA / Ra',52,,
b'her / IP / TCP 13.107.21.239:https > 192.168.180.164:6047 PA / Ra',52,,
b'her / IP / TCP 13.107.21.239:https > 192.168.180.164:6047 PA / Ra',52,,
b'her / IP / TCP 13.107.21.239:https > 192.168.180.164:6047 PA / Ra',52,,
b'her / IP / TCP 13.107.21.239:https > 192.168.180.164:6047 ',52,,
b'her / IP / UDP 45.40.228.59:8000 > 192.168.180.164:4010 / Ra',53,,
b'her / IP / UDP 45.40.228.59:8000 > 192.168.180.164:4010 / Ra',53,,
b'her / IP / UDP 45.40.228.59:8000 > 192.168.180.164:4010 / Ra',53,,
b'her / IP / UDP 192.168.180.164:55213 > 239.255.255.250:ssdp / Ra',54,,
b'her / IP / UDP 192.168.180.164:55213 > 239.255.255.250:ssdp / Ra',54,,
b'her / IP / UDP 192.168.180.164:55213 > 239.255.255.250:ssdp / Ra',54,,
b'her / IP / UDP 192.168.180.164:55213 > 239.255.255.250:ssdp / Ra',54,,
b'her / IP / TCP 192.168.180.164:9085 > 202.89.233.101:https ',55,,
b'her / IP / TCP 192.168.180.164:9085 > 202.89.233.101:https ',55,,
b'her / IP / TCP 192.168.180.164:9085 > 202.89.233.101:https PA / Ra',55,,
b'her / IP / TCP 192.168.180.164:9085 > 202.89.233.101:https ',55,,
b'her / IP / TCP 192.168.180.164:9085 > 202.89.233.101:https PA / Ra',55,,
b'her / IP / TCP 192.168.180.164:9085 > 202.89.233.101:https ',55,,
b'her / IP / TCP 202.89.233.101:https > 192.168.180.164:9085 S',56,,
b'her / IP / TCP 202.89.233.101:https > 192.168.180.164:9085 ',56,,
b'her / IP / TCP 202.89.233.101:https > 192.168.180.164:9085 A / Ra',56,,
b'her / IP / TCP 202.89.233.101:https > 192.168.180.164:9085 A / Ra',56,,
b'her / IP / TCP 202.89.233.101:https > 192.168.180.164:9085 A / Ra',56,,
b'her / IP / TCP 202.89.233.101:https > 192.168.180.164:9085 A / Ra',56,,
b'her / IP / TCP 202.89.233.101:https > 192.168.180.164:9085 PA / Ra',57,,
b'her / IP / TCP 202.89.233.101:https > 192.168.180.164:9085 ',57,,
b'her / IP / TCP 202.89.233.101:https > 192.168.180.164:9085 PA / Ra',57,,
b'her / IP / TCP 202.89.233.101:https > 192.168.180.164:9085 PA / Ra',57,,
b'her / IP / TCP 192.168.180.164:5861 > 14.18.180.113:https F',58,,
b'her / IP / TCP 192.168.180.164:5861 > 14.18.180.113:https F',58,,
b'her / IP / TCP 192.168.180.164:5861 > 14.18.180.113:https F',58,,
b'her / IP / TCP 192.168.180.164:5861 > 14.18.180.113:https F',58,,
b'her / IP / TCP 192.168.180.164:5861 > 14.18.180.113:https F',58,,
b'her / IP / TCP 192.168.180.164:5861 > 14.18.180.113:https F',58,,
b'her / IP / TCP 192.168.180.164:5856 > 14.18.180.113:https F',59,,
b'her / IP / TCP 192.168.180.164:5856 > 14.18.180.113:https F',59,,
b'her / IP / TCP 192.168.180.164:5856 > 14.18.180.113:https F',59,,
b'her / IP / TCP 192.168.180.164:5856 > 14.18.180.113:https F',59,,
b'her / IP / TCP 192.168.180.164:5856 > 14.18.180.113:https F',59,,
b'her / IP / TCP 192.168.180.164:5856 > 14.18.180.113:https F',59,,
b'her / IP / TCP 192.168.180.164:5859 > 14.18.180.113:https F',60,,
b'her / IP / TCP 192.168.180.164:5859 > 14.18.180.113:https F',60,,
b'her / IP / TCP 192.168.180.164:5859 > 14.18.180.113:https F',60,,
b'her / IP / TCP 192.168.180.164:5859 > 14.18.180.113:https F',60,,
b'her / IP / TCP 192.168.180.164:5859 > 14.18.180.113:https F',60,,
b'her / IP / TCP 192.168.180.164:5859 > 14.18.180.113:https F',60,,
b'her / IP / TCP 192.168.180.164:6023 > 42.187.183.15:https F',61,,
b'her / IP / TCP 192.168.180.164:6023 > 42.187.183.15:https F',61,,
b'her / IP / TCP 192.168.180.164:6023 > 42.187.183.15:https F',61,,
b'her / IP / TCP 192.168.180.164:6023 > 42.187.183.15:https F',61,,
b'her / IP / TCP 192.168.180.164:6023 > 42.187.183.15:https F',61,,
b'her / IP / TCP 192.168.180.164:6023 > 42.187.183.15:https F',61,,
"b'her / IP / UDP / DNS Qry ""b\'h5.qzone.qq.com.\'""'",62,,
"b'her / IP / UDP / DNS Ans ""14.18.180.113""'",63,,
b'her / IP / TCP 192.168.180.164:9086 > 14.18.180.113:https ',64,,
b'her / IP / TCP 192.168.180.164:9086 > 14.18.180.113:https ',64,,
b'her / IP / TCP 192.168.180.164:9086 > 14.18.180.113:https PA / Ra',64,,
b'her / IP / TCP 192.168.180.164:9086 > 14.18.180.113:https ',64,,
b'her / IP / TCP 192.168.180.164:9086 > 14.18.180.113:https PA / Ra',64,,
b'her / IP / TCP 192.168.180.164:9086 > 14.18.180.113:https PA / Ra',64,,
b'her / IP / TCP 192.168.180.164:9086 > 14.18.180.113:https PA / Ra',65,,
b'her / IP / TCP 192.168.180.164:9086 > 14.18.180.113:https ',65,,
b'her / IP / TCP 192.168.180.164:9087 > 14.18.180.113:https ',66,,
b'her / IP / TCP 192.168.180.164:9087 > 14.18.180.113:https ',66,,
b'her / IP / TCP 192.168.180.164:9087 > 14.18.180.113:https PA / Ra',66,,
b'her / IP / TCP 192.168.180.164:9087 > 14.18.180.113:https ',66,,
b'her / IP / TCP 192.168.180.164:9087 > 14.18.180.113:https PA / Ra',66,,
b'her / IP / TCP 192.168.180.164:9087 > 14.18.180.113:https PA / Ra',66,,
b'her / IP / TCP 192.168.180.164:9087 > 14.18.180.113:https PA / Ra',67,,
b'her / IP / TCP 192.168.180.164:9087 > 14.18.180.113:https ',67,,
b'her / IP / TCP 192.168.180.164:9087 > 14.18.180.113:https ',67,,
b'her / IP / TCP 192.168.180.164:9088 > 14.18.180.113:https ',68,,
b'her / IP / TCP 192.168.180.164:9088 > 14.18.180.113:https ',68,,
b'her / IP / TCP 192.168.180.164:9088 > 14.18.180.113:https PA / Ra',68,,
b'her / IP / TCP 192.168.180.164:9088 > 14.18.180.113:https ',68,,
b'her / IP / TCP 192.168.180.164:9088 > 14.18.180.113:https PA / Ra',68,,
b'her / IP / TCP 192.168.180.164:9088 > 14.18.180.113:https PA / Ra',68,,
b'her / IP / TCP 192.168.180.164:9088 > 14.18.180.113:https PA / Ra',69,,
b'her / IP / TCP 192.168.180.164:9088 > 14.18.180.113:https ',69,,
b'her / IP / TCP 14.18.180.113:https > 192.168.180.164:9086 S',70,,
b'her / IP / TCP 14.18.180.113:https > 192.168.180.164:9086 ',70,,
b'her / IP / TCP 14.18.180.113:https > 192.168.180.164:9086 A / Ra',70,,
b'her / IP / TCP 14.18.180.113:https > 192.168.180.164:9086 PA / Ra',70,,
b'her / IP / TCP 14.18.180.113:https > 192.168.180.164:9086 PA / Ra',70,,
b'her / IP / TCP 14.18.180.113:https > 192.168.180.164:9086 ',70,,
b'her / IP / TCP 14.18.180.113:https > 192.168.180.164:9086 PA / Ra',71,,
b'her / IP / TCP 14.18.180.113:https > 192.168.180.164:9086 ',71,,
b'her / IP / TCP 14.18.180.113:https > 192.168.180.164:9086 ',71,,
b'her / IP / TCP 14.18.180.113:https > 192.168.180.164:9086 PA / Ra',71,,
b'her / IP / TCP 14.18.180.113:https > 192.168.180.164:9086 FPA / Ra',71,,
b'her / IP / TCP 14.18.180.113:https > 192.168.180.164:9087 S',72,,
b'her / IP / TCP 14.18.180.113:https > 192.168.180.164:9087 ',72,,
b'her / IP / TCP 14.18.180.113:https > 192.168.180.164:9087 A / Ra',72,,
b'her / IP / TCP 14.18.180.113:https > 192.168.180.164:9087 PA / Ra',72,,
b'her / IP / TCP 14.18.180.113:https > 192.168.180.164:9087 PA / Ra',72,,
b'her / IP / TCP 14.18.180.113:https > 192.168.180.164:9087 ',72,,
b'her / IP / TCP 14.18.180.113:https > 192.168.180.164:9087 PA / Ra',73,,
b'her / IP / TCP 14.18.180.113:https > 192.168.180.164:9087 ',73,,
b'her / IP / TCP 14.18.180.113:https > 192.168.180.164:9087 ',73,,
b'her / IP / TCP 14.18.180.113:https > 192.168.180.164:9087 PA / Ra',73,,
b'her / IP / TCP 14.18.180.113:https > 192.168.180.164:9087 PA / Ra',73,,
b'her / IP / TCP 14.18.180.113:https > 192.168.180.164:9087 F',73,,
b'her / IP / TCP 14.18.180.113:https > 192.168.180.164:9088 S',74,,
b'her / IP / TCP 14.18.180.113:https > 192.168.180.164:9088 ',74,,
b'her / IP / TCP 14.18.180.113:https > 192.168.180.164:9088 A / Ra',74,,
b'her / IP / TCP 14.18.180.113:https > 192.168.180.164:9088 PA / Ra',74,,
b'her / IP / TCP 14.18.180.113:https > 192.168.180.164:9088 PA / Ra',74,,
b'her / IP / TCP 14.18.180.113:https > 192.168.180.164:9088 ',74,,
b'her / IP / TCP 14.18.180.113:https > 192.168.180.164:9088 PA / Ra',75,,
b'her / IP / TCP 14.18.180.113:https > 192.168.180.164:9088 ',75,,
b'her / IP / TCP 14.18.180.113:https > 192.168.180.164:9088 ',75,,
b'her / IP / TCP 14.18.180.113:https > 192.168.180.164:9088 PA / Ra',75,,
b'her / IP / TCP 14.18.180.113:https > 192.168.180.164:9088 FPA / Ra',75,,
b'her / IP / TCP 192.168.180.164:6052 > 23.200.74.17:https A / Ra',76,,
b'her / IP / TCP 23.200.74.17:https > 192.168.180.164:6052 ',77,,
b'her / IP / TCP 192.168.180.164:9074 > 119.28.20.150:https A / Ra',78,,
b'her / IP / TCP 119.28.20.150:https > 192.168.180.164:9074 ',79,,
b'her / IP / TCP 192.168.180.164:12757 > 72.25.64.32:https A / Ra',80,,
b'her / IP / TCP 72.25.64.32:https > 192.168.180.164:12757 ',81,,
"b'her / IP / UDP / DNS Ans ""b\'z1884b8d608a-327e9464-2Qy37IcC._airplay._tcp.local.\'""'",82,,
"b'her / IP / UDP / DNS Ans ""b\'z1884b8d608a-327e9464-2Qy37IcC._airplay._tcp.local.\'""'",82,,
"b'her / IP / UDP / DNS Ans ""b\'z1884b8d608a-327e9464-2Qy37IcC._airplay._tcp.local.\'""'",82,,
"b'her / IPv6 / UDP / DNS Ans ""b\'z1884b8d608a-327e9464-2Qy37IcC._airplay._tcp.local.\'""'",83,,
"b'her / IPv6 / UDP / DNS Ans ""b\'z1884b8d608a-327e9464-2Qy37IcC._airplay._tcp.local.\'""'",83,,
"b'her / IPv6 / UDP / DNS Ans ""b\'z1884b8d608a-327e9464-2Qy37IcC._airplay._tcp.local.\'""'",83,,
b'her / IP / UDP 192.168.180.164:4010 > 45.40.228.59:8000 / Ra',84,,
b'her / IP / TCP 192.168.180.164:9092 > 175.27.37.31:http ',85,,
b'her / IP / TCP 192.168.180.164:9092 > 175.27.37.31:http ',85,,
b'her / IP / TCP 192.168.180.164:9092 > 175.27.37.31:http PA / Ra',85,,
b'her / IP / TCP 175.27.37.31:http > 192.168.180.164:9092 S',86,,
b'her / IP / TCP 175.27.37.31:http > 192.168.180.164:9092 ',86,,
b'her / IP / TCP 175.27.37.31:http > 192.168.180.164:9092 PA / Ra',86,,
b'her / IP / TCP 175.27.37.31:http > 192.168.180.164:9092 F',86,,
