srcip,dstip,sport,dport,proto,data
192.168.0.106,116.132.235.204,7489,80,6,"Ether / IP / TCP 192.168.0.106:7489 > 116.132.235.204:http S"
116.132.235.204,192.168.0.106,80,7489,6,"Ether / IP / TCP 116.132.235.204:http > 192.168.0.106:7489 SA"
192.168.0.106,116.132.235.204,7489,80,6,"Ether / IP / TCP 192.168.0.106:7489 > 116.132.235.204:http A"
192.168.0.106,116.132.235.204,7489,80,6,"Ether / IP / TCP 192.168.0.106:7489 > 116.132.235.204:http PA / Raw"
192.168.0.106,116.132.235.204,7489,80,6,"Ether / IP / TCP 192.168.0.106:7489 > 116.132.235.204:http A / Raw"
192.168.0.106,116.132.235.204,7489,80,6,"Ether / IP / TCP 192.168.0.106:7489 > 116.132.235.204:http A / Raw"
192.168.0.106,116.132.235.204,7489,80,6,"Ether / IP / TCP 192.168.0.106:7489 > 116.132.235.204:http PA / Raw"
116.132.235.204,192.168.0.106,80,7489,6,"Ether / IP / TCP 116.132.235.204:http > 192.168.0.106:7489 A"
116.132.235.204,192.168.0.106,80,7489,6,"Ether / IP / TCP 116.132.235.204:http > 192.168.0.106:7489 A"
116.132.235.204,192.168.0.106,80,7489,6,"Ether / IP / TCP 116.132.235.204:http > 192.168.0.106:7489 PA / Raw"
116.132.235.204,192.168.0.106,80,7489,6,"Ether / IP / TCP 116.132.235.204:http > 192.168.0.106:7489 FA"
192.168.0.106,116.132.235.204,7489,80,6,"Ether / IP / TCP 192.168.0.106:7489 > 116.132.235.204:http A"
192.168.0.106,116.132.235.204,7489,80,6,"Ether / IP / TCP 192.168.0.106:7489 > 116.132.235.204:http FA"
192.168.0.106,116.132.235.204,7489,80,6,"Ether / IP / TCP 192.168.0.106:7489 > 116.132.235.204:http FA"
119.3.178.178,192.168.0.106,21111,8122,6,"Ether / IP / TCP 119.3.178.178:21111 > 192.168.0.106:8122 A / Padding"
192.168.0.106,119.3.178.178,8122,21111,6,"Ether / IP / TCP 192.168.0.106:8122 > 119.3.178.178:21111 A"
192.168.0.106,116.132.235.204,7489,80,6,"Ether / IP / TCP 192.168.0.106:7489 > 116.132.235.204:http FA"
192.168.0.106,116.132.235.204,7490,80,6,"Ether / IP / TCP 192.168.0.106:7490 > 116.132.235.204:http S"
116.132.235.204,192.168.0.106,80,7490,6,"Ether / IP / TCP 116.132.235.204:http > 192.168.0.106:7490 SA"
192.168.0.106,116.132.235.204,7490,80,6,"Ether / IP / TCP 192.168.0.106:7490 > 116.132.235.204:http A"
192.168.0.106,116.132.235.204,7490,80,6,"Ether / IP / TCP 192.168.0.106:7490 > 116.132.235.204:http PA / Raw"
192.168.0.106,116.132.235.204,7490,80,6,"Ether / IP / TCP 192.168.0.106:7490 > 116.132.235.204:http A / Raw"
192.168.0.106,116.132.235.204,7490,80,6,"Ether / IP / TCP 192.168.0.106:7490 > 116.132.235.204:http A / Raw"
192.168.0.106,116.132.235.204,7490,80,6,"Ether / IP / TCP 192.168.0.106:7490 > 116.132.235.204:http PA / Raw"
116.132.235.204,192.168.0.106,80,7490,6,"Ether / IP / TCP 116.132.235.204:http > 192.168.0.106:7490 A"
116.132.235.204,192.168.0.106,80,7490,6,"Ether / IP / TCP 116.132.235.204:http > 192.168.0.106:7490 A"
116.132.235.204,192.168.0.106,80,7490,6,"Ether / IP / TCP 116.132.235.204:http > 192.168.0.106:7490 A"
116.132.235.204,192.168.0.106,80,7490,6,"Ether / IP / TCP 116.132.235.204:http > 192.168.0.106:7490 PA / Raw"
116.132.235.204,192.168.0.106,80,7490,6,"Ether / IP / TCP 116.132.235.204:http > 192.168.0.106:7490 FA"
192.168.0.106,116.132.235.204,7490,80,6,"Ether / IP / TCP 192.168.0.106:7490 > 116.132.235.204:http A"
192.168.0.106,116.132.235.204,7490,80,6,"Ether / IP / TCP 192.168.0.106:7490 > 116.132.235.204:http FA"
116.132.235.204,192.168.0.106,80,7490,6,"Ether / IP / TCP 116.132.235.204:http > 192.168.0.106:7490 A"
192.168.0.106,116.132.235.204,7491,80,6,"Ether / IP / TCP 192.168.0.106:7491 > 116.132.235.204:http S"
116.132.235.204,192.168.0.106,80,7491,6,"Ether / IP / TCP 116.132.235.204:http > 192.168.0.106:7491 SA"
192.168.0.106,116.132.235.204,7491,80,6,"Ether / IP / TCP 192.168.0.106:7491 > 116.132.235.204:http A"
192.168.0.106,116.132.235.204,7491,80,6,"Ether / IP / TCP 192.168.0.106:7491 > 116.132.235.204:http PA / Raw"
192.168.0.106,116.132.235.204,7491,80,6,"Ether / IP / TCP 192.168.0.106:7491 > 116.132.235.204:http A / Raw"
192.168.0.106,116.132.235.204,7491,80,6,"Ether / IP / TCP 192.168.0.106:7491 > 116.132.235.204:http A / Raw"
192.168.0.106,116.132.235.204,7491,80,6,"Ether / IP / TCP 192.168.0.106:7491 > 116.132.235.204:http PA / Raw"
116.132.235.204,192.168.0.106,80,7491,6,"Ether / IP / TCP 116.132.235.204:http > 192.168.0.106:7491 A"
116.132.235.204,192.168.0.106,80,7491,6,"Ether / IP / TCP 116.132.235.204:http > 192.168.0.106:7491 A"
116.132.235.204,192.168.0.106,80,7491,6,"Ether / IP / TCP 116.132.235.204:http > 192.168.0.106:7491 A"
116.132.235.204,192.168.0.106,80,7491,6,"Ether / IP / TCP 116.132.235.204:http > 192.168.0.106:7491 PA / Raw"
116.132.235.204,192.168.0.106,80,7491,6,"Ether / IP / TCP 116.132.235.204:http > 192.168.0.106:7491 FA"
192.168.0.106,116.132.235.204,7491,80,6,"Ether / IP / TCP 192.168.0.106:7491 > 116.132.235.204:http A"
192.168.0.106,116.132.235.204,7491,80,6,"Ether / IP / TCP 192.168.0.106:7491 > 116.132.235.204:http FA"
116.132.235.204,192.168.0.106,80,7491,6,"Ether / IP / TCP 116.132.235.204:http > 192.168.0.106:7491 A"
192.168.0.106,116.132.235.204,7489,80,6,"Ether / IP / TCP 192.168.0.106:7489 > 116.132.235.204:http FA"
192.168.0.106,116.132.235.204,7493,80,6,"Ether / IP / TCP 192.168.0.106:7493 > 116.132.235.204:http S"
116.132.235.204,192.168.0.106,80,7493,6,"Ether / IP / TCP 116.132.235.204:http > 192.168.0.106:7493 SA"
192.168.0.106,116.132.235.204,7493,80,6,"Ether / IP / TCP 192.168.0.106:7493 > 116.132.235.204:http A"
192.168.0.106,116.132.235.204,7493,80,6,"Ether / IP / TCP 192.168.0.106:7493 > 116.132.235.204:http PA / Raw"
192.168.0.106,116.132.235.204,7493,80,6,"Ether / IP / TCP 192.168.0.106:7493 > 116.132.235.204:http A / Raw"
192.168.0.106,116.132.235.204,7493,80,6,"Ether / IP / TCP 192.168.0.106:7493 > 116.132.235.204:http A / Raw"
192.168.0.106,116.132.235.204,7493,80,6,"Ether / IP / TCP 192.168.0.106:7493 > 116.132.235.204:http PA / Raw"
116.132.235.204,192.168.0.106,80,7493,6,"Ether / IP / TCP 116.132.235.204:http > 192.168.0.106:7493 A"
116.132.235.204,192.168.0.106,80,7493,6,"Ether / IP / TCP 116.132.235.204:http > 192.168.0.106:7493 A"
116.132.235.204,192.168.0.106,80,7493,6,"Ether / IP / TCP 116.132.235.204:http > 192.168.0.106:7493 A"
116.132.235.204,192.168.0.106,80,7493,6,"Ether / IP / TCP 116.132.235.204:http > 192.168.0.106:7493 PA / Raw"
116.132.235.204,192.168.0.106,80,7493,6,"Ether / IP / TCP 116.132.235.204:http > 192.168.0.106:7493 FA"
192.168.0.106,116.132.235.204,7493,80,6,"Ether / IP / TCP 192.168.0.106:7493 > 116.132.235.204:http A"
192.168.0.106,116.132.235.204,7493,80,6,"Ether / IP / TCP 192.168.0.106:7493 > 116.132.235.204:http FA"
116.132.235.204,192.168.0.106,80,7493,6,"Ether / IP / TCP 116.132.235.204:http > 192.168.0.106:7493 A"
192.168.0.106,192.168.0.1,60618,53,17,"Ether / IP / UDP / DNS Qry ""b'dns.msftncsi.com.'"" "
192.168.0.1,192.168.0.106,53,60618,17,"Ether / IP / UDP / DNS Ans ""fd3e:4f5a:5b81::1"" "
192.168.0.106,192.168.0.1,50337,53,17,"Ether / IP / UDP / DNS Qry ""b'dns.msftncsi.com.'"" "
192.168.0.1,192.168.0.106,53,50337,17,"Ether / IP / UDP / DNS Ans ""fd3e:4f5a:5b81::1"" "
192.168.0.106,192.168.0.1,56506,53,17,"Ether / IP / UDP / DNS Qry ""b'ipv6.msftconnecttest.com.'"" "
192.168.0.106,192.168.0.1,50464,53,17,"Ether / IP / UDP / DNS Qry ""b'www.msftconnecttest.com.'"" "
192.168.0.106,192.168.0.1,60618,53,17,"Ether / IP / UDP / DNS Qry ""b'ipv6.msftconnecttest.com.'"" "
192.168.0.1,192.168.0.106,53,56506,17,"Ether / IP / UDP / DNS Ans ""b'v6ncsi.msedge.net.'"" "
192.168.0.1,192.168.0.106,53,60618,17,"Ether / IP / UDP / DNS Ans ""b'v6ncsi.msedge.net.'"" "
192.168.0.106,192.168.0.1,50337,53,17,"Ether / IP / UDP / DNS Qry ""b'ipv6.msftconnecttest.com.'"" "
192.168.0.1,192.168.0.106,53,50464,17,"Ether / IP / UDP / DNS Ans ""b'ncsi-geo.trafficmanager.net.'"" "
192.168.0.106,104.109.128.195,7494,80,6,"Ether / IP / TCP 192.168.0.106:7494 > 104.109.128.195:http S"
192.168.0.106,104.109.128.195,7495,80,6,"Ether / IP / TCP 192.168.0.106:7495 > 104.109.128.195:http S"
192.168.0.1,192.168.0.106,53,50337,17,"Ether / IP / UDP / DNS Ans ""b'v6ncsi.msedge.net.'"" "
104.109.128.195,192.168.0.106,80,7495,6,"Ether / IP / TCP 104.109.128.195:http > 192.168.0.106:7495 SA"
104.109.128.195,192.168.0.106,80,7494,6,"Ether / IP / TCP 104.109.128.195:http > 192.168.0.106:7494 SA"
192.168.0.106,104.109.128.195,7495,80,6,"Ether / IP / TCP 192.168.0.106:7495 > 104.109.128.195:http A"
192.168.0.106,104.109.128.195,7494,80,6,"Ether / IP / TCP 192.168.0.106:7494 > 104.109.128.195:http A"
192.168.0.106,104.109.128.195,7494,80,6,"Ether / IP / TCP 192.168.0.106:7494 > 104.109.128.195:http PA / Raw"
192.168.0.106,104.109.128.195,7495,80,6,"Ether / IP / TCP 192.168.0.106:7495 > 104.109.128.195:http PA / Raw"
192.168.192.1,192.168.192.2,137,137,17,"Ether / IP / UDP 192.168.192.1:netbios_ns > 192.168.192.2:netbios_ns / NBNSHeader / Raw"
104.109.128.195,192.168.0.106,80,7495,6,"Ether / IP / TCP 104.109.128.195:http > 192.168.0.106:7495 A"
104.109.128.195,192.168.0.106,80,7495,6,"Ether / IP / TCP 104.109.128.195:http > 192.168.0.106:7495 PA / Raw"
104.109.128.195,192.168.0.106,80,7495,6,"Ether / IP / TCP 104.109.128.195:http > 192.168.0.106:7495 FA"
192.168.0.106,104.109.128.195,7495,80,6,"Ether / IP / TCP 192.168.0.106:7495 > 104.109.128.195:http A"
192.168.0.106,104.109.128.195,7495,80,6,"Ether / IP / TCP 192.168.0.106:7495 > 104.109.128.195:http FA"
104.109.128.195,192.168.0.106,80,7494,6,"Ether / IP / TCP 104.109.128.195:http > 192.168.0.106:7494 A"
104.109.128.195,192.168.0.106,80,7494,6,"Ether / IP / TCP 104.109.128.195:http > 192.168.0.106:7494 PA / Raw"
192.168.0.106,104.109.128.195,7494,80,6,"Ether / IP / TCP 192.168.0.106:7494 > 104.109.128.195:http FA"
104.109.128.195,192.168.0.106,80,7494,6,"Ether / IP / TCP 104.109.128.195:http > 192.168.0.106:7494 FA"
192.168.0.106,104.109.128.195,7494,80,6,"Ether / IP / TCP 192.168.0.106:7494 > 104.109.128.195:http A"
192.168.0.106,116.132.235.204,7496,80,6,"Ether / IP / TCP 192.168.0.106:7496 > 116.132.235.204:http S"
116.132.235.204,192.168.0.106,80,7496,6,"Ether / IP / TCP 116.132.235.204:http > 192.168.0.106:7496 SA"
192.168.0.106,116.132.235.204,7496,80,6,"Ether / IP / TCP 192.168.0.106:7496 > 116.132.235.204:http A"
192.168.0.106,116.132.235.204,7496,80,6,"Ether / IP / TCP 192.168.0.106:7496 > 116.132.235.204:http PA / Raw"
192.168.0.106,116.132.235.204,7496,80,6,"Ether / IP / TCP 192.168.0.106:7496 > 116.132.235.204:http A / Raw"
192.168.0.106,116.132.235.204,7496,80,6,"Ether / IP / TCP 192.168.0.106:7496 > 116.132.235.204:http A / Raw"
192.168.0.106,116.132.235.204,7496,80,6,"Ether / IP / TCP 192.168.0.106:7496 > 116.132.235.204:http PA / Raw"
116.132.235.204,192.168.0.106,80,7496,6,"Ether / IP / TCP 116.132.235.204:http > 192.168.0.106:7496 A"
116.132.235.204,192.168.0.106,80,7496,6,"Ether / IP / TCP 116.132.235.204:http > 192.168.0.106:7496 A"
116.132.235.204,192.168.0.106,80,7496,6,"Ether / IP / TCP 116.132.235.204:http > 192.168.0.106:7496 PA / Raw"
116.132.235.204,192.168.0.106,80,7496,6,"Ether / IP / TCP 116.132.235.204:http > 192.168.0.106:7496 FA"
192.168.0.106,116.132.235.204,7496,80,6,"Ether / IP / TCP 192.168.0.106:7496 > 116.132.235.204:http A"
192.168.0.106,116.132.235.204,7496,80,6,"Ether / IP / TCP 192.168.0.106:7496 > 116.132.235.204:http FA"
116.132.235.204,192.168.0.106,80,7496,6,"Ether / IP / TCP 116.132.235.204:http > 192.168.0.106:7496 A"
192.168.0.106,116.132.235.204,7497,80,6,"Ether / IP / TCP 192.168.0.106:7497 > 116.132.235.204:http S"
116.132.235.204,192.168.0.106,80,7497,6,"Ether / IP / TCP 116.132.235.204:http > 192.168.0.106:7497 SA"
192.168.0.106,116.132.235.204,7497,80,6,"Ether / IP / TCP 192.168.0.106:7497 > 116.132.235.204:http A"
192.168.0.106,116.132.235.204,7497,80,6,"Ether / IP / TCP 192.168.0.106:7497 > 116.132.235.204:http PA / Raw"
192.168.0.106,116.132.235.204,7497,80,6,"Ether / IP / TCP 192.168.0.106:7497 > 116.132.235.204:http A / Raw"
192.168.0.106,116.132.235.204,7497,80,6,"Ether / IP / TCP 192.168.0.106:7497 > 116.132.235.204:http A / Raw"
192.168.0.106,116.132.235.204,7497,80,6,"Ether / IP / TCP 192.168.0.106:7497 > 116.132.235.204:http PA / Raw"
116.132.235.204,192.168.0.106,80,7497,6,"Ether / IP / TCP 116.132.235.204:http > 192.168.0.106:7497 A"
116.132.235.204,192.168.0.106,80,7497,6,"Ether / IP / TCP 116.132.235.204:http > 192.168.0.106:7497 A"
116.132.235.204,192.168.0.106,80,7497,6,"Ether / IP / TCP 116.132.235.204:http > 192.168.0.106:7497 A"
116.132.235.204,192.168.0.106,80,7497,6,"Ether / IP / TCP 116.132.235.204:http > 192.168.0.106:7497 PA / Raw"
116.132.235.204,192.168.0.106,80,7497,6,"Ether / IP / TCP 116.132.235.204:http > 192.168.0.106:7497 FA"
192.168.0.106,116.132.235.204,7497,80,6,"Ether / IP / TCP 192.168.0.106:7497 > 116.132.235.204:http A"
192.168.0.106,116.132.235.204,7497,80,6,"Ether / IP / TCP 192.168.0.106:7497 > 116.132.235.204:http FA"
116.132.235.204,192.168.0.106,80,7497,6,"Ether / IP / TCP 116.132.235.204:http > 192.168.0.106:7497 A"
192.168.0.106,20.198.162.78,1025,443,6,"Ether / IP / TCP 192.168.0.106:1025 > 20.198.162.78:https PA / Raw"
192.168.0.106,104.109.128.195,7495,80,6,"Ether / IP / TCP 192.168.0.106:7495 > 104.109.128.195:http FA"
192.168.0.106,104.109.128.195,7494,80,6,"Ether / IP / TCP 192.168.0.106:7494 > 104.109.128.195:http FA"
20.198.162.78,192.168.0.106,443,1025,6,"Ether / IP / TCP 20.198.162.78:https > 192.168.0.106:1025 PA / Raw"
192.168.0.106,20.198.162.78,1025,443,6,"Ether / IP / TCP 192.168.0.106:1025 > 20.198.162.78:https A"
104.109.128.195,192.168.0.106,80,7494,6,"Ether / IP / TCP 104.109.128.195:http > 192.168.0.106:7494 R"
104.109.128.195,192.168.0.106,80,7495,6,"Ether / IP / TCP 104.109.128.195:http > 192.168.0.106:7495 R"
192.168.0.106,116.132.235.204,7489,80,6,"Ether / IP / TCP 192.168.0.106:7489 > 116.132.235.204:http FA"
192.168.0.106,116.132.235.204,7499,80,6,"Ether / IP / TCP 192.168.0.106:7499 > 116.132.235.204:http S"
116.132.235.204,192.168.0.106,80,7499,6,"Ether / IP / TCP 116.132.235.204:http > 192.168.0.106:7499 SA"
192.168.0.106,116.132.235.204,7499,80,6,"Ether / IP / TCP 192.168.0.106:7499 > 116.132.235.204:http A"
192.168.0.106,116.132.235.204,7499,80,6,"Ether / IP / TCP 192.168.0.106:7499 > 116.132.235.204:http PA / Raw"
192.168.0.106,116.132.235.204,7499,80,6,"Ether / IP / TCP 192.168.0.106:7499 > 116.132.235.204:http A / Raw"
192.168.0.106,116.132.235.204,7499,80,6,"Ether / IP / TCP 192.168.0.106:7499 > 116.132.235.204:http A / Raw"
192.168.0.106,116.132.235.204,7499,80,6,"Ether / IP / TCP 192.168.0.106:7499 > 116.132.235.204:http PA / Raw"
116.132.235.204,192.168.0.106,80,7499,6,"Ether / IP / TCP 116.132.235.204:http > 192.168.0.106:7499 A"
116.132.235.204,192.168.0.106,80,7499,6,"Ether / IP / TCP 116.132.235.204:http > 192.168.0.106:7499 A"
116.132.235.204,192.168.0.106,80,7499,6,"Ether / IP / TCP 116.132.235.204:http > 192.168.0.106:7499 A"
116.132.235.204,192.168.0.106,80,7499,6,"Ether / IP / TCP 116.132.235.204:http > 192.168.0.106:7499 PA / Raw"
116.132.235.204,192.168.0.106,80,7499,6,"Ether / IP / TCP 116.132.235.204:http > 192.168.0.106:7499 FA"
192.168.0.106,116.132.235.204,7499,80,6,"Ether / IP / TCP 192.168.0.106:7499 > 116.132.235.204:http A"
192.168.0.106,116.132.235.204,7499,80,6,"Ether / IP / TCP 192.168.0.106:7499 > 116.132.235.204:http FA"
116.132.235.204,192.168.0.106,80,7499,6,"Ether / IP / TCP 116.132.235.204:http > 192.168.0.106:7499 A"
192.168.192.1,192.168.192.2,137,137,17,"Ether / IP / UDP 192.168.192.1:netbios_ns > 192.168.192.2:netbios_ns / NBNSHeader / Raw"
192.168.0.106,110.242.68.3,7500,80,6,"Ether / IP / TCP 192.168.0.106:7500 > 110.242.68.3:http S"
110.242.68.3,192.168.0.106,80,7500,6,"Ether / IP / TCP 110.242.68.3:http > 192.168.0.106:7500 SA"
192.168.0.106,110.242.68.3,7500,80,6,"Ether / IP / TCP 192.168.0.106:7500 > 110.242.68.3:http A"
192.168.0.106,110.242.68.3,7500,80,6,"Ether / IP / TCP 192.168.0.106:7500 > 110.242.68.3:http FA"
110.242.68.3,192.168.0.106,80,7500,6,"Ether / IP / TCP 110.242.68.3:http > 192.168.0.106:7500 A"
110.242.68.3,192.168.0.106,80,7500,6,"Ether / IP / TCP 110.242.68.3:http > 192.168.0.106:7500 FA"
192.168.0.106,110.242.68.3,7500,80,6,"Ether / IP / TCP 192.168.0.106:7500 > 110.242.68.3:http A"
192.168.0.106,116.132.235.204,7501,80,6,"Ether / IP / TCP 192.168.0.106:7501 > 116.132.235.204:http S"
116.132.235.204,192.168.0.106,80,7501,6,"Ether / IP / TCP 116.132.235.204:http > 192.168.0.106:7501 SA"
192.168.0.106,116.132.235.204,7501,80,6,"Ether / IP / TCP 192.168.0.106:7501 > 116.132.235.204:http A"
192.168.0.106,116.132.235.204,7501,80,6,"Ether / IP / TCP 192.168.0.106:7501 > 116.132.235.204:http PA / Raw"
192.168.0.106,116.132.235.204,7501,80,6,"Ether / IP / TCP 192.168.0.106:7501 > 116.132.235.204:http A / Raw"
192.168.0.106,116.132.235.204,7501,80,6,"Ether / IP / TCP 192.168.0.106:7501 > 116.132.235.204:http A / Raw"
192.168.0.106,116.132.235.204,7501,80,6,"Ether / IP / TCP 192.168.0.106:7501 > 116.132.235.204:http PA / Raw"
116.132.235.204,192.168.0.106,80,7501,6,"Ether / IP / TCP 116.132.235.204:http > 192.168.0.106:7501 A"
116.132.235.204,192.168.0.106,80,7501,6,"Ether / IP / TCP 116.132.235.204:http > 192.168.0.106:7501 A"
116.132.235.204,192.168.0.106,80,7501,6,"Ether / IP / TCP 116.132.235.204:http > 192.168.0.106:7501 A"
116.132.235.204,192.168.0.106,80,7501,6,"Ether / IP / TCP 116.132.235.204:http > 192.168.0.106:7501 PA / Raw"
116.132.235.204,192.168.0.106,80,7501,6,"Ether / IP / TCP 116.132.235.204:http > 192.168.0.106:7501 FA"
192.168.0.106,116.132.235.204,7501,80,6,"Ether / IP / TCP 192.168.0.106:7501 > 116.132.235.204:http A"
192.168.0.106,116.132.235.204,7501,80,6,"Ether / IP / TCP 192.168.0.106:7501 > 116.132.235.204:http FA"
116.132.235.204,192.168.0.106,80,7501,6,"Ether / IP / TCP 116.132.235.204:http > 192.168.0.106:7501 A"
192.168.192.1,192.168.192.2,137,137,17,"Ether / IP / UDP 192.168.192.1:netbios_ns > 192.168.192.2:netbios_ns / NBNSHeader / Raw"
192.168.0.106,116.132.235.204,7503,80,6,"Ether / IP / TCP 192.168.0.106:7503 > 116.132.235.204:http S"
116.132.235.204,192.168.0.106,80,7503,6,"Ether / IP / TCP 116.132.235.204:http > 192.168.0.106:7503 SA"
192.168.0.106,116.132.235.204,7503,80,6,"Ether / IP / TCP 192.168.0.106:7503 > 116.132.235.204:http A"
192.168.0.106,116.132.235.204,7503,80,6,"Ether / IP / TCP 192.168.0.106:7503 > 116.132.235.204:http PA / Raw"
192.168.0.106,116.132.235.204,7503,80,6,"Ether / IP / TCP 192.168.0.106:7503 > 116.132.235.204:http A / Raw"
192.168.0.106,116.132.235.204,7503,80,6,"Ether / IP / TCP 192.168.0.106:7503 > 116.132.235.204:http A / Raw"
192.168.0.106,116.132.235.204,7503,80,6,"Ether / IP / TCP 192.168.0.106:7503 > 116.132.235.204:http PA / Raw"
116.132.235.204,192.168.0.106,80,7503,6,"Ether / IP / TCP 116.132.235.204:http > 192.168.0.106:7503 A"
116.132.235.204,192.168.0.106,80,7503,6,"Ether / IP / TCP 116.132.235.204:http > 192.168.0.106:7503 A"
116.132.235.204,192.168.0.106,80,7503,6,"Ether / IP / TCP 116.132.235.204:http > 192.168.0.106:7503 A"
116.132.235.204,192.168.0.106,80,7503,6,"Ether / IP / TCP 116.132.235.204:http > 192.168.0.106:7503 PA / Raw"
116.132.235.204,192.168.0.106,80,7503,6,"Ether / IP / TCP 116.132.235.204:http > 192.168.0.106:7503 FA"
192.168.0.106,116.132.235.204,7503,80,6,"Ether / IP / TCP 192.168.0.106:7503 > 116.132.235.204:http A"
192.168.0.106,116.132.235.204,7503,80,6,"Ether / IP / TCP 192.168.0.106:7503 > 116.132.235.204:http FA"
116.132.235.204,192.168.0.106,80,7503,6,"Ether / IP / TCP 116.132.235.204:http > 192.168.0.106:7503 A"
192.168.0.106,116.132.235.204,7504,80,6,"Ether / IP / TCP 192.168.0.106:7504 > 116.132.235.204:http S"
116.132.235.204,192.168.0.106,80,7504,6,"Ether / IP / TCP 116.132.235.204:http > 192.168.0.106:7504 SA"
192.168.0.106,116.132.235.204,7504,80,6,"Ether / IP / TCP 192.168.0.106:7504 > 116.132.235.204:http A"
192.168.0.106,116.132.235.204,7504,80,6,"Ether / IP / TCP 192.168.0.106:7504 > 116.132.235.204:http PA / Raw"
192.168.0.106,116.132.235.204,7504,80,6,"Ether / IP / TCP 192.168.0.106:7504 > 116.132.235.204:http A / Raw"
192.168.0.106,116.132.235.204,7504,80,6,"Ether / IP / TCP 192.168.0.106:7504 > 116.132.235.204:http A / Raw"
192.168.0.106,116.132.235.204,7504,80,6,"Ether / IP / TCP 192.168.0.106:7504 > 116.132.235.204:http PA / Raw"
116.132.235.204,192.168.0.106,80,7504,6,"Ether / IP / TCP 116.132.235.204:http > 192.168.0.106:7504 A"
116.132.235.204,192.168.0.106,80,7504,6,"Ether / IP / TCP 116.132.235.204:http > 192.168.0.106:7504 A"
116.132.235.204,192.168.0.106,80,7504,6,"Ether / IP / TCP 116.132.235.204:http > 192.168.0.106:7504 A"
116.132.235.204,192.168.0.106,80,7504,6,"Ether / IP / TCP 116.132.235.204:http > 192.168.0.106:7504 PA / Raw"
116.132.235.204,192.168.0.106,80,7504,6,"Ether / IP / TCP 116.132.235.204:http > 192.168.0.106:7504 FA"
192.168.0.106,116.132.235.204,7504,80,6,"Ether / IP / TCP 192.168.0.106:7504 > 116.132.235.204:http A"
192.168.0.106,116.132.235.204,7504,80,6,"Ether / IP / TCP 192.168.0.106:7504 > 116.132.235.204:http FA"
116.132.235.204,192.168.0.106,80,7504,6,"Ether / IP / TCP 116.132.235.204:http > 192.168.0.106:7504 A"
192.168.0.106,116.132.235.204,7505,80,6,"Ether / IP / TCP 192.168.0.106:7505 > 116.132.235.204:http S"
116.132.235.204,192.168.0.106,80,7505,6,"Ether / IP / TCP 116.132.235.204:http > 192.168.0.106:7505 SA"
192.168.0.106,116.132.235.204,7505,80,6,"Ether / IP / TCP 192.168.0.106:7505 > 116.132.235.204:http A"
192.168.0.106,116.132.235.204,7505,80,6,"Ether / IP / TCP 192.168.0.106:7505 > 116.132.235.204:http PA / Raw"
192.168.0.106,116.132.235.204,7505,80,6,"Ether / IP / TCP 192.168.0.106:7505 > 116.132.235.204:http A / Raw"
192.168.0.106,116.132.235.204,7505,80,6,"Ether / IP / TCP 192.168.0.106:7505 > 116.132.235.204:http A / Raw"
192.168.0.106,116.132.235.204,7505,80,6,"Ether / IP / TCP 192.168.0.106:7505 > 116.132.235.204:http PA / Raw"
116.132.235.204,192.168.0.106,80,7505,6,"Ether / IP / TCP 116.132.235.204:http > 192.168.0.106:7505 A"
116.132.235.204,192.168.0.106,80,7505,6,"Ether / IP / TCP 116.132.235.204:http > 192.168.0.106:7505 A"
116.132.235.204,192.168.0.106,80,7505,6,"Ether / IP / TCP 116.132.235.204:http > 192.168.0.106:7505 A"
116.132.235.204,192.168.0.106,80,7505,6,"Ether / IP / TCP 116.132.235.204:http > 192.168.0.106:7505 PA / Raw"
116.132.235.204,192.168.0.106,80,7505,6,"Ether / IP / TCP 116.132.235.204:http > 192.168.0.106:7505 FA"
192.168.0.106,116.132.235.204,7505,80,6,"Ether / IP / TCP 192.168.0.106:7505 > 116.132.235.204:http A"
192.168.0.106,116.132.235.204,7505,80,6,"Ether / IP / TCP 192.168.0.106:7505 > 116.132.235.204:http FA"
192.168.0.106,116.132.235.204,7505,80,6,"Ether / IP / TCP 192.168.0.106:7505 > 116.132.235.204:http FA"
192.168.0.106,116.132.235.204,7505,80,6,"Ether / IP / TCP 192.168.0.106:7505 > 116.132.235.204:http FA"
192.168.0.106,116.132.235.204,7507,80,6,"Ether / IP / TCP 192.168.0.106:7507 > 116.132.235.204:http S"
116.132.235.204,192.168.0.106,80,7507,6,"Ether / IP / TCP 116.132.235.204:http > 192.168.0.106:7507 SA"
192.168.0.106,116.132.235.204,7507,80,6,"Ether / IP / TCP 192.168.0.106:7507 > 116.132.235.204:http A"
192.168.0.106,116.132.235.204,7507,80,6,"Ether / IP / TCP 192.168.0.106:7507 > 116.132.235.204:http PA / Raw"
192.168.0.106,116.132.235.204,7507,80,6,"Ether / IP / TCP 192.168.0.106:7507 > 116.132.235.204:http A / Raw"
192.168.0.106,116.132.235.204,7507,80,6,"Ether / IP / TCP 192.168.0.106:7507 > 116.132.235.204:http A / Raw"
192.168.0.106,116.132.235.204,7507,80,6,"Ether / IP / TCP 192.168.0.106:7507 > 116.132.235.204:http PA / Raw"
116.132.235.204,192.168.0.106,80,7507,6,"Ether / IP / TCP 116.132.235.204:http > 192.168.0.106:7507 A"
116.132.235.204,192.168.0.106,80,7507,6,"Ether / IP / TCP 116.132.235.204:http > 192.168.0.106:7507 A"
116.132.235.204,192.168.0.106,80,7507,6,"Ether / IP / TCP 116.132.235.204:http > 192.168.0.106:7507 PA / Raw"
116.132.235.204,192.168.0.106,80,7507,6,"Ether / IP / TCP 116.132.235.204:http > 192.168.0.106:7507 FA"
192.168.0.106,116.132.235.204,7507,80,6,"Ether / IP / TCP 192.168.0.106:7507 > 116.132.235.204:http A"
192.168.0.106,116.132.235.204,7507,80,6,"Ether / IP / TCP 192.168.0.106:7507 > 116.132.235.204:http FA"
192.168.0.106,116.132.235.204,7508,80,6,"Ether / IP / TCP 192.168.0.106:7508 > 116.132.235.204:http S"
116.132.235.204,192.168.0.106,80,7508,6,"Ether / IP / TCP 116.132.235.204:http > 192.168.0.106:7508 SA"
192.168.0.106,116.132.235.204,7508,80,6,"Ether / IP / TCP 192.168.0.106:7508 > 116.132.235.204:http A"
192.168.0.106,116.132.235.204,7508,80,6,"Ether / IP / TCP 192.168.0.106:7508 > 116.132.235.204:http PA / Raw"
192.168.0.106,116.132.235.204,7508,80,6,"Ether / IP / TCP 192.168.0.106:7508 > 116.132.235.204:http A / Raw"
192.168.0.106,116.132.235.204,7508,80,6,"Ether / IP / TCP 192.168.0.106:7508 > 116.132.235.204:http A / Raw"
192.168.0.106,116.132.235.204,7508,80,6,"Ether / IP / TCP 192.168.0.106:7508 > 116.132.235.204:http PA / Raw"
192.168.0.106,116.132.235.204,7489,80,6,"Ether / IP / TCP 192.168.0.106:7489 > 116.132.235.204:http FA"
192.168.0.106,119.28.20.150,7355,443,6,"Ether / IP / TCP 192.168.0.106:7355 > 119.28.20.150:https A / Raw"
116.132.235.204,192.168.0.106,80,7508,6,"Ether / IP / TCP 116.132.235.204:http > 192.168.0.106:7508 A"
116.132.235.204,192.168.0.106,80,7508,6,"Ether / IP / TCP 116.132.235.204:http > 192.168.0.106:7508 A"
116.132.235.204,192.168.0.106,80,7508,6,"Ether / IP / TCP 116.132.235.204:http > 192.168.0.106:7508 A"
116.132.235.204,192.168.0.106,80,7508,6,"Ether / IP / TCP 116.132.235.204:http > 192.168.0.106:7508 PA / Raw"
192.168.0.106,116.132.235.204,7508,80,6,"Ether / IP / TCP 192.168.0.106:7508 > 116.132.235.204:http FA"
116.132.235.204,192.168.0.106,80,7508,6,"Ether / IP / TCP 116.132.235.204:http > 192.168.0.106:7508 FA"
192.168.0.106,116.132.235.204,7508,80,6,"Ether / IP / TCP 192.168.0.106:7508 > 116.132.235.204:http A"
119.28.20.150,192.168.0.106,443,7355,6,"Ether / IP / TCP 119.28.20.150:https > 192.168.0.106:7355 A"
192.168.0.106,192.168.0.1,63843,53,17,"Ether / IP / UDP / DNS Qry ""b'wpad.www.tendawifi.com.'"" "
192.168.0.1,192.168.0.106,53,63843,17,"Ether / IP / UDP / DNS Ans "
192.168.0.106,116.132.235.204,7507,80,6,"Ether / IP / TCP 192.168.0.106:7507 > 116.132.235.204:http FA"
192.168.0.106,116.132.235.204,7508,80,6,"Ether / IP / TCP 192.168.0.106:7508 > 116.132.235.204:http FA"
192.168.0.106,116.132.235.204,7507,80,6,"Ether / IP / TCP 192.168.0.106:7507 > 116.132.235.204:http FA"
192.168.0.106,116.132.235.204,7505,80,6,"Ether / IP / TCP 192.168.0.106:7505 > 116.132.235.204:http FA"
192.168.0.106,116.132.235.204,7508,80,6,"Ether / IP / TCP 192.168.0.106:7508 > 116.132.235.204:http FA"
192.168.0.106,192.168.0.1,60618,53,17,"Ether / IP / UDP / DNS Qry ""b'wpad.www.tendawifi.com.'"" "
192.168.0.1,192.168.0.106,53,60618,17,"Ether / IP / UDP / DNS Ans "
192.168.0.106,116.132.235.204,7509,80,6,"Ether / IP / TCP 192.168.0.106:7509 > 116.132.235.204:http S"
116.132.235.204,192.168.0.106,80,7509,6,"Ether / IP / TCP 116.132.235.204:http > 192.168.0.106:7509 SA"
192.168.0.106,116.132.235.204,7509,80,6,"Ether / IP / TCP 192.168.0.106:7509 > 116.132.235.204:http A"
192.168.0.106,116.132.235.204,7509,80,6,"Ether / IP / TCP 192.168.0.106:7509 > 116.132.235.204:http PA / Raw"
192.168.0.106,116.132.235.204,7509,80,6,"Ether / IP / TCP 192.168.0.106:7509 > 116.132.235.204:http A / Raw"
192.168.0.106,116.132.235.204,7509,80,6,"Ether / IP / TCP 192.168.0.106:7509 > 116.132.235.204:http A / Raw"
192.168.0.106,116.132.235.204,7509,80,6,"Ether / IP / TCP 192.168.0.106:7509 > 116.132.235.204:http PA / Raw"
116.132.235.204,192.168.0.106,80,7509,6,"Ether / IP / TCP 116.132.235.204:http > 192.168.0.106:7509 A"
116.132.235.204,192.168.0.106,80,7509,6,"Ether / IP / TCP 116.132.235.204:http > 192.168.0.106:7509 A"
116.132.235.204,192.168.0.106,80,7509,6,"Ether / IP / TCP 116.132.235.204:http > 192.168.0.106:7509 A"
116.132.235.204,192.168.0.106,80,7509,6,"Ether / IP / TCP 116.132.235.204:http > 192.168.0.106:7509 PA / Raw"
116.132.235.204,192.168.0.106,80,7509,6,"Ether / IP / TCP 116.132.235.204:http > 192.168.0.106:7509 FA"
192.168.0.106,116.132.235.204,7509,80,6,"Ether / IP / TCP 192.168.0.106:7509 > 116.132.235.204:http A"
192.168.0.106,116.132.235.204,7509,80,6,"Ether / IP / TCP 192.168.0.106:7509 > 116.132.235.204:http FA"
116.132.235.204,192.168.0.106,80,7509,6,"Ether / IP / TCP 116.132.235.204:http > 192.168.0.106:7509 A"
121.36.83.100,192.168.0.106,443,7315,6,"Ether / IP / TCP 121.36.83.100:https > 192.168.0.106:7315 PA / Raw"
121.36.83.100,192.168.0.106,443,7315,6,"Ether / IP / TCP 121.36.83.100:https > 192.168.0.106:7315 FA"
192.168.0.106,121.36.83.100,7315,443,6,"Ether / IP / TCP 192.168.0.106:7315 > 121.36.83.100:https A"
192.168.0.106,121.36.83.100,7315,443,6,"Ether / IP / TCP 192.168.0.106:7315 > 121.36.83.100:https FA"
121.36.83.100,192.168.0.106,443,7315,6,"Ether / IP / TCP 121.36.83.100:https > 192.168.0.106:7315 R"
192.168.0.106,116.132.235.204,7507,80,6,"Ether / IP / TCP 192.168.0.106:7507 > 116.132.235.204:http FA"
192.168.0.106,116.132.235.204,7508,80,6,"Ether / IP / TCP 192.168.0.106:7508 > 116.132.235.204:http FA"
192.168.0.106,116.132.235.204,7511,80,6,"Ether / IP / TCP 192.168.0.106:7511 > 116.132.235.204:http S"
116.132.235.204,192.168.0.106,80,7511,6,"Ether / IP / TCP 116.132.235.204:http > 192.168.0.106:7511 SA"
192.168.0.106,116.132.235.204,7511,80,6,"Ether / IP / TCP 192.168.0.106:7511 > 116.132.235.204:http A"
192.168.0.106,116.132.235.204,7511,80,6,"Ether / IP / TCP 192.168.0.106:7511 > 116.132.235.204:http PA / Raw"
192.168.0.106,116.132.235.204,7511,80,6,"Ether / IP / TCP 192.168.0.106:7511 > 116.132.235.204:http A / Raw"
192.168.0.106,116.132.235.204,7511,80,6,"Ether / IP / TCP 192.168.0.106:7511 > 116.132.235.204:http A / Raw"
192.168.0.106,116.132.235.204,7511,80,6,"Ether / IP / TCP 192.168.0.106:7511 > 116.132.235.204:http PA / Raw"
116.132.235.204,192.168.0.106,80,7511,6,"Ether / IP / TCP 116.132.235.204:http > 192.168.0.106:7511 A"
116.132.235.204,192.168.0.106,80,7511,6,"Ether / IP / TCP 116.132.235.204:http > 192.168.0.106:7511 A"
116.132.235.204,192.168.0.106,80,7511,6,"Ether / IP / TCP 116.132.235.204:http > 192.168.0.106:7511 A"
116.132.235.204,192.168.0.106,80,7511,6,"Ether / IP / TCP 116.132.235.204:http > 192.168.0.106:7511 PA / Raw"
116.132.235.204,192.168.0.106,80,7511,6,"Ether / IP / TCP 116.132.235.204:http > 192.168.0.106:7511 FA"
192.168.0.106,116.132.235.204,7511,80,6,"Ether / IP / TCP 192.168.0.106:7511 > 116.132.235.204:http A"
192.168.0.106,116.132.235.204,7511,80,6,"Ether / IP / TCP 192.168.0.106:7511 > 116.132.235.204:http FA"
116.132.235.204,192.168.0.106,80,7511,6,"Ether / IP / TCP 116.132.235.204:http > 192.168.0.106:7511 A"
192.168.0.106,116.132.235.204,7512,80,6,"Ether / IP / TCP 192.168.0.106:7512 > 116.132.235.204:http S"
116.132.235.204,192.168.0.106,80,7512,6,"Ether / IP / TCP 116.132.235.204:http > 192.168.0.106:7512 SA"
192.168.0.106,116.132.235.204,7512,80,6,"Ether / IP / TCP 192.168.0.106:7512 > 116.132.235.204:http A"
192.168.0.106,116.132.235.204,7512,80,6,"Ether / IP / TCP 192.168.0.106:7512 > 116.132.235.204:http PA / Raw"
192.168.0.106,116.132.235.204,7512,80,6,"Ether / IP / TCP 192.168.0.106:7512 > 116.132.235.204:http A / Raw"
192.168.0.106,116.132.235.204,7512,80,6,"Ether / IP / TCP 192.168.0.106:7512 > 116.132.235.204:http A / Raw"
192.168.0.106,116.132.235.204,7512,80,6,"Ether / IP / TCP 192.168.0.106:7512 > 116.132.235.204:http PA / Raw"
192.168.0.106,116.132.235.204,7505,80,6,"Ether / IP / TCP 192.168.0.106:7505 > 116.132.235.204:http FA"
116.132.235.204,192.168.0.106,80,7512,6,"Ether / IP / TCP 116.132.235.204:http > 192.168.0.106:7512 A"
116.132.235.204,192.168.0.106,80,7512,6,"Ether / IP / TCP 116.132.235.204:http > 192.168.0.106:7512 A"
116.132.235.204,192.168.0.106,80,7512,6,"Ether / IP / TCP 116.132.235.204:http > 192.168.0.106:7512 A"
116.132.235.204,192.168.0.106,80,7512,6,"Ether / IP / TCP 116.132.235.204:http > 192.168.0.106:7512 PA / Raw"
116.132.235.204,192.168.0.106,80,7512,6,"Ether / IP / TCP 116.132.235.204:http > 192.168.0.106:7512 FA"
192.168.0.106,116.132.235.204,7512,80,6,"Ether / IP / TCP 192.168.0.106:7512 > 116.132.235.204:http A"
192.168.0.106,116.132.235.204,7512,80,6,"Ether / IP / TCP 192.168.0.106:7512 > 116.132.235.204:http FA"
116.132.235.204,192.168.0.106,80,7512,6,"Ether / IP / TCP 116.132.235.204:http > 192.168.0.106:7512 A"
192.168.0.106,116.132.235.204,7513,80,6,"Ether / IP / TCP 192.168.0.106:7513 > 116.132.235.204:http S"
116.132.235.204,192.168.0.106,80,7513,6,"Ether / IP / TCP 116.132.235.204:http > 192.168.0.106:7513 SA"
192.168.0.106,116.132.235.204,7513,80,6,"Ether / IP / TCP 192.168.0.106:7513 > 116.132.235.204:http A"
192.168.0.106,116.132.235.204,7513,80,6,"Ether / IP / TCP 192.168.0.106:7513 > 116.132.235.204:http PA / Raw"
192.168.0.106,116.132.235.204,7513,80,6,"Ether / IP / TCP 192.168.0.106:7513 > 116.132.235.204:http A / Raw"
192.168.0.106,116.132.235.204,7513,80,6,"Ether / IP / TCP 192.168.0.106:7513 > 116.132.235.204:http A / Raw"
192.168.0.106,116.132.235.204,7513,80,6,"Ether / IP / TCP 192.168.0.106:7513 > 116.132.235.204:http PA / Raw"
116.132.235.204,192.168.0.106,80,7513,6,"Ether / IP / TCP 116.132.235.204:http > 192.168.0.106:7513 A"
116.132.235.204,192.168.0.106,80,7513,6,"Ether / IP / TCP 116.132.235.204:http > 192.168.0.106:7513 A"
116.132.235.204,192.168.0.106,80,7513,6,"Ether / IP / TCP 116.132.235.204:http > 192.168.0.106:7513 A"
116.132.235.204,192.168.0.106,80,7513,6,"Ether / IP / TCP 116.132.235.204:http > 192.168.0.106:7513 PA / Raw"
116.132.235.204,192.168.0.106,80,7513,6,"Ether / IP / TCP 116.132.235.204:http > 192.168.0.106:7513 FA"
192.168.0.106,116.132.235.204,7513,80,6,"Ether / IP / TCP 192.168.0.106:7513 > 116.132.235.204:http A"
192.168.0.106,116.132.235.204,7513,80,6,"Ether / IP / TCP 192.168.0.106:7513 > 116.132.235.204:http FA"
192.168.0.106,116.132.235.204,7513,80,6,"Ether / IP / TCP 192.168.0.106:7513 > 116.132.235.204:http FA"
192.168.0.106,116.132.235.204,7513,80,6,"Ether / IP / TCP 192.168.0.106:7513 > 116.132.235.204:http FA"
192.168.0.106,116.132.235.204,7507,80,6,"Ether / IP / TCP 192.168.0.106:7507 > 116.132.235.204:http FA"
192.168.0.106,116.132.235.204,7508,80,6,"Ether / IP / TCP 192.168.0.106:7508 > 116.132.235.204:http FA"
192.168.0.106,116.132.235.204,7513,80,6,"Ether / IP / TCP 192.168.0.106:7513 > 116.132.235.204:http FA"
192.168.0.106,13.89.178.26,6981,443,6,"Ether / IP / TCP 192.168.0.106:6981 > 13.89.178.26:https A / Raw"
192.168.0.106,192.168.0.1,56506,53,17,"Ether / IP / UDP / DNS Qry ""b'www.baidu.com.'"" "
192.168.0.1,192.168.0.106,53,56506,17,"Ether / IP / UDP / DNS Ans ""110.242.68.3"" "
192.168.0.106,110.242.68.3,7515,80,6,"Ether / IP / TCP 192.168.0.106:7515 > 110.242.68.3:http S"
110.242.68.3,192.168.0.106,80,7515,6,"Ether / IP / TCP 110.242.68.3:http > 192.168.0.106:7515 SA"
192.168.0.106,110.242.68.3,7515,80,6,"Ether / IP / TCP 192.168.0.106:7515 > 110.242.68.3:http A"
192.168.0.106,110.242.68.3,7515,80,6,"Ether / IP / TCP 192.168.0.106:7515 > 110.242.68.3:http FA"
13.89.178.26,192.168.0.106,443,6981,6,"Ether / IP / TCP 13.89.178.26:https > 192.168.0.106:6981 A"
110.242.68.3,192.168.0.106,80,7515,6,"Ether / IP / TCP 110.242.68.3:http > 192.168.0.106:7515 A"
110.242.68.3,192.168.0.106,80,7515,6,"Ether / IP / TCP 110.242.68.3:http > 192.168.0.106:7515 FA"
192.168.0.106,110.242.68.3,7515,80,6,"Ether / IP / TCP 192.168.0.106:7515 > 110.242.68.3:http A"
192.168.0.106,116.132.235.204,7513,80,6,"Ether / IP / TCP 192.168.0.106:7513 > 116.132.235.204:http FA"
192.168.0.106,116.132.235.204,7505,80,6,"Ether / IP / TCP 192.168.0.106:7505 > 116.132.235.204:http FA"
192.168.0.106,13.89.178.26,6981,443,6,"Ether / IP / TCP 192.168.0.106:6981 > 13.89.178.26:https PA / Raw"
192.168.0.106,13.89.178.26,6981,443,6,"Ether / IP / TCP 192.168.0.106:6981 > 13.89.178.26:https PA / Raw"
192.168.0.106,13.89.178.26,6981,443,6,"Ether / IP / TCP 192.168.0.106:6981 > 13.89.178.26:https PA / Raw"
192.168.0.106,192.168.0.1,50464,53,17,"Ether / IP / UDP / DNS Qry ""b'wpad.www.tendawifi.com.'"" "
192.168.0.1,192.168.0.106,53,50464,17,"Ether / IP / UDP / DNS Ans "
13.89.178.26,192.168.0.106,443,6981,6,"Ether / IP / TCP 13.89.178.26:https > 192.168.0.106:6981 A / Padding"
13.89.178.26,192.168.0.106,443,6981,6,"Ether / IP / TCP 13.89.178.26:https > 192.168.0.106:6981 PA / Raw"
13.89.178.26,192.168.0.106,443,6981,6,"Ether / IP / TCP 13.89.178.26:https > 192.168.0.106:6981 A / Padding"
13.89.178.26,192.168.0.106,443,6981,6,"Ether / IP / TCP 13.89.178.26:https > 192.168.0.106:6981 PA / Raw"
192.168.0.106,13.89.178.26,6981,443,6,"Ether / IP / TCP 192.168.0.106:6981 > 13.89.178.26:https A"
13.89.178.26,192.168.0.106,443,6981,6,"Ether / IP / TCP 13.89.178.26:https > 192.168.0.106:6981 PA / Raw"
192.168.0.106,13.89.178.26,6981,443,6,"Ether / IP / TCP 192.168.0.106:6981 > 13.89.178.26:https PA / Raw"
192.168.0.106,116.132.235.204,7507,80,6,"Ether / IP / TCP 192.168.0.106:7507 > 116.132.235.204:http FA"
192.168.0.106,116.132.235.204,7508,80,6,"Ether / IP / TCP 192.168.0.106:7508 > 116.132.235.204:http FA"
13.89.178.26,192.168.0.106,443,6981,6,"Ether / IP / TCP 13.89.178.26:https > 192.168.0.106:6981 A / Padding"
192.168.0.106,116.132.235.204,7489,80,6,"Ether / IP / TCP 192.168.0.106:7489 > 116.132.235.204:http RA"
192.168.0.106,224.0.0.251,5353,5353,17,"Ether / IP / UDP / DNS Qry ""b'_microsoft_mcc._tcp.local.'"" "
0,0,0,0,0,"Ether / IPv6 / UDP / DNS Qry ""b'_microsoft_mcc._tcp.local.'"" "
192.168.0.106,224.0.0.251,5353,5353,17,"Ether / IP / UDP / DNS Qry ""b'_microsoft_mcc._tcp.local.'"" "
0,0,0,0,0,"Ether / IPv6 / UDP / DNS Qry ""b'_microsoft_mcc._tcp.local.'"" "
192.168.0.106,116.132.235.204,7513,80,6,"Ether / IP / TCP 192.168.0.106:7513 > 116.132.235.204:http FA"
192.168.0.106,13.89.178.26,6981,443,6,"Ether / IP / TCP 192.168.0.106:6981 > 13.89.178.26:https PA / Raw"
192.168.0.106,13.89.178.26,6981,443,6,"Ether / IP / TCP 192.168.0.106:6981 > 13.89.178.26:https PA / Raw"
13.89.178.26,192.168.0.106,443,6981,6,"Ether / IP / TCP 13.89.178.26:https > 192.168.0.106:6981 A / Padding"
13.89.178.26,192.168.0.106,443,6981,6,"Ether / IP / TCP 13.89.178.26:https > 192.168.0.106:6981 PA / Raw"
13.89.178.26,192.168.0.106,443,6981,6,"Ether / IP / TCP 13.89.178.26:https > 192.168.0.106:6981 PA / Raw"
192.168.0.106,13.89.178.26,6981,443,6,"Ether / IP / TCP 192.168.0.106:6981 > 13.89.178.26:https A"
119.28.20.150,192.168.0.106,443,7355,6,"Ether / IP / TCP 119.28.20.150:https > 192.168.0.106:7355 PA / Raw"
119.28.20.150,192.168.0.106,443,7355,6,"Ether / IP / TCP 119.28.20.150:https > 192.168.0.106:7355 FA"
192.168.0.106,119.28.20.150,7355,443,6,"Ether / IP / TCP 192.168.0.106:7355 > 119.28.20.150:https A"
192.168.0.106,110.242.68.3,7521,80,6,"Ether / IP / TCP 192.168.0.106:7521 > 110.242.68.3:http S"
110.242.68.3,192.168.0.106,80,7521,6,"Ether / IP / TCP 110.242.68.3:http > 192.168.0.106:7521 SA"
192.168.0.106,110.242.68.3,7521,80,6,"Ether / IP / TCP 192.168.0.106:7521 > 110.242.68.3:http A"
192.168.0.106,110.242.68.3,7521,80,6,"Ether / IP / TCP 192.168.0.106:7521 > 110.242.68.3:http FA"
192.168.0.106,110.242.68.3,7521,80,6,"Ether / IP / TCP 192.168.0.106:7521 > 110.242.68.3:http FA"
123.6.106.1,192.168.0.106,443,7313,6,"Ether / IP / TCP 123.6.106.1:https > 192.168.0.106:7313 PA / Raw"
123.6.106.1,192.168.0.106,443,7313,6,"Ether / IP / TCP 123.6.106.1:https > 192.168.0.106:7313 FA"
192.168.0.106,123.6.106.1,7313,443,6,"Ether / IP / TCP 192.168.0.106:7313 > 123.6.106.1:https A"
192.168.0.106,123.6.106.1,7313,443,6,"Ether / IP / TCP 192.168.0.106:7313 > 123.6.106.1:https FA"
123.6.106.1,192.168.0.106,80,7314,6,"Ether / IP / TCP 123.6.106.1:http > 192.168.0.106:7314 FA"
192.168.0.106,123.6.106.1,7314,80,6,"Ether / IP / TCP 192.168.0.106:7314 > 123.6.106.1:http A"
192.168.0.106,123.6.106.1,7314,80,6,"Ether / IP / TCP 192.168.0.106:7314 > 123.6.106.1:http FA"
123.6.106.1,192.168.0.106,80,7314,6,"Ether / IP / TCP 123.6.106.1:http > 192.168.0.106:7314 A"
192.168.0.106,110.242.68.3,7521,80,6,"Ether / IP / TCP 192.168.0.106:7521 > 110.242.68.3:http FA"
192.168.0.106,123.6.106.1,7313,443,6,"Ether / IP / TCP 192.168.0.106:7313 > 123.6.106.1:https FA"
123.6.106.1,192.168.0.106,443,7313,6,"Ether / IP / TCP 123.6.106.1:https > 192.168.0.106:7313 R"
192.168.0.106,116.132.235.204,7505,80,6,"Ether / IP / TCP 192.168.0.106:7505 > 116.132.235.204:http RA"
192.168.0.106,110.242.68.3,7521,80,6,"Ether / IP / TCP 192.168.0.106:7521 > 110.242.68.3:http FA"
192.168.0.106,116.132.235.204,7507,80,6,"Ether / IP / TCP 192.168.0.106:7507 > 116.132.235.204:http RA"
192.168.0.106,116.132.235.204,7508,80,6,"Ether / IP / TCP 192.168.0.106:7508 > 116.132.235.204:http RA"
192.168.0.106,239.255.255.250,58205,1900,17,"Ether / IP / UDP 192.168.0.106:58205 > 239.255.255.250:ssdp / Raw"
192.168.0.106,110.242.68.3,7521,80,6,"Ether / IP / TCP 192.168.0.106:7521 > 110.242.68.3:http FA"
192.168.0.106,20.190.9.86,7524,443,6,"Ether / IP / TCP 192.168.0.106:7524 > 20.190.9.86:https S"
20.190.9.86,192.168.0.106,443,7524,6,"Ether / IP / TCP 20.190.9.86:https > 192.168.0.106:7524 SA"
192.168.0.106,20.190.9.86,7524,443,6,"Ether / IP / TCP 192.168.0.106:7524 > 20.190.9.86:https A"
192.168.0.106,20.190.9.86,7524,443,6,"Ether / IP / TCP 192.168.0.106:7524 > 20.190.9.86:https PA / Raw"
20.190.9.86,192.168.0.106,443,7524,6,"Ether / IP / TCP 20.190.9.86:https > 192.168.0.106:7524 A"
20.190.9.86,192.168.0.106,443,7524,6,"Ether / IP / TCP 20.190.9.86:https > 192.168.0.106:7524 A / Raw"
20.190.9.86,192.168.0.106,443,7524,6,"Ether / IP / TCP 20.190.9.86:https > 192.168.0.106:7524 PA / Raw"
192.168.0.106,20.190.9.86,7524,443,6,"Ether / IP / TCP 192.168.0.106:7524 > 20.190.9.86:https A"
