data,flowmember,label,classes
b'her / IP / TCP 192.168.0.106:7489 > 116.132.235.204:http ',1,,
b'her / IP / TCP 192.168.0.106:7489 > 116.132.235.204:http ',1,,
b'her / IP / TCP 192.168.0.106:7489 > 116.132.235.204:http PA / Ra',1,,
b'her / IP / TCP 192.168.0.106:7489 > 116.132.235.204:http A / Ra',1,,
b'her / IP / TCP 192.168.0.106:7489 > 116.132.235.204:http A / Ra',1,,
b'her / IP / TCP 192.168.0.106:7489 > 116.132.235.204:http PA / Ra',1,,
b'her / IP / TCP 192.168.0.106:7489 > 116.132.235.204:http ',2,,
b'her / IP / TCP 192.168.0.106:7489 > 116.132.235.204:http F',2,,
b'her / IP / TCP 192.168.0.106:7489 > 116.132.235.204:http F',2,,
b'her / IP / TCP 192.168.0.106:7489 > 116.132.235.204:http F',2,,
b'her / IP / TCP 192.168.0.106:7489 > 116.132.235.204:http F',2,,
b'her / IP / TCP 192.168.0.106:7489 > 116.132.235.204:http F',2,,
b'her / IP / TCP 192.168.0.106:7489 > 116.132.235.204:http F',2,,
b'her / IP / TCP 192.168.0.106:7489 > 116.132.235.204:http R',3,,
b'her / IP / TCP 116.132.235.204:http > 192.168.0.106:7489 S',3,,
b'her / IP / TCP 116.132.235.204:http > 192.168.0.106:7489 ',3,,
b'her / IP / TCP 116.132.235.204:http > 192.168.0.106:7489 ',3,,
b'her / IP / TCP 116.132.235.204:http > 192.168.0.106:7489 PA / Ra',3,,
b'her / IP / TCP 116.132.235.204:http > 192.168.0.106:7489 F',3,,
b'her / IP / TCP 119.3.178.178:21111 > 192.168.0.106:8122 A / Paddin',4,,
b'her / IP / TCP 192.168.0.106:8122 > 119.3.178.178:21111 ',5,,
b'her / IP / TCP 192.168.0.106:7490 > 116.132.235.204:http ',6,,
b'her / IP / TCP 192.168.0.106:7490 > 116.132.235.204:http ',6,,
b'her / IP / TCP 192.168.0.106:7490 > 116.132.235.204:http PA / Ra',6,,
b'her / IP / TCP 192.168.0.106:7490 > 116.132.235.204:http A / Ra',6,,
b'her / IP / TCP 192.168.0.106:7490 > 116.132.235.204:http A / Ra',6,,
b'her / IP / TCP 192.168.0.106:7490 > 116.132.235.204:http PA / Ra',6,,
b'her / IP / TCP 192.168.0.106:7490 > 116.132.235.204:http ',7,,
b'her / IP / TCP 192.168.0.106:7490 > 116.132.235.204:http F',7,,
b'her / IP / TCP 116.132.235.204:http > 192.168.0.106:7490 S',8,,
b'her / IP / TCP 116.132.235.204:http > 192.168.0.106:7490 ',8,,
b'her / IP / TCP 116.132.235.204:http > 192.168.0.106:7490 ',8,,
b'her / IP / TCP 116.132.235.204:http > 192.168.0.106:7490 ',8,,
b'her / IP / TCP 116.132.235.204:http > 192.168.0.106:7490 PA / Ra',8,,
b'her / IP / TCP 116.132.235.204:http > 192.168.0.106:7490 F',8,,
b'her / IP / TCP 116.132.235.204:http > 192.168.0.106:7490 ',9,,
b'her / IP / TCP 192.168.0.106:7491 > 116.132.235.204:http ',9,,
b'her / IP / TCP 192.168.0.106:7491 > 116.132.235.204:http ',9,,
b'her / IP / TCP 192.168.0.106:7491 > 116.132.235.204:http PA / Ra',9,,
b'her / IP / TCP 192.168.0.106:7491 > 116.132.235.204:http A / Ra',9,,
b'her / IP / TCP 192.168.0.106:7491 > 116.132.235.204:http A / Ra',9,,
b'her / IP / TCP 192.168.0.106:7491 > 116.132.235.204:http PA / Ra',9,,
b'her / IP / TCP 192.168.0.106:7491 > 116.132.235.204:http ',10,,
b'her / IP / TCP 192.168.0.106:7491 > 116.132.235.204:http F',10,,
b'her / IP / TCP 116.132.235.204:http > 192.168.0.106:7491 S',11,,
b'her / IP / TCP 116.132.235.204:http > 192.168.0.106:7491 ',11,,
b'her / IP / TCP 116.132.235.204:http > 192.168.0.106:7491 ',11,,
b'her / IP / TCP 116.132.235.204:http > 192.168.0.106:7491 ',11,,
b'her / IP / TCP 116.132.235.204:http > 192.168.0.106:7491 PA / Ra',11,,
b'her / IP / TCP 116.132.235.204:http > 192.168.0.106:7491 F',11,,
b'her / IP / TCP 116.132.235.204:http > 192.168.0.106:7491 ',12,,
b'her / IP / TCP 192.168.0.106:7493 > 116.132.235.204:http ',12,,
b'her / IP / TCP 192.168.0.106:7493 > 116.132.235.204:http ',12,,
b'her / IP / TCP 192.168.0.106:7493 > 116.132.235.204:http PA / Ra',12,,
b'her / IP / TCP 192.168.0.106:7493 > 116.132.235.204:http A / Ra',12,,
b'her / IP / TCP 192.168.0.106:7493 > 116.132.235.204:http A / Ra',12,,
b'her / IP / TCP 192.168.0.106:7493 > 116.132.235.204:http PA / Ra',12,,
b'her / IP / TCP 192.168.0.106:7493 > 116.132.235.204:http ',13,,
b'her / IP / TCP 192.168.0.106:7493 > 116.132.235.204:http F',13,,
b'her / IP / TCP 116.132.235.204:http > 192.168.0.106:7493 S',14,,
b'her / IP / TCP 116.132.235.204:http > 192.168.0.106:7493 ',14,,
b'her / IP / TCP 116.132.235.204:http > 192.168.0.106:7493 ',14,,
b'her / IP / TCP 116.132.235.204:http > 192.168.0.106:7493 ',14,,
b'her / IP / TCP 116.132.235.204:http > 192.168.0.106:7493 PA / Ra',14,,
b'her / IP / TCP 116.132.235.204:http > 192.168.0.106:7493 F',14,,
b'her / IP / TCP 116.132.235.204:http > 192.168.0.106:7493 ',15,,
"b'her / IP / UDP / DNS Qry ""b\'dns.msftncsi.com.\'""'",15,,
"b'her / IP / UDP / DNS Qry ""b\'ipv6.msftconnecttest.com.\'""'",15,,
"b'her / IP / UDP / DNS Qry ""b\'wpad.www.tendawifi.com.\'""'",15,,
"b'her / IP / UDP / DNS Ans ""fd3e:4f5a:5b81::1""'",16,,
"b'her / IP / UDP / DNS Ans ""b\'v6ncsi.msedge.net.\'""'",16,,
b'her / IP / UDP / DNS Ans',16,,
"b'her / IP / UDP / DNS Qry ""b\'dns.msftncsi.com.\'""'",17,,
"b'her / IP / UDP / DNS Qry ""b\'ipv6.msftconnecttest.com.\'""'",17,,
"b'her / IP / UDP / DNS Ans ""fd3e:4f5a:5b81::1""'",18,,
"b'her / IP / UDP / DNS Ans ""b\'v6ncsi.msedge.net.\'""'",18,,
"b'her / IP / UDP / DNS Qry ""b\'ipv6.msftconnecttest.com.\'""'",19,,
"b'her / IP / UDP / DNS Qry ""b\'www.baidu.com.\'""'",19,,
"b'her / IP / UDP / DNS Qry ""b\'www.msftconnecttest.com.\'""'",20,,
"b'her / IP / UDP / DNS Qry ""b\'wpad.www.tendawifi.com.\'""'",20,,
"b'her / IP / UDP / DNS Ans ""b\'v6ncsi.msedge.net.\'""'",21,,
"b'her / IP / UDP / DNS Ans ""110.242.68.3""'",21,,
"b'her / IP / UDP / DNS Ans ""b\'ncsi-geo.trafficmanager.net.\'""'",22,,
b'her / IP / UDP / DNS Ans',22,,
b'her / IP / TCP 192.168.0.106:7494 > 104.109.128.195:http ',23,,
b'her / IP / TCP 192.168.0.106:7494 > 104.109.128.195:http ',23,,
b'her / IP / TCP 192.168.0.106:7494 > 104.109.128.195:http PA / Ra',23,,
b'her / IP / TCP 192.168.0.106:7494 > 104.109.128.195:http F',23,,
b'her / IP / TCP 192.168.0.106:7494 > 104.109.128.195:http ',23,,
b'her / IP / TCP 192.168.0.106:7494 > 104.109.128.195:http F',23,,
b'her / IP / TCP 192.168.0.106:7495 > 104.109.128.195:http ',24,,
b'her / IP / TCP 192.168.0.106:7495 > 104.109.128.195:http ',24,,
b'her / IP / TCP 192.168.0.106:7495 > 104.109.128.195:http PA / Ra',24,,
b'her / IP / TCP 192.168.0.106:7495 > 104.109.128.195:http ',24,,
b'her / IP / TCP 192.168.0.106:7495 > 104.109.128.195:http F',24,,
b'her / IP / TCP 192.168.0.106:7495 > 104.109.128.195:http F',24,,
b'her / IP / TCP 104.109.128.195:http > 192.168.0.106:7495 S',25,,
b'her / IP / TCP 104.109.128.195:http > 192.168.0.106:7495 ',25,,
b'her / IP / TCP 104.109.128.195:http > 192.168.0.106:7495 PA / Ra',25,,
b'her / IP / TCP 104.109.128.195:http > 192.168.0.106:7495 F',25,,
b'her / IP / TCP 104.109.128.195:http > 192.168.0.106:7495 ',25,,
b'her / IP / TCP 104.109.128.195:http > 192.168.0.106:7494 S',26,,
b'her / IP / TCP 104.109.128.195:http > 192.168.0.106:7494 ',26,,
b'her / IP / TCP 104.109.128.195:http > 192.168.0.106:7494 PA / Ra',26,,
b'her / IP / TCP 104.109.128.195:http > 192.168.0.106:7494 F',26,,
b'her / IP / TCP 104.109.128.195:http > 192.168.0.106:7494 ',26,,
b'her / IP / UDP 192.168.192.1:netbios_ns > 192.168.192.2:netbios_ns / NBNSHeader / Ra',27,,
b'her / IP / UDP 192.168.192.1:netbios_ns > 192.168.192.2:netbios_ns / NBNSHeader / Ra',27,,
b'her / IP / UDP 192.168.192.1:netbios_ns > 192.168.192.2:netbios_ns / NBNSHeader / Ra',27,,
b'her / IP / TCP 192.168.0.106:7496 > 116.132.235.204:http ',28,,
b'her / IP / TCP 192.168.0.106:7496 > 116.132.235.204:http ',28,,
b'her / IP / TCP 192.168.0.106:7496 > 116.132.235.204:http PA / Ra',28,,
b'her / IP / TCP 192.168.0.106:7496 > 116.132.235.204:http A / Ra',28,,
b'her / IP / TCP 192.168.0.106:7496 > 116.132.235.204:http A / Ra',28,,
b'her / IP / TCP 192.168.0.106:7496 > 116.132.235.204:http PA / Ra',28,,
b'her / IP / TCP 192.168.0.106:7496 > 116.132.235.204:http ',29,,
b'her / IP / TCP 192.168.0.106:7496 > 116.132.235.204:http F',29,,
b'her / IP / TCP 116.132.235.204:http > 192.168.0.106:7496 S',30,,
b'her / IP / TCP 116.132.235.204:http > 192.168.0.106:7496 ',30,,
b'her / IP / TCP 116.132.235.204:http > 192.168.0.106:7496 ',30,,
b'her / IP / TCP 116.132.235.204:http > 192.168.0.106:7496 PA / Ra',30,,
b'her / IP / TCP 116.132.235.204:http > 192.168.0.106:7496 F',30,,
b'her / IP / TCP 116.132.235.204:http > 192.168.0.106:7496 ',30,,
b'her / IP / TCP 192.168.0.106:7497 > 116.132.235.204:http ',31,,
b'her / IP / TCP 192.168.0.106:7497 > 116.132.235.204:http ',31,,
b'her / IP / TCP 192.168.0.106:7497 > 116.132.235.204:http PA / Ra',31,,
b'her / IP / TCP 192.168.0.106:7497 > 116.132.235.204:http A / Ra',31,,
b'her / IP / TCP 192.168.0.106:7497 > 116.132.235.204:http A / Ra',31,,
b'her / IP / TCP 192.168.0.106:7497 > 116.132.235.204:http PA / Ra',31,,
b'her / IP / TCP 192.168.0.106:7497 > 116.132.235.204:http ',32,,
b'her / IP / TCP 192.168.0.106:7497 > 116.132.235.204:http F',32,,
b'her / IP / TCP 116.132.235.204:http > 192.168.0.106:7497 S',33,,
b'her / IP / TCP 116.132.235.204:http > 192.168.0.106:7497 ',33,,
b'her / IP / TCP 116.132.235.204:http > 192.168.0.106:7497 ',33,,
b'her / IP / TCP 116.132.235.204:http > 192.168.0.106:7497 ',33,,
b'her / IP / TCP 116.132.235.204:http > 192.168.0.106:7497 PA / Ra',33,,
b'her / IP / TCP 116.132.235.204:http > 192.168.0.106:7497 F',33,,
b'her / IP / TCP 116.132.235.204:http > 192.168.0.106:7497 ',34,,
b'her / IP / TCP 192.168.0.106:1025 > 20.198.162.78:https PA / Ra',34,,
b'her / IP / TCP 192.168.0.106:1025 > 20.198.162.78:https ',34,,
b'her / IP / TCP 20.198.162.78:https > 192.168.0.106:1025 PA / Ra',35,,
b'her / IP / TCP 192.168.0.106:7499 > 116.132.235.204:http ',36,,
b'her / IP / TCP 192.168.0.106:7499 > 116.132.235.204:http ',36,,
b'her / IP / TCP 192.168.0.106:7499 > 116.132.235.204:http PA / Ra',36,,
b'her / IP / TCP 192.168.0.106:7499 > 116.132.235.204:http A / Ra',36,,
b'her / IP / TCP 192.168.0.106:7499 > 116.132.235.204:http A / Ra',36,,
b'her / IP / TCP 192.168.0.106:7499 > 116.132.235.204:http PA / Ra',36,,
b'her / IP / TCP 192.168.0.106:7499 > 116.132.235.204:http ',37,,
b'her / IP / TCP 192.168.0.106:7499 > 116.132.235.204:http F',37,,
b'her / IP / TCP 116.132.235.204:http > 192.168.0.106:7499 S',38,,
b'her / IP / TCP 116.132.235.204:http > 192.168.0.106:7499 ',38,,
b'her / IP / TCP 116.132.235.204:http > 192.168.0.106:7499 ',38,,
b'her / IP / TCP 116.132.235.204:http > 192.168.0.106:7499 ',38,,
b'her / IP / TCP 116.132.235.204:http > 192.168.0.106:7499 PA / Ra',38,,
b'her / IP / TCP 116.132.235.204:http > 192.168.0.106:7499 F',38,,
b'her / IP / TCP 116.132.235.204:http > 192.168.0.106:7499 ',39,,
b'her / IP / TCP 192.168.0.106:7500 > 110.242.68.3:http ',39,,
b'her / IP / TCP 192.168.0.106:7500 > 110.242.68.3:http ',39,,
b'her / IP / TCP 192.168.0.106:7500 > 110.242.68.3:http F',39,,
b'her / IP / TCP 192.168.0.106:7500 > 110.242.68.3:http ',39,,
b'her / IP / TCP 110.242.68.3:http > 192.168.0.106:7500 S',40,,
b'her / IP / TCP 110.242.68.3:http > 192.168.0.106:7500 ',40,,
b'her / IP / TCP 110.242.68.3:http > 192.168.0.106:7500 F',40,,
b'her / IP / TCP 192.168.0.106:7501 > 116.132.235.204:http ',41,,
b'her / IP / TCP 192.168.0.106:7501 > 116.132.235.204:http ',41,,
b'her / IP / TCP 192.168.0.106:7501 > 116.132.235.204:http PA / Ra',41,,
b'her / IP / TCP 192.168.0.106:7501 > 116.132.235.204:http A / Ra',41,,
b'her / IP / TCP 192.168.0.106:7501 > 116.132.235.204:http A / Ra',41,,
b'her / IP / TCP 192.168.0.106:7501 > 116.132.235.204:http PA / Ra',41,,
b'her / IP / TCP 192.168.0.106:7501 > 116.132.235.204:http ',42,,
b'her / IP / TCP 192.168.0.106:7501 > 116.132.235.204:http F',42,,
b'her / IP / TCP 116.132.235.204:http > 192.168.0.106:7501 S',43,,
b'her / IP / TCP 116.132.235.204:http > 192.168.0.106:7501 ',43,,
b'her / IP / TCP 116.132.235.204:http > 192.168.0.106:7501 ',43,,
b'her / IP / TCP 116.132.235.204:http > 192.168.0.106:7501 ',43,,
b'her / IP / TCP 116.132.235.204:http > 192.168.0.106:7501 PA / Ra',43,,
b'her / IP / TCP 116.132.235.204:http > 192.168.0.106:7501 F',43,,
b'her / IP / TCP 116.132.235.204:http > 192.168.0.106:7501 ',44,,
b'her / IP / TCP 192.168.0.106:7503 > 116.132.235.204:http ',44,,
b'her / IP / TCP 192.168.0.106:7503 > 116.132.235.204:http ',44,,
b'her / IP / TCP 192.168.0.106:7503 > 116.132.235.204:http PA / Ra',44,,
b'her / IP / TCP 192.168.0.106:7503 > 116.132.235.204:http A / Ra',44,,
b'her / IP / TCP 192.168.0.106:7503 > 116.132.235.204:http A / Ra',44,,
b'her / IP / TCP 192.168.0.106:7503 > 116.132.235.204:http PA / Ra',44,,
b'her / IP / TCP 192.168.0.106:7503 > 116.132.235.204:http ',45,,
b'her / IP / TCP 192.168.0.106:7503 > 116.132.235.204:http F',45,,
b'her / IP / TCP 116.132.235.204:http > 192.168.0.106:7503 S',46,,
b'her / IP / TCP 116.132.235.204:http > 192.168.0.106:7503 ',46,,
b'her / IP / TCP 116.132.235.204:http > 192.168.0.106:7503 ',46,,
b'her / IP / TCP 116.132.235.204:http > 192.168.0.106:7503 ',46,,
b'her / IP / TCP 116.132.235.204:http > 192.168.0.106:7503 PA / Ra',46,,
b'her / IP / TCP 116.132.235.204:http > 192.168.0.106:7503 F',46,,
b'her / IP / TCP 116.132.235.204:http > 192.168.0.106:7503 ',47,,
b'her / IP / TCP 192.168.0.106:7504 > 116.132.235.204:http ',47,,
b'her / IP / TCP 192.168.0.106:7504 > 116.132.235.204:http ',47,,
b'her / IP / TCP 192.168.0.106:7504 > 116.132.235.204:http PA / Ra',47,,
b'her / IP / TCP 192.168.0.106:7504 > 116.132.235.204:http A / Ra',47,,
b'her / IP / TCP 192.168.0.106:7504 > 116.132.235.204:http A / Ra',47,,
b'her / IP / TCP 192.168.0.106:7504 > 116.132.235.204:http PA / Ra',47,,
b'her / IP / TCP 192.168.0.106:7504 > 116.132.235.204:http ',48,,
b'her / IP / TCP 192.168.0.106:7504 > 116.132.235.204:http F',48,,
b'her / IP / TCP 116.132.235.204:http > 192.168.0.106:7504 S',49,,
b'her / IP / TCP 116.132.235.204:http > 192.168.0.106:7504 ',49,,
b'her / IP / TCP 116.132.235.204:http > 192.168.0.106:7504 ',49,,
b'her / IP / TCP 116.132.235.204:http > 192.168.0.106:7504 ',49,,
b'her / IP / TCP 116.132.235.204:http > 192.168.0.106:7504 PA / Ra',49,,
b'her / IP / TCP 116.132.235.204:http > 192.168.0.106:7504 F',49,,
b'her / IP / TCP 116.132.235.204:http > 192.168.0.106:7504 ',50,,
b'her / IP / TCP 192.168.0.106:7505 > 116.132.235.204:http ',50,,
b'her / IP / TCP 192.168.0.106:7505 > 116.132.235.204:http ',50,,
b'her / IP / TCP 192.168.0.106:7505 > 116.132.235.204:http PA / Ra',50,,
b'her / IP / TCP 192.168.0.106:7505 > 116.132.235.204:http A / Ra',50,,
b'her / IP / TCP 192.168.0.106:7505 > 116.132.235.204:http A / Ra',50,,
b'her / IP / TCP 192.168.0.106:7505 > 116.132.235.204:http PA / Ra',50,,
b'her / IP / TCP 192.168.0.106:7505 > 116.132.235.204:http ',51,,
b'her / IP / TCP 192.168.0.106:7505 > 116.132.235.204:http F',51,,
b'her / IP / TCP 192.168.0.106:7505 > 116.132.235.204:http F',51,,
b'her / IP / TCP 192.168.0.106:7505 > 116.132.235.204:http F',51,,
b'her / IP / TCP 192.168.0.106:7505 > 116.132.235.204:http F',51,,
b'her / IP / TCP 192.168.0.106:7505 > 116.132.235.204:http F',51,,
b'her / IP / TCP 192.168.0.106:7505 > 116.132.235.204:http F',51,,
b'her / IP / TCP 192.168.0.106:7505 > 116.132.235.204:http R',52,,
b'her / IP / TCP 116.132.235.204:http > 192.168.0.106:7505 S',52,,
b'her / IP / TCP 116.132.235.204:http > 192.168.0.106:7505 ',52,,
b'her / IP / TCP 116.132.235.204:http > 192.168.0.106:7505 ',52,,
b'her / IP / TCP 116.132.235.204:http > 192.168.0.106:7505 ',52,,
b'her / IP / TCP 116.132.235.204:http > 192.168.0.106:7505 PA / Ra',52,,
b'her / IP / TCP 116.132.235.204:http > 192.168.0.106:7505 F',52,,
b'her / IP / TCP 192.168.0.106:7507 > 116.132.235.204:http ',53,,
b'her / IP / TCP 192.168.0.106:7507 > 116.132.235.204:http ',53,,
b'her / IP / TCP 192.168.0.106:7507 > 116.132.235.204:http PA / Ra',53,,
b'her / IP / TCP 192.168.0.106:7507 > 116.132.235.204:http A / Ra',53,,
b'her / IP / TCP 192.168.0.106:7507 > 116.132.235.204:http A / Ra',53,,
b'her / IP / TCP 192.168.0.106:7507 > 116.132.235.204:http PA / Ra',53,,
b'her / IP / TCP 192.168.0.106:7507 > 116.132.235.204:http ',54,,
b'her / IP / TCP 192.168.0.106:7507 > 116.132.235.204:http F',54,,
b'her / IP / TCP 192.168.0.106:7507 > 116.132.235.204:http F',54,,
b'her / IP / TCP 192.168.0.106:7507 > 116.132.235.204:http F',54,,
b'her / IP / TCP 192.168.0.106:7507 > 116.132.235.204:http F',54,,
b'her / IP / TCP 192.168.0.106:7507 > 116.132.235.204:http F',54,,
b'her / IP / TCP 192.168.0.106:7507 > 116.132.235.204:http F',54,,
b'her / IP / TCP 192.168.0.106:7507 > 116.132.235.204:http R',55,,
b'her / IP / TCP 116.132.235.204:http > 192.168.0.106:7507 S',55,,
b'her / IP / TCP 116.132.235.204:http > 192.168.0.106:7507 ',55,,
b'her / IP / TCP 116.132.235.204:http > 192.168.0.106:7507 ',55,,
b'her / IP / TCP 116.132.235.204:http > 192.168.0.106:7507 PA / Ra',55,,
b'her / IP / TCP 116.132.235.204:http > 192.168.0.106:7507 F',55,,
b'her / IP / TCP 192.168.0.106:7508 > 116.132.235.204:http ',56,,
b'her / IP / TCP 192.168.0.106:7508 > 116.132.235.204:http ',56,,
b'her / IP / TCP 192.168.0.106:7508 > 116.132.235.204:http PA / Ra',56,,
b'her / IP / TCP 192.168.0.106:7508 > 116.132.235.204:http A / Ra',56,,
b'her / IP / TCP 192.168.0.106:7508 > 116.132.235.204:http A / Ra',56,,
b'her / IP / TCP 192.168.0.106:7508 > 116.132.235.204:http PA / Ra',56,,
b'her / IP / TCP 192.168.0.106:7508 > 116.132.235.204:http F',57,,
b'her / IP / TCP 192.168.0.106:7508 > 116.132.235.204:http ',57,,
b'her / IP / TCP 192.168.0.106:7508 > 116.132.235.204:http F',57,,
b'her / IP / TCP 192.168.0.106:7508 > 116.132.235.204:http F',57,,
b'her / IP / TCP 192.168.0.106:7508 > 116.132.235.204:http F',57,,
b'her / IP / TCP 192.168.0.106:7508 > 116.132.235.204:http F',57,,
b'her / IP / TCP 192.168.0.106:7508 > 116.132.235.204:http F',57,,
b'her / IP / TCP 192.168.0.106:7508 > 116.132.235.204:http R',58,,
b'her / IP / TCP 116.132.235.204:http > 192.168.0.106:7508 S',58,,
b'her / IP / TCP 116.132.235.204:http > 192.168.0.106:7508 ',58,,
b'her / IP / TCP 116.132.235.204:http > 192.168.0.106:7508 ',58,,
b'her / IP / TCP 116.132.235.204:http > 192.168.0.106:7508 ',58,,
b'her / IP / TCP 116.132.235.204:http > 192.168.0.106:7508 PA / Ra',58,,
b'her / IP / TCP 116.132.235.204:http > 192.168.0.106:7508 F',58,,
b'her / IP / TCP 192.168.0.106:7355 > 119.28.20.150:https A / Ra',59,,
b'her / IP / TCP 192.168.0.106:7355 > 119.28.20.150:https ',59,,
b'her / IP / TCP 119.28.20.150:https > 192.168.0.106:7355 ',60,,
b'her / IP / TCP 119.28.20.150:https > 192.168.0.106:7355 PA / Ra',60,,
b'her / IP / TCP 119.28.20.150:https > 192.168.0.106:7355 F',60,,
"b'her / IP / UDP / DNS Qry ""b\'wpad.www.tendawifi.com.\'""'",61,,
b'her / IP / UDP / DNS Ans',62,,
b'her / IP / TCP 192.168.0.106:7509 > 116.132.235.204:http ',63,,
b'her / IP / TCP 192.168.0.106:7509 > 116.132.235.204:http ',63,,
b'her / IP / TCP 192.168.0.106:7509 > 116.132.235.204:http PA / Ra',63,,
b'her / IP / TCP 192.168.0.106:7509 > 116.132.235.204:http A / Ra',63,,
b'her / IP / TCP 192.168.0.106:7509 > 116.132.235.204:http A / Ra',63,,
b'her / IP / TCP 192.168.0.106:7509 > 116.132.235.204:http PA / Ra',63,,
b'her / IP / TCP 192.168.0.106:7509 > 116.132.235.204:http ',64,,
b'her / IP / TCP 192.168.0.106:7509 > 116.132.235.204:http F',64,,
b'her / IP / TCP 116.132.235.204:http > 192.168.0.106:7509 S',65,,
b'her / IP / TCP 116.132.235.204:http > 192.168.0.106:7509 ',65,,
b'her / IP / TCP 116.132.235.204:http > 192.168.0.106:7509 ',65,,
b'her / IP / TCP 116.132.235.204:http > 192.168.0.106:7509 ',65,,
b'her / IP / TCP 116.132.235.204:http > 192.168.0.106:7509 PA / Ra',65,,
b'her / IP / TCP 116.132.235.204:http > 192.168.0.106:7509 F',65,,
b'her / IP / TCP 116.132.235.204:http > 192.168.0.106:7509 ',66,,
b'her / IP / TCP 121.36.83.100:https > 192.168.0.106:7315 PA / Ra',66,,
b'her / IP / TCP 121.36.83.100:https > 192.168.0.106:7315 F',66,,
b'her / IP / TCP 121.36.83.100:https > 192.168.0.106:7315 ',66,,
b'her / IP / TCP 192.168.0.106:7315 > 121.36.83.100:https ',67,,
b'her / IP / TCP 192.168.0.106:7315 > 121.36.83.100:https F',67,,
b'her / IP / TCP 192.168.0.106:7511 > 116.132.235.204:http ',68,,
b'her / IP / TCP 192.168.0.106:7511 > 116.132.235.204:http ',68,,
b'her / IP / TCP 192.168.0.106:7511 > 116.132.235.204:http PA / Ra',68,,
b'her / IP / TCP 192.168.0.106:7511 > 116.132.235.204:http A / Ra',68,,
b'her / IP / TCP 192.168.0.106:7511 > 116.132.235.204:http A / Ra',68,,
b'her / IP / TCP 192.168.0.106:7511 > 116.132.235.204:http PA / Ra',68,,
b'her / IP / TCP 192.168.0.106:7511 > 116.132.235.204:http ',69,,
b'her / IP / TCP 192.168.0.106:7511 > 116.132.235.204:http F',69,,
b'her / IP / TCP 116.132.235.204:http > 192.168.0.106:7511 S',70,,
b'her / IP / TCP 116.132.235.204:http > 192.168.0.106:7511 ',70,,
b'her / IP / TCP 116.132.235.204:http > 192.168.0.106:7511 ',70,,
b'her / IP / TCP 116.132.235.204:http > 192.168.0.106:7511 ',70,,
b'her / IP / TCP 116.132.235.204:http > 192.168.0.106:7511 PA / Ra',70,,
b'her / IP / TCP 116.132.235.204:http > 192.168.0.106:7511 F',70,,
b'her / IP / TCP 116.132.235.204:http > 192.168.0.106:7511 ',71,,
b'her / IP / TCP 192.168.0.106:7512 > 116.132.235.204:http ',71,,
b'her / IP / TCP 192.168.0.106:7512 > 116.132.235.204:http ',71,,
b'her / IP / TCP 192.168.0.106:7512 > 116.132.235.204:http PA / Ra',71,,
b'her / IP / TCP 192.168.0.106:7512 > 116.132.235.204:http A / Ra',71,,
b'her / IP / TCP 192.168.0.106:7512 > 116.132.235.204:http A / Ra',71,,
b'her / IP / TCP 192.168.0.106:7512 > 116.132.235.204:http PA / Ra',71,,
b'her / IP / TCP 192.168.0.106:7512 > 116.132.235.204:http ',72,,
b'her / IP / TCP 192.168.0.106:7512 > 116.132.235.204:http F',72,,
b'her / IP / TCP 116.132.235.204:http > 192.168.0.106:7512 S',73,,
b'her / IP / TCP 116.132.235.204:http > 192.168.0.106:7512 ',73,,
b'her / IP / TCP 116.132.235.204:http > 192.168.0.106:7512 ',73,,
b'her / IP / TCP 116.132.235.204:http > 192.168.0.106:7512 ',73,,
b'her / IP / TCP 116.132.235.204:http > 192.168.0.106:7512 PA / Ra',73,,
b'her / IP / TCP 116.132.235.204:http > 192.168.0.106:7512 F',73,,
b'her / IP / TCP 116.132.235.204:http > 192.168.0.106:7512 ',74,,
b'her / IP / TCP 192.168.0.106:7513 > 116.132.235.204:http ',74,,
b'her / IP / TCP 192.168.0.106:7513 > 116.132.235.204:http ',74,,
b'her / IP / TCP 192.168.0.106:7513 > 116.132.235.204:http PA / Ra',74,,
b'her / IP / TCP 192.168.0.106:7513 > 116.132.235.204:http A / Ra',74,,
b'her / IP / TCP 192.168.0.106:7513 > 116.132.235.204:http A / Ra',74,,
b'her / IP / TCP 192.168.0.106:7513 > 116.132.235.204:http PA / Ra',74,,
b'her / IP / TCP 192.168.0.106:7513 > 116.132.235.204:http ',75,,
b'her / IP / TCP 192.168.0.106:7513 > 116.132.235.204:http F',75,,
b'her / IP / TCP 192.168.0.106:7513 > 116.132.235.204:http F',75,,
b'her / IP / TCP 192.168.0.106:7513 > 116.132.235.204:http F',75,,
b'her / IP / TCP 192.168.0.106:7513 > 116.132.235.204:http F',75,,
b'her / IP / TCP 192.168.0.106:7513 > 116.132.235.204:http F',75,,
b'her / IP / TCP 192.168.0.106:7513 > 116.132.235.204:http F',75,,
b'her / IP / TCP 116.132.235.204:http > 192.168.0.106:7513 S',76,,
b'her / IP / TCP 116.132.235.204:http > 192.168.0.106:7513 ',76,,
b'her / IP / TCP 116.132.235.204:http > 192.168.0.106:7513 ',76,,
b'her / IP / TCP 116.132.235.204:http > 192.168.0.106:7513 ',76,,
b'her / IP / TCP 116.132.235.204:http > 192.168.0.106:7513 PA / Ra',76,,
b'her / IP / TCP 116.132.235.204:http > 192.168.0.106:7513 F',76,,
b'her / IP / TCP 192.168.0.106:6981 > 13.89.178.26:https A / Ra',77,,
b'her / IP / TCP 192.168.0.106:6981 > 13.89.178.26:https PA / Ra',77,,
b'her / IP / TCP 192.168.0.106:6981 > 13.89.178.26:https PA / Ra',77,,
b'her / IP / TCP 192.168.0.106:6981 > 13.89.178.26:https PA / Ra',77,,
b'her / IP / TCP 192.168.0.106:6981 > 13.89.178.26:https ',77,,
b'her / IP / TCP 192.168.0.106:6981 > 13.89.178.26:https PA / Ra',77,,
b'her / IP / TCP 192.168.0.106:6981 > 13.89.178.26:https PA / Ra',78,,
b'her / IP / TCP 192.168.0.106:6981 > 13.89.178.26:https PA / Ra',78,,
b'her / IP / TCP 192.168.0.106:6981 > 13.89.178.26:https ',78,,
b'her / IP / TCP 192.168.0.106:7515 > 110.242.68.3:http ',79,,
b'her / IP / TCP 192.168.0.106:7515 > 110.242.68.3:http ',79,,
b'her / IP / TCP 192.168.0.106:7515 > 110.242.68.3:http F',79,,
b'her / IP / TCP 192.168.0.106:7515 > 110.242.68.3:http ',79,,
b'her / IP / TCP 110.242.68.3:http > 192.168.0.106:7515 S',80,,
b'her / IP / TCP 110.242.68.3:http > 192.168.0.106:7515 ',80,,
b'her / IP / TCP 110.242.68.3:http > 192.168.0.106:7515 F',80,,
b'her / IP / TCP 13.89.178.26:https > 192.168.0.106:6981 ',81,,
b'her / IP / TCP 13.89.178.26:https > 192.168.0.106:6981 A / Paddin',81,,
b'her / IP / TCP 13.89.178.26:https > 192.168.0.106:6981 PA / Ra',81,,
b'her / IP / TCP 13.89.178.26:https > 192.168.0.106:6981 A / Paddin',81,,
b'her / IP / TCP 13.89.178.26:https > 192.168.0.106:6981 PA / Ra',81,,
b'her / IP / TCP 13.89.178.26:https > 192.168.0.106:6981 PA / Ra',81,,
b'her / IP / TCP 13.89.178.26:https > 192.168.0.106:6981 A / Paddin',82,,
b'her / IP / TCP 13.89.178.26:https > 192.168.0.106:6981 A / Paddin',82,,
b'her / IP / TCP 13.89.178.26:https > 192.168.0.106:6981 PA / Ra',82,,
b'her / IP / TCP 13.89.178.26:https > 192.168.0.106:6981 PA / Ra',82,,
"b'her / IP / UDP / DNS Qry ""b\'_microsoft_mcc._tcp.local.\'""'",83,,
"b'her / IP / UDP / DNS Qry ""b\'_microsoft_mcc._tcp.local.\'""'",83,,
"b'her / IPv6 / UDP / DNS Qry ""b\'_microsoft_mcc._tcp.local.\'""'",84,,
"b'her / IPv6 / UDP / DNS Qry ""b\'_microsoft_mcc._tcp.local.\'""'",84,,
b'her / IP / TCP 192.168.0.106:7521 > 110.242.68.3:http ',85,,
b'her / IP / TCP 192.168.0.106:7521 > 110.242.68.3:http ',85,,
b'her / IP / TCP 192.168.0.106:7521 > 110.242.68.3:http F',85,,
b'her / IP / TCP 192.168.0.106:7521 > 110.242.68.3:http F',85,,
b'her / IP / TCP 192.168.0.106:7521 > 110.242.68.3:http F',85,,
b'her / IP / TCP 192.168.0.106:7521 > 110.242.68.3:http F',85,,
b'her / IP / TCP 192.168.0.106:7521 > 110.242.68.3:http F',86,,
b'her / IP / TCP 110.242.68.3:http > 192.168.0.106:7521 S',86,,
b'her / IP / TCP 123.6.106.1:https > 192.168.0.106:7313 PA / Ra',87,,
b'her / IP / TCP 123.6.106.1:https > 192.168.0.106:7313 F',87,,
b'her / IP / TCP 123.6.106.1:https > 192.168.0.106:7313 ',87,,
b'her / IP / TCP 192.168.0.106:7313 > 123.6.106.1:https ',88,,
b'her / IP / TCP 192.168.0.106:7313 > 123.6.106.1:https F',88,,
b'her / IP / TCP 192.168.0.106:7313 > 123.6.106.1:https F',88,,
b'her / IP / TCP 123.6.106.1:http > 192.168.0.106:7314 F',89,,
b'her / IP / TCP 123.6.106.1:http > 192.168.0.106:7314 ',89,,
b'her / IP / TCP 192.168.0.106:7314 > 123.6.106.1:http ',90,,
b'her / IP / TCP 192.168.0.106:7314 > 123.6.106.1:http F',90,,
b'her / IP / UDP 192.168.0.106:58205 > 239.255.255.250:ssdp / Ra',91,,
b'her / IP / TCP 192.168.0.106:7524 > 20.190.9.86:https ',92,,
b'her / IP / TCP 192.168.0.106:7524 > 20.190.9.86:https ',92,,
b'her / IP / TCP 192.168.0.106:7524 > 20.190.9.86:https PA / Ra',92,,
b'her / IP / TCP 192.168.0.106:7524 > 20.190.9.86:https ',92,,
b'her / IP / TCP 20.190.9.86:https > 192.168.0.106:7524 S',93,,
b'her / IP / TCP 20.190.9.86:https > 192.168.0.106:7524 ',93,,
b'her / IP / TCP 20.190.9.86:https > 192.168.0.106:7524 A / Ra',93,,
b'her / IP / TCP 20.190.9.86:https > 192.168.0.106:7524 PA / Ra',93,,
