srcip,dstip,sport,dport,proto,data
192.168.0.106,119.3.178.178,6806,21113,6,"Ether / IP / TCP 192.168.0.106:6806 > 119.3.178.178:21113 A / Raw"
119.3.178.178,192.168.0.106,21113,6806,6,"Ether / IP / TCP 119.3.178.178:21113 > 192.168.0.106:6806 A"
192.168.0.106,116.132.235.204,14695,80,6,"Ether / IP / TCP 192.168.0.106:14695 > 116.132.235.204:http S"
116.132.235.204,192.168.0.106,80,14695,6,"Ether / IP / TCP 116.132.235.204:http > 192.168.0.106:14695 SA"
192.168.0.106,116.132.235.204,14695,80,6,"Ether / IP / TCP 192.168.0.106:14695 > 116.132.235.204:http A"
192.168.0.106,116.132.235.204,14695,80,6,"Ether / IP / TCP 192.168.0.106:14695 > 116.132.235.204:http PA / Raw"
192.168.0.106,116.132.235.204,14695,80,6,"Ether / IP / TCP 192.168.0.106:14695 > 116.132.235.204:http A / Raw"
192.168.0.106,116.132.235.204,14695,80,6,"Ether / IP / TCP 192.168.0.106:14695 > 116.132.235.204:http A / Raw"
192.168.0.106,116.132.235.204,14695,80,6,"Ether / IP / TCP 192.168.0.106:14695 > 116.132.235.204:http PA / Raw"
116.132.235.204,192.168.0.106,80,14695,6,"Ether / IP / TCP 116.132.235.204:http > 192.168.0.106:14695 A"
116.132.235.204,192.168.0.106,80,14695,6,"Ether / IP / TCP 116.132.235.204:http > 192.168.0.106:14695 A"
116.132.235.204,192.168.0.106,80,14695,6,"Ether / IP / TCP 116.132.235.204:http > 192.168.0.106:14695 A"
116.132.235.204,192.168.0.106,80,14695,6,"Ether / IP / TCP 116.132.235.204:http > 192.168.0.106:14695 PA / Raw"
116.132.235.204,192.168.0.106,80,14695,6,"Ether / IP / TCP 116.132.235.204:http > 192.168.0.106:14695 FA"
192.168.0.106,116.132.235.204,14695,80,6,"Ether / IP / TCP 192.168.0.106:14695 > 116.132.235.204:http A"
192.168.0.106,116.132.235.204,14695,80,6,"Ether / IP / TCP 192.168.0.106:14695 > 116.132.235.204:http FA"
192.168.0.106,116.132.235.204,14695,80,6,"Ether / IP / TCP 192.168.0.106:14695 > 116.132.235.204:http FA"
192.168.0.106,110.242.68.3,14696,80,6,"Ether / IP / TCP 192.168.0.106:14696 > 110.242.68.3:http S"
110.242.68.3,192.168.0.106,80,14696,6,"Ether / IP / TCP 110.242.68.3:http > 192.168.0.106:14696 SA"
192.168.0.106,110.242.68.3,14696,80,6,"Ether / IP / TCP 192.168.0.106:14696 > 110.242.68.3:http A"
192.168.0.106,110.242.68.3,14696,80,6,"Ether / IP / TCP 192.168.0.106:14696 > 110.242.68.3:http FA"
110.242.68.3,192.168.0.106,80,14696,6,"Ether / IP / TCP 110.242.68.3:http > 192.168.0.106:14696 A"
110.242.68.3,192.168.0.106,80,14696,6,"Ether / IP / TCP 110.242.68.3:http > 192.168.0.106:14696 FA"
192.168.0.106,110.242.68.3,14696,80,6,"Ether / IP / TCP 192.168.0.106:14696 > 110.242.68.3:http A"
192.168.0.106,116.132.235.204,14695,80,6,"Ether / IP / TCP 192.168.0.106:14695 > 116.132.235.204:http FA"
192.168.0.106,116.132.235.204,14697,80,6,"Ether / IP / TCP 192.168.0.106:14697 > 116.132.235.204:http S"
116.132.235.204,192.168.0.106,80,14697,6,"Ether / IP / TCP 116.132.235.204:http > 192.168.0.106:14697 SA"
192.168.0.106,116.132.235.204,14697,80,6,"Ether / IP / TCP 192.168.0.106:14697 > 116.132.235.204:http A"
192.168.0.106,116.132.235.204,14697,80,6,"Ether / IP / TCP 192.168.0.106:14697 > 116.132.235.204:http PA / Raw"
192.168.0.106,116.132.235.204,14697,80,6,"Ether / IP / TCP 192.168.0.106:14697 > 116.132.235.204:http A / Raw"
192.168.0.106,116.132.235.204,14697,80,6,"Ether / IP / TCP 192.168.0.106:14697 > 116.132.235.204:http A / Raw"
192.168.0.106,116.132.235.204,14697,80,6,"Ether / IP / TCP 192.168.0.106:14697 > 116.132.235.204:http PA / Raw"
116.132.235.204,192.168.0.106,80,14697,6,"Ether / IP / TCP 116.132.235.204:http > 192.168.0.106:14697 A"
116.132.235.204,192.168.0.106,80,14697,6,"Ether / IP / TCP 116.132.235.204:http > 192.168.0.106:14697 A"
116.132.235.204,192.168.0.106,80,14697,6,"Ether / IP / TCP 116.132.235.204:http > 192.168.0.106:14697 A"
116.132.235.204,192.168.0.106,80,14697,6,"Ether / IP / TCP 116.132.235.204:http > 192.168.0.106:14697 PA / Raw"
116.132.235.204,192.168.0.106,80,14697,6,"Ether / IP / TCP 116.132.235.204:http > 192.168.0.106:14697 FA"
192.168.0.106,116.132.235.204,14697,80,6,"Ether / IP / TCP 192.168.0.106:14697 > 116.132.235.204:http A"
192.168.0.106,116.132.235.204,14697,80,6,"Ether / IP / TCP 192.168.0.106:14697 > 116.132.235.204:http FA"
116.132.235.204,192.168.0.106,80,14697,6,"Ether / IP / TCP 116.132.235.204:http > 192.168.0.106:14697 A"
192.168.0.106,116.132.235.204,14698,80,6,"Ether / IP / TCP 192.168.0.106:14698 > 116.132.235.204:http S"
116.132.235.204,192.168.0.106,80,14698,6,"Ether / IP / TCP 116.132.235.204:http > 192.168.0.106:14698 SA"
192.168.0.106,116.132.235.204,14698,80,6,"Ether / IP / TCP 192.168.0.106:14698 > 116.132.235.204:http A"
192.168.0.106,116.132.235.204,14698,80,6,"Ether / IP / TCP 192.168.0.106:14698 > 116.132.235.204:http PA / Raw"
192.168.0.106,116.132.235.204,14698,80,6,"Ether / IP / TCP 192.168.0.106:14698 > 116.132.235.204:http A / Raw"
192.168.0.106,116.132.235.204,14698,80,6,"Ether / IP / TCP 192.168.0.106:14698 > 116.132.235.204:http A / Raw"
192.168.0.106,116.132.235.204,14698,80,6,"Ether / IP / TCP 192.168.0.106:14698 > 116.132.235.204:http PA / Raw"
116.132.235.204,192.168.0.106,80,14698,6,"Ether / IP / TCP 116.132.235.204:http > 192.168.0.106:14698 A"
116.132.235.204,192.168.0.106,80,14698,6,"Ether / IP / TCP 116.132.235.204:http > 192.168.0.106:14698 A"
116.132.235.204,192.168.0.106,80,14698,6,"Ether / IP / TCP 116.132.235.204:http > 192.168.0.106:14698 A"
116.132.235.204,192.168.0.106,80,14698,6,"Ether / IP / TCP 116.132.235.204:http > 192.168.0.106:14698 PA / Raw"
116.132.235.204,192.168.0.106,80,14698,6,"Ether / IP / TCP 116.132.235.204:http > 192.168.0.106:14698 FA"
192.168.0.106,116.132.235.204,14698,80,6,"Ether / IP / TCP 192.168.0.106:14698 > 116.132.235.204:http A"
192.168.0.106,116.132.235.204,14698,80,6,"Ether / IP / TCP 192.168.0.106:14698 > 116.132.235.204:http FA"
116.132.235.204,192.168.0.106,80,14698,6,"Ether / IP / TCP 116.132.235.204:http > 192.168.0.106:14698 A"
192.168.0.106,116.132.235.204,14695,80,6,"Ether / IP / TCP 192.168.0.106:14695 > 116.132.235.204:http FA"
192.168.0.106,116.132.235.204,14699,80,6,"Ether / IP / TCP 192.168.0.106:14699 > 116.132.235.204:http S"
116.132.235.204,192.168.0.106,80,14699,6,"Ether / IP / TCP 116.132.235.204:http > 192.168.0.106:14699 SA"
192.168.0.106,116.132.235.204,14699,80,6,"Ether / IP / TCP 192.168.0.106:14699 > 116.132.235.204:http A"
192.168.0.106,116.132.235.204,14699,80,6,"Ether / IP / TCP 192.168.0.106:14699 > 116.132.235.204:http PA / Raw"
192.168.0.106,116.132.235.204,14699,80,6,"Ether / IP / TCP 192.168.0.106:14699 > 116.132.235.204:http A / Raw"
192.168.0.106,116.132.235.204,14699,80,6,"Ether / IP / TCP 192.168.0.106:14699 > 116.132.235.204:http A / Raw"
192.168.0.106,116.132.235.204,14699,80,6,"Ether / IP / TCP 192.168.0.106:14699 > 116.132.235.204:http PA / Raw"
116.132.235.204,192.168.0.106,80,14699,6,"Ether / IP / TCP 116.132.235.204:http > 192.168.0.106:14699 A"
116.132.235.204,192.168.0.106,80,14699,6,"Ether / IP / TCP 116.132.235.204:http > 192.168.0.106:14699 A"
116.132.235.204,192.168.0.106,80,14699,6,"Ether / IP / TCP 116.132.235.204:http > 192.168.0.106:14699 A"
116.132.235.204,192.168.0.106,80,14699,6,"Ether / IP / TCP 116.132.235.204:http > 192.168.0.106:14699 PA / Raw"
116.132.235.204,192.168.0.106,80,14699,6,"Ether / IP / TCP 116.132.235.204:http > 192.168.0.106:14699 FA"
192.168.0.106,116.132.235.204,14699,80,6,"Ether / IP / TCP 192.168.0.106:14699 > 116.132.235.204:http A"
192.168.0.106,116.132.235.204,14699,80,6,"Ether / IP / TCP 192.168.0.106:14699 > 116.132.235.204:http FA"
116.132.235.204,192.168.0.106,80,14699,6,"Ether / IP / TCP 116.132.235.204:http > 192.168.0.106:14699 A"
192.168.0.106,116.132.235.204,14700,80,6,"Ether / IP / TCP 192.168.0.106:14700 > 116.132.235.204:http S"
116.132.235.204,192.168.0.106,80,14700,6,"Ether / IP / TCP 116.132.235.204:http > 192.168.0.106:14700 SA"
192.168.0.106,116.132.235.204,14700,80,6,"Ether / IP / TCP 192.168.0.106:14700 > 116.132.235.204:http A"
192.168.0.106,116.132.235.204,14700,80,6,"Ether / IP / TCP 192.168.0.106:14700 > 116.132.235.204:http PA / Raw"
192.168.0.106,116.132.235.204,14700,80,6,"Ether / IP / TCP 192.168.0.106:14700 > 116.132.235.204:http A / Raw"
192.168.0.106,116.132.235.204,14700,80,6,"Ether / IP / TCP 192.168.0.106:14700 > 116.132.235.204:http A / Raw"
192.168.0.106,116.132.235.204,14700,80,6,"Ether / IP / TCP 192.168.0.106:14700 > 116.132.235.204:http PA / Raw"
116.132.235.204,192.168.0.106,80,14700,6,"Ether / IP / TCP 116.132.235.204:http > 192.168.0.106:14700 A"
116.132.235.204,192.168.0.106,80,14700,6,"Ether / IP / TCP 116.132.235.204:http > 192.168.0.106:14700 A"
116.132.235.204,192.168.0.106,80,14700,6,"Ether / IP / TCP 116.132.235.204:http > 192.168.0.106:14700 A"
116.132.235.204,192.168.0.106,80,14700,6,"Ether / IP / TCP 116.132.235.204:http > 192.168.0.106:14700 PA / Raw"
116.132.235.204,192.168.0.106,80,14700,6,"Ether / IP / TCP 116.132.235.204:http > 192.168.0.106:14700 FA"
192.168.0.106,116.132.235.204,14700,80,6,"Ether / IP / TCP 192.168.0.106:14700 > 116.132.235.204:http A"
192.168.0.106,116.132.235.204,14700,80,6,"Ether / IP / TCP 192.168.0.106:14700 > 116.132.235.204:http FA"
116.132.235.204,192.168.0.106,80,14700,6,"Ether / IP / TCP 116.132.235.204:http > 192.168.0.106:14700 A"
192.168.0.106,116.132.235.204,14701,80,6,"Ether / IP / TCP 192.168.0.106:14701 > 116.132.235.204:http S"
192.168.0.106,116.132.235.204,14695,80,6,"Ether / IP / TCP 192.168.0.106:14695 > 116.132.235.204:http FA"
116.132.235.204,192.168.0.106,80,14701,6,"Ether / IP / TCP 116.132.235.204:http > 192.168.0.106:14701 SA"
192.168.0.106,116.132.235.204,14701,80,6,"Ether / IP / TCP 192.168.0.106:14701 > 116.132.235.204:http A"
192.168.0.106,116.132.235.204,14701,80,6,"Ether / IP / TCP 192.168.0.106:14701 > 116.132.235.204:http PA / Raw"
192.168.0.106,116.132.235.204,14701,80,6,"Ether / IP / TCP 192.168.0.106:14701 > 116.132.235.204:http A / Raw"
192.168.0.106,116.132.235.204,14701,80,6,"Ether / IP / TCP 192.168.0.106:14701 > 116.132.235.204:http A / Raw"
192.168.0.106,116.132.235.204,14701,80,6,"Ether / IP / TCP 192.168.0.106:14701 > 116.132.235.204:http PA / Raw"
116.132.235.204,192.168.0.106,80,14701,6,"Ether / IP / TCP 116.132.235.204:http > 192.168.0.106:14701 A"
116.132.235.204,192.168.0.106,80,14701,6,"Ether / IP / TCP 116.132.235.204:http > 192.168.0.106:14701 A"
116.132.235.204,192.168.0.106,80,14701,6,"Ether / IP / TCP 116.132.235.204:http > 192.168.0.106:14701 PA / Raw"
116.132.235.204,192.168.0.106,80,14701,6,"Ether / IP / TCP 116.132.235.204:http > 192.168.0.106:14701 FA"
192.168.0.106,116.132.235.204,14701,80,6,"Ether / IP / TCP 192.168.0.106:14701 > 116.132.235.204:http A"
192.168.0.106,116.132.235.204,14701,80,6,"Ether / IP / TCP 192.168.0.106:14701 > 116.132.235.204:http FA"
116.132.235.204,192.168.0.106,80,14701,6,"Ether / IP / TCP 116.132.235.204:http > 192.168.0.106:14701 A"
192.168.0.106,116.132.235.204,14702,80,6,"Ether / IP / TCP 192.168.0.106:14702 > 116.132.235.204:http S"
116.132.235.204,192.168.0.106,80,14702,6,"Ether / IP / TCP 116.132.235.204:http > 192.168.0.106:14702 SA"
192.168.0.106,116.132.235.204,14702,80,6,"Ether / IP / TCP 192.168.0.106:14702 > 116.132.235.204:http A"
192.168.0.106,116.132.235.204,14702,80,6,"Ether / IP / TCP 192.168.0.106:14702 > 116.132.235.204:http PA / Raw"
192.168.0.106,116.132.235.204,14702,80,6,"Ether / IP / TCP 192.168.0.106:14702 > 116.132.235.204:http A / Raw"
192.168.0.106,116.132.235.204,14702,80,6,"Ether / IP / TCP 192.168.0.106:14702 > 116.132.235.204:http A / Raw"
192.168.0.106,116.132.235.204,14702,80,6,"Ether / IP / TCP 192.168.0.106:14702 > 116.132.235.204:http PA / Raw"
116.132.235.204,192.168.0.106,80,14702,6,"Ether / IP / TCP 116.132.235.204:http > 192.168.0.106:14702 A"
116.132.235.204,192.168.0.106,80,14702,6,"Ether / IP / TCP 116.132.235.204:http > 192.168.0.106:14702 A"
116.132.235.204,192.168.0.106,80,14702,6,"Ether / IP / TCP 116.132.235.204:http > 192.168.0.106:14702 A"
116.132.235.204,192.168.0.106,80,14702,6,"Ether / IP / TCP 116.132.235.204:http > 192.168.0.106:14702 PA / Raw"
116.132.235.204,192.168.0.106,80,14702,6,"Ether / IP / TCP 116.132.235.204:http > 192.168.0.106:14702 FA"
192.168.0.106,116.132.235.204,14702,80,6,"Ether / IP / TCP 192.168.0.106:14702 > 116.132.235.204:http A"
192.168.0.106,116.132.235.204,14702,80,6,"Ether / IP / TCP 192.168.0.106:14702 > 116.132.235.204:http FA"
116.132.235.204,192.168.0.106,80,14702,6,"Ether / IP / TCP 116.132.235.204:http > 192.168.0.106:14702 A"
192.168.0.106,116.132.235.204,14703,80,6,"Ether / IP / TCP 192.168.0.106:14703 > 116.132.235.204:http S"
116.132.235.204,192.168.0.106,80,14703,6,"Ether / IP / TCP 116.132.235.204:http > 192.168.0.106:14703 SA"
192.168.0.106,116.132.235.204,14703,80,6,"Ether / IP / TCP 192.168.0.106:14703 > 116.132.235.204:http A"
192.168.0.106,116.132.235.204,14703,80,6,"Ether / IP / TCP 192.168.0.106:14703 > 116.132.235.204:http PA / Raw"
192.168.0.106,116.132.235.204,14703,80,6,"Ether / IP / TCP 192.168.0.106:14703 > 116.132.235.204:http A / Raw"
192.168.0.106,116.132.235.204,14703,80,6,"Ether / IP / TCP 192.168.0.106:14703 > 116.132.235.204:http A / Raw"
192.168.0.106,116.132.235.204,14703,80,6,"Ether / IP / TCP 192.168.0.106:14703 > 116.132.235.204:http PA / Raw"
116.132.235.204,192.168.0.106,80,14703,6,"Ether / IP / TCP 116.132.235.204:http > 192.168.0.106:14703 A"
116.132.235.204,192.168.0.106,80,14703,6,"Ether / IP / TCP 116.132.235.204:http > 192.168.0.106:14703 A"
116.132.235.204,192.168.0.106,80,14703,6,"Ether / IP / TCP 116.132.235.204:http > 192.168.0.106:14703 A"
116.132.235.204,192.168.0.106,80,14703,6,"Ether / IP / TCP 116.132.235.204:http > 192.168.0.106:14703 PA / Raw"
192.168.0.106,116.132.235.204,14703,80,6,"Ether / IP / TCP 192.168.0.106:14703 > 116.132.235.204:http FA"
116.132.235.204,192.168.0.106,80,14703,6,"Ether / IP / TCP 116.132.235.204:http > 192.168.0.106:14703 FA"
192.168.0.106,116.132.235.204,14703,80,6,"Ether / IP / TCP 192.168.0.106:14703 > 116.132.235.204:http A"
116.132.235.204,192.168.0.106,80,14703,6,"Ether / IP / TCP 116.132.235.204:http > 192.168.0.106:14703 A"
192.168.0.106,116.132.235.204,14704,80,6,"Ether / IP / TCP 192.168.0.106:14704 > 116.132.235.204:http S"
116.132.235.204,192.168.0.106,80,14704,6,"Ether / IP / TCP 116.132.235.204:http > 192.168.0.106:14704 SA"
192.168.0.106,116.132.235.204,14704,80,6,"Ether / IP / TCP 192.168.0.106:14704 > 116.132.235.204:http A"
192.168.0.106,116.132.235.204,14704,80,6,"Ether / IP / TCP 192.168.0.106:14704 > 116.132.235.204:http PA / Raw"
192.168.0.106,116.132.235.204,14704,80,6,"Ether / IP / TCP 192.168.0.106:14704 > 116.132.235.204:http A / Raw"
192.168.0.106,116.132.235.204,14704,80,6,"Ether / IP / TCP 192.168.0.106:14704 > 116.132.235.204:http A / Raw"
192.168.0.106,116.132.235.204,14704,80,6,"Ether / IP / TCP 192.168.0.106:14704 > 116.132.235.204:http PA / Raw"
116.132.235.204,192.168.0.106,80,14704,6,"Ether / IP / TCP 116.132.235.204:http > 192.168.0.106:14704 A"
116.132.235.204,192.168.0.106,80,14704,6,"Ether / IP / TCP 116.132.235.204:http > 192.168.0.106:14704 A"
116.132.235.204,192.168.0.106,80,14704,6,"Ether / IP / TCP 116.132.235.204:http > 192.168.0.106:14704 A"
116.132.235.204,192.168.0.106,80,14704,6,"Ether / IP / TCP 116.132.235.204:http > 192.168.0.106:14704 PA / Raw"
192.168.0.106,116.132.235.204,14704,80,6,"Ether / IP / TCP 192.168.0.106:14704 > 116.132.235.204:http FA"
116.132.235.204,192.168.0.106,80,14704,6,"Ether / IP / TCP 116.132.235.204:http > 192.168.0.106:14704 FA"
192.168.0.106,116.132.235.204,14704,80,6,"Ether / IP / TCP 192.168.0.106:14704 > 116.132.235.204:http A"
192.168.0.106,116.132.235.204,14704,80,6,"Ether / IP / TCP 192.168.0.106:14704 > 116.132.235.204:http FA"
192.168.0.106,116.132.235.204,14704,80,6,"Ether / IP / TCP 192.168.0.106:14704 > 116.132.235.204:http FA"
192.168.0.106,116.132.235.204,14705,80,6,"Ether / IP / TCP 192.168.0.106:14705 > 116.132.235.204:http S"
116.132.235.204,192.168.0.106,80,14705,6,"Ether / IP / TCP 116.132.235.204:http > 192.168.0.106:14705 SA"
192.168.0.106,116.132.235.204,14705,80,6,"Ether / IP / TCP 192.168.0.106:14705 > 116.132.235.204:http A"
192.168.0.106,116.132.235.204,14705,80,6,"Ether / IP / TCP 192.168.0.106:14705 > 116.132.235.204:http PA / Raw"
192.168.0.106,116.132.235.204,14705,80,6,"Ether / IP / TCP 192.168.0.106:14705 > 116.132.235.204:http A / Raw"
192.168.0.106,116.132.235.204,14705,80,6,"Ether / IP / TCP 192.168.0.106:14705 > 116.132.235.204:http A / Raw"
192.168.0.106,116.132.235.204,14705,80,6,"Ether / IP / TCP 192.168.0.106:14705 > 116.132.235.204:http PA / Raw"
116.132.235.204,192.168.0.106,80,14705,6,"Ether / IP / TCP 116.132.235.204:http > 192.168.0.106:14705 A"
116.132.235.204,192.168.0.106,80,14705,6,"Ether / IP / TCP 116.132.235.204:http > 192.168.0.106:14705 A"
116.132.235.204,192.168.0.106,80,14705,6,"Ether / IP / TCP 116.132.235.204:http > 192.168.0.106:14705 A"
116.132.235.204,192.168.0.106,80,14705,6,"Ether / IP / TCP 116.132.235.204:http > 192.168.0.106:14705 PA / Raw"
116.132.235.204,192.168.0.106,80,14705,6,"Ether / IP / TCP 116.132.235.204:http > 192.168.0.106:14705 FA"
192.168.0.106,116.132.235.204,14705,80,6,"Ether / IP / TCP 192.168.0.106:14705 > 116.132.235.204:http A"
192.168.0.106,116.132.235.204,14705,80,6,"Ether / IP / TCP 192.168.0.106:14705 > 116.132.235.204:http FA"
116.132.235.204,192.168.0.106,80,14705,6,"Ether / IP / TCP 116.132.235.204:http > 192.168.0.106:14705 A"
192.168.0.106,116.132.235.204,14706,80,6,"Ether / IP / TCP 192.168.0.106:14706 > 116.132.235.204:http S"
116.132.235.204,192.168.0.106,80,14706,6,"Ether / IP / TCP 116.132.235.204:http > 192.168.0.106:14706 SA"
192.168.0.106,116.132.235.204,14706,80,6,"Ether / IP / TCP 192.168.0.106:14706 > 116.132.235.204:http A"
192.168.0.106,116.132.235.204,14706,80,6,"Ether / IP / TCP 192.168.0.106:14706 > 116.132.235.204:http PA / Raw"
192.168.0.106,116.132.235.204,14706,80,6,"Ether / IP / TCP 192.168.0.106:14706 > 116.132.235.204:http A / Raw"
192.168.0.106,116.132.235.204,14706,80,6,"Ether / IP / TCP 192.168.0.106:14706 > 116.132.235.204:http A / Raw"
192.168.0.106,116.132.235.204,14706,80,6,"Ether / IP / TCP 192.168.0.106:14706 > 116.132.235.204:http PA / Raw"
116.132.235.204,192.168.0.106,80,14706,6,"Ether / IP / TCP 116.132.235.204:http > 192.168.0.106:14706 A"
116.132.235.204,192.168.0.106,80,14706,6,"Ether / IP / TCP 116.132.235.204:http > 192.168.0.106:14706 A"
116.132.235.204,192.168.0.106,80,14706,6,"Ether / IP / TCP 116.132.235.204:http > 192.168.0.106:14706 A"
116.132.235.204,192.168.0.106,80,14706,6,"Ether / IP / TCP 116.132.235.204:http > 192.168.0.106:14706 PA / Raw"
116.132.235.204,192.168.0.106,80,14706,6,"Ether / IP / TCP 116.132.235.204:http > 192.168.0.106:14706 FA"
192.168.0.106,116.132.235.204,14706,80,6,"Ether / IP / TCP 192.168.0.106:14706 > 116.132.235.204:http A"
192.168.0.106,116.132.235.204,14706,80,6,"Ether / IP / TCP 192.168.0.106:14706 > 116.132.235.204:http FA"
192.168.0.106,116.132.235.204,14706,80,6,"Ether / IP / TCP 192.168.0.106:14706 > 116.132.235.204:http FA"
192.168.0.104,224.0.0.251,5353,5353,17,"Ether / IP / UDP / DNS Qry ""b'_companion-link._tcp.local.'"" "
0,0,0,0,0,"Ether / IPv6 / UDP / DNS Qry ""b'_companion-link._tcp.local.'"" "
192.168.0.104,224.0.0.251,5353,5353,17,"Ether / IP / UDP / DNS Ans ""[b'model=J517AP']"" "
0,0,0,0,0,"Ether / IPv6 / UDP / DNS Ans ""[b'model=J517AP']"" "
192.168.0.104,224.0.0.251,5353,5353,17,"Ether / IP / UDP / DNS Qry ""b'iPad (305)._rdlink._tcp.local.'"" "
0,0,0,0,0,"Ether / IPv6 / UDP / DNS Qry ""b'iPad (305)._rdlink._tcp.local.'"" "
192.168.0.104,224.0.0.251,5353,5353,17,"Ether / IP / UDP / DNS Qry ""b'iPad-305.local.'"" "
0,0,0,0,0,"Ether / IPv6 / UDP / DNS Qry ""b'iPad-305.local.'"" "
192.168.0.106,116.132.235.204,14704,80,6,"Ether / IP / TCP 192.168.0.106:14704 > 116.132.235.204:http FA"
192.168.0.106,116.132.235.204,14706,80,6,"Ether / IP / TCP 192.168.0.106:14706 > 116.132.235.204:http FA"
192.168.0.104,224.0.0.251,5353,5353,17,"Ether / IP / UDP / DNS Qry ""b'iPad (305)._rdlink._tcp.local.'"" "
0,0,0,0,0,"Ether / IPv6 / UDP / DNS Qry ""b'iPad (305)._rdlink._tcp.local.'"" "
192.168.0.106,116.132.235.204,14707,80,6,"Ether / IP / TCP 192.168.0.106:14707 > 116.132.235.204:http S"
116.132.235.204,192.168.0.106,80,14707,6,"Ether / IP / TCP 116.132.235.204:http > 192.168.0.106:14707 SA"
192.168.0.106,116.132.235.204,14707,80,6,"Ether / IP / TCP 192.168.0.106:14707 > 116.132.235.204:http A"
192.168.0.106,116.132.235.204,14707,80,6,"Ether / IP / TCP 192.168.0.106:14707 > 116.132.235.204:http PA / Raw"
192.168.0.106,116.132.235.204,14707,80,6,"Ether / IP / TCP 192.168.0.106:14707 > 116.132.235.204:http A / Raw"
192.168.0.106,116.132.235.204,14707,80,6,"Ether / IP / TCP 192.168.0.106:14707 > 116.132.235.204:http A / Raw"
192.168.0.106,116.132.235.204,14707,80,6,"Ether / IP / TCP 192.168.0.106:14707 > 116.132.235.204:http PA / Raw"
116.132.235.204,192.168.0.106,80,14707,6,"Ether / IP / TCP 116.132.235.204:http > 192.168.0.106:14707 A"
116.132.235.204,192.168.0.106,80,14707,6,"Ether / IP / TCP 116.132.235.204:http > 192.168.0.106:14707 A"
116.132.235.204,192.168.0.106,80,14707,6,"Ether / IP / TCP 116.132.235.204:http > 192.168.0.106:14707 A"
116.132.235.204,192.168.0.106,80,14707,6,"Ether / IP / TCP 116.132.235.204:http > 192.168.0.106:14707 PA / Raw"
116.132.235.204,192.168.0.106,80,14707,6,"Ether / IP / TCP 116.132.235.204:http > 192.168.0.106:14707 FA"
192.168.0.106,116.132.235.204,14707,80,6,"Ether / IP / TCP 192.168.0.106:14707 > 116.132.235.204:http A"
192.168.0.106,116.132.235.204,14707,80,6,"Ether / IP / TCP 192.168.0.106:14707 > 116.132.235.204:http FA"
192.168.0.104,224.0.0.251,5353,5353,17,"Ether / IP / UDP / DNS Qry ""b'iPad-305.local.'"" "
0,0,0,0,0,"Ether / IPv6 / UDP / DNS Qry ""b'iPad-305.local.'"" "
116.132.235.204,192.168.0.106,80,14707,6,"Ether / IP / TCP 116.132.235.204:http > 192.168.0.106:14707 A"
192.168.0.106,116.132.235.204,14695,80,6,"Ether / IP / TCP 192.168.0.106:14695 > 116.132.235.204:http FA"
192.168.0.104,224.0.0.251,5353,5353,17,"Ether / IP / UDP / DNS Ans ""[b'model=J517AP']"" "
0,0,0,0,0,"Ether / IPv6 / UDP / DNS Ans ""[b'model=J517AP']"" "
192.168.0.104,224.0.0.251,5353,5353,17,"Ether / IP / UDP / DNS Qry ""b'iPad-305.local.'"" "
0,0,0,0,0,"Ether / IPv6 / UDP / DNS Qry ""b'iPad-305.local.'"" "
192.168.0.104,224.0.0.251,5353,5353,17,"Ether / IP / UDP / DNS Ans ""b'_rdlink._tcp.local.'"" "
0,0,0,0,0,"Ether / IPv6 / UDP / DNS Ans ""b'_rdlink._tcp.local.'"" "
192.168.0.104,224.0.0.251,5353,5353,17,"Ether / IP / UDP / DNS Qry ""b'_companion-link._tcp.local.'"" "
0,0,0,0,0,"Ether / IPv6 / UDP / DNS Qry ""b'_companion-link._tcp.local.'"" "
192.168.0.104,224.0.0.251,5353,5353,17,"Ether / IP / UDP / DNS Ans ""fe80::c09:5d3e:ea0f:a477"" "
0,0,0,0,0,"Ether / IPv6 / UDP / DNS Ans ""fe80::c09:5d3e:ea0f:a477"" "
192.168.0.106,116.132.235.204,14706,80,6,"Ether / IP / TCP 192.168.0.106:14706 > 116.132.235.204:http FA"
192.168.0.106,116.132.235.204,14708,80,6,"Ether / IP / TCP 192.168.0.106:14708 > 116.132.235.204:http S"
116.132.235.204,192.168.0.106,80,14708,6,"Ether / IP / TCP 116.132.235.204:http > 192.168.0.106:14708 SA"
192.168.0.106,116.132.235.204,14708,80,6,"Ether / IP / TCP 192.168.0.106:14708 > 116.132.235.204:http A"
192.168.0.106,116.132.235.204,14708,80,6,"Ether / IP / TCP 192.168.0.106:14708 > 116.132.235.204:http PA / Raw"
192.168.0.106,116.132.235.204,14708,80,6,"Ether / IP / TCP 192.168.0.106:14708 > 116.132.235.204:http A / Raw"
192.168.0.106,116.132.235.204,14708,80,6,"Ether / IP / TCP 192.168.0.106:14708 > 116.132.235.204:http A / Raw"
192.168.0.106,116.132.235.204,14708,80,6,"Ether / IP / TCP 192.168.0.106:14708 > 116.132.235.204:http PA / Raw"
116.132.235.204,192.168.0.106,80,14708,6,"Ether / IP / TCP 116.132.235.204:http > 192.168.0.106:14708 A"
116.132.235.204,192.168.0.106,80,14708,6,"Ether / IP / TCP 116.132.235.204:http > 192.168.0.106:14708 A"
192.168.0.104,224.0.0.251,5353,5353,17,"Ether / IP / UDP / DNS Ans ""[b'model=J517AP']"" "
0,0,0,0,0,"Ether / IPv6 / UDP / DNS Ans ""[b'model=J517AP']"" "
116.132.235.204,192.168.0.106,80,14708,6,"Ether / IP / TCP 116.132.235.204:http > 192.168.0.106:14708 A"
116.132.235.204,192.168.0.106,80,14708,6,"Ether / IP / TCP 116.132.235.204:http > 192.168.0.106:14708 PA / Raw"
116.132.235.204,192.168.0.106,80,14708,6,"Ether / IP / TCP 116.132.235.204:http > 192.168.0.106:14708 FA"
192.168.0.106,116.132.235.204,14708,80,6,"Ether / IP / TCP 192.168.0.106:14708 > 116.132.235.204:http A"
192.168.0.106,116.132.235.204,14708,80,6,"Ether / IP / TCP 192.168.0.106:14708 > 116.132.235.204:http FA"
116.132.235.204,192.168.0.106,80,14708,6,"Ether / IP / TCP 116.132.235.204:http > 192.168.0.106:14708 A"
192.168.0.106,116.132.235.204,14709,80,6,"Ether / IP / TCP 192.168.0.106:14709 > 116.132.235.204:http S"
116.132.235.204,192.168.0.106,80,14709,6,"Ether / IP / TCP 116.132.235.204:http > 192.168.0.106:14709 SA"
192.168.0.106,116.132.235.204,14709,80,6,"Ether / IP / TCP 192.168.0.106:14709 > 116.132.235.204:http A"
192.168.0.106,116.132.235.204,14709,80,6,"Ether / IP / TCP 192.168.0.106:14709 > 116.132.235.204:http PA / Raw"
192.168.0.106,116.132.235.204,14709,80,6,"Ether / IP / TCP 192.168.0.106:14709 > 116.132.235.204:http A / Raw"
192.168.0.106,116.132.235.204,14709,80,6,"Ether / IP / TCP 192.168.0.106:14709 > 116.132.235.204:http A / Raw"
192.168.0.106,116.132.235.204,14709,80,6,"Ether / IP / TCP 192.168.0.106:14709 > 116.132.235.204:http PA / Raw"
116.132.235.204,192.168.0.106,80,14709,6,"Ether / IP / TCP 116.132.235.204:http > 192.168.0.106:14709 A"
116.132.235.204,192.168.0.106,80,14709,6,"Ether / IP / TCP 116.132.235.204:http > 192.168.0.106:14709 A"
116.132.235.204,192.168.0.106,80,14709,6,"Ether / IP / TCP 116.132.235.204:http > 192.168.0.106:14709 A"
116.132.235.204,192.168.0.106,80,14709,6,"Ether / IP / TCP 116.132.235.204:http > 192.168.0.106:14709 PA / Raw"
116.132.235.204,192.168.0.106,80,14709,6,"Ether / IP / TCP 116.132.235.204:http > 192.168.0.106:14709 FA"
192.168.0.106,116.132.235.204,14709,80,6,"Ether / IP / TCP 192.168.0.106:14709 > 116.132.235.204:http A"
192.168.0.106,116.132.235.204,14709,80,6,"Ether / IP / TCP 192.168.0.106:14709 > 116.132.235.204:http FA"
116.132.235.204,192.168.0.106,80,14709,6,"Ether / IP / TCP 116.132.235.204:http > 192.168.0.106:14709 A"
192.168.0.106,116.130.230.27,11670,443,6,"Ether / IP / TCP 192.168.0.106:11670 > 116.130.230.27:https PA / Raw"
116.130.230.27,192.168.0.106,443,11670,6,"Ether / IP / TCP 116.130.230.27:https > 192.168.0.106:11670 A / Padding"
116.130.230.27,192.168.0.106,443,11670,6,"Ether / IP / TCP 116.130.230.27:https > 192.168.0.106:11670 PA / Raw"
192.168.0.106,116.130.230.27,11670,443,6,"Ether / IP / TCP 192.168.0.106:11670 > 116.130.230.27:https A"
192.168.0.106,110.242.68.3,14710,80,6,"Ether / IP / TCP 192.168.0.106:14710 > 110.242.68.3:http S"
110.242.68.3,192.168.0.106,80,14710,6,"Ether / IP / TCP 110.242.68.3:http > 192.168.0.106:14710 SA"
192.168.0.106,110.242.68.3,14710,80,6,"Ether / IP / TCP 192.168.0.106:14710 > 110.242.68.3:http A"
192.168.0.106,110.242.68.3,14710,80,6,"Ether / IP / TCP 192.168.0.106:14710 > 110.242.68.3:http FA"
110.242.68.3,192.168.0.106,80,14710,6,"Ether / IP / TCP 110.242.68.3:http > 192.168.0.106:14710 A"
110.242.68.3,192.168.0.106,80,14710,6,"Ether / IP / TCP 110.242.68.3:http > 192.168.0.106:14710 FA"
192.168.0.106,110.242.68.3,14710,80,6,"Ether / IP / TCP 192.168.0.106:14710 > 110.242.68.3:http A"
192.168.0.106,116.132.235.204,14704,80,6,"Ether / IP / TCP 192.168.0.106:14704 > 116.132.235.204:http FA"
192.168.0.104,224.0.0.251,5353,5353,17,"Ether / IP / UDP / DNS Ans ""[b'model=J517AP']"" "
0,0,0,0,0,"Ether / IPv6 / UDP / DNS Ans ""[b'model=J517AP']"" "
192.168.0.106,116.132.235.204,14711,80,6,"Ether / IP / TCP 192.168.0.106:14711 > 116.132.235.204:http S"
116.132.235.204,192.168.0.106,80,14711,6,"Ether / IP / TCP 116.132.235.204:http > 192.168.0.106:14711 SA"
192.168.0.106,116.132.235.204,14711,80,6,"Ether / IP / TCP 192.168.0.106:14711 > 116.132.235.204:http A"
192.168.0.106,116.132.235.204,14711,80,6,"Ether / IP / TCP 192.168.0.106:14711 > 116.132.235.204:http PA / Raw"
192.168.0.106,116.132.235.204,14711,80,6,"Ether / IP / TCP 192.168.0.106:14711 > 116.132.235.204:http A / Raw"
192.168.0.106,116.132.235.204,14711,80,6,"Ether / IP / TCP 192.168.0.106:14711 > 116.132.235.204:http A / Raw"
192.168.0.106,116.132.235.204,14711,80,6,"Ether / IP / TCP 192.168.0.106:14711 > 116.132.235.204:http PA / Raw"
116.132.235.204,192.168.0.106,80,14711,6,"Ether / IP / TCP 116.132.235.204:http > 192.168.0.106:14711 A"
116.132.235.204,192.168.0.106,80,14711,6,"Ether / IP / TCP 116.132.235.204:http > 192.168.0.106:14711 A"
116.132.235.204,192.168.0.106,80,14711,6,"Ether / IP / TCP 116.132.235.204:http > 192.168.0.106:14711 A"
116.132.235.204,192.168.0.106,80,14711,6,"Ether / IP / TCP 116.132.235.204:http > 192.168.0.106:14711 PA / Raw"
116.132.235.204,192.168.0.106,80,14711,6,"Ether / IP / TCP 116.132.235.204:http > 192.168.0.106:14711 FA"
192.168.0.106,116.132.235.204,14711,80,6,"Ether / IP / TCP 192.168.0.106:14711 > 116.132.235.204:http A"
192.168.0.106,116.132.235.204,14711,80,6,"Ether / IP / TCP 192.168.0.106:14711 > 116.132.235.204:http FA"
116.132.235.204,192.168.0.106,80,14711,6,"Ether / IP / TCP 116.132.235.204:http > 192.168.0.106:14711 A"
192.168.0.104,224.0.0.251,5353,5353,17,"Ether / IP / UDP / DNS Qry ""b'_companion-link._tcp.local.'"" "
0,0,0,0,0,"Ether / IPv6 / UDP / DNS Qry ""b'_companion-link._tcp.local.'"" "
192.168.0.106,116.132.235.204,14706,80,6,"Ether / IP / TCP 192.168.0.106:14706 > 116.132.235.204:http FA"
192.168.0.106,116.132.235.204,14712,80,6,"Ether / IP / TCP 192.168.0.106:14712 > 116.132.235.204:http S"
116.132.235.204,192.168.0.106,80,14712,6,"Ether / IP / TCP 116.132.235.204:http > 192.168.0.106:14712 SA"
192.168.0.106,116.132.235.204,14712,80,6,"Ether / IP / TCP 192.168.0.106:14712 > 116.132.235.204:http A"
192.168.0.106,116.132.235.204,14712,80,6,"Ether / IP / TCP 192.168.0.106:14712 > 116.132.235.204:http PA / Raw"
192.168.0.106,116.132.235.204,14712,80,6,"Ether / IP / TCP 192.168.0.106:14712 > 116.132.235.204:http A / Raw"
192.168.0.106,116.132.235.204,14712,80,6,"Ether / IP / TCP 192.168.0.106:14712 > 116.132.235.204:http A / Raw"
192.168.0.106,116.132.235.204,14712,80,6,"Ether / IP / TCP 192.168.0.106:14712 > 116.132.235.204:http PA / Raw"
116.132.235.204,192.168.0.106,80,14712,6,"Ether / IP / TCP 116.132.235.204:http > 192.168.0.106:14712 A"
116.132.235.204,192.168.0.106,80,14712,6,"Ether / IP / TCP 116.132.235.204:http > 192.168.0.106:14712 A"
116.132.235.204,192.168.0.106,80,14712,6,"Ether / IP / TCP 116.132.235.204:http > 192.168.0.106:14712 A"
116.132.235.204,192.168.0.106,80,14712,6,"Ether / IP / TCP 116.132.235.204:http > 192.168.0.106:14712 PA / Raw"
116.132.235.204,192.168.0.106,80,14712,6,"Ether / IP / TCP 116.132.235.204:http > 192.168.0.106:14712 FA"
192.168.0.106,116.132.235.204,14712,80,6,"Ether / IP / TCP 192.168.0.106:14712 > 116.132.235.204:http A"
192.168.0.106,116.132.235.204,14712,80,6,"Ether / IP / TCP 192.168.0.106:14712 > 116.132.235.204:http FA"
192.168.0.106,116.132.235.204,14712,80,6,"Ether / IP / TCP 192.168.0.106:14712 > 116.132.235.204:http FA"
192.168.0.106,116.132.235.204,14712,80,6,"Ether / IP / TCP 192.168.0.106:14712 > 116.132.235.204:http FA"
192.168.0.104,224.0.0.251,5353,5353,17,"Ether / IP / UDP / DNS Ans ""[b'model=J517AP']"" "
0,0,0,0,0,"Ether / IPv6 / UDP / DNS Ans ""[b'model=J517AP']"" "
192.168.0.106,116.132.235.204,14712,80,6,"Ether / IP / TCP 192.168.0.106:14712 > 116.132.235.204:http FA"
192.168.0.106,116.132.235.204,14704,80,6,"Ether / IP / TCP 192.168.0.106:14704 > 116.132.235.204:http FA"
192.168.0.106,220.194.116.51,7287,443,6,"Ether / IP / TCP 192.168.0.106:7287 > 220.194.116.51:https FA"
192.168.0.106,220.194.116.51,14713,443,6,"Ether / IP / TCP 192.168.0.106:14713 > 220.194.116.51:https S"
220.194.116.51,192.168.0.106,443,14713,6,"Ether / IP / TCP 220.194.116.51:https > 192.168.0.106:14713 SA"
192.168.0.106,220.194.116.51,14713,443,6,"Ether / IP / TCP 192.168.0.106:14713 > 220.194.116.51:https A"
192.168.0.106,220.194.116.51,14713,443,6,"Ether / IP / TCP 192.168.0.106:14713 > 220.194.116.51:https PA / Raw"
220.194.116.51,192.168.0.106,443,14713,6,"Ether / IP / TCP 220.194.116.51:https > 192.168.0.106:14713 A"
220.194.116.51,192.168.0.106,443,14713,6,"Ether / IP / TCP 220.194.116.51:https > 192.168.0.106:14713 A / Raw"
220.194.116.51,192.168.0.106,443,14713,6,"Ether / IP / TCP 220.194.116.51:https > 192.168.0.106:14713 PA / Raw"
220.194.116.51,192.168.0.106,443,14713,6,"Ether / IP / TCP 220.194.116.51:https > 192.168.0.106:14713 PA / Raw"
192.168.0.106,220.194.116.51,14713,443,6,"Ether / IP / TCP 192.168.0.106:14713 > 220.194.116.51:https A"
192.168.0.106,220.194.116.51,14713,443,6,"Ether / IP / TCP 192.168.0.106:14713 > 220.194.116.51:https PA / Raw"
220.194.116.51,192.168.0.106,443,14713,6,"Ether / IP / TCP 220.194.116.51:https > 192.168.0.106:14713 A"
220.194.116.51,192.168.0.106,443,14713,6,"Ether / IP / TCP 220.194.116.51:https > 192.168.0.106:14713 PA / Raw"
192.168.0.106,220.194.116.51,14713,443,6,"Ether / IP / TCP 192.168.0.106:14713 > 220.194.116.51:https PA / Raw"
220.194.116.51,192.168.0.106,443,14713,6,"Ether / IP / TCP 220.194.116.51:https > 192.168.0.106:14713 A"
192.168.0.106,220.194.116.51,14713,443,6,"Ether / IP / TCP 192.168.0.106:14713 > 220.194.116.51:https PA / Raw"
220.194.116.51,192.168.0.106,443,14713,6,"Ether / IP / TCP 220.194.116.51:https > 192.168.0.106:14713 A"
220.194.116.51,192.168.0.106,443,14713,6,"Ether / IP / TCP 220.194.116.51:https > 192.168.0.106:14713 PA / Raw"
220.194.116.51,192.168.0.106,443,14713,6,"Ether / IP / TCP 220.194.116.51:https > 192.168.0.106:14713 FPA / Raw"
192.168.0.106,220.194.116.51,14713,443,6,"Ether / IP / TCP 192.168.0.106:14713 > 220.194.116.51:https A"
192.168.0.106,220.194.116.51,7287,443,6,"Ether / IP / TCP 192.168.0.106:7287 > 220.194.116.51:https FA"
192.168.0.106,116.132.235.204,14712,80,6,"Ether / IP / TCP 192.168.0.106:14712 > 116.132.235.204:http FA"
192.168.0.106,116.132.235.204,14706,80,6,"Ether / IP / TCP 192.168.0.106:14706 > 116.132.235.204:http FA"
192.168.0.106,220.194.116.51,7287,443,6,"Ether / IP / TCP 192.168.0.106:7287 > 220.194.116.51:https FA"
116.130.230.27,192.168.0.106,443,11670,6,"Ether / IP / TCP 116.130.230.27:https > 192.168.0.106:11670 PA / Raw"
192.168.0.106,116.130.230.27,11670,443,6,"Ether / IP / TCP 192.168.0.106:11670 > 116.130.230.27:https A"
192.168.0.106,220.194.116.51,7287,443,6,"Ether / IP / TCP 192.168.0.106:7287 > 220.194.116.51:https FA"
192.168.0.106,116.132.235.204,14695,80,6,"Ether / IP / TCP 192.168.0.106:14695 > 116.132.235.204:http RA"
192.168.0.106,13.107.21.239,14519,443,6,"Ether / IP / TCP 192.168.0.106:14519 > 13.107.21.239:https A / Raw"
192.168.0.106,192.168.0.1,52703,53,17,"Ether / IP / UDP / DNS Qry ""b'wpad.www.tendawifi.com.'"" "
192.168.0.1,192.168.0.106,53,52703,17,"Ether / IP / UDP / DNS Ans "
13.107.21.239,192.168.0.106,443,14519,6,"Ether / IP / TCP 13.107.21.239:https > 192.168.0.106:14519 A"
192.168.0.106,192.168.0.1,52703,53,17,"Ether / IP / UDP / DNS Qry ""b'default.exp-tas.com.'"" "
192.168.0.1,192.168.0.106,53,52703,17,"Ether / IP / UDP / DNS Ans ""b'deault-exp-tas-com.e-0014.e-msedge.net.'"" "
192.168.0.106,13.107.5.93,14714,443,6,"Ether / IP / TCP 192.168.0.106:14714 > 13.107.5.93:https S"
13.107.5.93,192.168.0.106,443,14714,6,"Ether / IP / TCP 13.107.5.93:https > 192.168.0.106:14714 SA"
192.168.0.106,13.107.5.93,14714,443,6,"Ether / IP / TCP 192.168.0.106:14714 > 13.107.5.93:https A"
192.168.0.106,13.107.5.93,14714,443,6,"Ether / IP / TCP 192.168.0.106:14714 > 13.107.5.93:https PA / Raw"
13.107.5.93,192.168.0.106,443,14714,6,"Ether / IP / TCP 13.107.5.93:https > 192.168.0.106:14714 A"
13.107.5.93,192.168.0.106,443,14714,6,"Ether / IP / TCP 13.107.5.93:https > 192.168.0.106:14714 A / Raw"
13.107.5.93,192.168.0.106,443,14714,6,"Ether / IP / TCP 13.107.5.93:https > 192.168.0.106:14714 A / Raw"
13.107.5.93,192.168.0.106,443,14714,6,"Ether / IP / TCP 13.107.5.93:https > 192.168.0.106:14714 A / Raw"
13.107.5.93,192.168.0.106,443,14714,6,"Ether / IP / TCP 13.107.5.93:https > 192.168.0.106:14714 PA / Raw"
13.107.5.93,192.168.0.106,443,14714,6,"Ether / IP / TCP 13.107.5.93:https > 192.168.0.106:14714 A / Raw"
192.168.0.106,13.107.5.93,14714,443,6,"Ether / IP / TCP 192.168.0.106:14714 > 13.107.5.93:https A"
192.168.0.106,13.107.5.93,14714,443,6,"Ether / IP / TCP 192.168.0.106:14714 > 13.107.5.93:https A"
192.168.0.106,13.107.5.93,14714,443,6,"Ether / IP / TCP 192.168.0.106:14714 > 13.107.5.93:https PA / Raw"
192.168.0.106,13.107.5.93,14714,443,6,"Ether / IP / TCP 192.168.0.106:14714 > 13.107.5.93:https PA / Raw"
192.168.0.106,13.107.5.93,14714,443,6,"Ether / IP / TCP 192.168.0.106:14714 > 13.107.5.93:https PA / Raw"
13.107.5.93,192.168.0.106,443,14714,6,"Ether / IP / TCP 13.107.5.93:https > 192.168.0.106:14714 A"
13.107.5.93,192.168.0.106,443,14714,6,"Ether / IP / TCP 13.107.5.93:https > 192.168.0.106:14714 A"
13.107.5.93,192.168.0.106,443,14714,6,"Ether / IP / TCP 13.107.5.93:https > 192.168.0.106:14714 PA / Raw"
13.107.5.93,192.168.0.106,443,14714,6,"Ether / IP / TCP 13.107.5.93:https > 192.168.0.106:14714 PA / Raw"
192.168.0.106,13.107.5.93,14714,443,6,"Ether / IP / TCP 192.168.0.106:14714 > 13.107.5.93:https A"
192.168.0.106,13.107.5.93,14714,443,6,"Ether / IP / TCP 192.168.0.106:14714 > 13.107.5.93:https PA / Raw"
13.107.5.93,192.168.0.106,443,14714,6,"Ether / IP / TCP 13.107.5.93:https > 192.168.0.106:14714 PA / Raw"
192.168.0.106,13.107.5.93,14714,443,6,"Ether / IP / TCP 192.168.0.106:14714 > 13.107.5.93:https PA / Raw"
13.107.5.93,192.168.0.106,443,14714,6,"Ether / IP / TCP 13.107.5.93:https > 192.168.0.106:14714 A"
13.107.5.93,192.168.0.106,443,14714,6,"Ether / IP / TCP 13.107.5.93:https > 192.168.0.106:14714 PA / Raw"
192.168.0.106,13.107.5.93,14714,443,6,"Ether / IP / TCP 192.168.0.106:14714 > 13.107.5.93:https A"
192.168.0.106,192.168.0.1,52703,53,17,"Ether / IP / UDP / DNS Qry ""b'update.code.visualstudio.com.'"" "
192.168.0.1,192.168.0.106,53,52703,17,"Ether / IP / UDP / DNS Ans ""b'vscode-update.trafficmanager.net.'"" "
192.168.0.106,20.43.132.130,14715,443,6,"Ether / IP / TCP 192.168.0.106:14715 > 20.43.132.130:https S"
20.43.132.130,192.168.0.106,443,14715,6,"Ether / IP / TCP 20.43.132.130:https > 192.168.0.106:14715 SA"
192.168.0.106,20.43.132.130,14715,443,6,"Ether / IP / TCP 192.168.0.106:14715 > 20.43.132.130:https A"
192.168.0.106,20.43.132.130,14715,443,6,"Ether / IP / TCP 192.168.0.106:14715 > 20.43.132.130:https PA / Raw"
116.130.230.27,192.168.0.106,443,11670,6,"Ether / IP / TCP 116.130.230.27:https > 192.168.0.106:11670 PA / Raw"
192.168.0.106,116.130.230.27,11670,443,6,"Ether / IP / TCP 192.168.0.106:11670 > 116.130.230.27:https A"
20.43.132.130,192.168.0.106,443,14715,6,"Ether / IP / TCP 20.43.132.130:https > 192.168.0.106:14715 A / Raw"
20.43.132.130,192.168.0.106,443,14715,6,"Ether / IP / TCP 20.43.132.130:https > 192.168.0.106:14715 A / Raw"
20.43.132.130,192.168.0.106,443,14715,6,"Ether / IP / TCP 20.43.132.130:https > 192.168.0.106:14715 PA / Raw"
20.43.132.130,192.168.0.106,443,14715,6,"Ether / IP / TCP 20.43.132.130:https > 192.168.0.106:14715 A / Raw"
20.43.132.130,192.168.0.106,443,14715,6,"Ether / IP / TCP 20.43.132.130:https > 192.168.0.106:14715 A / Raw"
192.168.0.106,20.43.132.130,14715,443,6,"Ether / IP / TCP 192.168.0.106:14715 > 20.43.132.130:https A"
192.168.0.106,20.43.132.130,14715,443,6,"Ether / IP / TCP 192.168.0.106:14715 > 20.43.132.130:https A"
192.168.0.106,20.43.132.130,14715,443,6,"Ether / IP / TCP 192.168.0.106:14715 > 20.43.132.130:https A"
192.168.0.106,20.43.132.130,14715,443,6,"Ether / IP / TCP 192.168.0.106:14715 > 20.43.132.130:https PA / Raw"
192.168.0.106,20.43.132.130,14715,443,6,"Ether / IP / TCP 192.168.0.106:14715 > 20.43.132.130:https PA / Raw"
20.43.132.130,192.168.0.106,443,14715,6,"Ether / IP / TCP 20.43.132.130:https > 192.168.0.106:14715 A"
20.43.132.130,192.168.0.106,443,14715,6,"Ether / IP / TCP 20.43.132.130:https > 192.168.0.106:14715 A"
20.43.132.130,192.168.0.106,443,14715,6,"Ether / IP / TCP 20.43.132.130:https > 192.168.0.106:14715 PA / Raw"
20.43.132.130,192.168.0.106,443,14715,6,"Ether / IP / TCP 20.43.132.130:https > 192.168.0.106:14715 PA / Raw"
192.168.0.106,20.43.132.130,14715,443,6,"Ether / IP / TCP 192.168.0.106:14715 > 20.43.132.130:https A"
192.168.0.106,110.242.68.3,14716,80,6,"Ether / IP / TCP 192.168.0.106:14716 > 110.242.68.3:http S"
110.242.68.3,192.168.0.106,80,14716,6,"Ether / IP / TCP 110.242.68.3:http > 192.168.0.106:14716 SA"
192.168.0.106,110.242.68.3,14716,80,6,"Ether / IP / TCP 192.168.0.106:14716 > 110.242.68.3:http A"
192.168.0.106,110.242.68.3,14716,80,6,"Ether / IP / TCP 192.168.0.106:14716 > 110.242.68.3:http FA"
110.242.68.3,192.168.0.106,80,14716,6,"Ether / IP / TCP 110.242.68.3:http > 192.168.0.106:14716 A"
110.242.68.3,192.168.0.106,80,14716,6,"Ether / IP / TCP 110.242.68.3:http > 192.168.0.106:14716 FA"
192.168.0.106,110.242.68.3,14716,80,6,"Ether / IP / TCP 192.168.0.106:14716 > 110.242.68.3:http A"
192.168.0.106,192.168.0.1,52703,53,17,"Ether / IP / UDP / DNS Qry ""b'default.exp-tas.com.'"" "
192.168.0.1,192.168.0.106,53,52703,17,"Ether / IP / UDP / DNS Ans ""13.107.5.93"" "
192.168.0.106,13.107.5.93,14717,443,6,"Ether / IP / TCP 192.168.0.106:14717 > 13.107.5.93:https S"
13.107.5.93,192.168.0.106,443,14717,6,"Ether / IP / TCP 13.107.5.93:https > 192.168.0.106:14717 SA"
192.168.0.106,13.107.5.93,14717,443,6,"Ether / IP / TCP 192.168.0.106:14717 > 13.107.5.93:https A"
192.168.0.106,13.107.5.93,14717,443,6,"Ether / IP / TCP 192.168.0.106:14717 > 13.107.5.93:https PA / Raw"
192.168.0.106,220.194.116.51,7287,443,6,"Ether / IP / TCP 192.168.0.106:7287 > 220.194.116.51:https FA"
13.107.5.93,192.168.0.106,443,14717,6,"Ether / IP / TCP 13.107.5.93:https > 192.168.0.106:14717 A"
