srcip,dstip,sport,dport,proto,data
59.38.123.207,192.168.0.106,45902,9322,6,"Ether / IP / TCP 59.38.123.207:45902 > 192.168.0.106:9322 A"
59.38.123.207,192.168.0.106,45902,9322,6,"Ether / IP / TCP 59.38.123.207:45902 > 192.168.0.106:9322 A"
59.38.123.207,192.168.0.106,45902,9322,6,"Ether / IP / TCP 59.38.123.207:45902 > 192.168.0.106:9322 A"
192.168.0.106,59.38.123.207,8947,45902,6,"Ether / IP / TCP 192.168.0.106:8947 > 59.38.123.207:45902 PA / Raw"
192.168.0.106,59.38.123.207,8947,45902,6,"Ether / IP / TCP 192.168.0.106:8947 > 59.38.123.207:45902 PA / Raw"
59.38.123.207,192.168.0.106,45902,9322,6,"Ether / IP / TCP 59.38.123.207:45902 > 192.168.0.106:9322 A / Raw"
59.38.123.207,192.168.0.106,45902,9322,6,"Ether / IP / TCP 59.38.123.207:45902 > 192.168.0.106:9322 PA / Raw"
59.38.123.207,192.168.0.106,45902,9322,6,"Ether / IP / TCP 59.38.123.207:45902 > 192.168.0.106:9322 A / Raw"
59.38.123.207,192.168.0.106,45902,9322,6,"Ether / IP / TCP 59.38.123.207:45902 > 192.168.0.106:9322 PA / Raw"
59.38.123.207,192.168.0.106,45902,9322,6,"Ether / IP / TCP 59.38.123.207:45902 > 192.168.0.106:9322 A / Raw"
192.168.0.106,59.38.123.207,9322,45902,6,"Ether / IP / TCP 192.168.0.106:9322 > 59.38.123.207:45902 A"
59.38.123.207,192.168.0.106,45902,9322,6,"Ether / IP / TCP 59.38.123.207:45902 > 192.168.0.106:9322 PA / Raw"
192.168.0.106,59.38.123.207,9322,45902,6,"Ether / IP / TCP 192.168.0.106:9322 > 59.38.123.207:45902 A"
192.168.0.106,59.38.123.207,9322,45902,6,"Ether / IP / TCP 192.168.0.106:9322 > 59.38.123.207:45902 PA / Raw"
59.38.123.207,192.168.0.106,45902,8947,6,"Ether / IP / TCP 59.38.123.207:45902 > 192.168.0.106:8947 A / Padding"
59.38.123.207,192.168.0.106,45902,8947,6,"Ether / IP / TCP 59.38.123.207:45902 > 192.168.0.106:8947 A / Padding"
59.38.123.207,192.168.0.106,45902,9322,6,"Ether / IP / TCP 59.38.123.207:45902 > 192.168.0.106:9322 A"
59.38.123.207,192.168.0.106,45902,9322,6,"Ether / IP / TCP 59.38.123.207:45902 > 192.168.0.106:9322 PA / Raw"
192.168.0.106,59.38.123.207,9322,45902,6,"Ether / IP / TCP 192.168.0.106:9322 > 59.38.123.207:45902 PA / Raw"
192.168.0.106,59.38.123.207,9322,45902,6,"Ether / IP / TCP 192.168.0.106:9322 > 59.38.123.207:45902 A / Raw"
192.168.0.106,59.38.123.207,9322,45902,6,"Ether / IP / TCP 192.168.0.106:9322 > 59.38.123.207:45902 PA / Raw"
59.38.123.207,192.168.0.106,45902,9322,6,"Ether / IP / TCP 59.38.123.207:45902 > 192.168.0.106:9322 A"
59.38.123.207,192.168.0.106,45902,9322,6,"Ether / IP / TCP 59.38.123.207:45902 > 192.168.0.106:9322 A / Raw"
59.38.123.207,192.168.0.106,45902,9322,6,"Ether / IP / TCP 59.38.123.207:45902 > 192.168.0.106:9322 PA / Raw"
59.38.123.207,192.168.0.106,45902,9322,6,"Ether / IP / TCP 59.38.123.207:45902 > 192.168.0.106:9322 FA"
192.168.0.106,59.38.123.207,9322,45902,6,"Ether / IP / TCP 192.168.0.106:9322 > 59.38.123.207:45902 A"
192.168.0.106,59.38.123.207,9322,45902,6,"Ether / IP / TCP 192.168.0.106:9322 > 59.38.123.207:45902 FA"
59.38.123.207,192.168.0.106,45902,9322,6,"Ether / IP / TCP 59.38.123.207:45902 > 192.168.0.106:9322 A"
59.38.123.207,192.168.0.106,45902,8947,6,"Ether / IP / TCP 59.38.123.207:45902 > 192.168.0.106:8947 PA / Raw"
59.38.123.207,192.168.0.106,45902,8947,6,"Ether / IP / TCP 59.38.123.207:45902 > 192.168.0.106:8947 PA / Raw"
192.168.0.106,59.38.123.207,8947,45902,6,"Ether / IP / TCP 192.168.0.106:8947 > 59.38.123.207:45902 A"
59.38.123.207,192.168.0.106,45902,9125,6,"Ether / IP / TCP 59.38.123.207:45902 > 192.168.0.106:9125 PA / Raw"
192.168.0.106,59.38.123.207,9125,45902,6,"Ether / IP / TCP 192.168.0.106:9125 > 59.38.123.207:45902 PA / Raw"
59.38.123.207,192.168.0.106,45902,9125,6,"Ether / IP / TCP 59.38.123.207:45902 > 192.168.0.106:9125 A / Padding"
192.168.0.106,116.130.224.46,13282,443,6,"Ether / IP / TCP 192.168.0.106:13282 > 116.130.224.46:https PA / Raw"
192.168.0.106,59.38.123.207,8947,45902,6,"Ether / IP / TCP 192.168.0.106:8947 > 59.38.123.207:45902 PA / Raw"
192.168.0.106,59.38.123.207,8947,45902,6,"Ether / IP / TCP 192.168.0.106:8947 > 59.38.123.207:45902 PA / Raw"
116.130.224.46,192.168.0.106,443,13282,6,"Ether / IP / TCP 116.130.224.46:https > 192.168.0.106:13282 PA / Raw"
192.168.0.106,116.130.224.46,13282,443,6,"Ether / IP / TCP 192.168.0.106:13282 > 116.130.224.46:https PA / Raw"
192.168.0.106,116.132.235.204,9323,80,6,"Ether / IP / TCP 192.168.0.106:9323 > 116.132.235.204:http S"
59.38.123.207,192.168.0.106,45902,8947,6,"Ether / IP / TCP 59.38.123.207:45902 > 192.168.0.106:8947 A / Padding"
59.38.123.207,192.168.0.106,45902,8947,6,"Ether / IP / TCP 59.38.123.207:45902 > 192.168.0.106:8947 A / Padding"
116.132.235.204,192.168.0.106,80,9323,6,"Ether / IP / TCP 116.132.235.204:http > 192.168.0.106:9323 SA"
192.168.0.106,116.132.235.204,9323,80,6,"Ether / IP / TCP 192.168.0.106:9323 > 116.132.235.204:http A"
192.168.0.106,116.132.235.204,9323,80,6,"Ether / IP / TCP 192.168.0.106:9323 > 116.132.235.204:http PA / Raw"
192.168.0.106,116.132.235.204,9323,80,6,"Ether / IP / TCP 192.168.0.106:9323 > 116.132.235.204:http A / Raw"
192.168.0.106,116.132.235.204,9323,80,6,"Ether / IP / TCP 192.168.0.106:9323 > 116.132.235.204:http A / Raw"
192.168.0.106,116.132.235.204,9323,80,6,"Ether / IP / TCP 192.168.0.106:9323 > 116.132.235.204:http PA / Raw"
116.130.224.46,192.168.0.106,443,13282,6,"Ether / IP / TCP 116.130.224.46:https > 192.168.0.106:13282 A / Padding"
192.168.0.106,116.130.224.46,13282,443,6,"Ether / IP / TCP 192.168.0.106:13282 > 116.130.224.46:https PA / Raw"
116.132.235.204,192.168.0.106,80,9323,6,"Ether / IP / TCP 116.132.235.204:http > 192.168.0.106:9323 A"
116.132.235.204,192.168.0.106,80,9323,6,"Ether / IP / TCP 116.132.235.204:http > 192.168.0.106:9323 A"
116.132.235.204,192.168.0.106,80,9323,6,"Ether / IP / TCP 116.132.235.204:http > 192.168.0.106:9323 A"
116.132.235.204,192.168.0.106,80,9323,6,"Ether / IP / TCP 116.132.235.204:http > 192.168.0.106:9323 PA / Raw"
116.132.235.204,192.168.0.106,80,9323,6,"Ether / IP / TCP 116.132.235.204:http > 192.168.0.106:9323 FA"
192.168.0.106,116.132.235.204,9323,80,6,"Ether / IP / TCP 192.168.0.106:9323 > 116.132.235.204:http A"
192.168.0.106,116.132.235.204,9323,80,6,"Ether / IP / TCP 192.168.0.106:9323 > 116.132.235.204:http FA"
116.130.224.46,192.168.0.106,443,13282,6,"Ether / IP / TCP 116.130.224.46:https > 192.168.0.106:13282 PA / Raw"
116.130.224.46,192.168.0.106,443,13282,6,"Ether / IP / TCP 116.130.224.46:https > 192.168.0.106:13282 A / Padding"
116.132.235.204,192.168.0.106,80,9323,6,"Ether / IP / TCP 116.132.235.204:http > 192.168.0.106:9323 A"
192.168.0.106,116.130.224.46,13282,443,6,"Ether / IP / TCP 192.168.0.106:13282 > 116.130.224.46:https A"
192.168.0.106,119.167.131.86,9278,80,6,"Ether / IP / TCP 192.168.0.106:9278 > 119.167.131.86:http FA"
192.168.0.106,119.167.131.94,9273,80,6,"Ether / IP / TCP 192.168.0.106:9273 > 119.167.131.94:http FA"
192.168.0.106,220.194.118.247,9324,80,6,"Ether / IP / TCP 192.168.0.106:9324 > 220.194.118.247:http S"
119.167.131.94,192.168.0.106,80,9273,6,"Ether / IP / TCP 119.167.131.94:http > 192.168.0.106:9273 R"
116.130.224.46,192.168.0.106,443,13282,6,"Ether / IP / TCP 116.130.224.46:https > 192.168.0.106:13282 PA / Raw"
220.194.118.247,192.168.0.106,80,9324,6,"Ether / IP / TCP 220.194.118.247:http > 192.168.0.106:9324 SA"
192.168.0.106,220.194.118.247,9324,80,6,"Ether / IP / TCP 192.168.0.106:9324 > 220.194.118.247:http A"
192.168.0.106,220.194.118.247,9324,80,6,"Ether / IP / TCP 192.168.0.106:9324 > 220.194.118.247:http PA / Raw"
119.167.131.86,192.168.0.106,80,9278,6,"Ether / IP / TCP 119.167.131.86:http > 192.168.0.106:9278 A"
220.194.118.247,192.168.0.106,80,9324,6,"Ether / IP / TCP 220.194.118.247:http > 192.168.0.106:9324 A"
192.168.0.106,220.194.118.247,9324,80,6,"Ether / IP / TCP 192.168.0.106:9324 > 220.194.118.247:http PA / Raw"
192.168.0.106,116.130.224.46,13282,443,6,"Ether / IP / TCP 192.168.0.106:13282 > 116.130.224.46:https A"
220.194.118.247,192.168.0.106,80,9324,6,"Ether / IP / TCP 220.194.118.247:http > 192.168.0.106:9324 A"
59.38.123.207,192.168.0.106,45902,8947,6,"Ether / IP / TCP 59.38.123.207:45902 > 192.168.0.106:8947 PA / Raw"
192.168.0.106,59.38.123.207,8947,45902,6,"Ether / IP / TCP 192.168.0.106:8947 > 59.38.123.207:45902 A"
220.194.118.247,192.168.0.106,80,9324,6,"Ether / IP / TCP 220.194.118.247:http > 192.168.0.106:9324 A / Raw"
220.194.118.247,192.168.0.106,80,9324,6,"Ether / IP / TCP 220.194.118.247:http > 192.168.0.106:9324 PA / Raw"
220.194.118.247,192.168.0.106,80,9324,6,"Ether / IP / TCP 220.194.118.247:http > 192.168.0.106:9324 A / Raw"
192.168.0.106,220.194.118.247,9324,80,6,"Ether / IP / TCP 192.168.0.106:9324 > 220.194.118.247:http A"
220.194.118.247,192.168.0.106,80,9324,6,"Ether / IP / TCP 220.194.118.247:http > 192.168.0.106:9324 PA / Raw"
220.194.118.247,192.168.0.106,80,9324,6,"Ether / IP / TCP 220.194.118.247:http > 192.168.0.106:9324 A / Raw"
192.168.0.106,220.194.118.247,9324,80,6,"Ether / IP / TCP 192.168.0.106:9324 > 220.194.118.247:http A"
220.194.118.247,192.168.0.106,80,9324,6,"Ether / IP / TCP 220.194.118.247:http > 192.168.0.106:9324 PA / Raw"
220.194.118.247,192.168.0.106,80,9324,6,"Ether / IP / TCP 220.194.118.247:http > 192.168.0.106:9324 A / Raw"
220.194.118.247,192.168.0.106,80,9324,6,"Ether / IP / TCP 220.194.118.247:http > 192.168.0.106:9324 PA / Raw"
220.194.118.247,192.168.0.106,80,9324,6,"Ether / IP / TCP 220.194.118.247:http > 192.168.0.106:9324 A / Raw"
220.194.118.247,192.168.0.106,80,9324,6,"Ether / IP / TCP 220.194.118.247:http > 192.168.0.106:9324 PA / Raw"
192.168.0.106,220.194.118.247,9324,80,6,"Ether / IP / TCP 192.168.0.106:9324 > 220.194.118.247:http A"
220.194.118.247,192.168.0.106,80,9324,6,"Ether / IP / TCP 220.194.118.247:http > 192.168.0.106:9324 A / Raw"
220.194.118.247,192.168.0.106,80,9324,6,"Ether / IP / TCP 220.194.118.247:http > 192.168.0.106:9324 PA / Raw"
220.194.118.247,192.168.0.106,80,9324,6,"Ether / IP / TCP 220.194.118.247:http > 192.168.0.106:9324 PA / Raw"
192.168.0.106,220.194.118.247,9324,80,6,"Ether / IP / TCP 192.168.0.106:9324 > 220.194.118.247:http A"
59.38.123.207,192.168.0.106,45902,8947,6,"Ether / IP / TCP 59.38.123.207:45902 > 192.168.0.106:8947 PA / Raw"
192.168.0.106,59.38.123.207,8947,45902,6,"Ether / IP / TCP 192.168.0.106:8947 > 59.38.123.207:45902 A"
192.168.0.104,224.0.0.251,5353,5353,17,"Ether / IP / UDP / DNS Qry ""b'_companion-link._tcp.local.'"" "
0,0,0,0,0,"Ether / IPv6 / UDP / DNS Qry ""b'_companion-link._tcp.local.'"" "
192.168.0.106,116.132.235.204,9325,80,6,"Ether / IP / TCP 192.168.0.106:9325 > 116.132.235.204:http S"
116.132.235.204,192.168.0.106,80,9325,6,"Ether / IP / TCP 116.132.235.204:http > 192.168.0.106:9325 SA"
192.168.0.106,116.132.235.204,9325,80,6,"Ether / IP / TCP 192.168.0.106:9325 > 116.132.235.204:http A"
192.168.0.106,116.132.235.204,9325,80,6,"Ether / IP / TCP 192.168.0.106:9325 > 116.132.235.204:http PA / Raw"
192.168.0.106,116.132.235.204,9325,80,6,"Ether / IP / TCP 192.168.0.106:9325 > 116.132.235.204:http A / Raw"
192.168.0.106,116.132.235.204,9325,80,6,"Ether / IP / TCP 192.168.0.106:9325 > 116.132.235.204:http A / Raw"
192.168.0.106,116.132.235.204,9325,80,6,"Ether / IP / TCP 192.168.0.106:9325 > 116.132.235.204:http PA / Raw"
116.132.235.204,192.168.0.106,80,9325,6,"Ether / IP / TCP 116.132.235.204:http > 192.168.0.106:9325 A"
116.132.235.204,192.168.0.106,80,9325,6,"Ether / IP / TCP 116.132.235.204:http > 192.168.0.106:9325 A"
116.132.235.204,192.168.0.106,80,9325,6,"Ether / IP / TCP 116.132.235.204:http > 192.168.0.106:9325 A"
116.132.235.204,192.168.0.106,80,9325,6,"Ether / IP / TCP 116.132.235.204:http > 192.168.0.106:9325 PA / Raw"
116.132.235.204,192.168.0.106,80,9325,6,"Ether / IP / TCP 116.132.235.204:http > 192.168.0.106:9325 FA"
192.168.0.106,116.132.235.204,9325,80,6,"Ether / IP / TCP 192.168.0.106:9325 > 116.132.235.204:http A"
192.168.0.106,116.132.235.204,9325,80,6,"Ether / IP / TCP 192.168.0.106:9325 > 116.132.235.204:http FA"
116.132.235.204,192.168.0.106,80,9325,6,"Ether / IP / TCP 116.132.235.204:http > 192.168.0.106:9325 A"
192.168.0.106,116.132.235.204,9326,80,6,"Ether / IP / TCP 192.168.0.106:9326 > 116.132.235.204:http S"
116.132.235.204,192.168.0.106,80,9326,6,"Ether / IP / TCP 116.132.235.204:http > 192.168.0.106:9326 SA"
192.168.0.106,116.132.235.204,9326,80,6,"Ether / IP / TCP 192.168.0.106:9326 > 116.132.235.204:http A"
192.168.0.106,116.132.235.204,9326,80,6,"Ether / IP / TCP 192.168.0.106:9326 > 116.132.235.204:http PA / Raw"
192.168.0.106,116.132.235.204,9326,80,6,"Ether / IP / TCP 192.168.0.106:9326 > 116.132.235.204:http A / Raw"
192.168.0.106,116.132.235.204,9326,80,6,"Ether / IP / TCP 192.168.0.106:9326 > 116.132.235.204:http A / Raw"
192.168.0.106,116.132.235.204,9326,80,6,"Ether / IP / TCP 192.168.0.106:9326 > 116.132.235.204:http PA / Raw"
116.132.235.204,192.168.0.106,80,9326,6,"Ether / IP / TCP 116.132.235.204:http > 192.168.0.106:9326 A"
116.132.235.204,192.168.0.106,80,9326,6,"Ether / IP / TCP 116.132.235.204:http > 192.168.0.106:9326 A"
116.132.235.204,192.168.0.106,80,9326,6,"Ether / IP / TCP 116.132.235.204:http > 192.168.0.106:9326 A"
116.132.235.204,192.168.0.106,80,9326,6,"Ether / IP / TCP 116.132.235.204:http > 192.168.0.106:9326 PA / Raw"
116.132.235.204,192.168.0.106,80,9326,6,"Ether / IP / TCP 116.132.235.204:http > 192.168.0.106:9326 FA"
192.168.0.106,116.132.235.204,9326,80,6,"Ether / IP / TCP 192.168.0.106:9326 > 116.132.235.204:http A"
192.168.0.106,116.132.235.204,9326,80,6,"Ether / IP / TCP 192.168.0.106:9326 > 116.132.235.204:http FA"
116.132.235.204,192.168.0.106,80,9326,6,"Ether / IP / TCP 116.132.235.204:http > 192.168.0.106:9326 A"
192.168.0.104,224.0.0.251,5353,5353,17,"Ether / IP / UDP / DNS Qry ""b'_companion-link._tcp.local.'"" "
0,0,0,0,0,"Ether / IPv6 / UDP / DNS Qry ""b'_companion-link._tcp.local.'"" "
192.168.0.106,116.132.235.204,9327,80,6,"Ether / IP / TCP 192.168.0.106:9327 > 116.132.235.204:http S"
116.132.235.204,192.168.0.106,80,9327,6,"Ether / IP / TCP 116.132.235.204:http > 192.168.0.106:9327 SA"
192.168.0.106,116.132.235.204,9327,80,6,"Ether / IP / TCP 192.168.0.106:9327 > 116.132.235.204:http A"
192.168.0.106,116.132.235.204,9327,80,6,"Ether / IP / TCP 192.168.0.106:9327 > 116.132.235.204:http PA / Raw"
192.168.0.106,116.132.235.204,9327,80,6,"Ether / IP / TCP 192.168.0.106:9327 > 116.132.235.204:http A / Raw"
192.168.0.106,116.132.235.204,9327,80,6,"Ether / IP / TCP 192.168.0.106:9327 > 116.132.235.204:http A / Raw"
192.168.0.106,116.132.235.204,9327,80,6,"Ether / IP / TCP 192.168.0.106:9327 > 116.132.235.204:http PA / Raw"
116.132.235.204,192.168.0.106,80,9327,6,"Ether / IP / TCP 116.132.235.204:http > 192.168.0.106:9327 A"
116.132.235.204,192.168.0.106,80,9327,6,"Ether / IP / TCP 116.132.235.204:http > 192.168.0.106:9327 A"
116.132.235.204,192.168.0.106,80,9327,6,"Ether / IP / TCP 116.132.235.204:http > 192.168.0.106:9327 A"
116.132.235.204,192.168.0.106,80,9327,6,"Ether / IP / TCP 116.132.235.204:http > 192.168.0.106:9327 PA / Raw"
116.132.235.204,192.168.0.106,80,9327,6,"Ether / IP / TCP 116.132.235.204:http > 192.168.0.106:9327 FA"
192.168.0.106,116.132.235.204,9327,80,6,"Ether / IP / TCP 192.168.0.106:9327 > 116.132.235.204:http A"
192.168.0.106,116.132.235.204,9327,80,6,"Ether / IP / TCP 192.168.0.106:9327 > 116.132.235.204:http FA"
116.132.235.204,192.168.0.106,80,9327,6,"Ether / IP / TCP 116.132.235.204:http > 192.168.0.106:9327 A"
116.130.224.46,192.168.0.106,443,13282,6,"Ether / IP / TCP 116.130.224.46:https > 192.168.0.106:13282 PA / Raw"
192.168.0.106,116.130.224.46,13282,443,6,"Ether / IP / TCP 192.168.0.106:13282 > 116.130.224.46:https PA / Raw"
192.168.0.106,110.242.68.3,9328,80,6,"Ether / IP / TCP 192.168.0.106:9328 > 110.242.68.3:http S"
116.130.224.46,192.168.0.106,443,13282,6,"Ether / IP / TCP 116.130.224.46:https > 192.168.0.106:13282 A / Padding"
110.242.68.3,192.168.0.106,80,9328,6,"Ether / IP / TCP 110.242.68.3:http > 192.168.0.106:9328 SA"
192.168.0.106,110.242.68.3,9328,80,6,"Ether / IP / TCP 192.168.0.106:9328 > 110.242.68.3:http A"
192.168.0.106,110.242.68.3,9328,80,6,"Ether / IP / TCP 192.168.0.106:9328 > 110.242.68.3:http FA"
116.130.224.46,192.168.0.106,443,13282,6,"Ether / IP / TCP 116.130.224.46:https > 192.168.0.106:13282 PA / Raw"
110.242.68.3,192.168.0.106,80,9328,6,"Ether / IP / TCP 110.242.68.3:http > 192.168.0.106:9328 A"
110.242.68.3,192.168.0.106,80,9328,6,"Ether / IP / TCP 110.242.68.3:http > 192.168.0.106:9328 FA"
192.168.0.106,110.242.68.3,9328,80,6,"Ether / IP / TCP 192.168.0.106:9328 > 110.242.68.3:http A"
192.168.0.106,116.130.224.46,13282,443,6,"Ether / IP / TCP 192.168.0.106:13282 > 116.130.224.46:https A"
192.168.0.106,192.168.0.1,61855,53,17,"Ether / IP / UDP / DNS Qry ""b'v.streaming.qq.com.'"" "
192.168.0.1,192.168.0.106,53,61855,17,"Ether / IP / UDP / DNS Ans ""b'ins-k6pvraen.ias.tencent-cloud.net.'"" "
192.168.0.106,116.132.235.204,9329,80,6,"Ether / IP / TCP 192.168.0.106:9329 > 116.132.235.204:http S"
116.132.235.204,192.168.0.106,80,9329,6,"Ether / IP / TCP 116.132.235.204:http > 192.168.0.106:9329 SA"
192.168.0.106,116.132.235.204,9329,80,6,"Ether / IP / TCP 192.168.0.106:9329 > 116.132.235.204:http A"
192.168.0.106,116.132.235.204,9329,80,6,"Ether / IP / TCP 192.168.0.106:9329 > 116.132.235.204:http PA / Raw"
192.168.0.106,116.132.235.204,9329,80,6,"Ether / IP / TCP 192.168.0.106:9329 > 116.132.235.204:http A / Raw"
192.168.0.106,116.132.235.204,9329,80,6,"Ether / IP / TCP 192.168.0.106:9329 > 116.132.235.204:http A / Raw"
192.168.0.106,116.132.235.204,9329,80,6,"Ether / IP / TCP 192.168.0.106:9329 > 116.132.235.204:http PA / Raw"
116.132.235.204,192.168.0.106,80,9329,6,"Ether / IP / TCP 116.132.235.204:http > 192.168.0.106:9329 A"
116.132.235.204,192.168.0.106,80,9329,6,"Ether / IP / TCP 116.132.235.204:http > 192.168.0.106:9329 A"
116.132.235.204,192.168.0.106,80,9329,6,"Ether / IP / TCP 116.132.235.204:http > 192.168.0.106:9329 A"
116.132.235.204,192.168.0.106,80,9329,6,"Ether / IP / TCP 116.132.235.204:http > 192.168.0.106:9329 PA / Raw"
116.132.235.204,192.168.0.106,80,9329,6,"Ether / IP / TCP 116.132.235.204:http > 192.168.0.106:9329 FA"
192.168.0.106,116.132.235.204,9329,80,6,"Ether / IP / TCP 192.168.0.106:9329 > 116.132.235.204:http A"
192.168.0.106,116.132.235.204,9329,80,6,"Ether / IP / TCP 192.168.0.106:9329 > 116.132.235.204:http FA"
116.132.235.204,192.168.0.106,80,9329,6,"Ether / IP / TCP 116.132.235.204:http > 192.168.0.106:9329 A"
192.168.0.106,116.132.235.204,9330,80,6,"Ether / IP / TCP 192.168.0.106:9330 > 116.132.235.204:http S"
116.132.235.204,192.168.0.106,80,9330,6,"Ether / IP / TCP 116.132.235.204:http > 192.168.0.106:9330 SA"
192.168.0.106,116.132.235.204,9330,80,6,"Ether / IP / TCP 192.168.0.106:9330 > 116.132.235.204:http A"
192.168.0.106,116.132.235.204,9330,80,6,"Ether / IP / TCP 192.168.0.106:9330 > 116.132.235.204:http PA / Raw"
192.168.0.106,116.132.235.204,9330,80,6,"Ether / IP / TCP 192.168.0.106:9330 > 116.132.235.204:http A / Raw"
192.168.0.106,116.132.235.204,9330,80,6,"Ether / IP / TCP 192.168.0.106:9330 > 116.132.235.204:http A / Raw"
192.168.0.106,116.132.235.204,9330,80,6,"Ether / IP / TCP 192.168.0.106:9330 > 116.132.235.204:http PA / Raw"
116.132.235.204,192.168.0.106,80,9330,6,"Ether / IP / TCP 116.132.235.204:http > 192.168.0.106:9330 A"
116.132.235.204,192.168.0.106,80,9330,6,"Ether / IP / TCP 116.132.235.204:http > 192.168.0.106:9330 A"
116.132.235.204,192.168.0.106,80,9330,6,"Ether / IP / TCP 116.132.235.204:http > 192.168.0.106:9330 A"
116.132.235.204,192.168.0.106,80,9330,6,"Ether / IP / TCP 116.132.235.204:http > 192.168.0.106:9330 PA / Raw"
116.132.235.204,192.168.0.106,80,9330,6,"Ether / IP / TCP 116.132.235.204:http > 192.168.0.106:9330 FA"
192.168.0.106,116.132.235.204,9330,80,6,"Ether / IP / TCP 192.168.0.106:9330 > 116.132.235.204:http A"
192.168.0.106,116.132.235.204,9330,80,6,"Ether / IP / TCP 192.168.0.106:9330 > 116.132.235.204:http FA"
192.168.0.106,59.38.123.207,9173,45902,6,"Ether / IP / TCP 192.168.0.106:9173 > 59.38.123.207:45902 A / Raw"
116.132.235.204,192.168.0.106,80,9330,6,"Ether / IP / TCP 116.132.235.204:http > 192.168.0.106:9330 A"
59.38.123.207,192.168.0.106,45902,9173,6,"Ether / IP / TCP 59.38.123.207:45902 > 192.168.0.106:9173 A"
192.168.0.106,59.38.123.207,9169,45902,6,"Ether / IP / TCP 192.168.0.106:9169 > 59.38.123.207:45902 A / Raw"
59.38.123.207,192.168.0.106,45902,9169,6,"Ether / IP / TCP 59.38.123.207:45902 > 192.168.0.106:9169 A"
52.108.46.20,192.168.0.106,443,1285,6,"Ether / IP / TCP 52.108.46.20:https > 192.168.0.106:1285 PA / Raw"
192.168.0.106,52.108.46.20,1285,443,6,"Ether / IP / TCP 192.168.0.106:1285 > 52.108.46.20:https A"
192.168.0.104,224.0.0.251,5353,5353,17,"Ether / IP / UDP / DNS Qry ""b'_companion-link._tcp.local.'"" "
0,0,0,0,0,"Ether / IPv6 / UDP / DNS Qry ""b'_companion-link._tcp.local.'"" "
192.168.0.106,116.132.235.204,9331,80,6,"Ether / IP / TCP 192.168.0.106:9331 > 116.132.235.204:http S"
116.132.235.204,192.168.0.106,80,9331,6,"Ether / IP / TCP 116.132.235.204:http > 192.168.0.106:9331 SA"
192.168.0.106,116.132.235.204,9331,80,6,"Ether / IP / TCP 192.168.0.106:9331 > 116.132.235.204:http A"
192.168.0.106,116.132.235.204,9331,80,6,"Ether / IP / TCP 192.168.0.106:9331 > 116.132.235.204:http PA / Raw"
192.168.0.106,116.132.235.204,9331,80,6,"Ether / IP / TCP 192.168.0.106:9331 > 116.132.235.204:http A / Raw"
192.168.0.106,116.132.235.204,9331,80,6,"Ether / IP / TCP 192.168.0.106:9331 > 116.132.235.204:http A / Raw"
192.168.0.106,116.132.235.204,9331,80,6,"Ether / IP / TCP 192.168.0.106:9331 > 116.132.235.204:http PA / Raw"
116.132.235.204,192.168.0.106,80,9331,6,"Ether / IP / TCP 116.132.235.204:http > 192.168.0.106:9331 A"
116.132.235.204,192.168.0.106,80,9331,6,"Ether / IP / TCP 116.132.235.204:http > 192.168.0.106:9331 A"
116.132.235.204,192.168.0.106,80,9331,6,"Ether / IP / TCP 116.132.235.204:http > 192.168.0.106:9331 A"
116.132.235.204,192.168.0.106,80,9331,6,"Ether / IP / TCP 116.132.235.204:http > 192.168.0.106:9331 PA / Raw"
116.132.235.204,192.168.0.106,80,9331,6,"Ether / IP / TCP 116.132.235.204:http > 192.168.0.106:9331 FA"
192.168.0.106,116.132.235.204,9331,80,6,"Ether / IP / TCP 192.168.0.106:9331 > 116.132.235.204:http A"
192.168.0.106,116.132.235.204,9331,80,6,"Ether / IP / TCP 192.168.0.106:9331 > 116.132.235.204:http FA"
116.132.235.204,192.168.0.106,80,9331,6,"Ether / IP / TCP 116.132.235.204:http > 192.168.0.106:9331 A"
192.168.0.106,59.38.123.207,9333,45902,6,"Ether / IP / TCP 192.168.0.106:9333 > 59.38.123.207:45902 S"
59.38.123.207,192.168.0.106,45902,9333,6,"Ether / IP / TCP 59.38.123.207:45902 > 192.168.0.106:9333 SA"
192.168.0.106,59.38.123.207,9333,45902,6,"Ether / IP / TCP 192.168.0.106:9333 > 59.38.123.207:45902 A"
192.168.0.106,59.38.123.207,9333,45902,6,"Ether / IP / TCP 192.168.0.106:9333 > 59.38.123.207:45902 PA / Raw"
192.168.0.106,59.38.123.207,9333,45902,6,"Ether / IP / TCP 192.168.0.106:9333 > 59.38.123.207:45902 PA / Raw"
192.168.0.106,59.38.123.207,9333,45902,6,"Ether / IP / TCP 192.168.0.106:9333 > 59.38.123.207:45902 PA / Raw"
59.38.123.207,192.168.0.106,45902,9333,6,"Ether / IP / TCP 59.38.123.207:45902 > 192.168.0.106:9333 A"
59.38.123.207,192.168.0.106,45902,9333,6,"Ether / IP / TCP 59.38.123.207:45902 > 192.168.0.106:9333 A"
59.38.123.207,192.168.0.106,45902,9333,6,"Ether / IP / TCP 59.38.123.207:45902 > 192.168.0.106:9333 A"
59.38.123.207,192.168.0.106,45902,9333,6,"Ether / IP / TCP 59.38.123.207:45902 > 192.168.0.106:9333 A / Raw"
59.38.123.207,192.168.0.106,45902,9333,6,"Ether / IP / TCP 59.38.123.207:45902 > 192.168.0.106:9333 PA / Raw"
59.38.123.207,192.168.0.106,45902,9333,6,"Ether / IP / TCP 59.38.123.207:45902 > 192.168.0.106:9333 A / Raw"
59.38.123.207,192.168.0.106,45902,9333,6,"Ether / IP / TCP 59.38.123.207:45902 > 192.168.0.106:9333 PA / Raw"
59.38.123.207,192.168.0.106,45902,9333,6,"Ether / IP / TCP 59.38.123.207:45902 > 192.168.0.106:9333 A / Raw"
59.38.123.207,192.168.0.106,45902,9333,6,"Ether / IP / TCP 59.38.123.207:45902 > 192.168.0.106:9333 PA / Raw"
192.168.0.106,59.38.123.207,9333,45902,6,"Ether / IP / TCP 192.168.0.106:9333 > 59.38.123.207:45902 A"
192.168.0.106,59.38.123.207,9333,45902,6,"Ether / IP / TCP 192.168.0.106:9333 > 59.38.123.207:45902 PA / Raw"
59.38.123.207,192.168.0.106,45902,9333,6,"Ether / IP / TCP 59.38.123.207:45902 > 192.168.0.106:9333 PA / Raw"
192.168.0.106,59.38.123.207,9333,45902,6,"Ether / IP / TCP 192.168.0.106:9333 > 59.38.123.207:45902 A"
192.168.0.106,116.132.235.204,9334,80,6,"Ether / IP / TCP 192.168.0.106:9334 > 116.132.235.204:http S"
192.168.0.106,119.3.178.178,12190,21111,6,"Ether / IP / TCP 192.168.0.106:12190 > 119.3.178.178:21111 A / Raw"
116.132.235.204,192.168.0.106,80,9334,6,"Ether / IP / TCP 116.132.235.204:http > 192.168.0.106:9334 SA"
192.168.0.106,116.132.235.204,9334,80,6,"Ether / IP / TCP 192.168.0.106:9334 > 116.132.235.204:http A"
192.168.0.106,116.132.235.204,9334,80,6,"Ether / IP / TCP 192.168.0.106:9334 > 116.132.235.204:http PA / Raw"
192.168.0.106,116.132.235.204,9334,80,6,"Ether / IP / TCP 192.168.0.106:9334 > 116.132.235.204:http A / Raw"
192.168.0.106,116.132.235.204,9334,80,6,"Ether / IP / TCP 192.168.0.106:9334 > 116.132.235.204:http A / Raw"
192.168.0.106,116.132.235.204,9334,80,6,"Ether / IP / TCP 192.168.0.106:9334 > 116.132.235.204:http PA / Raw"
119.3.178.178,192.168.0.106,21111,12190,6,"Ether / IP / TCP 119.3.178.178:21111 > 192.168.0.106:12190 A"
116.132.235.204,192.168.0.106,80,9334,6,"Ether / IP / TCP 116.132.235.204:http > 192.168.0.106:9334 A"
116.132.235.204,192.168.0.106,80,9334,6,"Ether / IP / TCP 116.132.235.204:http > 192.168.0.106:9334 A"
116.132.235.204,192.168.0.106,80,9334,6,"Ether / IP / TCP 116.132.235.204:http > 192.168.0.106:9334 A"
116.132.235.204,192.168.0.106,80,9334,6,"Ether / IP / TCP 116.132.235.204:http > 192.168.0.106:9334 PA / Raw"
116.132.235.204,192.168.0.106,80,9334,6,"Ether / IP / TCP 116.132.235.204:http > 192.168.0.106:9334 FA"
192.168.0.106,116.132.235.204,9334,80,6,"Ether / IP / TCP 192.168.0.106:9334 > 116.132.235.204:http A"
192.168.0.106,116.132.235.204,9334,80,6,"Ether / IP / TCP 192.168.0.106:9334 > 116.132.235.204:http FA"
192.168.0.106,116.132.235.204,9334,80,6,"Ether / IP / TCP 192.168.0.106:9334 > 116.132.235.204:http FA"
192.168.0.106,116.132.235.204,9334,80,6,"Ether / IP / TCP 192.168.0.106:9334 > 116.132.235.204:http FA"
192.168.0.106,116.132.235.204,9335,80,6,"Ether / IP / TCP 192.168.0.106:9335 > 116.132.235.204:http S"
116.132.235.204,192.168.0.106,80,9335,6,"Ether / IP / TCP 116.132.235.204:http > 192.168.0.106:9335 SA"
192.168.0.106,116.132.235.204,9335,80,6,"Ether / IP / TCP 192.168.0.106:9335 > 116.132.235.204:http A"
192.168.0.106,116.132.235.204,9335,80,6,"Ether / IP / TCP 192.168.0.106:9335 > 116.132.235.204:http PA / Raw"
192.168.0.106,116.132.235.204,9335,80,6,"Ether / IP / TCP 192.168.0.106:9335 > 116.132.235.204:http A / Raw"
192.168.0.106,116.132.235.204,9335,80,6,"Ether / IP / TCP 192.168.0.106:9335 > 116.132.235.204:http A / Raw"
192.168.0.106,116.132.235.204,9335,80,6,"Ether / IP / TCP 192.168.0.106:9335 > 116.132.235.204:http PA / Raw"
116.132.235.204,192.168.0.106,80,9335,6,"Ether / IP / TCP 116.132.235.204:http > 192.168.0.106:9335 A"
116.132.235.204,192.168.0.106,80,9335,6,"Ether / IP / TCP 116.132.235.204:http > 192.168.0.106:9335 A"
116.132.235.204,192.168.0.106,80,9335,6,"Ether / IP / TCP 116.132.235.204:http > 192.168.0.106:9335 A"
116.132.235.204,192.168.0.106,80,9335,6,"Ether / IP / TCP 116.132.235.204:http > 192.168.0.106:9335 PA / Raw"
116.132.235.204,192.168.0.106,80,9335,6,"Ether / IP / TCP 116.132.235.204:http > 192.168.0.106:9335 FA"
192.168.0.106,116.132.235.204,9335,80,6,"Ether / IP / TCP 192.168.0.106:9335 > 116.132.235.204:http A"
192.168.0.106,116.132.235.204,9335,80,6,"Ether / IP / TCP 192.168.0.106:9335 > 116.132.235.204:http FA"
116.132.235.204,192.168.0.106,80,9335,6,"Ether / IP / TCP 116.132.235.204:http > 192.168.0.106:9335 A"
192.168.0.106,116.132.235.204,9336,80,6,"Ether / IP / TCP 192.168.0.106:9336 > 116.132.235.204:http S"
116.132.235.204,192.168.0.106,80,9336,6,"Ether / IP / TCP 116.132.235.204:http > 192.168.0.106:9336 SA"
192.168.0.106,116.132.235.204,9336,80,6,"Ether / IP / TCP 192.168.0.106:9336 > 116.132.235.204:http A"
192.168.0.106,116.132.235.204,9336,80,6,"Ether / IP / TCP 192.168.0.106:9336 > 116.132.235.204:http PA / Raw"
192.168.0.106,116.132.235.204,9336,80,6,"Ether / IP / TCP 192.168.0.106:9336 > 116.132.235.204:http A / Raw"
192.168.0.106,116.132.235.204,9336,80,6,"Ether / IP / TCP 192.168.0.106:9336 > 116.132.235.204:http A / Raw"
192.168.0.106,116.132.235.204,9336,80,6,"Ether / IP / TCP 192.168.0.106:9336 > 116.132.235.204:http PA / Raw"
116.132.235.204,192.168.0.106,80,9336,6,"Ether / IP / TCP 116.132.235.204:http > 192.168.0.106:9336 A"
116.132.235.204,192.168.0.106,80,9336,6,"Ether / IP / TCP 116.132.235.204:http > 192.168.0.106:9336 A"
116.132.235.204,192.168.0.106,80,9336,6,"Ether / IP / TCP 116.132.235.204:http > 192.168.0.106:9336 A"
116.132.235.204,192.168.0.106,80,9336,6,"Ether / IP / TCP 116.132.235.204:http > 192.168.0.106:9336 PA / Raw"
116.132.235.204,192.168.0.106,80,9336,6,"Ether / IP / TCP 116.132.235.204:http > 192.168.0.106:9336 FA"
192.168.0.106,116.132.235.204,9336,80,6,"Ether / IP / TCP 192.168.0.106:9336 > 116.132.235.204:http A"
192.168.0.106,116.132.235.204,9336,80,6,"Ether / IP / TCP 192.168.0.106:9336 > 116.132.235.204:http FA"
192.168.0.106,116.132.235.204,9336,80,6,"Ether / IP / TCP 192.168.0.106:9336 > 116.132.235.204:http FA"
192.168.0.106,116.132.235.204,9334,80,6,"Ether / IP / TCP 192.168.0.106:9334 > 116.132.235.204:http FA"
192.168.0.106,116.132.235.204,9336,80,6,"Ether / IP / TCP 192.168.0.106:9336 > 116.132.235.204:http FA"
192.168.0.106,116.132.235.204,9337,80,6,"Ether / IP / TCP 192.168.0.106:9337 > 116.132.235.204:http S"
116.132.235.204,192.168.0.106,80,9337,6,"Ether / IP / TCP 116.132.235.204:http > 192.168.0.106:9337 SA"
192.168.0.106,116.132.235.204,9337,80,6,"Ether / IP / TCP 192.168.0.106:9337 > 116.132.235.204:http A"
192.168.0.106,116.132.235.204,9337,80,6,"Ether / IP / TCP 192.168.0.106:9337 > 116.132.235.204:http PA / Raw"
192.168.0.106,116.132.235.204,9337,80,6,"Ether / IP / TCP 192.168.0.106:9337 > 116.132.235.204:http A / Raw"
192.168.0.106,116.132.235.204,9337,80,6,"Ether / IP / TCP 192.168.0.106:9337 > 116.132.235.204:http A / Raw"
192.168.0.106,116.132.235.204,9337,80,6,"Ether / IP / TCP 192.168.0.106:9337 > 116.132.235.204:http PA / Raw"
116.132.235.204,192.168.0.106,80,9337,6,"Ether / IP / TCP 116.132.235.204:http > 192.168.0.106:9337 A"
116.132.235.204,192.168.0.106,80,9337,6,"Ether / IP / TCP 116.132.235.204:http > 192.168.0.106:9337 A"
116.132.235.204,192.168.0.106,80,9337,6,"Ether / IP / TCP 116.132.235.204:http > 192.168.0.106:9337 A"
116.132.235.204,192.168.0.106,80,9337,6,"Ether / IP / TCP 116.132.235.204:http > 192.168.0.106:9337 PA / Raw"
116.132.235.204,192.168.0.106,80,9337,6,"Ether / IP / TCP 116.132.235.204:http > 192.168.0.106:9337 FA"
192.168.0.106,116.132.235.204,9337,80,6,"Ether / IP / TCP 192.168.0.106:9337 > 116.132.235.204:http A"
192.168.0.106,116.132.235.204,9337,80,6,"Ether / IP / TCP 192.168.0.106:9337 > 116.132.235.204:http FA"
116.132.235.204,192.168.0.106,80,9337,6,"Ether / IP / TCP 116.132.235.204:http > 192.168.0.106:9337 A"
192.168.0.106,116.130.229.126,11219,14000,6,"Ether / IP / TCP 192.168.0.106:11219 > 116.130.229.126:14000 PA / Raw"
116.130.229.126,192.168.0.106,14000,11219,6,"Ether / IP / TCP 116.130.229.126:14000 > 192.168.0.106:11219 PA / Raw"
192.168.0.106,116.130.229.126,11219,14000,6,"Ether / IP / TCP 192.168.0.106:11219 > 116.130.229.126:14000 A"
192.168.0.106,116.132.235.204,9336,80,6,"Ether / IP / TCP 192.168.0.106:9336 > 116.132.235.204:http FA"
192.168.0.106,116.132.235.204,9338,80,6,"Ether / IP / TCP 192.168.0.106:9338 > 116.132.235.204:http S"
116.132.235.204,192.168.0.106,80,9338,6,"Ether / IP / TCP 116.132.235.204:http > 192.168.0.106:9338 SA"
192.168.0.106,116.132.235.204,9338,80,6,"Ether / IP / TCP 192.168.0.106:9338 > 116.132.235.204:http A"
192.168.0.106,116.132.235.204,9338,80,6,"Ether / IP / TCP 192.168.0.106:9338 > 116.132.235.204:http PA / Raw"
192.168.0.106,116.132.235.204,9338,80,6,"Ether / IP / TCP 192.168.0.106:9338 > 116.132.235.204:http A / Raw"
192.168.0.106,116.132.235.204,9338,80,6,"Ether / IP / TCP 192.168.0.106:9338 > 116.132.235.204:http A / Raw"
192.168.0.106,116.132.235.204,9338,80,6,"Ether / IP / TCP 192.168.0.106:9338 > 116.132.235.204:http PA / Raw"
116.132.235.204,192.168.0.106,80,9338,6,"Ether / IP / TCP 116.132.235.204:http > 192.168.0.106:9338 A"
116.132.235.204,192.168.0.106,80,9338,6,"Ether / IP / TCP 116.132.235.204:http > 192.168.0.106:9338 A"
116.132.235.204,192.168.0.106,80,9338,6,"Ether / IP / TCP 116.132.235.204:http > 192.168.0.106:9338 A"
116.132.235.204,192.168.0.106,80,9338,6,"Ether / IP / TCP 116.132.235.204:http > 192.168.0.106:9338 PA / Raw"
116.132.235.204,192.168.0.106,80,9338,6,"Ether / IP / TCP 116.132.235.204:http > 192.168.0.106:9338 FA"
192.168.0.106,116.132.235.204,9338,80,6,"Ether / IP / TCP 192.168.0.106:9338 > 116.132.235.204:http A"
192.168.0.106,116.132.235.204,9338,80,6,"Ether / IP / TCP 192.168.0.106:9338 > 116.132.235.204:http FA"
116.132.235.204,192.168.0.106,80,9338,6,"Ether / IP / TCP 116.132.235.204:http > 192.168.0.106:9338 A"
192.168.0.106,116.132.235.204,9339,80,6,"Ether / IP / TCP 192.168.0.106:9339 > 116.132.235.204:http S"
116.132.235.204,192.168.0.106,80,9339,6,"Ether / IP / TCP 116.132.235.204:http > 192.168.0.106:9339 SA"
192.168.0.106,116.132.235.204,9339,80,6,"Ether / IP / TCP 192.168.0.106:9339 > 116.132.235.204:http A"
192.168.0.106,116.132.235.204,9339,80,6,"Ether / IP / TCP 192.168.0.106:9339 > 116.132.235.204:http PA / Raw"
192.168.0.106,116.132.235.204,9339,80,6,"Ether / IP / TCP 192.168.0.106:9339 > 116.132.235.204:http A / Raw"
192.168.0.106,116.132.235.204,9339,80,6,"Ether / IP / TCP 192.168.0.106:9339 > 116.132.235.204:http A / Raw"
192.168.0.106,116.132.235.204,9339,80,6,"Ether / IP / TCP 192.168.0.106:9339 > 116.132.235.204:http PA / Raw"
116.132.235.204,192.168.0.106,80,9339,6,"Ether / IP / TCP 116.132.235.204:http > 192.168.0.106:9339 A"
116.132.235.204,192.168.0.106,80,9339,6,"Ether / IP / TCP 116.132.235.204:http > 192.168.0.106:9339 A"
116.132.235.204,192.168.0.106,80,9339,6,"Ether / IP / TCP 116.132.235.204:http > 192.168.0.106:9339 A"
116.132.235.204,192.168.0.106,80,9339,6,"Ether / IP / TCP 116.132.235.204:http > 192.168.0.106:9339 PA / Raw"
116.132.235.204,192.168.0.106,80,9339,6,"Ether / IP / TCP 116.132.235.204:http > 192.168.0.106:9339 FA"
192.168.0.106,116.132.235.204,9339,80,6,"Ether / IP / TCP 192.168.0.106:9339 > 116.132.235.204:http A"
192.168.0.106,116.132.235.204,9339,80,6,"Ether / IP / TCP 192.168.0.106:9339 > 116.132.235.204:http FA"
116.132.235.204,192.168.0.106,80,9339,6,"Ether / IP / TCP 116.132.235.204:http > 192.168.0.106:9339 A"
60.28.172.104,192.168.0.106,443,11251,6,"Ether / IP / TCP 60.28.172.104:https > 192.168.0.106:11251 PA / Raw"
192.168.0.106,60.28.172.104,11251,443,6,"Ether / IP / TCP 192.168.0.106:11251 > 60.28.172.104:https A"
192.168.0.106,116.132.235.204,9334,80,6,"Ether / IP / TCP 192.168.0.106:9334 > 116.132.235.204:http FA"
192.168.0.106,125.39.196.167,13267,14000,6,"Ether / IP / TCP 192.168.0.106:13267 > 125.39.196.167:14000 PA / Raw"
125.39.196.167,192.168.0.106,14000,13267,6,"Ether / IP / TCP 125.39.196.167:14000 > 192.168.0.106:13267 PA / Raw"
192.168.0.106,116.132.235.204,9340,80,6,"Ether / IP / TCP 192.168.0.106:9340 > 116.132.235.204:http S"
192.168.0.106,125.39.196.167,13267,14000,6,"Ether / IP / TCP 192.168.0.106:13267 > 125.39.196.167:14000 A"
116.132.235.204,192.168.0.106,80,9340,6,"Ether / IP / TCP 116.132.235.204:http > 192.168.0.106:9340 SA"
192.168.0.106,116.132.235.204,9340,80,6,"Ether / IP / TCP 192.168.0.106:9340 > 116.132.235.204:http A"
192.168.0.106,116.132.235.204,9340,80,6,"Ether / IP / TCP 192.168.0.106:9340 > 116.132.235.204:http PA / Raw"
192.168.0.106,116.132.235.204,9340,80,6,"Ether / IP / TCP 192.168.0.106:9340 > 116.132.235.204:http A / Raw"
192.168.0.106,116.132.235.204,9340,80,6,"Ether / IP / TCP 192.168.0.106:9340 > 116.132.235.204:http A / Raw"
192.168.0.106,116.132.235.204,9340,80,6,"Ether / IP / TCP 192.168.0.106:9340 > 116.132.235.204:http PA / Raw"
116.132.235.204,192.168.0.106,80,9340,6,"Ether / IP / TCP 116.132.235.204:http > 192.168.0.106:9340 A"
116.132.235.204,192.168.0.106,80,9340,6,"Ether / IP / TCP 116.132.235.204:http > 192.168.0.106:9340 A"
116.132.235.204,192.168.0.106,80,9340,6,"Ether / IP / TCP 116.132.235.204:http > 192.168.0.106:9340 A"
116.132.235.204,192.168.0.106,80,9340,6,"Ether / IP / TCP 116.132.235.204:http > 192.168.0.106:9340 PA / Raw"
116.132.235.204,192.168.0.106,80,9340,6,"Ether / IP / TCP 116.132.235.204:http > 192.168.0.106:9340 FA"
192.168.0.106,116.132.235.204,9340,80,6,"Ether / IP / TCP 192.168.0.106:9340 > 116.132.235.204:http A"
192.168.0.106,116.132.235.204,9340,80,6,"Ether / IP / TCP 192.168.0.106:9340 > 116.132.235.204:http FA"
192.168.0.106,54.148.245.131,1063,443,6,"Ether / IP / TCP 192.168.0.106:1063 > 54.148.245.131:https PA / Raw"
192.168.0.106,116.132.235.204,9340,80,6,"Ether / IP / TCP 192.168.0.106:9340 > 116.132.235.204:http FA"
54.148.245.131,192.168.0.106,443,1063,6,"Ether / IP / TCP 54.148.245.131:https > 192.168.0.106:1063 PA / Raw"
192.168.0.106,54.148.245.131,1063,443,6,"Ether / IP / TCP 192.168.0.106:1063 > 54.148.245.131:https A"
192.168.0.106,116.132.235.204,9340,80,6,"Ether / IP / TCP 192.168.0.106:9340 > 116.132.235.204:http FA"
192.168.0.106,116.132.235.204,9341,80,6,"Ether / IP / TCP 192.168.0.106:9341 > 116.132.235.204:http S"
116.132.235.204,192.168.0.106,80,9341,6,"Ether / IP / TCP 116.132.235.204:http > 192.168.0.106:9341 SA"
192.168.0.106,116.132.235.204,9341,80,6,"Ether / IP / TCP 192.168.0.106:9341 > 116.132.235.204:http A"
192.168.0.106,116.132.235.204,9341,80,6,"Ether / IP / TCP 192.168.0.106:9341 > 116.132.235.204:http PA / Raw"
192.168.0.106,116.132.235.204,9341,80,6,"Ether / IP / TCP 192.168.0.106:9341 > 116.132.235.204:http A / Raw"
192.168.0.106,116.132.235.204,9341,80,6,"Ether / IP / TCP 192.168.0.106:9341 > 116.132.235.204:http A / Raw"
192.168.0.106,116.132.235.204,9341,80,6,"Ether / IP / TCP 192.168.0.106:9341 > 116.132.235.204:http PA / Raw"
192.168.0.106,116.132.235.204,9336,80,6,"Ether / IP / TCP 192.168.0.106:9336 > 116.132.235.204:http FA"
116.132.235.204,192.168.0.106,80,9341,6,"Ether / IP / TCP 116.132.235.204:http > 192.168.0.106:9341 A"
116.132.235.204,192.168.0.106,80,9341,6,"Ether / IP / TCP 116.132.235.204:http > 192.168.0.106:9341 A"
116.132.235.204,192.168.0.106,80,9341,6,"Ether / IP / TCP 116.132.235.204:http > 192.168.0.106:9341 A"
116.132.235.204,192.168.0.106,80,9341,6,"Ether / IP / TCP 116.132.235.204:http > 192.168.0.106:9341 PA / Raw"
116.132.235.204,192.168.0.106,80,9341,6,"Ether / IP / TCP 116.132.235.204:http > 192.168.0.106:9341 FA"
192.168.0.106,116.132.235.204,9341,80,6,"Ether / IP / TCP 192.168.0.106:9341 > 116.132.235.204:http A"
192.168.0.106,116.132.235.204,9341,80,6,"Ether / IP / TCP 192.168.0.106:9341 > 116.132.235.204:http FA"
192.168.0.106,116.132.235.204,9341,80,6,"Ether / IP / TCP 192.168.0.106:9341 > 116.132.235.204:http FA"
192.168.0.106,110.242.68.3,9342,80,6,"Ether / IP / TCP 192.168.0.106:9342 > 110.242.68.3:http S"
110.242.68.3,192.168.0.106,80,9342,6,"Ether / IP / TCP 110.242.68.3:http > 192.168.0.106:9342 SA"
192.168.0.106,110.242.68.3,9342,80,6,"Ether / IP / TCP 192.168.0.106:9342 > 110.242.68.3:http A"
192.168.0.106,110.242.68.3,9342,80,6,"Ether / IP / TCP 192.168.0.106:9342 > 110.242.68.3:http FA"
192.168.0.106,116.132.235.204,9341,80,6,"Ether / IP / TCP 192.168.0.106:9341 > 116.132.235.204:http FA"
110.242.68.3,192.168.0.106,80,9342,6,"Ether / IP / TCP 110.242.68.3:http > 192.168.0.106:9342 A"
110.242.68.3,192.168.0.106,80,9342,6,"Ether / IP / TCP 110.242.68.3:http > 192.168.0.106:9342 FA"
192.168.0.106,110.242.68.3,9342,80,6,"Ether / IP / TCP 192.168.0.106:9342 > 110.242.68.3:http A"
192.168.0.106,116.132.235.204,9340,80,6,"Ether / IP / TCP 192.168.0.106:9340 > 116.132.235.204:http FA"
192.168.0.106,116.132.235.204,9343,80,6,"Ether / IP / TCP 192.168.0.106:9343 > 116.132.235.204:http S"
116.132.235.204,192.168.0.106,80,9343,6,"Ether / IP / TCP 116.132.235.204:http > 192.168.0.106:9343 SA"
192.168.0.106,116.132.235.204,9343,80,6,"Ether / IP / TCP 192.168.0.106:9343 > 116.132.235.204:http A"
192.168.0.106,116.132.235.204,9343,80,6,"Ether / IP / TCP 192.168.0.106:9343 > 116.132.235.204:http PA / Raw"
192.168.0.106,116.132.235.204,9343,80,6,"Ether / IP / TCP 192.168.0.106:9343 > 116.132.235.204:http A / Raw"
192.168.0.106,116.132.235.204,9343,80,6,"Ether / IP / TCP 192.168.0.106:9343 > 116.132.235.204:http A / Raw"
192.168.0.106,116.132.235.204,9343,80,6,"Ether / IP / TCP 192.168.0.106:9343 > 116.132.235.204:http PA / Raw"
116.132.235.204,192.168.0.106,80,9343,6,"Ether / IP / TCP 116.132.235.204:http > 192.168.0.106:9343 A"
116.132.235.204,192.168.0.106,80,9343,6,"Ether / IP / TCP 116.132.235.204:http > 192.168.0.106:9343 A"
116.132.235.204,192.168.0.106,80,9343,6,"Ether / IP / TCP 116.132.235.204:http > 192.168.0.106:9343 A"
116.132.235.204,192.168.0.106,80,9343,6,"Ether / IP / TCP 116.132.235.204:http > 192.168.0.106:9343 PA / Raw"
116.132.235.204,192.168.0.106,80,9343,6,"Ether / IP / TCP 116.132.235.204:http > 192.168.0.106:9343 FA"
192.168.0.106,116.132.235.204,9343,80,6,"Ether / IP / TCP 192.168.0.106:9343 > 116.132.235.204:http A"
192.168.0.106,116.132.235.204,9343,80,6,"Ether / IP / TCP 192.168.0.106:9343 > 116.132.235.204:http FA"
192.168.0.106,116.132.235.204,9344,80,6,"Ether / IP / TCP 192.168.0.106:9344 > 116.132.235.204:http S"
116.132.235.204,192.168.0.106,80,9344,6,"Ether / IP / TCP 116.132.235.204:http > 192.168.0.106:9344 SA"
192.168.0.106,116.132.235.204,9344,80,6,"Ether / IP / TCP 192.168.0.106:9344 > 116.132.235.204:http A"
192.168.0.106,116.132.235.204,9344,80,6,"Ether / IP / TCP 192.168.0.106:9344 > 116.132.235.204:http PA / Raw"
192.168.0.106,116.132.235.204,9344,80,6,"Ether / IP / TCP 192.168.0.106:9344 > 116.132.235.204:http A / Raw"
192.168.0.106,116.132.235.204,9344,80,6,"Ether / IP / TCP 192.168.0.106:9344 > 116.132.235.204:http A / Raw"
192.168.0.106,116.132.235.204,9344,80,6,"Ether / IP / TCP 192.168.0.106:9344 > 116.132.235.204:http PA / Raw"
