srcip,dstip,sport,dport,proto,data
192.168.0.106,192.168.0.1,55510,53,17,"Ether / IP / UDP / DNS Qry ""b'static-pcs-sdk-server.alibaba.com.'"" "
192.168.0.1,192.168.0.106,53,55510,17,"Ether / IP / UDP / DNS Ans ""116.132.235.228"" "
192.168.0.106,116.132.235.228,14295,80,6,"Ether / IP / TCP 192.168.0.106:14295 > 116.132.235.228:http S"
116.132.235.228,192.168.0.106,80,14295,6,"Ether / IP / TCP 116.132.235.228:http > 192.168.0.106:14295 SA"
192.168.0.106,116.132.235.228,14295,80,6,"Ether / IP / TCP 192.168.0.106:14295 > 116.132.235.228:http A"
192.168.0.106,116.132.235.228,14295,80,6,"Ether / IP / TCP 192.168.0.106:14295 > 116.132.235.228:http PA / Raw"
192.168.0.106,116.132.235.228,14295,80,6,"Ether / IP / TCP 192.168.0.106:14295 > 116.132.235.228:http A / Raw"
192.168.0.106,116.132.235.228,14295,80,6,"Ether / IP / TCP 192.168.0.106:14295 > 116.132.235.228:http A / Raw"
192.168.0.106,116.132.235.228,14295,80,6,"Ether / IP / TCP 192.168.0.106:14295 > 116.132.235.228:http PA / Raw"
116.132.235.228,192.168.0.106,80,14295,6,"Ether / IP / TCP 116.132.235.228:http > 192.168.0.106:14295 A"
116.132.235.228,192.168.0.106,80,14295,6,"Ether / IP / TCP 116.132.235.228:http > 192.168.0.106:14295 A"
116.132.235.228,192.168.0.106,80,14295,6,"Ether / IP / TCP 116.132.235.228:http > 192.168.0.106:14295 A"
116.132.235.228,192.168.0.106,80,14295,6,"Ether / IP / TCP 116.132.235.228:http > 192.168.0.106:14295 PA / Raw"
116.132.235.228,192.168.0.106,80,14295,6,"Ether / IP / TCP 116.132.235.228:http > 192.168.0.106:14295 FA"
192.168.0.106,116.132.235.228,14295,80,6,"Ether / IP / TCP 192.168.0.106:14295 > 116.132.235.228:http A"
192.168.0.106,116.132.235.228,14295,80,6,"Ether / IP / TCP 192.168.0.106:14295 > 116.132.235.228:http FA"
192.168.0.106,116.132.235.228,14295,80,6,"Ether / IP / TCP 192.168.0.106:14295 > 116.132.235.228:http FA"
192.168.0.106,116.132.235.228,14295,80,6,"Ether / IP / TCP 192.168.0.106:14295 > 116.132.235.228:http FA"
192.168.0.106,192.168.0.1,53456,53,17,"Ether / IP / UDP / DNS Qry ""b'static-pcs-sdk-server.alibaba.com.'"" "
192.168.0.1,192.168.0.106,53,53456,17,"Ether / IP / UDP / DNS Ans ""b'static-pcs-sdk-server.alibaba.com.gds.alibabadns.com.'"" "
192.168.0.106,116.132.235.204,14296,80,6,"Ether / IP / TCP 192.168.0.106:14296 > 116.132.235.204:http S"
116.132.235.204,192.168.0.106,80,14296,6,"Ether / IP / TCP 116.132.235.204:http > 192.168.0.106:14296 SA"
192.168.0.106,116.132.235.204,14296,80,6,"Ether / IP / TCP 192.168.0.106:14296 > 116.132.235.204:http A"
192.168.0.106,116.132.235.204,14296,80,6,"Ether / IP / TCP 192.168.0.106:14296 > 116.132.235.204:http PA / Raw"
192.168.0.106,116.132.235.204,14296,80,6,"Ether / IP / TCP 192.168.0.106:14296 > 116.132.235.204:http A / Raw"
192.168.0.106,116.132.235.204,14296,80,6,"Ether / IP / TCP 192.168.0.106:14296 > 116.132.235.204:http A / Raw"
192.168.0.106,116.132.235.204,14296,80,6,"Ether / IP / TCP 192.168.0.106:14296 > 116.132.235.204:http PA / Raw"
116.132.235.204,192.168.0.106,80,14296,6,"Ether / IP / TCP 116.132.235.204:http > 192.168.0.106:14296 A"
116.132.235.204,192.168.0.106,80,14296,6,"Ether / IP / TCP 116.132.235.204:http > 192.168.0.106:14296 A"
116.132.235.204,192.168.0.106,80,14296,6,"Ether / IP / TCP 116.132.235.204:http > 192.168.0.106:14296 A"
116.132.235.204,192.168.0.106,80,14296,6,"Ether / IP / TCP 116.132.235.204:http > 192.168.0.106:14296 PA / Raw"
192.168.0.106,116.132.235.204,14296,80,6,"Ether / IP / TCP 192.168.0.106:14296 > 116.132.235.204:http FA"
116.132.235.204,192.168.0.106,80,14296,6,"Ether / IP / TCP 116.132.235.204:http > 192.168.0.106:14296 FA"
192.168.0.106,116.132.235.204,14296,80,6,"Ether / IP / TCP 192.168.0.106:14296 > 116.132.235.204:http A"
116.132.235.204,192.168.0.106,80,14296,6,"Ether / IP / TCP 116.132.235.204:http > 192.168.0.106:14296 A"
192.168.0.106,116.132.235.228,14295,80,6,"Ether / IP / TCP 192.168.0.106:14295 > 116.132.235.228:http FA"
192.168.0.106,116.132.235.204,14297,80,6,"Ether / IP / TCP 192.168.0.106:14297 > 116.132.235.204:http S"
116.132.235.204,192.168.0.106,80,14297,6,"Ether / IP / TCP 116.132.235.204:http > 192.168.0.106:14297 SA"
192.168.0.106,116.132.235.204,14297,80,6,"Ether / IP / TCP 192.168.0.106:14297 > 116.132.235.204:http A"
192.168.0.106,116.132.235.204,14297,80,6,"Ether / IP / TCP 192.168.0.106:14297 > 116.132.235.204:http PA / Raw"
192.168.0.106,116.132.235.204,14297,80,6,"Ether / IP / TCP 192.168.0.106:14297 > 116.132.235.204:http A / Raw"
192.168.0.106,116.132.235.204,14297,80,6,"Ether / IP / TCP 192.168.0.106:14297 > 116.132.235.204:http A / Raw"
192.168.0.106,116.132.235.204,14297,80,6,"Ether / IP / TCP 192.168.0.106:14297 > 116.132.235.204:http PA / Raw"
116.132.235.204,192.168.0.106,80,14297,6,"Ether / IP / TCP 116.132.235.204:http > 192.168.0.106:14297 A"
116.132.235.204,192.168.0.106,80,14297,6,"Ether / IP / TCP 116.132.235.204:http > 192.168.0.106:14297 A"
116.132.235.204,192.168.0.106,80,14297,6,"Ether / IP / TCP 116.132.235.204:http > 192.168.0.106:14297 A"
116.132.235.204,192.168.0.106,80,14297,6,"Ether / IP / TCP 116.132.235.204:http > 192.168.0.106:14297 PA / Raw"
116.132.235.204,192.168.0.106,80,14297,6,"Ether / IP / TCP 116.132.235.204:http > 192.168.0.106:14297 FA"
192.168.0.106,116.132.235.204,14297,80,6,"Ether / IP / TCP 192.168.0.106:14297 > 116.132.235.204:http A"
192.168.0.106,116.132.235.204,14297,80,6,"Ether / IP / TCP 192.168.0.106:14297 > 116.132.235.204:http FA"
116.132.235.204,192.168.0.106,80,14297,6,"Ether / IP / TCP 116.132.235.204:http > 192.168.0.106:14297 A"
192.168.0.106,192.168.0.1,55510,53,17,"Ether / IP / UDP / DNS Qry ""b'catalog.gamepass.com.'"" "
192.168.0.1,192.168.0.106,53,55510,17,"Ether / IP / UDP / DNS Ans ""b'catalog.gamepass.com.edgesuite.net.'"" "
192.168.0.106,92.123.101.113,14298,443,6,"Ether / IP / TCP 192.168.0.106:14298 > 92.123.101.113:https S"
92.123.101.113,192.168.0.106,443,14298,6,"Ether / IP / TCP 92.123.101.113:https > 192.168.0.106:14298 SA"
192.168.0.106,92.123.101.113,14298,443,6,"Ether / IP / TCP 192.168.0.106:14298 > 92.123.101.113:https A"
192.168.0.106,92.123.101.113,14298,443,6,"Ether / IP / TCP 192.168.0.106:14298 > 92.123.101.113:https PA / Raw"
92.123.101.113,192.168.0.106,443,14298,6,"Ether / IP / TCP 92.123.101.113:https > 192.168.0.106:14298 A"
92.123.101.113,192.168.0.106,443,14298,6,"Ether / IP / TCP 92.123.101.113:https > 192.168.0.106:14298 A / Raw"
92.123.101.113,192.168.0.106,443,14298,6,"Ether / IP / TCP 92.123.101.113:https > 192.168.0.106:14298 PA / Raw"
92.123.101.113,192.168.0.106,443,14298,6,"Ether / IP / TCP 92.123.101.113:https > 192.168.0.106:14298 PA / Raw"
192.168.0.106,92.123.101.113,14298,443,6,"Ether / IP / TCP 192.168.0.106:14298 > 92.123.101.113:https A"
92.123.101.113,192.168.0.106,443,14298,6,"Ether / IP / TCP 92.123.101.113:https > 192.168.0.106:14298 A / Raw"
192.168.0.106,92.123.101.113,14298,443,6,"Ether / IP / TCP 192.168.0.106:14298 > 92.123.101.113:https A"
92.123.101.113,192.168.0.106,443,14298,6,"Ether / IP / TCP 92.123.101.113:https > 192.168.0.106:14298 PA / Raw"
192.168.0.106,92.123.101.113,14298,443,6,"Ether / IP / TCP 192.168.0.106:14298 > 92.123.101.113:https PA / Raw"
192.168.0.106,92.123.101.113,14298,443,6,"Ether / IP / TCP 192.168.0.106:14298 > 92.123.101.113:https PA / Raw"
192.168.0.106,92.123.101.113,14298,443,6,"Ether / IP / TCP 192.168.0.106:14298 > 92.123.101.113:https PA / Raw"
92.123.101.113,192.168.0.106,443,14298,6,"Ether / IP / TCP 92.123.101.113:https > 192.168.0.106:14298 A"
92.123.101.113,192.168.0.106,443,14298,6,"Ether / IP / TCP 92.123.101.113:https > 192.168.0.106:14298 PA / Raw"
92.123.101.113,192.168.0.106,443,14298,6,"Ether / IP / TCP 92.123.101.113:https > 192.168.0.106:14298 PA / Raw"
192.168.0.106,92.123.101.113,14298,443,6,"Ether / IP / TCP 192.168.0.106:14298 > 92.123.101.113:https A"
92.123.101.113,192.168.0.106,443,14298,6,"Ether / IP / TCP 92.123.101.113:https > 192.168.0.106:14298 A"
92.123.101.113,192.168.0.106,443,14298,6,"Ether / IP / TCP 92.123.101.113:https > 192.168.0.106:14298 A"
92.123.101.113,192.168.0.106,443,14298,6,"Ether / IP / TCP 92.123.101.113:https > 192.168.0.106:14298 PA / Raw"
92.123.101.113,192.168.0.106,443,14298,6,"Ether / IP / TCP 92.123.101.113:https > 192.168.0.106:14298 PA / Raw"
92.123.101.113,192.168.0.106,443,14298,6,"Ether / IP / TCP 92.123.101.113:https > 192.168.0.106:14298 PA / Raw"
192.168.0.106,92.123.101.113,14298,443,6,"Ether / IP / TCP 192.168.0.106:14298 > 92.123.101.113:https A"
92.123.101.113,192.168.0.106,443,14298,6,"Ether / IP / TCP 92.123.101.113:https > 192.168.0.106:14298 PA / Raw"
192.168.0.106,92.123.101.113,14298,443,6,"Ether / IP / TCP 192.168.0.106:14298 > 92.123.101.113:https A"
192.168.0.106,92.123.101.113,14298,443,6,"Ether / IP / TCP 192.168.0.106:14298 > 92.123.101.113:https PA / Raw"
192.168.0.106,92.123.101.113,14298,443,6,"Ether / IP / TCP 192.168.0.106:14298 > 92.123.101.113:https FA"
192.168.0.106,116.132.235.204,14299,80,6,"Ether / IP / TCP 192.168.0.106:14299 > 116.132.235.204:http S"
116.132.235.204,192.168.0.106,80,14299,6,"Ether / IP / TCP 116.132.235.204:http > 192.168.0.106:14299 SA"
192.168.0.106,116.132.235.204,14299,80,6,"Ether / IP / TCP 192.168.0.106:14299 > 116.132.235.204:http A"
192.168.0.106,116.132.235.204,14299,80,6,"Ether / IP / TCP 192.168.0.106:14299 > 116.132.235.204:http PA / Raw"
192.168.0.106,116.132.235.204,14299,80,6,"Ether / IP / TCP 192.168.0.106:14299 > 116.132.235.204:http A / Raw"
192.168.0.106,116.132.235.204,14299,80,6,"Ether / IP / TCP 192.168.0.106:14299 > 116.132.235.204:http A / Raw"
192.168.0.106,116.132.235.204,14299,80,6,"Ether / IP / TCP 192.168.0.106:14299 > 116.132.235.204:http PA / Raw"
116.132.235.204,192.168.0.106,80,14299,6,"Ether / IP / TCP 116.132.235.204:http > 192.168.0.106:14299 A"
116.132.235.204,192.168.0.106,80,14299,6,"Ether / IP / TCP 116.132.235.204:http > 192.168.0.106:14299 A"
116.132.235.204,192.168.0.106,80,14299,6,"Ether / IP / TCP 116.132.235.204:http > 192.168.0.106:14299 A"
116.132.235.204,192.168.0.106,80,14299,6,"Ether / IP / TCP 116.132.235.204:http > 192.168.0.106:14299 A"
116.132.235.204,192.168.0.106,80,14299,6,"Ether / IP / TCP 116.132.235.204:http > 192.168.0.106:14299 PA / Raw"
116.132.235.204,192.168.0.106,80,14299,6,"Ether / IP / TCP 116.132.235.204:http > 192.168.0.106:14299 FA"
192.168.0.106,116.132.235.204,14299,80,6,"Ether / IP / TCP 192.168.0.106:14299 > 116.132.235.204:http A"
192.168.0.106,116.132.235.204,14299,80,6,"Ether / IP / TCP 192.168.0.106:14299 > 116.132.235.204:http FA"
192.168.0.106,116.132.235.204,14300,80,6,"Ether / IP / TCP 192.168.0.106:14300 > 116.132.235.204:http S"
116.132.235.204,192.168.0.106,80,14300,6,"Ether / IP / TCP 116.132.235.204:http > 192.168.0.106:14300 SA"
192.168.0.106,116.132.235.204,14300,80,6,"Ether / IP / TCP 192.168.0.106:14300 > 116.132.235.204:http A"
192.168.0.106,116.132.235.204,14300,80,6,"Ether / IP / TCP 192.168.0.106:14300 > 116.132.235.204:http PA / Raw"
192.168.0.106,116.132.235.204,14300,80,6,"Ether / IP / TCP 192.168.0.106:14300 > 116.132.235.204:http A / Raw"
192.168.0.106,116.132.235.204,14300,80,6,"Ether / IP / TCP 192.168.0.106:14300 > 116.132.235.204:http A / Raw"
192.168.0.106,116.132.235.204,14300,80,6,"Ether / IP / TCP 192.168.0.106:14300 > 116.132.235.204:http PA / Raw"
116.132.235.204,192.168.0.106,80,14300,6,"Ether / IP / TCP 116.132.235.204:http > 192.168.0.106:14300 A"
116.132.235.204,192.168.0.106,80,14300,6,"Ether / IP / TCP 116.132.235.204:http > 192.168.0.106:14300 A"
192.168.0.106,92.123.101.113,14298,443,6,"Ether / IP / TCP 192.168.0.106:14298 > 92.123.101.113:https FPA / Raw"
116.132.235.204,192.168.0.106,80,14300,6,"Ether / IP / TCP 116.132.235.204:http > 192.168.0.106:14300 PA / Raw"
116.132.235.204,192.168.0.106,80,14300,6,"Ether / IP / TCP 116.132.235.204:http > 192.168.0.106:14300 FA"
192.168.0.106,116.132.235.204,14300,80,6,"Ether / IP / TCP 192.168.0.106:14300 > 116.132.235.204:http A"
192.168.0.106,116.132.235.204,14300,80,6,"Ether / IP / TCP 192.168.0.106:14300 > 116.132.235.204:http FA"
92.123.101.113,192.168.0.106,443,14298,6,"Ether / IP / TCP 92.123.101.113:https > 192.168.0.106:14298 R"
192.168.0.106,116.132.235.204,14299,80,6,"Ether / IP / TCP 192.168.0.106:14299 > 116.132.235.204:http FA"
192.168.0.106,116.132.235.204,14300,80,6,"Ether / IP / TCP 192.168.0.106:14300 > 116.132.235.204:http FA"
192.168.0.106,110.242.68.4,14301,80,6,"Ether / IP / TCP 192.168.0.106:14301 > 110.242.68.4:http S"
192.168.0.106,116.132.235.204,14299,80,6,"Ether / IP / TCP 192.168.0.106:14299 > 116.132.235.204:http FA"
110.242.68.4,192.168.0.106,80,14301,6,"Ether / IP / TCP 110.242.68.4:http > 192.168.0.106:14301 SA"
192.168.0.106,110.242.68.4,14301,80,6,"Ether / IP / TCP 192.168.0.106:14301 > 110.242.68.4:http A"
192.168.0.106,110.242.68.4,14301,80,6,"Ether / IP / TCP 192.168.0.106:14301 > 110.242.68.4:http FA"
110.242.68.4,192.168.0.106,80,14301,6,"Ether / IP / TCP 110.242.68.4:http > 192.168.0.106:14301 A"
110.242.68.4,192.168.0.106,80,14301,6,"Ether / IP / TCP 110.242.68.4:http > 192.168.0.106:14301 FA"
192.168.0.106,110.242.68.4,14301,80,6,"Ether / IP / TCP 192.168.0.106:14301 > 110.242.68.4:http A"
192.168.0.106,116.132.235.204,14300,80,6,"Ether / IP / TCP 192.168.0.106:14300 > 116.132.235.204:http FA"
192.168.0.106,116.132.235.228,14295,80,6,"Ether / IP / TCP 192.168.0.106:14295 > 116.132.235.228:http FA"
192.168.0.106,116.132.235.204,14302,80,6,"Ether / IP / TCP 192.168.0.106:14302 > 116.132.235.204:http S"
116.132.235.204,192.168.0.106,80,14302,6,"Ether / IP / TCP 116.132.235.204:http > 192.168.0.106:14302 SA"
192.168.0.106,116.132.235.204,14302,80,6,"Ether / IP / TCP 192.168.0.106:14302 > 116.132.235.204:http A"
192.168.0.106,116.132.235.204,14302,80,6,"Ether / IP / TCP 192.168.0.106:14302 > 116.132.235.204:http PA / Raw"
192.168.0.106,116.132.235.204,14302,80,6,"Ether / IP / TCP 192.168.0.106:14302 > 116.132.235.204:http A / Raw"
192.168.0.106,116.132.235.204,14302,80,6,"Ether / IP / TCP 192.168.0.106:14302 > 116.132.235.204:http A / Raw"
192.168.0.106,116.132.235.204,14302,80,6,"Ether / IP / TCP 192.168.0.106:14302 > 116.132.235.204:http PA / Raw"
116.132.235.204,192.168.0.106,80,14302,6,"Ether / IP / TCP 116.132.235.204:http > 192.168.0.106:14302 A"
116.132.235.204,192.168.0.106,80,14302,6,"Ether / IP / TCP 116.132.235.204:http > 192.168.0.106:14302 A"
116.132.235.204,192.168.0.106,80,14302,6,"Ether / IP / TCP 116.132.235.204:http > 192.168.0.106:14302 A"
116.132.235.204,192.168.0.106,80,14302,6,"Ether / IP / TCP 116.132.235.204:http > 192.168.0.106:14302 PA / Raw"
116.132.235.204,192.168.0.106,80,14302,6,"Ether / IP / TCP 116.132.235.204:http > 192.168.0.106:14302 FA"
192.168.0.106,116.132.235.204,14302,80,6,"Ether / IP / TCP 192.168.0.106:14302 > 116.132.235.204:http A"
192.168.0.106,116.132.235.204,14302,80,6,"Ether / IP / TCP 192.168.0.106:14302 > 116.132.235.204:http FA"
192.168.0.106,116.132.235.204,14302,80,6,"Ether / IP / TCP 192.168.0.106:14302 > 116.132.235.204:http FA"
192.168.0.106,116.132.235.204,14299,80,6,"Ether / IP / TCP 192.168.0.106:14299 > 116.132.235.204:http FA"
192.168.0.106,116.132.235.204,14302,80,6,"Ether / IP / TCP 192.168.0.106:14302 > 116.132.235.204:http FA"
192.168.0.106,116.132.235.204,14300,80,6,"Ether / IP / TCP 192.168.0.106:14300 > 116.132.235.204:http FA"
192.168.0.106,116.132.235.204,14303,80,6,"Ether / IP / TCP 192.168.0.106:14303 > 116.132.235.204:http S"
116.132.235.204,192.168.0.106,80,14303,6,"Ether / IP / TCP 116.132.235.204:http > 192.168.0.106:14303 SA"
192.168.0.106,116.132.235.204,14303,80,6,"Ether / IP / TCP 192.168.0.106:14303 > 116.132.235.204:http A"
192.168.0.106,116.132.235.204,14303,80,6,"Ether / IP / TCP 192.168.0.106:14303 > 116.132.235.204:http PA / Raw"
192.168.0.106,116.132.235.204,14303,80,6,"Ether / IP / TCP 192.168.0.106:14303 > 116.132.235.204:http A / Raw"
192.168.0.106,116.132.235.204,14303,80,6,"Ether / IP / TCP 192.168.0.106:14303 > 116.132.235.204:http A / Raw"
192.168.0.106,116.132.235.204,14303,80,6,"Ether / IP / TCP 192.168.0.106:14303 > 116.132.235.204:http PA / Raw"
116.132.235.204,192.168.0.106,80,14303,6,"Ether / IP / TCP 116.132.235.204:http > 192.168.0.106:14303 A"
116.132.235.204,192.168.0.106,80,14303,6,"Ether / IP / TCP 116.132.235.204:http > 192.168.0.106:14303 A"
116.132.235.204,192.168.0.106,80,14303,6,"Ether / IP / TCP 116.132.235.204:http > 192.168.0.106:14303 A"
116.132.235.204,192.168.0.106,80,14303,6,"Ether / IP / TCP 116.132.235.204:http > 192.168.0.106:14303 PA / Raw"
116.132.235.204,192.168.0.106,80,14303,6,"Ether / IP / TCP 116.132.235.204:http > 192.168.0.106:14303 FA"
192.168.0.106,116.132.235.204,14303,80,6,"Ether / IP / TCP 192.168.0.106:14303 > 116.132.235.204:http A"
192.168.0.106,116.132.235.204,14303,80,6,"Ether / IP / TCP 192.168.0.106:14303 > 116.132.235.204:http FA"
116.132.235.204,192.168.0.106,80,14303,6,"Ether / IP / TCP 116.132.235.204:http > 192.168.0.106:14303 A"
192.168.0.106,116.132.235.204,14304,80,6,"Ether / IP / TCP 192.168.0.106:14304 > 116.132.235.204:http S"
116.132.235.204,192.168.0.106,80,14304,6,"Ether / IP / TCP 116.132.235.204:http > 192.168.0.106:14304 SA"
192.168.0.106,116.132.235.204,14304,80,6,"Ether / IP / TCP 192.168.0.106:14304 > 116.132.235.204:http A"
192.168.0.106,116.132.235.204,14304,80,6,"Ether / IP / TCP 192.168.0.106:14304 > 116.132.235.204:http PA / Raw"
192.168.0.106,116.132.235.204,14304,80,6,"Ether / IP / TCP 192.168.0.106:14304 > 116.132.235.204:http A / Raw"
192.168.0.106,116.132.235.204,14304,80,6,"Ether / IP / TCP 192.168.0.106:14304 > 116.132.235.204:http A / Raw"
192.168.0.106,116.132.235.204,14304,80,6,"Ether / IP / TCP 192.168.0.106:14304 > 116.132.235.204:http PA / Raw"
116.132.235.204,192.168.0.106,80,14304,6,"Ether / IP / TCP 116.132.235.204:http > 192.168.0.106:14304 A"
116.132.235.204,192.168.0.106,80,14304,6,"Ether / IP / TCP 116.132.235.204:http > 192.168.0.106:14304 A"
116.132.235.204,192.168.0.106,80,14304,6,"Ether / IP / TCP 116.132.235.204:http > 192.168.0.106:14304 A"
116.132.235.204,192.168.0.106,80,14304,6,"Ether / IP / TCP 116.132.235.204:http > 192.168.0.106:14304 PA / Raw"
116.132.235.204,192.168.0.106,80,14304,6,"Ether / IP / TCP 116.132.235.204:http > 192.168.0.106:14304 FA"
192.168.0.106,116.132.235.204,14304,80,6,"Ether / IP / TCP 192.168.0.106:14304 > 116.132.235.204:http A"
192.168.0.106,116.132.235.204,14304,80,6,"Ether / IP / TCP 192.168.0.106:14304 > 116.132.235.204:http FA"
116.132.235.204,192.168.0.106,80,14304,6,"Ether / IP / TCP 116.132.235.204:http > 192.168.0.106:14304 A"
192.168.0.106,116.132.235.204,14302,80,6,"Ether / IP / TCP 192.168.0.106:14302 > 116.132.235.204:http FA"
192.168.0.106,116.132.235.204,14305,80,6,"Ether / IP / TCP 192.168.0.106:14305 > 116.132.235.204:http S"
192.168.0.106,13.107.21.239,6902,443,6,"Ether / IP / TCP 192.168.0.106:6902 > 13.107.21.239:https A / Raw"
116.132.235.204,192.168.0.106,80,14305,6,"Ether / IP / TCP 116.132.235.204:http > 192.168.0.106:14305 SA"
192.168.0.106,116.132.235.204,14305,80,6,"Ether / IP / TCP 192.168.0.106:14305 > 116.132.235.204:http A"
192.168.0.106,116.132.235.204,14305,80,6,"Ether / IP / TCP 192.168.0.106:14305 > 116.132.235.204:http PA / Raw"
192.168.0.106,116.132.235.204,14305,80,6,"Ether / IP / TCP 192.168.0.106:14305 > 116.132.235.204:http A / Raw"
192.168.0.106,116.132.235.204,14305,80,6,"Ether / IP / TCP 192.168.0.106:14305 > 116.132.235.204:http A / Raw"
192.168.0.106,116.132.235.204,14305,80,6,"Ether / IP / TCP 192.168.0.106:14305 > 116.132.235.204:http PA / Raw"
116.132.235.204,192.168.0.106,80,14305,6,"Ether / IP / TCP 116.132.235.204:http > 192.168.0.106:14305 A"
116.132.235.204,192.168.0.106,80,14305,6,"Ether / IP / TCP 116.132.235.204:http > 192.168.0.106:14305 A"
116.132.235.204,192.168.0.106,80,14305,6,"Ether / IP / TCP 116.132.235.204:http > 192.168.0.106:14305 A"
116.132.235.204,192.168.0.106,80,14305,6,"Ether / IP / TCP 116.132.235.204:http > 192.168.0.106:14305 PA / Raw"
116.132.235.204,192.168.0.106,80,14305,6,"Ether / IP / TCP 116.132.235.204:http > 192.168.0.106:14305 FA"
192.168.0.106,116.132.235.204,14305,80,6,"Ether / IP / TCP 192.168.0.106:14305 > 116.132.235.204:http A"
192.168.0.106,116.132.235.204,14305,80,6,"Ether / IP / TCP 192.168.0.106:14305 > 116.132.235.204:http FA"
13.107.21.239,192.168.0.106,443,6902,6,"Ether / IP / TCP 13.107.21.239:https > 192.168.0.106:6902 A"
116.132.235.204,192.168.0.106,80,14305,6,"Ether / IP / TCP 116.132.235.204:http > 192.168.0.106:14305 A"
192.168.0.106,157.255.191.88,4013,443,6,"Ether / IP / TCP 192.168.0.106:4013 > 157.255.191.88:https PA / Raw"
157.255.191.88,192.168.0.106,443,4013,6,"Ether / IP / TCP 157.255.191.88:https > 192.168.0.106:4013 A / Padding"
157.255.191.88,192.168.0.106,443,4013,6,"Ether / IP / TCP 157.255.191.88:https > 192.168.0.106:4013 PA / Raw"
192.168.0.106,157.255.191.88,4013,443,6,"Ether / IP / TCP 192.168.0.106:4013 > 157.255.191.88:https A"
192.168.0.106,116.132.235.204,14299,80,6,"Ether / IP / TCP 192.168.0.106:14299 > 116.132.235.204:http FA"
192.168.0.106,116.132.235.204,14306,80,6,"Ether / IP / TCP 192.168.0.106:14306 > 116.132.235.204:http S"
192.168.0.106,116.132.235.204,14300,80,6,"Ether / IP / TCP 192.168.0.106:14300 > 116.132.235.204:http FA"
116.132.235.204,192.168.0.106,80,14306,6,"Ether / IP / TCP 116.132.235.204:http > 192.168.0.106:14306 SA"
192.168.0.106,116.132.235.204,14306,80,6,"Ether / IP / TCP 192.168.0.106:14306 > 116.132.235.204:http A"
192.168.0.106,116.132.235.204,14306,80,6,"Ether / IP / TCP 192.168.0.106:14306 > 116.132.235.204:http PA / Raw"
192.168.0.106,116.132.235.204,14306,80,6,"Ether / IP / TCP 192.168.0.106:14306 > 116.132.235.204:http A / Raw"
192.168.0.106,116.132.235.204,14306,80,6,"Ether / IP / TCP 192.168.0.106:14306 > 116.132.235.204:http A / Raw"
192.168.0.106,116.132.235.204,14306,80,6,"Ether / IP / TCP 192.168.0.106:14306 > 116.132.235.204:http PA / Raw"
116.132.235.204,192.168.0.106,80,14306,6,"Ether / IP / TCP 116.132.235.204:http > 192.168.0.106:14306 A"
116.132.235.204,192.168.0.106,80,14306,6,"Ether / IP / TCP 116.132.235.204:http > 192.168.0.106:14306 A"
116.132.235.204,192.168.0.106,80,14306,6,"Ether / IP / TCP 116.132.235.204:http > 192.168.0.106:14306 A"
116.132.235.204,192.168.0.106,80,14306,6,"Ether / IP / TCP 116.132.235.204:http > 192.168.0.106:14306 PA / Raw"
116.132.235.204,192.168.0.106,80,14306,6,"Ether / IP / TCP 116.132.235.204:http > 192.168.0.106:14306 FA"
192.168.0.106,116.132.235.204,14306,80,6,"Ether / IP / TCP 192.168.0.106:14306 > 116.132.235.204:http A"
192.168.0.106,116.132.235.204,14306,80,6,"Ether / IP / TCP 192.168.0.106:14306 > 116.132.235.204:http FA"
192.168.0.106,116.132.235.204,14307,80,6,"Ether / IP / TCP 192.168.0.106:14307 > 116.132.235.204:http S"
116.132.235.204,192.168.0.106,80,14307,6,"Ether / IP / TCP 116.132.235.204:http > 192.168.0.106:14307 SA"
192.168.0.106,116.132.235.204,14307,80,6,"Ether / IP / TCP 192.168.0.106:14307 > 116.132.235.204:http A"
192.168.0.106,116.132.235.204,14307,80,6,"Ether / IP / TCP 192.168.0.106:14307 > 116.132.235.204:http PA / Raw"
192.168.0.106,116.132.235.204,14307,80,6,"Ether / IP / TCP 192.168.0.106:14307 > 116.132.235.204:http A / Raw"
192.168.0.106,116.132.235.204,14307,80,6,"Ether / IP / TCP 192.168.0.106:14307 > 116.132.235.204:http A / Raw"
192.168.0.106,116.132.235.204,14307,80,6,"Ether / IP / TCP 192.168.0.106:14307 > 116.132.235.204:http PA / Raw"
116.132.235.204,192.168.0.106,80,14307,6,"Ether / IP / TCP 116.132.235.204:http > 192.168.0.106:14307 A"
116.132.235.204,192.168.0.106,80,14307,6,"Ether / IP / TCP 116.132.235.204:http > 192.168.0.106:14307 A"
116.132.235.204,192.168.0.106,80,14307,6,"Ether / IP / TCP 116.132.235.204:http > 192.168.0.106:14307 A"
116.132.235.204,192.168.0.106,80,14307,6,"Ether / IP / TCP 116.132.235.204:http > 192.168.0.106:14307 A"
116.132.235.204,192.168.0.106,80,14307,6,"Ether / IP / TCP 116.132.235.204:http > 192.168.0.106:14307 PA / Raw"
116.132.235.204,192.168.0.106,80,14307,6,"Ether / IP / TCP 116.132.235.204:http > 192.168.0.106:14307 FA"
192.168.0.106,116.132.235.204,14307,80,6,"Ether / IP / TCP 192.168.0.106:14307 > 116.132.235.204:http A"
192.168.0.106,116.132.235.204,14307,80,6,"Ether / IP / TCP 192.168.0.106:14307 > 116.132.235.204:http FA"
192.168.0.106,116.132.235.204,14306,80,6,"Ether / IP / TCP 192.168.0.106:14306 > 116.132.235.204:http FA"
192.168.0.106,116.132.235.204,14307,80,6,"Ether / IP / TCP 192.168.0.106:14307 > 116.132.235.204:http FA"
192.168.0.106,116.132.235.204,14306,80,6,"Ether / IP / TCP 192.168.0.106:14306 > 116.132.235.204:http FA"
192.168.0.106,116.132.235.204,14307,80,6,"Ether / IP / TCP 192.168.0.106:14307 > 116.132.235.204:http FA"
192.168.0.106,116.132.235.204,14302,80,6,"Ether / IP / TCP 192.168.0.106:14302 > 116.132.235.204:http FA"
192.168.0.106,116.132.235.204,14308,80,6,"Ether / IP / TCP 192.168.0.106:14308 > 116.132.235.204:http S"
116.132.235.204,192.168.0.106,80,14308,6,"Ether / IP / TCP 116.132.235.204:http > 192.168.0.106:14308 SA"
192.168.0.106,116.132.235.204,14308,80,6,"Ether / IP / TCP 192.168.0.106:14308 > 116.132.235.204:http A"
192.168.0.106,116.132.235.204,14308,80,6,"Ether / IP / TCP 192.168.0.106:14308 > 116.132.235.204:http PA / Raw"
192.168.0.106,116.132.235.204,14308,80,6,"Ether / IP / TCP 192.168.0.106:14308 > 116.132.235.204:http A / Raw"
192.168.0.106,116.132.235.204,14308,80,6,"Ether / IP / TCP 192.168.0.106:14308 > 116.132.235.204:http A / Raw"
192.168.0.106,116.132.235.204,14308,80,6,"Ether / IP / TCP 192.168.0.106:14308 > 116.132.235.204:http PA / Raw"
116.132.235.204,192.168.0.106,80,14308,6,"Ether / IP / TCP 116.132.235.204:http > 192.168.0.106:14308 A"
116.132.235.204,192.168.0.106,80,14308,6,"Ether / IP / TCP 116.132.235.204:http > 192.168.0.106:14308 A"
116.132.235.204,192.168.0.106,80,14308,6,"Ether / IP / TCP 116.132.235.204:http > 192.168.0.106:14308 A"
116.132.235.204,192.168.0.106,80,14308,6,"Ether / IP / TCP 116.132.235.204:http > 192.168.0.106:14308 PA / Raw"
116.132.235.204,192.168.0.106,80,14308,6,"Ether / IP / TCP 116.132.235.204:http > 192.168.0.106:14308 FA"
192.168.0.106,116.132.235.204,14308,80,6,"Ether / IP / TCP 192.168.0.106:14308 > 116.132.235.204:http A"
192.168.0.106,116.132.235.204,14308,80,6,"Ether / IP / TCP 192.168.0.106:14308 > 116.132.235.204:http FA"
116.132.235.204,192.168.0.106,80,14308,6,"Ether / IP / TCP 116.132.235.204:http > 192.168.0.106:14308 A"
192.168.0.106,116.132.235.228,14295,80,6,"Ether / IP / TCP 192.168.0.106:14295 > 116.132.235.228:http FA"
192.168.0.106,116.132.235.204,14306,80,6,"Ether / IP / TCP 192.168.0.106:14306 > 116.132.235.204:http FA"
192.168.0.106,116.132.235.204,14307,80,6,"Ether / IP / TCP 192.168.0.106:14307 > 116.132.235.204:http FA"
192.168.0.106,116.132.235.204,14309,80,6,"Ether / IP / TCP 192.168.0.106:14309 > 116.132.235.204:http S"
116.132.235.204,192.168.0.106,80,14309,6,"Ether / IP / TCP 116.132.235.204:http > 192.168.0.106:14309 SA"
192.168.0.106,116.132.235.204,14309,80,6,"Ether / IP / TCP 192.168.0.106:14309 > 116.132.235.204:http A"
192.168.0.106,116.132.235.204,14309,80,6,"Ether / IP / TCP 192.168.0.106:14309 > 116.132.235.204:http PA / Raw"
192.168.0.106,116.132.235.204,14309,80,6,"Ether / IP / TCP 192.168.0.106:14309 > 116.132.235.204:http A / Raw"
192.168.0.106,116.132.235.204,14309,80,6,"Ether / IP / TCP 192.168.0.106:14309 > 116.132.235.204:http A / Raw"
192.168.0.106,116.132.235.204,14309,80,6,"Ether / IP / TCP 192.168.0.106:14309 > 116.132.235.204:http PA / Raw"
116.132.235.204,192.168.0.106,80,14309,6,"Ether / IP / TCP 116.132.235.204:http > 192.168.0.106:14309 A"
116.132.235.204,192.168.0.106,80,14309,6,"Ether / IP / TCP 116.132.235.204:http > 192.168.0.106:14309 A"
116.132.235.204,192.168.0.106,80,14309,6,"Ether / IP / TCP 116.132.235.204:http > 192.168.0.106:14309 A"
116.132.235.204,192.168.0.106,80,14309,6,"Ether / IP / TCP 116.132.235.204:http > 192.168.0.106:14309 PA / Raw"
116.132.235.204,192.168.0.106,80,14309,6,"Ether / IP / TCP 116.132.235.204:http > 192.168.0.106:14309 FA"
192.168.0.106,116.132.235.204,14309,80,6,"Ether / IP / TCP 192.168.0.106:14309 > 116.132.235.204:http A"
192.168.0.106,116.132.235.204,14309,80,6,"Ether / IP / TCP 192.168.0.106:14309 > 116.132.235.204:http FA"
192.168.0.106,116.132.235.204,14309,80,6,"Ether / IP / TCP 192.168.0.106:14309 > 116.132.235.204:http FA"
192.168.0.106,116.132.235.204,14309,80,6,"Ether / IP / TCP 192.168.0.106:14309 > 116.132.235.204:http FA"
192.168.0.106,116.132.235.204,14310,80,6,"Ether / IP / TCP 192.168.0.106:14310 > 116.132.235.204:http S"
116.132.235.204,192.168.0.106,80,14310,6,"Ether / IP / TCP 116.132.235.204:http > 192.168.0.106:14310 SA"
192.168.0.106,116.132.235.204,14310,80,6,"Ether / IP / TCP 192.168.0.106:14310 > 116.132.235.204:http A"
192.168.0.106,116.132.235.204,14310,80,6,"Ether / IP / TCP 192.168.0.106:14310 > 116.132.235.204:http PA / Raw"
192.168.0.106,116.132.235.204,14310,80,6,"Ether / IP / TCP 192.168.0.106:14310 > 116.132.235.204:http A / Raw"
192.168.0.106,116.132.235.204,14310,80,6,"Ether / IP / TCP 192.168.0.106:14310 > 116.132.235.204:http A / Raw"
192.168.0.106,116.132.235.204,14310,80,6,"Ether / IP / TCP 192.168.0.106:14310 > 116.132.235.204:http PA / Raw"
116.132.235.204,192.168.0.106,80,14310,6,"Ether / IP / TCP 116.132.235.204:http > 192.168.0.106:14310 A"
116.132.235.204,192.168.0.106,80,14310,6,"Ether / IP / TCP 116.132.235.204:http > 192.168.0.106:14310 A"
116.132.235.204,192.168.0.106,80,14310,6,"Ether / IP / TCP 116.132.235.204:http > 192.168.0.106:14310 A"
116.132.235.204,192.168.0.106,80,14310,6,"Ether / IP / TCP 116.132.235.204:http > 192.168.0.106:14310 PA / Raw"
116.132.235.204,192.168.0.106,80,14310,6,"Ether / IP / TCP 116.132.235.204:http > 192.168.0.106:14310 FA"
192.168.0.106,116.132.235.204,14310,80,6,"Ether / IP / TCP 192.168.0.106:14310 > 116.132.235.204:http A"
192.168.0.106,116.132.235.204,14310,80,6,"Ether / IP / TCP 192.168.0.106:14310 > 116.132.235.204:http FA"
116.132.235.204,192.168.0.106,80,14310,6,"Ether / IP / TCP 116.132.235.204:http > 192.168.0.106:14310 A"
192.168.0.106,116.132.235.204,14311,80,6,"Ether / IP / TCP 192.168.0.106:14311 > 116.132.235.204:http S"
116.132.235.204,192.168.0.106,80,14311,6,"Ether / IP / TCP 116.132.235.204:http > 192.168.0.106:14311 SA"
192.168.0.106,116.132.235.204,14311,80,6,"Ether / IP / TCP 192.168.0.106:14311 > 116.132.235.204:http A"
192.168.0.106,116.132.235.204,14311,80,6,"Ether / IP / TCP 192.168.0.106:14311 > 116.132.235.204:http PA / Raw"
192.168.0.106,116.132.235.204,14311,80,6,"Ether / IP / TCP 192.168.0.106:14311 > 116.132.235.204:http A / Raw"
192.168.0.106,116.132.235.204,14311,80,6,"Ether / IP / TCP 192.168.0.106:14311 > 116.132.235.204:http A / Raw"
192.168.0.106,116.132.235.204,14311,80,6,"Ether / IP / TCP 192.168.0.106:14311 > 116.132.235.204:http PA / Raw"
116.132.235.204,192.168.0.106,80,14311,6,"Ether / IP / TCP 116.132.235.204:http > 192.168.0.106:14311 A"
116.132.235.204,192.168.0.106,80,14311,6,"Ether / IP / TCP 116.132.235.204:http > 192.168.0.106:14311 A"
116.132.235.204,192.168.0.106,80,14311,6,"Ether / IP / TCP 116.132.235.204:http > 192.168.0.106:14311 A"
116.132.235.204,192.168.0.106,80,14311,6,"Ether / IP / TCP 116.132.235.204:http > 192.168.0.106:14311 PA / Raw"
116.132.235.204,192.168.0.106,80,14311,6,"Ether / IP / TCP 116.132.235.204:http > 192.168.0.106:14311 FA"
192.168.0.106,116.132.235.204,14311,80,6,"Ether / IP / TCP 192.168.0.106:14311 > 116.132.235.204:http A"
192.168.0.106,116.132.235.204,14311,80,6,"Ether / IP / TCP 192.168.0.106:14311 > 116.132.235.204:http FA"
116.132.235.204,192.168.0.106,80,14311,6,"Ether / IP / TCP 116.132.235.204:http > 192.168.0.106:14311 A"
192.168.0.106,116.132.235.204,14309,80,6,"Ether / IP / TCP 192.168.0.106:14309 > 116.132.235.204:http FA"
192.168.0.106,116.132.235.204,14306,80,6,"Ether / IP / TCP 192.168.0.106:14306 > 116.132.235.204:http FA"
192.168.0.106,116.132.235.204,14312,80,6,"Ether / IP / TCP 192.168.0.106:14312 > 116.132.235.204:http S"
116.132.235.204,192.168.0.106,80,14312,6,"Ether / IP / TCP 116.132.235.204:http > 192.168.0.106:14312 SA"
192.168.0.106,116.132.235.204,14312,80,6,"Ether / IP / TCP 192.168.0.106:14312 > 116.132.235.204:http A"
192.168.0.106,116.132.235.204,14312,80,6,"Ether / IP / TCP 192.168.0.106:14312 > 116.132.235.204:http PA / Raw"
192.168.0.106,116.132.235.204,14312,80,6,"Ether / IP / TCP 192.168.0.106:14312 > 116.132.235.204:http A / Raw"
192.168.0.106,116.132.235.204,14312,80,6,"Ether / IP / TCP 192.168.0.106:14312 > 116.132.235.204:http A / Raw"
192.168.0.106,116.132.235.204,14312,80,6,"Ether / IP / TCP 192.168.0.106:14312 > 116.132.235.204:http PA / Raw"
192.168.0.106,116.132.235.204,14299,80,6,"Ether / IP / TCP 192.168.0.106:14299 > 116.132.235.204:http FA"
192.168.0.106,116.132.235.204,14307,80,6,"Ether / IP / TCP 192.168.0.106:14307 > 116.132.235.204:http FA"
116.132.235.204,192.168.0.106,80,14312,6,"Ether / IP / TCP 116.132.235.204:http > 192.168.0.106:14312 A"
116.132.235.204,192.168.0.106,80,14312,6,"Ether / IP / TCP 116.132.235.204:http > 192.168.0.106:14312 A"
116.132.235.204,192.168.0.106,80,14312,6,"Ether / IP / TCP 116.132.235.204:http > 192.168.0.106:14312 A"
116.132.235.204,192.168.0.106,80,14312,6,"Ether / IP / TCP 116.132.235.204:http > 192.168.0.106:14312 PA / Raw"
116.132.235.204,192.168.0.106,80,14312,6,"Ether / IP / TCP 116.132.235.204:http > 192.168.0.106:14312 FA"
192.168.0.106,116.132.235.204,14312,80,6,"Ether / IP / TCP 192.168.0.106:14312 > 116.132.235.204:http A"
192.168.0.106,116.132.235.204,14312,80,6,"Ether / IP / TCP 192.168.0.106:14312 > 116.132.235.204:http FA"
116.132.235.204,192.168.0.106,80,14312,6,"Ether / IP / TCP 116.132.235.204:http > 192.168.0.106:14312 A"
192.168.0.106,116.132.235.204,14300,80,6,"Ether / IP / TCP 192.168.0.106:14300 > 116.132.235.204:http FA"
192.168.0.106,116.132.235.204,14302,80,6,"Ether / IP / TCP 192.168.0.106:14302 > 116.132.235.204:http FA"
192.168.0.106,110.242.68.4,14313,80,6,"Ether / IP / TCP 192.168.0.106:14313 > 110.242.68.4:http S"
110.242.68.4,192.168.0.106,80,14313,6,"Ether / IP / TCP 110.242.68.4:http > 192.168.0.106:14313 SA"
192.168.0.106,110.242.68.4,14313,80,6,"Ether / IP / TCP 192.168.0.106:14313 > 110.242.68.4:http A"
192.168.0.106,110.242.68.4,14313,80,6,"Ether / IP / TCP 192.168.0.106:14313 > 110.242.68.4:http FA"
110.242.68.4,192.168.0.106,80,14313,6,"Ether / IP / TCP 110.242.68.4:http > 192.168.0.106:14313 A"
110.242.68.4,192.168.0.106,80,14313,6,"Ether / IP / TCP 110.242.68.4:http > 192.168.0.106:14313 FA"
192.168.0.106,110.242.68.4,14313,80,6,"Ether / IP / TCP 192.168.0.106:14313 > 110.242.68.4:http A"
192.168.0.106,116.132.235.204,14309,80,6,"Ether / IP / TCP 192.168.0.106:14309 > 116.132.235.204:http FA"
192.168.0.106,52.2.80.44,3709,443,6,"Ether / IP / TCP 192.168.0.106:3709 > 52.2.80.44:https PA / Raw"
192.168.0.106,202.89.233.101,14194,443,6,"Ether / IP / TCP 192.168.0.106:14194 > 202.89.233.101:https A / Raw"
202.89.233.101,192.168.0.106,443,14194,6,"Ether / IP / TCP 202.89.233.101:https > 192.168.0.106:14194 A"
52.2.80.44,192.168.0.106,443,3709,6,"Ether / IP / TCP 52.2.80.44:https > 192.168.0.106:3709 A / Padding"
192.168.0.106,116.132.235.204,14306,80,6,"Ether / IP / TCP 192.168.0.106:14306 > 116.132.235.204:http FA"
119.3.178.178,192.168.0.106,21111,8122,6,"Ether / IP / TCP 119.3.178.178:21111 > 192.168.0.106:8122 A / Padding"
192.168.0.106,119.3.178.178,8122,21111,6,"Ether / IP / TCP 192.168.0.106:8122 > 119.3.178.178:21111 A"
192.168.0.106,116.132.235.204,14307,80,6,"Ether / IP / TCP 192.168.0.106:14307 > 116.132.235.204:http FA"
192.168.0.106,116.132.235.228,14295,80,6,"Ether / IP / TCP 192.168.0.106:14295 > 116.132.235.228:http RA"
192.168.0.106,116.132.235.204,14309,80,6,"Ether / IP / TCP 192.168.0.106:14309 > 116.132.235.204:http FA"
192.168.0.106,116.132.235.204,14299,80,6,"Ether / IP / TCP 192.168.0.106:14299 > 116.132.235.204:http RA"
192.168.0.106,116.132.235.204,14300,80,6,"Ether / IP / TCP 192.168.0.106:14300 > 116.132.235.204:http RA"
192.168.0.106,116.132.235.204,14302,80,6,"Ether / IP / TCP 192.168.0.106:14302 > 116.132.235.204:http RA"
192.168.0.106,110.242.68.4,14314,80,6,"Ether / IP / TCP 192.168.0.106:14314 > 110.242.68.4:http S"
110.242.68.4,192.168.0.106,80,14314,6,"Ether / IP / TCP 110.242.68.4:http > 192.168.0.106:14314 SA"
192.168.0.106,110.242.68.4,14314,80,6,"Ether / IP / TCP 192.168.0.106:14314 > 110.242.68.4:http A"
192.168.0.106,110.242.68.4,14314,80,6,"Ether / IP / TCP 192.168.0.106:14314 > 110.242.68.4:http FA"
110.242.68.4,192.168.0.106,80,14314,6,"Ether / IP / TCP 110.242.68.4:http > 192.168.0.106:14314 A"
110.242.68.4,192.168.0.106,80,14314,6,"Ether / IP / TCP 110.242.68.4:http > 192.168.0.106:14314 FA"
192.168.0.106,110.242.68.4,14314,80,6,"Ether / IP / TCP 192.168.0.106:14314 > 110.242.68.4:http A"
192.168.0.106,23.77.214.140,6894,443,6,"Ether / IP / TCP 192.168.0.106:6894 > 23.77.214.140:https FA"
23.77.214.140,192.168.0.106,443,6894,6,"Ether / IP / TCP 23.77.214.140:https > 192.168.0.106:6894 PA / Raw"
23.77.214.140,192.168.0.106,443,6894,6,"Ether / IP / TCP 23.77.214.140:https > 192.168.0.106:6894 FA"
192.168.0.106,23.77.214.140,6894,443,6,"Ether / IP / TCP 192.168.0.106:6894 > 23.77.214.140:https RA"
192.168.0.106,116.132.235.204,14306,80,6,"Ether / IP / TCP 192.168.0.106:14306 > 116.132.235.204:http RA"
192.168.0.106,13.32.50.17,6903,443,6,"Ether / IP / TCP 192.168.0.106:6903 > 13.32.50.17:https FA"
13.32.50.17,192.168.0.106,443,6903,6,"Ether / IP / TCP 13.32.50.17:https > 192.168.0.106:6903 FA"
192.168.0.106,13.32.50.17,6903,443,6,"Ether / IP / TCP 192.168.0.106:6903 > 13.32.50.17:https A"
192.168.0.106,116.132.235.204,14307,80,6,"Ether / IP / TCP 192.168.0.106:14307 > 116.132.235.204:http RA"
192.168.0.106,116.132.235.204,14309,80,6,"Ether / IP / TCP 192.168.0.106:14309 > 116.132.235.204:http RA"
192.168.0.106,20.44.10.122,14244,443,6,"Ether / IP / TCP 192.168.0.106:14244 > 20.44.10.122:https A / Raw"
20.44.10.122,192.168.0.106,443,14244,6,"Ether / IP / TCP 20.44.10.122:https > 192.168.0.106:14244 A"
192.168.0.106,202.89.233.101,14194,443,6,"Ether / IP / TCP 192.168.0.106:14194 > 202.89.233.101:https FA"
192.168.0.106,202.89.233.101,14315,443,6,"Ether / IP / TCP 192.168.0.106:14315 > 202.89.233.101:https S"
202.89.233.101,192.168.0.106,443,14315,6,"Ether / IP / TCP 202.89.233.101:https > 192.168.0.106:14315 SA"
192.168.0.106,202.89.233.101,14315,443,6,"Ether / IP / TCP 192.168.0.106:14315 > 202.89.233.101:https A"
192.168.0.106,202.89.233.101,14315,443,6,"Ether / IP / TCP 192.168.0.106:14315 > 202.89.233.101:https PA / Raw"
202.89.233.101,192.168.0.106,443,14194,6,"Ether / IP / TCP 202.89.233.101:https > 192.168.0.106:14194 A"
202.89.233.101,192.168.0.106,443,14194,6,"Ether / IP / TCP 202.89.233.101:https > 192.168.0.106:14194 RA"
202.89.233.101,192.168.0.106,443,14315,6,"Ether / IP / TCP 202.89.233.101:https > 192.168.0.106:14315 A"
202.89.233.101,192.168.0.106,443,14315,6,"Ether / IP / TCP 202.89.233.101:https > 192.168.0.106:14315 A / Raw"
202.89.233.101,192.168.0.106,443,14315,6,"Ether / IP / TCP 202.89.233.101:https > 192.168.0.106:14315 A / Raw"
202.89.233.101,192.168.0.106,443,14315,6,"Ether / IP / TCP 202.89.233.101:https > 192.168.0.106:14315 A / Raw"
202.89.233.101,192.168.0.106,443,14315,6,"Ether / IP / TCP 202.89.233.101:https > 192.168.0.106:14315 A / Raw"
202.89.233.101,192.168.0.106,443,14315,6,"Ether / IP / TCP 202.89.233.101:https > 192.168.0.106:14315 A / Raw"
202.89.233.101,192.168.0.106,443,14315,6,"Ether / IP / TCP 202.89.233.101:https > 192.168.0.106:14315 PA / Raw"
192.168.0.106,202.89.233.101,14315,443,6,"Ether / IP / TCP 192.168.0.106:14315 > 202.89.233.101:https A"
192.168.0.106,202.89.233.101,14315,443,6,"Ether / IP / TCP 192.168.0.106:14315 > 202.89.233.101:https PA / Raw"
202.89.233.101,192.168.0.106,443,14315,6,"Ether / IP / TCP 202.89.233.101:https > 192.168.0.106:14315 A"
202.89.233.101,192.168.0.106,443,14315,6,"Ether / IP / TCP 202.89.233.101:https > 192.168.0.106:14315 PA / Raw"
202.89.233.101,192.168.0.106,443,14315,6,"Ether / IP / TCP 202.89.233.101:https > 192.168.0.106:14315 PA / Raw"
192.168.0.106,202.89.233.101,14315,443,6,"Ether / IP / TCP 192.168.0.106:14315 > 202.89.233.101:https A"
192.168.0.106,110.242.68.4,14316,80,6,"Ether / IP / TCP 192.168.0.106:14316 > 110.242.68.4:http S"
110.242.68.4,192.168.0.106,80,14316,6,"Ether / IP / TCP 110.242.68.4:http > 192.168.0.106:14316 SA"
192.168.0.106,110.242.68.4,14316,80,6,"Ether / IP / TCP 192.168.0.106:14316 > 110.242.68.4:http A"
192.168.0.106,110.242.68.4,14316,80,6,"Ether / IP / TCP 192.168.0.106:14316 > 110.242.68.4:http FA"
110.242.68.4,192.168.0.106,80,14316,6,"Ether / IP / TCP 110.242.68.4:http > 192.168.0.106:14316 A"
110.242.68.4,192.168.0.106,80,14316,6,"Ether / IP / TCP 110.242.68.4:http > 192.168.0.106:14316 FA"
192.168.0.106,110.242.68.4,14316,80,6,"Ether / IP / TCP 192.168.0.106:14316 > 110.242.68.4:http A"
192.168.0.106,34.225.41.193,3626,443,6,"Ether / IP / TCP 192.168.0.106:3626 > 34.225.41.193:https PA / Raw"
34.225.41.193,192.168.0.106,443,3626,6,"Ether / IP / TCP 34.225.41.193:https > 192.168.0.106:3626 PA / Raw"
34.225.41.193,192.168.0.106,443,3626,6,"Ether / IP / TCP 34.225.41.193:https > 192.168.0.106:3626 PA / Raw"
192.168.0.106,34.225.41.193,3626,443,6,"Ether / IP / TCP 192.168.0.106:3626 > 34.225.41.193:https A"
13.107.21.239,192.168.0.106,443,6902,6,"Ether / IP / TCP 13.107.21.239:https > 192.168.0.106:6902 RA"
192.168.0.106,110.242.68.4,14317,80,6,"Ether / IP / TCP 192.168.0.106:14317 > 110.242.68.4:http S"
110.242.68.4,192.168.0.106,80,14317,6,"Ether / IP / TCP 110.242.68.4:http > 192.168.0.106:14317 SA"
192.168.0.106,110.242.68.4,14317,80,6,"Ether / IP / TCP 192.168.0.106:14317 > 110.242.68.4:http A"
192.168.0.106,110.242.68.4,14317,80,6,"Ether / IP / TCP 192.168.0.106:14317 > 110.242.68.4:http FA"
110.242.68.4,192.168.0.106,80,14317,6,"Ether / IP / TCP 110.242.68.4:http > 192.168.0.106:14317 A"
110.242.68.4,192.168.0.106,80,14317,6,"Ether / IP / TCP 110.242.68.4:http > 192.168.0.106:14317 FA"
192.168.0.106,110.242.68.4,14317,80,6,"Ether / IP / TCP 192.168.0.106:14317 > 110.242.68.4:http A"
192.168.0.106,52.2.80.44,3709,443,6,"Ether / IP / TCP 192.168.0.106:3709 > 52.2.80.44:https PA / Raw"
52.2.80.44,192.168.0.106,443,3709,6,"Ether / IP / TCP 52.2.80.44:https > 192.168.0.106:3709 A / Padding"
192.168.0.106,110.242.68.4,14318,80,6,"Ether / IP / TCP 192.168.0.106:14318 > 110.242.68.4:http S"
110.242.68.4,192.168.0.106,80,14318,6,"Ether / IP / TCP 110.242.68.4:http > 192.168.0.106:14318 SA"
192.168.0.106,110.242.68.4,14318,80,6,"Ether / IP / TCP 192.168.0.106:14318 > 110.242.68.4:http A"
192.168.0.106,110.242.68.4,14318,80,6,"Ether / IP / TCP 192.168.0.106:14318 > 110.242.68.4:http FA"
