srcip,dstip,sport,dport,proto,data
192.168.192.1,192.168.192.2,137,137,17,"Ether / IP / UDP 192.168.192.1:netbios_ns > 192.168.192.2:netbios_ns / NBNSHeader / Raw"
192.168.0.106,58.223.1.234,8050,8080,6,"Ether / IP / TCP 192.168.0.106:8050 > 58.223.1.234:8080 FA"
58.223.1.234,192.168.0.106,8080,8050,6,"Ether / IP / TCP 58.223.1.234:8080 > 192.168.0.106:8050 PA / Raw"
58.223.1.234,192.168.0.106,8080,8050,6,"Ether / IP / TCP 58.223.1.234:8080 > 192.168.0.106:8050 FA"
192.168.0.106,58.223.1.234,8050,8080,6,"Ether / IP / TCP 192.168.0.106:8050 > 58.223.1.234:8080 RA"
192.168.0.106,116.132.235.204,8057,80,6,"Ether / IP / TCP 192.168.0.106:8057 > 116.132.235.204:http S"
111.206.209.249,192.168.0.106,443,7999,6,"Ether / IP / TCP 111.206.209.249:https > 192.168.0.106:7999 PA / Raw"
111.206.209.249,192.168.0.106,443,7999,6,"Ether / IP / TCP 111.206.209.249:https > 192.168.0.106:7999 FA"
111.206.209.249,192.168.0.106,443,7999,6,"Ether / IP / TCP 111.206.209.249:https > 192.168.0.106:7999 FA"
111.206.209.249,192.168.0.106,443,7999,6,"Ether / IP / TCP 111.206.209.249:https > 192.168.0.106:7999 FPA / Raw"
192.168.0.106,111.206.209.249,7999,443,6,"Ether / IP / TCP 192.168.0.106:7999 > 111.206.209.249:https A"
192.168.0.106,111.206.209.249,7999,443,6,"Ether / IP / TCP 192.168.0.106:7999 > 111.206.209.249:https A"
116.132.235.204,192.168.0.106,80,8057,6,"Ether / IP / TCP 116.132.235.204:http > 192.168.0.106:8057 SA"
192.168.0.106,116.132.235.204,8057,80,6,"Ether / IP / TCP 192.168.0.106:8057 > 116.132.235.204:http A"
192.168.0.106,116.132.235.204,8057,80,6,"Ether / IP / TCP 192.168.0.106:8057 > 116.132.235.204:http PA / Raw"
192.168.0.106,116.132.235.204,8057,80,6,"Ether / IP / TCP 192.168.0.106:8057 > 116.132.235.204:http A / Raw"
192.168.0.106,116.132.235.204,8057,80,6,"Ether / IP / TCP 192.168.0.106:8057 > 116.132.235.204:http A / Raw"
192.168.0.106,116.132.235.204,8057,80,6,"Ether / IP / TCP 192.168.0.106:8057 > 116.132.235.204:http PA / Raw"
116.132.235.204,192.168.0.106,80,8057,6,"Ether / IP / TCP 116.132.235.204:http > 192.168.0.106:8057 A"
116.132.235.204,192.168.0.106,80,8057,6,"Ether / IP / TCP 116.132.235.204:http > 192.168.0.106:8057 A"
116.132.235.204,192.168.0.106,80,8057,6,"Ether / IP / TCP 116.132.235.204:http > 192.168.0.106:8057 A"
116.132.235.204,192.168.0.106,80,8057,6,"Ether / IP / TCP 116.132.235.204:http > 192.168.0.106:8057 PA / Raw"
116.132.235.204,192.168.0.106,80,8057,6,"Ether / IP / TCP 116.132.235.204:http > 192.168.0.106:8057 FA"
192.168.0.106,116.132.235.204,8057,80,6,"Ether / IP / TCP 192.168.0.106:8057 > 116.132.235.204:http A"
192.168.0.106,116.132.235.204,8057,80,6,"Ether / IP / TCP 192.168.0.106:8057 > 116.132.235.204:http FA"
116.132.235.204,192.168.0.106,80,8057,6,"Ether / IP / TCP 116.132.235.204:http > 192.168.0.106:8057 A"
192.168.0.106,116.132.235.204,8058,80,6,"Ether / IP / TCP 192.168.0.106:8058 > 116.132.235.204:http S"
116.132.235.204,192.168.0.106,80,8058,6,"Ether / IP / TCP 116.132.235.204:http > 192.168.0.106:8058 SA"
192.168.0.106,116.132.235.204,8058,80,6,"Ether / IP / TCP 192.168.0.106:8058 > 116.132.235.204:http A"
192.168.0.106,116.132.235.204,8058,80,6,"Ether / IP / TCP 192.168.0.106:8058 > 116.132.235.204:http PA / Raw"
192.168.0.106,116.132.235.204,8058,80,6,"Ether / IP / TCP 192.168.0.106:8058 > 116.132.235.204:http A / Raw"
192.168.0.106,116.132.235.204,8058,80,6,"Ether / IP / TCP 192.168.0.106:8058 > 116.132.235.204:http A / Raw"
192.168.0.106,116.132.235.204,8058,80,6,"Ether / IP / TCP 192.168.0.106:8058 > 116.132.235.204:http PA / Raw"
116.132.235.204,192.168.0.106,80,8058,6,"Ether / IP / TCP 116.132.235.204:http > 192.168.0.106:8058 A"
116.132.235.204,192.168.0.106,80,8058,6,"Ether / IP / TCP 116.132.235.204:http > 192.168.0.106:8058 A"
116.132.235.204,192.168.0.106,80,8058,6,"Ether / IP / TCP 116.132.235.204:http > 192.168.0.106:8058 A"
116.132.235.204,192.168.0.106,80,8058,6,"Ether / IP / TCP 116.132.235.204:http > 192.168.0.106:8058 PA / Raw"
116.132.235.204,192.168.0.106,80,8058,6,"Ether / IP / TCP 116.132.235.204:http > 192.168.0.106:8058 FA"
192.168.0.106,116.132.235.204,8058,80,6,"Ether / IP / TCP 192.168.0.106:8058 > 116.132.235.204:http A"
192.168.0.106,116.132.235.204,8058,80,6,"Ether / IP / TCP 192.168.0.106:8058 > 116.132.235.204:http FA"
116.132.235.204,192.168.0.106,80,8058,6,"Ether / IP / TCP 116.132.235.204:http > 192.168.0.106:8058 A"
192.168.192.1,192.168.192.2,137,137,17,"Ether / IP / UDP 192.168.192.1:netbios_ns > 192.168.192.2:netbios_ns / NBNSHeader / Raw"
192.168.0.106,192.168.0.1,60938,53,17,"Ether / IP / UDP / DNS Qry ""b'config.edge.skype.com.'"" "
192.168.0.1,192.168.0.106,53,60938,17,"Ether / IP / UDP / DNS Ans ""b'config.edge.skype.com.trafficmanager.net.'"" "
192.168.0.106,13.107.42.16,60939,443,17,"Ether / IP / UDP 192.168.0.106:60939 > 13.107.42.16:https / Raw"
192.168.0.106,13.107.42.16,8059,443,6,"Ether / IP / TCP 192.168.0.106:8059 > 13.107.42.16:https S"
13.107.42.16,192.168.0.106,443,8059,6,"Ether / IP / TCP 13.107.42.16:https > 192.168.0.106:8059 SA"
192.168.0.106,13.107.42.16,8059,443,6,"Ether / IP / TCP 192.168.0.106:8059 > 13.107.42.16:https A"
192.168.0.106,13.107.42.16,8059,443,6,"Ether / IP / TCP 192.168.0.106:8059 > 13.107.42.16:https PA / Raw"
13.107.42.16,192.168.0.106,443,8059,6,"Ether / IP / TCP 13.107.42.16:https > 192.168.0.106:8059 A"
13.107.42.16,192.168.0.106,443,8059,6,"Ether / IP / TCP 13.107.42.16:https > 192.168.0.106:8059 A / Raw"
13.107.42.16,192.168.0.106,443,8059,6,"Ether / IP / TCP 13.107.42.16:https > 192.168.0.106:8059 A / Raw"
13.107.42.16,192.168.0.106,443,8059,6,"Ether / IP / TCP 13.107.42.16:https > 192.168.0.106:8059 A / Raw"
13.107.42.16,192.168.0.106,443,8059,6,"Ether / IP / TCP 13.107.42.16:https > 192.168.0.106:8059 A / Raw"
13.107.42.16,192.168.0.106,443,8059,6,"Ether / IP / TCP 13.107.42.16:https > 192.168.0.106:8059 PA / Raw"
192.168.0.106,13.107.42.16,8059,443,6,"Ether / IP / TCP 192.168.0.106:8059 > 13.107.42.16:https A"
192.168.0.106,13.107.42.16,8059,443,6,"Ether / IP / TCP 192.168.0.106:8059 > 13.107.42.16:https PA / Raw"
192.168.0.106,13.107.42.16,8059,443,6,"Ether / IP / TCP 192.168.0.106:8059 > 13.107.42.16:https PA / Raw"
192.168.0.106,13.107.42.16,8059,443,6,"Ether / IP / TCP 192.168.0.106:8059 > 13.107.42.16:https PA / Raw"
13.107.42.16,192.168.0.106,443,8059,6,"Ether / IP / TCP 13.107.42.16:https > 192.168.0.106:8059 A"
13.107.42.16,192.168.0.106,443,8059,6,"Ether / IP / TCP 13.107.42.16:https > 192.168.0.106:8059 A"
13.107.42.16,192.168.0.106,443,8059,6,"Ether / IP / TCP 13.107.42.16:https > 192.168.0.106:8059 PA / Raw"
13.107.42.16,192.168.0.106,443,8059,6,"Ether / IP / TCP 13.107.42.16:https > 192.168.0.106:8059 PA / Raw"
192.168.0.106,13.107.42.16,8059,443,6,"Ether / IP / TCP 192.168.0.106:8059 > 13.107.42.16:https A"
192.168.0.106,13.107.42.16,8059,443,6,"Ether / IP / TCP 192.168.0.106:8059 > 13.107.42.16:https PA / Raw"
13.107.42.16,192.168.0.106,443,8059,6,"Ether / IP / TCP 13.107.42.16:https > 192.168.0.106:8059 PA / Raw"
13.107.42.16,192.168.0.106,443,8059,6,"Ether / IP / TCP 13.107.42.16:https > 192.168.0.106:8059 A"
192.168.0.106,13.107.42.16,8059,443,6,"Ether / IP / TCP 192.168.0.106:8059 > 13.107.42.16:https A"
192.168.0.106,13.107.42.16,60939,443,17,"Ether / IP / UDP 192.168.0.106:60939 > 13.107.42.16:https / Raw"
13.107.42.16,192.168.0.106,443,8059,6,"Ether / IP / TCP 13.107.42.16:https > 192.168.0.106:8059 PA / Raw"
192.168.0.106,116.132.235.204,8060,80,6,"Ether / IP / TCP 192.168.0.106:8060 > 116.132.235.204:http S"
192.168.0.106,13.107.42.16,8059,443,6,"Ether / IP / TCP 192.168.0.106:8059 > 13.107.42.16:https A"
116.132.235.204,192.168.0.106,80,8060,6,"Ether / IP / TCP 116.132.235.204:http > 192.168.0.106:8060 SA"
192.168.0.106,116.132.235.204,8060,80,6,"Ether / IP / TCP 192.168.0.106:8060 > 116.132.235.204:http A"
192.168.0.106,116.132.235.204,8060,80,6,"Ether / IP / TCP 192.168.0.106:8060 > 116.132.235.204:http PA / Raw"
192.168.0.106,116.132.235.204,8060,80,6,"Ether / IP / TCP 192.168.0.106:8060 > 116.132.235.204:http A / Raw"
192.168.0.106,116.132.235.204,8060,80,6,"Ether / IP / TCP 192.168.0.106:8060 > 116.132.235.204:http A / Raw"
192.168.0.106,116.132.235.204,8060,80,6,"Ether / IP / TCP 192.168.0.106:8060 > 116.132.235.204:http PA / Raw"
116.132.235.204,192.168.0.106,80,8060,6,"Ether / IP / TCP 116.132.235.204:http > 192.168.0.106:8060 A"
116.132.235.204,192.168.0.106,80,8060,6,"Ether / IP / TCP 116.132.235.204:http > 192.168.0.106:8060 A"
116.132.235.204,192.168.0.106,80,8060,6,"Ether / IP / TCP 116.132.235.204:http > 192.168.0.106:8060 A"
116.132.235.204,192.168.0.106,80,8060,6,"Ether / IP / TCP 116.132.235.204:http > 192.168.0.106:8060 PA / Raw"
116.132.235.204,192.168.0.106,80,8060,6,"Ether / IP / TCP 116.132.235.204:http > 192.168.0.106:8060 FA"
192.168.0.106,116.132.235.204,8060,80,6,"Ether / IP / TCP 192.168.0.106:8060 > 116.132.235.204:http A"
192.168.0.106,116.132.235.204,8060,80,6,"Ether / IP / TCP 192.168.0.106:8060 > 116.132.235.204:http FA"
116.132.235.204,192.168.0.106,80,8060,6,"Ether / IP / TCP 116.132.235.204:http > 192.168.0.106:8060 A"
192.168.0.106,13.107.42.16,60939,443,17,"Ether / IP / UDP 192.168.0.106:60939 > 13.107.42.16:https / Raw"
192.168.192.1,192.168.192.2,137,137,17,"Ether / IP / UDP 192.168.192.1:netbios_ns > 192.168.192.2:netbios_ns / NBNSHeader / Raw"
192.168.0.106,116.132.235.204,8061,80,6,"Ether / IP / TCP 192.168.0.106:8061 > 116.132.235.204:http S"
116.132.235.204,192.168.0.106,80,8061,6,"Ether / IP / TCP 116.132.235.204:http > 192.168.0.106:8061 SA"
192.168.0.106,116.132.235.204,8061,80,6,"Ether / IP / TCP 192.168.0.106:8061 > 116.132.235.204:http A"
192.168.0.106,116.132.235.204,8061,80,6,"Ether / IP / TCP 192.168.0.106:8061 > 116.132.235.204:http PA / Raw"
192.168.0.106,116.132.235.204,8061,80,6,"Ether / IP / TCP 192.168.0.106:8061 > 116.132.235.204:http A / Raw"
192.168.0.106,116.132.235.204,8061,80,6,"Ether / IP / TCP 192.168.0.106:8061 > 116.132.235.204:http A / Raw"
192.168.0.106,116.132.235.204,8061,80,6,"Ether / IP / TCP 192.168.0.106:8061 > 116.132.235.204:http PA / Raw"
116.132.235.204,192.168.0.106,80,8061,6,"Ether / IP / TCP 116.132.235.204:http > 192.168.0.106:8061 A"
116.132.235.204,192.168.0.106,80,8061,6,"Ether / IP / TCP 116.132.235.204:http > 192.168.0.106:8061 A"
116.132.235.204,192.168.0.106,80,8061,6,"Ether / IP / TCP 116.132.235.204:http > 192.168.0.106:8061 A"
116.132.235.204,192.168.0.106,80,8061,6,"Ether / IP / TCP 116.132.235.204:http > 192.168.0.106:8061 PA / Raw"
116.132.235.204,192.168.0.106,80,8061,6,"Ether / IP / TCP 116.132.235.204:http > 192.168.0.106:8061 FA"
192.168.0.106,116.132.235.204,8061,80,6,"Ether / IP / TCP 192.168.0.106:8061 > 116.132.235.204:http A"
192.168.0.106,116.132.235.204,8061,80,6,"Ether / IP / TCP 192.168.0.106:8061 > 116.132.235.204:http FA"
192.168.0.106,13.89.179.10,3758,443,6,"Ether / IP / TCP 192.168.0.106:3758 > 13.89.179.10:https PA / Raw"
192.168.0.106,13.89.179.10,3758,443,6,"Ether / IP / TCP 192.168.0.106:3758 > 13.89.179.10:https PA / Raw"
192.168.0.106,13.89.179.10,3758,443,6,"Ether / IP / TCP 192.168.0.106:3758 > 13.89.179.10:https PA / Raw"
192.168.0.106,116.132.235.204,8061,80,6,"Ether / IP / TCP 192.168.0.106:8061 > 116.132.235.204:http FA"
13.89.179.10,192.168.0.106,443,3758,6,"Ether / IP / TCP 13.89.179.10:https > 192.168.0.106:3758 A / Padding"
13.89.179.10,192.168.0.106,443,3758,6,"Ether / IP / TCP 13.89.179.10:https > 192.168.0.106:3758 A"
13.89.179.10,192.168.0.106,443,3758,6,"Ether / IP / TCP 13.89.179.10:https > 192.168.0.106:3758 PA / Raw"
13.89.179.10,192.168.0.106,443,3758,6,"Ether / IP / TCP 13.89.179.10:https > 192.168.0.106:3758 PA / Raw"
192.168.0.106,13.89.179.10,3758,443,6,"Ether / IP / TCP 192.168.0.106:3758 > 13.89.179.10:https A"
13.89.179.10,192.168.0.106,443,3758,6,"Ether / IP / TCP 13.89.179.10:https > 192.168.0.106:3758 PA / Raw"
192.168.0.106,13.89.179.10,3758,443,6,"Ether / IP / TCP 192.168.0.106:3758 > 13.89.179.10:https PA / Raw"
192.168.0.106,13.107.42.16,60939,443,17,"Ether / IP / UDP 192.168.0.106:60939 > 13.107.42.16:https / Raw"
13.89.179.10,192.168.0.106,443,3758,6,"Ether / IP / TCP 13.89.179.10:https > 192.168.0.106:3758 A / Padding"
192.168.0.106,116.132.235.204,8061,80,6,"Ether / IP / TCP 192.168.0.106:8061 > 116.132.235.204:http FA"
192.168.0.106,116.132.235.204,8062,80,6,"Ether / IP / TCP 192.168.0.106:8062 > 116.132.235.204:http S"
192.168.0.106,20.44.202.200,7989,443,6,"Ether / IP / TCP 192.168.0.106:7989 > 20.44.202.200:https RA"
116.132.235.204,192.168.0.106,80,8062,6,"Ether / IP / TCP 116.132.235.204:http > 192.168.0.106:8062 SA"
192.168.0.106,116.132.235.204,8062,80,6,"Ether / IP / TCP 192.168.0.106:8062 > 116.132.235.204:http A"
192.168.0.106,116.132.235.204,8062,80,6,"Ether / IP / TCP 192.168.0.106:8062 > 116.132.235.204:http PA / Raw"
192.168.0.106,116.132.235.204,8062,80,6,"Ether / IP / TCP 192.168.0.106:8062 > 116.132.235.204:http A / Raw"
192.168.0.106,116.132.235.204,8062,80,6,"Ether / IP / TCP 192.168.0.106:8062 > 116.132.235.204:http A / Raw"
192.168.0.106,116.132.235.204,8062,80,6,"Ether / IP / TCP 192.168.0.106:8062 > 116.132.235.204:http PA / Raw"
116.132.235.204,192.168.0.106,80,8062,6,"Ether / IP / TCP 116.132.235.204:http > 192.168.0.106:8062 A"
116.132.235.204,192.168.0.106,80,8062,6,"Ether / IP / TCP 116.132.235.204:http > 192.168.0.106:8062 A"
116.132.235.204,192.168.0.106,80,8062,6,"Ether / IP / TCP 116.132.235.204:http > 192.168.0.106:8062 A"
116.132.235.204,192.168.0.106,80,8062,6,"Ether / IP / TCP 116.132.235.204:http > 192.168.0.106:8062 PA / Raw"
116.132.235.204,192.168.0.106,80,8062,6,"Ether / IP / TCP 116.132.235.204:http > 192.168.0.106:8062 FA"
192.168.0.106,116.132.235.204,8062,80,6,"Ether / IP / TCP 192.168.0.106:8062 > 116.132.235.204:http A"
192.168.0.106,116.132.235.204,8062,80,6,"Ether / IP / TCP 192.168.0.106:8062 > 116.132.235.204:http FA"
192.168.0.106,116.132.235.204,8063,80,6,"Ether / IP / TCP 192.168.0.106:8063 > 116.132.235.204:http S"
116.132.235.204,192.168.0.106,80,8063,6,"Ether / IP / TCP 116.132.235.204:http > 192.168.0.106:8063 SA"
192.168.0.106,116.132.235.204,8063,80,6,"Ether / IP / TCP 192.168.0.106:8063 > 116.132.235.204:http A"
192.168.0.106,116.132.235.204,8063,80,6,"Ether / IP / TCP 192.168.0.106:8063 > 116.132.235.204:http PA / Raw"
192.168.0.106,116.132.235.204,8063,80,6,"Ether / IP / TCP 192.168.0.106:8063 > 116.132.235.204:http A / Raw"
192.168.0.106,116.132.235.204,8063,80,6,"Ether / IP / TCP 192.168.0.106:8063 > 116.132.235.204:http A / Raw"
192.168.0.106,116.132.235.204,8063,80,6,"Ether / IP / TCP 192.168.0.106:8063 > 116.132.235.204:http PA / Raw"
116.132.235.204,192.168.0.106,80,8063,6,"Ether / IP / TCP 116.132.235.204:http > 192.168.0.106:8063 A"
116.132.235.204,192.168.0.106,80,8063,6,"Ether / IP / TCP 116.132.235.204:http > 192.168.0.106:8063 A"
116.132.235.204,192.168.0.106,80,8063,6,"Ether / IP / TCP 116.132.235.204:http > 192.168.0.106:8063 A"
116.132.235.204,192.168.0.106,80,8063,6,"Ether / IP / TCP 116.132.235.204:http > 192.168.0.106:8063 PA / Raw"
116.132.235.204,192.168.0.106,80,8063,6,"Ether / IP / TCP 116.132.235.204:http > 192.168.0.106:8063 FA"
192.168.0.106,116.132.235.204,8063,80,6,"Ether / IP / TCP 192.168.0.106:8063 > 116.132.235.204:http A"
192.168.0.106,116.132.235.204,8063,80,6,"Ether / IP / TCP 192.168.0.106:8063 > 116.132.235.204:http FA"
192.168.0.106,34.225.41.193,3626,443,6,"Ether / IP / TCP 192.168.0.106:3626 > 34.225.41.193:https PA / Raw"
192.168.0.106,13.89.179.10,3758,443,6,"Ether / IP / TCP 192.168.0.106:3758 > 13.89.179.10:https PA / Raw"
192.168.0.106,13.89.179.10,3758,443,6,"Ether / IP / TCP 192.168.0.106:3758 > 13.89.179.10:https PA / Raw"
192.168.0.106,116.132.235.204,8062,80,6,"Ether / IP / TCP 192.168.0.106:8062 > 116.132.235.204:http FA"
192.168.0.106,116.132.235.204,8063,80,6,"Ether / IP / TCP 192.168.0.106:8063 > 116.132.235.204:http FA"
13.89.179.10,192.168.0.106,443,3758,6,"Ether / IP / TCP 13.89.179.10:https > 192.168.0.106:3758 A / Padding"
13.89.179.10,192.168.0.106,443,3758,6,"Ether / IP / TCP 13.89.179.10:https > 192.168.0.106:3758 PA / Raw"
13.89.179.10,192.168.0.106,443,3758,6,"Ether / IP / TCP 13.89.179.10:https > 192.168.0.106:3758 PA / Raw"
192.168.0.106,13.89.179.10,3758,443,6,"Ether / IP / TCP 192.168.0.106:3758 > 13.89.179.10:https A"
34.225.41.193,192.168.0.106,443,3626,6,"Ether / IP / TCP 34.225.41.193:https > 192.168.0.106:3626 PA / Raw"
34.225.41.193,192.168.0.106,443,3626,6,"Ether / IP / TCP 34.225.41.193:https > 192.168.0.106:3626 PA / Raw"
192.168.0.106,34.225.41.193,3626,443,6,"Ether / IP / TCP 192.168.0.106:3626 > 34.225.41.193:https A"
192.168.0.106,202.89.233.101,7880,443,6,"Ether / IP / TCP 192.168.0.106:7880 > 202.89.233.101:https PA / Raw"
192.168.0.106,202.89.233.101,7880,443,6,"Ether / IP / TCP 192.168.0.106:7880 > 202.89.233.101:https PA / Raw"
192.168.0.106,202.89.233.101,7880,443,6,"Ether / IP / TCP 192.168.0.106:7880 > 202.89.233.101:https A / Raw"
192.168.0.106,202.89.233.101,7880,443,6,"Ether / IP / TCP 192.168.0.106:7880 > 202.89.233.101:https PA / Raw"
192.168.0.106,202.89.233.101,7880,443,6,"Ether / IP / TCP 192.168.0.106:7880 > 202.89.233.101:https A / Raw"
192.168.0.106,202.89.233.101,7880,443,6,"Ether / IP / TCP 192.168.0.106:7880 > 202.89.233.101:https A / Raw"
192.168.0.106,202.89.233.101,7880,443,6,"Ether / IP / TCP 192.168.0.106:7880 > 202.89.233.101:https PA / Raw"
192.168.0.106,202.89.233.101,7880,443,6,"Ether / IP / TCP 192.168.0.106:7880 > 202.89.233.101:https A / Raw"
192.168.0.106,202.89.233.101,7880,443,6,"Ether / IP / TCP 192.168.0.106:7880 > 202.89.233.101:https A / Raw"
192.168.0.106,202.89.233.101,7880,443,6,"Ether / IP / TCP 192.168.0.106:7880 > 202.89.233.101:https PA / Raw"
202.89.233.101,192.168.0.106,443,7880,6,"Ether / IP / TCP 202.89.233.101:https > 192.168.0.106:7880 A / Padding"
202.89.233.101,192.168.0.106,443,7880,6,"Ether / IP / TCP 202.89.233.101:https > 192.168.0.106:7880 A / Padding"
202.89.233.101,192.168.0.106,443,7880,6,"Ether / IP / TCP 202.89.233.101:https > 192.168.0.106:7880 PA / Raw"
202.89.233.101,192.168.0.106,443,7880,6,"Ether / IP / TCP 202.89.233.101:https > 192.168.0.106:7880 A / Padding"
202.89.233.101,192.168.0.106,443,7880,6,"Ether / IP / TCP 202.89.233.101:https > 192.168.0.106:7880 A / Padding"
202.89.233.101,192.168.0.106,443,7880,6,"Ether / IP / TCP 202.89.233.101:https > 192.168.0.106:7880 A / Padding"
202.89.233.101,192.168.0.106,443,7880,6,"Ether / IP / TCP 202.89.233.101:https > 192.168.0.106:7880 A / Padding"
192.168.0.106,202.89.233.101,7880,443,6,"Ether / IP / TCP 192.168.0.106:7880 > 202.89.233.101:https A"
192.168.0.106,116.132.235.204,8062,80,6,"Ether / IP / TCP 192.168.0.106:8062 > 116.132.235.204:http FA"
202.89.233.101,192.168.0.106,443,7880,6,"Ether / IP / TCP 202.89.233.101:https > 192.168.0.106:7880 PA / Raw"
192.168.0.106,202.89.233.101,7880,443,6,"Ether / IP / TCP 192.168.0.106:7880 > 202.89.233.101:https A"
202.89.233.101,192.168.0.106,443,7880,6,"Ether / IP / TCP 202.89.233.101:https > 192.168.0.106:7880 PA / Raw"
192.168.0.106,116.132.235.204,8061,80,6,"Ether / IP / TCP 192.168.0.106:8061 > 116.132.235.204:http FA"
192.168.0.106,202.89.233.101,7880,443,6,"Ether / IP / TCP 192.168.0.106:7880 > 202.89.233.101:https A"
192.168.0.106,116.132.235.204,8063,80,6,"Ether / IP / TCP 192.168.0.106:8063 > 116.132.235.204:http FA"
202.89.233.101,192.168.0.106,443,7880,6,"Ether / IP / TCP 202.89.233.101:https > 192.168.0.106:7880 PA / Raw"
202.89.233.101,192.168.0.106,443,7880,6,"Ether / IP / TCP 202.89.233.101:https > 192.168.0.106:7880 PA / Raw"
192.168.0.106,202.89.233.101,7880,443,6,"Ether / IP / TCP 192.168.0.106:7880 > 202.89.233.101:https A"
192.168.0.106,202.89.233.101,7880,443,6,"Ether / IP / TCP 192.168.0.106:7880 > 202.89.233.101:https PA / Raw"
202.89.233.101,192.168.0.106,443,7880,6,"Ether / IP / TCP 202.89.233.101:https > 192.168.0.106:7880 A / Padding"
192.168.0.106,116.132.235.204,8064,80,6,"Ether / IP / TCP 192.168.0.106:8064 > 116.132.235.204:http S"
116.132.235.204,192.168.0.106,80,8064,6,"Ether / IP / TCP 116.132.235.204:http > 192.168.0.106:8064 SA"
192.168.0.106,116.132.235.204,8064,80,6,"Ether / IP / TCP 192.168.0.106:8064 > 116.132.235.204:http A"
192.168.0.106,116.132.235.204,8064,80,6,"Ether / IP / TCP 192.168.0.106:8064 > 116.132.235.204:http PA / Raw"
192.168.0.106,116.132.235.204,8064,80,6,"Ether / IP / TCP 192.168.0.106:8064 > 116.132.235.204:http A / Raw"
192.168.0.106,116.132.235.204,8064,80,6,"Ether / IP / TCP 192.168.0.106:8064 > 116.132.235.204:http A / Raw"
192.168.0.106,116.132.235.204,8064,80,6,"Ether / IP / TCP 192.168.0.106:8064 > 116.132.235.204:http PA / Raw"
116.132.235.204,192.168.0.106,80,8064,6,"Ether / IP / TCP 116.132.235.204:http > 192.168.0.106:8064 A"
116.132.235.204,192.168.0.106,80,8064,6,"Ether / IP / TCP 116.132.235.204:http > 192.168.0.106:8064 A"
116.132.235.204,192.168.0.106,80,8064,6,"Ether / IP / TCP 116.132.235.204:http > 192.168.0.106:8064 A"
116.132.235.204,192.168.0.106,80,8064,6,"Ether / IP / TCP 116.132.235.204:http > 192.168.0.106:8064 PA / Raw"
116.132.235.204,192.168.0.106,80,8064,6,"Ether / IP / TCP 116.132.235.204:http > 192.168.0.106:8064 FA"
192.168.0.106,116.132.235.204,8064,80,6,"Ether / IP / TCP 192.168.0.106:8064 > 116.132.235.204:http A"
192.168.0.106,116.132.235.204,8064,80,6,"Ether / IP / TCP 192.168.0.106:8064 > 116.132.235.204:http FA"
116.132.235.204,192.168.0.106,80,8064,6,"Ether / IP / TCP 116.132.235.204:http > 192.168.0.106:8064 A"
192.168.0.106,13.107.42.16,60939,443,17,"Ether / IP / UDP 192.168.0.106:60939 > 13.107.42.16:https / Raw"
111.206.209.249,192.168.0.106,443,8026,6,"Ether / IP / TCP 111.206.209.249:https > 192.168.0.106:8026 A"
192.168.0.106,111.206.209.249,8026,443,6,"Ether / IP / TCP 192.168.0.106:8026 > 111.206.209.249:https A"
192.168.0.106,13.89.179.10,3758,443,6,"Ether / IP / TCP 192.168.0.106:3758 > 13.89.179.10:https PA / Raw"
192.168.0.106,13.89.179.10,3758,443,6,"Ether / IP / TCP 192.168.0.106:3758 > 13.89.179.10:https PA / Raw"
192.168.0.106,202.89.233.101,7880,443,6,"Ether / IP / TCP 192.168.0.106:7880 > 202.89.233.101:https A / Raw"
192.168.0.106,202.89.233.101,7880,443,6,"Ether / IP / TCP 192.168.0.106:7880 > 202.89.233.101:https PA / Raw"
192.168.0.106,202.89.233.101,7880,443,6,"Ether / IP / TCP 192.168.0.106:7880 > 202.89.233.101:https PA / Raw"
192.168.0.106,202.89.233.101,7880,443,6,"Ether / IP / TCP 192.168.0.106:7880 > 202.89.233.101:https A / Raw"
192.168.0.106,202.89.233.101,7880,443,6,"Ether / IP / TCP 192.168.0.106:7880 > 202.89.233.101:https PA / Raw"
192.168.0.106,202.89.233.101,7880,443,6,"Ether / IP / TCP 192.168.0.106:7880 > 202.89.233.101:https PA / Raw"
202.89.233.101,192.168.0.106,443,7880,6,"Ether / IP / TCP 202.89.233.101:https > 192.168.0.106:7880 A / Padding"
202.89.233.101,192.168.0.106,443,7880,6,"Ether / IP / TCP 202.89.233.101:https > 192.168.0.106:7880 A / Padding"
202.89.233.101,192.168.0.106,443,7880,6,"Ether / IP / TCP 202.89.233.101:https > 192.168.0.106:7880 A / Padding"
202.89.233.101,192.168.0.106,443,7880,6,"Ether / IP / TCP 202.89.233.101:https > 192.168.0.106:7880 A / Padding"
202.89.233.101,192.168.0.106,443,7880,6,"Ether / IP / TCP 202.89.233.101:https > 192.168.0.106:7880 PA / Raw"
192.168.0.106,202.89.233.101,7880,443,6,"Ether / IP / TCP 192.168.0.106:7880 > 202.89.233.101:https A"
13.89.179.10,192.168.0.106,443,3758,6,"Ether / IP / TCP 13.89.179.10:https > 192.168.0.106:3758 A / Padding"
13.89.179.10,192.168.0.106,443,3758,6,"Ether / IP / TCP 13.89.179.10:https > 192.168.0.106:3758 PA / Raw"
192.168.0.106,110.242.68.3,8065,80,6,"Ether / IP / TCP 192.168.0.106:8065 > 110.242.68.3:http S"
202.89.233.101,192.168.0.106,443,7880,6,"Ether / IP / TCP 202.89.233.101:https > 192.168.0.106:7880 PA / Raw"
192.168.0.106,192.168.0.1,63110,53,17,"Ether / IP / UDP / DNS Qry ""b'szextshort.weixin.qq.com.'"" "
110.242.68.3,192.168.0.106,80,8065,6,"Ether / IP / TCP 110.242.68.3:http > 192.168.0.106:8065 SA"
192.168.0.106,110.242.68.3,8065,80,6,"Ether / IP / TCP 192.168.0.106:8065 > 110.242.68.3:http A"
13.89.179.10,192.168.0.106,443,3758,6,"Ether / IP / TCP 13.89.179.10:https > 192.168.0.106:3758 PA / Raw"
192.168.0.106,13.89.179.10,3758,443,6,"Ether / IP / TCP 192.168.0.106:3758 > 13.89.179.10:https A"
192.168.0.1,192.168.0.106,53,63110,17,"Ether / IP / UDP / DNS Ans ""b'szshort.weixin.qq.com.'"" "
192.168.0.106,157.255.191.46,8066,80,6,"Ether / IP / TCP 192.168.0.106:8066 > 157.255.191.46:http S"
192.168.0.106,13.89.179.10,3758,443,6,"Ether / IP / TCP 192.168.0.106:3758 > 13.89.179.10:https PA / Raw"
192.168.0.106,13.89.179.10,3758,443,6,"Ether / IP / TCP 192.168.0.106:3758 > 13.89.179.10:https PA / Raw"
192.168.0.106,202.89.233.101,7880,443,6,"Ether / IP / TCP 192.168.0.106:7880 > 202.89.233.101:https A"
192.168.0.106,110.242.68.3,8065,80,6,"Ether / IP / TCP 192.168.0.106:8065 > 110.242.68.3:http FA"
157.255.191.46,192.168.0.106,80,8066,6,"Ether / IP / TCP 157.255.191.46:http > 192.168.0.106:8066 SA"
192.168.0.106,157.255.191.46,8066,80,6,"Ether / IP / TCP 192.168.0.106:8066 > 157.255.191.46:http A"
192.168.0.106,157.255.191.46,8066,80,6,"Ether / IP / TCP 192.168.0.106:8066 > 157.255.191.46:http PA / Raw"
157.255.191.46,192.168.0.106,80,8066,6,"Ether / IP / TCP 157.255.191.46:http > 192.168.0.106:8066 A"
157.255.191.46,192.168.0.106,80,8066,6,"Ether / IP / TCP 157.255.191.46:http > 192.168.0.106:8066 PA / Raw"
157.255.191.46,192.168.0.106,80,8066,6,"Ether / IP / TCP 157.255.191.46:http > 192.168.0.106:8066 FA"
192.168.0.106,157.255.191.46,8066,80,6,"Ether / IP / TCP 192.168.0.106:8066 > 157.255.191.46:http A"
192.168.0.106,157.255.191.46,8066,80,6,"Ether / IP / TCP 192.168.0.106:8066 > 157.255.191.46:http FA"
13.89.179.10,192.168.0.106,443,3758,6,"Ether / IP / TCP 13.89.179.10:https > 192.168.0.106:3758 A / Padding"
13.89.179.10,192.168.0.106,443,3758,6,"Ether / IP / TCP 13.89.179.10:https > 192.168.0.106:3758 PA / Raw"
13.89.179.10,192.168.0.106,443,3758,6,"Ether / IP / TCP 13.89.179.10:https > 192.168.0.106:3758 PA / Raw"
192.168.0.106,13.89.179.10,3758,443,6,"Ether / IP / TCP 192.168.0.106:3758 > 13.89.179.10:https A"
192.168.0.106,110.242.68.3,8065,80,6,"Ether / IP / TCP 192.168.0.106:8065 > 110.242.68.3:http FA"
192.168.0.106,116.132.235.204,8062,80,6,"Ether / IP / TCP 192.168.0.106:8062 > 116.132.235.204:http FA"
192.168.0.106,157.255.191.46,8066,80,6,"Ether / IP / TCP 192.168.0.106:8066 > 157.255.191.46:http FA"
192.168.0.106,116.132.235.204,8063,80,6,"Ether / IP / TCP 192.168.0.106:8063 > 116.132.235.204:http FA"
192.168.0.106,116.132.235.204,8067,80,6,"Ether / IP / TCP 192.168.0.106:8067 > 116.132.235.204:http S"
116.132.235.204,192.168.0.106,80,8067,6,"Ether / IP / TCP 116.132.235.204:http > 192.168.0.106:8067 SA"
192.168.0.106,116.132.235.204,8067,80,6,"Ether / IP / TCP 192.168.0.106:8067 > 116.132.235.204:http A"
192.168.0.106,116.132.235.204,8067,80,6,"Ether / IP / TCP 192.168.0.106:8067 > 116.132.235.204:http PA / Raw"
192.168.0.106,116.132.235.204,8067,80,6,"Ether / IP / TCP 192.168.0.106:8067 > 116.132.235.204:http A / Raw"
192.168.0.106,116.132.235.204,8067,80,6,"Ether / IP / TCP 192.168.0.106:8067 > 116.132.235.204:http A / Raw"
192.168.0.106,116.132.235.204,8067,80,6,"Ether / IP / TCP 192.168.0.106:8067 > 116.132.235.204:http PA / Raw"
116.132.235.204,192.168.0.106,80,8067,6,"Ether / IP / TCP 116.132.235.204:http > 192.168.0.106:8067 A"
116.132.235.204,192.168.0.106,80,8067,6,"Ether / IP / TCP 116.132.235.204:http > 192.168.0.106:8067 A"
116.132.235.204,192.168.0.106,80,8067,6,"Ether / IP / TCP 116.132.235.204:http > 192.168.0.106:8067 A"
116.132.235.204,192.168.0.106,80,8067,6,"Ether / IP / TCP 116.132.235.204:http > 192.168.0.106:8067 PA / Raw"
116.132.235.204,192.168.0.106,80,8067,6,"Ether / IP / TCP 116.132.235.204:http > 192.168.0.106:8067 FA"
192.168.0.106,116.132.235.204,8067,80,6,"Ether / IP / TCP 192.168.0.106:8067 > 116.132.235.204:http A"
192.168.0.106,116.132.235.204,8067,80,6,"Ether / IP / TCP 192.168.0.106:8067 > 116.132.235.204:http FA"
116.132.235.204,192.168.0.106,80,8067,6,"Ether / IP / TCP 116.132.235.204:http > 192.168.0.106:8067 A"
192.168.0.106,116.132.235.204,8068,80,6,"Ether / IP / TCP 192.168.0.106:8068 > 116.132.235.204:http S"
116.132.235.204,192.168.0.106,80,8068,6,"Ether / IP / TCP 116.132.235.204:http > 192.168.0.106:8068 SA"
192.168.0.106,116.132.235.204,8068,80,6,"Ether / IP / TCP 192.168.0.106:8068 > 116.132.235.204:http A"
192.168.0.106,116.132.235.204,8068,80,6,"Ether / IP / TCP 192.168.0.106:8068 > 116.132.235.204:http PA / Raw"
192.168.0.106,116.132.235.204,8068,80,6,"Ether / IP / TCP 192.168.0.106:8068 > 116.132.235.204:http A / Raw"
192.168.0.106,116.132.235.204,8068,80,6,"Ether / IP / TCP 192.168.0.106:8068 > 116.132.235.204:http A / Raw"
192.168.0.106,116.132.235.204,8068,80,6,"Ether / IP / TCP 192.168.0.106:8068 > 116.132.235.204:http PA / Raw"
116.132.235.204,192.168.0.106,80,8068,6,"Ether / IP / TCP 116.132.235.204:http > 192.168.0.106:8068 A"
116.132.235.204,192.168.0.106,80,8068,6,"Ether / IP / TCP 116.132.235.204:http > 192.168.0.106:8068 A"
116.132.235.204,192.168.0.106,80,8068,6,"Ether / IP / TCP 116.132.235.204:http > 192.168.0.106:8068 A"
116.132.235.204,192.168.0.106,80,8068,6,"Ether / IP / TCP 116.132.235.204:http > 192.168.0.106:8068 PA / Raw"
116.132.235.204,192.168.0.106,80,8068,6,"Ether / IP / TCP 116.132.235.204:http > 192.168.0.106:8068 FA"
192.168.0.106,116.132.235.204,8068,80,6,"Ether / IP / TCP 192.168.0.106:8068 > 116.132.235.204:http A"
192.168.0.106,116.132.235.204,8068,80,6,"Ether / IP / TCP 192.168.0.106:8068 > 116.132.235.204:http FA"
116.132.235.204,192.168.0.106,80,8068,6,"Ether / IP / TCP 116.132.235.204:http > 192.168.0.106:8068 A"
192.168.0.106,110.242.68.3,8065,80,6,"Ether / IP / TCP 192.168.0.106:8065 > 110.242.68.3:http FA"
192.168.0.106,157.255.191.46,8066,80,6,"Ether / IP / TCP 192.168.0.106:8066 > 157.255.191.46:http FA"
192.168.0.106,116.132.235.204,8061,80,6,"Ether / IP / TCP 192.168.0.106:8061 > 116.132.235.204:http FA"
192.168.0.106,116.132.235.204,8069,80,6,"Ether / IP / TCP 192.168.0.106:8069 > 116.132.235.204:http S"
116.132.235.204,192.168.0.106,80,8069,6,"Ether / IP / TCP 116.132.235.204:http > 192.168.0.106:8069 SA"
192.168.0.106,116.132.235.204,8069,80,6,"Ether / IP / TCP 192.168.0.106:8069 > 116.132.235.204:http A"
192.168.0.106,116.132.235.204,8069,80,6,"Ether / IP / TCP 192.168.0.106:8069 > 116.132.235.204:http PA / Raw"
192.168.0.106,116.132.235.204,8069,80,6,"Ether / IP / TCP 192.168.0.106:8069 > 116.132.235.204:http A / Raw"
192.168.0.106,116.132.235.204,8069,80,6,"Ether / IP / TCP 192.168.0.106:8069 > 116.132.235.204:http A / Raw"
192.168.0.106,116.132.235.204,8069,80,6,"Ether / IP / TCP 192.168.0.106:8069 > 116.132.235.204:http PA / Raw"
116.132.235.204,192.168.0.106,80,8069,6,"Ether / IP / TCP 116.132.235.204:http > 192.168.0.106:8069 A"
116.132.235.204,192.168.0.106,80,8069,6,"Ether / IP / TCP 116.132.235.204:http > 192.168.0.106:8069 A"
116.132.235.204,192.168.0.106,80,8069,6,"Ether / IP / TCP 116.132.235.204:http > 192.168.0.106:8069 A"
116.132.235.204,192.168.0.106,80,8069,6,"Ether / IP / TCP 116.132.235.204:http > 192.168.0.106:8069 PA / Raw"
116.132.235.204,192.168.0.106,80,8069,6,"Ether / IP / TCP 116.132.235.204:http > 192.168.0.106:8069 FA"
192.168.0.106,116.132.235.204,8069,80,6,"Ether / IP / TCP 192.168.0.106:8069 > 116.132.235.204:http A"
192.168.0.106,116.132.235.204,8069,80,6,"Ether / IP / TCP 192.168.0.106:8069 > 116.132.235.204:http FA"
116.132.235.204,192.168.0.106,80,8069,6,"Ether / IP / TCP 116.132.235.204:http > 192.168.0.106:8069 A"
192.168.0.106,110.242.68.3,8065,80,6,"Ether / IP / TCP 192.168.0.106:8065 > 110.242.68.3:http FA"
192.168.0.106,157.255.191.46,8066,80,6,"Ether / IP / TCP 192.168.0.106:8066 > 157.255.191.46:http FA"
192.168.192.1,192.168.192.2,137,137,17,"Ether / IP / UDP 192.168.192.1:netbios_ns > 192.168.192.2:netbios_ns / NBNSHeader / Raw"
192.168.0.106,116.132.235.204,8062,80,6,"Ether / IP / TCP 192.168.0.106:8062 > 116.132.235.204:http FA"
192.168.0.106,116.132.235.204,8070,80,6,"Ether / IP / TCP 192.168.0.106:8070 > 116.132.235.204:http S"
116.132.235.204,192.168.0.106,80,8070,6,"Ether / IP / TCP 116.132.235.204:http > 192.168.0.106:8070 SA"
192.168.0.106,116.132.235.204,8070,80,6,"Ether / IP / TCP 192.168.0.106:8070 > 116.132.235.204:http A"
192.168.0.106,116.132.235.204,8070,80,6,"Ether / IP / TCP 192.168.0.106:8070 > 116.132.235.204:http PA / Raw"
192.168.0.106,116.132.235.204,8070,80,6,"Ether / IP / TCP 192.168.0.106:8070 > 116.132.235.204:http A / Raw"
192.168.0.106,116.132.235.204,8070,80,6,"Ether / IP / TCP 192.168.0.106:8070 > 116.132.235.204:http A / Raw"
192.168.0.106,116.132.235.204,8070,80,6,"Ether / IP / TCP 192.168.0.106:8070 > 116.132.235.204:http PA / Raw"
192.168.0.106,116.132.235.204,8063,80,6,"Ether / IP / TCP 192.168.0.106:8063 > 116.132.235.204:http FA"
116.132.235.204,192.168.0.106,80,8070,6,"Ether / IP / TCP 116.132.235.204:http > 192.168.0.106:8070 A"
116.132.235.204,192.168.0.106,80,8070,6,"Ether / IP / TCP 116.132.235.204:http > 192.168.0.106:8070 A"
116.132.235.204,192.168.0.106,80,8070,6,"Ether / IP / TCP 116.132.235.204:http > 192.168.0.106:8070 A"
116.132.235.204,192.168.0.106,80,8070,6,"Ether / IP / TCP 116.132.235.204:http > 192.168.0.106:8070 PA / Raw"
116.132.235.204,192.168.0.106,80,8070,6,"Ether / IP / TCP 116.132.235.204:http > 192.168.0.106:8070 FA"
192.168.0.106,116.132.235.204,8070,80,6,"Ether / IP / TCP 192.168.0.106:8070 > 116.132.235.204:http A"
192.168.0.106,116.132.235.204,8070,80,6,"Ether / IP / TCP 192.168.0.106:8070 > 116.132.235.204:http FA"
116.132.235.204,192.168.0.106,80,8070,6,"Ether / IP / TCP 116.132.235.204:http > 192.168.0.106:8070 A"
192.168.0.106,13.89.179.10,3758,443,6,"Ether / IP / TCP 192.168.0.106:3758 > 13.89.179.10:https PA / Raw"
192.168.0.106,13.89.179.10,3758,443,6,"Ether / IP / TCP 192.168.0.106:3758 > 13.89.179.10:https PA / Raw"
13.89.179.10,192.168.0.106,443,3758,6,"Ether / IP / TCP 13.89.179.10:https > 192.168.0.106:3758 A / Padding"
13.89.179.10,192.168.0.106,443,3758,6,"Ether / IP / TCP 13.89.179.10:https > 192.168.0.106:3758 PA / Raw"
13.89.179.10,192.168.0.106,443,3758,6,"Ether / IP / TCP 13.89.179.10:https > 192.168.0.106:3758 PA / Raw"
192.168.0.106,13.89.179.10,3758,443,6,"Ether / IP / TCP 192.168.0.106:3758 > 13.89.179.10:https A"
13.89.179.10,192.168.0.106,443,3758,6,"Ether / IP / TCP 13.89.179.10:https > 192.168.0.106:3758 PA / Raw"
192.168.0.106,13.89.179.10,3758,443,6,"Ether / IP / TCP 192.168.0.106:3758 > 13.89.179.10:https PA / Raw"
13.89.179.10,192.168.0.106,443,3758,6,"Ether / IP / TCP 13.89.179.10:https > 192.168.0.106:3758 A / Padding"
192.168.0.106,116.132.235.204,8071,80,6,"Ether / IP / TCP 192.168.0.106:8071 > 116.132.235.204:http S"
116.132.235.204,192.168.0.106,80,8071,6,"Ether / IP / TCP 116.132.235.204:http > 192.168.0.106:8071 SA"
192.168.0.106,116.132.235.204,8071,80,6,"Ether / IP / TCP 192.168.0.106:8071 > 116.132.235.204:http A"
192.168.0.106,116.132.235.204,8071,80,6,"Ether / IP / TCP 192.168.0.106:8071 > 116.132.235.204:http PA / Raw"
192.168.0.106,116.132.235.204,8071,80,6,"Ether / IP / TCP 192.168.0.106:8071 > 116.132.235.204:http A / Raw"
192.168.0.106,116.132.235.204,8071,80,6,"Ether / IP / TCP 192.168.0.106:8071 > 116.132.235.204:http A / Raw"
192.168.0.106,116.132.235.204,8071,80,6,"Ether / IP / TCP 192.168.0.106:8071 > 116.132.235.204:http PA / Raw"
116.132.235.204,192.168.0.106,80,8071,6,"Ether / IP / TCP 116.132.235.204:http > 192.168.0.106:8071 A"
116.132.235.204,192.168.0.106,80,8071,6,"Ether / IP / TCP 116.132.235.204:http > 192.168.0.106:8071 A"
116.132.235.204,192.168.0.106,80,8071,6,"Ether / IP / TCP 116.132.235.204:http > 192.168.0.106:8071 A"
116.132.235.204,192.168.0.106,80,8071,6,"Ether / IP / TCP 116.132.235.204:http > 192.168.0.106:8071 PA / Raw"
116.132.235.204,192.168.0.106,80,8071,6,"Ether / IP / TCP 116.132.235.204:http > 192.168.0.106:8071 FA"
192.168.0.106,116.132.235.204,8071,80,6,"Ether / IP / TCP 192.168.0.106:8071 > 116.132.235.204:http A"
192.168.0.106,116.132.235.204,8071,80,6,"Ether / IP / TCP 192.168.0.106:8071 > 116.132.235.204:http FA"
116.132.235.204,192.168.0.106,80,8071,6,"Ether / IP / TCP 116.132.235.204:http > 192.168.0.106:8071 A"
192.168.0.106,116.132.235.204,8072,80,6,"Ether / IP / TCP 192.168.0.106:8072 > 116.132.235.204:http S"
116.132.235.204,192.168.0.106,80,8072,6,"Ether / IP / TCP 116.132.235.204:http > 192.168.0.106:8072 SA"
192.168.0.106,116.132.235.204,8072,80,6,"Ether / IP / TCP 192.168.0.106:8072 > 116.132.235.204:http A"
192.168.0.106,116.132.235.204,8072,80,6,"Ether / IP / TCP 192.168.0.106:8072 > 116.132.235.204:http PA / Raw"
192.168.0.106,116.132.235.204,8072,80,6,"Ether / IP / TCP 192.168.0.106:8072 > 116.132.235.204:http A / Raw"
192.168.0.106,116.132.235.204,8072,80,6,"Ether / IP / TCP 192.168.0.106:8072 > 116.132.235.204:http A / Raw"
192.168.0.106,116.132.235.204,8072,80,6,"Ether / IP / TCP 192.168.0.106:8072 > 116.132.235.204:http PA / Raw"
116.132.235.204,192.168.0.106,80,8072,6,"Ether / IP / TCP 116.132.235.204:http > 192.168.0.106:8072 A"
116.132.235.204,192.168.0.106,80,8072,6,"Ether / IP / TCP 116.132.235.204:http > 192.168.0.106:8072 A"
116.132.235.204,192.168.0.106,80,8072,6,"Ether / IP / TCP 116.132.235.204:http > 192.168.0.106:8072 A"
116.132.235.204,192.168.0.106,80,8072,6,"Ether / IP / TCP 116.132.235.204:http > 192.168.0.106:8072 PA / Raw"
192.168.0.106,116.132.235.204,8072,80,6,"Ether / IP / TCP 192.168.0.106:8072 > 116.132.235.204:http FA"
116.132.235.204,192.168.0.106,80,8072,6,"Ether / IP / TCP 116.132.235.204:http > 192.168.0.106:8072 FA"
192.168.0.106,116.132.235.204,8072,80,6,"Ether / IP / TCP 192.168.0.106:8072 > 116.132.235.204:http A"
116.132.235.204,192.168.0.106,80,8072,6,"Ether / IP / TCP 116.132.235.204:http > 192.168.0.106:8072 A"
192.168.192.1,192.168.192.2,137,137,17,"Ether / IP / UDP 192.168.192.1:netbios_ns > 192.168.192.2:netbios_ns / NBNSHeader / Raw"
192.168.0.106,110.242.68.3,8065,80,6,"Ether / IP / TCP 192.168.0.106:8065 > 110.242.68.3:http FA"
192.168.0.106,13.89.179.10,3758,443,6,"Ether / IP / TCP 192.168.0.106:3758 > 13.89.179.10:https PA / Raw"
192.168.0.106,13.89.179.10,3758,443,6,"Ether / IP / TCP 192.168.0.106:3758 > 13.89.179.10:https PA / Raw"
192.168.0.106,157.255.191.46,8066,80,6,"Ether / IP / TCP 192.168.0.106:8066 > 157.255.191.46:http FA"
13.89.179.10,192.168.0.106,443,3758,6,"Ether / IP / TCP 13.89.179.10:https > 192.168.0.106:3758 A"
13.89.179.10,192.168.0.106,443,3758,6,"Ether / IP / TCP 13.89.179.10:https > 192.168.0.106:3758 A / Padding"
13.89.179.10,192.168.0.106,443,3758,6,"Ether / IP / TCP 13.89.179.10:https > 192.168.0.106:3758 PA / Raw"
192.168.0.106,13.89.179.10,3758,443,6,"Ether / IP / TCP 192.168.0.106:3758 > 13.89.179.10:https A"
13.89.179.10,192.168.0.106,443,3758,6,"Ether / IP / TCP 13.89.179.10:https > 192.168.0.106:3758 PA / Raw"
192.168.0.106,13.89.179.10,3758,443,6,"Ether / IP / TCP 192.168.0.106:3758 > 13.89.179.10:https PA / Raw"
192.168.0.106,13.89.179.10,3758,443,6,"Ether / IP / TCP 192.168.0.106:3758 > 13.89.179.10:https PA / Raw"
192.168.0.106,116.132.235.204,8073,80,6,"Ether / IP / TCP 192.168.0.106:8073 > 116.132.235.204:http S"
13.89.179.10,192.168.0.106,443,3758,6,"Ether / IP / TCP 13.89.179.10:https > 192.168.0.106:3758 A / Padding"
13.89.179.10,192.168.0.106,443,3758,6,"Ether / IP / TCP 13.89.179.10:https > 192.168.0.106:3758 PA / Raw"
13.89.179.10,192.168.0.106,443,3758,6,"Ether / IP / TCP 13.89.179.10:https > 192.168.0.106:3758 PA / Raw"
192.168.0.106,13.89.179.10,3758,443,6,"Ether / IP / TCP 192.168.0.106:3758 > 13.89.179.10:https A"
116.132.235.204,192.168.0.106,80,8073,6,"Ether / IP / TCP 116.132.235.204:http > 192.168.0.106:8073 SA"
192.168.0.106,116.132.235.204,8073,80,6,"Ether / IP / TCP 192.168.0.106:8073 > 116.132.235.204:http A"
192.168.0.106,116.132.235.204,8073,80,6,"Ether / IP / TCP 192.168.0.106:8073 > 116.132.235.204:http PA / Raw"
192.168.0.106,116.132.235.204,8073,80,6,"Ether / IP / TCP 192.168.0.106:8073 > 116.132.235.204:http A / Raw"
192.168.0.106,116.132.235.204,8073,80,6,"Ether / IP / TCP 192.168.0.106:8073 > 116.132.235.204:http A / Raw"
192.168.0.106,116.132.235.204,8073,80,6,"Ether / IP / TCP 192.168.0.106:8073 > 116.132.235.204:http PA / Raw"
192.168.0.106,119.28.20.150,7867,443,6,"Ether / IP / TCP 192.168.0.106:7867 > 119.28.20.150:https FA"
192.168.0.106,111.206.209.249,7999,443,6,"Ether / IP / TCP 192.168.0.106:7999 > 111.206.209.249:https FA"
192.168.0.106,111.206.209.249,7999,443,6,"Ether / IP / TCP 192.168.0.106:7999 > 111.206.209.249:https RA"
192.168.0.106,218.12.116.243,7992,443,6,"Ether / IP / TCP 192.168.0.106:7992 > 218.12.116.243:https FA"
192.168.0.106,218.12.116.243,8074,443,6,"Ether / IP / TCP 192.168.0.106:8074 > 218.12.116.243:https S"
116.132.235.204,192.168.0.106,80,8073,6,"Ether / IP / TCP 116.132.235.204:http > 192.168.0.106:8073 A"
116.132.235.204,192.168.0.106,80,8073,6,"Ether / IP / TCP 116.132.235.204:http > 192.168.0.106:8073 A"
116.132.235.204,192.168.0.106,80,8073,6,"Ether / IP / TCP 116.132.235.204:http > 192.168.0.106:8073 A"
116.132.235.204,192.168.0.106,80,8073,6,"Ether / IP / TCP 116.132.235.204:http > 192.168.0.106:8073 PA / Raw"
116.132.235.204,192.168.0.106,80,8073,6,"Ether / IP / TCP 116.132.235.204:http > 192.168.0.106:8073 FA"
192.168.0.106,116.132.235.204,8073,80,6,"Ether / IP / TCP 192.168.0.106:8073 > 116.132.235.204:http A"
192.168.0.106,116.132.235.204,8073,80,6,"Ether / IP / TCP 192.168.0.106:8073 > 116.132.235.204:http FA"
218.12.116.243,192.168.0.106,443,8074,6,"Ether / IP / TCP 218.12.116.243:https > 192.168.0.106:8074 SA"
192.168.0.106,218.12.116.243,8074,443,6,"Ether / IP / TCP 192.168.0.106:8074 > 218.12.116.243:https A"
192.168.0.106,218.12.116.243,8074,443,6,"Ether / IP / TCP 192.168.0.106:8074 > 218.12.116.243:https PA / Raw"
218.12.116.243,192.168.0.106,443,7992,6,"Ether / IP / TCP 218.12.116.243:https > 192.168.0.106:7992 A"
119.28.20.150,192.168.0.106,443,7867,6,"Ether / IP / TCP 119.28.20.150:https > 192.168.0.106:7867 A"
116.132.235.204,192.168.0.106,80,8073,6,"Ether / IP / TCP 116.132.235.204:http > 192.168.0.106:8073 A"
218.12.116.243,192.168.0.106,443,8074,6,"Ether / IP / TCP 218.12.116.243:https > 192.168.0.106:8074 A"
218.12.116.243,192.168.0.106,443,8074,6,"Ether / IP / TCP 218.12.116.243:https > 192.168.0.106:8074 PA / Raw"
