srcip,dstip,sport,dport,proto,data
106.55.58.216,192.168.1.116,8000,4022,17,"Ether / IP / UDP 106.55.58.216:8000 > 192.168.1.116:4022 / Raw"
192.168.1.116,203.119.169.227,6427,80,6,"Ether / IP / TCP 192.168.1.116:6427 > 203.119.169.227:http PA / Raw"
192.168.1.116,203.119.169.227,6427,80,6,"Ether / IP / TCP 192.168.1.116:6427 > 203.119.169.227:http A / Raw"
192.168.1.116,203.119.169.227,6427,80,6,"Ether / IP / TCP 192.168.1.116:6427 > 203.119.169.227:http A / Raw"
192.168.1.116,203.119.169.227,6427,80,6,"Ether / IP / TCP 192.168.1.116:6427 > 203.119.169.227:http PA / Raw"
203.119.169.227,192.168.1.116,80,6427,6,"Ether / IP / TCP 203.119.169.227:http > 192.168.1.116:6427 A"
203.119.169.227,192.168.1.116,80,6427,6,"Ether / IP / TCP 203.119.169.227:http > 192.168.1.116:6427 PA / Raw"
203.119.169.227,192.168.1.116,80,6427,6,"Ether / IP / TCP 203.119.169.227:http > 192.168.1.116:6427 PA / Raw"
192.168.1.116,203.119.169.227,6427,80,6,"Ether / IP / TCP 192.168.1.116:6427 > 203.119.169.227:http A"
192.168.1.116,203.119.169.227,6427,80,6,"Ether / IP / TCP 192.168.1.116:6427 > 203.119.169.227:http PA / Raw"
192.168.1.116,203.119.169.227,6427,80,6,"Ether / IP / TCP 192.168.1.116:6427 > 203.119.169.227:http A / Raw"
192.168.1.116,203.119.169.227,6427,80,6,"Ether / IP / TCP 192.168.1.116:6427 > 203.119.169.227:http A / Raw"
192.168.1.116,203.119.169.227,6427,80,6,"Ether / IP / TCP 192.168.1.116:6427 > 203.119.169.227:http PA / Raw"
203.119.169.227,192.168.1.116,80,6427,6,"Ether / IP / TCP 203.119.169.227:http > 192.168.1.116:6427 A"
203.119.169.227,192.168.1.116,80,6427,6,"Ether / IP / TCP 203.119.169.227:http > 192.168.1.116:6427 PA / Raw"
203.119.169.227,192.168.1.116,80,6427,6,"Ether / IP / TCP 203.119.169.227:http > 192.168.1.116:6427 PA / Raw"
192.168.1.116,203.119.169.227,6427,80,6,"Ether / IP / TCP 192.168.1.116:6427 > 203.119.169.227:http A"
192.168.1.116,203.119.169.227,6427,80,6,"Ether / IP / TCP 192.168.1.116:6427 > 203.119.169.227:http PA / Raw"
192.168.1.116,203.119.169.227,6427,80,6,"Ether / IP / TCP 192.168.1.116:6427 > 203.119.169.227:http A / Raw"
192.168.1.116,203.119.169.227,6427,80,6,"Ether / IP / TCP 192.168.1.116:6427 > 203.119.169.227:http A / Raw"
192.168.1.116,203.119.169.227,6427,80,6,"Ether / IP / TCP 192.168.1.116:6427 > 203.119.169.227:http PA / Raw"
192.168.1.1,255.255.255.255,1024,5001,17,"Ether / IP / UDP 192.168.1.1:1024 > 255.255.255.255:5001 / Raw"
203.119.169.227,192.168.1.116,80,6427,6,"Ether / IP / TCP 203.119.169.227:http > 192.168.1.116:6427 A"
203.119.169.227,192.168.1.116,80,6427,6,"Ether / IP / TCP 203.119.169.227:http > 192.168.1.116:6427 A"
203.119.169.227,192.168.1.116,80,6427,6,"Ether / IP / TCP 203.119.169.227:http > 192.168.1.116:6427 PA / Raw"
203.119.169.227,192.168.1.116,80,6427,6,"Ether / IP / TCP 203.119.169.227:http > 192.168.1.116:6427 PA / Raw"
192.168.1.116,203.119.169.227,6427,80,6,"Ether / IP / TCP 192.168.1.116:6427 > 203.119.169.227:http A"
192.168.1.116,203.119.169.227,6427,80,6,"Ether / IP / TCP 192.168.1.116:6427 > 203.119.169.227:http PA / Raw"
192.168.1.116,203.119.169.227,6427,80,6,"Ether / IP / TCP 192.168.1.116:6427 > 203.119.169.227:http A / Raw"
192.168.1.116,203.119.169.227,6427,80,6,"Ether / IP / TCP 192.168.1.116:6427 > 203.119.169.227:http A / Raw"
192.168.1.116,203.119.169.227,6427,80,6,"Ether / IP / TCP 192.168.1.116:6427 > 203.119.169.227:http PA / Raw"
203.119.169.227,192.168.1.116,80,6427,6,"Ether / IP / TCP 203.119.169.227:http > 192.168.1.116:6427 A"
203.119.169.227,192.168.1.116,80,6427,6,"Ether / IP / TCP 203.119.169.227:http > 192.168.1.116:6427 PA / Raw"
203.119.169.227,192.168.1.116,80,6427,6,"Ether / IP / TCP 203.119.169.227:http > 192.168.1.116:6427 PA / Raw"
192.168.1.116,203.119.169.227,6427,80,6,"Ether / IP / TCP 192.168.1.116:6427 > 203.119.169.227:http A"
192.168.1.116,202.112.14.21,13609,53,6,"Ether / IP / TCP 192.168.1.116:13609 > 202.112.14.21:domain S"
202.112.14.21,192.168.1.116,53,13609,6,"Ether / IP / TCP 202.112.14.21:domain > 192.168.1.116:13609 SA"
192.168.1.116,202.112.14.21,13609,53,6,"Ether / IP / TCP 192.168.1.116:13609 > 202.112.14.21:domain A"
192.168.1.116,202.112.14.21,13609,53,6,"Ether / IP / TCP 192.168.1.116:13609 > 202.112.14.21:domain PA / Raw"
192.168.1.116,202.112.14.21,13609,53,6,"Ether / IP / TCP 192.168.1.116:13609 > 202.112.14.21:domain PA / Raw"
202.112.14.21,192.168.1.116,53,13609,6,"Ether / IP / TCP 202.112.14.21:domain > 192.168.1.116:13609 A"
202.112.14.21,192.168.1.116,53,13609,6,"Ether / IP / TCP 202.112.14.21:domain > 192.168.1.116:13609 A"
202.112.14.21,192.168.1.116,53,13609,6,"Ether / IP / TCP / DNS Ans ""b'www-msn-com.a-0003.a-msedge.net.'"" "
192.168.1.116,202.112.14.21,13609,53,6,"Ether / IP / TCP 192.168.1.116:13609 > 202.112.14.21:domain FA"
202.112.14.21,192.168.1.116,53,13609,6,"Ether / IP / TCP 202.112.14.21:domain > 192.168.1.116:13609 FA"
192.168.1.116,202.112.14.21,13609,53,6,"Ether / IP / TCP 192.168.1.116:13609 > 202.112.14.21:domain A"
192.168.1.116,202.112.14.21,13610,53,6,"Ether / IP / TCP 192.168.1.116:13610 > 202.112.14.21:domain S"
192.168.1.116,202.112.14.21,13611,53,6,"Ether / IP / TCP 192.168.1.116:13611 > 202.112.14.21:domain S"
202.112.14.21,192.168.1.116,53,13610,6,"Ether / IP / TCP 202.112.14.21:domain > 192.168.1.116:13610 SA"
192.168.1.116,202.112.14.21,13610,53,6,"Ether / IP / TCP 192.168.1.116:13610 > 202.112.14.21:domain A"
192.168.1.116,202.112.14.21,13610,53,6,"Ether / IP / TCP 192.168.1.116:13610 > 202.112.14.21:domain PA / Raw"
192.168.1.116,202.112.14.21,13610,53,6,"Ether / IP / TCP 192.168.1.116:13610 > 202.112.14.21:domain PA / Raw"
202.112.14.21,192.168.1.116,53,13611,6,"Ether / IP / TCP 202.112.14.21:domain > 192.168.1.116:13611 SA"
192.168.1.116,202.112.14.21,13611,53,6,"Ether / IP / TCP 192.168.1.116:13611 > 202.112.14.21:domain A"
192.168.1.116,202.112.14.21,13611,53,6,"Ether / IP / TCP 192.168.1.116:13611 > 202.112.14.21:domain PA / Raw"
192.168.1.116,202.112.14.21,13611,53,6,"Ether / IP / TCP 192.168.1.116:13611 > 202.112.14.21:domain PA / Raw"
202.112.14.21,192.168.1.116,53,13610,6,"Ether / IP / TCP 202.112.14.21:domain > 192.168.1.116:13610 A"
202.112.14.21,192.168.1.116,53,13610,6,"Ether / IP / TCP 202.112.14.21:domain > 192.168.1.116:13610 A"
202.112.14.21,192.168.1.116,53,13611,6,"Ether / IP / TCP 202.112.14.21:domain > 192.168.1.116:13611 A"
202.112.14.21,192.168.1.116,53,13611,6,"Ether / IP / TCP 202.112.14.21:domain > 192.168.1.116:13611 A"
202.112.14.21,192.168.1.116,53,13611,6,"Ether / IP / TCP / DNS Ans ""b'www-msn-com.a-0003.a-msedge.net.'"" "
192.168.1.116,202.112.14.21,13611,53,6,"Ether / IP / TCP 192.168.1.116:13611 > 202.112.14.21:domain FA"
202.112.14.21,192.168.1.116,53,13610,6,"Ether / IP / TCP / DNS Ans ""b'www-msn-com.a-0003.a-msedge.net.'"" "
192.168.1.116,204.79.197.203,13612,443,6,"Ether / IP / TCP 192.168.1.116:13612 > 204.79.197.203:https S"
192.168.1.116,202.112.14.21,13610,53,6,"Ether / IP / TCP 192.168.1.116:13610 > 202.112.14.21:domain FA"
202.112.14.21,192.168.1.116,53,13611,6,"Ether / IP / TCP 202.112.14.21:domain > 192.168.1.116:13611 FA"
202.112.14.21,192.168.1.116,53,13610,6,"Ether / IP / TCP 202.112.14.21:domain > 192.168.1.116:13610 FA"
192.168.1.116,202.112.14.21,13611,53,6,"Ether / IP / TCP 192.168.1.116:13611 > 202.112.14.21:domain A"
192.168.1.116,202.112.14.21,13610,53,6,"Ether / IP / TCP 192.168.1.116:13610 > 202.112.14.21:domain A"
106.55.58.216,192.168.1.116,8000,4022,17,"Ether / IP / UDP 106.55.58.216:8000 > 192.168.1.116:4022 / Raw"
204.79.197.203,192.168.1.116,443,13612,6,"Ether / IP / TCP 204.79.197.203:https > 192.168.1.116:13612 SA"
192.168.1.116,204.79.197.203,13612,443,6,"Ether / IP / TCP 192.168.1.116:13612 > 204.79.197.203:https A"
192.168.1.116,204.79.197.203,13612,443,6,"Ether / IP / TCP 192.168.1.116:13612 > 204.79.197.203:https PA / Raw"
204.79.197.203,192.168.1.116,443,13612,6,"Ether / IP / TCP 204.79.197.203:https > 192.168.1.116:13612 A"
204.79.197.203,192.168.1.116,443,13612,6,"Ether / IP / TCP 204.79.197.203:https > 192.168.1.116:13612 A / Raw"
204.79.197.203,192.168.1.116,443,13612,6,"Ether / IP / TCP 204.79.197.203:https > 192.168.1.116:13612 A / Raw"
204.79.197.203,192.168.1.116,443,13612,6,"Ether / IP / TCP 204.79.197.203:https > 192.168.1.116:13612 A / Raw"
204.79.197.203,192.168.1.116,443,13612,6,"Ether / IP / TCP 204.79.197.203:https > 192.168.1.116:13612 PA / Raw"
192.168.1.116,204.79.197.203,13612,443,6,"Ether / IP / TCP 192.168.1.116:13612 > 204.79.197.203:https A"
192.168.1.116,204.79.197.203,13612,443,6,"Ether / IP / TCP 192.168.1.116:13612 > 204.79.197.203:https PA / Raw"
192.168.1.116,204.79.197.203,13612,443,6,"Ether / IP / TCP 192.168.1.116:13612 > 204.79.197.203:https PA / Raw"
192.168.1.116,204.79.197.203,13612,443,6,"Ether / IP / TCP 192.168.1.116:13612 > 204.79.197.203:https A / Raw"
192.168.1.116,204.79.197.203,13612,443,6,"Ether / IP / TCP 192.168.1.116:13612 > 204.79.197.203:https PA / Raw"
204.79.197.203,192.168.1.116,443,13612,6,"Ether / IP / TCP 204.79.197.203:https > 192.168.1.116:13612 A"
204.79.197.203,192.168.1.116,443,13612,6,"Ether / IP / TCP 204.79.197.203:https > 192.168.1.116:13612 A"
204.79.197.203,192.168.1.116,443,13612,6,"Ether / IP / TCP 204.79.197.203:https > 192.168.1.116:13612 PA / Raw"
204.79.197.203,192.168.1.116,443,13612,6,"Ether / IP / TCP 204.79.197.203:https > 192.168.1.116:13612 A"
204.79.197.203,192.168.1.116,443,13612,6,"Ether / IP / TCP 204.79.197.203:https > 192.168.1.116:13612 PA / Raw"
204.79.197.203,192.168.1.116,443,13612,6,"Ether / IP / TCP 204.79.197.203:https > 192.168.1.116:13612 A"
192.168.1.116,204.79.197.203,13612,443,6,"Ether / IP / TCP 192.168.1.116:13612 > 204.79.197.203:https A"
192.168.1.116,204.79.197.203,13612,443,6,"Ether / IP / TCP 192.168.1.116:13612 > 204.79.197.203:https PA / Raw"
204.79.197.203,192.168.1.116,443,13612,6,"Ether / IP / TCP 204.79.197.203:https > 192.168.1.116:13612 PA / Raw"
192.168.1.116,202.112.14.21,13613,53,6,"Ether / IP / TCP 192.168.1.116:13613 > 202.112.14.21:domain S"
202.112.14.21,192.168.1.116,53,13613,6,"Ether / IP / TCP 202.112.14.21:domain > 192.168.1.116:13613 SA"
192.168.1.116,202.112.14.21,13613,53,6,"Ether / IP / TCP 192.168.1.116:13613 > 202.112.14.21:domain A"
192.168.1.116,202.112.14.21,13613,53,6,"Ether / IP / TCP 192.168.1.116:13613 > 202.112.14.21:domain PA / Raw"
192.168.1.116,202.112.14.21,13613,53,6,"Ether / IP / TCP 192.168.1.116:13613 > 202.112.14.21:domain PA / Raw"
202.112.14.21,192.168.1.116,53,13613,6,"Ether / IP / TCP 202.112.14.21:domain > 192.168.1.116:13613 A"
202.112.14.21,192.168.1.116,53,13613,6,"Ether / IP / TCP 202.112.14.21:domain > 192.168.1.116:13613 A"
202.112.14.21,192.168.1.116,53,13613,6,"Ether / IP / TCP / DNS Ans ""b'msn-cn.a-0032.a-msedge.net.'"" "
192.168.1.116,202.112.14.21,13613,53,6,"Ether / IP / TCP 192.168.1.116:13613 > 202.112.14.21:domain FA"
202.112.14.21,192.168.1.116,53,13613,6,"Ether / IP / TCP 202.112.14.21:domain > 192.168.1.116:13613 FA"
192.168.1.116,202.112.14.21,13613,53,6,"Ether / IP / TCP 192.168.1.116:13613 > 202.112.14.21:domain A"
192.168.1.116,202.112.14.21,13614,53,6,"Ether / IP / TCP 192.168.1.116:13614 > 202.112.14.21:domain S"
192.168.1.116,202.112.14.21,13615,53,6,"Ether / IP / TCP 192.168.1.116:13615 > 202.112.14.21:domain S"
202.112.14.21,192.168.1.116,53,13614,6,"Ether / IP / TCP 202.112.14.21:domain > 192.168.1.116:13614 SA"
202.112.14.21,192.168.1.116,53,13615,6,"Ether / IP / TCP 202.112.14.21:domain > 192.168.1.116:13615 SA"
192.168.1.116,202.112.14.21,13614,53,6,"Ether / IP / TCP 192.168.1.116:13614 > 202.112.14.21:domain A"
192.168.1.116,202.112.14.21,13615,53,6,"Ether / IP / TCP 192.168.1.116:13615 > 202.112.14.21:domain A"
192.168.1.116,202.112.14.21,13614,53,6,"Ether / IP / TCP 192.168.1.116:13614 > 202.112.14.21:domain PA / Raw"
192.168.1.116,202.112.14.21,13614,53,6,"Ether / IP / TCP 192.168.1.116:13614 > 202.112.14.21:domain PA / Raw"
192.168.1.116,202.112.14.21,13615,53,6,"Ether / IP / TCP 192.168.1.116:13615 > 202.112.14.21:domain PA / Raw"
192.168.1.116,202.112.14.21,13615,53,6,"Ether / IP / TCP 192.168.1.116:13615 > 202.112.14.21:domain PA / Raw"
202.112.14.21,192.168.1.116,53,13614,6,"Ether / IP / TCP 202.112.14.21:domain > 192.168.1.116:13614 A"
202.112.14.21,192.168.1.116,53,13615,6,"Ether / IP / TCP 202.112.14.21:domain > 192.168.1.116:13615 A"
202.112.14.21,192.168.1.116,53,13614,6,"Ether / IP / TCP 202.112.14.21:domain > 192.168.1.116:13614 A"
202.112.14.21,192.168.1.116,53,13615,6,"Ether / IP / TCP 202.112.14.21:domain > 192.168.1.116:13615 A"
202.112.14.21,192.168.1.116,53,13614,6,"Ether / IP / TCP / DNS Ans ""b'msn-cn.a-0032.a-msedge.net.'"" "
192.168.1.116,202.112.14.21,13614,53,6,"Ether / IP / TCP 192.168.1.116:13614 > 202.112.14.21:domain FA"
202.112.14.21,192.168.1.116,53,13614,6,"Ether / IP / TCP 202.112.14.21:domain > 192.168.1.116:13614 FA"
192.168.1.116,202.112.14.21,13614,53,6,"Ether / IP / TCP 192.168.1.116:13614 > 202.112.14.21:domain A"
192.168.1.116,202.112.14.21,13615,53,6,"Ether / IP / TCP 192.168.1.116:13615 > 202.112.14.21:domain FA"
192.168.1.116,202.89.233.96,13616,443,6,"Ether / IP / TCP 192.168.1.116:13616 > 202.89.233.96:https S"
192.168.1.116,204.79.197.203,13612,443,6,"Ether / IP / TCP 192.168.1.116:13612 > 204.79.197.203:https A"
202.112.14.21,192.168.1.116,53,13615,6,"Ether / IP / TCP 202.112.14.21:domain > 192.168.1.116:13615 A"
202.89.233.96,192.168.1.116,443,13616,6,"Ether / IP / TCP 202.89.233.96:https > 192.168.1.116:13616 SA"
192.168.1.116,202.89.233.96,13616,443,6,"Ether / IP / TCP 192.168.1.116:13616 > 202.89.233.96:https A"
192.168.1.116,202.89.233.96,13616,443,6,"Ether / IP / TCP 192.168.1.116:13616 > 202.89.233.96:https PA / Raw"
202.89.233.96,192.168.1.116,443,13616,6,"Ether / IP / TCP 202.89.233.96:https > 192.168.1.116:13616 A"
202.89.233.96,192.168.1.116,443,13616,6,"Ether / IP / TCP 202.89.233.96:https > 192.168.1.116:13616 A / Raw"
202.89.233.96,192.168.1.116,443,13616,6,"Ether / IP / TCP 202.89.233.96:https > 192.168.1.116:13616 A / Raw"
202.89.233.96,192.168.1.116,443,13616,6,"Ether / IP / TCP 202.89.233.96:https > 192.168.1.116:13616 A / Raw"
202.89.233.96,192.168.1.116,443,13616,6,"Ether / IP / TCP 202.89.233.96:https > 192.168.1.116:13616 PA / Raw"
192.168.1.116,202.89.233.96,13616,443,6,"Ether / IP / TCP 192.168.1.116:13616 > 202.89.233.96:https A"
192.168.1.116,202.89.233.96,13616,443,6,"Ether / IP / TCP 192.168.1.116:13616 > 202.89.233.96:https PA / Raw"
192.168.1.116,202.89.233.96,13616,443,6,"Ether / IP / TCP 192.168.1.116:13616 > 202.89.233.96:https PA / Raw"
192.168.1.116,202.89.233.96,13616,443,6,"Ether / IP / TCP 192.168.1.116:13616 > 202.89.233.96:https A / Raw"
192.168.1.116,202.89.233.96,13616,443,6,"Ether / IP / TCP 192.168.1.116:13616 > 202.89.233.96:https A / Raw"
192.168.1.116,202.89.233.96,13616,443,6,"Ether / IP / TCP 192.168.1.116:13616 > 202.89.233.96:https A / Raw"
192.168.1.116,202.89.233.96,13616,443,6,"Ether / IP / TCP 192.168.1.116:13616 > 202.89.233.96:https PA / Raw"
202.89.233.96,192.168.1.116,443,13616,6,"Ether / IP / TCP 202.89.233.96:https > 192.168.1.116:13616 A"
202.89.233.96,192.168.1.116,443,13616,6,"Ether / IP / TCP 202.89.233.96:https > 192.168.1.116:13616 A"
202.89.233.96,192.168.1.116,443,13616,6,"Ether / IP / TCP 202.89.233.96:https > 192.168.1.116:13616 A"
202.89.233.96,192.168.1.116,443,13616,6,"Ether / IP / TCP 202.89.233.96:https > 192.168.1.116:13616 A"
202.89.233.96,192.168.1.116,443,13616,6,"Ether / IP / TCP 202.89.233.96:https > 192.168.1.116:13616 A"
202.89.233.96,192.168.1.116,443,13616,6,"Ether / IP / TCP 202.89.233.96:https > 192.168.1.116:13616 A"
202.89.233.96,192.168.1.116,443,13616,6,"Ether / IP / TCP 202.89.233.96:https > 192.168.1.116:13616 PA / Raw"
202.89.233.96,192.168.1.116,443,13616,6,"Ether / IP / TCP 202.89.233.96:https > 192.168.1.116:13616 PA / Raw"
192.168.1.116,202.89.233.96,13616,443,6,"Ether / IP / TCP 192.168.1.116:13616 > 202.89.233.96:https A"
192.168.1.116,202.89.233.96,13616,443,6,"Ether / IP / TCP 192.168.1.116:13616 > 202.89.233.96:https PA / Raw"
202.112.14.21,192.168.1.116,53,13615,6,"Ether / IP / TCP / DNS Ans ""b'msn-cn.a-0032.a-msedge.net.'"" "
202.112.14.21,192.168.1.116,53,13615,6,"Ether / IP / TCP 202.112.14.21:domain > 192.168.1.116:13615 FA"
192.168.1.116,202.112.14.21,13615,53,6,"Ether / IP / TCP 192.168.1.116:13615 > 202.112.14.21:domain RA"
202.89.233.96,192.168.1.116,443,13616,6,"Ether / IP / TCP 202.89.233.96:https > 192.168.1.116:13616 PA / Raw"
202.89.233.96,192.168.1.116,443,13616,6,"Ether / IP / TCP 202.89.233.96:https > 192.168.1.116:13616 A"
202.89.233.96,192.168.1.116,443,13616,6,"Ether / IP / TCP 202.89.233.96:https > 192.168.1.116:13616 A / Raw"
202.89.233.96,192.168.1.116,443,13616,6,"Ether / IP / TCP 202.89.233.96:https > 192.168.1.116:13616 A / Raw"
202.89.233.96,192.168.1.116,443,13616,6,"Ether / IP / TCP 202.89.233.96:https > 192.168.1.116:13616 A / Raw"
202.89.233.96,192.168.1.116,443,13616,6,"Ether / IP / TCP 202.89.233.96:https > 192.168.1.116:13616 A / Raw"
202.89.233.96,192.168.1.116,443,13616,6,"Ether / IP / TCP 202.89.233.96:https > 192.168.1.116:13616 PA / Raw"
202.89.233.96,192.168.1.116,443,13616,6,"Ether / IP / TCP 202.89.233.96:https > 192.168.1.116:13616 PA / Raw"
202.89.233.96,192.168.1.116,443,13616,6,"Ether / IP / TCP 202.89.233.96:https > 192.168.1.116:13616 PA / Raw"
202.89.233.96,192.168.1.116,443,13616,6,"Ether / IP / TCP 202.89.233.96:https > 192.168.1.116:13616 PA / Raw"
202.89.233.96,192.168.1.116,443,13616,6,"Ether / IP / TCP 202.89.233.96:https > 192.168.1.116:13616 A / Raw"
202.89.233.96,192.168.1.116,443,13616,6,"Ether / IP / TCP 202.89.233.96:https > 192.168.1.116:13616 A / Raw"
202.89.233.96,192.168.1.116,443,13616,6,"Ether / IP / TCP 202.89.233.96:https > 192.168.1.116:13616 PA / Raw"
202.89.233.96,192.168.1.116,443,13616,6,"Ether / IP / TCP 202.89.233.96:https > 192.168.1.116:13616 PA / Raw"
202.89.233.96,192.168.1.116,443,13616,6,"Ether / IP / TCP 202.89.233.96:https > 192.168.1.116:13616 A / Raw"
202.89.233.96,192.168.1.116,443,13616,6,"Ether / IP / TCP 202.89.233.96:https > 192.168.1.116:13616 A / Raw"
202.89.233.96,192.168.1.116,443,13616,6,"Ether / IP / TCP 202.89.233.96:https > 192.168.1.116:13616 PA / Raw"
192.168.1.116,202.89.233.96,13616,443,6,"Ether / IP / TCP 192.168.1.116:13616 > 202.89.233.96:https A"
202.89.233.96,192.168.1.116,443,13616,6,"Ether / IP / TCP 202.89.233.96:https > 192.168.1.116:13616 A / Raw"
202.89.233.96,192.168.1.116,443,13616,6,"Ether / IP / TCP 202.89.233.96:https > 192.168.1.116:13616 A / Raw"
202.89.233.96,192.168.1.116,443,13616,6,"Ether / IP / TCP 202.89.233.96:https > 192.168.1.116:13616 PA / Raw"
202.89.233.96,192.168.1.116,443,13616,6,"Ether / IP / TCP 202.89.233.96:https > 192.168.1.116:13616 PA / Raw"
202.89.233.96,192.168.1.116,443,13616,6,"Ether / IP / TCP 202.89.233.96:https > 192.168.1.116:13616 PA / Raw"
202.89.233.96,192.168.1.116,443,13616,6,"Ether / IP / TCP 202.89.233.96:https > 192.168.1.116:13616 A / Raw"
202.89.233.96,192.168.1.116,443,13616,6,"Ether / IP / TCP 202.89.233.96:https > 192.168.1.116:13616 A / Raw"
202.89.233.96,192.168.1.116,443,13616,6,"Ether / IP / TCP 202.89.233.96:https > 192.168.1.116:13616 A / Raw"
202.89.233.96,192.168.1.116,443,13616,6,"Ether / IP / TCP 202.89.233.96:https > 192.168.1.116:13616 A / Raw"
202.89.233.96,192.168.1.116,443,13616,6,"Ether / IP / TCP 202.89.233.96:https > 192.168.1.116:13616 PA / Raw"
202.89.233.96,192.168.1.116,443,13616,6,"Ether / IP / TCP 202.89.233.96:https > 192.168.1.116:13616 PA / Raw"
192.168.1.116,202.89.233.96,13616,443,6,"Ether / IP / TCP 192.168.1.116:13616 > 202.89.233.96:https A"
192.168.1.116,202.89.233.96,13616,443,6,"Ether / IP / TCP 192.168.1.116:13616 > 202.89.233.96:https A"
192.168.1.116,202.89.233.96,13616,443,6,"Ether / IP / TCP 192.168.1.116:13616 > 202.89.233.96:https A"
192.168.1.116,202.89.233.96,13616,443,6,"Ether / IP / TCP 192.168.1.116:13616 > 202.89.233.96:https A"
202.89.233.96,192.168.1.116,443,13616,6,"Ether / IP / TCP 202.89.233.96:https > 192.168.1.116:13616 A / Raw"
202.89.233.96,192.168.1.116,443,13616,6,"Ether / IP / TCP 202.89.233.96:https > 192.168.1.116:13616 PA / Raw"
202.89.233.96,192.168.1.116,443,13616,6,"Ether / IP / TCP 202.89.233.96:https > 192.168.1.116:13616 A / Raw"
202.89.233.96,192.168.1.116,443,13616,6,"Ether / IP / TCP 202.89.233.96:https > 192.168.1.116:13616 A / Raw"
202.89.233.96,192.168.1.116,443,13616,6,"Ether / IP / TCP 202.89.233.96:https > 192.168.1.116:13616 PA / Raw"
202.89.233.96,192.168.1.116,443,13616,6,"Ether / IP / TCP 202.89.233.96:https > 192.168.1.116:13616 A / Raw"
202.89.233.96,192.168.1.116,443,13616,6,"Ether / IP / TCP 202.89.233.96:https > 192.168.1.116:13616 PA / Raw"
202.89.233.96,192.168.1.116,443,13616,6,"Ether / IP / TCP 202.89.233.96:https > 192.168.1.116:13616 A / Raw"
202.89.233.96,192.168.1.116,443,13616,6,"Ether / IP / TCP 202.89.233.96:https > 192.168.1.116:13616 PA / Raw"
192.168.1.116,202.89.233.96,13616,443,6,"Ether / IP / TCP 192.168.1.116:13616 > 202.89.233.96:https A"
192.168.1.116,202.89.233.96,13616,443,6,"Ether / IP / TCP 192.168.1.116:13616 > 202.89.233.96:https A"
192.168.1.116,202.89.233.96,13616,443,6,"Ether / IP / TCP 192.168.1.116:13616 > 202.89.233.96:https A"
192.168.1.116,202.89.233.96,13616,443,6,"Ether / IP / TCP 192.168.1.116:13616 > 202.89.233.96:https A"
192.168.1.116,202.89.233.96,13616,443,6,"Ether / IP / TCP 192.168.1.116:13616 > 202.89.233.96:https A"
192.168.1.116,202.89.233.96,13616,443,6,"Ether / IP / TCP 192.168.1.116:13616 > 202.89.233.96:https A"
192.168.1.116,202.89.233.96,13616,443,6,"Ether / IP / TCP 192.168.1.116:13616 > 202.89.233.96:https A"
192.168.1.116,202.89.233.96,13616,443,6,"Ether / IP / TCP 192.168.1.116:13616 > 202.89.233.96:https A"
192.168.1.116,202.89.233.96,13616,443,6,"Ether / IP / TCP 192.168.1.116:13616 > 202.89.233.96:https A"
202.89.233.96,192.168.1.116,443,13616,6,"Ether / IP / TCP 202.89.233.96:https > 192.168.1.116:13616 A / Raw"
192.168.1.116,202.89.233.96,13616,443,6,"Ether / IP / TCP 192.168.1.116:13616 > 202.89.233.96:https A"
192.168.1.116,203.119.169.227,6427,80,6,"Ether / IP / TCP 192.168.1.116:6427 > 203.119.169.227:http PA / Raw"
192.168.1.116,203.119.169.227,6427,80,6,"Ether / IP / TCP 192.168.1.116:6427 > 203.119.169.227:http A / Raw"
192.168.1.116,203.119.169.227,6427,80,6,"Ether / IP / TCP 192.168.1.116:6427 > 203.119.169.227:http A / Raw"
192.168.1.116,203.119.169.227,6427,80,6,"Ether / IP / TCP 192.168.1.116:6427 > 203.119.169.227:http PA / Raw"
203.119.169.227,192.168.1.116,80,6427,6,"Ether / IP / TCP 203.119.169.227:http > 192.168.1.116:6427 A"
203.119.169.227,192.168.1.116,80,6427,6,"Ether / IP / TCP 203.119.169.227:http > 192.168.1.116:6427 PA / Raw"
203.119.169.227,192.168.1.116,80,6427,6,"Ether / IP / TCP 203.119.169.227:http > 192.168.1.116:6427 PA / Raw"
192.168.1.116,203.119.169.227,6427,80,6,"Ether / IP / TCP 192.168.1.116:6427 > 203.119.169.227:http A"
192.168.1.116,202.112.14.21,13617,53,6,"Ether / IP / TCP 192.168.1.116:13617 > 202.112.14.21:domain S"
192.168.1.116,202.112.14.21,13618,53,6,"Ether / IP / TCP 192.168.1.116:13618 > 202.112.14.21:domain S"
192.168.1.116,202.112.14.21,13619,53,6,"Ether / IP / TCP 192.168.1.116:13619 > 202.112.14.21:domain S"
192.168.1.116,202.112.14.21,13620,53,6,"Ether / IP / TCP 192.168.1.116:13620 > 202.112.14.21:domain S"
192.168.1.116,202.112.14.21,13621,53,6,"Ether / IP / TCP 192.168.1.116:13621 > 202.112.14.21:domain S"
192.168.1.116,202.112.14.21,13622,53,6,"Ether / IP / TCP 192.168.1.116:13622 > 202.112.14.21:domain S"
202.112.14.21,192.168.1.116,53,13617,6,"Ether / IP / TCP 202.112.14.21:domain > 192.168.1.116:13617 SA"
202.112.14.21,192.168.1.116,53,13618,6,"Ether / IP / TCP 202.112.14.21:domain > 192.168.1.116:13618 SA"
202.112.14.21,192.168.1.116,53,13619,6,"Ether / IP / TCP 202.112.14.21:domain > 192.168.1.116:13619 SA"
192.168.1.116,202.112.14.21,13617,53,6,"Ether / IP / TCP 192.168.1.116:13617 > 202.112.14.21:domain A"
192.168.1.116,202.112.14.21,13618,53,6,"Ether / IP / TCP 192.168.1.116:13618 > 202.112.14.21:domain A"
192.168.1.116,202.112.14.21,13617,53,6,"Ether / IP / TCP 192.168.1.116:13617 > 202.112.14.21:domain PA / Raw"
192.168.1.116,202.112.14.21,13619,53,6,"Ether / IP / TCP 192.168.1.116:13619 > 202.112.14.21:domain A"
192.168.1.116,202.112.14.21,13617,53,6,"Ether / IP / TCP 192.168.1.116:13617 > 202.112.14.21:domain PA / Raw"
192.168.1.116,202.112.14.21,13618,53,6,"Ether / IP / TCP 192.168.1.116:13618 > 202.112.14.21:domain PA / Raw"
192.168.1.116,202.112.14.21,13618,53,6,"Ether / IP / TCP 192.168.1.116:13618 > 202.112.14.21:domain PA / Raw"
192.168.1.116,202.112.14.21,13619,53,6,"Ether / IP / TCP 192.168.1.116:13619 > 202.112.14.21:domain PA / Raw"
192.168.1.116,202.112.14.21,13619,53,6,"Ether / IP / TCP 192.168.1.116:13619 > 202.112.14.21:domain PA / Raw"
202.112.14.21,192.168.1.116,53,13620,6,"Ether / IP / TCP 202.112.14.21:domain > 192.168.1.116:13620 SA"
202.112.14.21,192.168.1.116,53,13621,6,"Ether / IP / TCP 202.112.14.21:domain > 192.168.1.116:13621 SA"
202.112.14.21,192.168.1.116,53,13622,6,"Ether / IP / TCP 202.112.14.21:domain > 192.168.1.116:13622 SA"
192.168.1.116,202.112.14.21,13620,53,6,"Ether / IP / TCP 192.168.1.116:13620 > 202.112.14.21:domain A"
192.168.1.116,202.112.14.21,13621,53,6,"Ether / IP / TCP 192.168.1.116:13621 > 202.112.14.21:domain A"
192.168.1.116,202.112.14.21,13622,53,6,"Ether / IP / TCP 192.168.1.116:13622 > 202.112.14.21:domain A"
192.168.1.116,202.112.14.21,13620,53,6,"Ether / IP / TCP 192.168.1.116:13620 > 202.112.14.21:domain PA / Raw"
192.168.1.116,202.112.14.21,13620,53,6,"Ether / IP / TCP 192.168.1.116:13620 > 202.112.14.21:domain PA / Raw"
192.168.1.116,202.112.14.21,13621,53,6,"Ether / IP / TCP 192.168.1.116:13621 > 202.112.14.21:domain PA / Raw"
192.168.1.116,202.112.14.21,13621,53,6,"Ether / IP / TCP 192.168.1.116:13621 > 202.112.14.21:domain PA / Raw"
192.168.1.116,202.112.14.21,13622,53,6,"Ether / IP / TCP 192.168.1.116:13622 > 202.112.14.21:domain PA / Raw"
192.168.1.116,202.112.14.21,13622,53,6,"Ether / IP / TCP 192.168.1.116:13622 > 202.112.14.21:domain PA / Raw"
202.112.14.21,192.168.1.116,53,13617,6,"Ether / IP / TCP 202.112.14.21:domain > 192.168.1.116:13617 A"
202.112.14.21,192.168.1.116,53,13617,6,"Ether / IP / TCP 202.112.14.21:domain > 192.168.1.116:13617 A"
202.112.14.21,192.168.1.116,53,13618,6,"Ether / IP / TCP 202.112.14.21:domain > 192.168.1.116:13618 A"
202.112.14.21,192.168.1.116,53,13618,6,"Ether / IP / TCP 202.112.14.21:domain > 192.168.1.116:13618 A"
202.112.14.21,192.168.1.116,53,13619,6,"Ether / IP / TCP 202.112.14.21:domain > 192.168.1.116:13619 A"
202.112.14.21,192.168.1.116,53,13619,6,"Ether / IP / TCP 202.112.14.21:domain > 192.168.1.116:13619 A"
202.112.14.21,192.168.1.116,53,13618,6,"Ether / IP / TCP / DNS Ans ""b'a1834.dscg2.akamai.net.'"" "
202.112.14.21,192.168.1.116,53,13617,6,"Ether / IP / TCP / DNS Ans ""b'a1834.dscg2.akamai.net.'"" "
202.112.14.21,192.168.1.116,53,13619,6,"Ether / IP / TCP / DNS Ans ""b'p-th.bing.com.trafficmanager.net.'"" "
192.168.1.116,202.112.14.21,13618,53,6,"Ether / IP / TCP 192.168.1.116:13618 > 202.112.14.21:domain FA"
192.168.1.116,202.112.14.21,13619,53,6,"Ether / IP / TCP 192.168.1.116:13619 > 202.112.14.21:domain FA"
192.168.1.116,202.112.14.21,13617,53,6,"Ether / IP / TCP 192.168.1.116:13617 > 202.112.14.21:domain FA"
192.168.1.116,202.112.14.21,13623,53,6,"Ether / IP / TCP 192.168.1.116:13623 > 202.112.14.21:domain S"
192.168.1.116,202.112.14.21,13624,53,6,"Ether / IP / TCP 192.168.1.116:13624 > 202.112.14.21:domain S"
202.112.14.21,192.168.1.116,53,13620,6,"Ether / IP / TCP 202.112.14.21:domain > 192.168.1.116:13620 A"
202.112.14.21,192.168.1.116,53,13620,6,"Ether / IP / TCP 202.112.14.21:domain > 192.168.1.116:13620 A"
202.112.14.21,192.168.1.116,53,13621,6,"Ether / IP / TCP 202.112.14.21:domain > 192.168.1.116:13621 A"
202.112.14.21,192.168.1.116,53,13622,6,"Ether / IP / TCP 202.112.14.21:domain > 192.168.1.116:13622 A"
202.112.14.21,192.168.1.116,53,13622,6,"Ether / IP / TCP 202.112.14.21:domain > 192.168.1.116:13622 A"
202.112.14.21,192.168.1.116,53,13621,6,"Ether / IP / TCP 202.112.14.21:domain > 192.168.1.116:13621 A"
202.112.14.21,192.168.1.116,53,13623,6,"Ether / IP / TCP 202.112.14.21:domain > 192.168.1.116:13623 SA"
202.112.14.21,192.168.1.116,53,13624,6,"Ether / IP / TCP 202.112.14.21:domain > 192.168.1.116:13624 SA"
202.112.14.21,192.168.1.116,53,13618,6,"Ether / IP / TCP 202.112.14.21:domain > 192.168.1.116:13618 FA"
202.112.14.21,192.168.1.116,53,13617,6,"Ether / IP / TCP 202.112.14.21:domain > 192.168.1.116:13617 FA"
202.112.14.21,192.168.1.116,53,13619,6,"Ether / IP / TCP 202.112.14.21:domain > 192.168.1.116:13619 FA"
202.112.14.21,192.168.1.116,53,13620,6,"Ether / IP / TCP / DNS Ans ""b'p-th.bing.com.trafficmanager.net.'"" "
202.112.14.21,192.168.1.116,53,13622,6,"Ether / IP / TCP / DNS Ans ""b'c.msn.com.'"" "
202.112.14.21,192.168.1.116,53,13621,6,"Ether / IP / TCP / DNS Ans ""b'c.msn.com.'"" "
192.168.1.116,202.112.14.21,13618,53,6,"Ether / IP / TCP 192.168.1.116:13618 > 202.112.14.21:domain A"
192.168.1.116,202.112.14.21,13617,53,6,"Ether / IP / TCP 192.168.1.116:13617 > 202.112.14.21:domain A"
192.168.1.116,202.112.14.21,13623,53,6,"Ether / IP / TCP 192.168.1.116:13623 > 202.112.14.21:domain PA / Raw"
192.168.1.116,202.112.14.21,13619,53,6,"Ether / IP / TCP 192.168.1.116:13619 > 202.112.14.21:domain A"
192.168.1.116,202.112.14.21,13623,53,6,"Ether / IP / TCP 192.168.1.116:13623 > 202.112.14.21:domain PA / Raw"
192.168.1.116,202.112.14.21,13624,53,6,"Ether / IP / TCP 192.168.1.116:13624 > 202.112.14.21:domain A"
192.168.1.116,202.112.14.21,13624,53,6,"Ether / IP / TCP 192.168.1.116:13624 > 202.112.14.21:domain PA / Raw"
192.168.1.116,202.112.14.21,13624,53,6,"Ether / IP / TCP 192.168.1.116:13624 > 202.112.14.21:domain PA / Raw"
192.168.1.116,202.112.14.21,13620,53,6,"Ether / IP / TCP 192.168.1.116:13620 > 202.112.14.21:domain FA"
192.168.1.116,202.112.14.21,13620,53,6,"Ether / IP / TCP 192.168.1.116:13620 > 202.112.14.21:domain RA"
192.168.1.116,202.112.14.21,13622,53,6,"Ether / IP / TCP 192.168.1.116:13622 > 202.112.14.21:domain FA"
192.168.1.116,202.112.14.21,13621,53,6,"Ether / IP / TCP 192.168.1.116:13621 > 202.112.14.21:domain FA"
192.168.1.116,20.205.115.81,13625,443,6,"Ether / IP / TCP 192.168.1.116:13625 > 20.205.115.81:https S"
192.168.1.116,202.112.14.21,13626,53,6,"Ether / IP / TCP 192.168.1.116:13626 > 202.112.14.21:domain S"
192.168.1.116,202.112.14.21,13627,53,6,"Ether / IP / TCP 192.168.1.116:13627 > 202.112.14.21:domain S"
202.112.14.21,192.168.1.116,53,13623,6,"Ether / IP / TCP 202.112.14.21:domain > 192.168.1.116:13623 A"
202.112.14.21,192.168.1.116,53,13624,6,"Ether / IP / TCP 202.112.14.21:domain > 192.168.1.116:13624 A"
202.112.14.21,192.168.1.116,53,13624,6,"Ether / IP / TCP 202.112.14.21:domain > 192.168.1.116:13624 A"
202.112.14.21,192.168.1.116,53,13623,6,"Ether / IP / TCP 202.112.14.21:domain > 192.168.1.116:13623 A"
202.112.14.21,192.168.1.116,53,13620,6,"Ether / IP / TCP 202.112.14.21:domain > 192.168.1.116:13620 FA"
202.112.14.21,192.168.1.116,53,13624,6,"Ether / IP / TCP / DNS Ans ""b'assets.msn.cn-c.edgekey.net.'"" "
202.112.14.21,192.168.1.116,53,13623,6,"Ether / IP / TCP / DNS Ans ""b'assets.msn.cn-c.edgekey.net.'"" "
202.112.14.21,192.168.1.116,53,13626,6,"Ether / IP / TCP 202.112.14.21:domain > 192.168.1.116:13626 SA"
202.112.14.21,192.168.1.116,53,13621,6,"Ether / IP / TCP 202.112.14.21:domain > 192.168.1.116:13621 FA"
202.112.14.21,192.168.1.116,53,13622,6,"Ether / IP / TCP 202.112.14.21:domain > 192.168.1.116:13622 FA"
192.168.1.116,202.112.14.21,13624,53,6,"Ether / IP / TCP 192.168.1.116:13624 > 202.112.14.21:domain FA"
192.168.1.116,202.112.14.21,13621,53,6,"Ether / IP / TCP 192.168.1.116:13621 > 202.112.14.21:domain A"
192.168.1.116,202.112.14.21,13622,53,6,"Ether / IP / TCP 192.168.1.116:13622 > 202.112.14.21:domain A"
192.168.1.116,202.112.14.21,13626,53,6,"Ether / IP / TCP 192.168.1.116:13626 > 202.112.14.21:domain A"
192.168.1.116,202.112.14.21,13623,53,6,"Ether / IP / TCP 192.168.1.116:13623 > 202.112.14.21:domain FA"
192.168.1.116,202.112.14.21,13626,53,6,"Ether / IP / TCP 192.168.1.116:13626 > 202.112.14.21:domain PA / Raw"
192.168.1.116,202.112.14.21,13626,53,6,"Ether / IP / TCP 192.168.1.116:13626 > 202.112.14.21:domain PA / Raw"
192.168.1.116,221.194.154.216,13628,443,6,"Ether / IP / TCP 192.168.1.116:13628 > 221.194.154.216:https S"
192.168.1.116,221.194.154.216,13629,443,6,"Ether / IP / TCP 192.168.1.116:13629 > 221.194.154.216:https S"
202.112.14.21,192.168.1.116,53,13627,6,"Ether / IP / TCP 202.112.14.21:domain > 192.168.1.116:13627 SA"
192.168.1.116,202.112.14.21,13627,53,6,"Ether / IP / TCP 192.168.1.116:13627 > 202.112.14.21:domain A"
192.168.1.116,202.112.14.21,13627,53,6,"Ether / IP / TCP 192.168.1.116:13627 > 202.112.14.21:domain PA / Raw"
192.168.1.116,202.112.14.21,13627,53,6,"Ether / IP / TCP 192.168.1.116:13627 > 202.112.14.21:domain PA / Raw"
192.168.1.116,202.89.233.101,13630,443,6,"Ether / IP / TCP 192.168.1.116:13630 > 202.89.233.101:https S"
192.168.1.116,54.192.18.103,13631,443,6,"Ether / IP / TCP 192.168.1.116:13631 > 54.192.18.103:https S"
202.112.14.21,192.168.1.116,53,13626,6,"Ether / IP / TCP 202.112.14.21:domain > 192.168.1.116:13626 A"
202.112.14.21,192.168.1.116,53,13626,6,"Ether / IP / TCP 202.112.14.21:domain > 192.168.1.116:13626 A"
202.112.14.21,192.168.1.116,53,13624,6,"Ether / IP / TCP 202.112.14.21:domain > 192.168.1.116:13624 FA"
202.112.14.21,192.168.1.116,53,13623,6,"Ether / IP / TCP 202.112.14.21:domain > 192.168.1.116:13623 FA"
202.112.14.21,192.168.1.116,53,13626,6,"Ether / IP / TCP / DNS Ans ""b'msn-cn.a-0032.a-msedge.net.'"" "
202.112.14.21,192.168.1.116,53,13627,6,"Ether / IP / TCP 202.112.14.21:domain > 192.168.1.116:13627 A"
202.112.14.21,192.168.1.116,53,13627,6,"Ether / IP / TCP 202.112.14.21:domain > 192.168.1.116:13627 A"
192.168.1.116,202.112.14.21,13624,53,6,"Ether / IP / TCP 192.168.1.116:13624 > 202.112.14.21:domain A"
192.168.1.116,202.112.14.21,13623,53,6,"Ether / IP / TCP 192.168.1.116:13623 > 202.112.14.21:domain A"
192.168.1.116,202.112.14.21,13626,53,6,"Ether / IP / TCP 192.168.1.116:13626 > 202.112.14.21:domain FA"
192.168.1.116,23.203.135.97,13632,443,6,"Ether / IP / TCP 192.168.1.116:13632 > 23.203.135.97:https S"
202.112.14.21,192.168.1.116,53,13627,6,"Ether / IP / TCP / DNS Ans ""b'msn-cn.a-0032.a-msedge.net.'"" "
202.112.14.21,192.168.1.116,53,13626,6,"Ether / IP / TCP 202.112.14.21:domain > 192.168.1.116:13626 FA"
192.168.1.116,202.112.14.21,13626,53,6,"Ether / IP / TCP 192.168.1.116:13626 > 202.112.14.21:domain A"
192.168.1.116,202.112.14.21,13627,53,6,"Ether / IP / TCP 192.168.1.116:13627 > 202.112.14.21:domain FA"
192.168.1.116,202.89.233.96,13633,443,6,"Ether / IP / TCP 192.168.1.116:13633 > 202.89.233.96:https S"
202.112.14.21,192.168.1.116,53,13627,6,"Ether / IP / TCP 202.112.14.21:domain > 192.168.1.116:13627 FA"
192.168.1.116,202.112.14.21,13627,53,6,"Ether / IP / TCP 192.168.1.116:13627 > 202.112.14.21:domain A"
221.194.154.216,192.168.1.116,443,13628,6,"Ether / IP / TCP 221.194.154.216:https > 192.168.1.116:13628 SA"
192.168.1.116,221.194.154.216,13628,443,6,"Ether / IP / TCP 192.168.1.116:13628 > 221.194.154.216:https A"
192.168.1.116,221.194.154.216,13628,443,6,"Ether / IP / TCP 192.168.1.116:13628 > 221.194.154.216:https PA / Raw"
221.194.154.216,192.168.1.116,443,13629,6,"Ether / IP / TCP 221.194.154.216:https > 192.168.1.116:13629 SA"
192.168.1.116,221.194.154.216,13629,443,6,"Ether / IP / TCP 192.168.1.116:13629 > 221.194.154.216:https A"
192.168.1.116,221.194.154.216,13629,443,6,"Ether / IP / TCP 192.168.1.116:13629 > 221.194.154.216:https PA / Raw"
202.89.233.101,192.168.1.116,443,13630,6,"Ether / IP / TCP 202.89.233.101:https > 192.168.1.116:13630 SA"
192.168.1.116,202.89.233.101,13630,443,6,"Ether / IP / TCP 192.168.1.116:13630 > 202.89.233.101:https A"
192.168.1.116,202.89.233.101,13630,443,6,"Ether / IP / TCP 192.168.1.116:13630 > 202.89.233.101:https PA / Raw"
202.89.233.96,192.168.1.116,443,13633,6,"Ether / IP / TCP 202.89.233.96:https > 192.168.1.116:13633 SA"
192.168.1.116,202.89.233.96,13633,443,6,"Ether / IP / TCP 192.168.1.116:13633 > 202.89.233.96:https A"
192.168.1.116,202.89.233.96,13633,443,6,"Ether / IP / TCP 192.168.1.116:13633 > 202.89.233.96:https PA / Raw"
20.205.115.81,192.168.1.116,443,13625,6,"Ether / IP / TCP 20.205.115.81:https > 192.168.1.116:13625 SA"
221.194.154.216,192.168.1.116,443,13628,6,"Ether / IP / TCP 221.194.154.216:https > 192.168.1.116:13628 A"
221.194.154.216,192.168.1.116,443,13628,6,"Ether / IP / TCP 221.194.154.216:https > 192.168.1.116:13628 A / Raw"
221.194.154.216,192.168.1.116,443,13628,6,"Ether / IP / TCP 221.194.154.216:https > 192.168.1.116:13628 PA / Raw"
221.194.154.216,192.168.1.116,443,13628,6,"Ether / IP / TCP 221.194.154.216:https > 192.168.1.116:13628 PA / Raw"
221.194.154.216,192.168.1.116,443,13628,6,"Ether / IP / TCP 221.194.154.216:https > 192.168.1.116:13628 A / Raw"
54.192.18.103,192.168.1.116,443,13631,6,"Ether / IP / TCP 54.192.18.103:https > 192.168.1.116:13631 SA"
192.168.1.116,20.205.115.81,13625,443,6,"Ether / IP / TCP 192.168.1.116:13625 > 20.205.115.81:https A"
192.168.1.116,221.194.154.216,13628,443,6,"Ether / IP / TCP 192.168.1.116:13628 > 221.194.154.216:https A"
192.168.1.116,54.192.18.103,13631,443,6,"Ether / IP / TCP 192.168.1.116:13631 > 54.192.18.103:https A"
192.168.1.116,20.205.115.81,13625,443,6,"Ether / IP / TCP 192.168.1.116:13625 > 20.205.115.81:https PA / Raw"
192.168.1.116,54.192.18.103,13631,443,6,"Ether / IP / TCP 192.168.1.116:13631 > 54.192.18.103:https PA / Raw"
23.203.135.97,192.168.1.116,443,13632,6,"Ether / IP / TCP 23.203.135.97:https > 192.168.1.116:13632 SA"
192.168.1.116,23.203.135.97,13632,443,6,"Ether / IP / TCP 192.168.1.116:13632 > 23.203.135.97:https A"
192.168.1.116,23.203.135.97,13632,443,6,"Ether / IP / TCP 192.168.1.116:13632 > 23.203.135.97:https PA / Raw"
221.194.154.216,192.168.1.116,443,13629,6,"Ether / IP / TCP 221.194.154.216:https > 192.168.1.116:13629 A"
221.194.154.216,192.168.1.116,443,13629,6,"Ether / IP / TCP 221.194.154.216:https > 192.168.1.116:13629 A / Raw"
221.194.154.216,192.168.1.116,443,13629,6,"Ether / IP / TCP 221.194.154.216:https > 192.168.1.116:13629 PA / Raw"
221.194.154.216,192.168.1.116,443,13629,6,"Ether / IP / TCP 221.194.154.216:https > 192.168.1.116:13629 PA / Raw"
192.168.1.116,221.194.154.216,13629,443,6,"Ether / IP / TCP 192.168.1.116:13629 > 221.194.154.216:https A"
221.194.154.216,192.168.1.116,443,13629,6,"Ether / IP / TCP 221.194.154.216:https > 192.168.1.116:13629 A / Raw"
192.168.1.116,221.194.154.216,13629,443,6,"Ether / IP / TCP 192.168.1.116:13629 > 221.194.154.216:https A"
221.194.154.216,192.168.1.116,443,13628,6,"Ether / IP / TCP 221.194.154.216:https > 192.168.1.116:13628 PA / Raw"
192.168.1.116,221.194.154.216,13628,443,6,"Ether / IP / TCP 192.168.1.116:13628 > 221.194.154.216:https PA / Raw"
202.89.233.101,192.168.1.116,443,13630,6,"Ether / IP / TCP 202.89.233.101:https > 192.168.1.116:13630 A"
221.194.154.216,192.168.1.116,443,13629,6,"Ether / IP / TCP 221.194.154.216:https > 192.168.1.116:13629 PA / Raw"
202.89.233.101,192.168.1.116,443,13630,6,"Ether / IP / TCP 202.89.233.101:https > 192.168.1.116:13630 A / Raw"
202.89.233.101,192.168.1.116,443,13630,6,"Ether / IP / TCP 202.89.233.101:https > 192.168.1.116:13630 A / Raw"
202.89.233.101,192.168.1.116,443,13630,6,"Ether / IP / TCP 202.89.233.101:https > 192.168.1.116:13630 A / Raw"
202.89.233.101,192.168.1.116,443,13630,6,"Ether / IP / TCP 202.89.233.101:https > 192.168.1.116:13630 A / Raw"
202.89.233.101,192.168.1.116,443,13630,6,"Ether / IP / TCP 202.89.233.101:https > 192.168.1.116:13630 PA / Raw"
192.168.1.116,221.194.154.216,13629,443,6,"Ether / IP / TCP 192.168.1.116:13629 > 221.194.154.216:https PA / Raw"
192.168.1.116,202.89.233.101,13630,443,6,"Ether / IP / TCP 192.168.1.116:13630 > 202.89.233.101:https A"
202.89.233.96,192.168.1.116,443,13633,6,"Ether / IP / TCP 202.89.233.96:https > 192.168.1.116:13633 A"
202.89.233.96,192.168.1.116,443,13633,6,"Ether / IP / TCP 202.89.233.96:https > 192.168.1.116:13633 A / Raw"
202.89.233.96,192.168.1.116,443,13633,6,"Ether / IP / TCP 202.89.233.96:https > 192.168.1.116:13633 A / Raw"
202.89.233.96,192.168.1.116,443,13633,6,"Ether / IP / TCP 202.89.233.96:https > 192.168.1.116:13633 A / Raw"
202.89.233.96,192.168.1.116,443,13633,6,"Ether / IP / TCP 202.89.233.96:https > 192.168.1.116:13633 PA / Raw"
192.168.1.116,202.89.233.96,13633,443,6,"Ether / IP / TCP 192.168.1.116:13633 > 202.89.233.96:https A"
192.168.1.116,202.89.233.101,13630,443,6,"Ether / IP / TCP 192.168.1.116:13630 > 202.89.233.101:https PA / Raw"
192.168.1.116,202.89.233.96,13633,443,6,"Ether / IP / TCP 192.168.1.116:13633 > 202.89.233.96:https PA / Raw"
221.194.154.216,192.168.1.116,443,13628,6,"Ether / IP / TCP 221.194.154.216:https > 192.168.1.116:13628 A"
221.194.154.216,192.168.1.116,443,13628,6,"Ether / IP / TCP 221.194.154.216:https > 192.168.1.116:13628 PA / Raw"
221.194.154.216,192.168.1.116,443,13628,6,"Ether / IP / TCP 221.194.154.216:https > 192.168.1.116:13628 PA / Raw"
192.168.1.116,221.194.154.216,13628,443,6,"Ether / IP / TCP 192.168.1.116:13628 > 221.194.154.216:https A"
54.192.18.103,192.168.1.116,443,13631,6,"Ether / IP / TCP 54.192.18.103:https > 192.168.1.116:13631 A"
20.205.115.81,192.168.1.116,443,13625,6,"Ether / IP / TCP 20.205.115.81:https > 192.168.1.116:13625 A / Raw"
20.205.115.81,192.168.1.116,443,13625,6,"Ether / IP / TCP 20.205.115.81:https > 192.168.1.116:13625 A / Raw"
192.168.1.116,20.205.115.81,13625,443,6,"Ether / IP / TCP 192.168.1.116:13625 > 20.205.115.81:https A"
20.205.115.81,192.168.1.116,443,13625,6,"Ether / IP / TCP 20.205.115.81:https > 192.168.1.116:13625 PA / Raw"
192.168.1.116,20.205.115.81,13625,443,6,"Ether / IP / TCP 192.168.1.116:13625 > 20.205.115.81:https PA / Raw"
23.203.135.97,192.168.1.116,443,13632,6,"Ether / IP / TCP 23.203.135.97:https > 192.168.1.116:13632 A"
23.203.135.97,192.168.1.116,443,13632,6,"Ether / IP / TCP 23.203.135.97:https > 192.168.1.116:13632 A / Raw"
23.203.135.97,192.168.1.116,443,13632,6,"Ether / IP / TCP 23.203.135.97:https > 192.168.1.116:13632 PA / Raw"
23.203.135.97,192.168.1.116,443,13632,6,"Ether / IP / TCP 23.203.135.97:https > 192.168.1.116:13632 PA / Raw"
192.168.1.116,23.203.135.97,13632,443,6,"Ether / IP / TCP 192.168.1.116:13632 > 23.203.135.97:https A"
192.168.1.116,23.203.135.97,13632,443,6,"Ether / IP / TCP 192.168.1.116:13632 > 23.203.135.97:https PA / Raw"
54.192.18.103,192.168.1.116,443,13631,6,"Ether / IP / TCP 54.192.18.103:https > 192.168.1.116:13631 A / Raw"
