data,flowmember,label,classes
b'her / IP / TCP 192.168.0.106:6965 > 116.132.235.204:http ',1,,
b'her / IP / TCP 192.168.0.106:6965 > 116.132.235.204:http ',1,,
b'her / IP / TCP 192.168.0.106:6965 > 116.132.235.204:http PA / Ra',1,,
b'her / IP / TCP 192.168.0.106:6965 > 116.132.235.204:http A / Ra',1,,
b'her / IP / TCP 192.168.0.106:6965 > 116.132.235.204:http A / Ra',1,,
b'her / IP / TCP 192.168.0.106:6965 > 116.132.235.204:http PA / Ra',1,,
b'her / IP / TCP 192.168.0.106:6965 > 116.132.235.204:http ',2,,
b'her / IP / TCP 192.168.0.106:6965 > 116.132.235.204:http F',2,,
b'her / IP / TCP 116.132.235.204:http > 192.168.0.106:6965 S',3,,
b'her / IP / TCP 116.132.235.204:http > 192.168.0.106:6965 ',3,,
b'her / IP / TCP 116.132.235.204:http > 192.168.0.106:6965 ',3,,
b'her / IP / TCP 116.132.235.204:http > 192.168.0.106:6965 ',3,,
b'her / IP / TCP 116.132.235.204:http > 192.168.0.106:6965 PA / Ra',3,,
b'her / IP / TCP 116.132.235.204:http > 192.168.0.106:6965 F',3,,
b'her / IP / TCP 116.132.235.204:http > 192.168.0.106:6965 ',4,,
b'her / IP / TCP 192.168.0.106:6966 > 116.132.235.204:http ',4,,
b'her / IP / TCP 192.168.0.106:6966 > 116.132.235.204:http ',4,,
b'her / IP / TCP 192.168.0.106:6966 > 116.132.235.204:http PA / Ra',4,,
b'her / IP / TCP 192.168.0.106:6966 > 116.132.235.204:http A / Ra',4,,
b'her / IP / TCP 192.168.0.106:6966 > 116.132.235.204:http A / Ra',4,,
b'her / IP / TCP 192.168.0.106:6966 > 116.132.235.204:http PA / Ra',4,,
b'her / IP / TCP 192.168.0.106:6966 > 116.132.235.204:http ',5,,
b'her / IP / TCP 192.168.0.106:6966 > 116.132.235.204:http F',5,,
b'her / IP / TCP 116.132.235.204:http > 192.168.0.106:6966 S',6,,
b'her / IP / TCP 116.132.235.204:http > 192.168.0.106:6966 ',6,,
b'her / IP / TCP 116.132.235.204:http > 192.168.0.106:6966 ',6,,
b'her / IP / TCP 116.132.235.204:http > 192.168.0.106:6966 ',6,,
b'her / IP / TCP 116.132.235.204:http > 192.168.0.106:6966 PA / Ra',6,,
b'her / IP / TCP 116.132.235.204:http > 192.168.0.106:6966 F',6,,
b'her / IP / TCP 116.132.235.204:http > 192.168.0.106:6966 ',7,,
b'her / IP / TCP 192.168.0.106:6903 > 110.242.68.3:http R',7,,
b'her / IP / TCP 119.3.178.178:21111 > 192.168.0.106:8122 A / Paddin',8,,
b'her / IP / TCP 192.168.0.106:8122 > 119.3.178.178:21111 ',9,,
b'her / IP / TCP 192.168.0.106:6962 > 110.242.68.3:http F',10,,
b'her / IP / TCP 192.168.0.106:6962 > 110.242.68.3:http R',10,,
b'her / IP / TCP 192.168.0.106:6967 > 116.132.235.204:http ',11,,
b'her / IP / TCP 192.168.0.106:6967 > 116.132.235.204:http ',11,,
b'her / IP / TCP 192.168.0.106:6967 > 116.132.235.204:http PA / Ra',11,,
b'her / IP / TCP 192.168.0.106:6967 > 116.132.235.204:http A / Ra',11,,
b'her / IP / TCP 192.168.0.106:6967 > 116.132.235.204:http A / Ra',11,,
b'her / IP / TCP 192.168.0.106:6967 > 116.132.235.204:http PA / Ra',11,,
b'her / IP / TCP 192.168.0.106:6967 > 116.132.235.204:http ',12,,
b'her / IP / TCP 192.168.0.106:6967 > 116.132.235.204:http F',12,,
b'her / IP / TCP 116.132.235.204:http > 192.168.0.106:6967 S',13,,
b'her / IP / TCP 116.132.235.204:http > 192.168.0.106:6967 ',13,,
b'her / IP / TCP 116.132.235.204:http > 192.168.0.106:6967 ',13,,
b'her / IP / TCP 116.132.235.204:http > 192.168.0.106:6967 ',13,,
b'her / IP / TCP 116.132.235.204:http > 192.168.0.106:6967 PA / Ra',13,,
b'her / IP / TCP 116.132.235.204:http > 192.168.0.106:6967 F',13,,
b'her / IP / TCP 116.132.235.204:http > 192.168.0.106:6967 ',14,,
b'her / IP / TCP 192.168.0.106:6968 > 116.132.235.204:http ',14,,
b'her / IP / TCP 192.168.0.106:6968 > 116.132.235.204:http ',14,,
b'her / IP / TCP 192.168.0.106:6968 > 116.132.235.204:http PA / Ra',14,,
b'her / IP / TCP 192.168.0.106:6968 > 116.132.235.204:http A / Ra',14,,
b'her / IP / TCP 192.168.0.106:6968 > 116.132.235.204:http A / Ra',14,,
b'her / IP / TCP 192.168.0.106:6968 > 116.132.235.204:http PA / Ra',14,,
b'her / IP / TCP 192.168.0.106:6968 > 116.132.235.204:http ',15,,
b'her / IP / TCP 192.168.0.106:6968 > 116.132.235.204:http F',15,,
b'her / IP / TCP 116.132.235.204:http > 192.168.0.106:6968 S',16,,
b'her / IP / TCP 116.132.235.204:http > 192.168.0.106:6968 ',16,,
b'her / IP / TCP 116.132.235.204:http > 192.168.0.106:6968 ',16,,
b'her / IP / TCP 116.132.235.204:http > 192.168.0.106:6968 ',16,,
b'her / IP / TCP 116.132.235.204:http > 192.168.0.106:6968 PA / Ra',16,,
b'her / IP / TCP 116.132.235.204:http > 192.168.0.106:6968 F',16,,
b'her / IP / TCP 116.132.235.204:http > 192.168.0.106:6968 ',17,,
b'her / IP / TCP 192.168.0.106:6969 > 110.242.68.3:http ',17,,
b'her / IP / TCP 192.168.0.106:6969 > 110.242.68.3:http ',17,,
b'her / IP / TCP 192.168.0.106:6969 > 110.242.68.3:http F',17,,
b'her / IP / TCP 192.168.0.106:6969 > 110.242.68.3:http ',17,,
b'her / IP / TCP 110.242.68.3:http > 192.168.0.106:6969 S',18,,
b'her / IP / TCP 110.242.68.3:http > 192.168.0.106:6969 ',18,,
b'her / IP / TCP 110.242.68.3:http > 192.168.0.106:6969 F',18,,
b'her / IP / TCP 192.168.0.106:6970 > 116.132.235.204:http ',19,,
b'her / IP / TCP 192.168.0.106:6970 > 116.132.235.204:http ',19,,
b'her / IP / TCP 192.168.0.106:6970 > 116.132.235.204:http PA / Ra',19,,
b'her / IP / TCP 192.168.0.106:6970 > 116.132.235.204:http A / Ra',19,,
b'her / IP / TCP 192.168.0.106:6970 > 116.132.235.204:http A / Ra',19,,
b'her / IP / TCP 192.168.0.106:6970 > 116.132.235.204:http PA / Ra',19,,
b'her / IP / TCP 192.168.0.106:6970 > 116.132.235.204:http ',20,,
b'her / IP / TCP 192.168.0.106:6970 > 116.132.235.204:http F',20,,
b'her / IP / TCP 116.132.235.204:http > 192.168.0.106:6970 S',21,,
b'her / IP / TCP 116.132.235.204:http > 192.168.0.106:6970 ',21,,
b'her / IP / TCP 116.132.235.204:http > 192.168.0.106:6970 ',21,,
b'her / IP / TCP 116.132.235.204:http > 192.168.0.106:6970 ',21,,
b'her / IP / TCP 116.132.235.204:http > 192.168.0.106:6970 PA / Ra',21,,
b'her / IP / TCP 116.132.235.204:http > 192.168.0.106:6970 F',21,,
b'her / IP / TCP 116.132.235.204:http > 192.168.0.106:6970 ',22,,
b'her / IP / UDP 192.168.192.1:netbios_ns > 192.168.192.2:netbios_ns / NBNSHeader / Ra',22,,
b'her / IP / UDP 192.168.192.1:netbios_ns > 192.168.192.2:netbios_ns / NBNSHeader / Ra',22,,
b'her / IP / UDP 192.168.192.1:netbios_ns > 192.168.192.2:netbios_ns / NBNSHeader / Ra',22,,
b'her / IP / UDP 192.168.192.1:netbios_ns > 192.168.192.2:netbios_ns / NBNSHeader / Ra',22,,
b'her / IP / UDP 192.168.192.1:netbios_ns > 192.168.192.2:netbios_ns / NBNSHeader / Ra',22,,
b'her / IP / UDP 192.168.192.1:netbios_ns > 192.168.192.2:netbios_ns / NBNSHeader / Ra',22,,
b'her / IP / UDP 192.168.192.1:netbios_ns > 192.168.192.2:netbios_ns / NBNSHeader / Ra',23,,
b'her / IP / UDP 192.168.192.1:netbios_ns > 192.168.192.2:netbios_ns / NBNSHeader / Ra',23,,
b'her / IP / UDP 192.168.192.1:netbios_ns > 192.168.192.2:netbios_ns / NBNSHeader / Ra',23,,
b'her / IP / TCP 192.168.0.106:6908 > 20.44.202.200:https R',24,,
b'her / IP / TCP 192.168.0.106:6971 > 116.132.235.204:http ',25,,
b'her / IP / TCP 192.168.0.106:6971 > 116.132.235.204:http ',25,,
b'her / IP / TCP 192.168.0.106:6971 > 116.132.235.204:http PA / Ra',25,,
b'her / IP / TCP 192.168.0.106:6971 > 116.132.235.204:http A / Ra',25,,
b'her / IP / TCP 192.168.0.106:6971 > 116.132.235.204:http A / Ra',25,,
b'her / IP / TCP 192.168.0.106:6971 > 116.132.235.204:http PA / Ra',25,,
b'her / IP / TCP 192.168.0.106:6971 > 116.132.235.204:http ',26,,
b'her / IP / TCP 192.168.0.106:6971 > 116.132.235.204:http F',26,,
b'her / IP / TCP 116.132.235.204:http > 192.168.0.106:6971 S',27,,
b'her / IP / TCP 116.132.235.204:http > 192.168.0.106:6971 ',27,,
b'her / IP / TCP 116.132.235.204:http > 192.168.0.106:6971 ',27,,
b'her / IP / TCP 116.132.235.204:http > 192.168.0.106:6971 ',27,,
b'her / IP / TCP 116.132.235.204:http > 192.168.0.106:6971 ',27,,
b'her / IP / TCP 116.132.235.204:http > 192.168.0.106:6971 PA / Ra',27,,
b'her / IP / TCP 116.132.235.204:http > 192.168.0.106:6971 F',28,,
b'her / IP / TCP 116.132.235.204:http > 192.168.0.106:6971 ',28,,
b'her / IP / TCP 192.168.0.106:6972 > 116.132.235.204:http ',29,,
b'her / IP / TCP 192.168.0.106:6972 > 116.132.235.204:http ',29,,
b'her / IP / TCP 192.168.0.106:6972 > 116.132.235.204:http PA / Ra',29,,
b'her / IP / TCP 192.168.0.106:6972 > 116.132.235.204:http A / Ra',29,,
b'her / IP / TCP 192.168.0.106:6972 > 116.132.235.204:http A / Ra',29,,
b'her / IP / TCP 192.168.0.106:6972 > 116.132.235.204:http PA / Ra',29,,
b'her / IP / TCP 192.168.0.106:6972 > 116.132.235.204:http ',30,,
b'her / IP / TCP 192.168.0.106:6972 > 116.132.235.204:http F',30,,
b'her / IP / TCP 116.132.235.204:http > 192.168.0.106:6972 S',31,,
b'her / IP / TCP 116.132.235.204:http > 192.168.0.106:6972 ',31,,
b'her / IP / TCP 116.132.235.204:http > 192.168.0.106:6972 ',31,,
b'her / IP / TCP 116.132.235.204:http > 192.168.0.106:6972 ',31,,
b'her / IP / TCP 116.132.235.204:http > 192.168.0.106:6972 PA / Ra',31,,
b'her / IP / TCP 116.132.235.204:http > 192.168.0.106:6972 F',31,,
b'her / IP / TCP 116.132.235.204:http > 192.168.0.106:6972 ',32,,
b'her / IP / TCP 192.168.0.106:6973 > 116.132.235.204:http ',32,,
b'her / IP / TCP 192.168.0.106:6973 > 116.132.235.204:http ',32,,
b'her / IP / TCP 192.168.0.106:6973 > 116.132.235.204:http PA / Ra',32,,
b'her / IP / TCP 192.168.0.106:6973 > 116.132.235.204:http A / Ra',32,,
b'her / IP / TCP 192.168.0.106:6973 > 116.132.235.204:http A / Ra',32,,
b'her / IP / TCP 192.168.0.106:6973 > 116.132.235.204:http PA / Ra',32,,
b'her / IP / TCP 192.168.0.106:6973 > 116.132.235.204:http ',33,,
b'her / IP / TCP 192.168.0.106:6973 > 116.132.235.204:http F',33,,
b'her / IP / TCP 116.132.235.204:http > 192.168.0.106:6973 S',34,,
b'her / IP / TCP 116.132.235.204:http > 192.168.0.106:6973 ',34,,
b'her / IP / TCP 116.132.235.204:http > 192.168.0.106:6973 ',34,,
b'her / IP / TCP 116.132.235.204:http > 192.168.0.106:6973 ',34,,
b'her / IP / TCP 116.132.235.204:http > 192.168.0.106:6973 PA / Ra',34,,
b'her / IP / TCP 116.132.235.204:http > 192.168.0.106:6973 F',34,,
b'her / IP / TCP 116.132.235.204:http > 192.168.0.106:6973 ',35,,
b'her / IP / TCP 192.168.0.106:6974 > 116.132.235.204:http ',35,,
b'her / IP / TCP 192.168.0.106:6974 > 116.132.235.204:http ',35,,
b'her / IP / TCP 192.168.0.106:6974 > 116.132.235.204:http PA / Ra',35,,
b'her / IP / TCP 192.168.0.106:6974 > 116.132.235.204:http A / Ra',35,,
b'her / IP / TCP 192.168.0.106:6974 > 116.132.235.204:http A / Ra',35,,
b'her / IP / TCP 192.168.0.106:6974 > 116.132.235.204:http PA / Ra',35,,
b'her / IP / TCP 192.168.0.106:6974 > 116.132.235.204:http ',36,,
b'her / IP / TCP 192.168.0.106:6974 > 116.132.235.204:http F',36,,
b'her / IP / TCP 116.132.235.204:http > 192.168.0.106:6974 S',37,,
b'her / IP / TCP 116.132.235.204:http > 192.168.0.106:6974 ',37,,
b'her / IP / TCP 116.132.235.204:http > 192.168.0.106:6974 ',37,,
b'her / IP / TCP 116.132.235.204:http > 192.168.0.106:6974 ',37,,
b'her / IP / TCP 116.132.235.204:http > 192.168.0.106:6974 PA / Ra',37,,
b'her / IP / TCP 116.132.235.204:http > 192.168.0.106:6974 F',37,,
b'her / IP / TCP 116.132.235.204:http > 192.168.0.106:6974 ',38,,
b'her / IP / TCP 192.168.0.106:6975 > 116.132.235.204:http ',38,,
b'her / IP / TCP 192.168.0.106:6975 > 116.132.235.204:http ',38,,
b'her / IP / TCP 192.168.0.106:6975 > 116.132.235.204:http PA / Ra',38,,
b'her / IP / TCP 192.168.0.106:6975 > 116.132.235.204:http A / Ra',38,,
b'her / IP / TCP 192.168.0.106:6975 > 116.132.235.204:http A / Ra',38,,
b'her / IP / TCP 192.168.0.106:6975 > 116.132.235.204:http PA / Ra',38,,
b'her / IP / TCP 192.168.0.106:6975 > 116.132.235.204:http ',39,,
b'her / IP / TCP 192.168.0.106:6975 > 116.132.235.204:http F',39,,
b'her / IP / TCP 192.168.0.106:6975 > 116.132.235.204:http F',39,,
b'her / IP / TCP 192.168.0.106:6975 > 116.132.235.204:http F',39,,
b'her / IP / TCP 192.168.0.106:6975 > 116.132.235.204:http F',39,,
b'her / IP / TCP 192.168.0.106:6975 > 116.132.235.204:http F',39,,
b'her / IP / TCP 192.168.0.106:6975 > 116.132.235.204:http F',39,,
b'her / IP / TCP 192.168.0.106:6975 > 116.132.235.204:http R',40,,
b'her / IP / TCP 116.132.235.204:http > 192.168.0.106:6975 S',40,,
b'her / IP / TCP 116.132.235.204:http > 192.168.0.106:6975 ',40,,
b'her / IP / TCP 116.132.235.204:http > 192.168.0.106:6975 ',40,,
b'her / IP / TCP 116.132.235.204:http > 192.168.0.106:6975 ',40,,
b'her / IP / TCP 116.132.235.204:http > 192.168.0.106:6975 PA / Ra',40,,
b'her / IP / TCP 116.132.235.204:http > 192.168.0.106:6975 F',40,,
b'her / IP / TCP 192.168.0.106:6976 > 116.132.235.204:http ',41,,
b'her / IP / TCP 192.168.0.106:6976 > 116.132.235.204:http ',41,,
b'her / IP / TCP 192.168.0.106:6976 > 116.132.235.204:http PA / Ra',41,,
b'her / IP / TCP 192.168.0.106:6976 > 116.132.235.204:http A / Ra',41,,
b'her / IP / TCP 192.168.0.106:6976 > 116.132.235.204:http A / Ra',41,,
b'her / IP / TCP 192.168.0.106:6976 > 116.132.235.204:http PA / Ra',41,,
b'her / IP / TCP 192.168.0.106:6976 > 116.132.235.204:http F',42,,
b'her / IP / TCP 192.168.0.106:6976 > 116.132.235.204:http ',42,,
b'her / IP / TCP 192.168.0.106:6976 > 116.132.235.204:http F',42,,
b'her / IP / TCP 192.168.0.106:6976 > 116.132.235.204:http F',42,,
b'her / IP / TCP 192.168.0.106:6976 > 116.132.235.204:http F',42,,
b'her / IP / TCP 192.168.0.106:6976 > 116.132.235.204:http F',42,,
b'her / IP / TCP 192.168.0.106:6976 > 116.132.235.204:http F',42,,
b'her / IP / TCP 192.168.0.106:6976 > 116.132.235.204:http R',43,,
b'her / IP / TCP 116.132.235.204:http > 192.168.0.106:6976 S',43,,
b'her / IP / TCP 116.132.235.204:http > 192.168.0.106:6976 ',43,,
b'her / IP / TCP 116.132.235.204:http > 192.168.0.106:6976 ',43,,
b'her / IP / TCP 116.132.235.204:http > 192.168.0.106:6976 ',43,,
b'her / IP / TCP 116.132.235.204:http > 192.168.0.106:6976 PA / Ra',43,,
b'her / IP / TCP 116.132.235.204:http > 192.168.0.106:6976 F',43,,
b'her / IP / TCP 192.168.0.106:6841 > 119.28.20.150:https A / Ra',44,,
b'her / IP / TCP 192.168.0.106:6841 > 119.28.20.150:https ',44,,
b'her / IP / TCP 119.28.20.150:https > 192.168.0.106:6841 ',45,,
b'her / IP / TCP 119.28.20.150:https > 192.168.0.106:6841 PA / Ra',45,,
b'her / IP / TCP 119.28.20.150:https > 192.168.0.106:6841 F',45,,
b'her / IP / TCP 192.168.0.106:6977 > 116.132.235.204:http ',46,,
b'her / IP / TCP 192.168.0.106:6977 > 116.132.235.204:http ',46,,
b'her / IP / TCP 192.168.0.106:6977 > 116.132.235.204:http PA / Ra',46,,
b'her / IP / TCP 192.168.0.106:6977 > 116.132.235.204:http A / Ra',46,,
b'her / IP / TCP 192.168.0.106:6977 > 116.132.235.204:http A / Ra',46,,
b'her / IP / TCP 192.168.0.106:6977 > 116.132.235.204:http PA / Ra',46,,
b'her / IP / TCP 192.168.0.106:6977 > 116.132.235.204:http ',47,,
b'her / IP / TCP 192.168.0.106:6977 > 116.132.235.204:http F',47,,
b'her / IP / TCP 116.132.235.204:http > 192.168.0.106:6977 S',48,,
b'her / IP / TCP 116.132.235.204:http > 192.168.0.106:6977 ',48,,
b'her / IP / TCP 116.132.235.204:http > 192.168.0.106:6977 ',48,,
b'her / IP / TCP 116.132.235.204:http > 192.168.0.106:6977 ',48,,
b'her / IP / TCP 116.132.235.204:http > 192.168.0.106:6977 PA / Ra',48,,
b'her / IP / TCP 116.132.235.204:http > 192.168.0.106:6977 F',48,,
b'her / IP / TCP 116.132.235.204:http > 192.168.0.106:6977 ',49,,
b'her / IP / TCP 192.168.0.106:6978 > 116.132.235.204:http ',49,,
b'her / IP / TCP 192.168.0.106:6978 > 116.132.235.204:http ',49,,
b'her / IP / TCP 192.168.0.106:6978 > 116.132.235.204:http PA / Ra',49,,
b'her / IP / TCP 192.168.0.106:6978 > 116.132.235.204:http A / Ra',49,,
b'her / IP / TCP 192.168.0.106:6978 > 116.132.235.204:http A / Ra',49,,
b'her / IP / TCP 192.168.0.106:6978 > 116.132.235.204:http PA / Ra',49,,
b'her / IP / TCP 192.168.0.106:6978 > 116.132.235.204:http ',50,,
b'her / IP / TCP 192.168.0.106:6978 > 116.132.235.204:http F',50,,
b'her / IP / TCP 116.132.235.204:http > 192.168.0.106:6978 S',51,,
b'her / IP / TCP 116.132.235.204:http > 192.168.0.106:6978 ',51,,
b'her / IP / TCP 116.132.235.204:http > 192.168.0.106:6978 ',51,,
b'her / IP / TCP 116.132.235.204:http > 192.168.0.106:6978 ',51,,
b'her / IP / TCP 116.132.235.204:http > 192.168.0.106:6978 PA / Ra',51,,
b'her / IP / TCP 116.132.235.204:http > 192.168.0.106:6978 F',51,,
b'her / IP / TCP 116.132.235.204:http > 192.168.0.106:6978 ',52,,
b'her / IP / TCP 192.168.0.106:6979 > 116.132.235.204:http ',52,,
b'her / IP / TCP 192.168.0.106:6979 > 116.132.235.204:http ',52,,
b'her / IP / TCP 192.168.0.106:6979 > 116.132.235.204:http PA / Ra',52,,
b'her / IP / TCP 192.168.0.106:6979 > 116.132.235.204:http A / Ra',52,,
b'her / IP / TCP 192.168.0.106:6979 > 116.132.235.204:http A / Ra',52,,
b'her / IP / TCP 192.168.0.106:6979 > 116.132.235.204:http PA / Ra',52,,
b'her / IP / TCP 192.168.0.106:6979 > 116.132.235.204:http ',53,,
b'her / IP / TCP 192.168.0.106:6979 > 116.132.235.204:http F',53,,
b'her / IP / TCP 116.132.235.204:http > 192.168.0.106:6979 S',54,,
b'her / IP / TCP 116.132.235.204:http > 192.168.0.106:6979 ',54,,
b'her / IP / TCP 116.132.235.204:http > 192.168.0.106:6979 ',54,,
b'her / IP / TCP 116.132.235.204:http > 192.168.0.106:6979 ',54,,
b'her / IP / TCP 116.132.235.204:http > 192.168.0.106:6979 PA / Ra',54,,
b'her / IP / TCP 116.132.235.204:http > 192.168.0.106:6979 F',54,,
b'her / IP / TCP 116.132.235.204:http > 192.168.0.106:6979 ',55,,
b'her / IP / TCP 192.168.0.106:6980 > 116.132.235.204:http ',55,,
b'her / IP / TCP 192.168.0.106:6980 > 116.132.235.204:http ',55,,
b'her / IP / TCP 192.168.0.106:6980 > 116.132.235.204:http PA / Ra',55,,
b'her / IP / TCP 192.168.0.106:6980 > 116.132.235.204:http A / Ra',55,,
b'her / IP / TCP 192.168.0.106:6980 > 116.132.235.204:http A / Ra',55,,
b'her / IP / TCP 192.168.0.106:6980 > 116.132.235.204:http PA / Ra',55,,
b'her / IP / TCP 192.168.0.106:6980 > 116.132.235.204:http ',56,,
b'her / IP / TCP 192.168.0.106:6980 > 116.132.235.204:http F',56,,
b'her / IP / TCP 116.132.235.204:http > 192.168.0.106:6980 S',57,,
b'her / IP / TCP 116.132.235.204:http > 192.168.0.106:6980 ',57,,
b'her / IP / TCP 116.132.235.204:http > 192.168.0.106:6980 ',57,,
b'her / IP / TCP 116.132.235.204:http > 192.168.0.106:6980 ',57,,
b'her / IP / TCP 116.132.235.204:http > 192.168.0.106:6980 PA / Ra',57,,
b'her / IP / TCP 116.132.235.204:http > 192.168.0.106:6980 F',57,,
b'her / IP / TCP 116.132.235.204:http > 192.168.0.106:6980 ',58,,
b'her / IP / TCP 192.168.0.106:6852 > 61.163.9.167:https A / Ra',58,,
b'her / IP / TCP 192.168.0.106:6849 > 61.163.9.171:https A / Ra',59,,
b'her / IP / TCP 61.163.9.167:https > 192.168.0.106:6852 ',60,,
b'her / IP / TCP 61.163.9.171:https > 192.168.0.106:6849 ',61,,
b'her / IP / TCP 192.168.0.106:6853 > 123.6.28.49:https A / Ra',62,,
b'her / IP / TCP 192.168.0.106:6853 > 123.6.28.49:https ',62,,
b'her / IP / TCP 123.6.28.49:https > 192.168.0.106:6853 ',63,,
b'her / IP / TCP 123.6.28.49:https > 192.168.0.106:6853 PA / Ra',63,,
b'her / IP / TCP 123.6.28.49:https > 192.168.0.106:6853 PA / Ra',63,,
b'her / IP / TCP 123.6.28.49:https > 192.168.0.106:6853 F',63,,
b'her / IP / TCP 192.168.0.106:6981 > 110.242.68.3:http ',64,,
b'her / IP / TCP 192.168.0.106:6981 > 110.242.68.3:http ',64,,
b'her / IP / TCP 192.168.0.106:6981 > 110.242.68.3:http F',64,,
b'her / IP / TCP 192.168.0.106:6981 > 110.242.68.3:http ',64,,
b'her / IP / TCP 110.242.68.3:http > 192.168.0.106:6981 S',65,,
b'her / IP / TCP 110.242.68.3:http > 192.168.0.106:6981 ',65,,
b'her / IP / TCP 110.242.68.3:http > 192.168.0.106:6981 F',65,,
b'her / IP / TCP 192.168.0.106:6982 > 116.132.235.204:http ',66,,
b'her / IP / TCP 192.168.0.106:6982 > 116.132.235.204:http ',66,,
b'her / IP / TCP 192.168.0.106:6982 > 116.132.235.204:http PA / Ra',66,,
b'her / IP / TCP 192.168.0.106:6982 > 116.132.235.204:http A / Ra',66,,
b'her / IP / TCP 192.168.0.106:6982 > 116.132.235.204:http A / Ra',66,,
b'her / IP / TCP 192.168.0.106:6982 > 116.132.235.204:http PA / Ra',66,,
b'her / IP / TCP 192.168.0.106:6982 > 116.132.235.204:http ',67,,
b'her / IP / TCP 192.168.0.106:6982 > 116.132.235.204:http F',67,,
b'her / IP / TCP 116.132.235.204:http > 192.168.0.106:6982 S',68,,
b'her / IP / TCP 116.132.235.204:http > 192.168.0.106:6982 ',68,,
b'her / IP / TCP 116.132.235.204:http > 192.168.0.106:6982 ',68,,
b'her / IP / TCP 116.132.235.204:http > 192.168.0.106:6982 ',68,,
b'her / IP / TCP 116.132.235.204:http > 192.168.0.106:6982 PA / Ra',68,,
b'her / IP / TCP 116.132.235.204:http > 192.168.0.106:6982 F',68,,
b'her / IP / TCP 116.132.235.204:http > 192.168.0.106:6982 ',69,,
b'her / IP / TCP 192.168.0.106:6854 > 54.160.186.76:https A / Ra',69,,
b'her / IP / TCP 192.168.0.106:6854 > 54.160.186.76:https ',69,,
b'her / IP / TCP 192.168.0.106:6854 > 54.160.186.76:https F',69,,
b'her / IP / TCP 192.168.0.106:6855 > 54.160.186.76:https A / Ra',70,,
b'her / IP / TCP 192.168.0.106:6855 > 54.160.186.76:https ',70,,
b'her / IP / TCP 54.160.186.76:https > 192.168.0.106:6854 ',71,,
b'her / IP / TCP 54.160.186.76:https > 192.168.0.106:6854 PA / Ra',71,,
b'her / IP / TCP 54.160.186.76:https > 192.168.0.106:6854 FPA / Ra',71,,
b'her / IP / TCP 54.160.186.76:https > 192.168.0.106:6854 A / Paddin',71,,
b'her / IP / TCP 54.160.186.76:https > 192.168.0.106:6855 ',72,,
b'her / IP / TCP 54.160.186.76:https > 192.168.0.106:6855 PA / Ra',72,,
b'her / IP / TCP 54.160.186.76:https > 192.168.0.106:6855 PA / Ra',72,,
b'her / IP / TCP 54.160.186.76:https > 192.168.0.106:6855 F',72,,
b'her / IP / TCP 192.168.0.106:6803 > 202.89.233.101:https A / Ra',73,,
b'her / IP / TCP 202.89.233.101:https > 192.168.0.106:6803 ',74,,
b'her / IP / TCP 192.168.0.106:6809 > 185.199.108.133:https A / Ra',75,,
b'her / IP / TCP 192.168.0.106:6856 > 35.168.135.85:https A / Ra',76,,
b'her / IP / TCP 192.168.0.106:6856 > 35.168.135.85:https ',76,,
b'her / IP / TCP 192.168.0.106:6856 > 35.168.135.85:https F',76,,
b'her / IP / TCP 185.199.108.133:https > 192.168.0.106:6809 ',77,,
b'her / IP / TCP 192.168.0.106:6858 > 35.168.135.85:https A / Ra',78,,
b'her / IP / TCP 35.168.135.85:https > 192.168.0.106:6856 ',79,,
b'her / IP / TCP 35.168.135.85:https > 192.168.0.106:6856 PA / Ra',79,,
b'her / IP / TCP 35.168.135.85:https > 192.168.0.106:6856 FPA / Ra',79,,
b'her / IP / TCP 35.168.135.85:https > 192.168.0.106:6858 ',80,,
b'her / IP / TCP 35.168.135.85:https > 192.168.0.106:6858 PA / Ra',80,,
b'her / IP / TCP 35.168.135.85:https > 192.168.0.106:6858 F',80,,
b'her / IP / TCP 192.168.0.106:6785 > 218.29.50.85:https A / Ra',81,,
b'her / IP / TCP 218.29.50.85:https > 192.168.0.106:6785 ',82,,
b'her / IP / TCP 192.168.0.106:6808 > 151.101.2.132:https A / Ra',83,,
b'her / IP / TCP 151.101.2.132:https > 192.168.0.106:6808 ',84,,
b'her / IP / TCP 192.168.0.106:6795 > 52.168.117.169:https A / Ra',85,,
b'her / IP / TCP 192.168.0.106:6795 > 52.168.117.169:https PA / Ra',85,,
b'her / IP / TCP 192.168.0.106:6795 > 52.168.117.169:https PA / Ra',85,,
b'her / IP / TCP 192.168.0.106:6795 > 52.168.117.169:https ',85,,
b'her / IP / TCP 192.168.0.106:6795 > 52.168.117.169:https PA / Ra',85,,
b'her / IP / TCP 192.168.0.106:6795 > 52.168.117.169:https PA / Ra',85,,
b'her / IP / TCP 192.168.0.106:6795 > 52.168.117.169:https ',86,,
b'her / IP / TCP 52.168.117.169:https > 192.168.0.106:6795 ',86,,
b'her / IP / TCP 52.168.117.169:https > 192.168.0.106:6795 A / Paddin',86,,
b'her / IP / TCP 52.168.117.169:https > 192.168.0.106:6795 PA / Ra',86,,
b'her / IP / TCP 52.168.117.169:https > 192.168.0.106:6795 A / Paddin',86,,
b'her / IP / TCP 52.168.117.169:https > 192.168.0.106:6795 PA / Ra',86,,
"b'her / IP / UDP / DNS Qry ""b\'dns.msftncsi.com.\'""'",87,,
"b'her / IP / UDP / DNS Qry ""b\'ipv6.msftconnecttest.com.\'""'",87,,
"b'her / IP / UDP / DNS Ans ""fd3e:4f5a:5b81::1""'",88,,
"b'her / IP / UDP / DNS Ans ""b\'v6ncsi.msedge.net.\'""'",88,,
"b'her / IP / UDP / DNS Qry ""b\'www.msftconnecttest.com.\'""'",89,,
"b'her / IP / UDP / DNS Qry ""b\'ipv6.msftconnecttest.com.\'""'",90,,
"b'her / IP / UDP / DNS Qry ""b\'wpad.www.tendawifi.com.\'""'",90,,
"b'her / IP / UDP / DNS Ans ""b\'v6ncsi.msedge.net.\'""'",91,,
b'her / IP / UDP / DNS Ans',91,,
"b'her / IP / UDP / DNS Ans ""b\'ncsi-geo.trafficmanager.net.\'""'",92,,
b'her / IP / TCP 192.168.0.106:6984 > 23.56.170.193:http ',93,,
b'her / IP / TCP 192.168.0.106:6984 > 23.56.170.193:http ',93,,
b'her / IP / TCP 192.168.0.106:6984 > 23.56.170.193:http PA / Ra',93,,
b'her / IP / TCP 192.168.0.106:6984 > 23.56.170.193:http ',93,,
b'her / IP / TCP 192.168.0.106:6983 > 23.56.170.193:http ',94,,
b'her / IP / TCP 192.168.0.106:6983 > 23.56.170.193:http ',94,,
b'her / IP / TCP 192.168.0.106:6983 > 23.56.170.193:http PA / Ra',94,,
b'her / IP / TCP 192.168.0.106:6983 > 23.56.170.193:http ',94,,
b'her / IP / TCP 192.168.0.106:6983 > 23.56.170.193:http F',94,,
b'her / IP / TCP 192.168.0.106:6983 > 23.56.170.193:http F',94,,
"b'her / IP / UDP / DNS Qry ""b\'ipv6.msftconnecttest.com.\'""'",95,,
"b'her / IP / UDP / DNS Qry ""b\'ipv6.msftconnecttest.com.\'""'",95,,
"b'her / IP / UDP / DNS Qry ""b\'ipv6.msftconnecttest.com.\'""'",96,,
"b'her / IP / UDP / DNS Ans ""b\'v6ncsi.msedge.net.\'""'",97,,
"b'her / IP / UDP / DNS Ans ""b\'v6ncsi.msedge.net.\'""'",98,,
b'her / IP / TCP 23.56.170.193:http > 192.168.0.106:6984 S',99,,
b'her / IP / TCP 23.56.170.193:http > 192.168.0.106:6984 ',99,,
b'her / IP / TCP 23.56.170.193:http > 192.168.0.106:6984 F',99,,
b'her / IP / TCP 23.56.170.193:http > 192.168.0.106:6983 S',100,,
b'her / IP / TCP 23.56.170.193:http > 192.168.0.106:6983 ',100,,
b'her / IP / TCP 23.56.170.193:http > 192.168.0.106:6983 PA / Ra',100,,
b'her / IP / TCP 23.56.170.193:http > 192.168.0.106:6983 F',100,,
b'her / IP / TCP 23.56.170.193:http > 192.168.0.106:6983 ',100,,
b'her / IP / TCP 192.168.0.106:3626 > 34.225.41.193:https PA / Ra',101,,
b'her / IP / TCP 192.168.0.106:3626 > 34.225.41.193:https ',101,,
b'her / IP / TCP 34.225.41.193:https > 192.168.0.106:3626 PA / Ra',102,,
b'her / IP / TCP 34.225.41.193:https > 192.168.0.106:3626 PA / Ra',102,,
b'her / IP / TCP 192.168.0.106:6851 > 42.81.62.31:https A / Ra',103,,
b'her / IP / TCP 42.81.62.31:https > 192.168.0.106:6851 ',104,,
b'her / IP / TCP 192.168.0.106:6985 > 110.242.68.3:http ',105,,
b'her / IP / TCP 192.168.0.106:6985 > 110.242.68.3:http ',105,,
b'her / IP / TCP 192.168.0.106:6985 > 110.242.68.3:http F',105,,
b'her / IP / TCP 192.168.0.106:6985 > 110.242.68.3:http ',105,,
b'her / IP / TCP 110.242.68.3:http > 192.168.0.106:6985 S',106,,
b'her / IP / TCP 110.242.68.3:http > 192.168.0.106:6985 ',106,,
b'her / IP / TCP 110.242.68.3:http > 192.168.0.106:6985 F',106,,
b'her / IP / TCP 192.168.0.106:6857 > 111.206.209.249:https A / Ra',107,,
"b'her / IP / UDP / DNS Qry ""b\'cn.bing.com.\'""'",108,,
"b'her / IP / UDP / DNS Ans ""202.89.233.101""'",109,,
"b'her / IP / UDP / DNS Qry ""b\'_microsoft_mcc._tcp.local.\'""'",110,,
"b'her / IP / UDP / DNS Qry ""b\'_microsoft_mcc._tcp.local.\'""'",110,,
"b'her / IPv6 / UDP / DNS Qry ""b\'_microsoft_mcc._tcp.local.\'""'",111,,
"b'her / IPv6 / UDP / DNS Qry ""b\'_microsoft_mcc._tcp.local.\'""'",111,,
b'her / IP / TCP 192.168.0.106:3709 > 52.2.80.44:https PA / Ra',112,,
b'her / IP / TCP 52.2.80.44:https > 192.168.0.106:3709 A / Paddin',113,,
b'her / IP / TCP 192.168.0.106:6986 > 110.242.68.3:http ',114,,
b'her / IP / TCP 192.168.0.106:6986 > 110.242.68.3:http ',114,,
b'her / IP / TCP 192.168.0.106:6986 > 110.242.68.3:http F',114,,
b'her / IP / TCP 192.168.0.106:6986 > 110.242.68.3:http ',114,,
b'her / IP / TCP 110.242.68.3:http > 192.168.0.106:6986 S',115,,
b'her / IP / TCP 110.242.68.3:http > 192.168.0.106:6986 ',115,,
b'her / IP / TCP 110.242.68.3:http > 192.168.0.106:6986 F',115,,
