srcip,dstip,sport,dport,proto,data
192.168.0.106,116.132.235.204,8623,80,6,"Ether / IP / TCP 192.168.0.106:8623 > 116.132.235.204:http S"
116.132.235.204,192.168.0.106,80,8623,6,"Ether / IP / TCP 116.132.235.204:http > 192.168.0.106:8623 SA"
192.168.0.106,116.132.235.204,8623,80,6,"Ether / IP / TCP 192.168.0.106:8623 > 116.132.235.204:http A"
192.168.0.106,116.132.235.204,8623,80,6,"Ether / IP / TCP 192.168.0.106:8623 > 116.132.235.204:http PA / Raw"
192.168.0.106,116.132.235.204,8623,80,6,"Ether / IP / TCP 192.168.0.106:8623 > 116.132.235.204:http A / Raw"
192.168.0.106,116.132.235.204,8623,80,6,"Ether / IP / TCP 192.168.0.106:8623 > 116.132.235.204:http A / Raw"
192.168.0.106,116.132.235.204,8623,80,6,"Ether / IP / TCP 192.168.0.106:8623 > 116.132.235.204:http PA / Raw"
116.132.235.204,192.168.0.106,80,8623,6,"Ether / IP / TCP 116.132.235.204:http > 192.168.0.106:8623 A"
116.132.235.204,192.168.0.106,80,8623,6,"Ether / IP / TCP 116.132.235.204:http > 192.168.0.106:8623 A"
116.132.235.204,192.168.0.106,80,8623,6,"Ether / IP / TCP 116.132.235.204:http > 192.168.0.106:8623 A"
116.132.235.204,192.168.0.106,80,8623,6,"Ether / IP / TCP 116.132.235.204:http > 192.168.0.106:8623 PA / Raw"
116.132.235.204,192.168.0.106,80,8623,6,"Ether / IP / TCP 116.132.235.204:http > 192.168.0.106:8623 FA"
192.168.0.106,116.132.235.204,8623,80,6,"Ether / IP / TCP 192.168.0.106:8623 > 116.132.235.204:http A"
192.168.0.106,116.132.235.204,8623,80,6,"Ether / IP / TCP 192.168.0.106:8623 > 116.132.235.204:http FA"
116.132.235.204,192.168.0.106,80,8623,6,"Ether / IP / TCP 116.132.235.204:http > 192.168.0.106:8623 A"
124.236.26.168,192.168.0.106,80,8570,6,"Ether / IP / TCP 124.236.26.168:http > 192.168.0.106:8570 FA"
192.168.0.106,124.236.26.168,8570,80,6,"Ether / IP / TCP 192.168.0.106:8570 > 124.236.26.168:http A"
192.168.0.106,124.236.26.168,8570,80,6,"Ether / IP / TCP 192.168.0.106:8570 > 124.236.26.168:http FA"
124.236.26.168,192.168.0.106,80,8570,6,"Ether / IP / TCP 124.236.26.168:http > 192.168.0.106:8570 R"
192.168.0.106,110.242.68.3,8614,80,6,"Ether / IP / TCP 192.168.0.106:8614 > 110.242.68.3:http FA"
192.168.0.106,116.132.235.204,8624,80,6,"Ether / IP / TCP 192.168.0.106:8624 > 116.132.235.204:http S"
116.132.235.204,192.168.0.106,80,8624,6,"Ether / IP / TCP 116.132.235.204:http > 192.168.0.106:8624 SA"
192.168.0.106,116.132.235.204,8624,80,6,"Ether / IP / TCP 192.168.0.106:8624 > 116.132.235.204:http A"
192.168.0.106,116.132.235.204,8624,80,6,"Ether / IP / TCP 192.168.0.106:8624 > 116.132.235.204:http PA / Raw"
192.168.0.106,116.132.235.204,8624,80,6,"Ether / IP / TCP 192.168.0.106:8624 > 116.132.235.204:http A / Raw"
192.168.0.106,116.132.235.204,8624,80,6,"Ether / IP / TCP 192.168.0.106:8624 > 116.132.235.204:http A / Raw"
192.168.0.106,116.132.235.204,8624,80,6,"Ether / IP / TCP 192.168.0.106:8624 > 116.132.235.204:http PA / Raw"
116.132.235.204,192.168.0.106,80,8624,6,"Ether / IP / TCP 116.132.235.204:http > 192.168.0.106:8624 A"
116.132.235.204,192.168.0.106,80,8624,6,"Ether / IP / TCP 116.132.235.204:http > 192.168.0.106:8624 A"
116.132.235.204,192.168.0.106,80,8624,6,"Ether / IP / TCP 116.132.235.204:http > 192.168.0.106:8624 A"
116.132.235.204,192.168.0.106,80,8624,6,"Ether / IP / TCP 116.132.235.204:http > 192.168.0.106:8624 A"
116.132.235.204,192.168.0.106,80,8624,6,"Ether / IP / TCP 116.132.235.204:http > 192.168.0.106:8624 PA / Raw"
116.132.235.204,192.168.0.106,80,8624,6,"Ether / IP / TCP 116.132.235.204:http > 192.168.0.106:8624 FA"
192.168.0.106,116.132.235.204,8624,80,6,"Ether / IP / TCP 192.168.0.106:8624 > 116.132.235.204:http A"
192.168.0.106,116.132.235.204,8624,80,6,"Ether / IP / TCP 192.168.0.106:8624 > 116.132.235.204:http FA"
116.132.235.204,192.168.0.106,80,8624,6,"Ether / IP / TCP 116.132.235.204:http > 192.168.0.106:8624 A"
192.168.0.106,116.132.235.204,8625,80,6,"Ether / IP / TCP 192.168.0.106:8625 > 116.132.235.204:http S"
116.132.235.204,192.168.0.106,80,8625,6,"Ether / IP / TCP 116.132.235.204:http > 192.168.0.106:8625 SA"
192.168.0.106,116.132.235.204,8625,80,6,"Ether / IP / TCP 192.168.0.106:8625 > 116.132.235.204:http A"
192.168.0.106,116.132.235.204,8625,80,6,"Ether / IP / TCP 192.168.0.106:8625 > 116.132.235.204:http PA / Raw"
192.168.0.106,116.132.235.204,8625,80,6,"Ether / IP / TCP 192.168.0.106:8625 > 116.132.235.204:http A / Raw"
192.168.0.106,116.132.235.204,8625,80,6,"Ether / IP / TCP 192.168.0.106:8625 > 116.132.235.204:http A / Raw"
192.168.0.106,116.132.235.204,8625,80,6,"Ether / IP / TCP 192.168.0.106:8625 > 116.132.235.204:http PA / Raw"
116.132.235.204,192.168.0.106,80,8625,6,"Ether / IP / TCP 116.132.235.204:http > 192.168.0.106:8625 A"
116.132.235.204,192.168.0.106,80,8625,6,"Ether / IP / TCP 116.132.235.204:http > 192.168.0.106:8625 A"
116.132.235.204,192.168.0.106,80,8625,6,"Ether / IP / TCP 116.132.235.204:http > 192.168.0.106:8625 A"
116.132.235.204,192.168.0.106,80,8625,6,"Ether / IP / TCP 116.132.235.204:http > 192.168.0.106:8625 PA / Raw"
116.132.235.204,192.168.0.106,80,8625,6,"Ether / IP / TCP 116.132.235.204:http > 192.168.0.106:8625 FA"
192.168.0.106,116.132.235.204,8625,80,6,"Ether / IP / TCP 192.168.0.106:8625 > 116.132.235.204:http A"
192.168.0.106,116.132.235.204,8625,80,6,"Ether / IP / TCP 192.168.0.106:8625 > 116.132.235.204:http FA"
116.132.235.204,192.168.0.106,80,8625,6,"Ether / IP / TCP 116.132.235.204:http > 192.168.0.106:8625 A"
192.168.0.106,116.132.235.204,8626,80,6,"Ether / IP / TCP 192.168.0.106:8626 > 116.132.235.204:http S"
116.132.235.204,192.168.0.106,80,8626,6,"Ether / IP / TCP 116.132.235.204:http > 192.168.0.106:8626 SA"
192.168.0.106,116.132.235.204,8626,80,6,"Ether / IP / TCP 192.168.0.106:8626 > 116.132.235.204:http A"
192.168.0.106,116.132.235.204,8626,80,6,"Ether / IP / TCP 192.168.0.106:8626 > 116.132.235.204:http PA / Raw"
192.168.0.106,116.132.235.204,8626,80,6,"Ether / IP / TCP 192.168.0.106:8626 > 116.132.235.204:http A / Raw"
192.168.0.106,116.132.235.204,8626,80,6,"Ether / IP / TCP 192.168.0.106:8626 > 116.132.235.204:http A / Raw"
192.168.0.106,116.132.235.204,8626,80,6,"Ether / IP / TCP 192.168.0.106:8626 > 116.132.235.204:http PA / Raw"
116.132.235.204,192.168.0.106,80,8626,6,"Ether / IP / TCP 116.132.235.204:http > 192.168.0.106:8626 A"
116.132.235.204,192.168.0.106,80,8626,6,"Ether / IP / TCP 116.132.235.204:http > 192.168.0.106:8626 A"
116.132.235.204,192.168.0.106,80,8626,6,"Ether / IP / TCP 116.132.235.204:http > 192.168.0.106:8626 A"
116.132.235.204,192.168.0.106,80,8626,6,"Ether / IP / TCP 116.132.235.204:http > 192.168.0.106:8626 PA / Raw"
116.132.235.204,192.168.0.106,80,8626,6,"Ether / IP / TCP 116.132.235.204:http > 192.168.0.106:8626 FA"
192.168.0.106,116.132.235.204,8626,80,6,"Ether / IP / TCP 192.168.0.106:8626 > 116.132.235.204:http A"
192.168.0.106,116.132.235.204,8626,80,6,"Ether / IP / TCP 192.168.0.106:8626 > 116.132.235.204:http FA"
192.168.0.106,116.132.235.204,8626,80,6,"Ether / IP / TCP 192.168.0.106:8626 > 116.132.235.204:http FA"
192.168.0.106,116.132.235.204,8626,80,6,"Ether / IP / TCP 192.168.0.106:8626 > 116.132.235.204:http FA"
192.168.0.106,116.132.235.204,8627,80,6,"Ether / IP / TCP 192.168.0.106:8627 > 116.132.235.204:http S"
116.132.235.204,192.168.0.106,80,8627,6,"Ether / IP / TCP 116.132.235.204:http > 192.168.0.106:8627 SA"
192.168.0.106,116.132.235.204,8627,80,6,"Ether / IP / TCP 192.168.0.106:8627 > 116.132.235.204:http A"
192.168.0.106,116.132.235.204,8627,80,6,"Ether / IP / TCP 192.168.0.106:8627 > 116.132.235.204:http PA / Raw"
192.168.0.106,116.132.235.204,8627,80,6,"Ether / IP / TCP 192.168.0.106:8627 > 116.132.235.204:http A / Raw"
192.168.0.106,116.132.235.204,8627,80,6,"Ether / IP / TCP 192.168.0.106:8627 > 116.132.235.204:http A / Raw"
192.168.0.106,116.132.235.204,8627,80,6,"Ether / IP / TCP 192.168.0.106:8627 > 116.132.235.204:http PA / Raw"
116.132.235.204,192.168.0.106,80,8627,6,"Ether / IP / TCP 116.132.235.204:http > 192.168.0.106:8627 A"
116.132.235.204,192.168.0.106,80,8627,6,"Ether / IP / TCP 116.132.235.204:http > 192.168.0.106:8627 A"
116.132.235.204,192.168.0.106,80,8627,6,"Ether / IP / TCP 116.132.235.204:http > 192.168.0.106:8627 PA / Raw"
116.132.235.204,192.168.0.106,80,8627,6,"Ether / IP / TCP 116.132.235.204:http > 192.168.0.106:8627 FA"
192.168.0.106,116.132.235.204,8627,80,6,"Ether / IP / TCP 192.168.0.106:8627 > 116.132.235.204:http A"
192.168.0.106,116.132.235.204,8627,80,6,"Ether / IP / TCP 192.168.0.106:8627 > 116.132.235.204:http FA"
116.132.235.204,192.168.0.106,80,8627,6,"Ether / IP / TCP 116.132.235.204:http > 192.168.0.106:8627 A"
192.168.0.106,116.132.235.204,8626,80,6,"Ether / IP / TCP 192.168.0.106:8626 > 116.132.235.204:http FA"
192.168.0.106,116.132.235.204,8628,80,6,"Ether / IP / TCP 192.168.0.106:8628 > 116.132.235.204:http S"
116.132.235.204,192.168.0.106,80,8628,6,"Ether / IP / TCP 116.132.235.204:http > 192.168.0.106:8628 SA"
192.168.0.106,116.132.235.204,8628,80,6,"Ether / IP / TCP 192.168.0.106:8628 > 116.132.235.204:http A"
192.168.0.106,116.132.235.204,8628,80,6,"Ether / IP / TCP 192.168.0.106:8628 > 116.132.235.204:http PA / Raw"
192.168.0.106,116.132.235.204,8628,80,6,"Ether / IP / TCP 192.168.0.106:8628 > 116.132.235.204:http A / Raw"
192.168.0.106,116.132.235.204,8628,80,6,"Ether / IP / TCP 192.168.0.106:8628 > 116.132.235.204:http A / Raw"
192.168.0.106,116.132.235.204,8628,80,6,"Ether / IP / TCP 192.168.0.106:8628 > 116.132.235.204:http PA / Raw"
116.132.235.204,192.168.0.106,80,8628,6,"Ether / IP / TCP 116.132.235.204:http > 192.168.0.106:8628 A"
116.132.235.204,192.168.0.106,80,8628,6,"Ether / IP / TCP 116.132.235.204:http > 192.168.0.106:8628 A"
116.132.235.204,192.168.0.106,80,8628,6,"Ether / IP / TCP 116.132.235.204:http > 192.168.0.106:8628 A"
116.132.235.204,192.168.0.106,80,8628,6,"Ether / IP / TCP 116.132.235.204:http > 192.168.0.106:8628 PA / Raw"
116.132.235.204,192.168.0.106,80,8628,6,"Ether / IP / TCP 116.132.235.204:http > 192.168.0.106:8628 FA"
192.168.0.106,116.132.235.204,8628,80,6,"Ether / IP / TCP 192.168.0.106:8628 > 116.132.235.204:http A"
192.168.0.106,116.132.235.204,8628,80,6,"Ether / IP / TCP 192.168.0.106:8628 > 116.132.235.204:http FA"
116.132.235.204,192.168.0.106,80,8628,6,"Ether / IP / TCP 116.132.235.204:http > 192.168.0.106:8628 A"
192.168.0.106,116.132.235.204,8629,80,6,"Ether / IP / TCP 192.168.0.106:8629 > 116.132.235.204:http S"
116.132.235.204,192.168.0.106,80,8629,6,"Ether / IP / TCP 116.132.235.204:http > 192.168.0.106:8629 SA"
192.168.0.106,116.132.235.204,8629,80,6,"Ether / IP / TCP 192.168.0.106:8629 > 116.132.235.204:http A"
192.168.0.106,116.132.235.204,8629,80,6,"Ether / IP / TCP 192.168.0.106:8629 > 116.132.235.204:http PA / Raw"
192.168.0.106,116.132.235.204,8629,80,6,"Ether / IP / TCP 192.168.0.106:8629 > 116.132.235.204:http A / Raw"
192.168.0.106,116.132.235.204,8629,80,6,"Ether / IP / TCP 192.168.0.106:8629 > 116.132.235.204:http A / Raw"
192.168.0.106,116.132.235.204,8629,80,6,"Ether / IP / TCP 192.168.0.106:8629 > 116.132.235.204:http PA / Raw"
116.132.235.204,192.168.0.106,80,8629,6,"Ether / IP / TCP 116.132.235.204:http > 192.168.0.106:8629 A"
116.132.235.204,192.168.0.106,80,8629,6,"Ether / IP / TCP 116.132.235.204:http > 192.168.0.106:8629 A"
116.132.235.204,192.168.0.106,80,8629,6,"Ether / IP / TCP 116.132.235.204:http > 192.168.0.106:8629 A"
116.132.235.204,192.168.0.106,80,8629,6,"Ether / IP / TCP 116.132.235.204:http > 192.168.0.106:8629 PA / Raw"
116.132.235.204,192.168.0.106,80,8629,6,"Ether / IP / TCP 116.132.235.204:http > 192.168.0.106:8629 FA"
192.168.0.106,116.132.235.204,8629,80,6,"Ether / IP / TCP 192.168.0.106:8629 > 116.132.235.204:http A"
192.168.0.106,116.132.235.204,8629,80,6,"Ether / IP / TCP 192.168.0.106:8629 > 116.132.235.204:http FA"
116.132.235.204,192.168.0.106,80,8629,6,"Ether / IP / TCP 116.132.235.204:http > 192.168.0.106:8629 A"
192.168.0.106,202.89.233.100,8484,443,6,"Ether / IP / TCP 192.168.0.106:8484 > 202.89.233.100:https A / Raw"
192.168.0.106,202.89.233.100,8486,443,6,"Ether / IP / TCP 192.168.0.106:8486 > 202.89.233.100:https A / Raw"
202.89.233.100,192.168.0.106,443,8484,6,"Ether / IP / TCP 202.89.233.100:https > 192.168.0.106:8484 A"
202.89.233.100,192.168.0.106,443,8486,6,"Ether / IP / TCP 202.89.233.100:https > 192.168.0.106:8486 A"
192.168.0.106,204.79.197.203,8483,443,6,"Ether / IP / TCP 192.168.0.106:8483 > 204.79.197.203:https A / Raw"
204.79.197.203,192.168.0.106,443,8483,6,"Ether / IP / TCP 204.79.197.203:https > 192.168.0.106:8483 A"
192.168.0.106,20.205.115.81,8487,443,6,"Ether / IP / TCP 192.168.0.106:8487 > 20.205.115.81:https A / Raw"
20.205.115.81,192.168.0.106,443,8487,6,"Ether / IP / TCP 20.205.115.81:https > 192.168.0.106:8487 A"
192.168.0.106,110.242.68.3,8614,80,6,"Ether / IP / TCP 192.168.0.106:8614 > 110.242.68.3:http FA"
192.168.0.106,116.132.235.204,8630,80,6,"Ether / IP / TCP 192.168.0.106:8630 > 116.132.235.204:http S"
116.132.235.204,192.168.0.106,80,8630,6,"Ether / IP / TCP 116.132.235.204:http > 192.168.0.106:8630 SA"
192.168.0.106,116.132.235.204,8630,80,6,"Ether / IP / TCP 192.168.0.106:8630 > 116.132.235.204:http A"
192.168.0.106,116.132.235.204,8630,80,6,"Ether / IP / TCP 192.168.0.106:8630 > 116.132.235.204:http PA / Raw"
192.168.0.106,116.132.235.204,8630,80,6,"Ether / IP / TCP 192.168.0.106:8630 > 116.132.235.204:http A / Raw"
192.168.0.106,116.132.235.204,8630,80,6,"Ether / IP / TCP 192.168.0.106:8630 > 116.132.235.204:http A / Raw"
192.168.0.106,116.132.235.204,8630,80,6,"Ether / IP / TCP 192.168.0.106:8630 > 116.132.235.204:http PA / Raw"
116.132.235.204,192.168.0.106,80,8630,6,"Ether / IP / TCP 116.132.235.204:http > 192.168.0.106:8630 A"
116.132.235.204,192.168.0.106,80,8630,6,"Ether / IP / TCP 116.132.235.204:http > 192.168.0.106:8630 A"
116.132.235.204,192.168.0.106,80,8630,6,"Ether / IP / TCP 116.132.235.204:http > 192.168.0.106:8630 A"
116.132.235.204,192.168.0.106,80,8630,6,"Ether / IP / TCP 116.132.235.204:http > 192.168.0.106:8630 PA / Raw"
192.168.0.106,116.132.235.204,8630,80,6,"Ether / IP / TCP 192.168.0.106:8630 > 116.132.235.204:http FA"
116.132.235.204,192.168.0.106,80,8630,6,"Ether / IP / TCP 116.132.235.204:http > 192.168.0.106:8630 FA"
192.168.0.106,116.132.235.204,8630,80,6,"Ether / IP / TCP 192.168.0.106:8630 > 116.132.235.204:http A"
192.168.0.106,116.132.235.204,8630,80,6,"Ether / IP / TCP 192.168.0.106:8630 > 116.132.235.204:http FA"
192.168.0.106,110.242.68.3,8631,80,6,"Ether / IP / TCP 192.168.0.106:8631 > 110.242.68.3:http S"
110.242.68.3,192.168.0.106,80,8631,6,"Ether / IP / TCP 110.242.68.3:http > 192.168.0.106:8631 SA"
192.168.0.106,110.242.68.3,8631,80,6,"Ether / IP / TCP 192.168.0.106:8631 > 110.242.68.3:http A"
192.168.0.106,110.242.68.3,8631,80,6,"Ether / IP / TCP 192.168.0.106:8631 > 110.242.68.3:http FA"
110.242.68.3,192.168.0.106,80,8631,6,"Ether / IP / TCP 110.242.68.3:http > 192.168.0.106:8631 A"
110.242.68.3,192.168.0.106,80,8631,6,"Ether / IP / TCP 110.242.68.3:http > 192.168.0.106:8631 FA"
192.168.0.106,110.242.68.3,8631,80,6,"Ether / IP / TCP 192.168.0.106:8631 > 110.242.68.3:http A"
192.168.0.106,116.132.235.204,8630,80,6,"Ether / IP / TCP 192.168.0.106:8630 > 116.132.235.204:http FA"
192.168.0.106,116.132.235.204,8626,80,6,"Ether / IP / TCP 192.168.0.106:8626 > 116.132.235.204:http FA"
192.168.0.106,116.132.235.204,8632,80,6,"Ether / IP / TCP 192.168.0.106:8632 > 116.132.235.204:http S"
116.132.235.204,192.168.0.106,80,8632,6,"Ether / IP / TCP 116.132.235.204:http > 192.168.0.106:8632 SA"
192.168.0.106,116.132.235.204,8632,80,6,"Ether / IP / TCP 192.168.0.106:8632 > 116.132.235.204:http A"
192.168.0.106,116.132.235.204,8632,80,6,"Ether / IP / TCP 192.168.0.106:8632 > 116.132.235.204:http PA / Raw"
192.168.0.106,116.132.235.204,8632,80,6,"Ether / IP / TCP 192.168.0.106:8632 > 116.132.235.204:http A / Raw"
192.168.0.106,116.132.235.204,8632,80,6,"Ether / IP / TCP 192.168.0.106:8632 > 116.132.235.204:http A / Raw"
192.168.0.106,116.132.235.204,8632,80,6,"Ether / IP / TCP 192.168.0.106:8632 > 116.132.235.204:http PA / Raw"
116.132.235.204,192.168.0.106,80,8632,6,"Ether / IP / TCP 116.132.235.204:http > 192.168.0.106:8632 A"
116.132.235.204,192.168.0.106,80,8632,6,"Ether / IP / TCP 116.132.235.204:http > 192.168.0.106:8632 A"
116.132.235.204,192.168.0.106,80,8632,6,"Ether / IP / TCP 116.132.235.204:http > 192.168.0.106:8632 A"
116.132.235.204,192.168.0.106,80,8632,6,"Ether / IP / TCP 116.132.235.204:http > 192.168.0.106:8632 PA / Raw"
116.132.235.204,192.168.0.106,80,8632,6,"Ether / IP / TCP 116.132.235.204:http > 192.168.0.106:8632 FA"
192.168.0.106,116.132.235.204,8632,80,6,"Ether / IP / TCP 192.168.0.106:8632 > 116.132.235.204:http A"
192.168.0.106,116.132.235.204,8632,80,6,"Ether / IP / TCP 192.168.0.106:8632 > 116.132.235.204:http FA"
116.132.235.204,192.168.0.106,80,8632,6,"Ether / IP / TCP 116.132.235.204:http > 192.168.0.106:8632 A"
192.168.0.106,116.132.235.204,8633,80,6,"Ether / IP / TCP 192.168.0.106:8633 > 116.132.235.204:http S"
116.132.235.204,192.168.0.106,80,8633,6,"Ether / IP / TCP 116.132.235.204:http > 192.168.0.106:8633 SA"
192.168.0.106,116.132.235.204,8633,80,6,"Ether / IP / TCP 192.168.0.106:8633 > 116.132.235.204:http A"
192.168.0.106,116.132.235.204,8633,80,6,"Ether / IP / TCP 192.168.0.106:8633 > 116.132.235.204:http PA / Raw"
192.168.0.106,116.132.235.204,8633,80,6,"Ether / IP / TCP 192.168.0.106:8633 > 116.132.235.204:http A / Raw"
192.168.0.106,116.132.235.204,8633,80,6,"Ether / IP / TCP 192.168.0.106:8633 > 116.132.235.204:http A / Raw"
192.168.0.106,116.132.235.204,8633,80,6,"Ether / IP / TCP 192.168.0.106:8633 > 116.132.235.204:http PA / Raw"
116.132.235.204,192.168.0.106,80,8633,6,"Ether / IP / TCP 116.132.235.204:http > 192.168.0.106:8633 A"
116.132.235.204,192.168.0.106,80,8633,6,"Ether / IP / TCP 116.132.235.204:http > 192.168.0.106:8633 A"
116.132.235.204,192.168.0.106,80,8633,6,"Ether / IP / TCP 116.132.235.204:http > 192.168.0.106:8633 A"
116.132.235.204,192.168.0.106,80,8633,6,"Ether / IP / TCP 116.132.235.204:http > 192.168.0.106:8633 PA / Raw"
116.132.235.204,192.168.0.106,80,8633,6,"Ether / IP / TCP 116.132.235.204:http > 192.168.0.106:8633 FA"
192.168.0.106,116.132.235.204,8633,80,6,"Ether / IP / TCP 192.168.0.106:8633 > 116.132.235.204:http A"
192.168.0.106,116.132.235.204,8633,80,6,"Ether / IP / TCP 192.168.0.106:8633 > 116.132.235.204:http FA"
192.168.0.106,116.132.235.204,8633,80,6,"Ether / IP / TCP 192.168.0.106:8633 > 116.132.235.204:http FA"
192.168.0.106,202.89.233.96,8426,443,6,"Ether / IP / TCP 192.168.0.106:8426 > 202.89.233.96:https A / Raw"
202.89.233.96,192.168.0.106,443,8426,6,"Ether / IP / TCP 202.89.233.96:https > 192.168.0.106:8426 A"
192.168.0.106,204.79.197.203,8437,443,6,"Ether / IP / TCP 192.168.0.106:8437 > 204.79.197.203:https A / Raw"
192.168.192.1,192.168.192.2,137,137,17,"Ether / IP / UDP 192.168.192.1:netbios_ns > 192.168.192.2:netbios_ns / NBNSHeader / Raw"
204.79.197.203,192.168.0.106,443,8437,6,"Ether / IP / TCP 204.79.197.203:https > 192.168.0.106:8437 A"
192.168.0.106,116.132.235.204,8630,80,6,"Ether / IP / TCP 192.168.0.106:8630 > 116.132.235.204:http FA"
192.168.0.106,116.132.235.204,8633,80,6,"Ether / IP / TCP 192.168.0.106:8633 > 116.132.235.204:http FA"
192.168.0.106,116.132.235.204,8634,80,6,"Ether / IP / TCP 192.168.0.106:8634 > 116.132.235.204:http S"
116.132.235.204,192.168.0.106,80,8634,6,"Ether / IP / TCP 116.132.235.204:http > 192.168.0.106:8634 SA"
192.168.0.106,116.132.235.204,8634,80,6,"Ether / IP / TCP 192.168.0.106:8634 > 116.132.235.204:http A"
192.168.0.106,116.132.235.204,8634,80,6,"Ether / IP / TCP 192.168.0.106:8634 > 116.132.235.204:http PA / Raw"
192.168.0.106,116.132.235.204,8634,80,6,"Ether / IP / TCP 192.168.0.106:8634 > 116.132.235.204:http A / Raw"
192.168.0.106,116.132.235.204,8634,80,6,"Ether / IP / TCP 192.168.0.106:8634 > 116.132.235.204:http A / Raw"
192.168.0.106,116.132.235.204,8634,80,6,"Ether / IP / TCP 192.168.0.106:8634 > 116.132.235.204:http PA / Raw"
116.132.235.204,192.168.0.106,80,8634,6,"Ether / IP / TCP 116.132.235.204:http > 192.168.0.106:8634 A"
116.132.235.204,192.168.0.106,80,8634,6,"Ether / IP / TCP 116.132.235.204:http > 192.168.0.106:8634 A"
116.132.235.204,192.168.0.106,80,8634,6,"Ether / IP / TCP 116.132.235.204:http > 192.168.0.106:8634 A"
116.132.235.204,192.168.0.106,80,8634,6,"Ether / IP / TCP 116.132.235.204:http > 192.168.0.106:8634 PA / Raw"
116.132.235.204,192.168.0.106,80,8634,6,"Ether / IP / TCP 116.132.235.204:http > 192.168.0.106:8634 FA"
192.168.0.106,116.132.235.204,8634,80,6,"Ether / IP / TCP 192.168.0.106:8634 > 116.132.235.204:http A"
192.168.0.106,116.132.235.204,8634,80,6,"Ether / IP / TCP 192.168.0.106:8634 > 116.132.235.204:http FA"
116.132.235.204,192.168.0.106,80,8634,6,"Ether / IP / TCP 116.132.235.204:http > 192.168.0.106:8634 A"
192.168.0.106,218.58.102.48,8438,443,6,"Ether / IP / TCP 192.168.0.106:8438 > 218.58.102.48:https A / Raw"
218.58.102.48,192.168.0.106,443,8438,6,"Ether / IP / TCP 218.58.102.48:https > 192.168.0.106:8438 A"
192.168.0.106,218.58.102.48,8436,443,6,"Ether / IP / TCP 192.168.0.106:8436 > 218.58.102.48:https A / Raw"
218.58.102.48,192.168.0.106,443,8436,6,"Ether / IP / TCP 218.58.102.48:https > 192.168.0.106:8436 A"
192.168.0.106,116.132.235.204,8633,80,6,"Ether / IP / TCP 192.168.0.106:8633 > 116.132.235.204:http FA"
192.168.0.106,116.132.235.204,8635,80,6,"Ether / IP / TCP 192.168.0.106:8635 > 116.132.235.204:http S"
116.132.235.204,192.168.0.106,80,8635,6,"Ether / IP / TCP 116.132.235.204:http > 192.168.0.106:8635 SA"
192.168.0.106,116.132.235.204,8635,80,6,"Ether / IP / TCP 192.168.0.106:8635 > 116.132.235.204:http A"
192.168.0.106,116.132.235.204,8635,80,6,"Ether / IP / TCP 192.168.0.106:8635 > 116.132.235.204:http PA / Raw"
192.168.0.106,116.132.235.204,8635,80,6,"Ether / IP / TCP 192.168.0.106:8635 > 116.132.235.204:http A / Raw"
192.168.0.106,116.132.235.204,8635,80,6,"Ether / IP / TCP 192.168.0.106:8635 > 116.132.235.204:http A / Raw"
192.168.0.106,116.132.235.204,8635,80,6,"Ether / IP / TCP 192.168.0.106:8635 > 116.132.235.204:http PA / Raw"
116.132.235.204,192.168.0.106,80,8635,6,"Ether / IP / TCP 116.132.235.204:http > 192.168.0.106:8635 A"
116.132.235.204,192.168.0.106,80,8635,6,"Ether / IP / TCP 116.132.235.204:http > 192.168.0.106:8635 A"
116.132.235.204,192.168.0.106,80,8635,6,"Ether / IP / TCP 116.132.235.204:http > 192.168.0.106:8635 A"
116.132.235.204,192.168.0.106,80,8635,6,"Ether / IP / TCP 116.132.235.204:http > 192.168.0.106:8635 PA / Raw"
116.132.235.204,192.168.0.106,80,8635,6,"Ether / IP / TCP 116.132.235.204:http > 192.168.0.106:8635 FA"
192.168.0.106,116.132.235.204,8635,80,6,"Ether / IP / TCP 192.168.0.106:8635 > 116.132.235.204:http A"
192.168.0.106,116.132.235.204,8635,80,6,"Ether / IP / TCP 192.168.0.106:8635 > 116.132.235.204:http FA"
116.132.235.204,192.168.0.106,80,8635,6,"Ether / IP / TCP 116.132.235.204:http > 192.168.0.106:8635 A"
192.168.192.1,192.168.192.2,137,137,17,"Ether / IP / UDP 192.168.192.1:netbios_ns > 192.168.192.2:netbios_ns / NBNSHeader / Raw"
192.168.0.106,13.69.239.73,8447,443,6,"Ether / IP / TCP 192.168.0.106:8447 > 13.69.239.73:https A / Raw"
192.168.0.106,116.132.235.204,8636,80,6,"Ether / IP / TCP 192.168.0.106:8636 > 116.132.235.204:http S"
116.132.235.204,192.168.0.106,80,8636,6,"Ether / IP / TCP 116.132.235.204:http > 192.168.0.106:8636 SA"
192.168.0.106,116.132.235.204,8636,80,6,"Ether / IP / TCP 192.168.0.106:8636 > 116.132.235.204:http A"
192.168.0.106,116.132.235.204,8636,80,6,"Ether / IP / TCP 192.168.0.106:8636 > 116.132.235.204:http PA / Raw"
192.168.0.106,116.132.235.204,8630,80,6,"Ether / IP / TCP 192.168.0.106:8630 > 116.132.235.204:http FA"
192.168.0.106,116.132.235.204,8636,80,6,"Ether / IP / TCP 192.168.0.106:8636 > 116.132.235.204:http A / Raw"
192.168.0.106,116.132.235.204,8636,80,6,"Ether / IP / TCP 192.168.0.106:8636 > 116.132.235.204:http A / Raw"
192.168.0.106,116.132.235.204,8636,80,6,"Ether / IP / TCP 192.168.0.106:8636 > 116.132.235.204:http PA / Raw"
13.69.239.73,192.168.0.106,443,8447,6,"Ether / IP / TCP 13.69.239.73:https > 192.168.0.106:8447 A"
116.132.235.204,192.168.0.106,80,8636,6,"Ether / IP / TCP 116.132.235.204:http > 192.168.0.106:8636 A"
116.132.235.204,192.168.0.106,80,8636,6,"Ether / IP / TCP 116.132.235.204:http > 192.168.0.106:8636 A"
116.132.235.204,192.168.0.106,80,8636,6,"Ether / IP / TCP 116.132.235.204:http > 192.168.0.106:8636 A"
116.132.235.204,192.168.0.106,80,8636,6,"Ether / IP / TCP 116.132.235.204:http > 192.168.0.106:8636 PA / Raw"
116.132.235.204,192.168.0.106,80,8636,6,"Ether / IP / TCP 116.132.235.204:http > 192.168.0.106:8636 FA"
192.168.0.106,116.132.235.204,8636,80,6,"Ether / IP / TCP 192.168.0.106:8636 > 116.132.235.204:http A"
192.168.0.106,116.132.235.204,8636,80,6,"Ether / IP / TCP 192.168.0.106:8636 > 116.132.235.204:http FA"
116.132.235.204,192.168.0.106,80,8636,6,"Ether / IP / TCP 116.132.235.204:http > 192.168.0.106:8636 A"
192.168.0.106,116.132.235.204,8637,80,6,"Ether / IP / TCP 192.168.0.106:8637 > 116.132.235.204:http S"
116.132.235.204,192.168.0.106,80,8637,6,"Ether / IP / TCP 116.132.235.204:http > 192.168.0.106:8637 SA"
192.168.0.106,116.132.235.204,8637,80,6,"Ether / IP / TCP 192.168.0.106:8637 > 116.132.235.204:http A"
192.168.0.106,116.132.235.204,8637,80,6,"Ether / IP / TCP 192.168.0.106:8637 > 116.132.235.204:http PA / Raw"
192.168.0.106,116.132.235.204,8637,80,6,"Ether / IP / TCP 192.168.0.106:8637 > 116.132.235.204:http A / Raw"
192.168.0.106,116.132.235.204,8637,80,6,"Ether / IP / TCP 192.168.0.106:8637 > 116.132.235.204:http A / Raw"
192.168.0.106,116.132.235.204,8637,80,6,"Ether / IP / TCP 192.168.0.106:8637 > 116.132.235.204:http PA / Raw"
116.132.235.204,192.168.0.106,80,8637,6,"Ether / IP / TCP 116.132.235.204:http > 192.168.0.106:8637 A"
116.132.235.204,192.168.0.106,80,8637,6,"Ether / IP / TCP 116.132.235.204:http > 192.168.0.106:8637 A"
116.132.235.204,192.168.0.106,80,8637,6,"Ether / IP / TCP 116.132.235.204:http > 192.168.0.106:8637 A"
116.132.235.204,192.168.0.106,80,8637,6,"Ether / IP / TCP 116.132.235.204:http > 192.168.0.106:8637 PA / Raw"
116.132.235.204,192.168.0.106,80,8637,6,"Ether / IP / TCP 116.132.235.204:http > 192.168.0.106:8637 FA"
192.168.0.106,116.132.235.204,8637,80,6,"Ether / IP / TCP 192.168.0.106:8637 > 116.132.235.204:http A"
192.168.0.106,116.132.235.204,8637,80,6,"Ether / IP / TCP 192.168.0.106:8637 > 116.132.235.204:http FA"
116.132.235.204,192.168.0.106,80,8637,6,"Ether / IP / TCP 116.132.235.204:http > 192.168.0.106:8637 A"
192.168.192.1,192.168.192.2,137,137,17,"Ether / IP / UDP 192.168.192.1:netbios_ns > 192.168.192.2:netbios_ns / NBNSHeader / Raw"
192.168.0.106,116.132.235.204,8638,80,6,"Ether / IP / TCP 192.168.0.106:8638 > 116.132.235.204:http S"
192.168.0.106,116.132.235.204,8633,80,6,"Ether / IP / TCP 192.168.0.106:8633 > 116.132.235.204:http FA"
116.132.235.204,192.168.0.106,80,8638,6,"Ether / IP / TCP 116.132.235.204:http > 192.168.0.106:8638 SA"
192.168.0.106,116.132.235.204,8638,80,6,"Ether / IP / TCP 192.168.0.106:8638 > 116.132.235.204:http A"
192.168.0.106,116.132.235.204,8638,80,6,"Ether / IP / TCP 192.168.0.106:8638 > 116.132.235.204:http PA / Raw"
192.168.0.106,116.132.235.204,8638,80,6,"Ether / IP / TCP 192.168.0.106:8638 > 116.132.235.204:http A / Raw"
192.168.0.106,116.132.235.204,8638,80,6,"Ether / IP / TCP 192.168.0.106:8638 > 116.132.235.204:http A / Raw"
192.168.0.106,116.132.235.204,8638,80,6,"Ether / IP / TCP 192.168.0.106:8638 > 116.132.235.204:http PA / Raw"
116.132.235.204,192.168.0.106,80,8638,6,"Ether / IP / TCP 116.132.235.204:http > 192.168.0.106:8638 A"
116.132.235.204,192.168.0.106,80,8638,6,"Ether / IP / TCP 116.132.235.204:http > 192.168.0.106:8638 A"
116.132.235.204,192.168.0.106,80,8638,6,"Ether / IP / TCP 116.132.235.204:http > 192.168.0.106:8638 A"
116.132.235.204,192.168.0.106,80,8638,6,"Ether / IP / TCP 116.132.235.204:http > 192.168.0.106:8638 PA / Raw"
116.132.235.204,192.168.0.106,80,8638,6,"Ether / IP / TCP 116.132.235.204:http > 192.168.0.106:8638 FA"
192.168.0.106,116.132.235.204,8638,80,6,"Ether / IP / TCP 192.168.0.106:8638 > 116.132.235.204:http A"
192.168.0.106,116.132.235.204,8638,80,6,"Ether / IP / TCP 192.168.0.106:8638 > 116.132.235.204:http FA"
116.132.235.204,192.168.0.106,80,8638,6,"Ether / IP / TCP 116.132.235.204:http > 192.168.0.106:8638 A"
192.168.0.106,116.132.235.204,8626,80,6,"Ether / IP / TCP 192.168.0.106:8626 > 116.132.235.204:http FA"
110.43.67.230,192.168.0.106,443,8564,6,"Ether / IP / TCP 110.43.67.230:https > 192.168.0.106:8564 PA / Raw"
110.43.67.230,192.168.0.106,443,8564,6,"Ether / IP / TCP 110.43.67.230:https > 192.168.0.106:8564 FA"
192.168.0.106,110.43.67.230,8564,443,6,"Ether / IP / TCP 192.168.0.106:8564 > 110.43.67.230:https A"
192.168.0.106,110.43.67.230,8564,443,6,"Ether / IP / TCP 192.168.0.106:8564 > 110.43.67.230:https FA"
110.43.67.230,192.168.0.106,443,8564,6,"Ether / IP / TCP 110.43.67.230:https > 192.168.0.106:8564 A"
192.168.0.106,116.132.235.204,8639,80,6,"Ether / IP / TCP 192.168.0.106:8639 > 116.132.235.204:http S"
116.132.235.204,192.168.0.106,80,8639,6,"Ether / IP / TCP 116.132.235.204:http > 192.168.0.106:8639 SA"
192.168.0.106,116.132.235.204,8639,80,6,"Ether / IP / TCP 192.168.0.106:8639 > 116.132.235.204:http A"
192.168.0.106,116.132.235.204,8639,80,6,"Ether / IP / TCP 192.168.0.106:8639 > 116.132.235.204:http PA / Raw"
192.168.0.106,116.132.235.204,8639,80,6,"Ether / IP / TCP 192.168.0.106:8639 > 116.132.235.204:http A / Raw"
192.168.0.106,116.132.235.204,8639,80,6,"Ether / IP / TCP 192.168.0.106:8639 > 116.132.235.204:http A / Raw"
192.168.0.106,116.132.235.204,8639,80,6,"Ether / IP / TCP 192.168.0.106:8639 > 116.132.235.204:http PA / Raw"
116.132.235.204,192.168.0.106,80,8639,6,"Ether / IP / TCP 116.132.235.204:http > 192.168.0.106:8639 A"
116.132.235.204,192.168.0.106,80,8639,6,"Ether / IP / TCP 116.132.235.204:http > 192.168.0.106:8639 A"
116.132.235.204,192.168.0.106,80,8639,6,"Ether / IP / TCP 116.132.235.204:http > 192.168.0.106:8639 A"
116.132.235.204,192.168.0.106,80,8639,6,"Ether / IP / TCP 116.132.235.204:http > 192.168.0.106:8639 PA / Raw"
116.132.235.204,192.168.0.106,80,8639,6,"Ether / IP / TCP 116.132.235.204:http > 192.168.0.106:8639 FA"
192.168.0.106,116.132.235.204,8639,80,6,"Ether / IP / TCP 192.168.0.106:8639 > 116.132.235.204:http A"
192.168.0.106,116.132.235.204,8639,80,6,"Ether / IP / TCP 192.168.0.106:8639 > 116.132.235.204:http FA"
116.132.235.204,192.168.0.106,80,8639,6,"Ether / IP / TCP 116.132.235.204:http > 192.168.0.106:8639 A"
192.168.0.103,224.0.0.251,5353,5353,17,"Ether / IP / UDP / DNS Ans ""b'iPhonexxx.local.'"" "
0,0,0,0,0,"Ether / IPv6 / UDP / DNS Ans ""b'iPhonexxx.local.'"" "
192.168.0.103,224.0.0.251,5353,5353,17,"Ether / IP / UDP / DNS Qry ""b'_companion-link._tcp.local.'"" "
0,0,0,0,0,"Ether / IPv6 / UDP / DNS Qry ""b'_companion-link._tcp.local.'"" "
192.168.0.103,224.0.0.251,5353,5353,17,"Ether / IP / UDP / DNS Qry ""b'iPhonexxx._rdlink._tcp.local.'"" "
0,0,0,0,0,"Ether / IPv6 / UDP / DNS Qry ""b'iPhonexxx._rdlink._tcp.local.'"" "
192.168.0.103,224.0.0.251,5353,5353,17,"Ether / IP / UDP / DNS Qry ""b'iPhonexxx._rdlink._tcp.local.'"" "
0,0,0,0,0,"Ether / IPv6 / UDP / DNS Qry ""b'iPhonexxx._rdlink._tcp.local.'"" "
192.168.0.103,224.0.0.251,5353,5353,17,"Ether / IP / UDP / DNS Qry ""b'iPhonexxx._rdlink._tcp.local.'"" "
0,0,0,0,0,"Ether / IPv6 / UDP / DNS Qry ""b'iPhonexxx._rdlink._tcp.local.'"" "
192.168.0.103,224.0.0.251,5353,5353,17,"Ether / IP / UDP / DNS Ans ""b'iPhonexxx.local.'"" "
0,0,0,0,0,"Ether / IPv6 / UDP / DNS Ans ""b'iPhonexxx.local.'"" "
192.168.0.103,224.0.0.251,5353,5353,17,"Ether / IP / UDP / DNS Qry ""b'_companion-link._tcp.local.'"" "
0,0,0,0,0,"Ether / IPv6 / UDP / DNS Qry ""b'_companion-link._tcp.local.'"" "
192.168.0.103,224.0.0.251,5353,5353,17,"Ether / IP / UDP / DNS Ans ""[b'rpBA=02:EE:AC:35:79:1E', b'rpVr=440.9', b'rpAD=bafec0bbd76d']"" "
0,0,0,0,0,"Ether / IPv6 / UDP / DNS Ans ""[b'rpBA=02:EE:AC:35:79:1E', b'rpVr=440.9', b'rpAD=bafec0bbd76d']"" "
192.168.0.106,116.132.235.204,8630,80,6,"Ether / IP / TCP 192.168.0.106:8630 > 116.132.235.204:http FA"
192.168.0.103,224.0.0.251,5353,5353,17,"Ether / IP / UDP / DNS Ans ""[b'rpBA=02:EE:AC:35:79:1E', b'rpVr=440.9', b'rpAD=bafec0bbd76d']"" "
0,0,0,0,0,"Ether / IPv6 / UDP / DNS Ans ""[b'rpBA=02:EE:AC:35:79:1E', b'rpVr=440.9', b'rpAD=bafec0bbd76d']"" "
192.168.0.106,110.242.68.3,8614,80,6,"Ether / IP / TCP 192.168.0.106:8614 > 110.242.68.3:http RA"
192.168.0.103,224.0.0.251,5353,5353,17,"Ether / IP / UDP / DNS Ans ""b'iPhonexxx.local.'"" "
0,0,0,0,0,"Ether / IPv6 / UDP / DNS Ans ""b'iPhonexxx.local.'"" "
192.168.0.106,2.18.254.11,8481,443,6,"Ether / IP / TCP 192.168.0.106:8481 > 2.18.254.11:https A / Raw"
192.168.0.103,224.0.0.251,5353,5353,17,"Ether / IP / UDP / DNS Qry ""b'_companion-link._tcp.local.'"" "
0,0,0,0,0,"Ether / IPv6 / UDP / DNS Qry ""b'_companion-link._tcp.local.'"" "
2.18.254.11,192.168.0.106,443,8481,6,"Ether / IP / TCP 2.18.254.11:https > 192.168.0.106:8481 R"
192.168.0.103,224.0.0.251,5353,5353,17,"Ether / IP / UDP / DNS Qry ""b'iPhonexxx._rdlink._tcp.local.'"" "
0,0,0,0,0,"Ether / IPv6 / UDP / DNS Qry ""b'iPhonexxx._rdlink._tcp.local.'"" "
192.168.0.103,224.0.0.251,5353,5353,17,"Ether / IP / UDP / DNS Qry ""b'iPhonexxx._rdlink._tcp.local.'"" "
0,0,0,0,0,"Ether / IPv6 / UDP / DNS Qry ""b'iPhonexxx._rdlink._tcp.local.'"" "
192.168.0.103,224.0.0.251,5353,5353,17,"Ether / IP / UDP / DNS Ans ""b'iPhonexxx.local.'"" "
0,0,0,0,0,"Ether / IPv6 / UDP / DNS Ans ""b'iPhonexxx.local.'"" "
192.168.0.106,116.132.235.204,8633,80,6,"Ether / IP / TCP 192.168.0.106:8633 > 116.132.235.204:http FA"
192.168.0.106,110.242.68.3,8640,80,6,"Ether / IP / TCP 192.168.0.106:8640 > 110.242.68.3:http S"
110.242.68.3,192.168.0.106,80,8640,6,"Ether / IP / TCP 110.242.68.3:http > 192.168.0.106:8640 SA"
192.168.0.106,110.242.68.3,8640,80,6,"Ether / IP / TCP 192.168.0.106:8640 > 110.242.68.3:http A"
192.168.0.106,110.242.68.3,8640,80,6,"Ether / IP / TCP 192.168.0.106:8640 > 110.242.68.3:http FA"
110.242.68.3,192.168.0.106,80,8640,6,"Ether / IP / TCP 110.242.68.3:http > 192.168.0.106:8640 A"
110.242.68.3,192.168.0.106,80,8640,6,"Ether / IP / TCP 110.242.68.3:http > 192.168.0.106:8640 FA"
192.168.0.106,110.242.68.3,8640,80,6,"Ether / IP / TCP 192.168.0.106:8640 > 110.242.68.3:http A"
192.168.0.106,192.168.0.1,64559,53,17,"Ether / IP / UDP / DNS Qry ""b'dns.msftncsi.com.'"" "
192.168.0.1,192.168.0.106,53,64559,17,"Ether / IP / UDP / DNS Ans ""fd3e:4f5a:5b81::1"" "
192.168.0.103,224.0.0.251,5353,5353,17,"Ether / IP / UDP / DNS Qry ""b'iPhonexxx._rdlink._tcp.local.'"" "
0,0,0,0,0,"Ether / IPv6 / UDP / DNS Qry ""b'iPhonexxx._rdlink._tcp.local.'"" "
192.168.0.103,224.0.0.251,5353,5353,17,"Ether / IP / UDP / DNS Qry ""b'_companion-link._tcp.local.'"" "
0,0,0,0,0,"Ether / IPv6 / UDP / DNS Qry ""b'_companion-link._tcp.local.'"" "
192.168.0.103,224.0.0.251,5353,5353,17,"Ether / IP / UDP / DNS Ans ""[b'rpBA=02:EE:AC:35:79:1E', b'rpVr=440.9', b'rpAD=bafec0bbd76d']"" "
0,0,0,0,0,"Ether / IPv6 / UDP / DNS Ans ""[b'rpBA=02:EE:AC:35:79:1E', b'rpVr=440.9', b'rpAD=bafec0bbd76d']"" "
192.168.192.1,192.168.192.2,137,137,17,"Ether / IP / UDP 192.168.192.1:netbios_ns > 192.168.192.2:netbios_ns / NBNSHeader / Raw"
192.168.0.106,192.168.0.1,49234,53,17,"Ether / IP / UDP / DNS Qry ""b'www.msftconnecttest.com.'"" "
192.168.0.1,192.168.0.106,53,49234,17,"Ether / IP / UDP / DNS Ans ""b'ncsi-geo.trafficmanager.net.'"" "
192.168.0.106,192.168.0.1,64559,53,17,"Ether / IP / UDP / DNS Qry ""b'ipv6.msftconnecttest.com.'"" "
192.168.0.106,192.168.0.1,49234,53,17,"Ether / IP / UDP / DNS Qry ""b'ipv6.msftconnecttest.com.'"" "
192.168.0.106,23.195.91.99,8641,80,6,"Ether / IP / TCP 192.168.0.106:8641 > 23.195.91.99:http S"
192.168.0.1,192.168.0.106,53,49234,17,"Ether / IP / UDP / DNS Ans ""b'v6ncsi.msedge.net.'"" "
192.168.0.106,192.168.0.1,49234,53,17,"Ether / IP / UDP / DNS Qry ""b'ipv6.msftconnecttest.com.'"" "
192.168.0.106,192.168.0.1,63730,53,17,"Ether / IP / UDP / DNS Qry ""b'www.msftconnecttest.com.'"" "
192.168.0.1,192.168.0.106,53,63730,17,"Ether / IP / UDP / DNS Ans ""23.195.91.99"" "
192.168.0.106,23.195.91.99,8642,80,6,"Ether / IP / TCP 192.168.0.106:8642 > 23.195.91.99:http S"
192.168.0.1,192.168.0.106,53,49234,17,"Ether / IP / UDP / DNS Ans ""b'v6ncsi.msedge.net.'"" "
192.168.0.106,192.168.0.1,64559,53,17,"Ether / IP / UDP / DNS Qry ""b'ipv6.msftconnecttest.com.'"" "
192.168.0.1,192.168.0.106,53,64559,17,"Ether / IP / UDP / DNS Ans ""b'v6ncsi.msedge.net.'"" "
192.168.0.106,192.168.0.1,56164,53,17,"Ether / IP / UDP / DNS Qry ""b'ipv6.msftconnecttest.com.'"" "
192.168.0.1,192.168.0.106,53,56164,17,"Ether / IP / UDP / DNS Ans ""b'v6ncsi.msedge.net.'"" "
23.195.91.99,192.168.0.106,80,8641,6,"Ether / IP / TCP 23.195.91.99:http > 192.168.0.106:8641 SA"
192.168.0.106,23.195.91.99,8641,80,6,"Ether / IP / TCP 192.168.0.106:8641 > 23.195.91.99:http A"
192.168.0.106,23.195.91.99,8641,80,6,"Ether / IP / TCP 192.168.0.106:8641 > 23.195.91.99:http PA / Raw"
23.195.91.99,192.168.0.106,80,8642,6,"Ether / IP / TCP 23.195.91.99:http > 192.168.0.106:8642 SA"
192.168.0.106,23.195.91.99,8642,80,6,"Ether / IP / TCP 192.168.0.106:8642 > 23.195.91.99:http A"
192.168.0.106,23.195.91.99,8642,80,6,"Ether / IP / TCP 192.168.0.106:8642 > 23.195.91.99:http PA / Raw"
23.195.91.99,192.168.0.106,80,8641,6,"Ether / IP / TCP 23.195.91.99:http > 192.168.0.106:8641 A"
23.195.91.99,192.168.0.106,80,8641,6,"Ether / IP / TCP 23.195.91.99:http > 192.168.0.106:8641 PA / Raw"
23.195.91.99,192.168.0.106,80,8641,6,"Ether / IP / TCP 23.195.91.99:http > 192.168.0.106:8641 FA"
192.168.0.106,23.195.91.99,8641,80,6,"Ether / IP / TCP 192.168.0.106:8641 > 23.195.91.99:http A"
192.168.0.106,23.195.91.99,8641,80,6,"Ether / IP / TCP 192.168.0.106:8641 > 23.195.91.99:http FA"
23.195.91.99,192.168.0.106,80,8642,6,"Ether / IP / TCP 23.195.91.99:http > 192.168.0.106:8642 A"
23.195.91.99,192.168.0.106,80,8642,6,"Ether / IP / TCP 23.195.91.99:http > 192.168.0.106:8642 PA / Raw"
23.195.91.99,192.168.0.106,80,8642,6,"Ether / IP / TCP 23.195.91.99:http > 192.168.0.106:8642 FA"
192.168.0.106,23.195.91.99,8642,80,6,"Ether / IP / TCP 192.168.0.106:8642 > 23.195.91.99:http A"
192.168.0.106,23.195.91.99,8642,80,6,"Ether / IP / TCP 192.168.0.106:8642 > 23.195.91.99:http FA"
23.195.91.99,192.168.0.106,80,8641,6,"Ether / IP / TCP 23.195.91.99:http > 192.168.0.106:8641 A"
192.168.0.106,23.195.91.99,8642,80,6,"Ether / IP / TCP 192.168.0.106:8642 > 23.195.91.99:http FA"
23.195.91.99,192.168.0.106,80,8642,6,"Ether / IP / TCP 23.195.91.99:http > 192.168.0.106:8642 R"
192.168.0.103,224.0.0.251,5353,5353,17,"Ether / IP / UDP / DNS Ans ""[b'rpBA=02:EE:AC:35:79:1E', b'rpVr=440.9', b'rpAD=bafec0bbd76d']"" "
0,0,0,0,0,"Ether / IPv6 / UDP / DNS Ans ""[b'rpBA=02:EE:AC:35:79:1E', b'rpVr=440.9', b'rpAD=bafec0bbd76d']"" "
192.168.0.106,119.3.178.178,6806,21113,6,"Ether / IP / TCP 192.168.0.106:6806 > 119.3.178.178:21113 A / Raw"
119.3.178.178,192.168.0.106,21113,6806,6,"Ether / IP / TCP 119.3.178.178:21113 > 192.168.0.106:6806 A"
192.168.0.103,224.0.0.251,5353,5353,17,"Ether / IP / UDP / DNS Ans ""b'iPhonexxx.local.'"" "
0,0,0,0,0,"Ether / IPv6 / UDP / DNS Ans ""b'iPhonexxx.local.'"" "
192.168.192.1,192.168.192.2,137,137,17,"Ether / IP / UDP 192.168.192.1:netbios_ns > 192.168.192.2:netbios_ns / NBNSHeader / Raw"
192.168.0.103,224.0.0.251,5353,5353,17,"Ether / IP / UDP / DNS Qry ""b'_companion-link._tcp.local.'"" "
0,0,0,0,0,"Ether / IPv6 / UDP / DNS Qry ""b'_companion-link._tcp.local.'"" "
192.168.0.103,224.0.0.251,5353,5353,17,"Ether / IP / UDP / DNS Ans ""[b'rpBA=02:EE:AC:35:79:1E', b'rpVr=440.9', b'rpAD=bafec0bbd76d']"" "
0,0,0,0,0,"Ether / IPv6 / UDP / DNS Ans ""[b'rpBA=02:EE:AC:35:79:1E', b'rpVr=440.9', b'rpAD=bafec0bbd76d']"" "
192.168.192.1,192.168.192.2,137,137,17,"Ether / IP / UDP 192.168.192.1:netbios_ns > 192.168.192.2:netbios_ns / NBNSHeader / Raw"
192.168.0.103,224.0.0.251,5353,5353,17,"Ether / IP / UDP / DNS Ans ""b'iPhonexxx.local.'"" "
0,0,0,0,0,"Ether / IPv6 / UDP / DNS Ans ""b'iPhonexxx.local.'"" "
192.168.0.106,202.89.233.100,8492,443,6,"Ether / IP / TCP 192.168.0.106:8492 > 202.89.233.100:https A / Raw"
202.89.233.100,192.168.0.106,443,8492,6,"Ether / IP / TCP 202.89.233.100:https > 192.168.0.106:8492 A"
192.168.0.106,116.132.235.204,8626,80,6,"Ether / IP / TCP 192.168.0.106:8626 > 116.132.235.204:http RA"
110.43.67.231,192.168.0.106,80,8613,6,"Ether / IP / TCP 110.43.67.231:http > 192.168.0.106:8613 FA"
192.168.0.106,110.43.67.231,8613,80,6,"Ether / IP / TCP 192.168.0.106:8613 > 110.43.67.231:http A"
192.168.0.106,110.43.67.231,8613,80,6,"Ether / IP / TCP 192.168.0.106:8613 > 110.43.67.231:http FA"
110.43.67.231,192.168.0.106,80,8613,6,"Ether / IP / TCP 110.43.67.231:http > 192.168.0.106:8613 A"
192.168.0.103,224.0.0.251,5353,5353,17,"Ether / IP / UDP / DNS Ans ""[b'rpBA=02:EE:AC:35:79:1E', b'rpVr=440.9', b'rpAD=bafec0bbd76d']"" "
0,0,0,0,0,"Ether / IPv6 / UDP / DNS Ans ""[b'rpBA=02:EE:AC:35:79:1E', b'rpVr=440.9', b'rpAD=bafec0bbd76d']"" "
52.168.117.169,192.168.0.106,443,8471,6,"Ether / IP / TCP 52.168.117.169:https > 192.168.0.106:8471 RA"
192.168.0.106,116.132.235.204,8630,80,6,"Ether / IP / TCP 192.168.0.106:8630 > 116.132.235.204:http RA"
192.168.0.106,192.168.0.1,63730,53,17,"Ether / IP / UDP / DNS Qry ""b'catalog.gamepass.com.'"" "
192.168.0.1,192.168.0.106,53,63730,17,"Ether / IP / UDP / DNS Ans ""b'catalog.gamepass.com.edgesuite.net.'"" "
192.168.0.106,92.123.213.120,8643,443,6,"Ether / IP / TCP 192.168.0.106:8643 > 92.123.213.120:https S"
