data,flowmember,label,classes
b'her / IP / TCP 192.168.0.106:10872 > 111.206.209.249:https ',1,,
b'her / IP / TCP 192.168.0.106:10872 > 111.206.209.249:https ',1,,
b'her / IP / TCP 192.168.0.106:10872 > 111.206.209.249:https PA / Ra',1,,
b'her / IP / TCP 192.168.0.106:10872 > 111.206.209.249:https PA / Ra',1,,
b'her / IP / TCP 192.168.0.106:10872 > 111.206.209.249:https A / Ra',1,,
b'her / IP / TCP 192.168.0.106:10872 > 111.206.209.249:https PA / Ra',1,,
b'her / IP / TCP 192.168.0.106:10872 > 111.206.209.249:https ',2,,
b'her / IP / TCP 192.168.0.106:10872 > 111.206.209.249:https ',2,,
b'her / IP / TCP 192.168.0.106:10872 > 111.206.209.249:https F',2,,
b'her / IP / TCP 59.38.123.207:45902 > 192.168.0.106:10870 ',3,,
b'her / IP / TCP 59.38.123.207:45902 > 192.168.0.106:10870 ',3,,
b'her / IP / TCP 59.38.123.207:45902 > 192.168.0.106:10870 ',3,,
b'her / IP / TCP 59.38.123.207:45902 > 192.168.0.106:10870 A / Ra',3,,
b'her / IP / TCP 59.38.123.207:45902 > 192.168.0.106:10870 PA / Ra',3,,
b'her / IP / TCP 59.38.123.207:45902 > 192.168.0.106:10870 A / Ra',3,,
b'her / IP / TCP 59.38.123.207:45902 > 192.168.0.106:10870 PA / Ra',4,,
b'her / IP / TCP 59.38.123.207:45902 > 192.168.0.106:10870 A / Ra',4,,
b'her / IP / TCP 59.38.123.207:45902 > 192.168.0.106:10870 PA / Ra',4,,
b'her / IP / TCP 59.38.123.207:45902 > 192.168.0.106:10870 ',4,,
b'her / IP / TCP 59.38.123.207:45902 > 192.168.0.106:10870 PA / Ra',4,,
b'her / IP / TCP 59.38.123.207:45902 > 192.168.0.106:10870 ',4,,
b'her / IP / TCP 59.38.123.207:45902 > 192.168.0.106:10870 A / Ra',4,,
b'her / IP / TCP 59.38.123.207:45902 > 192.168.0.106:10870 PA / Ra',5,,
b'her / IP / TCP 59.38.123.207:45902 > 192.168.0.106:10870 F',5,,
b'her / IP / TCP 59.38.123.207:45902 > 192.168.0.106:10870 ',5,,
b'her / IP / TCP 192.168.0.106:10873 > 110.242.68.3:http ',6,,
b'her / IP / TCP 192.168.0.106:10873 > 110.242.68.3:http ',6,,
b'her / IP / TCP 192.168.0.106:10873 > 110.242.68.3:http F',6,,
b'her / IP / TCP 192.168.0.106:10873 > 110.242.68.3:http ',6,,
b'her / IP / TCP 111.206.209.249:https > 192.168.0.106:10872 S',7,,
b'her / IP / TCP 111.206.209.249:https > 192.168.0.106:10872 ',7,,
b'her / IP / TCP 111.206.209.249:https > 192.168.0.106:10872 PA / Ra',7,,
b'her / IP / TCP 111.206.209.249:https > 192.168.0.106:10872 ',7,,
b'her / IP / TCP 111.206.209.249:https > 192.168.0.106:10872 ',7,,
b'her / IP / TCP 111.206.209.249:https > 192.168.0.106:10872 PA / Ra',7,,
b'her / IP / TCP 111.206.209.249:https > 192.168.0.106:10872 PA / Ra',8,,
b'her / IP / TCP 111.206.209.249:https > 192.168.0.106:10872 F',8,,
b'her / IP / TCP 111.206.209.249:https > 192.168.0.106:10872 ',8,,
b'her / IP / TCP 110.242.68.3:http > 192.168.0.106:10873 S',9,,
b'her / IP / TCP 110.242.68.3:http > 192.168.0.106:10873 ',9,,
b'her / IP / TCP 110.242.68.3:http > 192.168.0.106:10873 F',9,,
b'her / IP / TCP 192.168.0.106:10870 > 59.38.123.207:45902 ',10,,
b'her / IP / TCP 192.168.0.106:10870 > 59.38.123.207:45902 PA / Ra',10,,
b'her / IP / TCP 192.168.0.106:10870 > 59.38.123.207:45902 PA / Ra',10,,
b'her / IP / TCP 192.168.0.106:10870 > 59.38.123.207:45902 A / Ra',10,,
b'her / IP / TCP 192.168.0.106:10870 > 59.38.123.207:45902 PA / Ra',10,,
b'her / IP / TCP 192.168.0.106:10870 > 59.38.123.207:45902 ',10,,
b'her / IP / TCP 192.168.0.106:10870 > 59.38.123.207:45902 F',11,,
b'her / IP / TCP 192.168.0.106:10292 > 59.38.123.207:45902 PA / Ra',11,,
b'her / IP / TCP 192.168.0.106:10292 > 59.38.123.207:45902 A / Ra',11,,
b'her / IP / TCP 192.168.0.106:10292 > 59.38.123.207:45902 PA / Ra',11,,
b'her / IP / TCP 192.168.0.106:10292 > 59.38.123.207:45902 ',11,,
b'her / IP / TCP 59.38.123.207:45902 > 192.168.0.106:10292 A / Paddin',12,,
b'her / IP / TCP 59.38.123.207:45902 > 192.168.0.106:10292 A / Paddin',12,,
b'her / IP / TCP 59.38.123.207:45902 > 192.168.0.106:10292 PA / Ra',12,,
b'her / IP / TCP 59.38.123.207:45902 > 192.168.0.106:10292 PA / Ra',12,,
b'her / IP / TCP 192.168.0.106:10874 > 116.132.235.228:http ',13,,
b'her / IP / TCP 192.168.0.106:10874 > 116.132.235.228:http ',13,,
b'her / IP / TCP 192.168.0.106:10874 > 116.132.235.228:http PA / Ra',13,,
b'her / IP / TCP 192.168.0.106:10874 > 116.132.235.228:http A / Ra',13,,
b'her / IP / TCP 192.168.0.106:10874 > 116.132.235.228:http A / Ra',13,,
b'her / IP / TCP 192.168.0.106:10874 > 116.132.235.228:http PA / Ra',13,,
b'her / IP / TCP 192.168.0.106:10874 > 116.132.235.228:http ',14,,
b'her / IP / TCP 192.168.0.106:10874 > 116.132.235.228:http F',14,,
b'her / IP / TCP 116.132.235.228:http > 192.168.0.106:10874 S',15,,
b'her / IP / TCP 116.132.235.228:http > 192.168.0.106:10874 ',15,,
b'her / IP / TCP 116.132.235.228:http > 192.168.0.106:10874 ',15,,
b'her / IP / TCP 116.132.235.228:http > 192.168.0.106:10874 ',15,,
b'her / IP / TCP 116.132.235.228:http > 192.168.0.106:10874 PA / Ra',15,,
b'her / IP / TCP 116.132.235.228:http > 192.168.0.106:10874 F',15,,
b'her / IP / TCP 116.132.235.228:http > 192.168.0.106:10874 ',16,,
b'her / IP / TCP 192.168.0.106:10875 > 116.132.235.228:http ',16,,
b'her / IP / TCP 192.168.0.106:10875 > 116.132.235.228:http ',16,,
b'her / IP / TCP 192.168.0.106:10875 > 116.132.235.228:http PA / Ra',16,,
b'her / IP / TCP 192.168.0.106:10875 > 116.132.235.228:http A / Ra',16,,
b'her / IP / TCP 192.168.0.106:10875 > 116.132.235.228:http A / Ra',16,,
b'her / IP / TCP 192.168.0.106:10875 > 116.132.235.228:http PA / Ra',16,,
b'her / IP / TCP 192.168.0.106:10875 > 116.132.235.228:http ',17,,
b'her / IP / TCP 192.168.0.106:10875 > 116.132.235.228:http F',17,,
b'her / IP / TCP 116.132.235.228:http > 192.168.0.106:10875 S',18,,
b'her / IP / TCP 116.132.235.228:http > 192.168.0.106:10875 ',18,,
b'her / IP / TCP 116.132.235.228:http > 192.168.0.106:10875 ',18,,
b'her / IP / TCP 116.132.235.228:http > 192.168.0.106:10875 ',18,,
b'her / IP / TCP 116.132.235.228:http > 192.168.0.106:10875 PA / Ra',18,,
b'her / IP / TCP 116.132.235.228:http > 192.168.0.106:10875 F',18,,
b'her / IP / TCP 116.132.235.228:http > 192.168.0.106:10875 ',19,,
b'her / IP / TCP 192.168.0.106:10746 > 59.38.123.207:45902 PA / Ra',19,,
b'her / IP / TCP 192.168.0.106:10746 > 59.38.123.207:45902 PA / Ra',19,,
b'her / IP / TCP 192.168.0.106:10746 > 59.38.123.207:45902 ',19,,
b'her / IP / TCP 192.168.0.106:10746 > 59.38.123.207:45902 ',19,,
b'her / IP / TCP 192.168.0.106:10746 > 59.38.123.207:45902 PA / Ra',19,,
b'her / IP / TCP 59.38.123.207:45902 > 192.168.0.106:10746 A / Paddin',20,,
b'her / IP / TCP 59.38.123.207:45902 > 192.168.0.106:10746 A / Paddin',20,,
b'her / IP / TCP 59.38.123.207:45902 > 192.168.0.106:10746 PA / Ra',20,,
b'her / IP / TCP 59.38.123.207:45902 > 192.168.0.106:10746 PA / Ra',20,,
b'her / IP / TCP 59.38.123.207:45902 > 192.168.0.106:10746 PA / Ra',20,,
b'her / IP / TCP 59.38.123.207:45902 > 192.168.0.106:10746 A / Paddin',20,,
b'her / IP / TCP 192.168.0.106:10876 > 116.132.235.228:http ',21,,
b'her / IP / TCP 192.168.0.106:10876 > 116.132.235.228:http ',21,,
b'her / IP / TCP 192.168.0.106:10876 > 116.132.235.228:http PA / Ra',21,,
b'her / IP / TCP 192.168.0.106:10876 > 116.132.235.228:http A / Ra',21,,
b'her / IP / TCP 192.168.0.106:10876 > 116.132.235.228:http A / Ra',21,,
b'her / IP / TCP 192.168.0.106:10876 > 116.132.235.228:http PA / Ra',21,,
b'her / IP / TCP 192.168.0.106:10876 > 116.132.235.228:http ',22,,
b'her / IP / TCP 192.168.0.106:10876 > 116.132.235.228:http F',22,,
b'her / IP / TCP 192.168.0.106:10876 > 116.132.235.228:http F',22,,
b'her / IP / TCP 192.168.0.106:10876 > 116.132.235.228:http F',22,,
b'her / IP / TCP 192.168.0.106:10876 > 116.132.235.228:http F',22,,
b'her / IP / TCP 192.168.0.106:10876 > 116.132.235.228:http F',22,,
b'her / IP / TCP 192.168.0.106:10876 > 116.132.235.228:http F',22,,
b'her / IP / TCP 116.132.235.228:http > 192.168.0.106:10876 S',23,,
b'her / IP / TCP 116.132.235.228:http > 192.168.0.106:10876 ',23,,
b'her / IP / TCP 116.132.235.228:http > 192.168.0.106:10876 ',23,,
b'her / IP / TCP 116.132.235.228:http > 192.168.0.106:10876 ',23,,
b'her / IP / TCP 116.132.235.228:http > 192.168.0.106:10876 PA / Ra',23,,
b'her / IP / TCP 116.132.235.228:http > 192.168.0.106:10876 F',23,,
b'her / IP / UDP 192.168.192.1:netbios_ns > 192.168.192.2:netbios_ns / NBNSHeader / Ra',24,,
b'her / IP / UDP 192.168.192.1:netbios_ns > 192.168.192.2:netbios_ns / NBNSHeader / Ra',24,,
b'her / IP / UDP 192.168.192.1:netbios_ns > 192.168.192.2:netbios_ns / NBNSHeader / Ra',24,,
b'her / IP / TCP 192.168.0.106:10877 > 116.132.235.228:http ',25,,
b'her / IP / TCP 192.168.0.106:10877 > 116.132.235.228:http ',25,,
b'her / IP / TCP 192.168.0.106:10877 > 116.132.235.228:http PA / Ra',25,,
b'her / IP / TCP 192.168.0.106:10877 > 116.132.235.228:http A / Ra',25,,
b'her / IP / TCP 192.168.0.106:10877 > 116.132.235.228:http A / Ra',25,,
b'her / IP / TCP 192.168.0.106:10877 > 116.132.235.228:http PA / Ra',25,,
b'her / IP / TCP 192.168.0.106:10877 > 116.132.235.228:http ',26,,
b'her / IP / TCP 192.168.0.106:10877 > 116.132.235.228:http F',26,,
b'her / IP / TCP 116.132.235.228:http > 192.168.0.106:10877 S',27,,
b'her / IP / TCP 116.132.235.228:http > 192.168.0.106:10877 ',27,,
b'her / IP / TCP 116.132.235.228:http > 192.168.0.106:10877 ',27,,
b'her / IP / TCP 116.132.235.228:http > 192.168.0.106:10877 ',27,,
b'her / IP / TCP 116.132.235.228:http > 192.168.0.106:10877 PA / Ra',27,,
b'her / IP / TCP 116.132.235.228:http > 192.168.0.106:10877 F',27,,
b'her / IP / TCP 116.132.235.228:http > 192.168.0.106:10877 ',28,,
b'her / IP / TCP 192.168.0.106:10878 > 116.132.235.228:http ',28,,
b'her / IP / TCP 192.168.0.106:10878 > 116.132.235.228:http ',28,,
b'her / IP / TCP 192.168.0.106:10878 > 116.132.235.228:http PA / Ra',28,,
b'her / IP / TCP 192.168.0.106:10878 > 116.132.235.228:http A / Ra',28,,
b'her / IP / TCP 192.168.0.106:10878 > 116.132.235.228:http A / Ra',28,,
b'her / IP / TCP 192.168.0.106:10878 > 116.132.235.228:http PA / Ra',28,,
b'her / IP / TCP 192.168.0.106:10878 > 116.132.235.228:http F',29,,
b'her / IP / TCP 192.168.0.106:10878 > 116.132.235.228:http ',29,,
b'her / IP / TCP 116.132.235.228:http > 192.168.0.106:10878 S',30,,
b'her / IP / TCP 116.132.235.228:http > 192.168.0.106:10878 ',30,,
b'her / IP / TCP 116.132.235.228:http > 192.168.0.106:10878 ',30,,
b'her / IP / TCP 116.132.235.228:http > 192.168.0.106:10878 PA / Ra',30,,
b'her / IP / TCP 116.132.235.228:http > 192.168.0.106:10878 F',30,,
b'her / IP / TCP 116.132.235.228:http > 192.168.0.106:10878 ',30,,
b'her / IP / TCP 192.168.0.106:10879 > 116.132.235.228:http ',31,,
b'her / IP / TCP 192.168.0.106:10879 > 116.132.235.228:http ',31,,
b'her / IP / TCP 192.168.0.106:10879 > 116.132.235.228:http PA / Ra',31,,
b'her / IP / TCP 192.168.0.106:10879 > 116.132.235.228:http A / Ra',31,,
b'her / IP / TCP 192.168.0.106:10879 > 116.132.235.228:http A / Ra',31,,
b'her / IP / TCP 192.168.0.106:10879 > 116.132.235.228:http PA / Ra',31,,
b'her / IP / TCP 192.168.0.106:10879 > 116.132.235.228:http ',32,,
b'her / IP / TCP 192.168.0.106:10879 > 116.132.235.228:http F',32,,
b'her / IP / TCP 116.132.235.228:http > 192.168.0.106:10879 S',33,,
b'her / IP / TCP 116.132.235.228:http > 192.168.0.106:10879 ',33,,
b'her / IP / TCP 116.132.235.228:http > 192.168.0.106:10879 ',33,,
b'her / IP / TCP 116.132.235.228:http > 192.168.0.106:10879 ',33,,
b'her / IP / TCP 116.132.235.228:http > 192.168.0.106:10879 PA / Ra',33,,
b'her / IP / TCP 116.132.235.228:http > 192.168.0.106:10879 F',33,,
b'her / IP / TCP 116.132.235.228:http > 192.168.0.106:10879 ',34,,
b'her / IP / TCP 192.168.0.106:10880 > 116.132.235.228:http ',34,,
b'her / IP / TCP 192.168.0.106:10880 > 116.132.235.228:http ',34,,
b'her / IP / TCP 192.168.0.106:10880 > 116.132.235.228:http PA / Ra',34,,
b'her / IP / TCP 192.168.0.106:10880 > 116.132.235.228:http A / Ra',34,,
b'her / IP / TCP 192.168.0.106:10880 > 116.132.235.228:http A / Ra',34,,
b'her / IP / TCP 192.168.0.106:10880 > 116.132.235.228:http PA / Ra',34,,
b'her / IP / TCP 192.168.0.106:10880 > 116.132.235.228:http ',35,,
b'her / IP / TCP 192.168.0.106:10880 > 116.132.235.228:http F',35,,
b'her / IP / TCP 116.132.235.228:http > 192.168.0.106:10880 S',36,,
b'her / IP / TCP 116.132.235.228:http > 192.168.0.106:10880 ',36,,
b'her / IP / TCP 116.132.235.228:http > 192.168.0.106:10880 ',36,,
b'her / IP / TCP 116.132.235.228:http > 192.168.0.106:10880 ',36,,
b'her / IP / TCP 116.132.235.228:http > 192.168.0.106:10880 PA / Ra',36,,
b'her / IP / TCP 116.132.235.228:http > 192.168.0.106:10880 F',36,,
b'her / IP / TCP 116.132.235.228:http > 192.168.0.106:10880 ',37,,
b'her / IP / TCP 192.168.0.106:10881 > 116.132.235.228:http ',37,,
b'her / IP / TCP 192.168.0.106:10881 > 116.132.235.228:http ',37,,
b'her / IP / TCP 192.168.0.106:10881 > 116.132.235.228:http PA / Ra',37,,
b'her / IP / TCP 192.168.0.106:10881 > 116.132.235.228:http A / Ra',37,,
b'her / IP / TCP 192.168.0.106:10881 > 116.132.235.228:http A / Ra',37,,
b'her / IP / TCP 192.168.0.106:10881 > 116.132.235.228:http PA / Ra',37,,
b'her / IP / TCP 192.168.0.106:10881 > 116.132.235.228:http ',38,,
b'her / IP / TCP 192.168.0.106:10881 > 116.132.235.228:http F',38,,
b'her / IP / TCP 116.132.235.228:http > 192.168.0.106:10881 S',39,,
b'her / IP / TCP 116.132.235.228:http > 192.168.0.106:10881 ',39,,
b'her / IP / TCP 116.132.235.228:http > 192.168.0.106:10881 ',39,,
b'her / IP / TCP 116.132.235.228:http > 192.168.0.106:10881 ',39,,
b'her / IP / TCP 116.132.235.228:http > 192.168.0.106:10881 PA / Ra',39,,
b'her / IP / TCP 116.132.235.228:http > 192.168.0.106:10881 F',39,,
b'her / IP / TCP 116.132.235.228:http > 192.168.0.106:10881 ',40,,
b'her / IP / TCP 192.168.0.106:10882 > 116.132.235.228:http ',40,,
b'her / IP / TCP 192.168.0.106:10882 > 116.132.235.228:http ',40,,
b'her / IP / TCP 192.168.0.106:10882 > 116.132.235.228:http PA / Ra',40,,
b'her / IP / TCP 192.168.0.106:10882 > 116.132.235.228:http A / Ra',40,,
b'her / IP / TCP 192.168.0.106:10882 > 116.132.235.228:http A / Ra',40,,
b'her / IP / TCP 192.168.0.106:10882 > 116.132.235.228:http PA / Ra',40,,
b'her / IP / TCP 192.168.0.106:10882 > 116.132.235.228:http ',41,,
b'her / IP / TCP 192.168.0.106:10882 > 116.132.235.228:http F',41,,
b'her / IP / TCP 116.132.235.228:http > 192.168.0.106:10882 S',42,,
b'her / IP / TCP 116.132.235.228:http > 192.168.0.106:10882 ',42,,
b'her / IP / TCP 116.132.235.228:http > 192.168.0.106:10882 ',42,,
b'her / IP / TCP 116.132.235.228:http > 192.168.0.106:10882 ',42,,
b'her / IP / TCP 116.132.235.228:http > 192.168.0.106:10882 PA / Ra',42,,
b'her / IP / TCP 116.132.235.228:http > 192.168.0.106:10882 F',42,,
b'her / IP / TCP 116.132.235.228:http > 192.168.0.106:10882 ',43,,
b'her / IP / UDP 192.168.0.106:57626 > 239.255.255.250:ssdp / Ra',43,,
b'her / IP / UDP 192.168.0.106:57626 > 239.255.255.250:ssdp / Ra',43,,
b'her / IP / UDP 192.168.0.106:57626 > 239.255.255.250:ssdp / Ra',43,,
b'her / IP / UDP 192.168.0.106:57626 > 239.255.255.250:ssdp / Ra',43,,
b'her / IP / TCP 59.38.123.207:45902 > 192.168.0.106:10802 PA / Ra',44,,
b'her / IP / TCP 59.38.123.207:45902 > 192.168.0.106:10802 F',44,,
b'her / IP / TCP 59.38.123.207:45902 > 192.168.0.106:10802 ',44,,
b'her / IP / TCP 192.168.0.106:10802 > 59.38.123.207:45902 ',45,,
b'her / IP / TCP 192.168.0.106:10802 > 59.38.123.207:45902 F',45,,
b'her / IP / TCP 192.168.0.106:11251 > 60.28.172.104:https PA / Ra',46,,
b'her / IP / TCP 192.168.0.106:11251 > 60.28.172.104:https ',46,,
b'her / IP / TCP 192.168.0.106:11251 > 60.28.172.104:https ',46,,
b'her / IP / TCP 192.168.0.106:10883 > 116.132.235.228:http ',47,,
b'her / IP / TCP 192.168.0.106:10883 > 116.132.235.228:http ',47,,
b'her / IP / TCP 192.168.0.106:10883 > 116.132.235.228:http PA / Ra',47,,
b'her / IP / TCP 192.168.0.106:10883 > 116.132.235.228:http A / Ra',47,,
b'her / IP / TCP 192.168.0.106:10883 > 116.132.235.228:http A / Ra',47,,
b'her / IP / TCP 192.168.0.106:10883 > 116.132.235.228:http PA / Ra',47,,
b'her / IP / TCP 192.168.0.106:10883 > 116.132.235.228:http ',48,,
b'her / IP / TCP 192.168.0.106:10883 > 116.132.235.228:http F',48,,
b'her / IP / TCP 192.168.0.106:10883 > 116.132.235.228:http F',48,,
b'her / IP / TCP 192.168.0.106:10883 > 116.132.235.228:http F',48,,
b'her / IP / TCP 192.168.0.106:10883 > 116.132.235.228:http F',48,,
b'her / IP / TCP 192.168.0.106:10883 > 116.132.235.228:http F',48,,
b'her / IP / TCP 60.28.172.104:https > 192.168.0.106:11251 A / Paddin',49,,
b'her / IP / TCP 60.28.172.104:https > 192.168.0.106:11251 PA / Ra',49,,
b'her / IP / TCP 60.28.172.104:https > 192.168.0.106:11251 PA / Ra',49,,
b'her / IP / TCP 116.132.235.228:http > 192.168.0.106:10883 S',50,,
b'her / IP / TCP 116.132.235.228:http > 192.168.0.106:10883 ',50,,
b'her / IP / TCP 116.132.235.228:http > 192.168.0.106:10883 ',50,,
b'her / IP / TCP 116.132.235.228:http > 192.168.0.106:10883 ',50,,
b'her / IP / TCP 116.132.235.228:http > 192.168.0.106:10883 PA / Ra',50,,
b'her / IP / TCP 116.132.235.228:http > 192.168.0.106:10883 F',50,,
b'her / IP / TCP 110.242.68.4:https > 192.168.0.106:10725 PA / Ra',51,,
b'her / IP / TCP 110.242.68.4:https > 192.168.0.106:10725 F',51,,
b'her / IP / TCP 110.242.68.4:https > 192.168.0.106:10725 A / Paddin',51,,
b'her / IP / TCP 192.168.0.106:10725 > 110.242.68.4:https ',52,,
b'her / IP / TCP 192.168.0.106:10725 > 110.242.68.4:https F',52,,
b'her / IP / TCP 192.168.0.106:10884 > 116.132.235.228:http ',53,,
b'her / IP / TCP 192.168.0.106:10884 > 116.132.235.228:http ',53,,
b'her / IP / TCP 192.168.0.106:10884 > 116.132.235.228:http PA / Ra',53,,
b'her / IP / TCP 192.168.0.106:10884 > 116.132.235.228:http A / Ra',53,,
b'her / IP / TCP 192.168.0.106:10884 > 116.132.235.228:http A / Ra',53,,
b'her / IP / TCP 192.168.0.106:10884 > 116.132.235.228:http PA / Ra',53,,
b'her / IP / TCP 192.168.0.106:10884 > 116.132.235.228:http ',54,,
b'her / IP / TCP 192.168.0.106:10884 > 116.132.235.228:http F',54,,
b'her / IP / TCP 192.168.0.106:10884 > 116.132.235.228:http F',54,,
b'her / IP / TCP 192.168.0.106:10884 > 116.132.235.228:http F',54,,
b'her / IP / TCP 192.168.0.106:10884 > 116.132.235.228:http F',54,,
b'her / IP / TCP 192.168.0.106:10884 > 116.132.235.228:http F',54,,
b'her / IP / TCP 116.132.235.228:http > 192.168.0.106:10884 S',55,,
b'her / IP / TCP 116.132.235.228:http > 192.168.0.106:10884 ',55,,
b'her / IP / TCP 116.132.235.228:http > 192.168.0.106:10884 ',55,,
b'her / IP / TCP 116.132.235.228:http > 192.168.0.106:10884 ',55,,
b'her / IP / TCP 116.132.235.228:http > 192.168.0.106:10884 ',55,,
b'her / IP / TCP 116.132.235.228:http > 192.168.0.106:10884 PA / Ra',55,,
b'her / IP / TCP 116.132.235.228:http > 192.168.0.106:10884 F',56,,
b'her / IP / TCP 192.168.0.106:10885 > 116.132.235.228:http ',56,,
b'her / IP / TCP 192.168.0.106:10885 > 116.132.235.228:http ',56,,
b'her / IP / TCP 192.168.0.106:10885 > 116.132.235.228:http PA / Ra',56,,
b'her / IP / TCP 192.168.0.106:10885 > 116.132.235.228:http A / Ra',56,,
b'her / IP / TCP 192.168.0.106:10885 > 116.132.235.228:http A / Ra',56,,
b'her / IP / TCP 192.168.0.106:10885 > 116.132.235.228:http PA / Ra',56,,
b'her / IP / TCP 192.168.0.106:10885 > 116.132.235.228:http ',57,,
b'her / IP / TCP 192.168.0.106:10885 > 116.132.235.228:http F',57,,
b'her / IP / TCP 192.168.0.106:10885 > 116.132.235.228:http F',57,,
b'her / IP / TCP 192.168.0.106:10885 > 116.132.235.228:http F',57,,
b'her / IP / TCP 192.168.0.106:10885 > 116.132.235.228:http F',57,,
b'her / IP / TCP 192.168.0.106:10885 > 116.132.235.228:http F',57,,
b'her / IP / TCP 116.132.235.228:http > 192.168.0.106:10885 S',58,,
b'her / IP / TCP 116.132.235.228:http > 192.168.0.106:10885 ',58,,
b'her / IP / TCP 116.132.235.228:http > 192.168.0.106:10885 ',58,,
b'her / IP / TCP 116.132.235.228:http > 192.168.0.106:10885 ',58,,
b'her / IP / TCP 116.132.235.228:http > 192.168.0.106:10885 PA / Ra',58,,
b'her / IP / TCP 116.132.235.228:http > 192.168.0.106:10885 F',58,,
b'her / IP / TCP 192.168.0.106:10886 > 110.242.68.3:http ',59,,
b'her / IP / TCP 192.168.0.106:10886 > 110.242.68.3:http ',59,,
b'her / IP / TCP 192.168.0.106:10886 > 110.242.68.3:http F',59,,
b'her / IP / TCP 192.168.0.106:10886 > 110.242.68.3:http ',59,,
b'her / IP / TCP 110.242.68.3:http > 192.168.0.106:10886 S',60,,
b'her / IP / TCP 110.242.68.3:http > 192.168.0.106:10886 ',60,,
b'her / IP / TCP 110.242.68.3:http > 192.168.0.106:10886 F',60,,
b'her / IP / TCP 192.168.0.106:10887 > 116.132.235.228:http ',61,,
b'her / IP / TCP 192.168.0.106:10887 > 116.132.235.228:http ',61,,
b'her / IP / TCP 192.168.0.106:10887 > 116.132.235.228:http PA / Ra',61,,
b'her / IP / TCP 192.168.0.106:10887 > 116.132.235.228:http A / Ra',61,,
b'her / IP / TCP 192.168.0.106:10887 > 116.132.235.228:http A / Ra',61,,
b'her / IP / TCP 192.168.0.106:10887 > 116.132.235.228:http PA / Ra',61,,
b'her / IP / TCP 192.168.0.106:10887 > 116.132.235.228:http ',62,,
b'her / IP / TCP 192.168.0.106:10887 > 116.132.235.228:http F',62,,
b'her / IP / TCP 116.132.235.228:http > 192.168.0.106:10887 S',63,,
b'her / IP / TCP 116.132.235.228:http > 192.168.0.106:10887 ',63,,
b'her / IP / TCP 116.132.235.228:http > 192.168.0.106:10887 ',63,,
b'her / IP / TCP 116.132.235.228:http > 192.168.0.106:10887 ',63,,
b'her / IP / TCP 116.132.235.228:http > 192.168.0.106:10887 PA / Ra',63,,
b'her / IP / TCP 116.132.235.228:http > 192.168.0.106:10887 F',63,,
b'her / IP / TCP 116.132.235.228:http > 192.168.0.106:10887 ',64,,
b'her / IP / TCP 192.168.0.106:10888 > 116.132.235.228:http ',64,,
b'her / IP / TCP 192.168.0.106:10888 > 116.132.235.228:http ',64,,
b'her / IP / TCP 192.168.0.106:10888 > 116.132.235.228:http PA / Ra',64,,
b'her / IP / TCP 192.168.0.106:10888 > 116.132.235.228:http A / Ra',64,,
b'her / IP / TCP 192.168.0.106:10888 > 116.132.235.228:http A / Ra',64,,
b'her / IP / TCP 192.168.0.106:10888 > 116.132.235.228:http PA / Ra',64,,
b'her / IP / TCP 192.168.0.106:10888 > 116.132.235.228:http ',65,,
b'her / IP / TCP 192.168.0.106:10888 > 116.132.235.228:http F',65,,
b'her / IP / TCP 59.38.123.207:45902 > 192.168.0.106:10672 PA / Ra',66,,
b'her / IP / TCP 59.38.123.207:45902 > 192.168.0.106:10672 F',66,,
b'her / IP / TCP 59.38.123.207:45902 > 192.168.0.106:10672 A / Paddin',66,,
b'her / IP / TCP 192.168.0.106:10672 > 59.38.123.207:45902 ',67,,
b'her / IP / TCP 192.168.0.106:10672 > 59.38.123.207:45902 F',67,,
b'her / IP / TCP 116.132.235.228:http > 192.168.0.106:10888 S',68,,
b'her / IP / TCP 116.132.235.228:http > 192.168.0.106:10888 ',68,,
b'her / IP / TCP 116.132.235.228:http > 192.168.0.106:10888 ',68,,
b'her / IP / TCP 116.132.235.228:http > 192.168.0.106:10888 ',68,,
b'her / IP / TCP 116.132.235.228:http > 192.168.0.106:10888 PA / Ra',68,,
b'her / IP / TCP 116.132.235.228:http > 192.168.0.106:10888 F',68,,
b'her / IP / TCP 116.132.235.228:http > 192.168.0.106:10888 ',69,,
b'her / IP / TCP 101.72.249.41:https > 192.168.0.106:10699 PA / Ra',69,,
b'her / IP / TCP 101.72.249.41:https > 192.168.0.106:10699 PA / Ra',69,,
b'her / IP / TCP 101.72.249.41:https > 192.168.0.106:10699 F',69,,
b'her / IP / TCP 101.72.249.41:https > 192.168.0.106:10699 A / Paddin',69,,
b'her / IP / TCP 101.72.249.41:https > 192.168.0.106:10699 ',69,,
b'her / IP / TCP 192.168.0.106:10699 > 101.72.249.41:https ',70,,
b'her / IP / TCP 192.168.0.106:10699 > 101.72.249.41:https F',70,,
b'her / IP / TCP 192.168.0.106:10699 > 101.72.249.41:https ',70,,
b'her / IP / TCP 192.168.0.106:10699 > 101.72.249.41:https F',70,,
b'her / IP / TCP 192.168.0.106:10685 > 59.38.123.207:45902 A / Ra',71,,
b'her / IP / TCP 59.38.123.207:45902 > 192.168.0.106:10685 ',72,,
b'her / IP / TCP 192.168.0.106:10889 > 116.132.235.228:http ',73,,
b'her / IP / TCP 192.168.0.106:10889 > 116.132.235.228:http ',73,,
b'her / IP / TCP 192.168.0.106:10889 > 116.132.235.228:http PA / Ra',73,,
b'her / IP / TCP 192.168.0.106:10889 > 116.132.235.228:http A / Ra',73,,
b'her / IP / TCP 192.168.0.106:10889 > 116.132.235.228:http A / Ra',73,,
b'her / IP / TCP 192.168.0.106:10889 > 116.132.235.228:http PA / Ra',73,,
b'her / IP / TCP 192.168.0.106:10889 > 116.132.235.228:http ',74,,
b'her / IP / TCP 192.168.0.106:10889 > 116.132.235.228:http F',74,,
b'her / IP / TCP 116.132.235.228:http > 192.168.0.106:10889 S',75,,
b'her / IP / TCP 116.132.235.228:http > 192.168.0.106:10889 ',75,,
b'her / IP / TCP 116.132.235.228:http > 192.168.0.106:10889 ',75,,
b'her / IP / TCP 116.132.235.228:http > 192.168.0.106:10889 ',75,,
b'her / IP / TCP 116.132.235.228:http > 192.168.0.106:10889 ',75,,
b'her / IP / TCP 116.132.235.228:http > 192.168.0.106:10889 PA / Ra',75,,
b'her / IP / TCP 116.132.235.228:http > 192.168.0.106:10889 F',76,,
b'her / IP / TCP 116.132.235.228:http > 192.168.0.106:10889 ',76,,
b'her / IP / TCP 192.168.0.106:10890 > 116.132.235.228:http ',77,,
b'her / IP / TCP 192.168.0.106:10890 > 116.132.235.228:http ',77,,
b'her / IP / TCP 192.168.0.106:10890 > 116.132.235.228:http PA / Ra',77,,
b'her / IP / TCP 192.168.0.106:10890 > 116.132.235.228:http A / Ra',77,,
b'her / IP / TCP 192.168.0.106:10890 > 116.132.235.228:http A / Ra',77,,
b'her / IP / TCP 192.168.0.106:10890 > 116.132.235.228:http PA / Ra',77,,
b'her / IP / TCP 192.168.0.106:10890 > 116.132.235.228:http ',78,,
b'her / IP / TCP 192.168.0.106:10890 > 116.132.235.228:http F',78,,
b'her / IP / TCP 116.132.235.228:http > 192.168.0.106:10890 S',79,,
b'her / IP / TCP 116.132.235.228:http > 192.168.0.106:10890 ',79,,
b'her / IP / TCP 116.132.235.228:http > 192.168.0.106:10890 ',79,,
b'her / IP / TCP 116.132.235.228:http > 192.168.0.106:10890 ',79,,
b'her / IP / TCP 116.132.235.228:http > 192.168.0.106:10890 PA / Ra',79,,
b'her / IP / TCP 116.132.235.228:http > 192.168.0.106:10890 F',79,,
b'her / IP / TCP 116.132.235.228:http > 192.168.0.106:10890 ',80,,
b'her / IP / TCP 192.168.0.106:10615 > 61.163.9.167:https A / Ra',80,,
b'her / IP / TCP 61.163.9.167:https > 192.168.0.106:10615 ',81,,
b'her / IP / TCP 192.168.0.106:10622 > 115.54.20.37:https A / Ra',82,,
b'her / IP / TCP 115.54.20.37:https > 192.168.0.106:10622 ',83,,
b'her / IP / TCP 192.168.0.106:10594 > 120.46.209.149:https A / Ra',84,,
b'her / IP / TCP 120.46.209.149:https > 192.168.0.106:10594 ',85,,
b'her / IP / TCP 192.168.0.106:10624 > 120.46.209.149:https A / Ra',86,,
b'her / IP / TCP 120.46.209.149:https > 192.168.0.106:10624 ',87,,
b'her / IP / TCP 192.168.0.106:10577 > 120.46.209.149:https A / Ra',88,,
b'her / IP / TCP 192.168.0.106:10727 > 123.6.9.80:https A / Ra',89,,
b'her / IP / TCP 120.46.209.149:https > 192.168.0.106:10577 ',90,,
b'her / IP / TCP 123.6.9.80:https > 192.168.0.106:10727 ',91,,
b'her / IP / TCP 192.168.0.106:10581 > 120.46.209.149:https A / Ra',92,,
b'her / IP / TCP 120.46.209.149:https > 192.168.0.106:10581 ',93,,
b'her / IP / TCP 192.168.0.106:10599 > 120.46.209.149:https A / Ra',94,,
b'her / IP / TCP 120.46.209.149:https > 192.168.0.106:10599 ',95,,
b'her / IP / TCP 192.168.0.106:10778 > 115.54.19.7:https A / Ra',96,,
b'her / IP / TCP 115.54.19.7:https > 192.168.0.106:10778 ',97,,
b'her / IP / TCP 192.168.0.106:10606 > 120.46.209.149:https A / Ra',98,,
b'her / IP / TCP 120.46.209.149:https > 192.168.0.106:10606 ',99,,
b'her / IP / TCP 192.168.0.106:10607 > 120.46.209.149:https A / Ra',100,,
b'her / IP / TCP 120.46.209.149:https > 192.168.0.106:10607 ',101,,
b'her / IP / TCP 192.168.0.106:10827 > 123.249.99.208:https A / Ra',102,,
b'her / IP / TCP 123.249.99.208:https > 192.168.0.106:10827 ',103,,
b'her / IP / TCP 52.108.46.20:https > 192.168.0.106:1285 PA / Ra',104,,
b'her / IP / TCP 192.168.0.106:1285 > 52.108.46.20:https ',105,,
b'her / IP / TCP 192.168.0.106:13267 > 125.39.196.167:14000 PA / Ra',106,,
b'her / IP / TCP 192.168.0.106:13267 > 125.39.196.167:14000 ',106,,
b'her / IP / TCP 125.39.196.167:14000 > 192.168.0.106:13267 PA / Ra',107,,
b'her / IP / TCP 192.168.0.106:10601 > 59.38.123.207:45902 A / Ra',108,,
b'her / IP / TCP 59.38.123.207:45902 > 192.168.0.106:10601 ',109,,
b'her / IP / TCP 59.38.123.207:45902 > 192.168.0.106:9954 PA / Ra',110,,
b'her / IP / TCP 192.168.0.106:9954 > 59.38.123.207:45902 PA / Ra',111,,
