data,flowmember,label,classes
b'her / IP / TCP 42.236.89.187:https > 192.168.0.106:7704 A / Ra',1,,
b'her / IP / TCP 42.236.89.187:https > 192.168.0.106:7704 A / Ra',1,,
b'her / IP / TCP 42.236.89.187:https > 192.168.0.106:7704 A / Ra',1,,
b'her / IP / TCP 42.236.89.187:https > 192.168.0.106:7704 A / Ra',1,,
b'her / IP / TCP 42.236.89.187:https > 192.168.0.106:7704 A / Ra',1,,
b'her / IP / TCP 42.236.89.187:https > 192.168.0.106:7704 PA / Ra',1,,
b'her / IP / TCP 42.236.89.187:https > 192.168.0.106:7704 F',2,,
b'her / IP / TCP 192.168.0.106:7704 > 42.236.89.187:https ',2,,
b'her / IP / TCP 192.168.0.106:7704 > 42.236.89.187:https PA / Ra',2,,
b'her / IP / TCP 192.168.0.106:7704 > 42.236.89.187:https F',2,,
b'her / IP / TCP 192.168.0.106:7704 > 42.236.89.187:https ',2,,
b'her / IP / TCP 192.168.0.106:7705 > 157.255.191.46:http ',3,,
b'her / IP / TCP 192.168.0.106:7705 > 157.255.191.46:http ',3,,
b'her / IP / TCP 192.168.0.106:7705 > 157.255.191.46:http PA / Ra',3,,
b'her / IP / TCP 192.168.0.106:7705 > 157.255.191.46:http ',3,,
b'her / IP / TCP 192.168.0.106:7705 > 157.255.191.46:http F',3,,
b'her / IP / TCP 58.223.1.234:8080 > 192.168.0.106:7647 A / Paddin',4,,
b'her / IP / TCP 58.223.1.234:8080 > 192.168.0.106:7647 A / Paddin',4,,
b'her / IP / TCP 58.223.1.234:8080 > 192.168.0.106:7647 PA / Ra',4,,
b'her / IP / TCP 58.223.1.234:8080 > 192.168.0.106:7647 F',4,,
b'her / IP / TCP 192.168.0.106:7647 > 58.223.1.234:8080 R',5,,
b'her / IP / TCP 157.255.191.46:http > 192.168.0.106:7701 A / Ra',6,,
b'her / IP / TCP 157.255.191.46:http > 192.168.0.106:7701 PA / Ra',6,,
b'her / IP / TCP 157.255.191.46:http > 192.168.0.106:7701 F',6,,
b'her / IP / TCP 157.255.191.46:http > 192.168.0.106:7701 ',6,,
b'her / IP / TCP 192.168.0.106:7701 > 157.255.191.46:http ',7,,
b'her / IP / TCP 192.168.0.106:7701 > 157.255.191.46:http F',7,,
b'her / IP / TCP 192.168.0.106:14800 > 157.255.191.89:8080 ',8,,
b'her / IP / TCP 192.168.0.106:14800 > 157.255.191.89:8080 PA / Ra',8,,
b'her / IP / TCP 192.168.0.106:14800 > 157.255.191.89:8080 ',8,,
b'her / IP / TCP 192.168.0.106:7706 > 157.255.191.46:http ',9,,
b'her / IP / TCP 192.168.0.106:7706 > 157.255.191.46:http ',9,,
b'her / IP / TCP 192.168.0.106:7706 > 157.255.191.46:http PA / Ra',9,,
b'her / IP / TCP 192.168.0.106:7706 > 157.255.191.46:http ',9,,
b'her / IP / TCP 192.168.0.106:7706 > 157.255.191.46:http F',9,,
b'her / IP / TCP 192.168.0.106:7706 > 157.255.191.46:http F',9,,
b'her / IP / TCP 192.168.0.106:7707 > 157.255.191.46:http ',10,,
b'her / IP / TCP 192.168.0.106:7707 > 157.255.191.46:http ',10,,
b'her / IP / TCP 192.168.0.106:7707 > 157.255.191.46:http PA / Ra',10,,
b'her / IP / TCP 192.168.0.106:7707 > 157.255.191.46:http ',10,,
b'her / IP / TCP 192.168.0.106:7707 > 157.255.191.46:http F',10,,
b'her / IP / TCP 157.255.191.46:http > 192.168.0.106:7705 S',11,,
b'her / IP / TCP 157.255.191.46:http > 192.168.0.106:7705 ',11,,
b'her / IP / TCP 157.255.191.46:http > 192.168.0.106:7705 PA / Ra',11,,
b'her / IP / TCP 157.255.191.46:http > 192.168.0.106:7705 F',11,,
b'her / IP / TCP 157.255.191.46:http > 192.168.0.106:7705 ',11,,
b'her / IP / TCP 157.255.191.46:http > 192.168.0.106:7706 S',12,,
b'her / IP / TCP 157.255.191.46:http > 192.168.0.106:7706 ',12,,
b'her / IP / TCP 157.255.191.46:http > 192.168.0.106:7706 A / Ra',12,,
b'her / IP / TCP 157.255.191.46:http > 192.168.0.106:7706 PA / Ra',12,,
b'her / IP / TCP 157.255.191.46:http > 192.168.0.106:7706 F',12,,
b'her / IP / TCP 157.255.191.46:http > 192.168.0.106:7706 ',12,,
b'her / IP / TCP 157.255.191.46:http > 192.168.0.106:7707 S',13,,
b'her / IP / TCP 157.255.191.46:http > 192.168.0.106:7707 ',13,,
b'her / IP / TCP 157.255.191.46:http > 192.168.0.106:7707 PA / Ra',13,,
b'her / IP / TCP 157.255.191.46:http > 192.168.0.106:7707 F',13,,
b'her / IP / TCP 157.255.191.46:http > 192.168.0.106:7707 ',13,,
b'her / IP / TCP 192.168.0.106:7708 > 157.255.191.46:http ',14,,
b'her / IP / TCP 192.168.0.106:7708 > 157.255.191.46:http ',14,,
b'her / IP / TCP 192.168.0.106:7708 > 157.255.191.46:http A / Ra',14,,
b'her / IP / TCP 192.168.0.106:7708 > 157.255.191.46:http A / Ra',14,,
b'her / IP / TCP 192.168.0.106:7708 > 157.255.191.46:http A / Ra',14,,
b'her / IP / TCP 192.168.0.106:7708 > 157.255.191.46:http A / Ra',14,,
b'her / IP / TCP 192.168.0.106:7708 > 157.255.191.46:http PA / Ra',15,,
b'her / IP / TCP 192.168.0.106:7708 > 157.255.191.46:http ',15,,
b'her / IP / TCP 192.168.0.106:7708 > 157.255.191.46:http F',15,,
b'her / IP / TCP 157.255.191.46:http > 192.168.0.106:7708 S',16,,
b'her / IP / TCP 157.255.191.46:http > 192.168.0.106:7708 ',16,,
b'her / IP / TCP 157.255.191.46:http > 192.168.0.106:7708 ',16,,
b'her / IP / TCP 157.255.191.46:http > 192.168.0.106:7708 ',16,,
b'her / IP / TCP 157.255.191.46:http > 192.168.0.106:7708 ',16,,
b'her / IP / TCP 157.255.191.46:http > 192.168.0.106:7708 ',16,,
b'her / IP / TCP 157.255.191.46:http > 192.168.0.106:7708 A / Ra',17,,
b'her / IP / TCP 157.255.191.46:http > 192.168.0.106:7708 PA / Ra',17,,
b'her / IP / TCP 157.255.191.46:http > 192.168.0.106:7708 F',17,,
b'her / IP / TCP 157.255.191.46:http > 192.168.0.106:7708 ',17,,
"b'her / IP / UDP / DNS Qry ""b\'dns.msftncsi.com.\'""'",18,,
b'her / IP / TCP 192.168.0.106:7698 > 157.255.191.46:http F',19,,
b'her / IP / TCP 192.168.0.106:7698 > 157.255.191.46:http F',19,,
b'her / IP / TCP 192.168.0.106:7698 > 157.255.191.46:http F',19,,
b'her / IP / TCP 192.168.0.106:7698 > 157.255.191.46:http F',19,,
"b'her / IP / UDP / DNS Ans ""fd3e:4f5a:5b81::1""'",20,,
b'her / IP / TCP 192.168.0.106:13404 > 192.168.0.1:domain ',21,,
b'her / IP / TCP 192.168.0.106:13404 > 192.168.0.1:domain ',21,,
b'her / IP / TCP 192.168.0.106:13404 > 192.168.0.1:domain ',21,,
b'her / IP / TCP 192.168.0.106:13404 > 192.168.0.1:domain ',21,,
b'her / IP / TCP 192.168.0.1:domain > 192.168.0.106:13404 R',22,,
b'her / IP / TCP 192.168.0.1:domain > 192.168.0.106:13404 R',22,,
b'her / IP / TCP 192.168.0.1:domain > 192.168.0.106:13404 R',22,,
b'her / IP / TCP 192.168.0.1:domain > 192.168.0.106:13404 R',22,,
b'her / IP / TCP 192.168.0.106:13405 > 157.255.4.143:http ',23,,
b'her / IP / TCP 192.168.0.106:13405 > 157.255.4.143:http ',23,,
b'her / IP / TCP 192.168.0.106:13405 > 157.255.4.143:http PA / Ra',23,,
b'her / IP / TCP 192.168.0.106:13405 > 157.255.4.143:http ',23,,
b'her / IP / TCP 192.168.0.106:13405 > 157.255.4.143:http ',23,,
b'her / IP / TCP 192.168.0.106:13405 > 157.255.4.143:http F',23,,
b'her / IP / TCP 192.168.0.106:13405 > 157.255.4.143:http ',24,,
b'her / IP / TCP 157.255.4.143:http > 192.168.0.106:13405 S',24,,
b'her / IP / TCP 157.255.4.143:http > 192.168.0.106:13405 ',24,,
b'her / IP / TCP 157.255.4.143:http > 192.168.0.106:13405 A / Ra',24,,
b'her / IP / TCP 157.255.4.143:http > 192.168.0.106:13405 A / Ra',24,,
b'her / IP / TCP 157.255.4.143:http > 192.168.0.106:13405 PA / Ra',24,,
b'her / IP / TCP 157.255.4.143:http > 192.168.0.106:13405 F',24,,
b'her / IP / TCP 192.168.0.106:13406 > 157.255.191.46:http ',25,,
b'her / IP / TCP 192.168.0.106:13406 > 157.255.191.46:http ',25,,
b'her / IP / TCP 192.168.0.106:13406 > 157.255.191.46:http A / Ra',25,,
b'her / IP / TCP 192.168.0.106:13406 > 157.255.191.46:http A / Ra',25,,
b'her / IP / TCP 192.168.0.106:13406 > 157.255.191.46:http A / Ra',25,,
b'her / IP / TCP 192.168.0.106:13406 > 157.255.191.46:http A / Ra',25,,
b'her / IP / TCP 192.168.0.106:13406 > 157.255.191.46:http PA / Ra',26,,
b'her / IP / TCP 192.168.0.106:13406 > 157.255.191.46:http ',26,,
b'her / IP / TCP 192.168.0.106:13406 > 157.255.191.46:http F',26,,
b'her / IP / TCP 157.255.191.46:http > 192.168.0.106:13406 S',27,,
b'her / IP / TCP 157.255.191.46:http > 192.168.0.106:13406 ',27,,
b'her / IP / TCP 157.255.191.46:http > 192.168.0.106:13406 ',27,,
b'her / IP / TCP 157.255.191.46:http > 192.168.0.106:13406 ',27,,
b'her / IP / TCP 157.255.191.46:http > 192.168.0.106:13406 ',27,,
b'her / IP / TCP 157.255.191.46:http > 192.168.0.106:13406 ',27,,
b'her / IP / TCP 157.255.191.46:http > 192.168.0.106:13406 A / Ra',28,,
b'her / IP / TCP 157.255.191.46:http > 192.168.0.106:13406 PA / Ra',28,,
b'her / IP / TCP 157.255.191.46:http > 192.168.0.106:13406 F',28,,
b'her / IP / TCP 157.255.191.46:http > 192.168.0.106:13406 ',28,,
b'her / IP / TCP 192.168.0.106:7678 > 157.255.191.46:http F',29,,
b'her / IP / TCP 192.168.0.106:7678 > 157.255.191.46:http F',29,,
b'her / IP / TCP 192.168.0.106:7678 > 157.255.191.46:http F',29,,
"b'her / IP / UDP / DNS Qry ""b\'dns.msftncsi.com.\'""'",30,,
"b'her / IP / UDP / DNS Ans ""fd3e:4f5a:5b81::1""'",31,,
b'her / IP / TCP 192.168.0.106:13407 > 157.255.191.46:http ',32,,
b'her / IP / TCP 192.168.0.106:13407 > 157.255.191.46:http ',32,,
b'her / IP / TCP 192.168.0.106:13407 > 157.255.191.46:http A / Ra',32,,
b'her / IP / TCP 192.168.0.106:13407 > 157.255.191.46:http A / Ra',32,,
b'her / IP / TCP 192.168.0.106:13407 > 157.255.191.46:http A / Ra',32,,
b'her / IP / TCP 192.168.0.106:13407 > 157.255.191.46:http A / Ra',32,,
b'her / IP / TCP 192.168.0.106:13407 > 157.255.191.46:http PA / Ra',33,,
b'her / IP / TCP 192.168.0.106:13407 > 157.255.191.46:http ',33,,
b'her / IP / TCP 192.168.0.106:13407 > 157.255.191.46:http F',33,,
b'her / IP / TCP 192.168.0.106:13407 > 157.255.191.46:http F',33,,
b'her / IP / TCP 192.168.0.106:13407 > 157.255.191.46:http F',33,,
b'her / IP / TCP 192.168.0.106:13407 > 157.255.191.46:http F',33,,
b'her / IP / TCP 192.168.0.106:13407 > 157.255.191.46:http F',33,,
b'her / IP / TCP 192.168.0.106:13407 > 157.255.191.46:http F',34,,
b'her / IP / TCP 157.255.191.46:http > 192.168.0.106:13407 S',34,,
b'her / IP / TCP 157.255.191.46:http > 192.168.0.106:13407 ',34,,
b'her / IP / TCP 157.255.191.46:http > 192.168.0.106:13407 ',34,,
b'her / IP / TCP 157.255.191.46:http > 192.168.0.106:13407 ',34,,
b'her / IP / TCP 157.255.191.46:http > 192.168.0.106:13407 ',34,,
b'her / IP / TCP 157.255.191.46:http > 192.168.0.106:13407 ',34,,
b'her / IP / TCP 157.255.191.46:http > 192.168.0.106:13407 A / Ra',35,,
b'her / IP / TCP 157.255.191.46:http > 192.168.0.106:13407 PA / Ra',35,,
b'her / IP / TCP 157.255.191.46:http > 192.168.0.106:13407 F',35,,
b'her / IP / TCP 192.168.0.106:13408 > 116.132.235.204:http ',36,,
b'her / IP / TCP 192.168.0.106:13408 > 116.132.235.204:http ',36,,
b'her / IP / TCP 192.168.0.106:13408 > 116.132.235.204:http PA / Ra',36,,
b'her / IP / TCP 192.168.0.106:13408 > 116.132.235.204:http A / Ra',36,,
b'her / IP / TCP 192.168.0.106:13408 > 116.132.235.204:http A / Ra',36,,
b'her / IP / TCP 192.168.0.106:13408 > 116.132.235.204:http PA / Ra',36,,
b'her / IP / TCP 192.168.0.106:13408 > 116.132.235.204:http ',37,,
b'her / IP / TCP 192.168.0.106:13408 > 116.132.235.204:http F',37,,
b'her / IP / TCP 116.132.235.204:http > 192.168.0.106:13408 S',38,,
b'her / IP / TCP 116.132.235.204:http > 192.168.0.106:13408 ',38,,
b'her / IP / TCP 116.132.235.204:http > 192.168.0.106:13408 ',38,,
b'her / IP / TCP 116.132.235.204:http > 192.168.0.106:13408 ',38,,
b'her / IP / TCP 116.132.235.204:http > 192.168.0.106:13408 PA / Ra',38,,
b'her / IP / TCP 116.132.235.204:http > 192.168.0.106:13408 F',38,,
b'her / IP / TCP 116.132.235.204:http > 192.168.0.106:13408 ',39,,
b'her / IP / TCP 192.168.0.106:13410 > 116.132.235.204:http ',39,,
b'her / IP / TCP 192.168.0.106:13410 > 116.132.235.204:http ',39,,
b'her / IP / TCP 192.168.0.106:13410 > 116.132.235.204:http PA / Ra',39,,
b'her / IP / TCP 192.168.0.106:13410 > 116.132.235.204:http A / Ra',39,,
b'her / IP / TCP 192.168.0.106:13410 > 116.132.235.204:http A / Ra',39,,
b'her / IP / TCP 192.168.0.106:13410 > 116.132.235.204:http PA / Ra',39,,
b'her / IP / TCP 192.168.0.106:13410 > 116.132.235.204:http ',40,,
b'her / IP / TCP 192.168.0.106:13410 > 116.132.235.204:http F',40,,
b'her / IP / TCP 116.132.235.204:http > 192.168.0.106:13410 S',41,,
b'her / IP / TCP 116.132.235.204:http > 192.168.0.106:13410 ',41,,
b'her / IP / TCP 116.132.235.204:http > 192.168.0.106:13410 ',41,,
b'her / IP / TCP 116.132.235.204:http > 192.168.0.106:13410 ',41,,
b'her / IP / TCP 116.132.235.204:http > 192.168.0.106:13410 PA / Ra',41,,
b'her / IP / TCP 116.132.235.204:http > 192.168.0.106:13410 F',41,,
b'her / IP / TCP 116.132.235.204:http > 192.168.0.106:13410 ',42,,
"b'her / IP / UDP / DNS Qry ""b\'www.baidu.com.\'""'",42,,
"b'her / IP / UDP / DNS Ans ""b\'www.a.shifen.com.\'""'",43,,
b'her / IP / TCP 192.168.0.106:13411 > 110.242.68.3:http ',44,,
b'her / IP / TCP 192.168.0.106:13411 > 110.242.68.3:http ',44,,
b'her / IP / TCP 192.168.0.106:13411 > 110.242.68.3:http F',44,,
b'her / IP / TCP 192.168.0.106:13411 > 110.242.68.3:http ',44,,
b'her / IP / TCP 110.242.68.3:http > 192.168.0.106:13411 S',45,,
b'her / IP / TCP 110.242.68.3:http > 192.168.0.106:13411 ',45,,
b'her / IP / TCP 110.242.68.3:http > 192.168.0.106:13411 F',45,,
b'her / IP / TCP 192.168.0.106:7657 > 157.255.191.46:http F',46,,
b'her / IP / TCP 192.168.0.106:7657 > 157.255.191.46:http F',46,,
b'her / IP / TCP 192.168.0.106:13412 > 116.132.235.204:http ',47,,
b'her / IP / TCP 192.168.0.106:13412 > 116.132.235.204:http ',47,,
b'her / IP / TCP 192.168.0.106:13412 > 116.132.235.204:http PA / Ra',47,,
b'her / IP / TCP 192.168.0.106:13412 > 116.132.235.204:http A / Ra',47,,
b'her / IP / TCP 192.168.0.106:13412 > 116.132.235.204:http A / Ra',47,,
b'her / IP / TCP 192.168.0.106:13412 > 116.132.235.204:http PA / Ra',47,,
b'her / IP / TCP 192.168.0.106:13412 > 116.132.235.204:http ',48,,
b'her / IP / TCP 192.168.0.106:13412 > 116.132.235.204:http F',48,,
b'her / IP / TCP 116.132.235.204:http > 192.168.0.106:13412 S',49,,
b'her / IP / TCP 116.132.235.204:http > 192.168.0.106:13412 ',49,,
b'her / IP / TCP 116.132.235.204:http > 192.168.0.106:13412 ',49,,
b'her / IP / TCP 116.132.235.204:http > 192.168.0.106:13412 ',49,,
b'her / IP / TCP 116.132.235.204:http > 192.168.0.106:13412 PA / Ra',49,,
b'her / IP / TCP 116.132.235.204:http > 192.168.0.106:13412 F',49,,
b'her / IP / TCP 116.132.235.204:http > 192.168.0.106:13412 ',50,,
b'her / IP / TCP 192.168.0.106:13413 > 116.132.235.204:http ',50,,
b'her / IP / TCP 192.168.0.106:13413 > 116.132.235.204:http ',50,,
b'her / IP / TCP 192.168.0.106:13413 > 116.132.235.204:http PA / Ra',50,,
b'her / IP / TCP 192.168.0.106:13413 > 116.132.235.204:http A / Ra',50,,
b'her / IP / TCP 192.168.0.106:13413 > 116.132.235.204:http A / Ra',50,,
b'her / IP / TCP 192.168.0.106:13413 > 116.132.235.204:http PA / Ra',50,,
b'her / IP / TCP 192.168.0.106:13413 > 116.132.235.204:http ',51,,
b'her / IP / TCP 192.168.0.106:13413 > 116.132.235.204:http F',51,,
b'her / IP / TCP 192.168.0.106:13413 > 116.132.235.204:http F',51,,
b'her / IP / TCP 192.168.0.106:13413 > 116.132.235.204:http F',51,,
b'her / IP / TCP 192.168.0.106:13413 > 116.132.235.204:http F',51,,
b'her / IP / TCP 192.168.0.106:13413 > 116.132.235.204:http F',51,,
b'her / IP / TCP 116.132.235.204:http > 192.168.0.106:13413 S',52,,
b'her / IP / TCP 116.132.235.204:http > 192.168.0.106:13413 ',52,,
b'her / IP / TCP 116.132.235.204:http > 192.168.0.106:13413 ',52,,
b'her / IP / TCP 116.132.235.204:http > 192.168.0.106:13413 PA / Ra',52,,
b'her / IP / TCP 116.132.235.204:http > 192.168.0.106:13413 F',52,,
b'her / IP / TCP 192.168.0.106:7364 > 202.112.14.6:https F',53,,
b'her / IP / TCP 192.168.0.106:7364 > 202.112.14.6:https R',53,,
b'her / IP / TCP 202.112.14.6:https > 192.168.0.106:7364 ',54,,
b'her / IP / TCP 192.168.0.106:6981 > 13.89.178.26:https PA / Ra',55,,
b'her / IP / TCP 192.168.0.106:6981 > 13.89.178.26:https PA / Ra',55,,
b'her / IP / TCP 192.168.0.106:6981 > 13.89.178.26:https ',55,,
b'her / IP / TCP 192.168.0.106:6981 > 13.89.178.26:https PA / Ra',55,,
b'her / IP / TCP 192.168.0.106:6981 > 13.89.178.26:https PA / Ra',55,,
b'her / IP / TCP 192.168.0.106:6981 > 13.89.178.26:https PA / Ra',55,,
b'her / IP / TCP 192.168.0.106:6981 > 13.89.178.26:https ',56,,
b'her / IP / TCP 192.168.0.106:6981 > 13.89.178.26:https PA / Ra',56,,
b'her / IP / TCP 192.168.0.106:6981 > 13.89.178.26:https PA / Ra',56,,
b'her / IP / TCP 192.168.0.106:6981 > 13.89.178.26:https ',56,,
b'her / IP / TCP 13.89.178.26:https > 192.168.0.106:6981 A / Paddin',57,,
b'her / IP / TCP 13.89.178.26:https > 192.168.0.106:6981 PA / Ra',57,,
b'her / IP / TCP 13.89.178.26:https > 192.168.0.106:6981 PA / Ra',57,,
b'her / IP / TCP 13.89.178.26:https > 192.168.0.106:6981 A / Paddin',57,,
b'her / IP / TCP 13.89.178.26:https > 192.168.0.106:6981 A / Paddin',57,,
b'her / IP / TCP 13.89.178.26:https > 192.168.0.106:6981 PA / Ra',57,,
b'her / IP / TCP 13.89.178.26:https > 192.168.0.106:6981 PA / Ra',58,,
b'her / IP / TCP 13.89.178.26:https > 192.168.0.106:6981 A / Paddin',58,,
b'her / IP / TCP 13.89.178.26:https > 192.168.0.106:6981 PA / Ra',58,,
b'her / IP / TCP 13.89.178.26:https > 192.168.0.106:6981 PA / Ra',58,,
b'her / IP / TCP 192.168.0.106:13415 > 116.132.235.204:http ',59,,
b'her / IP / TCP 192.168.0.106:13415 > 116.132.235.204:http ',59,,
b'her / IP / TCP 192.168.0.106:13415 > 116.132.235.204:http PA / Ra',59,,
b'her / IP / TCP 192.168.0.106:13415 > 116.132.235.204:http A / Ra',59,,
b'her / IP / TCP 192.168.0.106:13415 > 116.132.235.204:http A / Ra',59,,
b'her / IP / TCP 192.168.0.106:13415 > 116.132.235.204:http PA / Ra',59,,
b'her / IP / TCP 192.168.0.106:13415 > 116.132.235.204:http ',60,,
b'her / IP / TCP 192.168.0.106:13415 > 116.132.235.204:http F',60,,
b'her / IP / TCP 116.132.235.204:http > 192.168.0.106:13415 S',61,,
b'her / IP / TCP 116.132.235.204:http > 192.168.0.106:13415 ',61,,
b'her / IP / TCP 116.132.235.204:http > 192.168.0.106:13415 ',61,,
b'her / IP / TCP 116.132.235.204:http > 192.168.0.106:13415 PA / Ra',61,,
b'her / IP / TCP 116.132.235.204:http > 192.168.0.106:13415 F',61,,
b'her / IP / TCP 116.132.235.204:http > 192.168.0.106:13415 ',61,,
b'her / IP / TCP 192.168.0.106:13416 > 116.132.235.204:http ',62,,
b'her / IP / TCP 192.168.0.106:13416 > 116.132.235.204:http ',62,,
b'her / IP / TCP 192.168.0.106:13416 > 116.132.235.204:http PA / Ra',62,,
b'her / IP / TCP 192.168.0.106:13416 > 116.132.235.204:http A / Ra',62,,
b'her / IP / TCP 192.168.0.106:13416 > 116.132.235.204:http A / Ra',62,,
b'her / IP / TCP 192.168.0.106:13416 > 116.132.235.204:http PA / Ra',62,,
b'her / IP / TCP 192.168.0.106:13416 > 116.132.235.204:http ',63,,
b'her / IP / TCP 192.168.0.106:13416 > 116.132.235.204:http F',63,,
b'her / IP / TCP 116.132.235.204:http > 192.168.0.106:13416 S',64,,
b'her / IP / TCP 116.132.235.204:http > 192.168.0.106:13416 ',64,,
b'her / IP / TCP 116.132.235.204:http > 192.168.0.106:13416 ',64,,
b'her / IP / TCP 116.132.235.204:http > 192.168.0.106:13416 PA / Ra',64,,
b'her / IP / TCP 116.132.235.204:http > 192.168.0.106:13416 F',64,,
b'her / IP / TCP 116.132.235.204:http > 192.168.0.106:13416 ',64,,
b'her / IP / TCP 192.168.0.106:13417 > 116.132.235.204:http ',65,,
b'her / IP / TCP 192.168.0.106:13417 > 116.132.235.204:http ',65,,
b'her / IP / TCP 192.168.0.106:13417 > 116.132.235.204:http PA / Ra',65,,
b'her / IP / TCP 192.168.0.106:13417 > 116.132.235.204:http A / Ra',65,,
b'her / IP / TCP 192.168.0.106:13417 > 116.132.235.204:http A / Ra',65,,
b'her / IP / TCP 192.168.0.106:13417 > 116.132.235.204:http PA / Ra',65,,
b'her / IP / TCP 192.168.0.106:13417 > 116.132.235.204:http ',66,,
b'her / IP / TCP 192.168.0.106:13417 > 116.132.235.204:http F',66,,
b'her / IP / TCP 116.132.235.204:http > 192.168.0.106:13417 S',67,,
b'her / IP / TCP 116.132.235.204:http > 192.168.0.106:13417 ',67,,
b'her / IP / TCP 116.132.235.204:http > 192.168.0.106:13417 ',67,,
b'her / IP / TCP 116.132.235.204:http > 192.168.0.106:13417 ',67,,
b'her / IP / TCP 116.132.235.204:http > 192.168.0.106:13417 PA / Ra',67,,
b'her / IP / TCP 116.132.235.204:http > 192.168.0.106:13417 F',67,,
b'her / IP / TCP 116.132.235.204:http > 192.168.0.106:13417 ',68,,
b'her / IP / TCP 192.168.0.106:13419 > 116.132.235.204:http ',68,,
b'her / IP / TCP 192.168.0.106:13419 > 116.132.235.204:http ',68,,
b'her / IP / TCP 192.168.0.106:13419 > 116.132.235.204:http PA / Ra',68,,
b'her / IP / TCP 192.168.0.106:13419 > 116.132.235.204:http A / Ra',68,,
b'her / IP / TCP 192.168.0.106:13419 > 116.132.235.204:http A / Ra',68,,
b'her / IP / TCP 192.168.0.106:13419 > 116.132.235.204:http PA / Ra',68,,
b'her / IP / TCP 192.168.0.106:13419 > 116.132.235.204:http ',69,,
b'her / IP / TCP 192.168.0.106:13419 > 116.132.235.204:http F',69,,
b'her / IP / TCP 116.132.235.204:http > 192.168.0.106:13419 S',70,,
b'her / IP / TCP 116.132.235.204:http > 192.168.0.106:13419 ',70,,
b'her / IP / TCP 116.132.235.204:http > 192.168.0.106:13419 ',70,,
b'her / IP / TCP 116.132.235.204:http > 192.168.0.106:13419 ',70,,
b'her / IP / TCP 116.132.235.204:http > 192.168.0.106:13419 PA / Ra',70,,
b'her / IP / TCP 116.132.235.204:http > 192.168.0.106:13419 F',70,,
b'her / IP / TCP 116.132.235.204:http > 192.168.0.106:13419 ',71,,
b'her / IP / TCP 192.168.0.106:13420 > 116.132.235.204:http ',71,,
b'her / IP / TCP 192.168.0.106:13420 > 116.132.235.204:http ',71,,
b'her / IP / TCP 192.168.0.106:13420 > 116.132.235.204:http PA / Ra',71,,
b'her / IP / TCP 192.168.0.106:13420 > 116.132.235.204:http A / Ra',71,,
b'her / IP / TCP 192.168.0.106:13420 > 116.132.235.204:http A / Ra',71,,
b'her / IP / TCP 192.168.0.106:13420 > 116.132.235.204:http PA / Ra',71,,
b'her / IP / TCP 192.168.0.106:13420 > 116.132.235.204:http ',72,,
b'her / IP / TCP 192.168.0.106:13420 > 116.132.235.204:http F',72,,
b'her / IP / TCP 116.132.235.204:http > 192.168.0.106:13420 S',73,,
b'her / IP / TCP 116.132.235.204:http > 192.168.0.106:13420 ',73,,
b'her / IP / TCP 116.132.235.204:http > 192.168.0.106:13420 ',73,,
b'her / IP / TCP 116.132.235.204:http > 192.168.0.106:13420 ',73,,
b'her / IP / TCP 116.132.235.204:http > 192.168.0.106:13420 PA / Ra',73,,
b'her / IP / TCP 116.132.235.204:http > 192.168.0.106:13420 F',73,,
b'her / IP / TCP 116.132.235.204:http > 192.168.0.106:13420 ',74,,
b'her / IP / TCP 192.168.0.106:13421 > 116.132.235.204:http ',74,,
b'her / IP / TCP 192.168.0.106:13421 > 116.132.235.204:http ',74,,
b'her / IP / TCP 192.168.0.106:13421 > 116.132.235.204:http PA / Ra',74,,
b'her / IP / TCP 192.168.0.106:13421 > 116.132.235.204:http A / Ra',74,,
b'her / IP / TCP 192.168.0.106:13421 > 116.132.235.204:http A / Ra',74,,
b'her / IP / TCP 192.168.0.106:13421 > 116.132.235.204:http PA / Ra',74,,
b'her / IP / TCP 192.168.0.106:13421 > 116.132.235.204:http ',75,,
b'her / IP / TCP 192.168.0.106:13421 > 116.132.235.204:http F',75,,
b'her / IP / TCP 116.132.235.204:http > 192.168.0.106:13421 S',76,,
b'her / IP / TCP 116.132.235.204:http > 192.168.0.106:13421 ',76,,
b'her / IP / TCP 116.132.235.204:http > 192.168.0.106:13421 ',76,,
b'her / IP / TCP 116.132.235.204:http > 192.168.0.106:13421 ',76,,
b'her / IP / TCP 116.132.235.204:http > 192.168.0.106:13421 PA / Ra',76,,
b'her / IP / TCP 116.132.235.204:http > 192.168.0.106:13421 F',76,,
b'her / IP / TCP 116.132.235.204:http > 192.168.0.106:13421 ',77,,
b'her / IP / TCP 192.168.0.106:13423 > 116.132.235.204:http ',77,,
b'her / IP / TCP 192.168.0.106:13423 > 116.132.235.204:http ',77,,
b'her / IP / TCP 192.168.0.106:13423 > 116.132.235.204:http PA / Ra',77,,
b'her / IP / TCP 192.168.0.106:13423 > 116.132.235.204:http A / Ra',77,,
b'her / IP / TCP 192.168.0.106:13423 > 116.132.235.204:http A / Ra',77,,
b'her / IP / TCP 192.168.0.106:13423 > 116.132.235.204:http PA / Ra',77,,
b'her / IP / TCP 192.168.0.106:13423 > 116.132.235.204:http ',78,,
b'her / IP / TCP 192.168.0.106:13423 > 116.132.235.204:http F',78,,
b'her / IP / TCP 116.132.235.204:http > 192.168.0.106:13423 S',79,,
b'her / IP / TCP 116.132.235.204:http > 192.168.0.106:13423 ',79,,
b'her / IP / TCP 116.132.235.204:http > 192.168.0.106:13423 ',79,,
b'her / IP / TCP 116.132.235.204:http > 192.168.0.106:13423 ',79,,
b'her / IP / TCP 116.132.235.204:http > 192.168.0.106:13423 PA / Ra',79,,
b'her / IP / TCP 116.132.235.204:http > 192.168.0.106:13423 F',79,,
b'her / IP / TCP 116.132.235.204:http > 192.168.0.106:13423 ',80,,
b'her / IP / TCP 192.168.0.106:13424 > 116.132.235.204:http ',80,,
b'her / IP / TCP 192.168.0.106:13424 > 116.132.235.204:http ',80,,
b'her / IP / TCP 192.168.0.106:13424 > 116.132.235.204:http PA / Ra',80,,
b'her / IP / TCP 192.168.0.106:13424 > 116.132.235.204:http A / Ra',80,,
b'her / IP / TCP 192.168.0.106:13424 > 116.132.235.204:http A / Ra',80,,
b'her / IP / TCP 192.168.0.106:13424 > 116.132.235.204:http PA / Ra',80,,
b'her / IP / TCP 192.168.0.106:13424 > 116.132.235.204:http ',81,,
b'her / IP / TCP 192.168.0.106:13424 > 116.132.235.204:http F',81,,
b'her / IP / TCP 192.168.0.106:13424 > 116.132.235.204:http F',81,,
b'her / IP / TCP 192.168.0.106:13424 > 116.132.235.204:http F',81,,
b'her / IP / TCP 192.168.0.106:13424 > 116.132.235.204:http F',81,,
b'her / IP / TCP 116.132.235.204:http > 192.168.0.106:13424 S',82,,
b'her / IP / TCP 116.132.235.204:http > 192.168.0.106:13424 ',82,,
b'her / IP / TCP 116.132.235.204:http > 192.168.0.106:13424 ',82,,
b'her / IP / TCP 116.132.235.204:http > 192.168.0.106:13424 ',82,,
b'her / IP / TCP 116.132.235.204:http > 192.168.0.106:13424 PA / Ra',82,,
b'her / IP / TCP 116.132.235.204:http > 192.168.0.106:13424 F',82,,
b'her / IP / TCP 157.255.191.89:8080 > 192.168.0.106:14800 PA / Ra',83,,
b'her / IP / TCP 157.255.191.89:8080 > 192.168.0.106:14800 PA / Ra',83,,
b'her / IP / TCP 192.168.0.106:13426 > 116.132.235.204:http ',84,,
b'her / IP / TCP 192.168.0.106:13426 > 116.132.235.204:http ',84,,
b'her / IP / TCP 192.168.0.106:13426 > 116.132.235.204:http PA / Ra',84,,
b'her / IP / TCP 192.168.0.106:13426 > 116.132.235.204:http A / Ra',84,,
b'her / IP / TCP 192.168.0.106:13426 > 116.132.235.204:http A / Ra',84,,
b'her / IP / TCP 192.168.0.106:13426 > 116.132.235.204:http PA / Ra',84,,
b'her / IP / TCP 192.168.0.106:13426 > 116.132.235.204:http ',85,,
b'her / IP / TCP 192.168.0.106:13426 > 116.132.235.204:http F',85,,
b'her / IP / TCP 116.132.235.204:http > 192.168.0.106:13426 S',86,,
b'her / IP / TCP 116.132.235.204:http > 192.168.0.106:13426 ',86,,
b'her / IP / TCP 116.132.235.204:http > 192.168.0.106:13426 ',86,,
b'her / IP / TCP 116.132.235.204:http > 192.168.0.106:13426 ',86,,
b'her / IP / TCP 116.132.235.204:http > 192.168.0.106:13426 PA / Ra',86,,
b'her / IP / TCP 116.132.235.204:http > 192.168.0.106:13426 F',86,,
b'her / IP / TCP 116.132.235.204:http > 192.168.0.106:13426 ',87,,
b'her / IP / TCP 192.168.0.106:13427 > 116.132.235.204:http ',87,,
b'her / IP / TCP 192.168.0.106:13427 > 116.132.235.204:http ',87,,
b'her / IP / TCP 192.168.0.106:13427 > 116.132.235.204:http PA / Ra',87,,
b'her / IP / TCP 192.168.0.106:13427 > 116.132.235.204:http A / Ra',87,,
b'her / IP / TCP 192.168.0.106:13427 > 116.132.235.204:http A / Ra',87,,
b'her / IP / TCP 192.168.0.106:13427 > 116.132.235.204:http PA / Ra',87,,
b'her / IP / TCP 192.168.0.106:13427 > 116.132.235.204:http ',88,,
b'her / IP / TCP 192.168.0.106:13427 > 116.132.235.204:http F',88,,
b'her / IP / TCP 116.132.235.204:http > 192.168.0.106:13427 S',89,,
b'her / IP / TCP 116.132.235.204:http > 192.168.0.106:13427 ',89,,
b'her / IP / TCP 116.132.235.204:http > 192.168.0.106:13427 ',89,,
b'her / IP / TCP 116.132.235.204:http > 192.168.0.106:13427 ',89,,
b'her / IP / TCP 116.132.235.204:http > 192.168.0.106:13427 PA / Ra',89,,
b'her / IP / TCP 116.132.235.204:http > 192.168.0.106:13427 F',89,,
b'her / IP / TCP 116.132.235.204:http > 192.168.0.106:13427 ',90,,
"b'her / IP / UDP / DNS Qry ""b\'_companion-link._tcp.local.\'""'",90,,
"b'her / IPv6 / UDP / DNS Qry ""b\'_companion-link._tcp.local.\'""'",91,,
