data,flowmember,label,classes
b'her / IP / TCP 20.195.112.105:https > 192.168.1.116:10370 A / Ra',1,,
b'her / IP / TCP 20.195.112.105:https > 192.168.1.116:10370 A / Ra',1,,
b'her / IP / TCP 20.195.112.105:https > 192.168.1.116:10370 A / Ra',1,,
b'her / IP / TCP 20.195.112.105:https > 192.168.1.116:10370 A / Ra',1,,
b'her / IP / TCP 20.195.112.105:https > 192.168.1.116:10370 PA / Ra',1,,
b'her / IP / TCP 20.195.112.105:https > 192.168.1.116:10370 PA / Ra',1,,
b'her / IP / TCP 20.195.112.105:https > 192.168.1.116:10370 ',2,,
b'her / IP / TCP 20.195.112.105:https > 192.168.1.116:10370 FPA / Ra',2,,
b'her / IP / TCP 192.168.1.116:10370 > 20.195.112.105:https ',3,,
b'her / IP / TCP 192.168.1.116:10370 > 20.195.112.105:https PA / Ra',3,,
b'her / IP / TCP 192.168.1.116:10370 > 20.195.112.105:https PA / Ra',3,,
b'her / IP / TCP 192.168.1.116:10370 > 20.195.112.105:https A / Ra',3,,
b'her / IP / TCP 192.168.1.116:10370 > 20.195.112.105:https PA / Ra',3,,
b'her / IP / TCP 192.168.1.116:10370 > 20.195.112.105:https ',3,,
b'her / IP / TCP 192.168.1.116:10370 > 20.195.112.105:https F',4,,
b'her / IP / TCP 192.168.1.116:10370 > 20.195.112.105:https F',4,,
b'her / IP / TCP 192.168.1.116:10370 > 20.195.112.105:https F',4,,
b'her / IP / TCP 192.168.1.116:10370 > 20.195.112.105:https F',4,,
b'her / IP / TCP 192.168.1.116:10370 > 20.195.112.105:https F',4,,
b'her / IP / TCP 192.168.1.116:10370 > 20.195.112.105:https F',4,,
b'her / IP / TCP 192.168.1.116:10370 > 20.195.112.105:https R',4,,
b'her / IP / TCP 192.168.1.116:10349 > 51.104.15.253:https PA / Ra',5,,
b'her / IP / TCP 192.168.1.116:10349 > 51.104.15.253:https A / Ra',5,,
b'her / IP / TCP 192.168.1.116:10349 > 51.104.15.253:https PA / Ra',5,,
b'her / IP / TCP 192.168.1.116:10349 > 51.104.15.253:https ',5,,
b'her / IP / TCP 192.168.1.116:10349 > 51.104.15.253:https A / Ra',5,,
b'her / IP / TCP 51.104.15.253:https > 192.168.1.116:10349 ',6,,
b'her / IP / TCP 51.104.15.253:https > 192.168.1.116:10349 PA / Ra',6,,
b'her / IP / TCP 51.104.15.253:https > 192.168.1.116:10349 PA / Ra',6,,
b'her / IP / TCP 51.104.15.253:https > 192.168.1.116:10349 ',6,,
b'her / IP / TCP 192.168.1.116:10367 > 142.251.43.10:https ',7,,
b'her / IP / TCP 192.168.1.116:10367 > 142.251.43.10:https ',7,,
b'her / IP / TCP 192.168.1.116:10367 > 142.251.43.10:https ',7,,
"b'her / IP / UDP / DNS Qry ""b\'static-pcs-sdk-server.alibaba.com.\'""'",8,,
"b'her / IP / UDP / DNS Qry ""b\'v20.events.data.microsoft.com.\'""'",8,,
"b'her / IP / UDP / DNS Ans ""b\'static-pcs-sdk-server.alibaba.com.gds.alibabadns.com.\'""'",9,,
"b'her / IP / UDP / DNS Ans ""b\'win-global-asimov-leafs-events-data.trafficmanager.net.\'""'",9,,
b'her / IP / TCP 192.168.1.116:10372 > 203.119.169.16:http ',10,,
b'her / IP / TCP 192.168.1.116:10372 > 203.119.169.16:http ',10,,
b'her / IP / TCP 192.168.1.116:10372 > 203.119.169.16:http PA / Ra',10,,
b'her / IP / TCP 192.168.1.116:10372 > 203.119.169.16:http A / Ra',10,,
b'her / IP / TCP 192.168.1.116:10372 > 203.119.169.16:http A / Ra',10,,
b'her / IP / TCP 192.168.1.116:10372 > 203.119.169.16:http PA / Ra',10,,
b'her / IP / TCP 192.168.1.116:10372 > 203.119.169.16:http ',11,,
b'her / IP / TCP 192.168.1.116:10372 > 203.119.169.16:http PA / Ra',11,,
b'her / IP / TCP 192.168.1.116:10372 > 203.119.169.16:http A / Ra',11,,
b'her / IP / TCP 192.168.1.116:10372 > 203.119.169.16:http A / Ra',11,,
b'her / IP / TCP 192.168.1.116:10372 > 203.119.169.16:http PA / Ra',11,,
b'her / IP / TCP 192.168.1.116:10372 > 203.119.169.16:http ',11,,
b'her / IP / TCP 192.168.1.116:10372 > 203.119.169.16:http PA / Ra',11,,
b'her / IP / TCP 192.168.1.116:10372 > 203.119.169.16:http A / Ra',12,,
b'her / IP / TCP 192.168.1.116:10372 > 203.119.169.16:http A / Ra',12,,
b'her / IP / TCP 192.168.1.116:10372 > 203.119.169.16:http PA / Ra',12,,
b'her / IP / TCP 192.168.1.116:10372 > 203.119.169.16:http ',12,,
b'her / IP / TCP 192.168.1.116:10372 > 203.119.169.16:http PA / Ra',12,,
b'her / IP / TCP 192.168.1.116:10372 > 203.119.169.16:http A / Ra',12,,
b'her / IP / TCP 192.168.1.116:10372 > 203.119.169.16:http A / Ra',12,,
b'her / IP / TCP 192.168.1.116:10372 > 203.119.169.16:http PA / Ra',13,,
b'her / IP / TCP 192.168.1.116:10372 > 203.119.169.16:http ',13,,
b'her / IP / TCP 192.168.1.116:10372 > 203.119.169.16:http PA / Ra',13,,
b'her / IP / TCP 192.168.1.116:10372 > 203.119.169.16:http A / Ra',13,,
b'her / IP / TCP 192.168.1.116:10372 > 203.119.169.16:http A / Ra',13,,
b'her / IP / TCP 192.168.1.116:10372 > 203.119.169.16:http PA / Ra',13,,
b'her / IP / TCP 192.168.1.116:10372 > 203.119.169.16:http ',13,,
b'her / IP / TCP 192.168.1.116:10372 > 203.119.169.16:http PA / Ra',14,,
b'her / IP / TCP 192.168.1.116:10372 > 203.119.169.16:http A / Ra',14,,
b'her / IP / TCP 192.168.1.116:10372 > 203.119.169.16:http A / Ra',14,,
b'her / IP / TCP 192.168.1.116:10372 > 203.119.169.16:http PA / Ra',14,,
b'her / IP / TCP 192.168.1.116:10372 > 203.119.169.16:http ',14,,
b'her / IP / TCP 192.168.1.116:10372 > 203.119.169.16:http PA / Ra',14,,
b'her / IP / TCP 192.168.1.116:10372 > 203.119.169.16:http A / Ra',14,,
b'her / IP / TCP 192.168.1.116:10372 > 203.119.169.16:http A / Ra',15,,
b'her / IP / TCP 192.168.1.116:10372 > 203.119.169.16:http PA / Ra',15,,
b'her / IP / TCP 192.168.1.116:10372 > 203.119.169.16:http ',15,,
b'her / IP / TCP 192.168.1.116:10372 > 203.119.169.16:http PA / Ra',15,,
b'her / IP / TCP 192.168.1.116:10372 > 203.119.169.16:http A / Ra',15,,
b'her / IP / TCP 192.168.1.116:10372 > 203.119.169.16:http A / Ra',15,,
b'her / IP / TCP 192.168.1.116:10372 > 203.119.169.16:http PA / Ra',15,,
b'her / IP / TCP 192.168.1.116:10372 > 203.119.169.16:http ',16,,
b'her / IP / TCP 192.168.1.116:10372 > 203.119.169.16:http PA / Ra',16,,
b'her / IP / TCP 192.168.1.116:10372 > 203.119.169.16:http A / Ra',16,,
b'her / IP / TCP 192.168.1.116:10372 > 203.119.169.16:http A / Ra',16,,
b'her / IP / TCP 192.168.1.116:10372 > 203.119.169.16:http PA / Ra',16,,
b'her / IP / TCP 192.168.1.116:10372 > 203.119.169.16:http ',16,,
b'her / IP / TCP 192.168.1.116:10372 > 203.119.169.16:http PA / Ra',16,,
b'her / IP / TCP 192.168.1.116:10372 > 203.119.169.16:http A / Ra',17,,
b'her / IP / TCP 192.168.1.116:10372 > 203.119.169.16:http A / Ra',17,,
b'her / IP / TCP 192.168.1.116:10372 > 203.119.169.16:http PA / Ra',17,,
b'her / IP / TCP 192.168.1.116:10372 > 203.119.169.16:http ',17,,
b'her / IP / TCP 192.168.1.116:10372 > 203.119.169.16:http PA / Ra',17,,
b'her / IP / TCP 192.168.1.116:10372 > 203.119.169.16:http A / Ra',17,,
b'her / IP / TCP 192.168.1.116:10372 > 203.119.169.16:http A / Ra',17,,
b'her / IP / TCP 192.168.1.116:10372 > 203.119.169.16:http PA / Ra',18,,
b'her / IP / TCP 192.168.1.116:10372 > 203.119.169.16:http ',18,,
b'her / IP / TCP 192.168.1.116:10372 > 203.119.169.16:http PA / Ra',18,,
b'her / IP / TCP 192.168.1.116:10372 > 203.119.169.16:http A / Ra',18,,
b'her / IP / TCP 192.168.1.116:10372 > 203.119.169.16:http A / Ra',18,,
b'her / IP / TCP 192.168.1.116:10372 > 203.119.169.16:http PA / Ra',18,,
b'her / IP / TCP 192.168.1.116:10372 > 203.119.169.16:http ',18,,
b'her / IP / TCP 192.168.1.116:10372 > 203.119.169.16:http PA / Ra',19,,
b'her / IP / TCP 192.168.1.116:10372 > 203.119.169.16:http A / Ra',19,,
b'her / IP / TCP 192.168.1.116:10372 > 203.119.169.16:http A / Ra',19,,
b'her / IP / TCP 192.168.1.116:10372 > 203.119.169.16:http PA / Ra',19,,
b'her / IP / TCP 192.168.1.116:10372 > 203.119.169.16:http ',19,,
b'her / IP / TCP 192.168.1.116:10372 > 203.119.169.16:http PA / Ra',19,,
b'her / IP / TCP 192.168.1.116:10372 > 203.119.169.16:http A / Ra',19,,
b'her / IP / TCP 192.168.1.116:10372 > 203.119.169.16:http A / Ra',20,,
b'her / IP / TCP 192.168.1.116:10372 > 203.119.169.16:http PA / Ra',20,,
b'her / IP / TCP 192.168.1.116:10372 > 203.119.169.16:http ',20,,
b'her / IP / TCP 192.168.1.116:10372 > 203.119.169.16:http PA / Ra',20,,
b'her / IP / TCP 192.168.1.116:10372 > 203.119.169.16:http A / Ra',20,,
b'her / IP / TCP 192.168.1.116:10372 > 203.119.169.16:http A / Ra',20,,
b'her / IP / TCP 192.168.1.116:10372 > 203.119.169.16:http PA / Ra',20,,
b'her / IP / TCP 192.168.1.116:10372 > 203.119.169.16:http ',21,,
b'her / IP / TCP 192.168.1.116:10372 > 203.119.169.16:http PA / Ra',21,,
b'her / IP / TCP 192.168.1.116:10372 > 203.119.169.16:http A / Ra',21,,
b'her / IP / TCP 192.168.1.116:10372 > 203.119.169.16:http A / Ra',21,,
b'her / IP / TCP 192.168.1.116:10372 > 203.119.169.16:http PA / Ra',21,,
b'her / IP / TCP 192.168.1.116:10372 > 203.119.169.16:http ',21,,
b'her / IP / TCP 192.168.1.116:10372 > 203.119.169.16:http ',21,,
b'her / IP / TCP 192.168.1.116:10372 > 203.119.169.16:http F',22,,
b'her / IP / TCP 203.119.169.16:http > 192.168.1.116:10372 S',22,,
b'her / IP / TCP 203.119.169.16:http > 192.168.1.116:10372 ',22,,
b'her / IP / TCP 203.119.169.16:http > 192.168.1.116:10372 ',22,,
b'her / IP / TCP 203.119.169.16:http > 192.168.1.116:10372 PA / Ra',22,,
b'her / IP / TCP 203.119.169.16:http > 192.168.1.116:10372 PA / Ra',22,,
b'her / IP / TCP 203.119.169.16:http > 192.168.1.116:10372 ',22,,
b'her / IP / TCP 203.119.169.16:http > 192.168.1.116:10372 PA / Ra',23,,
b'her / IP / TCP 203.119.169.16:http > 192.168.1.116:10372 PA / Ra',23,,
b'her / IP / TCP 203.119.169.16:http > 192.168.1.116:10372 ',23,,
b'her / IP / TCP 203.119.169.16:http > 192.168.1.116:10372 PA / Ra',23,,
b'her / IP / TCP 203.119.169.16:http > 192.168.1.116:10372 PA / Ra',23,,
b'her / IP / TCP 203.119.169.16:http > 192.168.1.116:10372 ',23,,
b'her / IP / TCP 203.119.169.16:http > 192.168.1.116:10372 PA / Ra',23,,
b'her / IP / TCP 203.119.169.16:http > 192.168.1.116:10372 PA / Ra',24,,
b'her / IP / TCP 203.119.169.16:http > 192.168.1.116:10372 ',24,,
b'her / IP / TCP 203.119.169.16:http > 192.168.1.116:10372 PA / Ra',24,,
b'her / IP / TCP 203.119.169.16:http > 192.168.1.116:10372 PA / Ra',24,,
b'her / IP / TCP 203.119.169.16:http > 192.168.1.116:10372 ',24,,
b'her / IP / TCP 203.119.169.16:http > 192.168.1.116:10372 ',24,,
b'her / IP / TCP 203.119.169.16:http > 192.168.1.116:10372 PA / Ra',24,,
b'her / IP / TCP 203.119.169.16:http > 192.168.1.116:10372 PA / Ra',25,,
b'her / IP / TCP 203.119.169.16:http > 192.168.1.116:10372 ',25,,
b'her / IP / TCP 203.119.169.16:http > 192.168.1.116:10372 PA / Ra',25,,
b'her / IP / TCP 203.119.169.16:http > 192.168.1.116:10372 PA / Ra',25,,
b'her / IP / TCP 203.119.169.16:http > 192.168.1.116:10372 ',25,,
b'her / IP / TCP 203.119.169.16:http > 192.168.1.116:10372 PA / Ra',25,,
b'her / IP / TCP 203.119.169.16:http > 192.168.1.116:10372 PA / Ra',25,,
b'her / IP / TCP 203.119.169.16:http > 192.168.1.116:10372 ',26,,
b'her / IP / TCP 203.119.169.16:http > 192.168.1.116:10372 ',26,,
b'her / IP / TCP 203.119.169.16:http > 192.168.1.116:10372 PA / Ra',26,,
b'her / IP / TCP 203.119.169.16:http > 192.168.1.116:10372 PA / Ra',26,,
b'her / IP / TCP 203.119.169.16:http > 192.168.1.116:10372 ',26,,
b'her / IP / TCP 203.119.169.16:http > 192.168.1.116:10372 PA / Ra',26,,
b'her / IP / TCP 203.119.169.16:http > 192.168.1.116:10372 PA / Ra',26,,
b'her / IP / TCP 203.119.169.16:http > 192.168.1.116:10372 ',27,,
b'her / IP / TCP 203.119.169.16:http > 192.168.1.116:10372 PA / Ra',27,,
b'her / IP / TCP 203.119.169.16:http > 192.168.1.116:10372 PA / Ra',27,,
b'her / IP / TCP 203.119.169.16:http > 192.168.1.116:10372 ',27,,
b'her / IP / TCP 203.119.169.16:http > 192.168.1.116:10372 PA / Ra',27,,
b'her / IP / TCP 203.119.169.16:http > 192.168.1.116:10372 PA / Ra',27,,
b'her / IP / TCP 203.119.169.16:http > 192.168.1.116:10372 ',27,,
b'her / IP / TCP 203.119.169.16:http > 192.168.1.116:10372 PA / Ra',28,,
b'her / IP / TCP 203.119.169.16:http > 192.168.1.116:10372 PA / Ra',28,,
b'her / IP / TCP 203.119.169.16:http > 192.168.1.116:10372 ',28,,
b'her / IP / TCP 203.119.169.16:http > 192.168.1.116:10372 PA / Ra',28,,
b'her / IP / TCP 203.119.169.16:http > 192.168.1.116:10372 PA / Ra',28,,
b'her / IP / TCP 203.119.169.16:http > 192.168.1.116:10372 ',28,,
b'her / IP / TCP 203.119.169.16:http > 192.168.1.116:10372 PA / Ra',28,,
b'her / IP / TCP 203.119.169.16:http > 192.168.1.116:10372 PA / Ra',29,,
b'her / IP / TCP 203.119.169.16:http > 192.168.1.116:10372 ',29,,
b'her / IP / TCP 203.119.169.16:http > 192.168.1.116:10372 PA / Ra',29,,
b'her / IP / TCP 203.119.169.16:http > 192.168.1.116:10372 PA / Ra',29,,
b'her / IP / TCP 203.119.169.16:http > 192.168.1.116:10372 F',29,,
b'her / IP / TCP 203.119.169.16:http > 192.168.1.116:10372 ',29,,
b'her / IP / TCP 192.168.1.116:10368 > 142.251.43.10:https ',30,,
b'her / IP / TCP 192.168.1.116:10368 > 142.251.43.10:https ',30,,
b'her / IP / TCP 192.168.1.116:10368 > 142.251.43.10:https ',30,,
b'her / IP / TCP 192.168.1.116:10373 > 104.208.16.90:https ',31,,
b'her / IP / TCP 192.168.1.116:10373 > 104.208.16.90:https ',31,,
b'her / IP / TCP 192.168.1.116:10373 > 104.208.16.90:https PA / Ra',31,,
b'her / IP / TCP 192.168.1.116:10373 > 104.208.16.90:https ',31,,
b'her / IP / TCP 192.168.1.116:10373 > 104.208.16.90:https PA / Ra',31,,
b'her / IP / TCP 192.168.1.116:10373 > 104.208.16.90:https PA / Ra',31,,
b'her / IP / TCP 192.168.1.116:10373 > 104.208.16.90:https A / Ra',32,,
b'her / IP / TCP 192.168.1.116:10373 > 104.208.16.90:https PA / Ra',32,,
b'her / IP / TCP 192.168.1.116:10373 > 104.208.16.90:https F',32,,
b'her / IP / TCP 192.168.1.116:10373 > 104.208.16.90:https ',32,,
b'her / IP / TCP 104.208.16.90:https > 192.168.1.116:10373 S',33,,
b'her / IP / TCP 104.208.16.90:https > 192.168.1.116:10373 A / Ra',33,,
b'her / IP / TCP 104.208.16.90:https > 192.168.1.116:10373 A / Ra',33,,
b'her / IP / TCP 104.208.16.90:https > 192.168.1.116:10373 A / Ra',33,,
b'her / IP / TCP 104.208.16.90:https > 192.168.1.116:10373 PA / Ra',33,,
b'her / IP / TCP 104.208.16.90:https > 192.168.1.116:10373 PA / Ra',33,,
b'her / IP / TCP 104.208.16.90:https > 192.168.1.116:10373 ',34,,
b'her / IP / TCP 104.208.16.90:https > 192.168.1.116:10373 PA / Ra',34,,
b'her / IP / TCP 104.208.16.90:https > 192.168.1.116:10373 F',34,,
b'her / IP / TCP 13.107.5.80:https > 192.168.1.116:10223 R',35,,
b'her / IP / TCP 221.194.154.216:https > 192.168.1.116:10249 PA / Ra',36,,
b'her / IP / TCP 221.194.154.216:https > 192.168.1.116:10249 F',36,,
b'her / IP / TCP 221.194.154.216:https > 192.168.1.116:10249 ',36,,
b'her / IP / TCP 192.168.1.116:10249 > 221.194.154.216:https ',37,,
b'her / IP / TCP 192.168.1.116:10249 > 221.194.154.216:https F',37,,
b'her / IP / TCP 192.168.1.116:10249 > 221.194.154.216:https F',37,,
b'her / IP / UDP 192.168.1.1:1024 > 255.255.255.255:5001 / Ra',38,,
b'her / IP / UDP 192.168.1.1:1024 > 255.255.255.255:5001 / Ra',38,,
b'her / IP / UDP 192.168.1.1:1024 > 255.255.255.255:5001 / Ra',38,,
b'her / IP / UDP 192.168.1.1:1024 > 255.255.255.255:5001 / Ra',38,,
b'her / IP / UDP 192.168.1.1:1024 > 255.255.255.255:5001 / Ra',38,,
b'her / IP / TCP 221.194.154.216:https > 192.168.1.116:10250 PA / Ra',39,,
b'her / IP / TCP 221.194.154.216:https > 192.168.1.116:10250 F',39,,
b'her / IP / TCP 221.194.154.216:https > 192.168.1.116:10250 ',39,,
b'her / IP / TCP 192.168.1.116:10250 > 221.194.154.216:https ',40,,
b'her / IP / TCP 192.168.1.116:10250 > 221.194.154.216:https F',40,,
b'her / IP / TCP 69.16.175.10:http > 192.168.1.116:10360 F',41,,
b'her / IP / TCP 192.168.1.116:10360 > 69.16.175.10:http ',42,,
b'her / IP / TCP 192.168.1.116:10360 > 69.16.175.10:http A / Ra',42,,
b'her / IP / TCP 192.168.1.116:10360 > 69.16.175.10:http F',42,,
b'her / IP / TCP 192.168.1.116:10360 > 69.16.175.10:http F',42,,
b'her / IP / TCP 192.168.1.116:10360 > 69.16.175.10:http F',42,,
b'her / IP / TCP 192.168.1.116:10360 > 69.16.175.10:http F',42,,
b'her / IP / TCP 192.168.1.116:10360 > 69.16.175.10:http F',43,,
b'her / IP / TCP 192.168.1.116:10360 > 69.16.175.10:http F',43,,
b'her / IP / TCP 202.89.233.96:https > 192.168.1.116:10247 R',44,,
b'her / IP / TCP 192.168.1.116:10213 > 220.181.174.226:https A / Ra',45,,
b'her / IP / TCP 192.168.1.116:10213 > 220.181.174.226:https A / Ra',45,,
b'her / IP / TCP 220.181.174.226:https > 192.168.1.116:10213 ',46,,
b'her / IP / TCP 220.181.174.226:https > 192.168.1.116:10213 ',46,,
b'her / IP / TCP 204.79.197.203:https > 192.168.1.116:10246 R',47,,
b'her / IP / UDP 192.168.1.1:ssdp > 239.255.255.250:ssdp / Ra',48,,
b'her / IP / UDP 192.168.1.1:ssdp > 239.255.255.250:ssdp / Ra',48,,
b'her / IP / UDP 192.168.1.1:ssdp > 239.255.255.250:ssdp / Ra',48,,
b'her / IP / UDP 192.168.1.1:ssdp > 239.255.255.250:ssdp / Ra',48,,
b'her / IP / UDP 192.168.1.1:ssdp > 239.255.255.250:ssdp / Ra',48,,
b'her / IP / UDP 192.168.1.1:ssdp > 239.255.255.250:ssdp / Ra',48,,
b'her / IP / UDP 192.168.1.1:ssdp > 239.255.255.250:ssdp / Ra',49,,
b'her / IP / UDP 192.168.1.1:ssdp > 239.255.255.250:ssdp / Ra',49,,
b'her / IP / UDP 192.168.1.1:ssdp > 239.255.255.250:ssdp / Ra',49,,
b'her / IP / UDP 192.168.1.1:ssdp > 239.255.255.250:ssdp / Ra',49,,
b'her / IP / UDP 192.168.1.1:ssdp > 239.255.255.250:ssdp / Ra',49,,
b'her / IP / UDP 192.168.1.1:ssdp > 239.255.255.250:ssdp / Ra',49,,
b'her / IP / UDP 192.168.1.1:ssdp > 239.255.255.250:ssdp / Ra',49,,
b'her / IP / UDP 192.168.1.1:ssdp > 239.255.255.250:ssdp / Ra',50,,
b'her / IP / UDP 192.168.1.1:ssdp > 239.255.255.250:ssdp / Ra',50,,
b'her / IP / UDP 192.168.1.1:ssdp > 239.255.255.250:ssdp / Ra',50,,
b'her / IP / UDP 192.168.1.1:ssdp > 239.255.255.250:ssdp / Ra',50,,
b'her / IP / UDP 192.168.1.1:ssdp > 239.255.255.250:ssdp / Ra',50,,
b'her / IP / UDP 192.168.1.1:ssdp > 239.255.255.250:ssdp / Ra',50,,
b'her / IP / UDP 192.168.1.1:ssdp > 239.255.255.250:ssdp / Ra',50,,
b'her / IP / UDP 192.168.1.1:ssdp > 239.255.255.250:ssdp / Ra',51,,
b'her / IP / UDP 192.168.1.1:ssdp > 239.255.255.250:ssdp / Ra',51,,
b'her / IP / UDP 192.168.1.1:ssdp > 239.255.255.250:ssdp / Ra',51,,
b'her / IP / UDP 192.168.1.1:ssdp > 239.255.255.250:ssdp / Ra',51,,
b'her / IP / UDP 192.168.1.1:ssdp > 239.255.255.250:ssdp / Ra',51,,
b'her / IP / UDP 192.168.1.1:ssdp > 239.255.255.250:ssdp / Ra',51,,
b'her / IP / UDP 192.168.1.1:ssdp > 239.255.255.250:ssdp / Ra',51,,
b'her / IP / UDP 192.168.1.1:ssdp > 239.255.255.250:ssdp / Ra',52,,
b'her / IP / UDP 192.168.1.1:ssdp > 239.255.255.250:ssdp / Ra',52,,
b'her / IP / UDP 192.168.1.1:ssdp > 239.255.255.250:ssdp / Ra',52,,
b'her / IP / TCP 192.168.1.116:10348 > 13.107.21.239:https A / Ra',53,,
b'her / IP / TCP 192.168.1.116:10347 > 223.119.232.83:https A / Ra',54,,
b'her / IP / TCP 192.168.1.116:10347 > 223.119.232.83:https A / Ra',54,,
b'her / IP / TCP 13.107.21.239:https > 192.168.1.116:10348 ',55,,
b'her / IP / TCP 13.107.21.239:https > 192.168.1.116:10348 R',55,,
b'her / IP / TCP 223.119.232.83:https > 192.168.1.116:10347 ',56,,
b'her / IP / TCP 223.119.232.83:https > 192.168.1.116:10347 ',56,,
b'her / IP / TCP 192.168.1.116:10211 > 13.107.21.239:https A / Ra',57,,
b'her / IP / TCP 13.107.21.239:https > 192.168.1.116:10211 ',58,,
b'her / IP / TCP 13.107.21.239:https > 192.168.1.116:10211 R',58,,
b'her / IP / TCP 192.168.1.116:12699 > 54.185.31.151:https PA / Ra',59,,
b'her / IP / TCP 192.168.1.116:12699 > 54.185.31.151:https ',59,,
b'her / IP / TCP 192.168.1.116:12699 > 54.185.31.151:https PA / Ra',59,,
b'her / IP / TCP 192.168.1.116:12699 > 54.185.31.151:https ',59,,
b'her / IP / TCP 192.168.1.116:12699 > 54.185.31.151:https PA / Ra',59,,
b'her / IP / TCP 192.168.1.116:12699 > 54.185.31.151:https ',59,,
b'her / IP / TCP 54.185.31.151:https > 192.168.1.116:12699 PA / Ra',60,,
b'her / IP / TCP 54.185.31.151:https > 192.168.1.116:12699 PA / Ra',60,,
b'her / IP / TCP 54.185.31.151:https > 192.168.1.116:12699 PA / Ra',60,,
b'her / IP / TCP 192.168.1.116:10238 > 23.200.74.26:https A / Ra',61,,
b'her / IP / TCP 192.168.1.116:10238 > 23.200.74.26:https A / Ra',61,,
b'her / IP / TCP 23.200.74.26:https > 192.168.1.116:10238 ',62,,
b'her / IP / TCP 23.200.74.26:https > 192.168.1.116:10238 ',62,,
b'her / IP / TCP 192.168.1.116:10222 > 13.107.21.239:https PA / Ra',63,,
b'her / IP / TCP 192.168.1.116:10222 > 13.107.21.239:https PA / Ra',63,,
b'her / IP / TCP 192.168.1.116:10222 > 13.107.21.239:https PA / Ra',63,,
b'her / IP / TCP 192.168.1.116:10222 > 13.107.21.239:https ',63,,
b'her / IP / TCP 192.168.1.116:10222 > 13.107.21.239:https ',63,,
b'her / IP / TCP 192.168.1.116:10222 > 13.107.21.239:https PA / Ra',63,,
b'her / IP / TCP 192.168.1.116:10222 > 13.107.21.239:https A / Ra',64,,
b'her / IP / TCP 13.107.21.239:https > 192.168.1.116:10222 ',64,,
b'her / IP / TCP 13.107.21.239:https > 192.168.1.116:10222 ',64,,
b'her / IP / TCP 13.107.21.239:https > 192.168.1.116:10222 PA / Ra',64,,
b'her / IP / TCP 13.107.21.239:https > 192.168.1.116:10222 PA / Ra',64,,
b'her / IP / TCP 13.107.21.239:https > 192.168.1.116:10222 PA / Ra',64,,
b'her / IP / TCP 13.107.21.239:https > 192.168.1.116:10222 PA / Ra',64,,
b'her / IP / TCP 13.107.21.239:https > 192.168.1.116:10222 ',65,,
b'her / IP / TCP 13.107.21.239:https > 192.168.1.116:10222 ',65,,
b'her / IP / TCP 192.168.1.116:10357 > 202.89.233.100:https A / Ra',66,,
b'her / IP / TCP 202.89.233.100:https > 192.168.1.116:10357 ',67,,
b'her / IP / TCP 192.168.1.116:10361 > 119.28.20.150:https A / Ra',68,,
b'her / IP / TCP 192.168.1.116:10361 > 119.28.20.150:https ',68,,
b'her / IP / TCP 119.28.20.150:https > 192.168.1.116:10361 ',69,,
b'her / IP / TCP 119.28.20.150:https > 192.168.1.116:10361 PA / Ra',69,,
b'her / IP / TCP 119.28.20.150:https > 192.168.1.116:10361 F',69,,
b'her / IP / TCP 192.168.1.116:10376 > 202.112.14.6:https ',70,,
b'her / IP / TCP 192.168.1.116:10376 > 202.112.14.6:https ',70,,
b'her / IP / TCP 192.168.1.116:10376 > 202.112.14.6:https PA / Ra',70,,
b'her / IP / TCP 192.168.1.116:10376 > 202.112.14.6:https ',70,,
b'her / IP / TCP 192.168.1.116:10376 > 202.112.14.6:https PA / Ra',70,,
b'her / IP / TCP 192.168.1.116:10376 > 202.112.14.6:https ',70,,
b'her / IP / TCP 192.168.1.116:10376 > 202.112.14.6:https PA / Ra',71,,
b'her / IP / TCP 192.168.1.116:10376 > 202.112.14.6:https ',71,,
b'her / IP / TCP 192.168.1.116:10376 > 202.112.14.6:https ',71,,
b'her / IP / TCP 202.112.14.6:https > 192.168.1.116:10376 S',72,,
b'her / IP / TCP 202.112.14.6:https > 192.168.1.116:10376 ',72,,
b'her / IP / TCP 202.112.14.6:https > 192.168.1.116:10376 A / Ra',72,,
b'her / IP / TCP 202.112.14.6:https > 192.168.1.116:10376 A / Ra',72,,
b'her / IP / TCP 202.112.14.6:https > 192.168.1.116:10376 PA / Ra',72,,
b'her / IP / TCP 202.112.14.6:https > 192.168.1.116:10376 PA / Ra',72,,
b'her / IP / TCP 202.112.14.6:https > 192.168.1.116:10376 PA / Ra',73,,
b'her / IP / TCP 202.112.14.6:https > 192.168.1.116:10376 A / Ra',73,,
b'her / IP / TCP 202.112.14.6:https > 192.168.1.116:10376 A / Ra',73,,
b'her / IP / TCP 202.112.14.6:https > 192.168.1.116:10376 PA / Ra',73,,
b'her / IP / TCP 202.112.14.6:https > 192.168.1.116:10376 PA / Ra',73,,
b'her / IP / TCP 202.112.14.6:https > 192.168.1.116:10376 F',73,,
b'her / IP / TCP 192.168.1.116:7051 > 202.112.14.6:https PA / Ra',74,,
b'her / IP / TCP 192.168.1.116:7051 > 202.112.14.6:https R',74,,
b'her / IP / TCP 192.168.1.116:10377 > 202.112.14.6:https ',75,,
b'her / IP / TCP 192.168.1.116:10377 > 202.112.14.6:https ',75,,
b'her / IP / TCP 192.168.1.116:10377 > 202.112.14.6:https PA / Ra',75,,
b'her / IP / TCP 192.168.1.116:10377 > 202.112.14.6:https ',75,,
b'her / IP / TCP 192.168.1.116:10377 > 202.112.14.6:https PA / Ra',75,,
b'her / IP / TCP 192.168.1.116:10377 > 202.112.14.6:https PA / Ra',75,,
b'her / IP / TCP 192.168.1.116:10377 > 202.112.14.6:https ',76,,
b'her / IP / TCP 192.168.1.116:10377 > 202.112.14.6:https ',76,,
b'her / IP / TCP 202.112.14.6:https > 192.168.1.116:10377 S',77,,
b'her / IP / TCP 202.112.14.6:https > 192.168.1.116:10377 ',77,,
b'her / IP / TCP 202.112.14.6:https > 192.168.1.116:10377 A / Ra',77,,
b'her / IP / TCP 202.112.14.6:https > 192.168.1.116:10377 A / Ra',77,,
b'her / IP / TCP 202.112.14.6:https > 192.168.1.116:10377 PA / Ra',77,,
b'her / IP / TCP 202.112.14.6:https > 192.168.1.116:10377 PA / Ra',77,,
b'her / IP / TCP 202.112.14.6:https > 192.168.1.116:10377 PA / Ra',78,,
b'her / IP / TCP 202.112.14.6:https > 192.168.1.116:10377 A / Ra',78,,
b'her / IP / TCP 202.112.14.6:https > 192.168.1.116:10377 A / Ra',78,,
b'her / IP / TCP 202.112.14.6:https > 192.168.1.116:10377 A / Ra',78,,
b'her / IP / TCP 202.112.14.6:https > 192.168.1.116:10377 A / Ra',78,,
b'her / IP / TCP 202.112.14.6:https > 192.168.1.116:10377 A / Ra',78,,
b'her / IP / TCP 202.112.14.6:https > 192.168.1.116:10377 A / Ra',78,,
b'her / IP / TCP 202.112.14.6:https > 192.168.1.116:10377 A / Ra',79,,
b'her / IP / TCP 202.112.14.6:https > 192.168.1.116:10377 A / Ra',79,,
b'her / IP / TCP 202.112.14.6:https > 192.168.1.116:10377 A / Ra',79,,
b'her / IP / TCP 202.112.14.6:https > 192.168.1.116:10377 PA / Ra',79,,
b'her / IP / TCP 202.112.14.6:https > 192.168.1.116:10377 PA / Ra',79,,
b'her / IP / TCP 202.112.14.6:https > 192.168.1.116:10377 F',79,,
"b'her / IP / UDP / DNS Qry ""b\'www.msftconnecttest.com.\'""'",80,,
"b'her / IP / UDP / DNS Qry ""b\'www.msftconnecttest.com.\'""'",80,,
"b'her / IP / UDP / DNS Qry ""b\'ipv6.msftconnecttest.com.\'""'",80,,
"b'her / IP / UDP / DNS Qry ""b\'ipv6.msftconnecttest.com.\'""'",80,,
"b'her / IP / UDP / DNS Ans ""b\'ncsi-geo.trafficmanager.net.\'""'",81,,
"b'her / IP / UDP / DNS Ans ""b\'ncsi-geo.trafficmanager.net.\'""'",81,,
"b'her / IP / UDP / DNS Ans ""b\'v6ncsi.msedge.net.\'""'",81,,
"b'her / IP / UDP / DNS Ans ""b\'v6ncsi.msedge.net.\'""'",81,,
b'her / IP / TCP 192.168.1.116:10378 > 23.203.135.114:http ',82,,
b'her / IP / TCP 192.168.1.116:10378 > 23.203.135.114:http ',82,,
b'her / IP / TCP 192.168.1.116:10378 > 23.203.135.114:http PA / Ra',82,,
b'her / IP / TCP 192.168.1.116:10378 > 23.203.135.114:http ',82,,
b'her / IP / TCP 192.168.1.116:10378 > 23.203.135.114:http F',82,,
b'her / IP / TCP 192.168.1.116:10378 > 23.203.135.114:http F',82,,
b'her / IP / TCP 192.168.1.116:10378 > 23.203.135.114:http F',83,,
b'her / IP / TCP 192.168.1.116:10378 > 23.203.135.114:http F',83,,
b'her / IP / TCP 192.168.1.116:10378 > 23.203.135.114:http F',83,,
b'her / IP / TCP 192.168.1.116:10378 > 23.203.135.114:http F',83,,
b'her / IP / TCP 192.168.1.116:10378 > 23.203.135.114:http R',83,,
b'her / IP / TCP 23.203.135.114:http > 192.168.1.116:10378 S',84,,
b'her / IP / TCP 23.203.135.114:http > 192.168.1.116:10378 ',84,,
b'her / IP / TCP 23.203.135.114:http > 192.168.1.116:10378 PA / Ra',84,,
b'her / IP / TCP 23.203.135.114:http > 192.168.1.116:10378 F',84,,
b'her / IP / TCP 192.168.1.116:10379 > 23.203.135.81:http ',85,,
b'her / IP / TCP 192.168.1.116:10379 > 23.203.135.81:http ',85,,
b'her / IP / TCP 192.168.1.116:10379 > 23.203.135.81:http PA / Ra',85,,
b'her / IP / TCP 192.168.1.116:10379 > 23.203.135.81:http ',85,,
b'her / IP / TCP 192.168.1.116:10379 > 23.203.135.81:http F',85,,
b'her / IP / TCP 192.168.1.116:10379 > 23.203.135.81:http F',85,,
b'her / IP / TCP 192.168.1.116:10379 > 23.203.135.81:http F',86,,
b'her / IP / TCP 192.168.1.116:10379 > 23.203.135.81:http F',86,,
b'her / IP / TCP 192.168.1.116:10379 > 23.203.135.81:http F',86,,
b'her / IP / TCP 192.168.1.116:10379 > 23.203.135.81:http F',86,,
b'her / IP / TCP 192.168.1.116:10379 > 23.203.135.81:http R',86,,
b'her / IP / TCP 23.203.135.81:http > 192.168.1.116:10379 S',87,,
b'her / IP / TCP 23.203.135.81:http > 192.168.1.116:10379 ',87,,
b'her / IP / TCP 23.203.135.81:http > 192.168.1.116:10379 PA / Ra',87,,
b'her / IP / TCP 23.203.135.81:http > 192.168.1.116:10379 F',87,,
b'her / IP / UDP 192.168.192.1:netbios_ns > 192.168.192.2:netbios_ns / NBNSHeader / Ra',88,,
b'her / IP / UDP 192.168.192.1:netbios_ns > 192.168.192.2:netbios_ns / NBNSHeader / Ra',88,,
b'her / IP / UDP 192.168.192.1:netbios_ns > 192.168.192.2:netbios_ns / NBNSHeader / Ra',88,,
b'her / IP / UDP 192.168.192.1:netbios_ns > 192.168.192.2:netbios_ns / NBNSHeader / Ra',88,,
b'her / IP / UDP 192.168.192.1:netbios_ns > 192.168.192.2:netbios_ns / NBNSHeader / Ra',88,,
b'her / IP / UDP 192.168.192.1:netbios_ns > 192.168.192.2:netbios_ns / NBNSHeader / Ra',88,,
b'her / IP / UDP 192.168.192.1:netbios_ns > 192.168.192.2:netbios_ns / NBNSHeader / Ra',89,,
b'her / IP / UDP 192.168.192.1:netbios_ns > 192.168.192.2:netbios_ns / NBNSHeader / Ra',89,,
