data,flowmember,label,classes
b'her / IP / TCP 20.195.114.44:https > 192.168.0.106:7328 S',1,,
b'her / IP / TCP 20.195.114.44:https > 192.168.0.106:7328 A / Ra',1,,
b'her / IP / TCP 20.195.114.44:https > 192.168.0.106:7328 A / Ra',1,,
b'her / IP / TCP 20.195.114.44:https > 192.168.0.106:7328 A / Ra',1,,
b'her / IP / TCP 20.195.114.44:https > 192.168.0.106:7328 A / Ra',1,,
b'her / IP / TCP 20.195.114.44:https > 192.168.0.106:7328 PA / Ra',1,,
b'her / IP / TCP 20.195.114.44:https > 192.168.0.106:7328 A / Ra',2,,
b'her / IP / TCP 20.195.114.44:https > 192.168.0.106:7328 PA / Ra',2,,
b'her / IP / TCP 20.195.114.44:https > 192.168.0.106:7328 ',2,,
b'her / IP / TCP 20.195.114.44:https > 192.168.0.106:7328 FPA / Ra',2,,
b'her / IP / TCP 20.195.114.44:https > 192.168.0.106:7328 A / Ra',2,,
b'her / IP / TCP 192.168.0.106:7328 > 20.195.114.44:https ',3,,
b'her / IP / TCP 192.168.0.106:7328 > 20.195.114.44:https PA / Ra',3,,
b'her / IP / TCP 192.168.0.106:7328 > 20.195.114.44:https ',3,,
b'her / IP / TCP 192.168.0.106:7328 > 20.195.114.44:https ',3,,
b'her / IP / TCP 192.168.0.106:7328 > 20.195.114.44:https ',3,,
b'her / IP / TCP 192.168.0.106:7328 > 20.195.114.44:https ',3,,
b'her / IP / TCP 192.168.0.106:7328 > 20.195.114.44:https PA / Ra',4,,
b'her / IP / TCP 192.168.0.106:7328 > 20.195.114.44:https PA / Ra',4,,
b'her / IP / TCP 192.168.0.106:7328 > 20.195.114.44:https A / Ra',4,,
b'her / IP / TCP 192.168.0.106:7328 > 20.195.114.44:https PA / Ra',4,,
b'her / IP / TCP 192.168.0.106:7328 > 20.195.114.44:https ',4,,
b'her / IP / TCP 192.168.0.106:7328 > 20.195.114.44:https ',4,,
b'her / IP / TCP 192.168.0.106:7328 > 20.195.114.44:https F',4,,
b'her / IP / TCP 192.168.0.106:7328 > 20.195.114.44:https F',5,,
b'her / IP / TCP 192.168.0.106:7328 > 20.195.114.44:https F',5,,
b'her / IP / TCP 192.168.0.106:7328 > 20.195.114.44:https F',5,,
b'her / IP / TCP 69.16.175.10:http > 192.168.0.106:7331 S',6,,
b'her / IP / TCP 192.168.0.106:7331 > 69.16.175.10:http ',7,,
b'her / IP / TCP 69.16.175.10:http > 192.168.0.106:7305 ',8,,
b'her / IP / TCP 192.168.0.106:7327 > 23.195.91.210:http F',9,,
b'her / IP / TCP 192.168.0.106:7326 > 23.195.91.210:http F',10,,
b'her / IP / TCP 23.195.91.210:http > 192.168.0.106:7327 ',11,,
b'her / IP / TCP 23.195.91.210:http > 192.168.0.106:7326 ',12,,
b'her / IP / TCP 192.168.0.106:7332 > 116.132.235.228:http ',13,,
b'her / IP / TCP 192.168.0.106:7332 > 116.132.235.228:http ',13,,
b'her / IP / TCP 192.168.0.106:7332 > 116.132.235.228:http PA / Ra',13,,
b'her / IP / TCP 192.168.0.106:7332 > 116.132.235.228:http A / Ra',13,,
b'her / IP / TCP 192.168.0.106:7332 > 116.132.235.228:http A / Ra',13,,
b'her / IP / TCP 192.168.0.106:7332 > 116.132.235.228:http PA / Ra',13,,
b'her / IP / TCP 192.168.0.106:7332 > 116.132.235.228:http ',14,,
b'her / IP / TCP 192.168.0.106:7332 > 116.132.235.228:http F',14,,
b'her / IP / TCP 116.132.235.228:http > 192.168.0.106:7332 S',15,,
b'her / IP / TCP 116.132.235.228:http > 192.168.0.106:7332 ',15,,
b'her / IP / TCP 116.132.235.228:http > 192.168.0.106:7332 ',15,,
b'her / IP / TCP 116.132.235.228:http > 192.168.0.106:7332 ',15,,
b'her / IP / TCP 116.132.235.228:http > 192.168.0.106:7332 PA / Ra',15,,
b'her / IP / TCP 116.132.235.228:http > 192.168.0.106:7332 F',15,,
b'her / IP / TCP 116.132.235.228:http > 192.168.0.106:7332 ',16,,
b'her / IP / TCP 192.168.0.106:7120 > 40.74.98.192:https PA / Ra',16,,
b'her / IP / TCP 192.168.0.106:7120 > 40.74.98.192:https A / Ra',16,,
b'her / IP / TCP 192.168.0.106:7120 > 40.74.98.192:https PA / Ra',16,,
b'her / IP / TCP 192.168.0.106:7120 > 40.74.98.192:https ',16,,
b'her / IP / TCP 192.168.0.106:7120 > 40.74.98.192:https PA / Ra',16,,
b'her / IP / TCP 40.74.98.192:https > 192.168.0.106:7120 ',17,,
b'her / IP / TCP 40.74.98.192:https > 192.168.0.106:7120 A / Paddin',17,,
b'her / IP / TCP 40.74.98.192:https > 192.168.0.106:7120 PA / Ra',17,,
b'her / IP / TCP 40.74.98.192:https > 192.168.0.106:7120 PA / Ra',17,,
b'her / IP / TCP 40.74.98.192:https > 192.168.0.106:7120 A / Paddin',17,,
b'her / IP / TCP 192.168.0.106:7319 > 20.195.114.44:https F',18,,
b'her / IP / TCP 192.168.0.106:7333 > 116.132.235.228:http ',19,,
b'her / IP / TCP 192.168.0.106:7333 > 116.132.235.228:http ',19,,
b'her / IP / TCP 192.168.0.106:7333 > 116.132.235.228:http PA / Ra',19,,
b'her / IP / TCP 192.168.0.106:7333 > 116.132.235.228:http A / Ra',19,,
b'her / IP / TCP 192.168.0.106:7333 > 116.132.235.228:http A / Ra',19,,
b'her / IP / TCP 192.168.0.106:7333 > 116.132.235.228:http PA / Ra',19,,
b'her / IP / TCP 192.168.0.106:7333 > 116.132.235.228:http ',20,,
b'her / IP / TCP 192.168.0.106:7333 > 116.132.235.228:http F',20,,
b'her / IP / TCP 192.168.0.106:7333 > 116.132.235.228:http F',20,,
b'her / IP / TCP 192.168.0.106:7333 > 116.132.235.228:http F',20,,
b'her / IP / TCP 192.168.0.106:7334 > 110.242.68.3:http ',21,,
b'her / IP / TCP 192.168.0.106:7334 > 110.242.68.3:http ',21,,
b'her / IP / TCP 192.168.0.106:7334 > 110.242.68.3:http F',21,,
b'her / IP / TCP 192.168.0.106:7334 > 110.242.68.3:http ',21,,
b'her / IP / TCP 116.132.235.228:http > 192.168.0.106:7333 S',22,,
b'her / IP / TCP 116.132.235.228:http > 192.168.0.106:7333 ',22,,
b'her / IP / TCP 116.132.235.228:http > 192.168.0.106:7333 ',22,,
b'her / IP / TCP 116.132.235.228:http > 192.168.0.106:7333 ',22,,
b'her / IP / TCP 116.132.235.228:http > 192.168.0.106:7333 PA / Ra',22,,
b'her / IP / TCP 116.132.235.228:http > 192.168.0.106:7333 F',22,,
b'her / IP / TCP 110.242.68.3:http > 192.168.0.106:7334 S',23,,
b'her / IP / TCP 110.242.68.3:http > 192.168.0.106:7334 ',23,,
b'her / IP / TCP 110.242.68.3:http > 192.168.0.106:7334 F',23,,
"b'her / IP / UDP / DNS Qry ""b\'ntp.msn.cn.\'""'",24,,
"b'her / IP / UDP / DNS Ans ""b\'msn-cn.a-0032.a-msedge.net.\'""'",25,,
"b'her / IP / UDP / DNS Qry ""b\'ntp.msn.cn.\'""'",26,,
"b'her / IP / UDP / DNS Qry ""b\'ntp.msn.cn.\'""'",27,,
"b'her / IP / UDP / DNS Ans ""202.89.233.96""'",28,,
"b'her / IP / UDP / DNS Ans ""b\'msn-cn.a-0032.a-msedge.net.\'""'",29,,
b'her / IP / TCP 192.168.0.106:7335 > 202.89.233.96:https ',30,,
b'her / IP / TCP 192.168.0.106:7335 > 202.89.233.96:https ',30,,
b'her / IP / TCP 192.168.0.106:7335 > 202.89.233.96:https PA / Ra',30,,
b'her / IP / TCP 192.168.0.106:7335 > 202.89.233.96:https ',30,,
b'her / IP / TCP 192.168.0.106:7335 > 202.89.233.96:https PA / Ra',30,,
b'her / IP / TCP 192.168.0.106:7335 > 202.89.233.96:https PA / Ra',30,,
b'her / IP / TCP 192.168.0.106:7335 > 202.89.233.96:https A / Ra',31,,
b'her / IP / TCP 192.168.0.106:7335 > 202.89.233.96:https A / Ra',31,,
b'her / IP / TCP 192.168.0.106:7335 > 202.89.233.96:https A / Ra',31,,
b'her / IP / TCP 192.168.0.106:7335 > 202.89.233.96:https PA / Ra',31,,
b'her / IP / TCP 192.168.0.106:7335 > 202.89.233.96:https ',31,,
b'her / IP / TCP 192.168.0.106:7335 > 202.89.233.96:https PA / Ra',31,,
b'her / IP / TCP 192.168.0.106:7335 > 202.89.233.96:https ',31,,
b'her / IP / TCP 192.168.0.106:7335 > 202.89.233.96:https ',32,,
b'her / IP / TCP 192.168.0.106:7335 > 202.89.233.96:https ',32,,
b'her / IP / TCP 192.168.0.106:7335 > 202.89.233.96:https ',32,,
b'her / IP / TCP 192.168.0.106:7335 > 202.89.233.96:https ',32,,
b'her / IP / TCP 192.168.0.106:7335 > 202.89.233.96:https ',32,,
b'her / IP / TCP 192.168.0.106:7335 > 202.89.233.96:https ',32,,
b'her / IP / TCP 202.89.233.96:https > 192.168.0.106:7335 S',33,,
b'her / IP / TCP 202.89.233.96:https > 192.168.0.106:7335 ',33,,
b'her / IP / TCP 202.89.233.96:https > 192.168.0.106:7335 A / Ra',33,,
b'her / IP / TCP 202.89.233.96:https > 192.168.0.106:7335 A / Ra',33,,
b'her / IP / TCP 202.89.233.96:https > 192.168.0.106:7335 A / Ra',33,,
b'her / IP / TCP 202.89.233.96:https > 192.168.0.106:7335 A / Ra',33,,
b'her / IP / TCP 202.89.233.96:https > 192.168.0.106:7335 PA / Ra',34,,
b'her / IP / TCP 202.89.233.96:https > 192.168.0.106:7335 ',34,,
b'her / IP / TCP 202.89.233.96:https > 192.168.0.106:7335 ',34,,
b'her / IP / TCP 202.89.233.96:https > 192.168.0.106:7335 ',34,,
b'her / IP / TCP 202.89.233.96:https > 192.168.0.106:7335 ',34,,
b'her / IP / TCP 202.89.233.96:https > 192.168.0.106:7335 ',34,,
b'her / IP / TCP 202.89.233.96:https > 192.168.0.106:7335 PA / Ra',34,,
b'her / IP / TCP 202.89.233.96:https > 192.168.0.106:7335 PA / Ra',35,,
b'her / IP / TCP 202.89.233.96:https > 192.168.0.106:7335 PA / Ra',35,,
b'her / IP / TCP 202.89.233.96:https > 192.168.0.106:7335 ',35,,
b'her / IP / TCP 202.89.233.96:https > 192.168.0.106:7335 A / Ra',35,,
b'her / IP / TCP 202.89.233.96:https > 192.168.0.106:7335 A / Ra',35,,
b'her / IP / TCP 202.89.233.96:https > 192.168.0.106:7335 A / Ra',35,,
b'her / IP / TCP 202.89.233.96:https > 192.168.0.106:7335 A / Ra',35,,
b'her / IP / TCP 202.89.233.96:https > 192.168.0.106:7335 PA / Ra',36,,
b'her / IP / TCP 202.89.233.96:https > 192.168.0.106:7335 PA / Ra',36,,
b'her / IP / TCP 202.89.233.96:https > 192.168.0.106:7335 A / Ra',36,,
b'her / IP / TCP 202.89.233.96:https > 192.168.0.106:7335 PA / Ra',36,,
b'her / IP / TCP 202.89.233.96:https > 192.168.0.106:7335 A / Ra',36,,
b'her / IP / TCP 202.89.233.96:https > 192.168.0.106:7335 PA / Ra',36,,
b'her / IP / TCP 202.89.233.96:https > 192.168.0.106:7335 A / Ra',36,,
b'her / IP / TCP 202.89.233.96:https > 192.168.0.106:7335 A / Ra',37,,
b'her / IP / TCP 202.89.233.96:https > 192.168.0.106:7335 PA / Ra',37,,
b'her / IP / TCP 202.89.233.96:https > 192.168.0.106:7335 A / Ra',37,,
b'her / IP / TCP 202.89.233.96:https > 192.168.0.106:7335 A / Ra',37,,
b'her / IP / TCP 202.89.233.96:https > 192.168.0.106:7335 PA / Ra',37,,
b'her / IP / TCP 202.89.233.96:https > 192.168.0.106:7335 PA / Ra',37,,
b'her / IP / TCP 202.89.233.96:https > 192.168.0.106:7335 A / Ra',37,,
b'her / IP / TCP 202.89.233.96:https > 192.168.0.106:7335 A / Ra',38,,
b'her / IP / TCP 202.89.233.96:https > 192.168.0.106:7335 PA / Ra',38,,
b'her / IP / TCP 202.89.233.96:https > 192.168.0.106:7335 A / Ra',38,,
b'her / IP / TCP 202.89.233.96:https > 192.168.0.106:7335 A / Ra',38,,
b'her / IP / TCP 202.89.233.96:https > 192.168.0.106:7335 PA / Ra',38,,
b'her / IP / TCP 202.89.233.96:https > 192.168.0.106:7335 PA / Ra',38,,
b'her / IP / TCP 202.89.233.96:https > 192.168.0.106:7335 A / Ra',38,,
b'her / IP / TCP 202.89.233.96:https > 192.168.0.106:7335 PA / Ra',39,,
b'her / IP / TCP 202.89.233.96:https > 192.168.0.106:7335 A / Ra',39,,
b'her / IP / TCP 202.89.233.96:https > 192.168.0.106:7335 A / Ra',39,,
b'her / IP / TCP 202.89.233.96:https > 192.168.0.106:7335 PA / Ra',39,,
b'her / IP / TCP 202.89.233.96:https > 192.168.0.106:7335 A / Ra',39,,
b'her / IP / TCP 202.89.233.96:https > 192.168.0.106:7335 A / Ra',39,,
b'her / IP / TCP 202.89.233.96:https > 192.168.0.106:7335 PA / Ra',39,,
b'her / IP / TCP 202.89.233.96:https > 192.168.0.106:7335 A / Ra',40,,
b'her / IP / TCP 202.89.233.96:https > 192.168.0.106:7335 PA / Ra',40,,
b'her / IP / TCP 192.168.0.106:7336 > 116.132.235.228:http ',41,,
b'her / IP / TCP 192.168.0.106:7336 > 116.132.235.228:http ',41,,
b'her / IP / TCP 192.168.0.106:7336 > 116.132.235.228:http PA / Ra',41,,
b'her / IP / TCP 192.168.0.106:7336 > 116.132.235.228:http A / Ra',41,,
b'her / IP / TCP 192.168.0.106:7336 > 116.132.235.228:http A / Ra',41,,
b'her / IP / TCP 192.168.0.106:7336 > 116.132.235.228:http PA / Ra',41,,
b'her / IP / TCP 192.168.0.106:7336 > 116.132.235.228:http ',42,,
b'her / IP / TCP 192.168.0.106:7336 > 116.132.235.228:http F',42,,
"b'her / IP / UDP / DNS Qry ""b\'assets.msn.cn.\'""'",43,,
"b'her / IP / UDP / DNS Qry ""b\'assets.msn.cn.\'""'",44,,
b'her / IP / TCP 116.132.235.228:http > 192.168.0.106:7336 S',45,,
b'her / IP / TCP 116.132.235.228:http > 192.168.0.106:7336 ',45,,
b'her / IP / TCP 116.132.235.228:http > 192.168.0.106:7336 ',45,,
b'her / IP / TCP 116.132.235.228:http > 192.168.0.106:7336 ',45,,
b'her / IP / TCP 116.132.235.228:http > 192.168.0.106:7336 PA / Ra',45,,
b'her / IP / TCP 116.132.235.228:http > 192.168.0.106:7336 F',45,,
b'her / IP / TCP 116.132.235.228:http > 192.168.0.106:7336 ',46,,
"b'her / IP / UDP / DNS Ans ""b\'assets.msn.cn-c.edgekey.net.\'""'",46,,
"b'her / IP / UDP / DNS Qry ""b\'assets.msn.com.\'""'",47,,
"b'her / IP / UDP / DNS Qry ""b\'assets.msn.com.\'""'",48,,
"b'her / IP / UDP / DNS Qry ""b\'www.bing.com.\'""'",49,,
b'her / IP / TCP 192.168.0.106:7337 > 204.79.197.203:https ',50,,
b'her / IP / TCP 192.168.0.106:7337 > 204.79.197.203:https ',50,,
b'her / IP / TCP 192.168.0.106:7337 > 204.79.197.203:https PA / Ra',50,,
"b'her / IP / UDP / DNS Qry ""b\'www.bing.com.\'""'",51,,
"b'her / IP / UDP / DNS Ans ""202.89.233.101""'",52,,
b'her / IP / TCP 192.168.0.106:7338 > 218.58.102.48:https ',53,,
b'her / IP / TCP 192.168.0.106:7338 > 218.58.102.48:https ',53,,
b'her / IP / TCP 192.168.0.106:7338 > 218.58.102.48:https PA / Ra',53,,
b'her / IP / TCP 192.168.0.106:7338 > 218.58.102.48:https PA / Ra',53,,
b'her / IP / TCP 192.168.0.106:7338 > 218.58.102.48:https PA / Ra',53,,
b'her / IP / TCP 192.168.0.106:7338 > 218.58.102.48:https PA / Ra',53,,
b'her / IP / TCP 192.168.0.106:7338 > 218.58.102.48:https PA / Ra',54,,
b'her / IP / TCP 192.168.0.106:7338 > 218.58.102.48:https ',54,,
b'her / IP / TCP 192.168.0.106:7338 > 218.58.102.48:https PA / Ra',54,,
b'her / IP / TCP 192.168.0.106:7338 > 218.58.102.48:https ',54,,
b'her / IP / TCP 192.168.0.106:7338 > 218.58.102.48:https ',54,,
b'her / IP / TCP 192.168.0.106:7338 > 218.58.102.48:https ',54,,
b'her / IP / TCP 192.168.0.106:7338 > 218.58.102.48:https ',54,,
b'her / IP / TCP 192.168.0.106:7338 > 218.58.102.48:https ',55,,
b'her / IP / TCP 192.168.0.106:7338 > 218.58.102.48:https ',55,,
b'her / IP / TCP 192.168.0.106:7338 > 218.58.102.48:https ',55,,
b'her / IP / TCP 192.168.0.106:7338 > 218.58.102.48:https ',55,,
b'her / IP / TCP 192.168.0.106:7338 > 218.58.102.48:https ',55,,
b'her / IP / TCP 192.168.0.106:7338 > 218.58.102.48:https ',55,,
b'her / IP / TCP 192.168.0.106:7338 > 218.58.102.48:https ',55,,
b'her / IP / TCP 192.168.0.106:7338 > 218.58.102.48:https ',56,,
b'her / IP / TCP 192.168.0.106:7338 > 218.58.102.48:https ',56,,
b'her / IP / TCP 192.168.0.106:7338 > 218.58.102.48:https ',56,,
b'her / IP / TCP 192.168.0.106:7338 > 218.58.102.48:https ',56,,
b'her / IP / TCP 192.168.0.106:7338 > 218.58.102.48:https ',56,,
b'her / IP / TCP 192.168.0.106:7338 > 218.58.102.48:https ',56,,
b'her / IP / TCP 192.168.0.106:7338 > 218.58.102.48:https ',56,,
b'her / IP / TCP 192.168.0.106:7338 > 218.58.102.48:https ',57,,
b'her / IP / TCP 192.168.0.106:7338 > 218.58.102.48:https ',57,,
b'her / IP / TCP 192.168.0.106:7338 > 218.58.102.48:https ',57,,
b'her / IP / TCP 192.168.0.106:7338 > 218.58.102.48:https ',57,,
b'her / IP / TCP 192.168.0.106:7338 > 218.58.102.48:https ',57,,
b'her / IP / TCP 192.168.0.106:7338 > 218.58.102.48:https ',57,,
b'her / IP / TCP 192.168.0.106:7338 > 218.58.102.48:https ',57,,
b'her / IP / TCP 192.168.0.106:7338 > 218.58.102.48:https ',58,,
b'her / IP / TCP 192.168.0.106:7338 > 218.58.102.48:https ',58,,
b'her / IP / TCP 192.168.0.106:7338 > 218.58.102.48:https ',58,,
b'her / IP / TCP 192.168.0.106:7338 > 218.58.102.48:https ',58,,
b'her / IP / TCP 192.168.0.106:7338 > 218.58.102.48:https ',58,,
b'her / IP / TCP 192.168.0.106:7338 > 218.58.102.48:https ',58,,
"b'her / IP / UDP / DNS Ans ""b\'assets.msn.com.edgekey.net.\'""'",59,,
"b'her / IP / UDP / DNS Ans ""b\'assets.msn.cn-c.edgekey.net.\'""'",60,,
"b'her / IP / UDP / DNS Ans ""b\'www-www.bing.com.trafficmanager.net.\'""'",61,,
"b'her / IP / UDP / DNS Qry ""b\'th.bing.com.\'""'",62,,
"b'her / IP / UDP / DNS Qry ""b\'th.bing.com.\'""'",63,,
b'her / IP / TCP 192.168.0.106:7339 > 202.89.233.101:https ',64,,
b'her / IP / TCP 192.168.0.106:7339 > 202.89.233.101:https ',64,,
b'her / IP / TCP 192.168.0.106:7339 > 202.89.233.101:https PA / Ra',64,,
b'her / IP / TCP 192.168.0.106:7339 > 202.89.233.101:https ',64,,
b'her / IP / TCP 192.168.0.106:7339 > 202.89.233.101:https PA / Ra',64,,
b'her / IP / TCP 192.168.0.106:7339 > 202.89.233.101:https ',64,,
"b'her / IP / UDP / DNS Ans ""b\'p-th.bing.com.trafficmanager.net.\'""'",65,,
"b'her / IP / UDP / DNS Qry ""b\'sb.scorecardresearch.com.\'""'",66,,
"b'her / IP / UDP / DNS Qry ""b\'sb.scorecardresearch.com.\'""'",67,,
"b'her / IP / UDP / DNS Qry ""b\'img-s-msn-com.akamaized.net.\'""'",68,,
"b'her / IP / UDP / DNS Qry ""b\'img-s-msn-com.akamaized.net.\'""'",69,,
b'her / IP / TCP 192.168.0.106:7341 > 23.209.84.147:https ',70,,
b'her / IP / TCP 192.168.0.106:7340 > 23.209.84.147:https ',71,,
"b'her / IP / UDP / DNS Qry ""b\'api.msn.com.\'""'",72,,
b'her / IP / TCP 192.168.0.106:7342 > 202.89.233.100:https ',73,,
b'her / IP / TCP 192.168.0.106:7342 > 202.89.233.100:https ',73,,
b'her / IP / TCP 192.168.0.106:7342 > 202.89.233.100:https PA / Ra',73,,
b'her / IP / TCP 192.168.0.106:7342 > 202.89.233.100:https PA / Ra',73,,
b'her / IP / TCP 192.168.0.106:7342 > 202.89.233.100:https ',73,,
"b'her / IP / UDP / DNS Qry ""b\'api.msn.com.\'""'",74,,
"b'her / IP / UDP / DNS Ans ""99.84.140.108""'",75,,
"b'her / IP / UDP / DNS Ans ""b\'a1834.dscg2.akamai.net.\'""'",76,,
"b'her / IP / UDP / DNS Ans ""204.79.197.203""'",77,,
"b'her / IP / UDP / DNS Ans ""b\'api-msn-com.a-0003.a-msedge.net.\'""'",78,,
"b'her / IP / UDP / DNS Qry ""b\'assets.msn.com.\'""'",79,,
"b'her / IP / UDP / DNS Qry ""b\'assets.msn.com.\'""'",80,,
"b'her / IP / UDP / DNS Ans ""23.209.84.147""'",81,,
"b'her / IP / UDP / DNS Qry ""b\'c.bing.com.\'""'",82,,
b'her / IP / TCP 192.168.0.106:7343 > 23.195.91.210:https ',83,,
b'her / IP / TCP 192.168.0.106:7343 > 23.195.91.210:https ',83,,
b'her / IP / TCP 192.168.0.106:7343 > 23.195.91.210:https PA / Ra',83,,
"b'her / IP / UDP / DNS Qry ""b\'c.bing.com.\'""'",84,,
"b'her / IP / UDP / DNS Qry ""b\'c.msn.com.\'""'",85,,
"b'her / IP / UDP / DNS Qry ""b\'c.msn.com.\'""'",86,,
"b'her / IP / UDP / DNS Ans ""b\'assets.msn.com.edgekey.net.\'""'",87,,
"b'her / IP / UDP / DNS Qry ""b\'img-s-msn-com.akamaized.net.\'""'",88,,
"b'her / IP / UDP / DNS Qry ""b\'img-s-msn-com.akamaized.net.\'""'",89,,
b'her / IP / TCP 202.89.233.101:https > 192.168.0.106:7339 S',90,,
b'her / IP / TCP 202.89.233.101:https > 192.168.0.106:7339 ',90,,
b'her / IP / TCP 202.89.233.101:https > 192.168.0.106:7339 A / Ra',90,,
b'her / IP / TCP 202.89.233.101:https > 192.168.0.106:7339 A / Ra',90,,
b'her / IP / TCP 202.89.233.101:https > 192.168.0.106:7339 A / Ra',90,,
b'her / IP / TCP 202.89.233.101:https > 192.168.0.106:7339 A / Ra',90,,
b'her / IP / TCP 202.89.233.101:https > 192.168.0.106:7339 A / Ra',91,,
b'her / IP / TCP 202.89.233.101:https > 192.168.0.106:7339 PA / Ra',91,,
b'her / IP / TCP 202.89.233.101:https > 192.168.0.106:7339 ',91,,
b'her / IP / TCP 202.89.233.101:https > 192.168.0.106:7339 PA / Ra',91,,
b'her / IP / TCP 202.89.233.101:https > 192.168.0.106:7339 PA / Ra',91,,
b'her / IP / TCP 218.58.102.48:https > 192.168.0.106:7338 S',92,,
b'her / IP / TCP 218.58.102.48:https > 192.168.0.106:7338 ',92,,
b'her / IP / TCP 218.58.102.48:https > 192.168.0.106:7338 PA / Ra',92,,
b'her / IP / TCP 218.58.102.48:https > 192.168.0.106:7338 ',92,,
b'her / IP / TCP 218.58.102.48:https > 192.168.0.106:7338 PA / Ra',92,,
b'her / IP / TCP 218.58.102.48:https > 192.168.0.106:7338 ',92,,
b'her / IP / TCP 218.58.102.48:https > 192.168.0.106:7338 ',93,,
b'her / IP / TCP 218.58.102.48:https > 192.168.0.106:7338 ',93,,
b'her / IP / TCP 218.58.102.48:https > 192.168.0.106:7338 PA / Ra',93,,
b'her / IP / TCP 218.58.102.48:https > 192.168.0.106:7338 PA / Ra',93,,
b'her / IP / TCP 218.58.102.48:https > 192.168.0.106:7338 PA / Ra',93,,
b'her / IP / TCP 218.58.102.48:https > 192.168.0.106:7338 PA / Ra',93,,
b'her / IP / TCP 218.58.102.48:https > 192.168.0.106:7338 A / Ra',93,,
b'her / IP / TCP 218.58.102.48:https > 192.168.0.106:7338 PA / Ra',94,,
b'her / IP / TCP 218.58.102.48:https > 192.168.0.106:7338 PA / Ra',94,,
b'her / IP / TCP 218.58.102.48:https > 192.168.0.106:7338 A / Ra',94,,
b'her / IP / TCP 218.58.102.48:https > 192.168.0.106:7338 PA / Ra',94,,
b'her / IP / TCP 218.58.102.48:https > 192.168.0.106:7338 PA / Ra',94,,
b'her / IP / TCP 218.58.102.48:https > 192.168.0.106:7338 A / Ra',94,,
b'her / IP / TCP 218.58.102.48:https > 192.168.0.106:7338 PA / Ra',94,,
b'her / IP / TCP 218.58.102.48:https > 192.168.0.106:7338 PA / Ra',95,,
b'her / IP / TCP 218.58.102.48:https > 192.168.0.106:7338 A / Ra',95,,
b'her / IP / TCP 218.58.102.48:https > 192.168.0.106:7338 PA / Ra',95,,
b'her / IP / TCP 218.58.102.48:https > 192.168.0.106:7338 A / Ra',95,,
b'her / IP / TCP 218.58.102.48:https > 192.168.0.106:7338 PA / Ra',95,,
b'her / IP / TCP 218.58.102.48:https > 192.168.0.106:7338 A / Ra',95,,
b'her / IP / TCP 218.58.102.48:https > 192.168.0.106:7338 PA / Ra',95,,
b'her / IP / TCP 218.58.102.48:https > 192.168.0.106:7338 A / Ra',96,,
b'her / IP / TCP 218.58.102.48:https > 192.168.0.106:7338 PA / Ra',96,,
b'her / IP / TCP 218.58.102.48:https > 192.168.0.106:7338 A / Ra',96,,
b'her / IP / TCP 218.58.102.48:https > 192.168.0.106:7338 PA / Ra',96,,
b'her / IP / TCP 218.58.102.48:https > 192.168.0.106:7338 A / Ra',96,,
b'her / IP / TCP 218.58.102.48:https > 192.168.0.106:7338 PA / Ra',96,,
b'her / IP / TCP 218.58.102.48:https > 192.168.0.106:7338 A / Ra',96,,
b'her / IP / TCP 218.58.102.48:https > 192.168.0.106:7338 PA / Ra',97,,
b'her / IP / TCP 218.58.102.48:https > 192.168.0.106:7338 A / Ra',97,,
b'her / IP / TCP 218.58.102.48:https > 192.168.0.106:7338 PA / Ra',97,,
b'her / IP / TCP 218.58.102.48:https > 192.168.0.106:7338 A / Ra',97,,
b'her / IP / TCP 218.58.102.48:https > 192.168.0.106:7338 PA / Ra',97,,
b'her / IP / TCP 218.58.102.48:https > 192.168.0.106:7338 A / Ra',97,,
b'her / IP / TCP 218.58.102.48:https > 192.168.0.106:7338 PA / Ra',97,,
b'her / IP / TCP 218.58.102.48:https > 192.168.0.106:7338 A / Ra',98,,
b'her / IP / TCP 218.58.102.48:https > 192.168.0.106:7338 PA / Ra',98,,
b'her / IP / TCP 218.58.102.48:https > 192.168.0.106:7338 A / Ra',98,,
b'her / IP / TCP 218.58.102.48:https > 192.168.0.106:7338 PA / Ra',98,,
b'her / IP / TCP 218.58.102.48:https > 192.168.0.106:7338 A / Ra',98,,
b'her / IP / TCP 218.58.102.48:https > 192.168.0.106:7338 PA / Ra',98,,
b'her / IP / TCP 218.58.102.48:https > 192.168.0.106:7338 A / Ra',98,,
b'her / IP / TCP 218.58.102.48:https > 192.168.0.106:7338 PA / Ra',99,,
b'her / IP / TCP 218.58.102.48:https > 192.168.0.106:7338 A / Ra',99,,
b'her / IP / TCP 218.58.102.48:https > 192.168.0.106:7338 PA / Ra',99,,
b'her / IP / TCP 218.58.102.48:https > 192.168.0.106:7338 A / Ra',99,,
b'her / IP / TCP 218.58.102.48:https > 192.168.0.106:7338 PA / Ra',99,,
b'her / IP / TCP 218.58.102.48:https > 192.168.0.106:7338 A / Ra',99,,
b'her / IP / TCP 218.58.102.48:https > 192.168.0.106:7338 PA / Ra',99,,
b'her / IP / TCP 218.58.102.48:https > 192.168.0.106:7338 A / Ra',100,,
b'her / IP / TCP 218.58.102.48:https > 192.168.0.106:7338 PA / Ra',100,,
b'her / IP / TCP 218.58.102.48:https > 192.168.0.106:7338 A / Ra',100,,
b'her / IP / TCP 218.58.102.48:https > 192.168.0.106:7338 PA / Ra',100,,
b'her / IP / TCP 218.58.102.48:https > 192.168.0.106:7338 A / Ra',100,,
b'her / IP / TCP 218.58.102.48:https > 192.168.0.106:7338 PA / Ra',100,,
b'her / IP / TCP 218.58.102.48:https > 192.168.0.106:7338 A / Ra',100,,
b'her / IP / TCP 218.58.102.48:https > 192.168.0.106:7338 PA / Ra',101,,
b'her / IP / TCP 218.58.102.48:https > 192.168.0.106:7338 A / Ra',101,,
b'her / IP / TCP 218.58.102.48:https > 192.168.0.106:7338 PA / Ra',101,,
b'her / IP / TCP 218.58.102.48:https > 192.168.0.106:7338 A / Ra',101,,
b'her / IP / TCP 218.58.102.48:https > 192.168.0.106:7338 PA / Ra',101,,
b'her / IP / TCP 218.58.102.48:https > 192.168.0.106:7338 A / Ra',101,,
b'her / IP / TCP 218.58.102.48:https > 192.168.0.106:7338 PA / Ra',101,,
b'her / IP / TCP 218.58.102.48:https > 192.168.0.106:7338 A / Ra',102,,
b'her / IP / TCP 218.58.102.48:https > 192.168.0.106:7338 PA / Ra',102,,
b'her / IP / TCP 218.58.102.48:https > 192.168.0.106:7338 A / Ra',102,,
b'her / IP / TCP 218.58.102.48:https > 192.168.0.106:7338 PA / Ra',102,,
b'her / IP / TCP 218.58.102.48:https > 192.168.0.106:7338 A / Ra',102,,
b'her / IP / TCP 218.58.102.48:https > 192.168.0.106:7338 PA / Ra',102,,
b'her / IP / TCP 218.58.102.48:https > 192.168.0.106:7338 A / Ra',102,,
b'her / IP / TCP 218.58.102.48:https > 192.168.0.106:7338 PA / Ra',103,,
b'her / IP / TCP 218.58.102.48:https > 192.168.0.106:7338 A / Ra',103,,
b'her / IP / TCP 218.58.102.48:https > 192.168.0.106:7338 PA / Ra',103,,
b'her / IP / TCP 218.58.102.48:https > 192.168.0.106:7338 A / Ra',103,,
b'her / IP / TCP 218.58.102.48:https > 192.168.0.106:7338 PA / Ra',103,,
b'her / IP / TCP 218.58.102.48:https > 192.168.0.106:7338 A / Ra',103,,
b'her / IP / TCP 218.58.102.48:https > 192.168.0.106:7338 PA / Ra',103,,
b'her / IP / TCP 218.58.102.48:https > 192.168.0.106:7338 A / Ra',104,,
b'her / IP / TCP 218.58.102.48:https > 192.168.0.106:7338 PA / Ra',104,,
b'her / IP / TCP 218.58.102.48:https > 192.168.0.106:7338 A / Ra',104,,
b'her / IP / TCP 218.58.102.48:https > 192.168.0.106:7338 PA / Ra',104,,
b'her / IP / TCP 218.58.102.48:https > 192.168.0.106:7338 A / Ra',104,,
"b'her / IP / UDP / DNS Ans ""23.195.91.210""'",105,,
"b'her / IP / UDP / DNS Ans ""b\'c-bing-com.a-0001.a-msedge.net.\'""'",106,,
"b'her / IP / UDP / DNS Ans ""b\'c-msn-com-nsatc.trafficmanager.net.\'""'",107,,
"b'her / IP / UDP / DNS Ans ""b\'a1834.dscg2.akamai.net.\'""'",108,,
"b'her / IP / UDP / DNS Qry ""b\'sb.scorecardresearch.com.\'""'",109,,
"b'her / IP / UDP / DNS Qry ""b\'sb.scorecardresearch.com.\'""'",110,,
"b'her / IP / UDP / DNS Ans ""99.84.140.108""'",111,,
b'her / IP / UDP / DNS Ans',112,,
"b'her / IP / UDP / DNS Qry ""b\'th.bing.com.\'""'",113,,
"b'her / IP / UDP / DNS Qry ""b\'th.bing.com.\'""'",114,,
"b'her / IP / UDP / DNS Qry ""b\'www.bing.com.\'""'",115,,
"b'her / IP / UDP / DNS Qry ""b\'www.bing.com.\'""'",116,,
"b'her / IP / UDP / DNS Qry ""b\'c.msn.com.\'""'",117,,
"b'her / IP / UDP / DNS Qry ""b\'c.msn.com.\'""'",118,,
b'her / IP / TCP 202.89.233.100:https > 192.168.0.106:7342 S',119,,
b'her / IP / TCP 202.89.233.100:https > 192.168.0.106:7342 ',119,,
b'her / IP / TCP 202.89.233.100:https > 192.168.0.106:7342 PA / Ra',119,,
b'her / IP / TCP 202.89.233.100:https > 192.168.0.106:7342 ',119,,
b'her / IP / TCP 202.89.233.100:https > 192.168.0.106:7342 PA / Ra',119,,
"b'her / IP / UDP / DNS Ans ""202.89.233.100""'",120,,
"b'her / IP / UDP / DNS Ans ""202.89.233.101""'",121,,
"b'her / IP / UDP / DNS Ans ""20.205.115.81""'",122,,
"b'her / IP / UDP / DNS Ans ""b\'p-th.bing.com.trafficmanager.net.\'""'",123,,
"b'her / IP / UDP / DNS Ans ""b\'c-msn-com-nsatc.trafficmanager.net.\'""'",124,,
"b'her / IP / UDP / DNS Qry ""b\'c.bing.com.\'""'",125,,
"b'her / IP / UDP / DNS Qry ""b\'c.bing.com.\'""'",126,,
b'her / IP / TCP 192.168.0.106:7344 > 20.205.115.81:https ',127,,
"b'her / IP / UDP / DNS Ans ""13.107.21.200""'",128,,
"b'her / IP / UDP / DNS Ans ""b\'c-bing-com.a-0001.a-msedge.net.\'""'",129,,
b'her / IP / TCP 192.168.0.106:7345 > 13.107.21.200:https ',130,,
b'her / IP / TCP 192.168.0.106:7345 > 13.107.21.200:https ',130,,
b'her / IP / TCP 192.168.0.106:7345 > 13.107.21.200:https PA / Ra',130,,
b'her / IP / TCP 204.79.197.203:https > 192.168.0.106:7337 S',131,,
b'her / IP / TCP 13.107.21.200:https > 192.168.0.106:7345 S',132,,
b'her / IP / TCP 23.195.91.210:https > 192.168.0.106:7343 S',133,,
