data,flowmember,label,classes
b'her / IP / TCP 192.168.0.106:1595 > 116.132.235.204:http ',1,,
b'her / IP / TCP 192.168.0.106:1595 > 116.132.235.204:http ',1,,
b'her / IP / TCP 192.168.0.106:1595 > 116.132.235.204:http PA / Ra',1,,
b'her / IP / TCP 192.168.0.106:1595 > 116.132.235.204:http A / Ra',1,,
b'her / IP / TCP 192.168.0.106:1595 > 116.132.235.204:http A / Ra',1,,
b'her / IP / TCP 192.168.0.106:1595 > 116.132.235.204:http PA / Ra',1,,
b'her / IP / TCP 192.168.0.106:1595 > 116.132.235.204:http ',2,,
b'her / IP / TCP 192.168.0.106:1595 > 116.132.235.204:http F',2,,
b'her / IP / TCP 116.132.235.204:http > 192.168.0.106:1595 S',3,,
b'her / IP / TCP 116.132.235.204:http > 192.168.0.106:1595 ',3,,
b'her / IP / TCP 116.132.235.204:http > 192.168.0.106:1595 ',3,,
b'her / IP / TCP 116.132.235.204:http > 192.168.0.106:1595 ',3,,
b'her / IP / TCP 116.132.235.204:http > 192.168.0.106:1595 PA / Ra',3,,
b'her / IP / TCP 116.132.235.204:http > 192.168.0.106:1595 F',3,,
b'her / IP / TCP 116.132.235.204:http > 192.168.0.106:1595 ',4,,
"b'her / IP / UDP / DNS Qry ""b\'static-pcs-sdk-server.alibaba.com.\'""'",4,,
"b'her / IP / UDP / DNS Ans ""116.132.235.204""'",5,,
b'her / IP / TCP 192.168.0.106:1596 > 116.132.235.204:http ',6,,
b'her / IP / TCP 192.168.0.106:1596 > 116.132.235.204:http ',6,,
b'her / IP / TCP 192.168.0.106:1596 > 116.132.235.204:http PA / Ra',6,,
b'her / IP / TCP 192.168.0.106:1596 > 116.132.235.204:http A / Ra',6,,
b'her / IP / TCP 192.168.0.106:1596 > 116.132.235.204:http A / Ra',6,,
b'her / IP / TCP 192.168.0.106:1596 > 116.132.235.204:http PA / Ra',6,,
b'her / IP / TCP 192.168.0.106:1596 > 116.132.235.204:http ',7,,
b'her / IP / TCP 192.168.0.106:1596 > 116.132.235.204:http F',7,,
b'her / IP / TCP 192.168.0.106:1596 > 116.132.235.204:http F',7,,
b'her / IP / TCP 192.168.0.106:1596 > 116.132.235.204:http F',7,,
b'her / IP / TCP 192.168.0.106:1596 > 116.132.235.204:http F',7,,
b'her / IP / TCP 192.168.0.106:1596 > 116.132.235.204:http F',7,,
b'her / IP / TCP 192.168.0.106:1596 > 116.132.235.204:http F',7,,
b'her / IP / TCP 192.168.0.106:1596 > 116.132.235.204:http R',8,,
b'her / IP / TCP 116.132.235.204:http > 192.168.0.106:1596 S',8,,
b'her / IP / TCP 116.132.235.204:http > 192.168.0.106:1596 ',8,,
b'her / IP / TCP 116.132.235.204:http > 192.168.0.106:1596 ',8,,
b'her / IP / TCP 116.132.235.204:http > 192.168.0.106:1596 ',8,,
b'her / IP / TCP 116.132.235.204:http > 192.168.0.106:1596 PA / Ra',8,,
b'her / IP / TCP 116.132.235.204:http > 192.168.0.106:1596 F',8,,
b'her / IP / TCP 116.130.230.27:https > 192.168.0.106:11670 PA / Ra',9,,
b'her / IP / TCP 192.168.0.106:11670 > 116.130.230.27:https ',10,,
b'her / IP / TCP 192.168.0.106:1589 > 110.242.68.4:http F',11,,
b'her / IP / TCP 192.168.0.106:1589 > 110.242.68.4:http F',11,,
b'her / IP / TCP 192.168.0.106:1589 > 110.242.68.4:http R',11,,
"b'her / IP / UDP / DNS Qry ""b\'static-pcs-sdk-server.alibaba.com.\'""'",12,,
"b'her / IP / UDP / DNS Ans ""b\'static-pcs-sdk-server.alibaba.com.gds.alibabadns.com.\'""'",13,,
b'her / IP / TCP 192.168.0.106:1597 > 116.132.235.228:http ',14,,
b'her / IP / TCP 192.168.0.106:1597 > 116.132.235.228:http ',14,,
b'her / IP / TCP 192.168.0.106:1597 > 116.132.235.228:http PA / Ra',14,,
b'her / IP / TCP 192.168.0.106:1597 > 116.132.235.228:http A / Ra',14,,
b'her / IP / TCP 192.168.0.106:1597 > 116.132.235.228:http A / Ra',14,,
b'her / IP / TCP 192.168.0.106:1597 > 116.132.235.228:http PA / Ra',14,,
b'her / IP / TCP 192.168.0.106:1597 > 116.132.235.228:http ',15,,
b'her / IP / TCP 192.168.0.106:1597 > 116.132.235.228:http F',15,,
b'her / IP / TCP 192.168.0.106:1597 > 116.132.235.228:http F',15,,
b'her / IP / TCP 192.168.0.106:1597 > 116.132.235.228:http F',15,,
b'her / IP / TCP 192.168.0.106:1597 > 116.132.235.228:http F',15,,
b'her / IP / TCP 192.168.0.106:1597 > 116.132.235.228:http F',15,,
b'her / IP / TCP 192.168.0.106:1597 > 116.132.235.228:http F',15,,
b'her / IP / TCP 192.168.0.106:1597 > 116.132.235.228:http R',16,,
b'her / IP / UDP 192.168.192.1:netbios_ns > 192.168.192.2:netbios_ns / NBNSHeader / Ra',16,,
b'her / IP / UDP 192.168.192.1:netbios_ns > 192.168.192.2:netbios_ns / NBNSHeader / Ra',16,,
b'her / IP / UDP 192.168.192.1:netbios_ns > 192.168.192.2:netbios_ns / NBNSHeader / Ra',16,,
b'her / IP / UDP 192.168.192.1:netbios_ns > 192.168.192.2:netbios_ns / NBNSHeader / Ra',16,,
b'her / IP / UDP 192.168.192.1:netbios_ns > 192.168.192.2:netbios_ns / NBNSHeader / Ra',16,,
b'her / IP / UDP 192.168.192.1:netbios_ns > 192.168.192.2:netbios_ns / NBNSHeader / Ra',16,,
b'her / IP / TCP 116.132.235.228:http > 192.168.0.106:1597 S',17,,
b'her / IP / TCP 116.132.235.228:http > 192.168.0.106:1597 ',17,,
b'her / IP / TCP 116.132.235.228:http > 192.168.0.106:1597 ',17,,
b'her / IP / TCP 116.132.235.228:http > 192.168.0.106:1597 ',17,,
b'her / IP / TCP 116.132.235.228:http > 192.168.0.106:1597 PA / Ra',17,,
b'her / IP / TCP 116.132.235.228:http > 192.168.0.106:1597 F',17,,
b'her / IP / TCP 192.168.0.106:1598 > 116.132.235.228:http ',18,,
b'her / IP / TCP 192.168.0.106:1598 > 116.132.235.228:http ',18,,
b'her / IP / TCP 192.168.0.106:1598 > 116.132.235.228:http PA / Ra',18,,
b'her / IP / TCP 192.168.0.106:1598 > 116.132.235.228:http A / Ra',18,,
b'her / IP / TCP 192.168.0.106:1598 > 116.132.235.228:http A / Ra',18,,
b'her / IP / TCP 192.168.0.106:1598 > 116.132.235.228:http PA / Ra',18,,
b'her / IP / TCP 192.168.0.106:1598 > 116.132.235.228:http ',19,,
b'her / IP / TCP 192.168.0.106:1598 > 116.132.235.228:http F',19,,
b'her / IP / TCP 192.168.0.106:1598 > 116.132.235.228:http F',19,,
b'her / IP / TCP 192.168.0.106:1598 > 116.132.235.228:http F',19,,
b'her / IP / TCP 192.168.0.106:1598 > 116.132.235.228:http F',19,,
b'her / IP / TCP 192.168.0.106:1598 > 116.132.235.228:http F',19,,
b'her / IP / TCP 192.168.0.106:1598 > 116.132.235.228:http F',19,,
b'her / IP / TCP 192.168.0.106:1598 > 116.132.235.228:http R',20,,
b'her / IP / TCP 116.132.235.228:http > 192.168.0.106:1598 S',20,,
b'her / IP / TCP 116.132.235.228:http > 192.168.0.106:1598 ',20,,
b'her / IP / TCP 116.132.235.228:http > 192.168.0.106:1598 ',20,,
b'her / IP / TCP 116.132.235.228:http > 192.168.0.106:1598 ',20,,
b'her / IP / TCP 116.132.235.228:http > 192.168.0.106:1598 PA / Ra',20,,
b'her / IP / TCP 116.132.235.228:http > 192.168.0.106:1598 F',20,,
b'her / IP / TCP 192.168.0.106:1599 > 116.132.235.228:http ',21,,
b'her / IP / TCP 192.168.0.106:1599 > 116.132.235.228:http ',21,,
b'her / IP / TCP 192.168.0.106:1599 > 116.132.235.228:http PA / Ra',21,,
b'her / IP / TCP 192.168.0.106:1599 > 116.132.235.228:http A / Ra',21,,
b'her / IP / TCP 192.168.0.106:1599 > 116.132.235.228:http A / Ra',21,,
b'her / IP / TCP 192.168.0.106:1599 > 116.132.235.228:http PA / Ra',21,,
b'her / IP / TCP 192.168.0.106:1599 > 116.132.235.228:http ',22,,
b'her / IP / TCP 192.168.0.106:1599 > 116.132.235.228:http F',22,,
b'her / IP / TCP 192.168.0.106:1599 > 116.132.235.228:http F',22,,
b'her / IP / TCP 192.168.0.106:1599 > 116.132.235.228:http F',22,,
b'her / IP / TCP 192.168.0.106:1599 > 116.132.235.228:http F',22,,
b'her / IP / TCP 192.168.0.106:1599 > 116.132.235.228:http F',22,,
b'her / IP / TCP 192.168.0.106:1599 > 116.132.235.228:http F',22,,
b'her / IP / TCP 116.132.235.228:http > 192.168.0.106:1599 S',23,,
b'her / IP / TCP 116.132.235.228:http > 192.168.0.106:1599 ',23,,
b'her / IP / TCP 116.132.235.228:http > 192.168.0.106:1599 ',23,,
b'her / IP / TCP 116.132.235.228:http > 192.168.0.106:1599 ',23,,
b'her / IP / TCP 116.132.235.228:http > 192.168.0.106:1599 PA / Ra',23,,
b'her / IP / TCP 116.132.235.228:http > 192.168.0.106:1599 F',23,,
b'her / IP / TCP 140.82.113.25:https > 192.168.0.106:7363 PA / Ra',24,,
b'her / IP / TCP 140.82.113.25:https > 192.168.0.106:7363 A / Paddin',24,,
b'her / IP / TCP 192.168.0.106:7363 > 140.82.113.25:https PA / Ra',25,,
b'her / IP / TCP 192.168.0.106:1600 > 116.132.235.228:http ',26,,
b'her / IP / TCP 192.168.0.106:1600 > 116.132.235.228:http ',26,,
b'her / IP / TCP 192.168.0.106:1600 > 116.132.235.228:http PA / Ra',26,,
b'her / IP / TCP 192.168.0.106:1600 > 116.132.235.228:http A / Ra',26,,
b'her / IP / TCP 192.168.0.106:1600 > 116.132.235.228:http A / Ra',26,,
b'her / IP / TCP 192.168.0.106:1600 > 116.132.235.228:http PA / Ra',26,,
b'her / IP / TCP 192.168.0.106:1600 > 116.132.235.228:http ',27,,
b'her / IP / TCP 192.168.0.106:1600 > 116.132.235.228:http F',27,,
b'her / IP / TCP 192.168.0.106:1600 > 116.132.235.228:http F',27,,
b'her / IP / TCP 192.168.0.106:1600 > 116.132.235.228:http F',27,,
b'her / IP / TCP 192.168.0.106:1600 > 116.132.235.228:http F',27,,
b'her / IP / TCP 192.168.0.106:1600 > 116.132.235.228:http F',27,,
b'her / IP / TCP 192.168.0.106:1600 > 116.132.235.228:http F',27,,
b'her / IP / TCP 116.132.235.228:http > 192.168.0.106:1600 S',28,,
b'her / IP / TCP 116.132.235.228:http > 192.168.0.106:1600 ',28,,
b'her / IP / TCP 116.132.235.228:http > 192.168.0.106:1600 ',28,,
b'her / IP / TCP 116.132.235.228:http > 192.168.0.106:1600 ',28,,
b'her / IP / TCP 116.132.235.228:http > 192.168.0.106:1600 PA / Ra',28,,
b'her / IP / TCP 116.132.235.228:http > 192.168.0.106:1600 F',28,,
b'her / IP / TCP 192.168.0.106:1601 > 202.89.233.100:https ',29,,
b'her / IP / TCP 192.168.0.106:1601 > 202.89.233.100:https ',29,,
b'her / IP / TCP 192.168.0.106:1601 > 202.89.233.100:https PA / Ra',29,,
b'her / IP / TCP 192.168.0.106:1601 > 202.89.233.100:https ',29,,
b'her / IP / TCP 192.168.0.106:1601 > 202.89.233.100:https ',29,,
b'her / IP / TCP 192.168.0.106:1601 > 202.89.233.100:https PA / Ra',29,,
b'her / IP / TCP 192.168.0.106:1601 > 202.89.233.100:https ',30,,
b'her / IP / TCP 202.89.233.100:https > 192.168.0.106:1601 S',30,,
b'her / IP / TCP 202.89.233.100:https > 192.168.0.106:1601 ',30,,
b'her / IP / TCP 202.89.233.100:https > 192.168.0.106:1601 A / Ra',30,,
b'her / IP / TCP 202.89.233.100:https > 192.168.0.106:1601 A / Ra',30,,
b'her / IP / TCP 202.89.233.100:https > 192.168.0.106:1601 A / Ra',30,,
b'her / IP / TCP 202.89.233.100:https > 192.168.0.106:1601 A / Ra',30,,
b'her / IP / TCP 202.89.233.100:https > 192.168.0.106:1601 A / Ra',31,,
b'her / IP / TCP 202.89.233.100:https > 192.168.0.106:1601 PA / Ra',31,,
b'her / IP / TCP 202.89.233.100:https > 192.168.0.106:1601 ',31,,
b'her / IP / TCP 202.89.233.100:https > 192.168.0.106:1601 PA / Ra',31,,
b'her / IP / TCP 202.89.233.100:https > 192.168.0.106:1601 PA / Ra',31,,
b'her / IP / TCP 192.168.0.106:1602 > 116.132.235.228:http ',32,,
b'her / IP / TCP 192.168.0.106:1602 > 116.132.235.228:http ',32,,
b'her / IP / TCP 192.168.0.106:1602 > 116.132.235.228:http PA / Ra',32,,
b'her / IP / TCP 192.168.0.106:1602 > 116.132.235.228:http A / Ra',32,,
b'her / IP / TCP 192.168.0.106:1602 > 116.132.235.228:http A / Ra',32,,
b'her / IP / TCP 192.168.0.106:1602 > 116.132.235.228:http PA / Ra',32,,
b'her / IP / TCP 192.168.0.106:1602 > 116.132.235.228:http ',33,,
b'her / IP / TCP 192.168.0.106:1602 > 116.132.235.228:http F',33,,
b'her / IP / TCP 116.132.235.228:http > 192.168.0.106:1602 S',34,,
b'her / IP / TCP 116.132.235.228:http > 192.168.0.106:1602 ',34,,
b'her / IP / TCP 116.132.235.228:http > 192.168.0.106:1602 ',34,,
b'her / IP / TCP 116.132.235.228:http > 192.168.0.106:1602 ',34,,
b'her / IP / TCP 116.132.235.228:http > 192.168.0.106:1602 PA / Ra',34,,
b'her / IP / TCP 116.132.235.228:http > 192.168.0.106:1602 F',34,,
b'her / IP / TCP 116.132.235.228:http > 192.168.0.106:1602 ',35,,
b'her / IP / TCP 192.168.0.106:1603 > 116.132.235.228:http ',35,,
b'her / IP / TCP 192.168.0.106:1603 > 116.132.235.228:http ',35,,
b'her / IP / TCP 192.168.0.106:1603 > 116.132.235.228:http PA / Ra',35,,
b'her / IP / TCP 192.168.0.106:1603 > 116.132.235.228:http A / Ra',35,,
b'her / IP / TCP 192.168.0.106:1603 > 116.132.235.228:http A / Ra',35,,
b'her / IP / TCP 192.168.0.106:1603 > 116.132.235.228:http PA / Ra',35,,
b'her / IP / TCP 192.168.0.106:1603 > 116.132.235.228:http ',36,,
b'her / IP / TCP 192.168.0.106:1603 > 116.132.235.228:http F',36,,
b'her / IP / TCP 116.132.235.228:http > 192.168.0.106:1603 S',37,,
b'her / IP / TCP 116.132.235.228:http > 192.168.0.106:1603 ',37,,
b'her / IP / TCP 116.132.235.228:http > 192.168.0.106:1603 ',37,,
b'her / IP / TCP 116.132.235.228:http > 192.168.0.106:1603 ',37,,
b'her / IP / TCP 116.132.235.228:http > 192.168.0.106:1603 PA / Ra',37,,
b'her / IP / TCP 116.132.235.228:http > 192.168.0.106:1603 F',37,,
b'her / IP / TCP 116.132.235.228:http > 192.168.0.106:1603 ',38,,
b'her / IP / TCP 192.168.0.106:1544 > 20.44.202.200:https R',38,,
b'her / IP / TCP 192.168.0.106:1545 > 110.242.68.4:http R',39,,
b'her / IP / TCP 192.168.0.106:1604 > 116.132.235.228:http ',40,,
b'her / IP / TCP 192.168.0.106:1604 > 116.132.235.228:http ',40,,
b'her / IP / TCP 192.168.0.106:1604 > 116.132.235.228:http PA / Ra',40,,
b'her / IP / TCP 192.168.0.106:1604 > 116.132.235.228:http A / Ra',40,,
b'her / IP / TCP 192.168.0.106:1604 > 116.132.235.228:http A / Ra',40,,
b'her / IP / TCP 192.168.0.106:1604 > 116.132.235.228:http PA / Ra',40,,
b'her / IP / TCP 192.168.0.106:1604 > 116.132.235.228:http ',41,,
b'her / IP / TCP 192.168.0.106:1604 > 116.132.235.228:http F',41,,
b'her / IP / TCP 192.168.0.106:1604 > 116.132.235.228:http F',41,,
b'her / IP / TCP 192.168.0.106:1604 > 116.132.235.228:http F',41,,
b'her / IP / TCP 192.168.0.106:1604 > 116.132.235.228:http F',41,,
b'her / IP / TCP 192.168.0.106:1604 > 116.132.235.228:http F',41,,
b'her / IP / TCP 192.168.0.106:1604 > 116.132.235.228:http F',41,,
b'her / IP / TCP 116.132.235.228:http > 192.168.0.106:1604 S',42,,
b'her / IP / TCP 116.132.235.228:http > 192.168.0.106:1604 ',42,,
b'her / IP / TCP 116.132.235.228:http > 192.168.0.106:1604 ',42,,
b'her / IP / TCP 116.132.235.228:http > 192.168.0.106:1604 PA / Ra',42,,
b'her / IP / TCP 116.132.235.228:http > 192.168.0.106:1604 F',42,,
b'her / IP / TCP 192.168.0.106:1605 > 110.242.68.4:http ',43,,
b'her / IP / TCP 192.168.0.106:1605 > 110.242.68.4:http ',43,,
b'her / IP / TCP 192.168.0.106:1605 > 110.242.68.4:http F',43,,
b'her / IP / TCP 192.168.0.106:1605 > 110.242.68.4:http ',43,,
b'her / IP / TCP 110.242.68.4:http > 192.168.0.106:1605 S',44,,
b'her / IP / TCP 110.242.68.4:http > 192.168.0.106:1605 ',44,,
b'her / IP / TCP 110.242.68.4:http > 192.168.0.106:1605 F',44,,
"b'her / IP / UDP / DNS Qry ""b\'szextshort.weixin.qq.com.\'""'",45,,
"b'her / IP / UDP / DNS Ans ""b\'szshort.weixin.qq.com.\'""'",46,,
b'her / IP / TCP 192.168.0.106:1606 > 157.255.191.46:http ',47,,
b'her / IP / TCP 192.168.0.106:1606 > 157.255.191.46:http ',47,,
b'her / IP / TCP 192.168.0.106:1606 > 157.255.191.46:http PA / Ra',47,,
b'her / IP / TCP 192.168.0.106:1606 > 157.255.191.46:http ',47,,
b'her / IP / TCP 192.168.0.106:1606 > 157.255.191.46:http F',47,,
b'her / IP / TCP 192.168.0.106:stt > 116.132.235.228:http ',48,,
b'her / IP / TCP 192.168.0.106:stt > 116.132.235.228:http ',48,,
b'her / IP / TCP 192.168.0.106:stt > 116.132.235.228:http PA / Ra',48,,
b'her / IP / TCP 192.168.0.106:stt > 116.132.235.228:http A / Ra',48,,
b'her / IP / TCP 192.168.0.106:stt > 116.132.235.228:http A / Ra',48,,
b'her / IP / TCP 192.168.0.106:stt > 116.132.235.228:http PA / Ra',48,,
b'her / IP / TCP 192.168.0.106:stt > 116.132.235.228:http ',49,,
b'her / IP / TCP 192.168.0.106:stt > 116.132.235.228:http F',49,,
b'her / IP / TCP 192.168.0.106:stt > 116.132.235.228:http F',49,,
b'her / IP / TCP 192.168.0.106:stt > 116.132.235.228:http F',49,,
b'her / IP / TCP 192.168.0.106:stt > 116.132.235.228:http F',49,,
b'her / IP / TCP 192.168.0.106:stt > 116.132.235.228:http F',49,,
b'her / IP / TCP 192.168.0.106:stt > 116.132.235.228:http F',49,,
b'her / IP / TCP 157.255.191.46:http > 192.168.0.106:1606 S',50,,
b'her / IP / TCP 157.255.191.46:http > 192.168.0.106:1606 ',50,,
b'her / IP / TCP 157.255.191.46:http > 192.168.0.106:1606 PA / Ra',50,,
b'her / IP / TCP 157.255.191.46:http > 192.168.0.106:1606 F',50,,
b'her / IP / TCP 157.255.191.46:http > 192.168.0.106:1606 ',50,,
b'her / IP / TCP 116.132.235.228:http > 192.168.0.106:stt S',51,,
b'her / IP / TCP 116.132.235.228:http > 192.168.0.106:stt ',51,,
b'her / IP / TCP 116.132.235.228:http > 192.168.0.106:stt ',51,,
b'her / IP / TCP 116.132.235.228:http > 192.168.0.106:stt ',51,,
b'her / IP / TCP 116.132.235.228:http > 192.168.0.106:stt PA / Ra',51,,
b'her / IP / TCP 116.132.235.228:http > 192.168.0.106:stt F',51,,
b'her / IP / TCP 192.168.0.106:1608 > 116.132.235.228:http ',52,,
b'her / IP / TCP 192.168.0.106:1608 > 116.132.235.228:http ',52,,
b'her / IP / TCP 192.168.0.106:1608 > 116.132.235.228:http PA / Ra',52,,
b'her / IP / TCP 192.168.0.106:1608 > 116.132.235.228:http A / Ra',52,,
b'her / IP / TCP 192.168.0.106:1608 > 116.132.235.228:http A / Ra',52,,
b'her / IP / TCP 192.168.0.106:1608 > 116.132.235.228:http PA / Ra',52,,
b'her / IP / TCP 192.168.0.106:1608 > 116.132.235.228:http ',53,,
b'her / IP / TCP 192.168.0.106:1608 > 116.132.235.228:http F',53,,
b'her / IP / TCP 116.132.235.228:http > 192.168.0.106:1608 S',54,,
b'her / IP / TCP 116.132.235.228:http > 192.168.0.106:1608 ',54,,
b'her / IP / TCP 116.132.235.228:http > 192.168.0.106:1608 ',54,,
b'her / IP / TCP 116.132.235.228:http > 192.168.0.106:1608 ',54,,
b'her / IP / TCP 116.132.235.228:http > 192.168.0.106:1608 PA / Ra',54,,
b'her / IP / TCP 116.132.235.228:http > 192.168.0.106:1608 F',54,,
b'her / IP / TCP 116.132.235.228:http > 192.168.0.106:1608 ',55,,
b'her / IP / TCP 192.168.0.106:1609 > 116.132.235.228:http ',55,,
b'her / IP / TCP 192.168.0.106:1609 > 116.132.235.228:http ',55,,
b'her / IP / TCP 192.168.0.106:1609 > 116.132.235.228:http PA / Ra',55,,
b'her / IP / TCP 192.168.0.106:1609 > 116.132.235.228:http A / Ra',55,,
b'her / IP / TCP 192.168.0.106:1609 > 116.132.235.228:http A / Ra',55,,
b'her / IP / TCP 192.168.0.106:1609 > 116.132.235.228:http PA / Ra',55,,
b'her / IP / TCP 192.168.0.106:1609 > 116.132.235.228:http ',56,,
b'her / IP / TCP 192.168.0.106:1609 > 116.132.235.228:http F',56,,
b'her / IP / TCP 116.132.235.228:http > 192.168.0.106:1609 S',57,,
b'her / IP / TCP 116.132.235.228:http > 192.168.0.106:1609 ',57,,
b'her / IP / TCP 116.132.235.228:http > 192.168.0.106:1609 ',57,,
b'her / IP / TCP 116.132.235.228:http > 192.168.0.106:1609 ',57,,
b'her / IP / TCP 116.132.235.228:http > 192.168.0.106:1609 PA / Ra',57,,
b'her / IP / TCP 116.132.235.228:http > 192.168.0.106:1609 F',57,,
b'her / IP / TCP 116.132.235.228:http > 192.168.0.106:1609 ',58,,
b'her / IP / TCP 192.168.0.106:1610 > 116.132.235.228:http ',58,,
b'her / IP / TCP 192.168.0.106:1610 > 116.132.235.228:http ',58,,
b'her / IP / TCP 192.168.0.106:1610 > 116.132.235.228:http PA / Ra',58,,
b'her / IP / TCP 192.168.0.106:1610 > 116.132.235.228:http A / Ra',58,,
b'her / IP / TCP 192.168.0.106:1610 > 116.132.235.228:http A / Ra',58,,
b'her / IP / TCP 192.168.0.106:1610 > 116.132.235.228:http PA / Ra',58,,
b'her / IP / TCP 192.168.0.106:1610 > 116.132.235.228:http ',59,,
b'her / IP / TCP 192.168.0.106:1610 > 116.132.235.228:http F',59,,
b'her / IP / TCP 192.168.0.106:1610 > 116.132.235.228:http F',59,,
b'her / IP / TCP 192.168.0.106:1610 > 116.132.235.228:http F',59,,
b'her / IP / TCP 192.168.0.106:1610 > 116.132.235.228:http F',59,,
b'her / IP / TCP 192.168.0.106:1610 > 116.132.235.228:http F',59,,
b'her / IP / TCP 192.168.0.106:1610 > 116.132.235.228:http F',59,,
b'her / IP / TCP 116.132.235.228:http > 192.168.0.106:1610 S',60,,
b'her / IP / TCP 116.132.235.228:http > 192.168.0.106:1610 ',60,,
b'her / IP / TCP 116.132.235.228:http > 192.168.0.106:1610 ',60,,
b'her / IP / TCP 116.132.235.228:http > 192.168.0.106:1610 PA / Ra',60,,
b'her / IP / TCP 116.132.235.228:http > 192.168.0.106:1610 F',60,,
b'her / IP / TCP 192.168.0.106:1473 > 119.28.20.150:https A / Ra',61,,
b'her / IP / TCP 119.28.20.150:https > 192.168.0.106:1473 ',62,,
b'her / IP / TCP 192.168.0.106:1611 > 116.132.235.228:http ',63,,
b'her / IP / TCP 192.168.0.106:1611 > 116.132.235.228:http ',63,,
b'her / IP / TCP 192.168.0.106:1611 > 116.132.235.228:http PA / Ra',63,,
b'her / IP / TCP 192.168.0.106:1611 > 116.132.235.228:http A / Ra',63,,
b'her / IP / TCP 192.168.0.106:1611 > 116.132.235.228:http A / Ra',63,,
b'her / IP / TCP 192.168.0.106:1611 > 116.132.235.228:http PA / Ra',63,,
b'her / IP / TCP 192.168.0.106:1611 > 116.132.235.228:http ',64,,
b'her / IP / TCP 192.168.0.106:1611 > 116.132.235.228:http F',64,,
b'her / IP / TCP 192.168.0.106:1611 > 116.132.235.228:http F',64,,
b'her / IP / TCP 192.168.0.106:1611 > 116.132.235.228:http F',64,,
b'her / IP / TCP 192.168.0.106:1611 > 116.132.235.228:http F',64,,
b'her / IP / TCP 192.168.0.106:1611 > 116.132.235.228:http F',64,,
b'her / IP / TCP 192.168.0.106:1611 > 116.132.235.228:http F',64,,
b'her / IP / TCP 116.132.235.228:http > 192.168.0.106:1611 S',65,,
b'her / IP / TCP 116.132.235.228:http > 192.168.0.106:1611 ',65,,
b'her / IP / TCP 116.132.235.228:http > 192.168.0.106:1611 ',65,,
b'her / IP / TCP 116.132.235.228:http > 192.168.0.106:1611 ',65,,
b'her / IP / TCP 116.132.235.228:http > 192.168.0.106:1611 PA / Ra',65,,
b'her / IP / TCP 116.132.235.228:http > 192.168.0.106:1611 F',65,,
b'her / IP / TCP 192.168.0.106:1612 > 116.132.235.228:http ',66,,
b'her / IP / TCP 192.168.0.106:1612 > 116.132.235.228:http ',66,,
b'her / IP / TCP 192.168.0.106:1612 > 116.132.235.228:http PA / Ra',66,,
b'her / IP / TCP 192.168.0.106:1612 > 116.132.235.228:http A / Ra',66,,
b'her / IP / TCP 192.168.0.106:1612 > 116.132.235.228:http A / Ra',66,,
b'her / IP / TCP 192.168.0.106:1612 > 116.132.235.228:http PA / Ra',66,,
b'her / IP / TCP 192.168.0.106:1612 > 116.132.235.228:http ',67,,
b'her / IP / TCP 192.168.0.106:1612 > 116.132.235.228:http F',67,,
b'her / IP / TCP 192.168.0.106:1612 > 116.132.235.228:http F',67,,
b'her / IP / TCP 192.168.0.106:1612 > 116.132.235.228:http F',67,,
b'her / IP / TCP 192.168.0.106:1612 > 116.132.235.228:http F',67,,
b'her / IP / TCP 192.168.0.106:1612 > 116.132.235.228:http F',67,,
b'her / IP / TCP 192.168.0.106:1612 > 116.132.235.228:http F',67,,
b'her / IP / TCP 116.132.235.228:http > 192.168.0.106:1612 S',68,,
b'her / IP / TCP 116.132.235.228:http > 192.168.0.106:1612 ',68,,
b'her / IP / TCP 116.132.235.228:http > 192.168.0.106:1612 ',68,,
b'her / IP / TCP 116.132.235.228:http > 192.168.0.106:1612 ',68,,
b'her / IP / TCP 116.132.235.228:http > 192.168.0.106:1612 PA / Ra',68,,
b'her / IP / TCP 116.132.235.228:http > 192.168.0.106:1612 F',68,,
b'her / IP / TCP 192.168.0.106:1613 > 116.132.235.228:http ',69,,
b'her / IP / TCP 192.168.0.106:1613 > 116.132.235.228:http ',69,,
b'her / IP / TCP 192.168.0.106:1613 > 116.132.235.228:http PA / Ra',69,,
b'her / IP / TCP 192.168.0.106:1613 > 116.132.235.228:http A / Ra',69,,
b'her / IP / TCP 192.168.0.106:1613 > 116.132.235.228:http A / Ra',69,,
b'her / IP / TCP 192.168.0.106:1613 > 116.132.235.228:http PA / Ra',69,,
b'her / IP / TCP 192.168.0.106:1613 > 116.132.235.228:http ',70,,
b'her / IP / TCP 192.168.0.106:1613 > 116.132.235.228:http F',70,,
b'her / IP / TCP 192.168.0.106:1613 > 116.132.235.228:http F',70,,
b'her / IP / TCP 192.168.0.106:1613 > 116.132.235.228:http F',70,,
b'her / IP / TCP 192.168.0.106:1613 > 116.132.235.228:http F',70,,
b'her / IP / TCP 192.168.0.106:1613 > 116.132.235.228:http F',70,,
b'her / IP / TCP 192.168.0.106:1613 > 116.132.235.228:http F',70,,
b'her / IP / TCP 116.132.235.228:http > 192.168.0.106:1613 S',71,,
b'her / IP / TCP 116.132.235.228:http > 192.168.0.106:1613 ',71,,
b'her / IP / TCP 116.132.235.228:http > 192.168.0.106:1613 ',71,,
b'her / IP / TCP 116.132.235.228:http > 192.168.0.106:1613 ',71,,
b'her / IP / TCP 116.132.235.228:http > 192.168.0.106:1613 PA / Ra',71,,
b'her / IP / TCP 116.132.235.228:http > 192.168.0.106:1613 F',71,,
b'her / IP / TCP 36.25.241.89:https > 192.168.0.106:10615 PA / Ra',72,,
b'her / IP / TCP 36.25.241.89:https > 192.168.0.106:10615 F',72,,
b'her / IP / TCP 192.168.0.106:10615 > 36.25.241.89:https ',73,,
b'her / IP / TCP 36.25.241.89:https > 192.168.0.106:10606 PA / Ra',74,,
b'her / IP / TCP 36.25.241.89:https > 192.168.0.106:10606 F',74,,
b'her / IP / TCP 192.168.0.106:10606 > 36.25.241.89:https ',75,,
b'her / IP / UDP 192.168.0.106:50634 > 125.39.196.188:8000 / Ra',76,,
b'her / IP / UDP 192.168.0.106:50634 > 125.39.196.188:8000 / Ra',76,,
b'her / IP / UDP 192.168.0.106:50634 > 125.39.196.188:8000 / Ra',76,,
b'her / IP / UDP 192.168.0.106:50634 > 125.39.196.188:8000 / Ra',76,,
b'her / IP / UDP 192.168.0.106:50634 > 125.39.196.188:8000 / Ra',76,,
b'her / IP / UDP 125.39.196.188:8000 > 192.168.0.106:50634 / Ra',77,,
b'her / IP / UDP 125.39.196.188:8000 > 192.168.0.106:50634 / Ra',77,,
b'her / IP / UDP 125.39.196.188:8000 > 192.168.0.106:50634 / Ra',77,,
b'her / IP / UDP 125.39.196.188:8000 > 192.168.0.106:50634 / Ra',77,,
b'her / IP / TCP 125.39.133.27:https > 192.168.0.106:1452 PA / Ra',78,,
b'her / IP / TCP 192.168.0.106:1452 > 125.39.133.27:https ',79,,
b'her / IP / TCP 36.25.241.89:https > 192.168.0.106:10623 PA / Ra',80,,
b'her / IP / TCP 36.25.241.89:https > 192.168.0.106:10623 F',80,,
b'her / IP / TCP 192.168.0.106:10623 > 36.25.241.89:https ',81,,
b'her / IP / TCP 192.168.0.106:1432 > 60.29.237.143:14000 F',82,,
b'her / IP / TCP 192.168.0.106:1451 > 58.251.106.223:https R',83,,
b'her / IP / TCP 192.168.0.106:1459 > 42.231.136.110:https F',84,,
b'her / IP / TCP 192.168.0.106:1614 > 60.29.237.143:14000 ',85,,
b'her / IP / TCP 192.168.0.106:1614 > 60.29.237.143:14000 ',85,,
b'her / IP / TCP 192.168.0.106:1614 > 60.29.237.143:14000 PA / Ra',85,,
b'her / IP / TCP 192.168.0.106:1614 > 60.29.237.143:14000 PA / Ra',85,,
b'her / IP / TCP 192.168.0.106:1614 > 60.29.237.143:14000 ',85,,
b'her / IP / TCP 42.231.136.110:https > 192.168.0.106:1459 ',86,,
b'her / IP / TCP 60.29.237.143:14000 > 192.168.0.106:1432 ',87,,
b'her / IP / TCP 60.29.237.143:14000 > 192.168.0.106:1614 S',88,,
b'her / IP / TCP 60.29.237.143:14000 > 192.168.0.106:1614 ',88,,
b'her / IP / TCP 60.29.237.143:14000 > 192.168.0.106:1614 ',88,,
b'her / IP / TCP 60.29.237.143:14000 > 192.168.0.106:1614 PA / Ra',88,,
b'her / IP / TCP 119.3.178.178:21113 > 192.168.0.106:6806 A / Paddin',89,,
b'her / IP / TCP 192.168.0.106:6806 > 119.3.178.178:21113 ',90,,
b'her / IP / TCP 139.224.70.134:https > 192.168.0.106:7880 PA / Ra',91,,
b'her / IP / TCP 139.224.70.134:https > 192.168.0.106:7880 A / Paddin',91,,
b'her / IP / TCP 192.168.0.106:7880 > 139.224.70.134:https PA / Ra',92,,
b'her / IP / TCP 192.168.0.106:1615 > 110.242.68.4:http ',93,,
b'her / IP / TCP 192.168.0.106:1615 > 110.242.68.4:http ',93,,
b'her / IP / TCP 192.168.0.106:1615 > 110.242.68.4:http F',93,,
b'her / IP / TCP 192.168.0.106:1615 > 110.242.68.4:http ',93,,
b'her / IP / TCP 110.242.68.4:http > 192.168.0.106:1615 S',94,,
b'her / IP / TCP 110.242.68.4:http > 192.168.0.106:1615 ',94,,
b'her / IP / TCP 110.242.68.4:http > 192.168.0.106:1615 F',94,,
b'her / IP / TCP 192.168.0.106:11726 > 157.255.209.167:http PA / Ra',95,,
b'her / IP / TCP 192.168.0.106:11726 > 157.255.209.167:http ',95,,
b'her / IP / TCP 157.255.209.167:http > 192.168.0.106:11726 A / Paddin',96,,
b'her / IP / TCP 157.255.209.167:http > 192.168.0.106:11726 PA / Ra',96,,
b'her / IP / TCP 192.168.0.106:10805 > 59.38.123.207:45902 A / Ra',97,,
b'her / IP / TCP 59.38.123.207:45902 > 192.168.0.106:10805 ',98,,
b'her / IP / TCP 192.168.0.106:10817 > 59.38.123.207:45902 A / Ra',99,,
b'her / IP / TCP 59.38.123.207:45902 > 192.168.0.106:10817 ',100,,
b'her / IP / TCP 192.168.0.106:10595 > 23.195.91.203:https A / Ra',101,,
b'her / IP / TCP 23.195.91.203:https > 192.168.0.106:10595 ',102,,
