data,flowmember,label,classes
b'her / IP / TCP 192.168.0.106:4429 > 60.29.237.214:14000 PA / Ra',1,,
b'her / IP / TCP 192.168.0.106:4429 > 60.29.237.214:14000 ',1,,
b'her / IP / TCP 60.29.237.214:14000 > 192.168.0.106:4429 PA / Ra',2,,
b'her / IP / TCP 192.168.0.106:4616 > 13.107.42.12:https PA / Ra',3,,
b'her / IP / TCP 192.168.0.106:4616 > 13.107.42.12:https PA / Ra',3,,
b'her / IP / TCP 192.168.0.106:4616 > 13.107.42.12:https ',3,,
b'her / IP / TCP 192.168.0.106:8455 > 116.132.235.228:http ',4,,
b'her / IP / TCP 192.168.0.106:8455 > 116.132.235.228:http ',4,,
b'her / IP / TCP 192.168.0.106:8455 > 116.132.235.228:http PA / Ra',4,,
b'her / IP / TCP 192.168.0.106:8455 > 116.132.235.228:http A / Ra',4,,
b'her / IP / TCP 192.168.0.106:8455 > 116.132.235.228:http A / Ra',4,,
b'her / IP / TCP 192.168.0.106:8455 > 116.132.235.228:http PA / Ra',4,,
b'her / IP / TCP 192.168.0.106:8455 > 116.132.235.228:http ',5,,
b'her / IP / TCP 192.168.0.106:8455 > 116.132.235.228:http F',5,,
b'her / IP / TCP 13.107.42.12:https > 192.168.0.106:4616 A / Paddin',6,,
b'her / IP / TCP 13.107.42.12:https > 192.168.0.106:4616 A / Paddin',6,,
b'her / IP / TCP 13.107.42.12:https > 192.168.0.106:4616 PA / Ra',6,,
b'her / IP / TCP 13.107.42.12:https > 192.168.0.106:4616 PA / Ra',6,,
b'her / IP / TCP 116.132.235.228:http > 192.168.0.106:8455 S',7,,
b'her / IP / TCP 116.132.235.228:http > 192.168.0.106:8455 ',7,,
b'her / IP / TCP 116.132.235.228:http > 192.168.0.106:8455 ',7,,
b'her / IP / TCP 116.132.235.228:http > 192.168.0.106:8455 ',7,,
b'her / IP / TCP 116.132.235.228:http > 192.168.0.106:8455 PA / Ra',7,,
b'her / IP / TCP 116.132.235.228:http > 192.168.0.106:8455 F',7,,
b'her / IP / TCP 116.132.235.228:http > 192.168.0.106:8455 ',8,,
b'her / IP / UDP 192.168.192.1:netbios_ns > 192.168.192.2:netbios_ns / NBNSHeader / Ra',8,,
b'her / IP / UDP 192.168.192.1:netbios_ns > 192.168.192.2:netbios_ns / NBNSHeader / Ra',8,,
b'her / IP / UDP 192.168.192.1:netbios_ns > 192.168.192.2:netbios_ns / NBNSHeader / Ra',8,,
b'her / IP / UDP 192.168.192.1:netbios_ns > 192.168.192.2:netbios_ns / NBNSHeader / Ra',8,,
b'her / IP / UDP 192.168.192.1:netbios_ns > 192.168.192.2:netbios_ns / NBNSHeader / Ra',8,,
b'her / IP / TCP 192.168.0.106:8456 > 116.132.235.228:http ',9,,
b'her / IP / TCP 192.168.0.106:8456 > 116.132.235.228:http ',9,,
b'her / IP / TCP 192.168.0.106:8456 > 116.132.235.228:http PA / Ra',9,,
b'her / IP / TCP 192.168.0.106:8456 > 116.132.235.228:http A / Ra',9,,
b'her / IP / TCP 192.168.0.106:8456 > 116.132.235.228:http A / Ra',9,,
b'her / IP / TCP 192.168.0.106:8456 > 116.132.235.228:http PA / Ra',9,,
b'her / IP / TCP 192.168.0.106:8456 > 116.132.235.228:http ',10,,
b'her / IP / TCP 192.168.0.106:8456 > 116.132.235.228:http F',10,,
b'her / IP / TCP 116.132.235.228:http > 192.168.0.106:8456 S',11,,
b'her / IP / TCP 116.132.235.228:http > 192.168.0.106:8456 ',11,,
b'her / IP / TCP 116.132.235.228:http > 192.168.0.106:8456 ',11,,
b'her / IP / TCP 116.132.235.228:http > 192.168.0.106:8456 ',11,,
b'her / IP / TCP 116.132.235.228:http > 192.168.0.106:8456 PA / Ra',11,,
b'her / IP / TCP 116.132.235.228:http > 192.168.0.106:8456 F',11,,
b'her / IP / TCP 116.132.235.228:http > 192.168.0.106:8456 ',12,,
"b'her / IP / UDP / DNS Qry ""b\'_companion-link._tcp.local.\'""'",12,,
"b'her / IP / UDP / DNS Qry ""b\'_companion-link._tcp.local.\'""'",12,,
"b'her / IP / UDP / DNS Qry ""b\'_companion-link._tcp.local.\'""'",12,,
"b'her / IP / UDP / DNS Qry ""b\'_companion-link._tcp.local.\'""'",12,,
"b'her / IP / UDP / DNS Qry ""b\'_companion-link._tcp.local.\'""'",12,,
"b'her / IPv6 / UDP / DNS Qry ""b\'_companion-link._tcp.local.\'""'",13,,
"b'her / IPv6 / UDP / DNS Qry ""b\'_companion-link._tcp.local.\'""'",13,,
"b'her / IPv6 / UDP / DNS Qry ""b\'_companion-link._tcp.local.\'""'",13,,
"b'her / IPv6 / UDP / DNS Qry ""b\'_companion-link._tcp.local.\'""'",13,,
"b'her / IPv6 / UDP / DNS Qry ""b\'_companion-link._tcp.local.\'""'",13,,
b'her / IP / TCP 192.168.0.106:8457 > 116.132.235.228:http ',14,,
b'her / IP / TCP 192.168.0.106:8457 > 116.132.235.228:http ',14,,
b'her / IP / TCP 192.168.0.106:8457 > 116.132.235.228:http PA / Ra',14,,
b'her / IP / TCP 192.168.0.106:8457 > 116.132.235.228:http A / Ra',14,,
b'her / IP / TCP 192.168.0.106:8457 > 116.132.235.228:http A / Ra',14,,
b'her / IP / TCP 192.168.0.106:8457 > 116.132.235.228:http PA / Ra',14,,
b'her / IP / TCP 192.168.0.106:8457 > 116.132.235.228:http ',15,,
b'her / IP / TCP 192.168.0.106:8457 > 116.132.235.228:http F',15,,
b'her / IP / TCP 116.132.235.228:http > 192.168.0.106:8457 S',16,,
b'her / IP / TCP 116.132.235.228:http > 192.168.0.106:8457 ',16,,
b'her / IP / TCP 116.132.235.228:http > 192.168.0.106:8457 ',16,,
b'her / IP / TCP 116.132.235.228:http > 192.168.0.106:8457 ',16,,
b'her / IP / TCP 116.132.235.228:http > 192.168.0.106:8457 PA / Ra',16,,
b'her / IP / TCP 116.132.235.228:http > 192.168.0.106:8457 F',16,,
b'her / IP / TCP 116.132.235.228:http > 192.168.0.106:8457 ',17,,
b'her / IP / TCP 192.168.0.106:8458 > 116.132.235.228:http ',17,,
b'her / IP / TCP 192.168.0.106:8458 > 116.132.235.228:http ',17,,
b'her / IP / TCP 192.168.0.106:8458 > 116.132.235.228:http PA / Ra',17,,
b'her / IP / TCP 192.168.0.106:8458 > 116.132.235.228:http A / Ra',17,,
b'her / IP / TCP 192.168.0.106:8458 > 116.132.235.228:http A / Ra',17,,
b'her / IP / TCP 192.168.0.106:8458 > 116.132.235.228:http PA / Ra',17,,
b'her / IP / TCP 192.168.0.106:8458 > 116.132.235.228:http F',18,,
b'her / IP / TCP 192.168.0.106:8458 > 116.132.235.228:http ',18,,
b'her / IP / TCP 192.168.0.106:8458 > 116.132.235.228:http F',18,,
b'her / IP / TCP 116.132.235.228:http > 192.168.0.106:8458 S',19,,
b'her / IP / TCP 116.132.235.228:http > 192.168.0.106:8458 ',19,,
b'her / IP / TCP 116.132.235.228:http > 192.168.0.106:8458 ',19,,
b'her / IP / TCP 116.132.235.228:http > 192.168.0.106:8458 ',19,,
b'her / IP / TCP 116.132.235.228:http > 192.168.0.106:8458 PA / Ra',19,,
b'her / IP / TCP 116.132.235.228:http > 192.168.0.106:8458 F',19,,
b'her / IP / TCP 116.132.235.228:http > 192.168.0.106:8458 ',20,,
b'her / IP / TCP 116.132.235.228:http > 192.168.0.106:8458 ',20,,
b'her / IP / TCP 192.168.0.106:8459 > 116.132.235.228:http ',21,,
b'her / IP / TCP 192.168.0.106:8459 > 116.132.235.228:http ',21,,
b'her / IP / TCP 192.168.0.106:8459 > 116.132.235.228:http PA / Ra',21,,
b'her / IP / TCP 192.168.0.106:8459 > 116.132.235.228:http A / Ra',21,,
b'her / IP / TCP 192.168.0.106:8459 > 116.132.235.228:http A / Ra',21,,
b'her / IP / TCP 192.168.0.106:8459 > 116.132.235.228:http PA / Ra',21,,
b'her / IP / TCP 192.168.0.106:8459 > 116.132.235.228:http ',22,,
b'her / IP / TCP 192.168.0.106:8459 > 116.132.235.228:http F',22,,
b'her / IP / TCP 192.168.0.106:8459 > 116.132.235.228:http F',22,,
b'her / IP / TCP 192.168.0.106:8459 > 116.132.235.228:http F',22,,
b'her / IP / TCP 192.168.0.106:8459 > 116.132.235.228:http F',22,,
b'her / IP / TCP 192.168.0.106:8459 > 116.132.235.228:http F',22,,
b'her / IP / TCP 192.168.0.106:8459 > 116.132.235.228:http F',22,,
b'her / IP / TCP 192.168.0.106:8459 > 116.132.235.228:http R',23,,
b'her / IP / TCP 116.132.235.228:http > 192.168.0.106:8459 S',23,,
b'her / IP / TCP 116.132.235.228:http > 192.168.0.106:8459 ',23,,
b'her / IP / TCP 116.132.235.228:http > 192.168.0.106:8459 ',23,,
b'her / IP / TCP 116.132.235.228:http > 192.168.0.106:8459 ',23,,
b'her / IP / TCP 116.132.235.228:http > 192.168.0.106:8459 PA / Ra',23,,
b'her / IP / TCP 116.132.235.228:http > 192.168.0.106:8459 F',23,,
b'her / IP / TCP 192.168.0.106:4167 > 116.130.230.27:https PA / Ra',24,,
b'her / IP / TCP 192.168.0.106:4167 > 116.130.230.27:https ',24,,
b'her / IP / TCP 192.168.0.106:4167 > 116.130.230.27:https PA / Ra',24,,
b'her / IP / TCP 192.168.0.106:4167 > 116.130.230.27:https ',24,,
b'her / IP / TCP 116.130.230.27:https > 192.168.0.106:4167 PA / Ra',25,,
b'her / IP / TCP 116.130.230.27:https > 192.168.0.106:4167 PA / Ra',25,,
b'her / IP / TCP 192.168.0.106:8460 > 116.132.235.228:http ',26,,
b'her / IP / TCP 192.168.0.106:8460 > 116.132.235.228:http ',26,,
b'her / IP / TCP 192.168.0.106:8460 > 116.132.235.228:http PA / Ra',26,,
b'her / IP / TCP 192.168.0.106:8460 > 116.132.235.228:http A / Ra',26,,
b'her / IP / TCP 192.168.0.106:8460 > 116.132.235.228:http A / Ra',26,,
b'her / IP / TCP 192.168.0.106:8460 > 116.132.235.228:http PA / Ra',26,,
b'her / IP / TCP 192.168.0.106:8460 > 116.132.235.228:http ',27,,
b'her / IP / TCP 192.168.0.106:8460 > 116.132.235.228:http F',27,,
b'her / IP / TCP 116.132.235.228:http > 192.168.0.106:8460 S',28,,
b'her / IP / TCP 116.132.235.228:http > 192.168.0.106:8460 ',28,,
b'her / IP / TCP 116.132.235.228:http > 192.168.0.106:8460 ',28,,
b'her / IP / TCP 116.132.235.228:http > 192.168.0.106:8460 ',28,,
b'her / IP / TCP 116.132.235.228:http > 192.168.0.106:8460 PA / Ra',28,,
b'her / IP / TCP 116.132.235.228:http > 192.168.0.106:8460 F',28,,
b'her / IP / TCP 116.132.235.228:http > 192.168.0.106:8460 ',29,,
b'her / IP / TCP 59.38.123.207:45902 > 192.168.0.106:4323 PA / Ra',29,,
b'her / IP / TCP 59.38.123.207:45902 > 192.168.0.106:4323 PA / Ra',29,,
b'her / IP / TCP 192.168.0.106:4323 > 59.38.123.207:45902 ',30,,
b'her / IP / TCP 192.168.0.106:4323 > 59.38.123.207:45902 ',30,,
b'her / IP / TCP 192.168.0.106:8461 > 116.132.235.228:http ',31,,
b'her / IP / TCP 192.168.0.106:8461 > 116.132.235.228:http ',31,,
b'her / IP / TCP 192.168.0.106:8461 > 116.132.235.228:http PA / Ra',31,,
b'her / IP / TCP 192.168.0.106:8461 > 116.132.235.228:http A / Ra',31,,
b'her / IP / TCP 192.168.0.106:8461 > 116.132.235.228:http A / Ra',31,,
b'her / IP / TCP 192.168.0.106:8461 > 116.132.235.228:http PA / Ra',31,,
b'her / IP / TCP 192.168.0.106:8461 > 116.132.235.228:http F',32,,
b'her / IP / TCP 192.168.0.106:8461 > 116.132.235.228:http ',32,,
b'her / IP / TCP 192.168.0.106:8461 > 116.132.235.228:http F',32,,
b'her / IP / TCP 192.168.0.106:8461 > 116.132.235.228:http F',32,,
b'her / IP / TCP 192.168.0.106:8461 > 116.132.235.228:http F',32,,
b'her / IP / TCP 192.168.0.106:8461 > 116.132.235.228:http F',32,,
b'her / IP / TCP 192.168.0.106:8461 > 116.132.235.228:http F',32,,
b'her / IP / TCP 116.132.235.228:http > 192.168.0.106:8461 S',33,,
b'her / IP / TCP 116.132.235.228:http > 192.168.0.106:8461 ',33,,
b'her / IP / TCP 116.132.235.228:http > 192.168.0.106:8461 ',33,,
b'her / IP / TCP 116.132.235.228:http > 192.168.0.106:8461 ',33,,
b'her / IP / TCP 116.132.235.228:http > 192.168.0.106:8461 PA / Ra',33,,
b'her / IP / TCP 116.132.235.228:http > 192.168.0.106:8461 F',33,,
b'her / IP / TCP 192.168.0.106:8462 > 116.132.235.228:http ',34,,
b'her / IP / TCP 192.168.0.106:8462 > 116.132.235.228:http ',34,,
b'her / IP / TCP 192.168.0.106:8462 > 116.132.235.228:http PA / Ra',34,,
b'her / IP / TCP 192.168.0.106:8462 > 116.132.235.228:http A / Ra',34,,
b'her / IP / TCP 192.168.0.106:8462 > 116.132.235.228:http A / Ra',34,,
b'her / IP / TCP 192.168.0.106:8462 > 116.132.235.228:http PA / Ra',34,,
b'her / IP / TCP 192.168.0.106:8462 > 116.132.235.228:http ',35,,
b'her / IP / TCP 192.168.0.106:8462 > 116.132.235.228:http F',35,,
b'her / IP / TCP 192.168.0.106:8462 > 116.132.235.228:http F',35,,
b'her / IP / TCP 192.168.0.106:8462 > 116.132.235.228:http F',35,,
b'her / IP / TCP 192.168.0.106:8462 > 116.132.235.228:http F',35,,
b'her / IP / TCP 192.168.0.106:8462 > 116.132.235.228:http F',35,,
b'her / IP / TCP 192.168.0.106:8462 > 116.132.235.228:http F',35,,
b'her / IP / TCP 116.132.235.228:http > 192.168.0.106:8462 S',36,,
b'her / IP / TCP 116.132.235.228:http > 192.168.0.106:8462 ',36,,
b'her / IP / TCP 116.132.235.228:http > 192.168.0.106:8462 ',36,,
b'her / IP / TCP 116.132.235.228:http > 192.168.0.106:8462 ',36,,
b'her / IP / TCP 116.132.235.228:http > 192.168.0.106:8462 PA / Ra',36,,
b'her / IP / TCP 116.132.235.228:http > 192.168.0.106:8462 F',36,,
b'her / IP / TCP 192.168.0.106:8463 > 110.242.68.4:http ',37,,
b'her / IP / TCP 192.168.0.106:8463 > 110.242.68.4:http ',37,,
b'her / IP / TCP 192.168.0.106:8463 > 110.242.68.4:http F',37,,
b'her / IP / TCP 192.168.0.106:8463 > 110.242.68.4:http F',37,,
b'her / IP / TCP 192.168.0.106:8463 > 110.242.68.4:http F',37,,
b'her / IP / TCP 192.168.0.106:8463 > 110.242.68.4:http F',37,,
b'her / IP / TCP 192.168.0.106:8463 > 110.242.68.4:http F',38,,
b'her / IP / TCP 192.168.0.106:8463 > 110.242.68.4:http F',38,,
b'her / IP / TCP 110.242.68.4:http > 192.168.0.106:8463 S',39,,
b'her / IP / TCP 192.168.0.106:8464 > 116.132.235.228:http ',40,,
b'her / IP / TCP 192.168.0.106:8464 > 116.132.235.228:http ',40,,
b'her / IP / TCP 192.168.0.106:8464 > 116.132.235.228:http PA / Ra',40,,
b'her / IP / TCP 192.168.0.106:8464 > 116.132.235.228:http A / Ra',40,,
b'her / IP / TCP 192.168.0.106:8464 > 116.132.235.228:http A / Ra',40,,
b'her / IP / TCP 192.168.0.106:8464 > 116.132.235.228:http PA / Ra',40,,
b'her / IP / TCP 192.168.0.106:8464 > 116.132.235.228:http ',41,,
b'her / IP / TCP 192.168.0.106:8464 > 116.132.235.228:http F',41,,
b'her / IP / TCP 116.132.235.228:http > 192.168.0.106:8464 S',42,,
b'her / IP / TCP 116.132.235.228:http > 192.168.0.106:8464 ',42,,
b'her / IP / TCP 116.132.235.228:http > 192.168.0.106:8464 ',42,,
b'her / IP / TCP 116.132.235.228:http > 192.168.0.106:8464 ',42,,
b'her / IP / TCP 116.132.235.228:http > 192.168.0.106:8464 PA / Ra',42,,
b'her / IP / TCP 116.132.235.228:http > 192.168.0.106:8464 F',42,,
b'her / IP / TCP 116.132.235.228:http > 192.168.0.106:8464 ',43,,
b'her / IP / TCP 192.168.0.106:8465 > 116.132.235.228:http ',43,,
b'her / IP / TCP 192.168.0.106:8465 > 116.132.235.228:http ',43,,
b'her / IP / TCP 192.168.0.106:8465 > 116.132.235.228:http PA / Ra',43,,
b'her / IP / TCP 192.168.0.106:8465 > 116.132.235.228:http A / Ra',43,,
b'her / IP / TCP 192.168.0.106:8465 > 116.132.235.228:http A / Ra',43,,
b'her / IP / TCP 192.168.0.106:8465 > 116.132.235.228:http PA / Ra',43,,
b'her / IP / TCP 192.168.0.106:8465 > 116.132.235.228:http ',44,,
b'her / IP / TCP 192.168.0.106:8465 > 116.132.235.228:http F',44,,
b'her / IP / TCP 116.132.235.228:http > 192.168.0.106:8465 S',45,,
b'her / IP / TCP 116.132.235.228:http > 192.168.0.106:8465 ',45,,
b'her / IP / TCP 116.132.235.228:http > 192.168.0.106:8465 ',45,,
b'her / IP / TCP 116.132.235.228:http > 192.168.0.106:8465 ',45,,
b'her / IP / TCP 116.132.235.228:http > 192.168.0.106:8465 PA / Ra',45,,
b'her / IP / TCP 116.132.235.228:http > 192.168.0.106:8465 F',45,,
b'her / IP / TCP 116.132.235.228:http > 192.168.0.106:8465 ',46,,
b'her / IP / TCP 192.168.0.106:8466 > 116.132.235.228:http ',46,,
b'her / IP / TCP 192.168.0.106:8466 > 116.132.235.228:http ',46,,
b'her / IP / TCP 192.168.0.106:8466 > 116.132.235.228:http PA / Ra',46,,
b'her / IP / TCP 192.168.0.106:8466 > 116.132.235.228:http A / Ra',46,,
b'her / IP / TCP 192.168.0.106:8466 > 116.132.235.228:http A / Ra',46,,
b'her / IP / TCP 192.168.0.106:8466 > 116.132.235.228:http PA / Ra',46,,
b'her / IP / TCP 192.168.0.106:8466 > 116.132.235.228:http ',47,,
b'her / IP / TCP 192.168.0.106:8466 > 116.132.235.228:http F',47,,
b'her / IP / TCP 116.132.235.228:http > 192.168.0.106:8466 S',48,,
b'her / IP / TCP 116.132.235.228:http > 192.168.0.106:8466 ',48,,
b'her / IP / TCP 116.132.235.228:http > 192.168.0.106:8466 ',48,,
b'her / IP / TCP 116.132.235.228:http > 192.168.0.106:8466 ',48,,
b'her / IP / TCP 116.132.235.228:http > 192.168.0.106:8466 PA / Ra',48,,
b'her / IP / TCP 116.132.235.228:http > 192.168.0.106:8466 F',48,,
b'her / IP / TCP 116.132.235.228:http > 192.168.0.106:8466 ',49,,
b'her / IP / TCP 192.168.0.106:8467 > 116.132.235.228:http ',49,,
b'her / IP / TCP 192.168.0.106:8467 > 116.132.235.228:http ',49,,
b'her / IP / TCP 192.168.0.106:8467 > 116.132.235.228:http PA / Ra',49,,
b'her / IP / TCP 192.168.0.106:8467 > 116.132.235.228:http A / Ra',49,,
b'her / IP / TCP 192.168.0.106:8467 > 116.132.235.228:http A / Ra',49,,
b'her / IP / TCP 192.168.0.106:8467 > 116.132.235.228:http PA / Ra',49,,
b'her / IP / TCP 192.168.0.106:8467 > 116.132.235.228:http ',50,,
b'her / IP / TCP 192.168.0.106:8467 > 116.132.235.228:http F',50,,
b'her / IP / TCP 116.132.235.228:http > 192.168.0.106:8467 S',51,,
b'her / IP / TCP 116.132.235.228:http > 192.168.0.106:8467 ',51,,
b'her / IP / TCP 116.132.235.228:http > 192.168.0.106:8467 ',51,,
b'her / IP / TCP 116.132.235.228:http > 192.168.0.106:8467 ',51,,
b'her / IP / TCP 116.132.235.228:http > 192.168.0.106:8467 PA / Ra',51,,
b'her / IP / TCP 116.132.235.228:http > 192.168.0.106:8467 F',51,,
b'her / IP / TCP 116.132.235.228:http > 192.168.0.106:8467 ',52,,
b'her / IP / TCP 192.168.0.106:8468 > 116.132.235.228:http ',52,,
b'her / IP / TCP 192.168.0.106:8468 > 116.132.235.228:http ',52,,
b'her / IP / TCP 192.168.0.106:8468 > 116.132.235.228:http PA / Ra',52,,
b'her / IP / TCP 192.168.0.106:8468 > 116.132.235.228:http A / Ra',52,,
b'her / IP / TCP 192.168.0.106:8468 > 116.132.235.228:http A / Ra',52,,
b'her / IP / TCP 192.168.0.106:8468 > 116.132.235.228:http PA / Ra',52,,
b'her / IP / TCP 192.168.0.106:8468 > 116.132.235.228:http ',53,,
b'her / IP / TCP 192.168.0.106:8468 > 116.132.235.228:http F',53,,
b'her / IP / TCP 116.132.235.228:http > 192.168.0.106:8468 S',54,,
b'her / IP / TCP 116.132.235.228:http > 192.168.0.106:8468 ',54,,
b'her / IP / TCP 116.132.235.228:http > 192.168.0.106:8468 ',54,,
b'her / IP / TCP 116.132.235.228:http > 192.168.0.106:8468 ',54,,
b'her / IP / TCP 116.132.235.228:http > 192.168.0.106:8468 PA / Ra',54,,
b'her / IP / TCP 116.132.235.228:http > 192.168.0.106:8468 F',54,,
b'her / IP / TCP 116.132.235.228:http > 192.168.0.106:8468 ',55,,
b'her / IP / TCP 192.168.0.106:8469 > 116.132.235.228:http ',55,,
b'her / IP / TCP 192.168.0.106:8469 > 116.132.235.228:http ',55,,
b'her / IP / TCP 192.168.0.106:8469 > 116.132.235.228:http PA / Ra',55,,
b'her / IP / TCP 192.168.0.106:8469 > 116.132.235.228:http A / Ra',55,,
b'her / IP / TCP 192.168.0.106:8469 > 116.132.235.228:http A / Ra',55,,
b'her / IP / TCP 192.168.0.106:8469 > 116.132.235.228:http PA / Ra',55,,
b'her / IP / TCP 192.168.0.106:8469 > 116.132.235.228:http ',56,,
b'her / IP / TCP 192.168.0.106:8469 > 116.132.235.228:http F',56,,
b'her / IP / TCP 192.168.0.106:8469 > 116.132.235.228:http F',56,,
b'her / IP / TCP 192.168.0.106:8469 > 116.132.235.228:http F',56,,
b'her / IP / TCP 192.168.0.106:8469 > 116.132.235.228:http F',56,,
b'her / IP / TCP 192.168.0.106:8469 > 116.132.235.228:http F',56,,
b'her / IP / TCP 192.168.0.106:8469 > 116.132.235.228:http F',56,,
b'her / IP / TCP 116.132.235.228:http > 192.168.0.106:8469 S',57,,
b'her / IP / TCP 116.132.235.228:http > 192.168.0.106:8469 ',57,,
b'her / IP / TCP 116.132.235.228:http > 192.168.0.106:8469 ',57,,
b'her / IP / TCP 116.132.235.228:http > 192.168.0.106:8469 ',57,,
b'her / IP / TCP 116.132.235.228:http > 192.168.0.106:8469 PA / Ra',57,,
b'her / IP / TCP 116.132.235.228:http > 192.168.0.106:8469 F',57,,
b'her / IP / TCP 192.168.0.106:8470 > 116.132.235.228:http ',58,,
b'her / IP / TCP 192.168.0.106:8470 > 116.132.235.228:http ',58,,
b'her / IP / TCP 192.168.0.106:8470 > 116.132.235.228:http PA / Ra',58,,
b'her / IP / TCP 192.168.0.106:8470 > 116.132.235.228:http A / Ra',58,,
b'her / IP / TCP 192.168.0.106:8470 > 116.132.235.228:http A / Ra',58,,
b'her / IP / TCP 192.168.0.106:8470 > 116.132.235.228:http PA / Ra',58,,
b'her / IP / TCP 192.168.0.106:8470 > 116.132.235.228:http ',59,,
b'her / IP / TCP 192.168.0.106:8470 > 116.132.235.228:http F',59,,
b'her / IP / TCP 192.168.0.106:8470 > 116.132.235.228:http F',59,,
b'her / IP / TCP 192.168.0.106:8470 > 116.132.235.228:http F',59,,
b'her / IP / TCP 192.168.0.106:8470 > 116.132.235.228:http F',59,,
b'her / IP / TCP 192.168.0.106:8470 > 116.132.235.228:http F',59,,
b'her / IP / TCP 192.168.0.106:8470 > 116.132.235.228:http F',59,,
b'her / IP / TCP 116.132.235.228:http > 192.168.0.106:8470 S',60,,
b'her / IP / TCP 116.132.235.228:http > 192.168.0.106:8470 ',60,,
b'her / IP / TCP 116.132.235.228:http > 192.168.0.106:8470 ',60,,
b'her / IP / TCP 116.132.235.228:http > 192.168.0.106:8470 ',60,,
b'her / IP / TCP 116.132.235.228:http > 192.168.0.106:8470 ',60,,
b'her / IP / TCP 116.132.235.228:http > 192.168.0.106:8470 PA / Ra',60,,
b'her / IP / TCP 116.132.235.228:http > 192.168.0.106:8470 F',61,,
b'her / IP / TCP 192.168.0.106:8471 > 116.132.235.228:http ',61,,
b'her / IP / TCP 192.168.0.106:8471 > 116.132.235.228:http ',61,,
b'her / IP / TCP 192.168.0.106:8471 > 116.132.235.228:http PA / Ra',61,,
b'her / IP / TCP 192.168.0.106:8471 > 116.132.235.228:http A / Ra',61,,
b'her / IP / TCP 192.168.0.106:8471 > 116.132.235.228:http A / Ra',61,,
b'her / IP / TCP 192.168.0.106:8471 > 116.132.235.228:http PA / Ra',61,,
b'her / IP / TCP 192.168.0.106:8471 > 116.132.235.228:http ',62,,
b'her / IP / TCP 192.168.0.106:8471 > 116.132.235.228:http F',62,,
b'her / IP / TCP 116.132.235.228:http > 192.168.0.106:8471 S',63,,
b'her / IP / TCP 116.132.235.228:http > 192.168.0.106:8471 ',63,,
b'her / IP / TCP 116.132.235.228:http > 192.168.0.106:8471 ',63,,
b'her / IP / TCP 116.132.235.228:http > 192.168.0.106:8471 ',63,,
b'her / IP / TCP 116.132.235.228:http > 192.168.0.106:8471 PA / Ra',63,,
b'her / IP / TCP 116.132.235.228:http > 192.168.0.106:8471 F',63,,
b'her / IP / TCP 116.132.235.228:http > 192.168.0.106:8471 ',64,,
b'her / IP / TCP 192.168.0.106:4426 > 116.130.224.119:https PA / Ra',64,,
b'her / IP / TCP 192.168.0.106:4426 > 116.130.224.119:https ',64,,
b'her / IP / TCP 192.168.0.106:4426 > 116.130.224.119:https ',64,,
b'her / IP / TCP 116.130.224.119:https > 192.168.0.106:4426 PA / Ra',65,,
b'her / IP / TCP 116.130.224.119:https > 192.168.0.106:4426 PA / Ra',65,,
b'her / IP / TCP 192.168.0.106:8472 > 110.242.68.4:http ',66,,
b'her / IP / TCP 192.168.0.106:8472 > 110.242.68.4:http ',66,,
b'her / IP / TCP 192.168.0.106:8472 > 110.242.68.4:http F',66,,
b'her / IP / TCP 192.168.0.106:8472 > 110.242.68.4:http F',66,,
b'her / IP / TCP 192.168.0.106:8472 > 110.242.68.4:http F',66,,
b'her / IP / TCP 192.168.0.106:8472 > 110.242.68.4:http F',66,,
b'her / IP / TCP 192.168.0.106:8472 > 110.242.68.4:http F',67,,
b'her / IP / TCP 110.242.68.4:http > 192.168.0.106:8472 S',67,,
"b'her / IP / UDP / DNS Qry ""b\'assets.pyecharts.org.\'""'",68,,
"b'her / IP / UDP / DNS Qry ""b\'code.jquery.com.\'""'",69,,
"b'her / IP / UDP / DNS Qry ""b\'wpad.www.tendawifi.com.\'""'",69,,
"b'her / IP / UDP / DNS Qry ""b\'functional.events.data.microsoft.com.\'""'",69,,
"b'her / IP / UDP / DNS Qry ""b\'nav-edge.smartscreen.microsoft.com.\'""'",70,,
"b'her / IP / UDP / DNS Ans ""69.16.175.10""'",71,,
b'her / IP / UDP / DNS Ans',71,,
"b'her / IP / UDP / DNS Ans ""b\'global.asimov.events.data.trafficmanager.net.\'""'",71,,
b'her / IP / TCP 192.168.0.106:8474 > 69.16.175.10:http ',72,,
b'her / IP / TCP 192.168.0.106:8474 > 69.16.175.10:http ',72,,
"b'her / IP / UDP / DNS Ans ""119.28.20.150""'",73,,
"b'her / IP / UDP / DNS Ans ""b\'tm-prod-wd-csp-edge.trafficmanager.net.\'""'",74,,
b'her / IP / TCP 192.168.0.106:8475 > 20.195.112.105:https ',75,,
b'her / IP / TCP 192.168.0.106:8475 > 20.195.112.105:https ',75,,
b'her / IP / TCP 192.168.0.106:8475 > 20.195.112.105:https PA / Ra',75,,
b'her / IP / TCP 192.168.0.106:8475 > 20.195.112.105:https ',75,,
b'her / IP / TCP 192.168.0.106:8475 > 20.195.112.105:https PA / Ra',75,,
b'her / IP / TCP 192.168.0.106:8475 > 20.195.112.105:https PA / Ra',75,,
b'her / IP / TCP 192.168.0.106:8475 > 20.195.112.105:https A / Ra',76,,
b'her / IP / TCP 192.168.0.106:8475 > 20.195.112.105:https PA / Ra',76,,
b'her / IP / TCP 192.168.0.106:8475 > 20.195.112.105:https ',76,,
b'her / IP / TCP 192.168.0.106:8475 > 20.195.112.105:https F',76,,
b'her / IP / TCP 192.168.0.106:8475 > 20.195.112.105:https F',76,,
b'her / IP / TCP 192.168.0.106:8475 > 20.195.112.105:https F',76,,
b'her / IP / TCP 192.168.0.106:8475 > 20.195.112.105:https F',76,,
b'her / IP / TCP 192.168.0.106:8475 > 20.195.112.105:https F',77,,
b'her / IP / TCP 192.168.0.106:8476 > 119.28.20.150:https ',77,,
b'her / IP / TCP 192.168.0.106:8476 > 119.28.20.150:https ',77,,
b'her / IP / TCP 192.168.0.106:8476 > 119.28.20.150:https PA / Ra',77,,
b'her / IP / TCP 192.168.0.106:8476 > 119.28.20.150:https PA / Ra',77,,
b'her / IP / TCP 192.168.0.106:8476 > 119.28.20.150:https ',77,,
b'her / IP / TCP 119.28.20.150:https > 192.168.0.106:8476 S',78,,
b'her / IP / TCP 119.28.20.150:https > 192.168.0.106:8476 ',78,,
b'her / IP / TCP 119.28.20.150:https > 192.168.0.106:8476 PA / Ra',78,,
b'her / IP / TCP 119.28.20.150:https > 192.168.0.106:8476 PA / Ra',78,,
b'her / IP / TCP 20.195.112.105:https > 192.168.0.106:8475 S',79,,
b'her / IP / TCP 20.195.112.105:https > 192.168.0.106:8475 A / Ra',79,,
b'her / IP / TCP 20.195.112.105:https > 192.168.0.106:8475 A / Ra',79,,
b'her / IP / TCP 20.195.112.105:https > 192.168.0.106:8475 A / Ra',79,,
b'her / IP / TCP 20.195.112.105:https > 192.168.0.106:8475 A / Ra',79,,
b'her / IP / TCP 20.195.112.105:https > 192.168.0.106:8475 A / Ra',79,,
b'her / IP / TCP 20.195.112.105:https > 192.168.0.106:8475 PA / Ra',80,,
b'her / IP / TCP 20.195.112.105:https > 192.168.0.106:8475 PA / Ra',80,,
b'her / IP / TCP 20.195.112.105:https > 192.168.0.106:8475 ',80,,
b'her / IP / TCP 20.195.112.105:https > 192.168.0.106:8475 ',80,,
b'her / IP / TCP 20.195.112.105:https > 192.168.0.106:8475 FPA / Ra',80,,
b'her / IP / TCP 69.16.175.10:http > 192.168.0.106:8474 S',81,,
b'her / IP / TCP 192.168.0.106:8477 > 51.104.15.253:https ',82,,
b'her / IP / TCP 192.168.0.106:8477 > 51.104.15.253:https ',82,,
b'her / IP / TCP 192.168.0.106:8477 > 51.104.15.253:https PA / Ra',82,,
b'her / IP / TCP 192.168.0.106:8477 > 51.104.15.253:https ',82,,
b'her / IP / TCP 192.168.0.106:8477 > 51.104.15.253:https ',82,,
b'her / IP / TCP 192.168.0.106:8477 > 51.104.15.253:https PA / Ra',82,,
b'her / IP / TCP 192.168.0.106:8477 > 51.104.15.253:https PA / Ra',83,,
b'her / IP / TCP 192.168.0.106:8477 > 51.104.15.253:https PA / Ra',83,,
b'her / IP / TCP 192.168.0.106:8477 > 51.104.15.253:https ',83,,
b'her / IP / TCP 51.104.15.253:https > 192.168.0.106:8477 S',84,,
b'her / IP / TCP 51.104.15.253:https > 192.168.0.106:8477 A / Ra',84,,
b'her / IP / TCP 51.104.15.253:https > 192.168.0.106:8477 A / Ra',84,,
b'her / IP / TCP 51.104.15.253:https > 192.168.0.106:8477 A / Ra',84,,
b'her / IP / TCP 51.104.15.253:https > 192.168.0.106:8477 A / Ra',84,,
b'her / IP / TCP 51.104.15.253:https > 192.168.0.106:8477 PA / Ra',84,,
b'her / IP / TCP 51.104.15.253:https > 192.168.0.106:8477 PA / Ra',85,,
b'her / IP / TCP 51.104.15.253:https > 192.168.0.106:8477 ',85,,
b'her / IP / TCP 51.104.15.253:https > 192.168.0.106:8477 PA / Ra',85,,
b'her / IP / TCP 192.168.0.106:8478 > 13.32.50.93:https ',86,,
b'her / IP / TCP 192.168.0.106:8478 > 13.32.50.93:https ',86,,
b'her / IP / TCP 192.168.0.106:8478 > 13.32.50.93:https PA / Ra',86,,
b'her / IP / TCP 192.168.0.106:8478 > 13.32.50.93:https ',86,,
b'her / IP / TCP 192.168.0.106:8478 > 13.32.50.93:https PA / Ra',86,,
b'her / IP / TCP 192.168.0.106:8478 > 13.32.50.93:https PA / Ra',86,,
b'her / IP / TCP 192.168.0.106:8478 > 13.32.50.93:https PA / Ra',87,,
b'her / IP / TCP 192.168.0.106:8478 > 13.32.50.93:https ',87,,
b'her / IP / TCP 192.168.0.106:8478 > 13.32.50.93:https PA / Ra',87,,
b'her / IP / TCP 13.32.50.93:https > 192.168.0.106:8478 S',88,,
b'her / IP / TCP 13.32.50.93:https > 192.168.0.106:8478 ',88,,
b'her / IP / TCP 13.32.50.93:https > 192.168.0.106:8478 PA / Ra',88,,
b'her / IP / TCP 13.32.50.93:https > 192.168.0.106:8478 ',88,,
b'her / IP / TCP 13.32.50.93:https > 192.168.0.106:8478 PA / Ra',88,,
