srcip,dstip,sport,dport,proto,data
192.168.0.106,116.132.235.204,8717,80,6,"Ether / IP / TCP 192.168.0.106:8717 > 116.132.235.204:http S"
116.132.235.204,192.168.0.106,80,8717,6,"Ether / IP / TCP 116.132.235.204:http > 192.168.0.106:8717 SA"
192.168.0.106,116.132.235.204,8717,80,6,"Ether / IP / TCP 192.168.0.106:8717 > 116.132.235.204:http A"
192.168.0.106,116.132.235.204,8717,80,6,"Ether / IP / TCP 192.168.0.106:8717 > 116.132.235.204:http PA / Raw"
192.168.0.106,116.132.235.204,8717,80,6,"Ether / IP / TCP 192.168.0.106:8717 > 116.132.235.204:http A / Raw"
192.168.0.106,116.132.235.204,8717,80,6,"Ether / IP / TCP 192.168.0.106:8717 > 116.132.235.204:http A / Raw"
192.168.0.106,116.132.235.204,8717,80,6,"Ether / IP / TCP 192.168.0.106:8717 > 116.132.235.204:http PA / Raw"
116.132.235.204,192.168.0.106,80,8717,6,"Ether / IP / TCP 116.132.235.204:http > 192.168.0.106:8717 A"
116.132.235.204,192.168.0.106,80,8717,6,"Ether / IP / TCP 116.132.235.204:http > 192.168.0.106:8717 A"
116.132.235.204,192.168.0.106,80,8717,6,"Ether / IP / TCP 116.132.235.204:http > 192.168.0.106:8717 A"
116.132.235.204,192.168.0.106,80,8717,6,"Ether / IP / TCP 116.132.235.204:http > 192.168.0.106:8717 PA / Raw"
116.132.235.204,192.168.0.106,80,8717,6,"Ether / IP / TCP 116.132.235.204:http > 192.168.0.106:8717 FA"
192.168.0.106,116.132.235.204,8717,80,6,"Ether / IP / TCP 192.168.0.106:8717 > 116.132.235.204:http A"
192.168.0.106,116.132.235.204,8717,80,6,"Ether / IP / TCP 192.168.0.106:8717 > 116.132.235.204:http FA"
116.132.235.204,192.168.0.106,80,8717,6,"Ether / IP / TCP 116.132.235.204:http > 192.168.0.106:8717 A"
192.168.0.106,3.221.215.84,2261,443,6,"Ether / IP / TCP 192.168.0.106:2261 > 3.221.215.84:https PA / Raw"
3.221.215.84,192.168.0.106,443,2261,6,"Ether / IP / TCP 3.221.215.84:https > 192.168.0.106:2261 A / Padding"
192.168.0.106,116.132.235.204,8718,80,6,"Ether / IP / TCP 192.168.0.106:8718 > 116.132.235.204:http S"
116.132.235.204,192.168.0.106,80,8718,6,"Ether / IP / TCP 116.132.235.204:http > 192.168.0.106:8718 SA"
192.168.0.106,116.132.235.204,8718,80,6,"Ether / IP / TCP 192.168.0.106:8718 > 116.132.235.204:http A"
192.168.0.106,116.132.235.204,8718,80,6,"Ether / IP / TCP 192.168.0.106:8718 > 116.132.235.204:http PA / Raw"
192.168.0.106,116.132.235.204,8718,80,6,"Ether / IP / TCP 192.168.0.106:8718 > 116.132.235.204:http A / Raw"
192.168.0.106,116.132.235.204,8718,80,6,"Ether / IP / TCP 192.168.0.106:8718 > 116.132.235.204:http A / Raw"
192.168.0.106,116.132.235.204,8718,80,6,"Ether / IP / TCP 192.168.0.106:8718 > 116.132.235.204:http PA / Raw"
116.132.235.204,192.168.0.106,80,8718,6,"Ether / IP / TCP 116.132.235.204:http > 192.168.0.106:8718 A"
116.132.235.204,192.168.0.106,80,8718,6,"Ether / IP / TCP 116.132.235.204:http > 192.168.0.106:8718 A"
116.132.235.204,192.168.0.106,80,8718,6,"Ether / IP / TCP 116.132.235.204:http > 192.168.0.106:8718 A"
116.132.235.204,192.168.0.106,80,8718,6,"Ether / IP / TCP 116.132.235.204:http > 192.168.0.106:8718 PA / Raw"
116.132.235.204,192.168.0.106,80,8718,6,"Ether / IP / TCP 116.132.235.204:http > 192.168.0.106:8718 FA"
192.168.0.106,116.132.235.204,8718,80,6,"Ether / IP / TCP 192.168.0.106:8718 > 116.132.235.204:http A"
192.168.0.106,116.132.235.204,8718,80,6,"Ether / IP / TCP 192.168.0.106:8718 > 116.132.235.204:http FA"
116.132.235.204,192.168.0.106,80,8718,6,"Ether / IP / TCP 116.132.235.204:http > 192.168.0.106:8718 A"
192.168.0.103,224.0.0.251,5353,5353,17,"Ether / IP / UDP / DNS Qry ""b'_companion-link._tcp.local.'"" "
0,0,0,0,0,"Ether / IPv6 / UDP / DNS Qry ""b'_companion-link._tcp.local.'"" "
192.168.0.106,116.132.235.204,8719,80,6,"Ether / IP / TCP 192.168.0.106:8719 > 116.132.235.204:http S"
116.132.235.204,192.168.0.106,80,8719,6,"Ether / IP / TCP 116.132.235.204:http > 192.168.0.106:8719 SA"
192.168.0.106,116.132.235.204,8719,80,6,"Ether / IP / TCP 192.168.0.106:8719 > 116.132.235.204:http A"
192.168.0.106,116.132.235.204,8719,80,6,"Ether / IP / TCP 192.168.0.106:8719 > 116.132.235.204:http PA / Raw"
192.168.0.106,116.132.235.204,8719,80,6,"Ether / IP / TCP 192.168.0.106:8719 > 116.132.235.204:http A / Raw"
192.168.0.106,116.132.235.204,8719,80,6,"Ether / IP / TCP 192.168.0.106:8719 > 116.132.235.204:http A / Raw"
192.168.0.106,116.132.235.204,8719,80,6,"Ether / IP / TCP 192.168.0.106:8719 > 116.132.235.204:http PA / Raw"
116.132.235.204,192.168.0.106,80,8719,6,"Ether / IP / TCP 116.132.235.204:http > 192.168.0.106:8719 A"
116.132.235.204,192.168.0.106,80,8719,6,"Ether / IP / TCP 116.132.235.204:http > 192.168.0.106:8719 A"
116.132.235.204,192.168.0.106,80,8719,6,"Ether / IP / TCP 116.132.235.204:http > 192.168.0.106:8719 A"
116.132.235.204,192.168.0.106,80,8719,6,"Ether / IP / TCP 116.132.235.204:http > 192.168.0.106:8719 PA / Raw"
116.132.235.204,192.168.0.106,80,8719,6,"Ether / IP / TCP 116.132.235.204:http > 192.168.0.106:8719 FA"
192.168.0.106,116.132.235.204,8719,80,6,"Ether / IP / TCP 192.168.0.106:8719 > 116.132.235.204:http A"
192.168.0.106,116.132.235.204,8719,80,6,"Ether / IP / TCP 192.168.0.106:8719 > 116.132.235.204:http FA"
116.132.235.204,192.168.0.106,80,8719,6,"Ether / IP / TCP 116.132.235.204:http > 192.168.0.106:8719 A"
192.168.0.106,116.132.235.204,8720,80,6,"Ether / IP / TCP 192.168.0.106:8720 > 116.132.235.204:http S"
116.132.235.204,192.168.0.106,80,8720,6,"Ether / IP / TCP 116.132.235.204:http > 192.168.0.106:8720 SA"
192.168.0.106,116.132.235.204,8720,80,6,"Ether / IP / TCP 192.168.0.106:8720 > 116.132.235.204:http A"
192.168.0.106,116.132.235.204,8720,80,6,"Ether / IP / TCP 192.168.0.106:8720 > 116.132.235.204:http PA / Raw"
192.168.0.106,116.132.235.204,8720,80,6,"Ether / IP / TCP 192.168.0.106:8720 > 116.132.235.204:http A / Raw"
192.168.0.106,116.132.235.204,8720,80,6,"Ether / IP / TCP 192.168.0.106:8720 > 116.132.235.204:http A / Raw"
192.168.0.106,116.132.235.204,8720,80,6,"Ether / IP / TCP 192.168.0.106:8720 > 116.132.235.204:http PA / Raw"
116.132.235.204,192.168.0.106,80,8720,6,"Ether / IP / TCP 116.132.235.204:http > 192.168.0.106:8720 A"
116.132.235.204,192.168.0.106,80,8720,6,"Ether / IP / TCP 116.132.235.204:http > 192.168.0.106:8720 A"
116.132.235.204,192.168.0.106,80,8720,6,"Ether / IP / TCP 116.132.235.204:http > 192.168.0.106:8720 A"
116.132.235.204,192.168.0.106,80,8720,6,"Ether / IP / TCP 116.132.235.204:http > 192.168.0.106:8720 PA / Raw"
116.132.235.204,192.168.0.106,80,8720,6,"Ether / IP / TCP 116.132.235.204:http > 192.168.0.106:8720 FA"
192.168.0.106,116.132.235.204,8720,80,6,"Ether / IP / TCP 192.168.0.106:8720 > 116.132.235.204:http A"
192.168.0.106,116.132.235.204,8720,80,6,"Ether / IP / TCP 192.168.0.106:8720 > 116.132.235.204:http FA"
116.132.235.204,192.168.0.106,80,8720,6,"Ether / IP / TCP 116.132.235.204:http > 192.168.0.106:8720 A"
192.168.0.106,116.132.235.204,8721,80,6,"Ether / IP / TCP 192.168.0.106:8721 > 116.132.235.204:http S"
116.132.235.204,192.168.0.106,80,8721,6,"Ether / IP / TCP 116.132.235.204:http > 192.168.0.106:8721 SA"
192.168.0.106,116.132.235.204,8721,80,6,"Ether / IP / TCP 192.168.0.106:8721 > 116.132.235.204:http A"
192.168.0.106,116.132.235.204,8721,80,6,"Ether / IP / TCP 192.168.0.106:8721 > 116.132.235.204:http PA / Raw"
192.168.0.106,116.132.235.204,8721,80,6,"Ether / IP / TCP 192.168.0.106:8721 > 116.132.235.204:http A / Raw"
192.168.0.106,116.132.235.204,8721,80,6,"Ether / IP / TCP 192.168.0.106:8721 > 116.132.235.204:http A / Raw"
192.168.0.106,116.132.235.204,8721,80,6,"Ether / IP / TCP 192.168.0.106:8721 > 116.132.235.204:http PA / Raw"
116.132.235.204,192.168.0.106,80,8721,6,"Ether / IP / TCP 116.132.235.204:http > 192.168.0.106:8721 A"
116.132.235.204,192.168.0.106,80,8721,6,"Ether / IP / TCP 116.132.235.204:http > 192.168.0.106:8721 A"
116.132.235.204,192.168.0.106,80,8721,6,"Ether / IP / TCP 116.132.235.204:http > 192.168.0.106:8721 A"
116.132.235.204,192.168.0.106,80,8721,6,"Ether / IP / TCP 116.132.235.204:http > 192.168.0.106:8721 PA / Raw"
116.132.235.204,192.168.0.106,80,8721,6,"Ether / IP / TCP 116.132.235.204:http > 192.168.0.106:8721 FA"
192.168.0.106,116.132.235.204,8721,80,6,"Ether / IP / TCP 192.168.0.106:8721 > 116.132.235.204:http A"
192.168.0.106,116.132.235.204,8721,80,6,"Ether / IP / TCP 192.168.0.106:8721 > 116.132.235.204:http FA"
116.132.235.204,192.168.0.106,80,8721,6,"Ether / IP / TCP 116.132.235.204:http > 192.168.0.106:8721 A"
192.168.0.106,152.136.104.42,8577,443,6,"Ether / IP / TCP 192.168.0.106:8577 > 152.136.104.42:https A / Raw"
152.136.104.42,192.168.0.106,443,8577,6,"Ether / IP / TCP 152.136.104.42:https > 192.168.0.106:8577 A"
192.168.0.106,218.61.197.137,8580,443,6,"Ether / IP / TCP 192.168.0.106:8580 > 218.61.197.137:https A / Raw"
218.61.197.137,192.168.0.106,443,8580,6,"Ether / IP / TCP 218.61.197.137:https > 192.168.0.106:8580 A"
192.168.0.106,13.107.21.239,8585,443,6,"Ether / IP / TCP 192.168.0.106:8585 > 13.107.21.239:https A / Raw"
13.107.21.239,192.168.0.106,443,8585,6,"Ether / IP / TCP 13.107.21.239:https > 192.168.0.106:8585 A"
192.168.0.106,116.132.235.204,8722,80,6,"Ether / IP / TCP 192.168.0.106:8722 > 116.132.235.204:http S"
116.132.235.204,192.168.0.106,80,8722,6,"Ether / IP / TCP 116.132.235.204:http > 192.168.0.106:8722 SA"
192.168.0.106,116.132.235.204,8722,80,6,"Ether / IP / TCP 192.168.0.106:8722 > 116.132.235.204:http A"
192.168.0.106,116.132.235.204,8722,80,6,"Ether / IP / TCP 192.168.0.106:8722 > 116.132.235.204:http PA / Raw"
192.168.0.106,116.132.235.204,8722,80,6,"Ether / IP / TCP 192.168.0.106:8722 > 116.132.235.204:http A / Raw"
192.168.0.106,116.132.235.204,8722,80,6,"Ether / IP / TCP 192.168.0.106:8722 > 116.132.235.204:http A / Raw"
192.168.0.106,116.132.235.204,8722,80,6,"Ether / IP / TCP 192.168.0.106:8722 > 116.132.235.204:http PA / Raw"
116.132.235.204,192.168.0.106,80,8722,6,"Ether / IP / TCP 116.132.235.204:http > 192.168.0.106:8722 A"
116.132.235.204,192.168.0.106,80,8722,6,"Ether / IP / TCP 116.132.235.204:http > 192.168.0.106:8722 A"
116.132.235.204,192.168.0.106,80,8722,6,"Ether / IP / TCP 116.132.235.204:http > 192.168.0.106:8722 A"
116.132.235.204,192.168.0.106,80,8722,6,"Ether / IP / TCP 116.132.235.204:http > 192.168.0.106:8722 PA / Raw"
116.132.235.204,192.168.0.106,80,8722,6,"Ether / IP / TCP 116.132.235.204:http > 192.168.0.106:8722 FA"
192.168.0.106,116.132.235.204,8722,80,6,"Ether / IP / TCP 192.168.0.106:8722 > 116.132.235.204:http A"
192.168.0.106,116.132.235.204,8722,80,6,"Ether / IP / TCP 192.168.0.106:8722 > 116.132.235.204:http FA"
116.132.235.204,192.168.0.106,80,8722,6,"Ether / IP / TCP 116.132.235.204:http > 192.168.0.106:8722 A"
192.168.0.106,192.168.0.1,52149,53,17,"Ether / IP / UDP / DNS Qry ""b'dns.msftncsi.com.'"" "
192.168.0.1,192.168.0.106,53,52149,17,"Ether / IP / UDP / DNS Ans ""fd3e:4f5a:5b81::1"" "
192.168.0.106,116.132.235.204,8723,80,6,"Ether / IP / TCP 192.168.0.106:8723 > 116.132.235.204:http S"
116.132.235.204,192.168.0.106,80,8723,6,"Ether / IP / TCP 116.132.235.204:http > 192.168.0.106:8723 SA"
192.168.0.106,116.132.235.204,8723,80,6,"Ether / IP / TCP 192.168.0.106:8723 > 116.132.235.204:http A"
192.168.0.106,116.132.235.204,8723,80,6,"Ether / IP / TCP 192.168.0.106:8723 > 116.132.235.204:http PA / Raw"
192.168.0.106,116.132.235.204,8723,80,6,"Ether / IP / TCP 192.168.0.106:8723 > 116.132.235.204:http A / Raw"
192.168.0.106,116.132.235.204,8723,80,6,"Ether / IP / TCP 192.168.0.106:8723 > 116.132.235.204:http PA / Raw"
116.132.235.204,192.168.0.106,80,8723,6,"Ether / IP / TCP 116.132.235.204:http > 192.168.0.106:8723 A"
116.132.235.204,192.168.0.106,80,8723,6,"Ether / IP / TCP 116.132.235.204:http > 192.168.0.106:8723 A"
116.132.235.204,192.168.0.106,80,8723,6,"Ether / IP / TCP 116.132.235.204:http > 192.168.0.106:8723 PA / Raw"
116.132.235.204,192.168.0.106,80,8723,6,"Ether / IP / TCP 116.132.235.204:http > 192.168.0.106:8723 FA"
192.168.0.106,116.132.235.204,8723,80,6,"Ether / IP / TCP 192.168.0.106:8723 > 116.132.235.204:http A"
192.168.0.106,116.132.235.204,8723,80,6,"Ether / IP / TCP 192.168.0.106:8723 > 116.132.235.204:http FA"
192.168.0.106,116.132.235.204,8724,80,6,"Ether / IP / TCP 192.168.0.106:8724 > 116.132.235.204:http S"
116.132.235.204,192.168.0.106,80,8724,6,"Ether / IP / TCP 116.132.235.204:http > 192.168.0.106:8724 SA"
192.168.0.103,224.0.0.251,5353,5353,17,"Ether / IP / UDP / DNS Ans ""b'iPhonexxx.local.'"" "
192.168.0.106,116.132.235.204,8724,80,6,"Ether / IP / TCP 192.168.0.106:8724 > 116.132.235.204:http A"
192.168.0.106,116.132.235.204,8724,80,6,"Ether / IP / TCP 192.168.0.106:8724 > 116.132.235.204:http PA / Raw"
192.168.0.106,116.132.235.204,8724,80,6,"Ether / IP / TCP 192.168.0.106:8724 > 116.132.235.204:http A / Raw"
192.168.0.106,116.132.235.204,8724,80,6,"Ether / IP / TCP 192.168.0.106:8724 > 116.132.235.204:http PA / Raw"
192.168.0.106,116.132.235.204,8725,80,6,"Ether / IP / TCP 192.168.0.106:8725 > 116.132.235.204:http S"
0.0.0.0,255.255.255.255,68,67,17,"Ether / IP / UDP / BOOTP / DHCP Request"
192.168.0.1,255.255.255.255,67,68,17,"Ether / IP / UDP / BOOTP / DHCP Ack"
116.132.235.204,192.168.0.106,80,8725,6,"Ether / IP / TCP 116.132.235.204:http > 192.168.0.106:8725 SA"
192.168.0.106,116.132.235.204,8725,80,6,"Ether / IP / TCP 192.168.0.106:8725 > 116.132.235.204:http A"
192.168.0.106,116.132.235.204,8725,80,6,"Ether / IP / TCP 192.168.0.106:8725 > 116.132.235.204:http PA / Raw"
116.132.235.204,192.168.0.106,80,8724,6,"Ether / IP / TCP 116.132.235.204:http > 192.168.0.106:8724 A"
192.168.0.106,116.132.235.204,8725,80,6,"Ether / IP / TCP 192.168.0.106:8725 > 116.132.235.204:http A / Raw"
192.168.0.106,116.132.235.204,8725,80,6,"Ether / IP / TCP 192.168.0.106:8725 > 116.132.235.204:http A / Raw"
192.168.0.106,116.132.235.204,8725,80,6,"Ether / IP / TCP 192.168.0.106:8725 > 116.132.235.204:http PA / Raw"
116.132.235.204,192.168.0.106,80,8724,6,"Ether / IP / TCP 116.132.235.204:http > 192.168.0.106:8724 A"
116.132.235.204,192.168.0.106,80,8724,6,"Ether / IP / TCP 116.132.235.204:http > 192.168.0.106:8724 PA / Raw"
116.132.235.204,192.168.0.106,80,8724,6,"Ether / IP / TCP 116.132.235.204:http > 192.168.0.106:8724 FA"
192.168.0.106,116.132.235.204,8724,80,6,"Ether / IP / TCP 192.168.0.106:8724 > 116.132.235.204:http A"
192.168.0.106,116.132.235.204,8724,80,6,"Ether / IP / TCP 192.168.0.106:8724 > 116.132.235.204:http FA"
116.132.235.204,192.168.0.106,80,8725,6,"Ether / IP / TCP 116.132.235.204:http > 192.168.0.106:8725 A"
116.132.235.204,192.168.0.106,80,8725,6,"Ether / IP / TCP 116.132.235.204:http > 192.168.0.106:8725 A"
192.168.0.106,116.132.235.204,8726,80,6,"Ether / IP / TCP 192.168.0.106:8726 > 116.132.235.204:http S"
116.132.235.204,192.168.0.106,80,8725,6,"Ether / IP / TCP 116.132.235.204:http > 192.168.0.106:8725 A"
116.132.235.204,192.168.0.106,80,8725,6,"Ether / IP / TCP 116.132.235.204:http > 192.168.0.106:8725 PA / Raw"
116.132.235.204,192.168.0.106,80,8725,6,"Ether / IP / TCP 116.132.235.204:http > 192.168.0.106:8725 FA"
192.168.0.106,116.132.235.204,8725,80,6,"Ether / IP / TCP 192.168.0.106:8725 > 116.132.235.204:http A"
192.168.0.106,116.132.235.204,8725,80,6,"Ether / IP / TCP 192.168.0.106:8725 > 116.132.235.204:http FA"
192.168.0.106,192.168.0.1,52149,53,17,"Ether / IP / UDP / DNS Qry ""b'dns.msftncsi.com.'"" "
192.168.0.1,192.168.0.106,53,52149,17,"Ether / IP / UDP / DNS Ans ""fd3e:4f5a:5b81::1"" "
116.132.235.204,192.168.0.106,80,8726,6,"Ether / IP / TCP 116.132.235.204:http > 192.168.0.106:8726 SA"
116.132.235.204,192.168.0.106,80,8725,6,"Ether / IP / TCP 116.132.235.204:http > 192.168.0.106:8725 A"
192.168.0.106,116.132.235.204,8726,80,6,"Ether / IP / TCP 192.168.0.106:8726 > 116.132.235.204:http A"
192.168.0.106,116.132.235.204,8726,80,6,"Ether / IP / TCP 192.168.0.106:8726 > 116.132.235.204:http PA / Raw"
192.168.0.106,116.132.235.204,8726,80,6,"Ether / IP / TCP 192.168.0.106:8726 > 116.132.235.204:http A / Raw"
192.168.0.106,116.132.235.204,8726,80,6,"Ether / IP / TCP 192.168.0.106:8726 > 116.132.235.204:http PA / Raw"
192.168.0.106,116.132.235.204,8727,80,6,"Ether / IP / TCP 192.168.0.106:8727 > 116.132.235.204:http S"
116.132.235.204,192.168.0.106,80,8726,6,"Ether / IP / TCP 116.132.235.204:http > 192.168.0.106:8726 A"
116.132.235.204,192.168.0.106,80,8726,6,"Ether / IP / TCP 116.132.235.204:http > 192.168.0.106:8726 A"
116.132.235.204,192.168.0.106,80,8726,6,"Ether / IP / TCP 116.132.235.204:http > 192.168.0.106:8726 PA / Raw"
116.132.235.204,192.168.0.106,80,8726,6,"Ether / IP / TCP 116.132.235.204:http > 192.168.0.106:8726 FA"
192.168.0.106,116.132.235.204,8726,80,6,"Ether / IP / TCP 192.168.0.106:8726 > 116.132.235.204:http A"
116.132.235.204,192.168.0.106,80,8727,6,"Ether / IP / TCP 116.132.235.204:http > 192.168.0.106:8727 SA"
192.168.0.106,116.132.235.204,8727,80,6,"Ether / IP / TCP 192.168.0.106:8727 > 116.132.235.204:http A"
192.168.0.106,116.132.235.204,8726,80,6,"Ether / IP / TCP 192.168.0.106:8726 > 116.132.235.204:http FA"
192.168.0.106,116.132.235.204,8727,80,6,"Ether / IP / TCP 192.168.0.106:8727 > 116.132.235.204:http PA / Raw"
192.168.0.106,116.132.235.204,8727,80,6,"Ether / IP / TCP 192.168.0.106:8727 > 116.132.235.204:http A / Raw"
192.168.0.106,116.132.235.204,8727,80,6,"Ether / IP / TCP 192.168.0.106:8727 > 116.132.235.204:http A / Raw"
192.168.0.106,116.132.235.204,8727,80,6,"Ether / IP / TCP 192.168.0.106:8727 > 116.132.235.204:http PA / Raw"
116.132.235.204,192.168.0.106,80,8727,6,"Ether / IP / TCP 116.132.235.204:http > 192.168.0.106:8727 A"
116.132.235.204,192.168.0.106,80,8727,6,"Ether / IP / TCP 116.132.235.204:http > 192.168.0.106:8727 A"
116.132.235.204,192.168.0.106,80,8727,6,"Ether / IP / TCP 116.132.235.204:http > 192.168.0.106:8727 A"
116.132.235.204,192.168.0.106,80,8727,6,"Ether / IP / TCP 116.132.235.204:http > 192.168.0.106:8727 PA / Raw"
116.132.235.204,192.168.0.106,80,8727,6,"Ether / IP / TCP 116.132.235.204:http > 192.168.0.106:8727 FA"
192.168.0.106,116.132.235.204,8727,80,6,"Ether / IP / TCP 192.168.0.106:8727 > 116.132.235.204:http A"
192.168.0.106,116.132.235.204,8727,80,6,"Ether / IP / TCP 192.168.0.106:8727 > 116.132.235.204:http FA"
116.132.235.204,192.168.0.106,80,8727,6,"Ether / IP / TCP 116.132.235.204:http > 192.168.0.106:8727 A"
0,0,0,0,0,"Ether / IPv6 / UDP / DNS Qry ""b'_companion-link._tcp.local.'"" "
0,0,0,0,0,"Ether / IPv6 / UDP / DNS Ans ""b'iPhonexxx.local.'"" "
192.168.0.103,224.0.0.251,5353,5353,17,"Ether / IP / UDP / DNS Qry ""b'_companion-link._tcp.local.'"" "
0,0,0,0,0,"Ether / IPv6 / UDP / DNS Qry ""b'_companion-link._tcp.local.'"" "
192.168.0.103,224.0.0.251,5353,5353,17,"Ether / IP / UDP / DNS Ans ""b'iPhonexxx.local.'"" "
0,0,0,0,0,"Ether / IPv6 / UDP / DNS Ans ""b'iPhonexxx.local.'"" "
192.168.0.106,116.132.235.204,8723,80,6,"Ether / IP / TCP 192.168.0.106:8723 > 116.132.235.204:http FA"
192.168.0.106,192.168.0.1,60464,53,17,"Ether / IP / UDP / DNS Qry ""b'www.msftconnecttest.com.'"" "
192.168.0.106,192.168.0.1,52791,53,17,"Ether / IP / UDP / DNS Qry ""b'ipv6.msftconnecttest.com.'"" "
192.168.0.1,192.168.0.106,53,60464,17,"Ether / IP / UDP / DNS Ans ""23.61.252.99"" "
192.168.0.106,23.61.252.99,8728,80,6,"Ether / IP / TCP 192.168.0.106:8728 > 23.61.252.99:http S"
192.168.0.1,192.168.0.106,53,52791,17,"Ether / IP / UDP / DNS Ans ""b'v6ncsi.msedge.net.'"" "
192.168.0.106,116.132.235.204,8724,80,6,"Ether / IP / TCP 192.168.0.106:8724 > 116.132.235.204:http FA"
192.168.0.106,192.168.0.1,52537,53,17,"Ether / IP / UDP / DNS Qry ""b'ipv6.msftconnecttest.com.'"" "
192.168.0.106,192.168.0.1,52149,53,17,"Ether / IP / UDP / DNS Qry ""b'ipv6.msftconnecttest.com.'"" "
192.168.0.1,192.168.0.106,53,52149,17,"Ether / IP / UDP / DNS Ans ""b'v6ncsi.msedge.net.'"" "
192.168.0.106,192.168.0.1,52149,53,17,"Ether / IP / UDP / DNS Qry ""b'ipv6.msftconnecttest.com.'"" "
192.168.0.1,192.168.0.106,53,52149,17,"Ether / IP / UDP / DNS Ans ""b'v6ncsi.msedge.net.'"" "
192.168.0.106,192.168.0.1,52537,53,17,"Ether / IP / UDP / DNS Qry ""b'ipv6.msftconnecttest.com.'"" "
192.168.0.1,192.168.0.106,53,52537,17,"Ether / IP / UDP / DNS Ans ""b'v6ncsi.msedge.net.'"" "
23.61.252.99,192.168.0.106,80,8728,6,"Ether / IP / TCP 23.61.252.99:http > 192.168.0.106:8728 SA"
192.168.0.106,23.61.252.99,8728,80,6,"Ether / IP / TCP 192.168.0.106:8728 > 23.61.252.99:http A"
192.168.0.106,23.61.252.99,8728,80,6,"Ether / IP / TCP 192.168.0.106:8728 > 23.61.252.99:http PA / Raw"
192.168.0.106,116.132.235.204,8726,80,6,"Ether / IP / TCP 192.168.0.106:8726 > 116.132.235.204:http FA"
23.61.252.99,192.168.0.106,80,8728,6,"Ether / IP / TCP 23.61.252.99:http > 192.168.0.106:8728 A"
23.61.252.99,192.168.0.106,80,8728,6,"Ether / IP / TCP 23.61.252.99:http > 192.168.0.106:8728 PA / Raw"
23.61.252.99,192.168.0.106,80,8728,6,"Ether / IP / TCP 23.61.252.99:http > 192.168.0.106:8728 FA"
192.168.0.106,23.61.252.99,8728,80,6,"Ether / IP / TCP 192.168.0.106:8728 > 23.61.252.99:http A"
192.168.0.106,23.61.252.99,8728,80,6,"Ether / IP / TCP 192.168.0.106:8728 > 23.61.252.99:http FA"
192.168.0.106,192.168.0.1,49664,53,17,"Ether / IP / UDP / DNS Qry ""b'www.msftconnecttest.com.'"" "
192.168.0.1,192.168.0.106,53,49664,17,"Ether / IP / UDP / DNS Ans ""23.61.252.99"" "
192.168.0.106,23.61.252.99,8729,80,6,"Ether / IP / TCP 192.168.0.106:8729 > 23.61.252.99:http S"
192.168.0.106,192.168.0.1,64446,53,17,"Ether / IP / UDP / DNS Qry ""b'ipv6.msftconnecttest.com.'"" "
192.168.0.106,52.182.143.211,8523,443,6,"Ether / IP / TCP 192.168.0.106:8523 > 52.182.143.211:https A / Raw"
192.168.0.1,192.168.0.106,53,64446,17,"Ether / IP / UDP / DNS Ans ""b'v6ncsi.msedge.net.'"" "
192.168.0.103,224.0.0.251,5353,5353,17,"Ether / IP / UDP / DNS Qry ""b'iPhonexxx._rdlink._tcp.local.'"" "
23.61.252.99,192.168.0.106,80,8729,6,"Ether / IP / TCP 23.61.252.99:http > 192.168.0.106:8729 SA"
192.168.0.106,23.61.252.99,8729,80,6,"Ether / IP / TCP 192.168.0.106:8729 > 23.61.252.99:http A"
192.168.0.106,23.61.252.99,8729,80,6,"Ether / IP / TCP 192.168.0.106:8729 > 23.61.252.99:http PA / Raw"
0,0,0,0,0,"Ether / IPv6 / UDP / DNS Qry ""b'iPhonexxx._rdlink._tcp.local.'"" "
23.61.252.99,192.168.0.106,80,8729,6,"Ether / IP / TCP 23.61.252.99:http > 192.168.0.106:8729 PA / Raw"
23.61.252.99,192.168.0.106,80,8729,6,"Ether / IP / TCP 23.61.252.99:http > 192.168.0.106:8729 FA"
192.168.0.106,23.61.252.99,8729,80,6,"Ether / IP / TCP 192.168.0.106:8729 > 23.61.252.99:http A"
192.168.0.106,23.61.252.99,8729,80,6,"Ether / IP / TCP 192.168.0.106:8729 > 23.61.252.99:http FA"
52.182.143.211,192.168.0.106,443,8523,6,"Ether / IP / TCP 52.182.143.211:https > 192.168.0.106:8523 A"
192.168.0.106,23.61.252.99,8728,80,6,"Ether / IP / TCP 192.168.0.106:8728 > 23.61.252.99:http FA"
192.168.0.106,116.132.235.204,8723,80,6,"Ether / IP / TCP 192.168.0.106:8723 > 116.132.235.204:http FA"
192.168.0.103,224.0.0.251,5353,5353,17,"Ether / IP / UDP / DNS Qry ""b'iPhonexxx._rdlink._tcp.local.'"" "
0,0,0,0,0,"Ether / IPv6 / UDP / DNS Qry ""b'iPhonexxx._rdlink._tcp.local.'"" "
23.61.252.99,192.168.0.106,80,8728,6,"Ether / IP / TCP 23.61.252.99:http > 192.168.0.106:8728 A"
192.168.0.106,116.132.235.204,8724,80,6,"Ether / IP / TCP 192.168.0.106:8724 > 116.132.235.204:http FA"
192.168.0.106,116.132.235.204,8726,80,6,"Ether / IP / TCP 192.168.0.106:8726 > 116.132.235.204:http FA"
192.168.0.106,23.61.252.99,8729,80,6,"Ether / IP / TCP 192.168.0.106:8729 > 23.61.252.99:http FA"
192.168.0.103,224.0.0.251,5353,5353,17,"Ether / IP / UDP / DNS Qry ""b'iPhonexxx._rdlink._tcp.local.'"" "
0,0,0,0,0,"Ether / IPv6 / UDP / DNS Qry ""b'iPhonexxx._rdlink._tcp.local.'"" "
23.61.252.99,192.168.0.106,80,8729,6,"Ether / IP / TCP 23.61.252.99:http > 192.168.0.106:8729 R"
192.168.0.106,116.132.235.204,8730,80,6,"Ether / IP / TCP 192.168.0.106:8730 > 116.132.235.204:http S"
192.168.0.103,224.0.0.251,5353,5353,17,"Ether / IP / UDP / DNS Qry ""b'_companion-link._tcp.local.'"" "
0,0,0,0,0,"Ether / IPv6 / UDP / DNS Qry ""b'_companion-link._tcp.local.'"" "
116.132.235.204,192.168.0.106,80,8730,6,"Ether / IP / TCP 116.132.235.204:http > 192.168.0.106:8730 SA"
192.168.0.106,116.132.235.204,8730,80,6,"Ether / IP / TCP 192.168.0.106:8730 > 116.132.235.204:http A"
192.168.0.106,116.132.235.204,8730,80,6,"Ether / IP / TCP 192.168.0.106:8730 > 116.132.235.204:http PA / Raw"
192.168.0.106,116.132.235.204,8730,80,6,"Ether / IP / TCP 192.168.0.106:8730 > 116.132.235.204:http A / Raw"
192.168.0.106,116.132.235.204,8730,80,6,"Ether / IP / TCP 192.168.0.106:8730 > 116.132.235.204:http A / Raw"
192.168.0.106,116.132.235.204,8730,80,6,"Ether / IP / TCP 192.168.0.106:8730 > 116.132.235.204:http PA / Raw"
116.132.235.204,192.168.0.106,80,8730,6,"Ether / IP / TCP 116.132.235.204:http > 192.168.0.106:8730 A"
116.132.235.204,192.168.0.106,80,8730,6,"Ether / IP / TCP 116.132.235.204:http > 192.168.0.106:8730 A"
116.132.235.204,192.168.0.106,80,8730,6,"Ether / IP / TCP 116.132.235.204:http > 192.168.0.106:8730 A"
116.132.235.204,192.168.0.106,80,8730,6,"Ether / IP / TCP 116.132.235.204:http > 192.168.0.106:8730 PA / Raw"
116.132.235.204,192.168.0.106,80,8730,6,"Ether / IP / TCP 116.132.235.204:http > 192.168.0.106:8730 FA"
192.168.0.106,116.132.235.204,8730,80,6,"Ether / IP / TCP 192.168.0.106:8730 > 116.132.235.204:http A"
192.168.0.106,116.132.235.204,8730,80,6,"Ether / IP / TCP 192.168.0.106:8730 > 116.132.235.204:http FA"
116.132.235.204,192.168.0.106,80,8730,6,"Ether / IP / TCP 116.132.235.204:http > 192.168.0.106:8730 A"
192.168.0.103,224.0.0.251,5353,5353,17,"Ether / IP / UDP / DNS Ans ""b'iPhonexxx.local.'"" "
0,0,0,0,0,"Ether / IPv6 / UDP / DNS Ans ""b'iPhonexxx.local.'"" "
192.168.0.106,119.147.15.37,11689,443,6,"Ether / IP / TCP 192.168.0.106:11689 > 119.147.15.37:https PA / Raw"
192.168.0.103,224.0.0.251,5353,5353,17,"Ether / IP / UDP / DNS Ans ""[b'rpBA=FF:72:35:98:81:0B', b'rpVr=440.9', b'rpAD=f6b41055bd93']"" "
0,0,0,0,0,"Ether / IPv6 / UDP / DNS Ans ""[b'rpBA=FF:72:35:98:81:0B', b'rpVr=440.9', b'rpAD=f6b41055bd93']"" "
119.147.15.37,192.168.0.106,443,11689,6,"Ether / IP / TCP 119.147.15.37:https > 192.168.0.106:11689 A / Padding"
119.147.15.37,192.168.0.106,443,11689,6,"Ether / IP / TCP 119.147.15.37:https > 192.168.0.106:11689 PA / Raw"
192.168.0.106,119.147.15.37,11689,443,6,"Ether / IP / TCP 192.168.0.106:11689 > 119.147.15.37:https A"
192.168.0.106,116.132.235.204,8723,80,6,"Ether / IP / TCP 192.168.0.106:8723 > 116.132.235.204:http FA"
192.168.0.106,116.132.235.204,8724,80,6,"Ether / IP / TCP 192.168.0.106:8724 > 116.132.235.204:http FA"
192.168.0.106,116.132.235.204,8726,80,6,"Ether / IP / TCP 192.168.0.106:8726 > 116.132.235.204:http FA"
192.168.0.106,116.132.235.204,8731,80,6,"Ether / IP / TCP 192.168.0.106:8731 > 116.132.235.204:http S"
116.132.235.204,192.168.0.106,80,8731,6,"Ether / IP / TCP 116.132.235.204:http > 192.168.0.106:8731 SA"
192.168.0.106,116.132.235.204,8731,80,6,"Ether / IP / TCP 192.168.0.106:8731 > 116.132.235.204:http A"
192.168.0.106,116.132.235.204,8731,80,6,"Ether / IP / TCP 192.168.0.106:8731 > 116.132.235.204:http PA / Raw"
192.168.0.106,116.132.235.204,8731,80,6,"Ether / IP / TCP 192.168.0.106:8731 > 116.132.235.204:http A / Raw"
192.168.0.106,116.132.235.204,8731,80,6,"Ether / IP / TCP 192.168.0.106:8731 > 116.132.235.204:http A / Raw"
192.168.0.106,116.132.235.204,8731,80,6,"Ether / IP / TCP 192.168.0.106:8731 > 116.132.235.204:http PA / Raw"
116.132.235.204,192.168.0.106,80,8731,6,"Ether / IP / TCP 116.132.235.204:http > 192.168.0.106:8731 A"
116.132.235.204,192.168.0.106,80,8731,6,"Ether / IP / TCP 116.132.235.204:http > 192.168.0.106:8731 A"
116.132.235.204,192.168.0.106,80,8731,6,"Ether / IP / TCP 116.132.235.204:http > 192.168.0.106:8731 PA / Raw"
116.132.235.204,192.168.0.106,80,8731,6,"Ether / IP / TCP 116.132.235.204:http > 192.168.0.106:8731 FA"
192.168.0.106,116.132.235.204,8731,80,6,"Ether / IP / TCP 192.168.0.106:8731 > 116.132.235.204:http A"
192.168.0.106,116.132.235.204,8731,80,6,"Ether / IP / TCP 192.168.0.106:8731 > 116.132.235.204:http FA"
116.132.235.204,192.168.0.106,80,8731,6,"Ether / IP / TCP 116.132.235.204:http > 192.168.0.106:8731 A"
192.168.0.106,116.132.235.204,8732,80,6,"Ether / IP / TCP 192.168.0.106:8732 > 116.132.235.204:http S"
192.168.0.106,110.242.68.4,8733,80,6,"Ether / IP / TCP 192.168.0.106:8733 > 110.242.68.4:http S"
192.168.0.103,224.0.0.251,5353,5353,17,"Ether / IP / UDP / DNS Ans ""[b'rpBA=FF:72:35:98:81:0B', b'rpVr=440.9', b'rpAD=f6b41055bd93']"" "
0,0,0,0,0,"Ether / IPv6 / UDP / DNS Ans ""[b'rpBA=FF:72:35:98:81:0B', b'rpVr=440.9', b'rpAD=f6b41055bd93']"" "
110.242.68.4,192.168.0.106,80,8733,6,"Ether / IP / TCP 110.242.68.4:http > 192.168.0.106:8733 SA"
192.168.0.106,110.242.68.4,8733,80,6,"Ether / IP / TCP 192.168.0.106:8733 > 110.242.68.4:http A"
116.132.235.204,192.168.0.106,80,8732,6,"Ether / IP / TCP 116.132.235.204:http > 192.168.0.106:8732 SA"
192.168.0.106,116.132.235.204,8732,80,6,"Ether / IP / TCP 192.168.0.106:8732 > 116.132.235.204:http A"
192.168.0.106,116.132.235.204,8732,80,6,"Ether / IP / TCP 192.168.0.106:8732 > 116.132.235.204:http PA / Raw"
192.168.0.106,116.132.235.204,8732,80,6,"Ether / IP / TCP 192.168.0.106:8732 > 116.132.235.204:http A / Raw"
192.168.0.106,116.132.235.204,8732,80,6,"Ether / IP / TCP 192.168.0.106:8732 > 116.132.235.204:http A / Raw"
192.168.0.106,116.132.235.204,8732,80,6,"Ether / IP / TCP 192.168.0.106:8732 > 116.132.235.204:http PA / Raw"
192.168.0.106,110.242.68.4,8733,80,6,"Ether / IP / TCP 192.168.0.106:8733 > 110.242.68.4:http FA"
116.132.235.204,192.168.0.106,80,8732,6,"Ether / IP / TCP 116.132.235.204:http > 192.168.0.106:8732 A"
116.132.235.204,192.168.0.106,80,8732,6,"Ether / IP / TCP 116.132.235.204:http > 192.168.0.106:8732 A"
116.132.235.204,192.168.0.106,80,8732,6,"Ether / IP / TCP 116.132.235.204:http > 192.168.0.106:8732 A"
116.132.235.204,192.168.0.106,80,8732,6,"Ether / IP / TCP 116.132.235.204:http > 192.168.0.106:8732 PA / Raw"
116.132.235.204,192.168.0.106,80,8732,6,"Ether / IP / TCP 116.132.235.204:http > 192.168.0.106:8732 FA"
192.168.0.106,116.132.235.204,8732,80,6,"Ether / IP / TCP 192.168.0.106:8732 > 116.132.235.204:http A"
192.168.0.106,116.132.235.204,8732,80,6,"Ether / IP / TCP 192.168.0.106:8732 > 116.132.235.204:http FA"
110.242.68.4,192.168.0.106,80,8733,6,"Ether / IP / TCP 110.242.68.4:http > 192.168.0.106:8733 A"
110.242.68.4,192.168.0.106,80,8733,6,"Ether / IP / TCP 110.242.68.4:http > 192.168.0.106:8733 FA"
192.168.0.106,110.242.68.4,8733,80,6,"Ether / IP / TCP 192.168.0.106:8733 > 110.242.68.4:http A"
116.132.235.204,192.168.0.106,80,8732,6,"Ether / IP / TCP 116.132.235.204:http > 192.168.0.106:8732 A"
192.168.0.106,202.89.233.100,8540,443,6,"Ether / IP / TCP 192.168.0.106:8540 > 202.89.233.100:https A / Raw"
192.168.0.106,202.89.233.101,8539,443,6,"Ether / IP / TCP 192.168.0.106:8539 > 202.89.233.101:https A / Raw"
202.89.233.100,192.168.0.106,443,8540,6,"Ether / IP / TCP 202.89.233.100:https > 192.168.0.106:8540 A"
202.89.233.101,192.168.0.106,443,8539,6,"Ether / IP / TCP 202.89.233.101:https > 192.168.0.106:8539 A"
192.168.0.103,224.0.0.251,5353,5353,17,"Ether / IP / UDP / DNS Ans ""b'iPhonexxx.local.'"" "
0,0,0,0,0,"Ether / IPv6 / UDP / DNS Ans ""b'iPhonexxx.local.'"" "
192.168.0.106,116.132.235.204,8734,80,6,"Ether / IP / TCP 192.168.0.106:8734 > 116.132.235.204:http S"
116.132.235.204,192.168.0.106,80,8734,6,"Ether / IP / TCP 116.132.235.204:http > 192.168.0.106:8734 SA"
192.168.0.106,116.132.235.204,8734,80,6,"Ether / IP / TCP 192.168.0.106:8734 > 116.132.235.204:http A"
192.168.0.106,116.132.235.204,8734,80,6,"Ether / IP / TCP 192.168.0.106:8734 > 116.132.235.204:http PA / Raw"
192.168.0.106,116.132.235.204,8734,80,6,"Ether / IP / TCP 192.168.0.106:8734 > 116.132.235.204:http A / Raw"
192.168.0.106,116.132.235.204,8734,80,6,"Ether / IP / TCP 192.168.0.106:8734 > 116.132.235.204:http A / Raw"
192.168.0.106,116.132.235.204,8734,80,6,"Ether / IP / TCP 192.168.0.106:8734 > 116.132.235.204:http PA / Raw"
116.132.235.204,192.168.0.106,80,8734,6,"Ether / IP / TCP 116.132.235.204:http > 192.168.0.106:8734 A"
116.132.235.204,192.168.0.106,80,8734,6,"Ether / IP / TCP 116.132.235.204:http > 192.168.0.106:8734 A"
116.132.235.204,192.168.0.106,80,8734,6,"Ether / IP / TCP 116.132.235.204:http > 192.168.0.106:8734 A"
116.132.235.204,192.168.0.106,80,8734,6,"Ether / IP / TCP 116.132.235.204:http > 192.168.0.106:8734 PA / Raw"
116.132.235.204,192.168.0.106,80,8734,6,"Ether / IP / TCP 116.132.235.204:http > 192.168.0.106:8734 FA"
192.168.0.106,116.132.235.204,8734,80,6,"Ether / IP / TCP 192.168.0.106:8734 > 116.132.235.204:http A"
192.168.0.106,116.132.235.204,8734,80,6,"Ether / IP / TCP 192.168.0.106:8734 > 116.132.235.204:http FA"
116.132.235.204,192.168.0.106,80,8734,6,"Ether / IP / TCP 116.132.235.204:http > 192.168.0.106:8734 A"
192.168.0.103,224.0.0.251,5353,5353,17,"Ether / IP / UDP / DNS Qry ""b'_companion-link._tcp.local.'"" "
0,0,0,0,0,"Ether / IPv6 / UDP / DNS Qry ""b'_companion-link._tcp.local.'"" "
192.168.0.103,224.0.0.251,5353,5353,17,"Ether / IP / UDP / DNS Ans ""[b'rpBA=FF:72:35:98:81:0B', b'rpVr=440.9', b'rpAD=f6b41055bd93']"" "
0,0,0,0,0,"Ether / IPv6 / UDP / DNS Ans ""[b'rpBA=FF:72:35:98:81:0B', b'rpVr=440.9', b'rpAD=f6b41055bd93']"" "
192.168.0.106,116.132.235.204,8723,80,6,"Ether / IP / TCP 192.168.0.106:8723 > 116.132.235.204:http FA"
101.132.142.159,192.168.0.106,443,2395,6,"Ether / IP / TCP 101.132.142.159:https > 192.168.0.106:2395 PA / Raw"
192.168.0.106,101.132.142.159,2395,443,6,"Ether / IP / TCP 192.168.0.106:2395 > 101.132.142.159:https PA / Raw"
192.168.0.106,116.132.235.204,8724,80,6,"Ether / IP / TCP 192.168.0.106:8724 > 116.132.235.204:http FA"
101.132.142.159,192.168.0.106,443,2395,6,"Ether / IP / TCP 101.132.142.159:https > 192.168.0.106:2395 A / Padding"
192.168.0.106,116.132.235.204,8726,80,6,"Ether / IP / TCP 192.168.0.106:8726 > 116.132.235.204:http FA"
192.168.0.106,116.132.235.204,8735,80,6,"Ether / IP / TCP 192.168.0.106:8735 > 116.132.235.204:http S"
116.132.235.204,192.168.0.106,80,8735,6,"Ether / IP / TCP 116.132.235.204:http > 192.168.0.106:8735 SA"
192.168.0.106,116.132.235.204,8735,80,6,"Ether / IP / TCP 192.168.0.106:8735 > 116.132.235.204:http A"
192.168.0.106,116.132.235.204,8735,80,6,"Ether / IP / TCP 192.168.0.106:8735 > 116.132.235.204:http PA / Raw"
192.168.0.106,116.132.235.204,8735,80,6,"Ether / IP / TCP 192.168.0.106:8735 > 116.132.235.204:http A / Raw"
192.168.0.106,116.132.235.204,8735,80,6,"Ether / IP / TCP 192.168.0.106:8735 > 116.132.235.204:http A / Raw"
192.168.0.106,116.132.235.204,8735,80,6,"Ether / IP / TCP 192.168.0.106:8735 > 116.132.235.204:http PA / Raw"
116.132.235.204,192.168.0.106,80,8735,6,"Ether / IP / TCP 116.132.235.204:http > 192.168.0.106:8735 A"
116.132.235.204,192.168.0.106,80,8735,6,"Ether / IP / TCP 116.132.235.204:http > 192.168.0.106:8735 A"
116.132.235.204,192.168.0.106,80,8735,6,"Ether / IP / TCP 116.132.235.204:http > 192.168.0.106:8735 A"
116.132.235.204,192.168.0.106,80,8735,6,"Ether / IP / TCP 116.132.235.204:http > 192.168.0.106:8735 PA / Raw"
116.132.235.204,192.168.0.106,80,8735,6,"Ether / IP / TCP 116.132.235.204:http > 192.168.0.106:8735 FA"
192.168.0.106,116.132.235.204,8735,80,6,"Ether / IP / TCP 192.168.0.106:8735 > 116.132.235.204:http A"
192.168.0.106,116.132.235.204,8735,80,6,"Ether / IP / TCP 192.168.0.106:8735 > 116.132.235.204:http FA"
192.168.0.106,116.132.235.204,8736,80,6,"Ether / IP / TCP 192.168.0.106:8736 > 116.132.235.204:http S"
116.132.235.204,192.168.0.106,80,8736,6,"Ether / IP / TCP 116.132.235.204:http > 192.168.0.106:8736 SA"
192.168.0.106,116.132.235.204,8736,80,6,"Ether / IP / TCP 192.168.0.106:8736 > 116.132.235.204:http A"
192.168.0.106,116.132.235.204,8736,80,6,"Ether / IP / TCP 192.168.0.106:8736 > 116.132.235.204:http PA / Raw"
192.168.0.106,116.132.235.204,8736,80,6,"Ether / IP / TCP 192.168.0.106:8736 > 116.132.235.204:http A / Raw"
192.168.0.106,116.132.235.204,8736,80,6,"Ether / IP / TCP 192.168.0.106:8736 > 116.132.235.204:http A / Raw"
192.168.0.106,116.132.235.204,8736,80,6,"Ether / IP / TCP 192.168.0.106:8736 > 116.132.235.204:http PA / Raw"
116.132.235.204,192.168.0.106,80,8736,6,"Ether / IP / TCP 116.132.235.204:http > 192.168.0.106:8736 A"
116.132.235.204,192.168.0.106,80,8736,6,"Ether / IP / TCP 116.132.235.204:http > 192.168.0.106:8736 A"
116.132.235.204,192.168.0.106,80,8736,6,"Ether / IP / TCP 116.132.235.204:http > 192.168.0.106:8736 A"
116.132.235.204,192.168.0.106,80,8736,6,"Ether / IP / TCP 116.132.235.204:http > 192.168.0.106:8736 PA / Raw"
116.132.235.204,192.168.0.106,80,8736,6,"Ether / IP / TCP 116.132.235.204:http > 192.168.0.106:8736 FA"
192.168.0.106,116.132.235.204,8736,80,6,"Ether / IP / TCP 192.168.0.106:8736 > 116.132.235.204:http A"
192.168.0.106,116.132.235.204,8736,80,6,"Ether / IP / TCP 192.168.0.106:8736 > 116.132.235.204:http FA"
192.168.0.106,116.132.235.204,8735,80,6,"Ether / IP / TCP 192.168.0.106:8735 > 116.132.235.204:http FA"
192.168.0.106,116.132.235.204,8736,80,6,"Ether / IP / TCP 192.168.0.106:8736 > 116.132.235.204:http FA"
192.168.0.106,20.24.121.134,8547,443,6,"Ether / IP / TCP 192.168.0.106:8547 > 20.24.121.134:https A / Raw"
192.168.0.106,202.89.233.101,8551,443,6,"Ether / IP / TCP 192.168.0.106:8551 > 202.89.233.101:https A / Raw"
202.89.233.101,192.168.0.106,443,8551,6,"Ether / IP / TCP 202.89.233.101:https > 192.168.0.106:8551 A"
192.168.0.106,204.79.197.219,8549,443,6,"Ether / IP / TCP 192.168.0.106:8549 > 204.79.197.219:https A / Raw"
192.168.0.106,116.132.235.204,8735,80,6,"Ether / IP / TCP 192.168.0.106:8735 > 116.132.235.204:http FA"
192.168.0.106,204.79.197.219,8550,443,6,"Ether / IP / TCP 192.168.0.106:8550 > 204.79.197.219:https A / Raw"
20.24.121.134,192.168.0.106,443,8547,6,"Ether / IP / TCP 20.24.121.134:https > 192.168.0.106:8547 A"
204.79.197.219,192.168.0.106,443,8549,6,"Ether / IP / TCP 204.79.197.219:https > 192.168.0.106:8549 A"
204.79.197.219,192.168.0.106,443,8550,6,"Ether / IP / TCP 204.79.197.219:https > 192.168.0.106:8550 A"
192.168.0.106,116.132.235.204,8736,80,6,"Ether / IP / TCP 192.168.0.106:8736 > 116.132.235.204:http FA"
192.168.0.106,116.132.235.204,8737,80,6,"Ether / IP / TCP 192.168.0.106:8737 > 116.132.235.204:http S"
116.132.235.204,192.168.0.106,80,8737,6,"Ether / IP / TCP 116.132.235.204:http > 192.168.0.106:8737 SA"
192.168.0.106,116.132.235.204,8737,80,6,"Ether / IP / TCP 192.168.0.106:8737 > 116.132.235.204:http A"
192.168.0.106,116.132.235.204,8737,80,6,"Ether / IP / TCP 192.168.0.106:8737 > 116.132.235.204:http PA / Raw"
192.168.0.106,116.132.235.204,8737,80,6,"Ether / IP / TCP 192.168.0.106:8737 > 116.132.235.204:http A / Raw"
192.168.0.106,116.132.235.204,8737,80,6,"Ether / IP / TCP 192.168.0.106:8737 > 116.132.235.204:http A / Raw"
192.168.0.106,116.132.235.204,8737,80,6,"Ether / IP / TCP 192.168.0.106:8737 > 116.132.235.204:http PA / Raw"
116.132.235.204,192.168.0.106,80,8737,6,"Ether / IP / TCP 116.132.235.204:http > 192.168.0.106:8737 A"
116.132.235.204,192.168.0.106,80,8737,6,"Ether / IP / TCP 116.132.235.204:http > 192.168.0.106:8737 A"
116.132.235.204,192.168.0.106,80,8737,6,"Ether / IP / TCP 116.132.235.204:http > 192.168.0.106:8737 A"
116.132.235.204,192.168.0.106,80,8737,6,"Ether / IP / TCP 116.132.235.204:http > 192.168.0.106:8737 PA / Raw"
116.132.235.204,192.168.0.106,80,8737,6,"Ether / IP / TCP 116.132.235.204:http > 192.168.0.106:8737 FA"
192.168.0.106,116.132.235.204,8737,80,6,"Ether / IP / TCP 192.168.0.106:8737 > 116.132.235.204:http A"
192.168.0.106,116.132.235.204,8737,80,6,"Ether / IP / TCP 192.168.0.106:8737 > 116.132.235.204:http FA"
116.132.235.204,192.168.0.106,80,8737,6,"Ether / IP / TCP 116.132.235.204:http > 192.168.0.106:8737 A"
192.168.0.106,204.79.197.200,8544,443,6,"Ether / IP / TCP 192.168.0.106:8544 > 204.79.197.200:https A / Raw"
204.79.197.200,192.168.0.106,443,8544,6,"Ether / IP / TCP 204.79.197.200:https > 192.168.0.106:8544 A"
192.168.0.106,20.205.115.81,8542,443,6,"Ether / IP / TCP 192.168.0.106:8542 > 20.205.115.81:https A / Raw"
192.168.0.106,18.65.168.26,8543,443,6,"Ether / IP / TCP 192.168.0.106:8543 > 18.65.168.26:https A / Raw"
18.65.168.26,192.168.0.106,443,8543,6,"Ether / IP / TCP 18.65.168.26:https > 192.168.0.106:8543 A"
20.205.115.81,192.168.0.106,443,8542,6,"Ether / IP / TCP 20.205.115.81:https > 192.168.0.106:8542 A"
192.168.0.106,116.132.235.204,8735,80,6,"Ether / IP / TCP 192.168.0.106:8735 > 116.132.235.204:http FA"
192.168.0.106,116.132.235.204,8736,80,6,"Ether / IP / TCP 192.168.0.106:8736 > 116.132.235.204:http FA"
192.168.0.106,116.132.235.204,8738,80,6,"Ether / IP / TCP 192.168.0.106:8738 > 116.132.235.204:http S"
116.132.235.204,192.168.0.106,80,8738,6,"Ether / IP / TCP 116.132.235.204:http > 192.168.0.106:8738 SA"
192.168.0.106,116.132.235.204,8738,80,6,"Ether / IP / TCP 192.168.0.106:8738 > 116.132.235.204:http A"
192.168.0.106,116.132.235.204,8738,80,6,"Ether / IP / TCP 192.168.0.106:8738 > 116.132.235.204:http PA / Raw"
192.168.0.106,116.132.235.204,8738,80,6,"Ether / IP / TCP 192.168.0.106:8738 > 116.132.235.204:http A / Raw"
192.168.0.106,116.132.235.204,8738,80,6,"Ether / IP / TCP 192.168.0.106:8738 > 116.132.235.204:http A / Raw"
192.168.0.106,116.132.235.204,8738,80,6,"Ether / IP / TCP 192.168.0.106:8738 > 116.132.235.204:http PA / Raw"
116.132.235.204,192.168.0.106,80,8738,6,"Ether / IP / TCP 116.132.235.204:http > 192.168.0.106:8738 A"
116.132.235.204,192.168.0.106,80,8738,6,"Ether / IP / TCP 116.132.235.204:http > 192.168.0.106:8738 A"
116.132.235.204,192.168.0.106,80,8738,6,"Ether / IP / TCP 116.132.235.204:http > 192.168.0.106:8738 PA / Raw"
116.132.235.204,192.168.0.106,80,8738,6,"Ether / IP / TCP 116.132.235.204:http > 192.168.0.106:8738 FA"
