data,flowmember,label,classes
b'her / IP / TCP 218.12.116.244:https > 192.168.0.106:7231 A / Paddin',1,,
b'her / IP / TCP 218.12.116.244:https > 192.168.0.106:7231 A / Paddin',1,,
b'her / IP / TCP 192.168.0.106:7231 > 218.12.116.244:https ',2,,
b'her / IP / TCP 192.168.0.106:7231 > 218.12.116.244:https ',2,,
b'her / IP / TCP 140.82.113.25:https > 192.168.0.106:7363 ',3,,
b'her / IP / TCP 140.82.113.25:https > 192.168.0.106:7363 PA / Ra',3,,
b'her / IP / TCP 140.82.113.25:https > 192.168.0.106:7363 PA / Ra',3,,
b'her / IP / TCP 140.82.113.25:https > 192.168.0.106:7363 PA / Ra',3,,
b'her / IP / TCP 140.82.113.25:https > 192.168.0.106:7363 PA / Ra',3,,
b'her / IP / TCP 192.168.0.106:7363 > 140.82.113.25:https ',4,,
b'her / IP / TCP 192.168.0.106:7363 > 140.82.113.25:https PA / Ra',4,,
b'her / IP / TCP 192.168.0.106:7363 > 140.82.113.25:https ',4,,
b'her / IP / TCP 192.168.0.106:7171 > 27.221.44.37:http F',5,,
b'her / IP / TCP 192.168.0.106:7168 > 27.221.44.37:http F',6,,
b'her / IP / TCP 192.168.0.106:7169 > 27.221.44.37:http F',7,,
b'her / IP / TCP 192.168.0.106:7172 > 27.221.44.37:http F',8,,
b'her / IP / TCP 192.168.0.106:7167 > 27.221.44.37:http F',9,,
b'her / IP / TCP 192.168.0.106:7170 > 27.221.44.37:http F',10,,
b'her / IP / TCP 192.168.0.106:7173 > 27.221.44.35:http F',11,,
b'her / IP / TCP 192.168.0.106:7163 > 27.221.44.35:http F',12,,
"b'her / IP / UDP / DNS Qry ""b\'api.github.com.\'""'",13,,
"b'her / IP / UDP / DNS Qry ""b\'www.msftconnecttest.com.\'""'",13,,
"b'her / IP / UDP / DNS Qry ""b\'ipv6.msftconnecttest.com.\'""'",13,,
"b'her / IP / UDP / DNS Qry ""b\'cdnjs.cloudflare.com.\'""'",13,,
"b'her / IP / UDP / DNS Ans ""20.205.243.168""'",14,,
"b'her / IP / UDP / DNS Ans ""23.195.91.99""'",14,,
"b'her / IP / UDP / DNS Ans ""b\'v6ncsi.msedge.net.\'""'",14,,
"b'her / IP / UDP / DNS Ans ""104.17.25.14""'",14,,
b'her / IP / TCP 192.168.0.106:7364 > 20.205.243.168:https ',15,,
b'her / IP / TCP 192.168.0.106:7364 > 20.205.243.168:https ',15,,
b'her / IP / TCP 192.168.0.106:7364 > 20.205.243.168:https PA / Ra',15,,
b'her / IP / TCP 192.168.0.106:7364 > 20.205.243.168:https ',15,,
b'her / IP / TCP 192.168.0.106:7364 > 20.205.243.168:https PA / Ra',15,,
b'her / IP / TCP 192.168.0.106:7364 > 20.205.243.168:https PA / Ra',15,,
b'her / IP / TCP 192.168.0.106:7364 > 20.205.243.168:https PA / Ra',16,,
b'her / IP / TCP 192.168.0.106:7364 > 20.205.243.168:https PA / Ra',16,,
b'her / IP / TCP 192.168.0.106:7364 > 20.205.243.168:https ',16,,
b'her / IP / TCP 192.168.0.106:7364 > 20.205.243.168:https PA / Ra',16,,
b'her / IP / TCP 192.168.0.106:7364 > 20.205.243.168:https ',16,,
b'her / IP / TCP 192.168.0.106:7364 > 20.205.243.168:https ',16,,
b'her / IP / TCP 192.168.0.106:7364 > 20.205.243.168:https PA / Ra',16,,
b'her / IP / TCP 192.168.0.106:7364 > 20.205.243.168:https A / Ra',17,,
b'her / IP / TCP 192.168.0.106:7364 > 20.205.243.168:https A / Ra',17,,
b'her / IP / TCP 192.168.0.106:7364 > 20.205.243.168:https A / Ra',17,,
b'her / IP / TCP 192.168.0.106:7364 > 20.205.243.168:https A / Ra',17,,
b'her / IP / TCP 192.168.0.106:7364 > 20.205.243.168:https A / Ra',17,,
b'her / IP / TCP 192.168.0.106:7364 > 20.205.243.168:https A / Ra',17,,
b'her / IP / TCP 192.168.0.106:7364 > 20.205.243.168:https A / Ra',17,,
b'her / IP / TCP 192.168.0.106:7364 > 20.205.243.168:https A / Ra',18,,
b'her / IP / TCP 192.168.0.106:7364 > 20.205.243.168:https A / Ra',18,,
b'her / IP / TCP 192.168.0.106:7364 > 20.205.243.168:https A / Ra',18,,
b'her / IP / TCP 192.168.0.106:7364 > 20.205.243.168:https A / Ra',18,,
b'her / IP / TCP 192.168.0.106:7364 > 20.205.243.168:https PA / Ra',18,,
b'her / IP / TCP 192.168.0.106:7364 > 20.205.243.168:https A / Ra',18,,
b'her / IP / TCP 192.168.0.106:7364 > 20.205.243.168:https A / Ra',18,,
b'her / IP / TCP 192.168.0.106:7364 > 20.205.243.168:https A / Ra',19,,
b'her / IP / TCP 192.168.0.106:7364 > 20.205.243.168:https A / Ra',19,,
b'her / IP / TCP 192.168.0.106:7364 > 20.205.243.168:https A / Ra',19,,
b'her / IP / TCP 192.168.0.106:7364 > 20.205.243.168:https A / Ra',19,,
b'her / IP / TCP 192.168.0.106:7364 > 20.205.243.168:https A / Ra',19,,
b'her / IP / TCP 192.168.0.106:7364 > 20.205.243.168:https A / Ra',19,,
b'her / IP / TCP 192.168.0.106:7364 > 20.205.243.168:https A / Ra',19,,
b'her / IP / TCP 192.168.0.106:7364 > 20.205.243.168:https A / Ra',20,,
b'her / IP / TCP 192.168.0.106:7364 > 20.205.243.168:https A / Ra',20,,
b'her / IP / TCP 192.168.0.106:7364 > 20.205.243.168:https PA / Ra',20,,
b'her / IP / TCP 192.168.0.106:7364 > 20.205.243.168:https A / Ra',20,,
b'her / IP / TCP 192.168.0.106:7364 > 20.205.243.168:https A / Ra',20,,
b'her / IP / TCP 192.168.0.106:7364 > 20.205.243.168:https A / Ra',20,,
b'her / IP / TCP 192.168.0.106:7364 > 20.205.243.168:https A / Ra',20,,
b'her / IP / TCP 192.168.0.106:7364 > 20.205.243.168:https A / Ra',21,,
b'her / IP / TCP 192.168.0.106:7364 > 20.205.243.168:https A / Ra',21,,
b'her / IP / TCP 192.168.0.106:7364 > 20.205.243.168:https A / Ra',21,,
b'her / IP / TCP 192.168.0.106:7364 > 20.205.243.168:https A / Ra',21,,
b'her / IP / TCP 192.168.0.106:7364 > 20.205.243.168:https A / Ra',21,,
b'her / IP / TCP 192.168.0.106:7364 > 20.205.243.168:https A / Ra',21,,
b'her / IP / TCP 192.168.0.106:7364 > 20.205.243.168:https A / Ra',21,,
b'her / IP / TCP 192.168.0.106:7364 > 20.205.243.168:https PA / Ra',22,,
b'her / IP / TCP 192.168.0.106:7364 > 20.205.243.168:https A / Ra',22,,
b'her / IP / TCP 192.168.0.106:7364 > 20.205.243.168:https PA / Ra',22,,
b'her / IP / TCP 192.168.0.106:7364 > 20.205.243.168:https ',22,,
b'her / IP / TCP 27.221.44.37:http > 192.168.0.106:7171 A / Paddin',23,,
b'her / IP / TCP 27.221.44.37:http > 192.168.0.106:7172 ',24,,
b'her / IP / TCP 27.221.44.37:http > 192.168.0.106:7170 A / Paddin',25,,
b'her / IP / TCP 27.221.44.37:http > 192.168.0.106:7169 A / Paddin',26,,
b'her / IP / TCP 27.221.44.35:http > 192.168.0.106:7173 ',27,,
b'her / IP / TCP 27.221.44.37:http > 192.168.0.106:7167 A / Paddin',28,,
b'her / IP / TCP 27.221.44.37:http > 192.168.0.106:7168 A / Paddin',29,,
b'her / IP / TCP 27.221.44.35:http > 192.168.0.106:7163 ',30,,
"b'her / IP / UDP / DNS Qry ""b\'cn.bing.com.\'""'",31,,
"b'her / IP / UDP / DNS Qry ""b\'ipv6.msftconnecttest.com.\'""'",31,,
"b'her / IP / UDP / DNS Qry ""b\'colorlib.com.\'""'",31,,
"b'her / IP / UDP / DNS Ans ""202.89.233.100""'",32,,
"b'her / IP / UDP / DNS Ans ""b\'v6ncsi.msedge.net.\'""'",32,,
"b'her / IP / UDP / DNS Ans ""172.67.26.100""'",32,,
b'her / IP / TCP 20.205.243.168:https > 192.168.0.106:7364 S',33,,
b'her / IP / TCP 20.205.243.168:https > 192.168.0.106:7364 A / Ra',33,,
b'her / IP / TCP 20.205.243.168:https > 192.168.0.106:7364 A / Ra',33,,
b'her / IP / TCP 20.205.243.168:https > 192.168.0.106:7364 PA / Ra',33,,
b'her / IP / TCP 20.205.243.168:https > 192.168.0.106:7364 PA / Ra',33,,
b'her / IP / TCP 20.205.243.168:https > 192.168.0.106:7364 PA / Ra',33,,
b'her / IP / TCP 20.205.243.168:https > 192.168.0.106:7364 ',34,,
b'her / IP / TCP 20.205.243.168:https > 192.168.0.106:7364 PA / Ra',34,,
b'her / IP / TCP 20.205.243.168:https > 192.168.0.106:7364 ',34,,
b'her / IP / TCP 20.205.243.168:https > 192.168.0.106:7364 PA / Ra',34,,
b'her / IP / TCP 20.205.243.168:https > 192.168.0.106:7364 ',34,,
b'her / IP / TCP 20.205.243.168:https > 192.168.0.106:7364 PA / Ra',34,,
b'her / IP / TCP 20.205.243.168:https > 192.168.0.106:7364 A / Paddin',34,,
b'her / IP / TCP 20.205.243.168:https > 192.168.0.106:7364 A / Paddin',35,,
b'her / IP / TCP 20.205.243.168:https > 192.168.0.106:7364 A / Paddin',35,,
b'her / IP / TCP 20.205.243.168:https > 192.168.0.106:7364 A / Paddin',35,,
b'her / IP / TCP 20.205.243.168:https > 192.168.0.106:7364 A / Paddin',35,,
b'her / IP / TCP 20.205.243.168:https > 192.168.0.106:7364 A / Paddin',35,,
b'her / IP / TCP 20.205.243.168:https > 192.168.0.106:7364 A / Paddin',35,,
b'her / IP / TCP 20.205.243.168:https > 192.168.0.106:7364 PA / Ra',35,,
b'her / IP / TCP 20.205.243.168:https > 192.168.0.106:7364 A / Paddin',36,,
b'her / IP / TCP 20.205.243.168:https > 192.168.0.106:7364 A / Paddin',36,,
b'her / IP / TCP 20.205.243.168:https > 192.168.0.106:7364 A / Paddin',36,,
b'her / IP / TCP 20.205.243.168:https > 192.168.0.106:7364 A / Paddin',36,,
b'her / IP / TCP 20.205.243.168:https > 192.168.0.106:7364 A / Paddin',36,,
b'her / IP / TCP 20.205.243.168:https > 192.168.0.106:7364 A / Paddin',36,,
b'her / IP / TCP 20.205.243.168:https > 192.168.0.106:7364 PA / Ra',36,,
b'her / IP / TCP 20.205.243.168:https > 192.168.0.106:7364 A / Paddin',37,,
b'her / IP / TCP 20.205.243.168:https > 192.168.0.106:7364 A / Paddin',37,,
b'her / IP / TCP 20.205.243.168:https > 192.168.0.106:7364 A / Paddin',37,,
b'her / IP / TCP 20.205.243.168:https > 192.168.0.106:7364 PA / Ra',37,,
b'her / IP / TCP 20.205.243.168:https > 192.168.0.106:7364 A / Paddin',37,,
b'her / IP / TCP 20.205.243.168:https > 192.168.0.106:7364 PA / Ra',37,,
"b'her / IP / UDP / DNS Qry ""b\'dns.msftncsi.com.\'""'",38,,
"b'her / IP / UDP / DNS Qry ""b\'ipv6.msftconnecttest.com.\'""'",38,,
"b'her / IP / UDP / DNS Qry ""b\'ipv6.msftconnecttest.com.\'""'",38,,
"b'her / IP / UDP / DNS Ans ""fd3e:4f5a:5b81::1""'",39,,
"b'her / IP / UDP / DNS Ans ""b\'v6ncsi.msedge.net.\'""'",39,,
"b'her / IP / UDP / DNS Qry ""b\'www.msftconnecttest.com.\'""'",40,,
"b'her / IP / UDP / DNS Qry ""b\'ipv6.msftconnecttest.com.\'""'",40,,
"b'her / IP / UDP / DNS Qry ""b\'collector.github.com.\'""'",40,,
"b'her / IP / UDP / DNS Ans ""b\'ncsi-geo.trafficmanager.net.\'""'",41,,
"b'her / IP / UDP / DNS Ans ""b\'v6ncsi.msedge.net.\'""'",41,,
"b'her / IP / UDP / DNS Ans ""b\'glb-db52c2cf8be544.github.com.\'""'",41,,
b'her / IP / TCP 192.168.0.106:7365 > 23.195.91.99:http ',42,,
b'her / IP / TCP 192.168.0.106:7365 > 23.195.91.99:http ',42,,
b'her / IP / TCP 192.168.0.106:7365 > 23.195.91.99:http PA / Ra',42,,
b'her / IP / TCP 192.168.0.106:7365 > 23.195.91.99:http ',42,,
b'her / IP / TCP 192.168.0.106:7365 > 23.195.91.99:http F',42,,
b'her / IP / TCP 192.168.0.106:7365 > 23.195.91.99:http F',42,,
b'her / IP / TCP 192.168.0.106:7366 > 23.195.91.99:http ',43,,
b'her / IP / TCP 192.168.0.106:7366 > 23.195.91.99:http ',43,,
b'her / IP / TCP 192.168.0.106:7366 > 23.195.91.99:http PA / Ra',43,,
b'her / IP / TCP 192.168.0.106:7366 > 23.195.91.99:http ',43,,
b'her / IP / TCP 192.168.0.106:7366 > 23.195.91.99:http F',43,,
b'her / IP / TCP 192.168.0.106:7366 > 23.195.91.99:http F',43,,
b'her / IP / TCP 23.195.91.99:http > 192.168.0.106:7366 S',44,,
b'her / IP / TCP 23.195.91.99:http > 192.168.0.106:7366 ',44,,
b'her / IP / TCP 23.195.91.99:http > 192.168.0.106:7366 PA / Ra',44,,
b'her / IP / TCP 23.195.91.99:http > 192.168.0.106:7366 F',44,,
b'her / IP / TCP 23.195.91.99:http > 192.168.0.106:7366 ',44,,
b'her / IP / TCP 23.195.91.99:http > 192.168.0.106:7365 S',45,,
b'her / IP / TCP 23.195.91.99:http > 192.168.0.106:7365 ',45,,
b'her / IP / TCP 23.195.91.99:http > 192.168.0.106:7365 PA / Ra',45,,
b'her / IP / TCP 23.195.91.99:http > 192.168.0.106:7365 F',45,,
b'her / IP / TCP 23.195.91.99:http > 192.168.0.106:7365 ',45,,
b'her / IP / TCP 192.168.0.106:7367 > 116.132.235.228:http ',46,,
b'her / IP / TCP 192.168.0.106:7367 > 116.132.235.228:http ',46,,
b'her / IP / TCP 192.168.0.106:7367 > 116.132.235.228:http PA / Ra',46,,
b'her / IP / TCP 192.168.0.106:7367 > 116.132.235.228:http A / Ra',46,,
b'her / IP / TCP 192.168.0.106:7367 > 116.132.235.228:http A / Ra',46,,
b'her / IP / TCP 192.168.0.106:7367 > 116.132.235.228:http PA / Ra',46,,
b'her / IP / TCP 192.168.0.106:7367 > 116.132.235.228:http ',47,,
b'her / IP / TCP 192.168.0.106:7367 > 116.132.235.228:http F',47,,
b'her / IP / TCP 192.168.0.106:7367 > 116.132.235.228:http F',47,,
b'her / IP / TCP 192.168.0.106:7367 > 116.132.235.228:http F',47,,
b'her / IP / TCP 192.168.0.106:7367 > 116.132.235.228:http F',47,,
b'her / IP / TCP 116.132.235.228:http > 192.168.0.106:7367 S',48,,
b'her / IP / TCP 116.132.235.228:http > 192.168.0.106:7367 ',48,,
b'her / IP / TCP 116.132.235.228:http > 192.168.0.106:7367 ',48,,
b'her / IP / TCP 116.132.235.228:http > 192.168.0.106:7367 ',48,,
b'her / IP / TCP 116.132.235.228:http > 192.168.0.106:7367 PA / Ra',48,,
b'her / IP / TCP 116.132.235.228:http > 192.168.0.106:7367 F',48,,
b'her / IP / TCP 192.168.0.106:7368 > 116.132.235.228:http ',49,,
b'her / IP / TCP 192.168.0.106:7368 > 116.132.235.228:http ',49,,
b'her / IP / TCP 192.168.0.106:7368 > 116.132.235.228:http PA / Ra',49,,
b'her / IP / TCP 192.168.0.106:7368 > 116.132.235.228:http A / Ra',49,,
b'her / IP / TCP 192.168.0.106:7368 > 116.132.235.228:http A / Ra',49,,
b'her / IP / TCP 192.168.0.106:7368 > 116.132.235.228:http PA / Ra',49,,
b'her / IP / TCP 192.168.0.106:7368 > 116.132.235.228:http ',50,,
b'her / IP / TCP 192.168.0.106:7368 > 116.132.235.228:http F',50,,
b'her / IP / TCP 192.168.0.106:7368 > 116.132.235.228:http F',50,,
b'her / IP / TCP 192.168.0.106:7368 > 116.132.235.228:http F',50,,
b'her / IP / TCP 116.132.235.228:http > 192.168.0.106:7368 S',51,,
b'her / IP / TCP 116.132.235.228:http > 192.168.0.106:7368 ',51,,
b'her / IP / TCP 116.132.235.228:http > 192.168.0.106:7368 ',51,,
b'her / IP / TCP 116.132.235.228:http > 192.168.0.106:7368 ',51,,
b'her / IP / TCP 116.132.235.228:http > 192.168.0.106:7368 PA / Ra',51,,
b'her / IP / TCP 116.132.235.228:http > 192.168.0.106:7368 F',51,,
b'her / IP / TCP 27.221.44.35:http > 192.168.0.106:7162 F',52,,
b'her / IP / TCP 27.221.44.35:http > 192.168.0.106:7162 A / Paddin',52,,
b'her / IP / TCP 192.168.0.106:7162 > 27.221.44.35:http ',53,,
b'her / IP / TCP 192.168.0.106:7162 > 27.221.44.35:http F',53,,
b'her / IP / TCP 192.168.0.106:7369 > 172.67.26.100:https ',54,,
b'her / IP / TCP 192.168.0.106:7369 > 172.67.26.100:https ',54,,
b'her / IP / TCP 192.168.0.106:7369 > 172.67.26.100:https PA / Ra',54,,
b'her / IP / TCP 192.168.0.106:7369 > 172.67.26.100:https ',54,,
b'her / IP / TCP 192.168.0.106:7369 > 172.67.26.100:https ',54,,
b'her / IP / TCP 192.168.0.106:7369 > 172.67.26.100:https PA / Ra',54,,
b'her / IP / TCP 192.168.0.106:7369 > 172.67.26.100:https ',55,,
b'her / IP / TCP 192.168.0.106:7370 > 172.67.26.100:https ',55,,
b'her / IP / TCP 192.168.0.106:7370 > 172.67.26.100:https ',55,,
b'her / IP / TCP 192.168.0.106:7370 > 172.67.26.100:https PA / Ra',55,,
b'her / IP / TCP 192.168.0.106:7370 > 172.67.26.100:https ',55,,
b'her / IP / TCP 192.168.0.106:7370 > 172.67.26.100:https PA / Ra',55,,
b'her / IP / TCP 192.168.0.106:7370 > 172.67.26.100:https PA / Ra',55,,
b'her / IP / TCP 192.168.0.106:7370 > 172.67.26.100:https PA / Ra',56,,
b'her / IP / TCP 192.168.0.106:7370 > 172.67.26.100:https PA / Ra',56,,
b'her / IP / TCP 192.168.0.106:7370 > 172.67.26.100:https ',56,,
b'her / IP / TCP 192.168.0.106:7370 > 172.67.26.100:https ',56,,
b'her / IP / TCP 192.168.0.106:7370 > 172.67.26.100:https PA / Ra',56,,
b'her / IP / TCP 192.168.0.106:7370 > 172.67.26.100:https PA / Ra',56,,
b'her / IP / TCP 192.168.0.106:7370 > 172.67.26.100:https ',56,,
b'her / IP / TCP 192.168.0.106:7370 > 172.67.26.100:https ',57,,
b'her / IP / TCP 192.168.0.106:7370 > 172.67.26.100:https ',57,,
b'her / IP / TCP 192.168.0.106:7370 > 172.67.26.100:https ',57,,
b'her / IP / TCP 192.168.0.106:7371 > 20.195.112.105:https ',58,,
b'her / IP / TCP 192.168.0.106:7371 > 20.195.112.105:https ',58,,
b'her / IP / TCP 192.168.0.106:7371 > 20.195.112.105:https PA / Ra',58,,
b'her / IP / TCP 192.168.0.106:7371 > 20.195.112.105:https ',58,,
b'her / IP / TCP 192.168.0.106:7371 > 20.195.112.105:https ',58,,
b'her / IP / TCP 192.168.0.106:7371 > 20.195.112.105:https PA / Ra',58,,
b'her / IP / TCP 192.168.0.106:7371 > 20.195.112.105:https PA / Ra',59,,
b'her / IP / TCP 192.168.0.106:7371 > 20.195.112.105:https A / Ra',59,,
b'her / IP / TCP 192.168.0.106:7371 > 20.195.112.105:https PA / Ra',59,,
b'her / IP / TCP 192.168.0.106:7371 > 20.195.112.105:https ',59,,
b'her / IP / TCP 192.168.0.106:7371 > 20.195.112.105:https F',59,,
b'her / IP / TCP 192.168.0.106:7371 > 20.195.112.105:https F',59,,
b'her / IP / TCP 192.168.0.106:7371 > 20.195.112.105:https F',59,,
b'her / IP / TCP 20.195.112.105:https > 192.168.0.106:7371 S',60,,
b'her / IP / TCP 20.195.112.105:https > 192.168.0.106:7371 A / Ra',60,,
b'her / IP / TCP 20.195.112.105:https > 192.168.0.106:7371 A / Ra',60,,
b'her / IP / TCP 20.195.112.105:https > 192.168.0.106:7371 A / Ra',60,,
b'her / IP / TCP 20.195.112.105:https > 192.168.0.106:7371 A / Ra',60,,
b'her / IP / TCP 20.195.112.105:https > 192.168.0.106:7371 A / Ra',60,,
b'her / IP / TCP 20.195.112.105:https > 192.168.0.106:7371 PA / Ra',61,,
b'her / IP / TCP 20.195.112.105:https > 192.168.0.106:7371 PA / Ra',61,,
b'her / IP / TCP 20.195.112.105:https > 192.168.0.106:7371 ',61,,
b'her / IP / TCP 20.195.112.105:https > 192.168.0.106:7371 ',61,,
b'her / IP / TCP 20.195.112.105:https > 192.168.0.106:7371 A / Ra',61,,
b'her / IP / TCP 20.195.112.105:https > 192.168.0.106:7371 FPA / Ra',61,,
b'her / IP / TCP 192.168.0.106:7356 > 20.195.112.105:https F',62,,
b'her / IP / TCP 192.168.0.106:7372 > 172.67.26.100:https ',63,,
b'her / IP / TCP 192.168.0.106:7372 > 172.67.26.100:https ',63,,
b'her / IP / TCP 192.168.0.106:7372 > 172.67.26.100:https PA / Ra',63,,
b'her / IP / TCP 192.168.0.106:7372 > 172.67.26.100:https ',63,,
b'her / IP / TCP 192.168.0.106:7372 > 172.67.26.100:https PA / Ra',63,,
b'her / IP / TCP 192.168.0.106:7372 > 172.67.26.100:https ',63,,
b'her / IP / TCP 172.67.26.100:https > 192.168.0.106:7370 S',64,,
b'her / IP / TCP 172.67.26.100:https > 192.168.0.106:7370 ',64,,
b'her / IP / TCP 172.67.26.100:https > 192.168.0.106:7370 A / Ra',64,,
b'her / IP / TCP 172.67.26.100:https > 192.168.0.106:7370 PA / Ra',64,,
b'her / IP / TCP 172.67.26.100:https > 192.168.0.106:7370 PA / Ra',64,,
b'her / IP / TCP 172.67.26.100:https > 192.168.0.106:7370 ',64,,
b'her / IP / TCP 172.67.26.100:https > 192.168.0.106:7370 PA / Ra',65,,
b'her / IP / TCP 172.67.26.100:https > 192.168.0.106:7370 ',65,,
b'her / IP / TCP 172.67.26.100:https > 192.168.0.106:7370 PA / Ra',65,,
b'her / IP / TCP 172.67.26.100:https > 192.168.0.106:7370 PA / Ra',65,,
b'her / IP / TCP 172.67.26.100:https > 192.168.0.106:7370 A / Ra',65,,
b'her / IP / TCP 172.67.26.100:https > 192.168.0.106:7370 PA / Ra',65,,
b'her / IP / TCP 172.67.26.100:https > 192.168.0.106:7370 A / Ra',65,,
b'her / IP / TCP 172.67.26.100:https > 192.168.0.106:7370 PA / Ra',66,,
b'her / IP / TCP 172.67.26.100:https > 192.168.0.106:7370 ',66,,
b'her / IP / TCP 172.67.26.100:https > 192.168.0.106:7370 ',66,,
b'her / IP / TCP 172.67.26.100:https > 192.168.0.106:7370 PA / Ra',66,,
b'her / IP / TCP 172.67.26.100:https > 192.168.0.106:7370 PA / Ra',66,,
b'her / IP / TCP 172.67.26.100:https > 192.168.0.106:7370 PA / Ra',66,,
b'her / IP / TCP 172.67.26.100:https > 192.168.0.106:7370 A / Ra',66,,
b'her / IP / TCP 172.67.26.100:https > 192.168.0.106:7370 PA / Ra',67,,
b'her / IP / TCP 172.67.26.100:https > 192.168.0.106:7370 A / Ra',67,,
b'her / IP / TCP 172.67.26.100:https > 192.168.0.106:7370 PA / Ra',67,,
b'her / IP / TCP 172.67.26.100:https > 192.168.0.106:7370 A / Ra',67,,
b'her / IP / TCP 172.67.26.100:https > 192.168.0.106:7370 PA / Ra',67,,
b'her / IP / TCP 172.67.26.100:https > 192.168.0.106:7369 S',68,,
b'her / IP / TCP 172.67.26.100:https > 192.168.0.106:7369 ',68,,
b'her / IP / TCP 172.67.26.100:https > 192.168.0.106:7369 PA / Ra',68,,
b'her / IP / TCP 172.67.26.100:https > 192.168.0.106:7369 A / Ra',68,,
b'her / IP / TCP 172.67.26.100:https > 192.168.0.106:7369 PA / Ra',68,,
b'her / IP / TCP 172.67.26.100:https > 192.168.0.106:7372 S',69,,
b'her / IP / TCP 172.67.26.100:https > 192.168.0.106:7372 ',69,,
b'her / IP / TCP 172.67.26.100:https > 192.168.0.106:7372 A / Ra',69,,
b'her / IP / TCP 172.67.26.100:https > 192.168.0.106:7372 PA / Ra',69,,
b'her / IP / TCP 172.67.26.100:https > 192.168.0.106:7372 PA / Ra',69,,
b'her / IP / TCP 192.168.0.106:7143 > 20.189.173.15:https PA / Ra',70,,
b'her / IP / TCP 192.168.0.106:7143 > 20.189.173.15:https PA / Ra',70,,
b'her / IP / TCP 192.168.0.106:7143 > 20.189.173.15:https ',70,,
b'her / IP / TCP 192.168.0.106:7373 > 116.132.235.228:http ',71,,
b'her / IP / TCP 192.168.0.106:7373 > 116.132.235.228:http ',71,,
b'her / IP / TCP 192.168.0.106:7373 > 116.132.235.228:http PA / Ra',71,,
b'her / IP / TCP 192.168.0.106:7373 > 116.132.235.228:http A / Ra',71,,
b'her / IP / TCP 192.168.0.106:7373 > 116.132.235.228:http A / Ra',71,,
b'her / IP / TCP 192.168.0.106:7373 > 116.132.235.228:http PA / Ra',71,,
b'her / IP / TCP 192.168.0.106:7373 > 116.132.235.228:http ',72,,
b'her / IP / TCP 192.168.0.106:7373 > 116.132.235.228:http F',72,,
b'her / IP / TCP 116.132.235.228:http > 192.168.0.106:7373 S',73,,
b'her / IP / TCP 116.132.235.228:http > 192.168.0.106:7373 ',73,,
b'her / IP / TCP 116.132.235.228:http > 192.168.0.106:7373 ',73,,
b'her / IP / TCP 116.132.235.228:http > 192.168.0.106:7373 ',73,,
b'her / IP / TCP 116.132.235.228:http > 192.168.0.106:7373 PA / Ra',73,,
b'her / IP / TCP 116.132.235.228:http > 192.168.0.106:7373 F',73,,
b'her / IP / TCP 116.132.235.228:http > 192.168.0.106:7373 ',74,,
b'her / IP / TCP 20.189.173.15:https > 192.168.0.106:7143 A / Paddin',74,,
b'her / IP / TCP 20.189.173.15:https > 192.168.0.106:7143 PA / Ra',74,,
b'her / IP / TCP 185.199.109.133:https > 192.168.0.106:7357 PA / Ra',75,,
b'her / IP / TCP 185.199.109.133:https > 192.168.0.106:7357 PA / Ra',75,,
b'her / IP / TCP 192.168.0.106:7357 > 185.199.109.133:https ',76,,
b'her / IP / TCP 192.168.0.106:7212 > 202.89.233.100:https F',77,,
b'her / IP / TCP 192.168.0.106:7211 > 202.89.233.100:https F',78,,
b'her / IP / TCP 192.168.0.106:7210 > 202.89.233.101:https F',79,,
b'her / IP / TCP 192.168.0.106:7213 > 202.89.233.101:https F',80,,
b'her / IP / TCP 192.168.0.106:7374 > 140.82.114.21:https ',81,,
b'her / IP / TCP 192.168.0.106:7374 > 140.82.114.21:https ',81,,
b'her / IP / TCP 192.168.0.106:7374 > 140.82.114.21:https PA / Ra',81,,
b'her / IP / TCP 192.168.0.106:7374 > 140.82.114.21:https ',81,,
b'her / IP / TCP 192.168.0.106:7374 > 140.82.114.21:https PA / Ra',81,,
b'her / IP / TCP 192.168.0.106:7374 > 140.82.114.21:https PA / Ra',81,,
b'her / IP / TCP 192.168.0.106:7374 > 140.82.114.21:https PA / Ra',82,,
b'her / IP / TCP 192.168.0.106:7374 > 140.82.114.21:https PA / Ra',82,,
b'her / IP / TCP 202.89.233.100:https > 192.168.0.106:7211 ',83,,
b'her / IP / TCP 202.89.233.100:https > 192.168.0.106:7211 R',83,,
b'her / IP / TCP 202.89.233.100:https > 192.168.0.106:7212 ',84,,
b'her / IP / TCP 202.89.233.100:https > 192.168.0.106:7212 R',84,,
b'her / IP / TCP 202.89.233.101:https > 192.168.0.106:7213 ',85,,
b'her / IP / TCP 202.89.233.101:https > 192.168.0.106:7213 R',85,,
b'her / IP / TCP 202.89.233.101:https > 192.168.0.106:7210 ',86,,
b'her / IP / TCP 202.89.233.101:https > 192.168.0.106:7210 R',86,,
b'her / IP / TCP 61.163.173.52:https > 192.168.0.106:7217 PA / Ra',87,,
b'her / IP / TCP 61.163.173.52:https > 192.168.0.106:7217 F',87,,
b'her / IP / TCP 192.168.0.106:7217 > 61.163.173.52:https ',88,,
b'her / IP / TCP 61.163.173.54:https > 192.168.0.106:7218 PA / Ra',89,,
b'her / IP / TCP 61.163.173.54:https > 192.168.0.106:7218 F',89,,
b'her / IP / TCP 192.168.0.106:7218 > 61.163.173.54:https ',90,,
b'her / IP / TCP 192.168.0.106:7226 > 13.107.5.80:https PA / Ra',91,,
b'her / IP / TCP 192.168.0.106:7226 > 13.107.5.80:https ',91,,
b'her / IP / UDP 192.168.0.106:49664 > 172.67.26.100:https / Ra',92,,
b'her / IP / UDP 192.168.0.106:49664 > 172.67.26.100:https / Ra',92,,
b'her / IP / UDP 192.168.0.106:49664 > 172.67.26.100:https / Ra',92,,
b'her / IP / UDP 192.168.0.106:49664 > 172.67.26.100:https / Ra',92,,
b'her / IP / UDP 192.168.0.106:49664 > 172.67.26.100:https / Ra',92,,
b'her / IP / UDP 192.168.0.106:49664 > 172.67.26.100:https / Ra',92,,
b'her / IP / UDP 192.168.0.106:49664 > 172.67.26.100:https / Ra',93,,
b'her / IP / UDP 192.168.0.106:63922 > 104.17.25.14:https / Ra',93,,
b'her / IP / UDP 192.168.0.106:63922 > 104.17.25.14:https / Ra',93,,
b'her / IP / UDP 192.168.0.106:63922 > 104.17.25.14:https / Ra',93,,
b'her / IP / UDP 192.168.0.106:63922 > 104.17.25.14:https / Ra',93,,
b'her / IP / UDP 192.168.0.106:63922 > 104.17.25.14:https / Ra',93,,
b'her / IP / UDP 192.168.0.106:63922 > 104.17.25.14:https / Ra',93,,
b'her / IP / UDP 192.168.0.106:63922 > 104.17.25.14:https / Ra',94,,
b'her / IP / UDP 192.168.0.106:63922 > 104.17.25.14:https / Ra',94,,
b'her / IP / UDP 192.168.0.106:63922 > 104.17.25.14:https / Ra',94,,
b'her / IP / UDP 192.168.0.106:63922 > 104.17.25.14:https / Ra',94,,
b'her / IP / UDP 192.168.0.106:63922 > 104.17.25.14:https / Ra',94,,
b'her / IP / UDP 192.168.0.106:63922 > 104.17.25.14:https / Ra',94,,
b'her / IP / UDP 192.168.0.106:63922 > 104.17.25.14:https / Ra',94,,
b'her / IP / UDP 192.168.0.106:63922 > 104.17.25.14:https / Ra',95,,
b'her / IP / UDP 192.168.0.106:63922 > 104.17.25.14:https / Ra',95,,
b'her / IP / UDP 192.168.0.106:63922 > 104.17.25.14:https / Ra',95,,
b'her / IP / UDP 192.168.0.106:63922 > 104.17.25.14:https / Ra',95,,
b'her / IP / UDP 192.168.0.106:63922 > 104.17.25.14:https / Ra',95,,
b'her / IP / TCP 13.107.5.80:https > 192.168.0.106:7226 A / Paddin',96,,
b'her / IP / TCP 13.107.5.80:https > 192.168.0.106:7226 A / Ra',96,,
b'her / IP / TCP 13.107.5.80:https > 192.168.0.106:7226 PA / Ra',96,,
b'her / IP / TCP 13.107.5.80:https > 192.168.0.106:7226 PA / Ra',96,,
b'her / IP / TCP 192.168.0.106:7375 > 140.82.114.21:https ',97,,
b'her / IP / TCP 192.168.0.106:7375 > 140.82.114.21:https ',97,,
b'her / IP / TCP 192.168.0.106:7375 > 140.82.114.21:https PA / Ra',97,,
b'her / IP / TCP 140.82.114.21:https > 192.168.0.106:7374 S',98,,
b'her / IP / TCP 140.82.114.21:https > 192.168.0.106:7374 A / Ra',98,,
b'her / IP / TCP 140.82.114.21:https > 192.168.0.106:7374 A / Ra',98,,
b'her / IP / TCP 140.82.114.21:https > 192.168.0.106:7374 PA / Ra',98,,
b'her / IP / UDP 172.67.26.100:https > 192.168.0.106:49664 / Ra',99,,
b'her / IP / UDP 172.67.26.100:https > 192.168.0.106:49664 / Ra',99,,
b'her / IP / UDP 172.67.26.100:https > 192.168.0.106:49664 / Ra',99,,
b'her / IP / UDP 172.67.26.100:https > 192.168.0.106:49664 / Ra',99,,
b'her / IP / UDP 172.67.26.100:https > 192.168.0.106:49664 / Ra',99,,
b'her / IP / UDP 172.67.26.100:https > 192.168.0.106:49664 / Ra',99,,
b'her / IP / UDP 172.67.26.100:https > 192.168.0.106:49664 / Ra',100,,
b'her / IP / UDP 172.67.26.100:https > 192.168.0.106:49664 / Ra',100,,
b'her / IP / UDP 104.17.25.14:https > 192.168.0.106:63922 / Ra',101,,
b'her / IP / UDP 104.17.25.14:https > 192.168.0.106:63922 / Ra',101,,
b'her / IP / UDP 104.17.25.14:https > 192.168.0.106:63922 / Ra',101,,
b'her / IP / UDP 104.17.25.14:https > 192.168.0.106:63922 / Ra',101,,
b'her / IP / UDP 104.17.25.14:https > 192.168.0.106:63922 / Ra',101,,
b'her / IP / UDP 104.17.25.14:https > 192.168.0.106:63922 / Ra',101,,
b'her / IP / UDP 104.17.25.14:https > 192.168.0.106:63922 / Ra',102,,
b'her / IP / UDP 104.17.25.14:https > 192.168.0.106:63922 / Ra',102,,
b'her / IP / UDP 104.17.25.14:https > 192.168.0.106:63922 / Ra',102,,
b'her / IP / UDP 104.17.25.14:https > 192.168.0.106:63922 / Ra',102,,
b'her / IP / UDP 104.17.25.14:https > 192.168.0.106:63922 / Ra',102,,
b'her / IP / UDP 104.17.25.14:https > 192.168.0.106:63922 / Ra',102,,
b'her / IP / UDP 104.17.25.14:https > 192.168.0.106:63922 / Ra',102,,
b'her / IP / UDP 104.17.25.14:https > 192.168.0.106:63922 / Ra',103,,
b'her / IP / UDP 104.17.25.14:https > 192.168.0.106:63922 / Ra',103,,
b'her / IP / UDP 104.17.25.14:https > 192.168.0.106:63922 / Ra',103,,
b'her / IP / TCP 140.82.114.21:https > 192.168.0.106:7375 S',104,,
b'her / IP / TCP 140.82.114.21:https > 192.168.0.106:7375 A / Ra',104,,
