srcip,dstip,sport,dport,proto,data
192.168.0.106,116.132.235.204,13754,80,6,"Ether / IP / TCP 192.168.0.106:13754 > 116.132.235.204:http S"
116.132.235.204,192.168.0.106,80,13754,6,"Ether / IP / TCP 116.132.235.204:http > 192.168.0.106:13754 SA"
192.168.0.106,116.132.235.204,13754,80,6,"Ether / IP / TCP 192.168.0.106:13754 > 116.132.235.204:http A"
192.168.0.106,116.132.235.204,13754,80,6,"Ether / IP / TCP 192.168.0.106:13754 > 116.132.235.204:http PA / Raw"
192.168.0.106,116.132.235.204,13754,80,6,"Ether / IP / TCP 192.168.0.106:13754 > 116.132.235.204:http A / Raw"
192.168.0.106,116.132.235.204,13754,80,6,"Ether / IP / TCP 192.168.0.106:13754 > 116.132.235.204:http A / Raw"
192.168.0.106,116.132.235.204,13754,80,6,"Ether / IP / TCP 192.168.0.106:13754 > 116.132.235.204:http PA / Raw"
116.132.235.204,192.168.0.106,80,13754,6,"Ether / IP / TCP 116.132.235.204:http > 192.168.0.106:13754 A"
116.132.235.204,192.168.0.106,80,13754,6,"Ether / IP / TCP 116.132.235.204:http > 192.168.0.106:13754 A"
116.132.235.204,192.168.0.106,80,13754,6,"Ether / IP / TCP 116.132.235.204:http > 192.168.0.106:13754 A"
116.132.235.204,192.168.0.106,80,13754,6,"Ether / IP / TCP 116.132.235.204:http > 192.168.0.106:13754 PA / Raw"
116.132.235.204,192.168.0.106,80,13754,6,"Ether / IP / TCP 116.132.235.204:http > 192.168.0.106:13754 FA"
192.168.0.106,116.132.235.204,13754,80,6,"Ether / IP / TCP 192.168.0.106:13754 > 116.132.235.204:http A"
192.168.0.106,116.132.235.204,13754,80,6,"Ether / IP / TCP 192.168.0.106:13754 > 116.132.235.204:http FA"
116.132.235.204,192.168.0.106,80,13754,6,"Ether / IP / TCP 116.132.235.204:http > 192.168.0.106:13754 A"
111.7.98.215,192.168.0.106,80,13610,6,"Ether / IP / TCP 111.7.98.215:http > 192.168.0.106:13610 FA"
192.168.0.106,111.7.98.215,13610,80,6,"Ether / IP / TCP 192.168.0.106:13610 > 111.7.98.215:http A"
192.168.0.106,157.148.57.58,13693,80,6,"Ether / IP / TCP 192.168.0.106:13693 > 157.148.57.58:http RA"
192.168.0.106,116.132.235.204,13755,80,6,"Ether / IP / TCP 192.168.0.106:13755 > 116.132.235.204:http S"
116.132.235.204,192.168.0.106,80,13755,6,"Ether / IP / TCP 116.132.235.204:http > 192.168.0.106:13755 SA"
192.168.0.106,116.132.235.204,13755,80,6,"Ether / IP / TCP 192.168.0.106:13755 > 116.132.235.204:http A"
192.168.0.106,116.132.235.204,13755,80,6,"Ether / IP / TCP 192.168.0.106:13755 > 116.132.235.204:http PA / Raw"
192.168.0.106,116.132.235.204,13755,80,6,"Ether / IP / TCP 192.168.0.106:13755 > 116.132.235.204:http A / Raw"
192.168.0.106,116.132.235.204,13755,80,6,"Ether / IP / TCP 192.168.0.106:13755 > 116.132.235.204:http A / Raw"
192.168.0.106,116.132.235.204,13755,80,6,"Ether / IP / TCP 192.168.0.106:13755 > 116.132.235.204:http PA / Raw"
116.132.235.204,192.168.0.106,80,13755,6,"Ether / IP / TCP 116.132.235.204:http > 192.168.0.106:13755 A"
116.132.235.204,192.168.0.106,80,13755,6,"Ether / IP / TCP 116.132.235.204:http > 192.168.0.106:13755 A"
116.132.235.204,192.168.0.106,80,13755,6,"Ether / IP / TCP 116.132.235.204:http > 192.168.0.106:13755 A"
116.132.235.204,192.168.0.106,80,13755,6,"Ether / IP / TCP 116.132.235.204:http > 192.168.0.106:13755 PA / Raw"
116.132.235.204,192.168.0.106,80,13755,6,"Ether / IP / TCP 116.132.235.204:http > 192.168.0.106:13755 FA"
192.168.0.106,116.132.235.204,13755,80,6,"Ether / IP / TCP 192.168.0.106:13755 > 116.132.235.204:http A"
192.168.0.106,116.132.235.204,13755,80,6,"Ether / IP / TCP 192.168.0.106:13755 > 116.132.235.204:http FA"
192.168.0.106,116.132.235.204,13755,80,6,"Ether / IP / TCP 192.168.0.106:13755 > 116.132.235.204:http FA"
192.168.0.104,224.0.0.251,5353,5353,17,"Ether / IP / UDP / DNS Ans ""[b'model=J517AP']"" "
0,0,0,0,0,"Ether / IPv6 / UDP / DNS Ans ""[b'model=J517AP']"" "
192.168.0.106,116.132.235.204,13755,80,6,"Ether / IP / TCP 192.168.0.106:13755 > 116.132.235.204:http FA"
192.168.0.106,116.132.235.204,13756,80,6,"Ether / IP / TCP 192.168.0.106:13756 > 116.132.235.204:http S"
116.132.235.204,192.168.0.106,80,13756,6,"Ether / IP / TCP 116.132.235.204:http > 192.168.0.106:13756 SA"
192.168.0.106,116.132.235.204,13756,80,6,"Ether / IP / TCP 192.168.0.106:13756 > 116.132.235.204:http A"
192.168.0.106,116.132.235.204,13756,80,6,"Ether / IP / TCP 192.168.0.106:13756 > 116.132.235.204:http PA / Raw"
192.168.0.106,116.132.235.204,13756,80,6,"Ether / IP / TCP 192.168.0.106:13756 > 116.132.235.204:http A / Raw"
192.168.0.106,116.132.235.204,13756,80,6,"Ether / IP / TCP 192.168.0.106:13756 > 116.132.235.204:http A / Raw"
192.168.0.106,116.132.235.204,13756,80,6,"Ether / IP / TCP 192.168.0.106:13756 > 116.132.235.204:http PA / Raw"
116.132.235.204,192.168.0.106,80,13756,6,"Ether / IP / TCP 116.132.235.204:http > 192.168.0.106:13756 A"
116.132.235.204,192.168.0.106,80,13756,6,"Ether / IP / TCP 116.132.235.204:http > 192.168.0.106:13756 A"
116.132.235.204,192.168.0.106,80,13756,6,"Ether / IP / TCP 116.132.235.204:http > 192.168.0.106:13756 A"
116.132.235.204,192.168.0.106,80,13756,6,"Ether / IP / TCP 116.132.235.204:http > 192.168.0.106:13756 PA / Raw"
116.132.235.204,192.168.0.106,80,13756,6,"Ether / IP / TCP 116.132.235.204:http > 192.168.0.106:13756 FA"
192.168.0.106,116.132.235.204,13756,80,6,"Ether / IP / TCP 192.168.0.106:13756 > 116.132.235.204:http A"
192.168.0.106,116.132.235.204,13756,80,6,"Ether / IP / TCP 192.168.0.106:13756 > 116.132.235.204:http FA"
116.132.235.204,192.168.0.106,80,13756,6,"Ether / IP / TCP 116.132.235.204:http > 192.168.0.106:13756 A"
192.168.0.106,54.144.16.154,3656,443,6,"Ether / IP / TCP 192.168.0.106:3656 > 54.144.16.154:https PA / Raw"
54.144.16.154,192.168.0.106,443,3656,6,"Ether / IP / TCP 54.144.16.154:https > 192.168.0.106:3656 A / Padding"
192.168.0.106,116.132.235.204,13755,80,6,"Ether / IP / TCP 192.168.0.106:13755 > 116.132.235.204:http FA"
192.168.0.106,116.132.235.204,13757,80,6,"Ether / IP / TCP 192.168.0.106:13757 > 116.132.235.204:http S"
116.132.235.204,192.168.0.106,80,13757,6,"Ether / IP / TCP 116.132.235.204:http > 192.168.0.106:13757 SA"
192.168.0.106,116.132.235.204,13757,80,6,"Ether / IP / TCP 192.168.0.106:13757 > 116.132.235.204:http A"
192.168.0.106,116.132.235.204,13757,80,6,"Ether / IP / TCP 192.168.0.106:13757 > 116.132.235.204:http PA / Raw"
192.168.0.106,116.132.235.204,13757,80,6,"Ether / IP / TCP 192.168.0.106:13757 > 116.132.235.204:http A / Raw"
192.168.0.106,116.132.235.204,13757,80,6,"Ether / IP / TCP 192.168.0.106:13757 > 116.132.235.204:http A / Raw"
192.168.0.106,116.132.235.204,13757,80,6,"Ether / IP / TCP 192.168.0.106:13757 > 116.132.235.204:http PA / Raw"
116.132.235.204,192.168.0.106,80,13757,6,"Ether / IP / TCP 116.132.235.204:http > 192.168.0.106:13757 A"
116.132.235.204,192.168.0.106,80,13757,6,"Ether / IP / TCP 116.132.235.204:http > 192.168.0.106:13757 A"
116.132.235.204,192.168.0.106,80,13757,6,"Ether / IP / TCP 116.132.235.204:http > 192.168.0.106:13757 A"
116.132.235.204,192.168.0.106,80,13757,6,"Ether / IP / TCP 116.132.235.204:http > 192.168.0.106:13757 PA / Raw"
116.132.235.204,192.168.0.106,80,13757,6,"Ether / IP / TCP 116.132.235.204:http > 192.168.0.106:13757 FA"
192.168.0.106,116.132.235.204,13757,80,6,"Ether / IP / TCP 192.168.0.106:13757 > 116.132.235.204:http A"
192.168.0.106,116.132.235.204,13757,80,6,"Ether / IP / TCP 192.168.0.106:13757 > 116.132.235.204:http FA"
116.132.235.204,192.168.0.106,80,13757,6,"Ether / IP / TCP 116.132.235.204:http > 192.168.0.106:13757 A"
192.168.0.106,116.132.235.204,13758,80,6,"Ether / IP / TCP 192.168.0.106:13758 > 116.132.235.204:http S"
116.132.235.204,192.168.0.106,80,13758,6,"Ether / IP / TCP 116.132.235.204:http > 192.168.0.106:13758 SA"
192.168.0.106,116.132.235.204,13758,80,6,"Ether / IP / TCP 192.168.0.106:13758 > 116.132.235.204:http A"
192.168.0.106,116.132.235.204,13758,80,6,"Ether / IP / TCP 192.168.0.106:13758 > 116.132.235.204:http PA / Raw"
192.168.0.106,116.132.235.204,13758,80,6,"Ether / IP / TCP 192.168.0.106:13758 > 116.132.235.204:http A / Raw"
192.168.0.106,116.132.235.204,13758,80,6,"Ether / IP / TCP 192.168.0.106:13758 > 116.132.235.204:http A / Raw"
192.168.0.106,116.132.235.204,13758,80,6,"Ether / IP / TCP 192.168.0.106:13758 > 116.132.235.204:http PA / Raw"
116.132.235.204,192.168.0.106,80,13758,6,"Ether / IP / TCP 116.132.235.204:http > 192.168.0.106:13758 A"
116.132.235.204,192.168.0.106,80,13758,6,"Ether / IP / TCP 116.132.235.204:http > 192.168.0.106:13758 A"
116.132.235.204,192.168.0.106,80,13758,6,"Ether / IP / TCP 116.132.235.204:http > 192.168.0.106:13758 A"
116.132.235.204,192.168.0.106,80,13758,6,"Ether / IP / TCP 116.132.235.204:http > 192.168.0.106:13758 PA / Raw"
116.132.235.204,192.168.0.106,80,13758,6,"Ether / IP / TCP 116.132.235.204:http > 192.168.0.106:13758 FA"
192.168.0.106,116.132.235.204,13758,80,6,"Ether / IP / TCP 192.168.0.106:13758 > 116.132.235.204:http A"
192.168.0.106,116.132.235.204,13758,80,6,"Ether / IP / TCP 192.168.0.106:13758 > 116.132.235.204:http FA"
116.132.235.204,192.168.0.106,80,13758,6,"Ether / IP / TCP 116.132.235.204:http > 192.168.0.106:13758 A"
192.168.0.106,116.132.235.204,13759,80,6,"Ether / IP / TCP 192.168.0.106:13759 > 116.132.235.204:http S"
116.132.235.204,192.168.0.106,80,13759,6,"Ether / IP / TCP 116.132.235.204:http > 192.168.0.106:13759 SA"
192.168.0.106,116.132.235.204,13759,80,6,"Ether / IP / TCP 192.168.0.106:13759 > 116.132.235.204:http A"
192.168.0.106,116.132.235.204,13759,80,6,"Ether / IP / TCP 192.168.0.106:13759 > 116.132.235.204:http PA / Raw"
192.168.0.106,116.132.235.204,13759,80,6,"Ether / IP / TCP 192.168.0.106:13759 > 116.132.235.204:http A / Raw"
192.168.0.106,116.132.235.204,13759,80,6,"Ether / IP / TCP 192.168.0.106:13759 > 116.132.235.204:http A / Raw"
192.168.0.106,116.132.235.204,13759,80,6,"Ether / IP / TCP 192.168.0.106:13759 > 116.132.235.204:http PA / Raw"
116.132.235.204,192.168.0.106,80,13759,6,"Ether / IP / TCP 116.132.235.204:http > 192.168.0.106:13759 A"
116.132.235.204,192.168.0.106,80,13759,6,"Ether / IP / TCP 116.132.235.204:http > 192.168.0.106:13759 A"
116.132.235.204,192.168.0.106,80,13759,6,"Ether / IP / TCP 116.132.235.204:http > 192.168.0.106:13759 A"
116.132.235.204,192.168.0.106,80,13759,6,"Ether / IP / TCP 116.132.235.204:http > 192.168.0.106:13759 PA / Raw"
116.132.235.204,192.168.0.106,80,13759,6,"Ether / IP / TCP 116.132.235.204:http > 192.168.0.106:13759 FA"
192.168.0.106,116.132.235.204,13759,80,6,"Ether / IP / TCP 192.168.0.106:13759 > 116.132.235.204:http A"
192.168.0.106,116.132.235.204,13759,80,6,"Ether / IP / TCP 192.168.0.106:13759 > 116.132.235.204:http FA"
116.132.235.204,192.168.0.106,80,13759,6,"Ether / IP / TCP 116.132.235.204:http > 192.168.0.106:13759 A"
110.242.68.89,192.168.0.106,443,8082,6,"Ether / IP / TCP 110.242.68.89:https > 192.168.0.106:8082 PA / Raw"
110.242.68.89,192.168.0.106,443,8082,6,"Ether / IP / TCP 110.242.68.89:https > 192.168.0.106:8082 FA"
192.168.0.106,110.242.68.89,8082,443,6,"Ether / IP / TCP 192.168.0.106:8082 > 110.242.68.89:https A"
110.242.68.89,192.168.0.106,443,8082,6,"Ether / IP / TCP 110.242.68.89:https > 192.168.0.106:8082 FA"
192.168.0.106,110.242.68.89,8082,443,6,"Ether / IP / TCP 192.168.0.106:8082 > 110.242.68.89:https A"
110.242.68.89,192.168.0.106,443,8082,6,"Ether / IP / TCP 110.242.68.89:https > 192.168.0.106:8082 R"
192.168.0.106,122.190.57.41,13592,443,6,"Ether / IP / TCP 192.168.0.106:13592 > 122.190.57.41:https A / Raw"
122.190.57.41,192.168.0.106,443,13592,6,"Ether / IP / TCP 122.190.57.41:https > 192.168.0.106:13592 A"
192.168.0.106,116.132.235.204,13755,80,6,"Ether / IP / TCP 192.168.0.106:13755 > 116.132.235.204:http FA"
192.168.0.106,116.132.235.204,13760,80,6,"Ether / IP / TCP 192.168.0.106:13760 > 116.132.235.204:http S"
116.132.235.204,192.168.0.106,80,13760,6,"Ether / IP / TCP 116.132.235.204:http > 192.168.0.106:13760 SA"
192.168.0.106,116.132.235.204,13760,80,6,"Ether / IP / TCP 192.168.0.106:13760 > 116.132.235.204:http A"
192.168.0.106,116.132.235.204,13760,80,6,"Ether / IP / TCP 192.168.0.106:13760 > 116.132.235.204:http PA / Raw"
192.168.0.106,116.132.235.204,13760,80,6,"Ether / IP / TCP 192.168.0.106:13760 > 116.132.235.204:http A / Raw"
192.168.0.106,116.132.235.204,13760,80,6,"Ether / IP / TCP 192.168.0.106:13760 > 116.132.235.204:http A / Raw"
192.168.0.106,116.132.235.204,13760,80,6,"Ether / IP / TCP 192.168.0.106:13760 > 116.132.235.204:http PA / Raw"
116.132.235.204,192.168.0.106,80,13760,6,"Ether / IP / TCP 116.132.235.204:http > 192.168.0.106:13760 A"
116.132.235.204,192.168.0.106,80,13760,6,"Ether / IP / TCP 116.132.235.204:http > 192.168.0.106:13760 A"
116.132.235.204,192.168.0.106,80,13760,6,"Ether / IP / TCP 116.132.235.204:http > 192.168.0.106:13760 A"
116.132.235.204,192.168.0.106,80,13760,6,"Ether / IP / TCP 116.132.235.204:http > 192.168.0.106:13760 PA / Raw"
116.132.235.204,192.168.0.106,80,13760,6,"Ether / IP / TCP 116.132.235.204:http > 192.168.0.106:13760 FA"
192.168.0.106,116.132.235.204,13760,80,6,"Ether / IP / TCP 192.168.0.106:13760 > 116.132.235.204:http A"
192.168.0.106,116.132.235.204,13760,80,6,"Ether / IP / TCP 192.168.0.106:13760 > 116.132.235.204:http FA"
116.132.235.204,192.168.0.106,80,13760,6,"Ether / IP / TCP 116.132.235.204:http > 192.168.0.106:13760 A"
192.168.0.106,116.132.235.204,13761,80,6,"Ether / IP / TCP 192.168.0.106:13761 > 116.132.235.204:http S"
116.132.235.204,192.168.0.106,80,13761,6,"Ether / IP / TCP 116.132.235.204:http > 192.168.0.106:13761 SA"
192.168.0.106,116.132.235.204,13761,80,6,"Ether / IP / TCP 192.168.0.106:13761 > 116.132.235.204:http A"
192.168.0.106,116.132.235.204,13761,80,6,"Ether / IP / TCP 192.168.0.106:13761 > 116.132.235.204:http PA / Raw"
192.168.0.106,116.132.235.204,13761,80,6,"Ether / IP / TCP 192.168.0.106:13761 > 116.132.235.204:http A / Raw"
192.168.0.106,116.132.235.204,13761,80,6,"Ether / IP / TCP 192.168.0.106:13761 > 116.132.235.204:http A / Raw"
192.168.0.106,116.132.235.204,13761,80,6,"Ether / IP / TCP 192.168.0.106:13761 > 116.132.235.204:http PA / Raw"
116.132.235.204,192.168.0.106,80,13761,6,"Ether / IP / TCP 116.132.235.204:http > 192.168.0.106:13761 A"
116.132.235.204,192.168.0.106,80,13761,6,"Ether / IP / TCP 116.132.235.204:http > 192.168.0.106:13761 A"
116.132.235.204,192.168.0.106,80,13761,6,"Ether / IP / TCP 116.132.235.204:http > 192.168.0.106:13761 PA / Raw"
116.132.235.204,192.168.0.106,80,13761,6,"Ether / IP / TCP 116.132.235.204:http > 192.168.0.106:13761 FA"
192.168.0.106,116.132.235.204,13761,80,6,"Ether / IP / TCP 192.168.0.106:13761 > 116.132.235.204:http A"
192.168.0.106,116.132.235.204,13761,80,6,"Ether / IP / TCP 192.168.0.106:13761 > 116.132.235.204:http FA"
116.132.235.204,192.168.0.106,80,13761,6,"Ether / IP / TCP 116.132.235.204:http > 192.168.0.106:13761 A"
192.168.0.106,116.132.235.204,13762,80,6,"Ether / IP / TCP 192.168.0.106:13762 > 116.132.235.204:http S"
116.132.235.204,192.168.0.106,80,13762,6,"Ether / IP / TCP 116.132.235.204:http > 192.168.0.106:13762 SA"
192.168.0.106,116.132.235.204,13762,80,6,"Ether / IP / TCP 192.168.0.106:13762 > 116.132.235.204:http A"
192.168.0.106,116.132.235.204,13762,80,6,"Ether / IP / TCP 192.168.0.106:13762 > 116.132.235.204:http PA / Raw"
192.168.0.106,116.132.235.204,13762,80,6,"Ether / IP / TCP 192.168.0.106:13762 > 116.132.235.204:http A / Raw"
192.168.0.106,116.132.235.204,13762,80,6,"Ether / IP / TCP 192.168.0.106:13762 > 116.132.235.204:http A / Raw"
192.168.0.106,116.132.235.204,13762,80,6,"Ether / IP / TCP 192.168.0.106:13762 > 116.132.235.204:http PA / Raw"
116.132.235.204,192.168.0.106,80,13762,6,"Ether / IP / TCP 116.132.235.204:http > 192.168.0.106:13762 A"
116.132.235.204,192.168.0.106,80,13762,6,"Ether / IP / TCP 116.132.235.204:http > 192.168.0.106:13762 A"
116.132.235.204,192.168.0.106,80,13762,6,"Ether / IP / TCP 116.132.235.204:http > 192.168.0.106:13762 A"
116.132.235.204,192.168.0.106,80,13762,6,"Ether / IP / TCP 116.132.235.204:http > 192.168.0.106:13762 PA / Raw"
116.132.235.204,192.168.0.106,80,13762,6,"Ether / IP / TCP 116.132.235.204:http > 192.168.0.106:13762 FA"
192.168.0.106,116.132.235.204,13762,80,6,"Ether / IP / TCP 192.168.0.106:13762 > 116.132.235.204:http A"
192.168.0.106,116.132.235.204,13762,80,6,"Ether / IP / TCP 192.168.0.106:13762 > 116.132.235.204:http FA"
116.132.235.204,192.168.0.106,80,13762,6,"Ether / IP / TCP 116.132.235.204:http > 192.168.0.106:13762 A"
192.168.0.106,110.242.68.3,13763,80,6,"Ether / IP / TCP 192.168.0.106:13763 > 110.242.68.3:http S"
110.242.68.3,192.168.0.106,80,13763,6,"Ether / IP / TCP 110.242.68.3:http > 192.168.0.106:13763 SA"
192.168.0.106,110.242.68.3,13763,80,6,"Ether / IP / TCP 192.168.0.106:13763 > 110.242.68.3:http A"
192.168.0.106,110.242.68.3,13763,80,6,"Ether / IP / TCP 192.168.0.106:13763 > 110.242.68.3:http FA"
110.242.68.3,192.168.0.106,80,13763,6,"Ether / IP / TCP 110.242.68.3:http > 192.168.0.106:13763 A"
110.242.68.3,192.168.0.106,80,13763,6,"Ether / IP / TCP 110.242.68.3:http > 192.168.0.106:13763 FA"
192.168.0.106,110.242.68.3,13763,80,6,"Ether / IP / TCP 192.168.0.106:13763 > 110.242.68.3:http A"
192.168.0.106,116.132.235.204,13764,80,6,"Ether / IP / TCP 192.168.0.106:13764 > 116.132.235.204:http S"
116.132.235.204,192.168.0.106,80,13764,6,"Ether / IP / TCP 116.132.235.204:http > 192.168.0.106:13764 SA"
192.168.0.106,116.132.235.204,13764,80,6,"Ether / IP / TCP 192.168.0.106:13764 > 116.132.235.204:http A"
192.168.0.106,116.132.235.204,13764,80,6,"Ether / IP / TCP 192.168.0.106:13764 > 116.132.235.204:http PA / Raw"
192.168.0.106,116.132.235.204,13764,80,6,"Ether / IP / TCP 192.168.0.106:13764 > 116.132.235.204:http A / Raw"
192.168.0.106,116.132.235.204,13764,80,6,"Ether / IP / TCP 192.168.0.106:13764 > 116.132.235.204:http A / Raw"
192.168.0.106,116.132.235.204,13764,80,6,"Ether / IP / TCP 192.168.0.106:13764 > 116.132.235.204:http PA / Raw"
116.132.235.204,192.168.0.106,80,13764,6,"Ether / IP / TCP 116.132.235.204:http > 192.168.0.106:13764 A"
116.132.235.204,192.168.0.106,80,13764,6,"Ether / IP / TCP 116.132.235.204:http > 192.168.0.106:13764 A"
116.132.235.204,192.168.0.106,80,13764,6,"Ether / IP / TCP 116.132.235.204:http > 192.168.0.106:13764 A"
116.132.235.204,192.168.0.106,80,13764,6,"Ether / IP / TCP 116.132.235.204:http > 192.168.0.106:13764 PA / Raw"
116.132.235.204,192.168.0.106,80,13764,6,"Ether / IP / TCP 116.132.235.204:http > 192.168.0.106:13764 FA"
192.168.0.106,116.132.235.204,13764,80,6,"Ether / IP / TCP 192.168.0.106:13764 > 116.132.235.204:http A"
192.168.0.106,116.132.235.204,13764,80,6,"Ether / IP / TCP 192.168.0.106:13764 > 116.132.235.204:http FA"
192.168.0.106,119.28.20.150,13623,443,6,"Ether / IP / TCP 192.168.0.106:13623 > 119.28.20.150:https A / Raw"
119.28.20.150,192.168.0.106,443,13623,6,"Ether / IP / TCP 119.28.20.150:https > 192.168.0.106:13623 A"
192.168.0.106,116.132.235.204,13764,80,6,"Ether / IP / TCP 192.168.0.106:13764 > 116.132.235.204:http FA"
192.168.0.106,116.132.235.204,13764,80,6,"Ether / IP / TCP 192.168.0.106:13764 > 116.132.235.204:http FA"
192.168.0.106,116.132.235.204,13765,80,6,"Ether / IP / TCP 192.168.0.106:13765 > 116.132.235.204:http S"
116.132.235.204,192.168.0.106,80,13765,6,"Ether / IP / TCP 116.132.235.204:http > 192.168.0.106:13765 SA"
192.168.0.106,116.132.235.204,13765,80,6,"Ether / IP / TCP 192.168.0.106:13765 > 116.132.235.204:http A"
192.168.0.106,116.132.235.204,13765,80,6,"Ether / IP / TCP 192.168.0.106:13765 > 116.132.235.204:http PA / Raw"
192.168.0.106,116.132.235.204,13765,80,6,"Ether / IP / TCP 192.168.0.106:13765 > 116.132.235.204:http A / Raw"
192.168.0.106,116.132.235.204,13765,80,6,"Ether / IP / TCP 192.168.0.106:13765 > 116.132.235.204:http A / Raw"
192.168.0.106,116.132.235.204,13765,80,6,"Ether / IP / TCP 192.168.0.106:13765 > 116.132.235.204:http PA / Raw"
116.132.235.204,192.168.0.106,80,13765,6,"Ether / IP / TCP 116.132.235.204:http > 192.168.0.106:13765 A"
116.132.235.204,192.168.0.106,80,13765,6,"Ether / IP / TCP 116.132.235.204:http > 192.168.0.106:13765 A"
116.132.235.204,192.168.0.106,80,13765,6,"Ether / IP / TCP 116.132.235.204:http > 192.168.0.106:13765 A"
116.132.235.204,192.168.0.106,80,13765,6,"Ether / IP / TCP 116.132.235.204:http > 192.168.0.106:13765 PA / Raw"
116.132.235.204,192.168.0.106,80,13765,6,"Ether / IP / TCP 116.132.235.204:http > 192.168.0.106:13765 FA"
192.168.0.106,116.132.235.204,13765,80,6,"Ether / IP / TCP 192.168.0.106:13765 > 116.132.235.204:http A"
192.168.0.106,116.132.235.204,13765,80,6,"Ether / IP / TCP 192.168.0.106:13765 > 116.132.235.204:http FA"
192.168.0.106,116.132.235.204,13766,80,6,"Ether / IP / TCP 192.168.0.106:13766 > 116.132.235.204:http S"
116.132.235.204,192.168.0.106,80,13765,6,"Ether / IP / TCP 116.132.235.204:http > 192.168.0.106:13765 A"
116.132.235.204,192.168.0.106,80,13766,6,"Ether / IP / TCP 116.132.235.204:http > 192.168.0.106:13766 SA"
192.168.0.106,116.132.235.204,13766,80,6,"Ether / IP / TCP 192.168.0.106:13766 > 116.132.235.204:http A"
192.168.0.106,116.132.235.204,13766,80,6,"Ether / IP / TCP 192.168.0.106:13766 > 116.132.235.204:http PA / Raw"
192.168.0.106,116.132.235.204,13766,80,6,"Ether / IP / TCP 192.168.0.106:13766 > 116.132.235.204:http A / Raw"
192.168.0.106,116.132.235.204,13766,80,6,"Ether / IP / TCP 192.168.0.106:13766 > 116.132.235.204:http A / Raw"
192.168.0.106,116.132.235.204,13766,80,6,"Ether / IP / TCP 192.168.0.106:13766 > 116.132.235.204:http PA / Raw"
116.132.235.204,192.168.0.106,80,13766,6,"Ether / IP / TCP 116.132.235.204:http > 192.168.0.106:13766 A"
116.132.235.204,192.168.0.106,80,13766,6,"Ether / IP / TCP 116.132.235.204:http > 192.168.0.106:13766 A"
116.132.235.204,192.168.0.106,80,13766,6,"Ether / IP / TCP 116.132.235.204:http > 192.168.0.106:13766 A"
116.132.235.204,192.168.0.106,80,13766,6,"Ether / IP / TCP 116.132.235.204:http > 192.168.0.106:13766 PA / Raw"
116.132.235.204,192.168.0.106,80,13766,6,"Ether / IP / TCP 116.132.235.204:http > 192.168.0.106:13766 FA"
192.168.0.106,116.132.235.204,13766,80,6,"Ether / IP / TCP 192.168.0.106:13766 > 116.132.235.204:http A"
192.168.0.106,116.132.235.204,13766,80,6,"Ether / IP / TCP 192.168.0.106:13766 > 116.132.235.204:http FA"
116.132.235.204,192.168.0.106,80,13766,6,"Ether / IP / TCP 116.132.235.204:http > 192.168.0.106:13766 A"
192.168.0.106,20.189.173.9,8099,443,6,"Ether / IP / TCP 192.168.0.106:8099 > 20.189.173.9:https PA / Raw"
192.168.0.106,20.189.173.9,8099,443,6,"Ether / IP / TCP 192.168.0.106:8099 > 20.189.173.9:https PA / Raw"
20.189.173.9,192.168.0.106,443,8099,6,"Ether / IP / TCP 20.189.173.9:https > 192.168.0.106:8099 A / Padding"
20.189.173.9,192.168.0.106,443,8099,6,"Ether / IP / TCP 20.189.173.9:https > 192.168.0.106:8099 PA / Raw"
192.168.0.106,20.189.173.9,8099,443,6,"Ether / IP / TCP 192.168.0.106:8099 > 20.189.173.9:https A"
192.168.0.106,116.132.235.204,13764,80,6,"Ether / IP / TCP 192.168.0.106:13764 > 116.132.235.204:http FA"
192.168.0.106,116.132.235.204,13767,80,6,"Ether / IP / TCP 192.168.0.106:13767 > 116.132.235.204:http S"
116.132.235.204,192.168.0.106,80,13767,6,"Ether / IP / TCP 116.132.235.204:http > 192.168.0.106:13767 SA"
192.168.0.106,116.132.235.204,13767,80,6,"Ether / IP / TCP 192.168.0.106:13767 > 116.132.235.204:http A"
192.168.0.106,116.132.235.204,13767,80,6,"Ether / IP / TCP 192.168.0.106:13767 > 116.132.235.204:http PA / Raw"
192.168.0.106,116.132.235.204,13767,80,6,"Ether / IP / TCP 192.168.0.106:13767 > 116.132.235.204:http A / Raw"
192.168.0.106,116.132.235.204,13767,80,6,"Ether / IP / TCP 192.168.0.106:13767 > 116.132.235.204:http A / Raw"
192.168.0.106,116.132.235.204,13767,80,6,"Ether / IP / TCP 192.168.0.106:13767 > 116.132.235.204:http PA / Raw"
192.168.0.106,116.132.235.204,13755,80,6,"Ether / IP / TCP 192.168.0.106:13755 > 116.132.235.204:http FA"
116.132.235.204,192.168.0.106,80,13767,6,"Ether / IP / TCP 116.132.235.204:http > 192.168.0.106:13767 A"
116.132.235.204,192.168.0.106,80,13767,6,"Ether / IP / TCP 116.132.235.204:http > 192.168.0.106:13767 A"
116.132.235.204,192.168.0.106,80,13767,6,"Ether / IP / TCP 116.132.235.204:http > 192.168.0.106:13767 A"
116.132.235.204,192.168.0.106,80,13767,6,"Ether / IP / TCP 116.132.235.204:http > 192.168.0.106:13767 PA / Raw"
116.132.235.204,192.168.0.106,80,13767,6,"Ether / IP / TCP 116.132.235.204:http > 192.168.0.106:13767 FA"
192.168.0.106,116.132.235.204,13767,80,6,"Ether / IP / TCP 192.168.0.106:13767 > 116.132.235.204:http A"
192.168.0.106,116.132.235.204,13767,80,6,"Ether / IP / TCP 192.168.0.106:13767 > 116.132.235.204:http FA"
116.132.235.204,192.168.0.106,80,13767,6,"Ether / IP / TCP 116.132.235.204:http > 192.168.0.106:13767 A"
192.168.0.106,20.189.173.9,8099,443,6,"Ether / IP / TCP 192.168.0.106:8099 > 20.189.173.9:https PA / Raw"
192.168.0.106,20.189.173.9,8099,443,6,"Ether / IP / TCP 192.168.0.106:8099 > 20.189.173.9:https PA / Raw"
20.189.173.9,192.168.0.106,443,8099,6,"Ether / IP / TCP 20.189.173.9:https > 192.168.0.106:8099 A / Padding"
20.189.173.9,192.168.0.106,443,8099,6,"Ether / IP / TCP 20.189.173.9:https > 192.168.0.106:8099 PA / Raw"
192.168.0.106,20.189.173.9,8099,443,6,"Ether / IP / TCP 192.168.0.106:8099 > 20.189.173.9:https A"
20.189.173.9,192.168.0.106,443,8099,6,"Ether / IP / TCP 20.189.173.9:https > 192.168.0.106:8099 PA / Raw"
192.168.0.106,20.189.173.9,8099,443,6,"Ether / IP / TCP 192.168.0.106:8099 > 20.189.173.9:https A"
192.168.0.106,192.168.0.1,56325,53,17,"Ether / IP / UDP / DNS Qry ""b'cdn.staticfile.org.'"" "
192.168.0.106,192.168.0.1,60938,53,17,"Ether / IP / UDP / DNS Qry ""b'static.runoob.com.'"" "
192.168.0.106,192.168.0.1,59876,53,17,"Ether / IP / UDP / DNS Qry ""b'www.runoob.com.'"" "
192.168.0.1,192.168.0.106,53,60938,17,"Ether / IP / UDP / DNS Ans ""b'static.runoob.com.qiniudns.com.'"" "
192.168.0.106,122.190.57.41,13592,443,6,"Ether / IP / TCP 192.168.0.106:13592 > 122.190.57.41:https FA"
192.168.0.106,111.206.209.249,13634,443,6,"Ether / IP / TCP 192.168.0.106:13634 > 111.206.209.249:https FA"
192.168.0.106,111.206.209.249,13634,443,6,"Ether / IP / TCP 192.168.0.106:13634 > 111.206.209.249:https RA"
192.168.0.106,218.12.116.243,13768,443,6,"Ether / IP / TCP 192.168.0.106:13768 > 218.12.116.243:https S"
192.168.0.1,192.168.0.106,53,56325,17,"Ether / IP / UDP / DNS Ans ""b'iduwdjf.qiniudns.com.'"" "
192.168.0.1,192.168.0.106,53,59876,17,"Ether / IP / UDP / DNS Ans ""b'www.runoob.com.qiniudns.com.'"" "
192.168.0.106,122.190.57.41,13769,443,6,"Ether / IP / TCP 192.168.0.106:13769 > 122.190.57.41:https S"
122.190.57.41,192.168.0.106,443,13592,6,"Ether / IP / TCP 122.190.57.41:https > 192.168.0.106:13592 A"
122.190.57.41,192.168.0.106,443,13592,6,"Ether / IP / TCP 122.190.57.41:https > 192.168.0.106:13592 FA"
192.168.0.106,122.190.57.41,13592,443,6,"Ether / IP / TCP 192.168.0.106:13592 > 122.190.57.41:https A"
122.190.57.41,192.168.0.106,443,13769,6,"Ether / IP / TCP 122.190.57.41:https > 192.168.0.106:13769 SA"
192.168.0.106,122.190.57.41,13769,443,6,"Ether / IP / TCP 192.168.0.106:13769 > 122.190.57.41:https A"
192.168.0.106,122.190.57.41,13769,443,6,"Ether / IP / TCP 192.168.0.106:13769 > 122.190.57.41:https PA / Raw"
218.12.116.243,192.168.0.106,443,13768,6,"Ether / IP / TCP 218.12.116.243:https > 192.168.0.106:13768 SA"
192.168.0.106,218.12.116.243,13768,443,6,"Ether / IP / TCP 192.168.0.106:13768 > 218.12.116.243:https A"
192.168.0.106,218.12.116.243,13768,443,6,"Ether / IP / TCP 192.168.0.106:13768 > 218.12.116.243:https PA / Raw"
122.190.57.41,192.168.0.106,443,13769,6,"Ether / IP / TCP 122.190.57.41:https > 192.168.0.106:13769 A"
122.190.57.41,192.168.0.106,443,13769,6,"Ether / IP / TCP 122.190.57.41:https > 192.168.0.106:13769 PA / Raw"
192.168.0.106,122.190.57.41,13769,443,6,"Ether / IP / TCP 192.168.0.106:13769 > 122.190.57.41:https PA / Raw"
218.12.116.243,192.168.0.106,443,13768,6,"Ether / IP / TCP 218.12.116.243:https > 192.168.0.106:13768 A"
218.12.116.243,192.168.0.106,443,13768,6,"Ether / IP / TCP 218.12.116.243:https > 192.168.0.106:13768 PA / Raw"
192.168.0.106,218.12.116.243,13768,443,6,"Ether / IP / TCP 192.168.0.106:13768 > 218.12.116.243:https PA / Raw"
122.190.57.41,192.168.0.106,443,13769,6,"Ether / IP / TCP 122.190.57.41:https > 192.168.0.106:13769 A"
122.190.57.41,192.168.0.106,443,13769,6,"Ether / IP / TCP 122.190.57.41:https > 192.168.0.106:13769 PA / Raw"
192.168.0.106,122.190.57.41,13769,443,6,"Ether / IP / TCP 192.168.0.106:13769 > 122.190.57.41:https A"
218.12.116.243,192.168.0.106,443,13768,6,"Ether / IP / TCP 218.12.116.243:https > 192.168.0.106:13768 A"
122.190.57.41,192.168.0.106,443,13769,6,"Ether / IP / TCP 122.190.57.41:https > 192.168.0.106:13769 PA / Raw"
192.168.0.106,122.190.57.41,13769,443,6,"Ether / IP / TCP 192.168.0.106:13769 > 122.190.57.41:https A"
192.168.0.106,116.132.235.204,13770,80,6,"Ether / IP / TCP 192.168.0.106:13770 > 116.132.235.204:http S"
116.132.235.204,192.168.0.106,80,13770,6,"Ether / IP / TCP 116.132.235.204:http > 192.168.0.106:13770 SA"
192.168.0.106,116.132.235.204,13770,80,6,"Ether / IP / TCP 192.168.0.106:13770 > 116.132.235.204:http A"
192.168.0.106,116.132.235.204,13770,80,6,"Ether / IP / TCP 192.168.0.106:13770 > 116.132.235.204:http PA / Raw"
192.168.0.106,116.132.235.204,13770,80,6,"Ether / IP / TCP 192.168.0.106:13770 > 116.132.235.204:http A / Raw"
192.168.0.106,116.132.235.204,13770,80,6,"Ether / IP / TCP 192.168.0.106:13770 > 116.132.235.204:http A / Raw"
192.168.0.106,116.132.235.204,13770,80,6,"Ether / IP / TCP 192.168.0.106:13770 > 116.132.235.204:http PA / Raw"
116.132.235.204,192.168.0.106,80,13770,6,"Ether / IP / TCP 116.132.235.204:http > 192.168.0.106:13770 A"
116.132.235.204,192.168.0.106,80,13770,6,"Ether / IP / TCP 116.132.235.204:http > 192.168.0.106:13770 A"
116.132.235.204,192.168.0.106,80,13770,6,"Ether / IP / TCP 116.132.235.204:http > 192.168.0.106:13770 PA / Raw"
116.132.235.204,192.168.0.106,80,13770,6,"Ether / IP / TCP 116.132.235.204:http > 192.168.0.106:13770 FA"
192.168.0.106,116.132.235.204,13770,80,6,"Ether / IP / TCP 192.168.0.106:13770 > 116.132.235.204:http A"
192.168.0.106,116.132.235.204,13770,80,6,"Ether / IP / TCP 192.168.0.106:13770 > 116.132.235.204:http FA"
192.168.0.106,116.132.235.204,13771,80,6,"Ether / IP / TCP 192.168.0.106:13771 > 116.132.235.204:http S"
116.132.235.204,192.168.0.106,80,13771,6,"Ether / IP / TCP 116.132.235.204:http > 192.168.0.106:13771 SA"
192.168.0.106,116.132.235.204,13771,80,6,"Ether / IP / TCP 192.168.0.106:13771 > 116.132.235.204:http A"
192.168.0.106,116.132.235.204,13771,80,6,"Ether / IP / TCP 192.168.0.106:13771 > 116.132.235.204:http PA / Raw"
192.168.0.106,116.132.235.204,13771,80,6,"Ether / IP / TCP 192.168.0.106:13771 > 116.132.235.204:http A / Raw"
192.168.0.106,116.132.235.204,13771,80,6,"Ether / IP / TCP 192.168.0.106:13771 > 116.132.235.204:http A / Raw"
192.168.0.106,116.132.235.204,13771,80,6,"Ether / IP / TCP 192.168.0.106:13771 > 116.132.235.204:http PA / Raw"
116.132.235.204,192.168.0.106,80,13771,6,"Ether / IP / TCP 116.132.235.204:http > 192.168.0.106:13771 A"
116.132.235.204,192.168.0.106,80,13771,6,"Ether / IP / TCP 116.132.235.204:http > 192.168.0.106:13771 A"
116.132.235.204,192.168.0.106,80,13771,6,"Ether / IP / TCP 116.132.235.204:http > 192.168.0.106:13771 A"
116.132.235.204,192.168.0.106,80,13771,6,"Ether / IP / TCP 116.132.235.204:http > 192.168.0.106:13771 PA / Raw"
116.132.235.204,192.168.0.106,80,13771,6,"Ether / IP / TCP 116.132.235.204:http > 192.168.0.106:13771 FA"
192.168.0.106,116.132.235.204,13771,80,6,"Ether / IP / TCP 192.168.0.106:13771 > 116.132.235.204:http A"
192.168.0.106,116.132.235.204,13771,80,6,"Ether / IP / TCP 192.168.0.106:13771 > 116.132.235.204:http FA"
192.168.0.106,116.132.235.204,13770,80,6,"Ether / IP / TCP 192.168.0.106:13770 > 116.132.235.204:http FA"
192.168.0.106,20.189.173.9,8099,443,6,"Ether / IP / TCP 192.168.0.106:8099 > 20.189.173.9:https PA / Raw"
192.168.0.106,20.189.173.9,8099,443,6,"Ether / IP / TCP 192.168.0.106:8099 > 20.189.173.9:https PA / Raw"
192.168.0.106,116.132.235.204,13771,80,6,"Ether / IP / TCP 192.168.0.106:13771 > 116.132.235.204:http FA"
20.189.173.9,192.168.0.106,443,8099,6,"Ether / IP / TCP 20.189.173.9:https > 192.168.0.106:8099 A"
20.189.173.9,192.168.0.106,443,8099,6,"Ether / IP / TCP 20.189.173.9:https > 192.168.0.106:8099 A / Padding"
20.189.173.9,192.168.0.106,443,8099,6,"Ether / IP / TCP 20.189.173.9:https > 192.168.0.106:8099 PA / Raw"
192.168.0.106,20.189.173.9,8099,443,6,"Ether / IP / TCP 192.168.0.106:8099 > 20.189.173.9:https A"
192.168.0.106,116.132.235.204,13770,80,6,"Ether / IP / TCP 192.168.0.106:13770 > 116.132.235.204:http FA"
192.168.0.106,116.132.235.204,13764,80,6,"Ether / IP / TCP 192.168.0.106:13764 > 116.132.235.204:http FA"
192.168.0.106,116.132.235.204,13771,80,6,"Ether / IP / TCP 192.168.0.106:13771 > 116.132.235.204:http FA"
192.168.0.106,116.132.235.204,13772,80,6,"Ether / IP / TCP 192.168.0.106:13772 > 116.132.235.204:http S"
116.132.235.204,192.168.0.106,80,13772,6,"Ether / IP / TCP 116.132.235.204:http > 192.168.0.106:13772 SA"
192.168.0.106,116.132.235.204,13772,80,6,"Ether / IP / TCP 192.168.0.106:13772 > 116.132.235.204:http A"
192.168.0.106,116.132.235.204,13772,80,6,"Ether / IP / TCP 192.168.0.106:13772 > 116.132.235.204:http PA / Raw"
192.168.0.106,116.132.235.204,13772,80,6,"Ether / IP / TCP 192.168.0.106:13772 > 116.132.235.204:http A / Raw"
192.168.0.106,116.132.235.204,13772,80,6,"Ether / IP / TCP 192.168.0.106:13772 > 116.132.235.204:http A / Raw"
192.168.0.106,116.132.235.204,13772,80,6,"Ether / IP / TCP 192.168.0.106:13772 > 116.132.235.204:http PA / Raw"
116.132.235.204,192.168.0.106,80,13772,6,"Ether / IP / TCP 116.132.235.204:http > 192.168.0.106:13772 A"
116.132.235.204,192.168.0.106,80,13772,6,"Ether / IP / TCP 116.132.235.204:http > 192.168.0.106:13772 A"
116.132.235.204,192.168.0.106,80,13772,6,"Ether / IP / TCP 116.132.235.204:http > 192.168.0.106:13772 A"
116.132.235.204,192.168.0.106,80,13772,6,"Ether / IP / TCP 116.132.235.204:http > 192.168.0.106:13772 PA / Raw"
116.132.235.204,192.168.0.106,80,13772,6,"Ether / IP / TCP 116.132.235.204:http > 192.168.0.106:13772 FA"
192.168.0.106,116.132.235.204,13772,80,6,"Ether / IP / TCP 192.168.0.106:13772 > 116.132.235.204:http A"
192.168.0.106,116.132.235.204,13772,80,6,"Ether / IP / TCP 192.168.0.106:13772 > 116.132.235.204:http FA"
116.132.235.204,192.168.0.106,80,13772,6,"Ether / IP / TCP 116.132.235.204:http > 192.168.0.106:13772 A"
218.12.116.243,192.168.0.106,443,13768,6,"Ether / IP / TCP 218.12.116.243:https > 192.168.0.106:13768 A"
192.168.0.106,218.12.116.243,13768,443,6,"Ether / IP / TCP 192.168.0.106:13768 > 218.12.116.243:https A"
192.168.0.106,20.42.73.27,13635,443,6,"Ether / IP / TCP 192.168.0.106:13635 > 20.42.73.27:https A / Raw"
192.168.0.106,116.132.235.204,13770,80,6,"Ether / IP / TCP 192.168.0.106:13770 > 116.132.235.204:http FA"
192.168.0.106,116.132.235.204,13771,80,6,"Ether / IP / TCP 192.168.0.106:13771 > 116.132.235.204:http FA"
20.42.73.27,192.168.0.106,443,13635,6,"Ether / IP / TCP 20.42.73.27:https > 192.168.0.106:13635 A"
218.12.116.243,192.168.0.106,443,13768,6,"Ether / IP / TCP 218.12.116.243:https > 192.168.0.106:13768 A"
192.168.0.106,218.12.116.243,13768,443,6,"Ether / IP / TCP 192.168.0.106:13768 > 218.12.116.243:https A"
192.168.0.106,203.208.50.33,13639,443,6,"Ether / IP / TCP 192.168.0.106:13639 > 203.208.50.33:https A / Raw"
192.168.0.106,101.72.199.41,13590,443,6,"Ether / IP / TCP 192.168.0.106:13590 > 101.72.199.41:https A / Raw"
203.208.50.33,192.168.0.106,443,13639,6,"Ether / IP / TCP 203.208.50.33:https > 192.168.0.106:13639 A"
101.72.199.41,192.168.0.106,443,13590,6,"Ether / IP / TCP 101.72.199.41:https > 192.168.0.106:13590 A"
192.168.0.106,203.208.50.38,13640,443,6,"Ether / IP / TCP 192.168.0.106:13640 > 203.208.50.38:https A / Raw"
203.208.50.38,192.168.0.106,443,13640,6,"Ether / IP / TCP 203.208.50.38:https > 192.168.0.106:13640 A"
192.168.0.106,116.132.235.204,13770,80,6,"Ether / IP / TCP 192.168.0.106:13770 > 116.132.235.204:http FA"
192.168.0.106,116.132.235.204,13771,80,6,"Ether / IP / TCP 192.168.0.106:13771 > 116.132.235.204:http FA"
192.168.0.106,202.89.233.101,13637,443,6,"Ether / IP / TCP 192.168.0.106:13637 > 202.89.233.101:https A / Raw"
202.89.233.101,192.168.0.106,443,13637,6,"Ether / IP / TCP 202.89.233.101:https > 192.168.0.106:13637 A"
192.168.0.106,116.132.235.204,13764,80,6,"Ether / IP / TCP 192.168.0.106:13764 > 116.132.235.204:http FA"
218.12.116.243,192.168.0.106,443,13768,6,"Ether / IP / TCP 218.12.116.243:https > 192.168.0.106:13768 A"
192.168.0.106,218.12.116.243,13768,443,6,"Ether / IP / TCP 192.168.0.106:13768 > 218.12.116.243:https A"
192.168.0.106,110.242.68.3,13773,80,6,"Ether / IP / TCP 192.168.0.106:13773 > 110.242.68.3:http S"
110.242.68.3,192.168.0.106,80,13773,6,"Ether / IP / TCP 110.242.68.3:http > 192.168.0.106:13773 SA"
192.168.0.106,110.242.68.3,13773,80,6,"Ether / IP / TCP 192.168.0.106:13773 > 110.242.68.3:http A"
192.168.0.106,110.242.68.3,13773,80,6,"Ether / IP / TCP 192.168.0.106:13773 > 110.242.68.3:http FA"
110.242.68.3,192.168.0.106,80,13773,6,"Ether / IP / TCP 110.242.68.3:http > 192.168.0.106:13773 A"
110.242.68.3,192.168.0.106,80,13773,6,"Ether / IP / TCP 110.242.68.3:http > 192.168.0.106:13773 FA"
192.168.0.106,110.242.68.3,13773,80,6,"Ether / IP / TCP 192.168.0.106:13773 > 110.242.68.3:http A"
192.168.0.106,101.72.199.41,13590,443,6,"Ether / IP / TCP 192.168.0.106:13590 > 101.72.199.41:https PA / Raw"
192.168.0.106,101.72.199.41,13590,443,6,"Ether / IP / TCP 192.168.0.106:13590 > 101.72.199.41:https PA / Raw"
101.72.199.41,192.168.0.106,443,13590,6,"Ether / IP / TCP 101.72.199.41:https > 192.168.0.106:13590 A / Padding"
101.72.199.41,192.168.0.106,443,13590,6,"Ether / IP / TCP 101.72.199.41:https > 192.168.0.106:13590 A / Padding"
101.72.199.41,192.168.0.106,443,13590,6,"Ether / IP / TCP 101.72.199.41:https > 192.168.0.106:13590 PA / Raw"
101.72.199.41,192.168.0.106,443,13590,6,"Ether / IP / TCP 101.72.199.41:https > 192.168.0.106:13590 A / Raw"
101.72.199.41,192.168.0.106,443,13590,6,"Ether / IP / TCP 101.72.199.41:https > 192.168.0.106:13590 A / Raw"
101.72.199.41,192.168.0.106,443,13590,6,"Ether / IP / TCP 101.72.199.41:https > 192.168.0.106:13590 A / Raw"
101.72.199.41,192.168.0.106,443,13590,6,"Ether / IP / TCP 101.72.199.41:https > 192.168.0.106:13590 A / Raw"
192.168.0.106,101.72.199.41,13590,443,6,"Ether / IP / TCP 192.168.0.106:13590 > 101.72.199.41:https A"
101.72.199.41,192.168.0.106,443,13590,6,"Ether / IP / TCP 101.72.199.41:https > 192.168.0.106:13590 A / Raw"
101.72.199.41,192.168.0.106,443,13590,6,"Ether / IP / TCP 101.72.199.41:https > 192.168.0.106:13590 A / Raw"
192.168.0.106,101.72.199.41,13590,443,6,"Ether / IP / TCP 192.168.0.106:13590 > 101.72.199.41:https A"
101.72.199.41,192.168.0.106,443,13590,6,"Ether / IP / TCP 101.72.199.41:https > 192.168.0.106:13590 A / Raw"
101.72.199.41,192.168.0.106,443,13590,6,"Ether / IP / TCP 101.72.199.41:https > 192.168.0.106:13590 A / Raw"
192.168.0.106,101.72.199.41,13590,443,6,"Ether / IP / TCP 192.168.0.106:13590 > 101.72.199.41:https A"
101.72.199.41,192.168.0.106,443,13590,6,"Ether / IP / TCP 101.72.199.41:https > 192.168.0.106:13590 A / Raw"
101.72.199.41,192.168.0.106,443,13590,6,"Ether / IP / TCP 101.72.199.41:https > 192.168.0.106:13590 A / Raw"
192.168.0.106,101.72.199.41,13590,443,6,"Ether / IP / TCP 192.168.0.106:13590 > 101.72.199.41:https A"
101.72.199.41,192.168.0.106,443,13590,6,"Ether / IP / TCP 101.72.199.41:https > 192.168.0.106:13590 PA / Raw"
192.168.0.106,101.72.199.41,13590,443,6,"Ether / IP / TCP 192.168.0.106:13590 > 101.72.199.41:https A"
192.168.0.106,101.72.199.41,13590,443,6,"Ether / IP / TCP 192.168.0.106:13590 > 101.72.199.41:https PA / Raw"
192.168.0.106,111.206.209.249,13774,443,6,"Ether / IP / TCP 192.168.0.106:13774 > 111.206.209.249:https S"
101.72.199.41,192.168.0.106,443,13590,6,"Ether / IP / TCP 101.72.199.41:https > 192.168.0.106:13590 A / Padding"
111.206.209.249,192.168.0.106,443,13774,6,"Ether / IP / TCP 111.206.209.249:https > 192.168.0.106:13774 SA"
192.168.0.106,111.206.209.249,13774,443,6,"Ether / IP / TCP 192.168.0.106:13774 > 111.206.209.249:https A"
192.168.0.106,111.206.209.249,13774,443,6,"Ether / IP / TCP 192.168.0.106:13774 > 111.206.209.249:https PA / Raw"
111.206.209.249,192.168.0.106,443,13774,6,"Ether / IP / TCP 111.206.209.249:https > 192.168.0.106:13774 A"
111.206.209.249,192.168.0.106,443,13774,6,"Ether / IP / TCP 111.206.209.249:https > 192.168.0.106:13774 PA / Raw"
192.168.0.106,111.206.209.249,13774,443,6,"Ether / IP / TCP 192.168.0.106:13774 > 111.206.209.249:https PA / Raw"
192.168.0.106,111.206.209.249,13774,443,6,"Ether / IP / TCP 192.168.0.106:13774 > 111.206.209.249:https PA / Raw"
111.206.209.249,192.168.0.106,443,13774,6,"Ether / IP / TCP 111.206.209.249:https > 192.168.0.106:13774 A"
111.206.209.249,192.168.0.106,443,13774,6,"Ether / IP / TCP 111.206.209.249:https > 192.168.0.106:13774 A"
111.206.209.249,192.168.0.106,443,13774,6,"Ether / IP / TCP 111.206.209.249:https > 192.168.0.106:13774 PA / Raw"
192.168.0.106,111.206.209.249,13774,443,6,"Ether / IP / TCP 192.168.0.106:13774 > 111.206.209.249:https A"
192.168.0.106,111.206.209.249,13774,443,6,"Ether / IP / TCP 192.168.0.106:13774 > 111.206.209.249:https PA / Raw"
192.168.0.106,101.72.199.41,13590,443,6,"Ether / IP / TCP 192.168.0.106:13590 > 101.72.199.41:https PA / Raw"
192.168.0.106,203.208.50.33,49664,443,17,"Ether / IP / UDP 192.168.0.106:49664 > 203.208.50.33:https / Raw"
192.168.0.106,203.208.50.33,13639,443,6,"Ether / IP / TCP 192.168.0.106:13639 > 203.208.50.33:https PA / Raw"
192.168.0.106,203.208.50.33,13639,443,6,"Ether / IP / TCP 192.168.0.106:13639 > 203.208.50.33:https PA / Raw"
111.206.209.249,192.168.0.106,443,13774,6,"Ether / IP / TCP 111.206.209.249:https > 192.168.0.106:13774 A"
101.72.199.41,192.168.0.106,443,13590,6,"Ether / IP / TCP 101.72.199.41:https > 192.168.0.106:13590 A / Padding"
111.206.209.249,192.168.0.106,443,13774,6,"Ether / IP / TCP 111.206.209.249:https > 192.168.0.106:13774 PA / Raw"
192.168.0.106,111.206.209.249,13775,443,6,"Ether / IP / TCP 192.168.0.106:13775 > 111.206.209.249:https S"
192.168.0.106,111.206.209.249,13774,443,6,"Ether / IP / TCP 192.168.0.106:13774 > 111.206.209.249:https PA / Raw"
203.208.50.33,192.168.0.106,443,13639,6,"Ether / IP / TCP 203.208.50.33:https > 192.168.0.106:13639 A"
203.208.50.33,192.168.0.106,443,13639,6,"Ether / IP / TCP 203.208.50.33:https > 192.168.0.106:13639 A"
111.206.209.249,192.168.0.106,443,13775,6,"Ether / IP / TCP 111.206.209.249:https > 192.168.0.106:13775 SA"
192.168.0.106,111.206.209.249,13775,443,6,"Ether / IP / TCP 192.168.0.106:13775 > 111.206.209.249:https A"
192.168.0.106,111.206.209.249,13775,443,6,"Ether / IP / TCP 192.168.0.106:13775 > 111.206.209.249:https PA / Raw"
111.206.209.249,192.168.0.106,443,13774,6,"Ether / IP / TCP 111.206.209.249:https > 192.168.0.106:13774 A"
