srcip,dstip,sport,dport,proto,data
192.168.0.106,192.168.0.1,5624,53,6,"Ether / IP / TCP 192.168.0.106:5624 > 192.168.0.1:domain S"
192.168.0.106,192.168.0.1,5625,53,6,"Ether / IP / TCP 192.168.0.106:5625 > 192.168.0.1:domain S"
192.168.0.106,192.168.0.1,5614,53,6,"Ether / IP / TCP 192.168.0.106:5614 > 192.168.0.1:domain S"
192.168.0.1,192.168.0.106,53,5624,6,"Ether / IP / TCP 192.168.0.1:domain > 192.168.0.106:5624 RA"
192.168.0.1,192.168.0.106,53,5625,6,"Ether / IP / TCP 192.168.0.1:domain > 192.168.0.106:5625 RA"
192.168.0.1,192.168.0.106,53,5614,6,"Ether / IP / TCP 192.168.0.1:domain > 192.168.0.106:5614 RA"
192.168.0.106,192.168.0.1,5615,53,6,"Ether / IP / TCP 192.168.0.106:5615 > 192.168.0.1:domain S"
192.168.0.1,192.168.0.106,53,5615,6,"Ether / IP / TCP 192.168.0.1:domain > 192.168.0.106:5615 RA"
192.168.0.106,40.74.98.192,7120,443,6,"Ether / IP / TCP 192.168.0.106:7120 > 40.74.98.192:https PA / Raw"
192.168.0.106,40.74.98.192,7120,443,6,"Ether / IP / TCP 192.168.0.106:7120 > 40.74.98.192:https PA / Raw"
40.74.98.192,192.168.0.106,443,7120,6,"Ether / IP / TCP 40.74.98.192:https > 192.168.0.106:7120 A / Padding"
40.74.98.192,192.168.0.106,443,7120,6,"Ether / IP / TCP 40.74.98.192:https > 192.168.0.106:7120 PA / Raw"
40.74.98.192,192.168.0.106,443,7120,6,"Ether / IP / TCP 40.74.98.192:https > 192.168.0.106:7120 PA / Raw"
192.168.0.106,40.74.98.192,7120,443,6,"Ether / IP / TCP 192.168.0.106:7120 > 40.74.98.192:https A"
192.168.0.106,192.168.0.1,5625,53,6,"Ether / IP / TCP 192.168.0.106:5625 > 192.168.0.1:domain S"
192.168.0.106,192.168.0.1,5614,53,6,"Ether / IP / TCP 192.168.0.106:5614 > 192.168.0.1:domain S"
192.168.0.106,192.168.0.1,5624,53,6,"Ether / IP / TCP 192.168.0.106:5624 > 192.168.0.1:domain S"
192.168.0.1,192.168.0.106,53,5624,6,"Ether / IP / TCP 192.168.0.1:domain > 192.168.0.106:5624 RA"
192.168.0.1,192.168.0.106,53,5625,6,"Ether / IP / TCP 192.168.0.1:domain > 192.168.0.106:5625 RA"
192.168.0.1,192.168.0.106,53,5614,6,"Ether / IP / TCP 192.168.0.1:domain > 192.168.0.106:5614 RA"
192.168.0.106,192.168.0.1,5615,53,6,"Ether / IP / TCP 192.168.0.106:5615 > 192.168.0.1:domain S"
192.168.0.1,192.168.0.106,53,5615,6,"Ether / IP / TCP 192.168.0.1:domain > 192.168.0.106:5615 RA"
192.168.0.106,116.132.235.228,5626,80,6,"Ether / IP / TCP 192.168.0.106:5626 > 116.132.235.228:http S"
116.132.235.228,192.168.0.106,80,5626,6,"Ether / IP / TCP 116.132.235.228:http > 192.168.0.106:5626 SA"
192.168.0.106,116.132.235.228,5626,80,6,"Ether / IP / TCP 192.168.0.106:5626 > 116.132.235.228:http A"
192.168.0.106,116.132.235.228,5626,80,6,"Ether / IP / TCP 192.168.0.106:5626 > 116.132.235.228:http PA / Raw"
192.168.0.106,116.132.235.228,5626,80,6,"Ether / IP / TCP 192.168.0.106:5626 > 116.132.235.228:http A / Raw"
192.168.0.106,116.132.235.228,5626,80,6,"Ether / IP / TCP 192.168.0.106:5626 > 116.132.235.228:http A / Raw"
192.168.0.106,116.132.235.228,5626,80,6,"Ether / IP / TCP 192.168.0.106:5626 > 116.132.235.228:http PA / Raw"
192.168.0.106,116.132.235.228,5613,80,6,"Ether / IP / TCP 192.168.0.106:5613 > 116.132.235.228:http FA"
116.132.235.228,192.168.0.106,80,5626,6,"Ether / IP / TCP 116.132.235.228:http > 192.168.0.106:5626 A"
116.132.235.228,192.168.0.106,80,5626,6,"Ether / IP / TCP 116.132.235.228:http > 192.168.0.106:5626 A"
116.132.235.228,192.168.0.106,80,5626,6,"Ether / IP / TCP 116.132.235.228:http > 192.168.0.106:5626 A"
116.132.235.228,192.168.0.106,80,5626,6,"Ether / IP / TCP 116.132.235.228:http > 192.168.0.106:5626 PA / Raw"
116.132.235.228,192.168.0.106,80,5626,6,"Ether / IP / TCP 116.132.235.228:http > 192.168.0.106:5626 FA"
192.168.0.106,116.132.235.228,5626,80,6,"Ether / IP / TCP 192.168.0.106:5626 > 116.132.235.228:http A"
192.168.0.106,116.132.235.228,5626,80,6,"Ether / IP / TCP 192.168.0.106:5626 > 116.132.235.228:http FA"
192.168.0.106,192.168.0.1,5624,53,6,"Ether / IP / TCP 192.168.0.106:5624 > 192.168.0.1:domain S"
192.168.0.106,192.168.0.1,5614,53,6,"Ether / IP / TCP 192.168.0.106:5614 > 192.168.0.1:domain S"
192.168.0.106,192.168.0.1,5625,53,6,"Ether / IP / TCP 192.168.0.106:5625 > 192.168.0.1:domain S"
192.168.0.1,192.168.0.106,53,5625,6,"Ether / IP / TCP 192.168.0.1:domain > 192.168.0.106:5625 RA"
192.168.0.1,192.168.0.106,53,5614,6,"Ether / IP / TCP 192.168.0.1:domain > 192.168.0.106:5614 RA"
192.168.0.1,192.168.0.106,53,5624,6,"Ether / IP / TCP 192.168.0.1:domain > 192.168.0.106:5624 RA"
192.168.0.106,192.168.0.1,5615,53,6,"Ether / IP / TCP 192.168.0.106:5615 > 192.168.0.1:domain S"
192.168.0.1,192.168.0.106,53,5615,6,"Ether / IP / TCP 192.168.0.1:domain > 192.168.0.106:5615 RA"
192.168.0.106,116.132.235.228,5626,80,6,"Ether / IP / TCP 192.168.0.106:5626 > 116.132.235.228:http FA"
192.168.0.106,116.130.230.27,11670,443,6,"Ether / IP / TCP 192.168.0.106:11670 > 116.130.230.27:https PA / Raw"
116.130.230.27,192.168.0.106,443,11670,6,"Ether / IP / TCP 116.130.230.27:https > 192.168.0.106:11670 PA / Raw"
192.168.0.106,116.130.230.27,11670,443,6,"Ether / IP / TCP 192.168.0.106:11670 > 116.130.230.27:https A"
192.168.0.106,192.168.0.1,5624,53,6,"Ether / IP / TCP 192.168.0.106:5624 > 192.168.0.1:domain S"
192.168.0.106,192.168.0.1,5625,53,6,"Ether / IP / TCP 192.168.0.106:5625 > 192.168.0.1:domain S"
192.168.0.1,192.168.0.106,53,5625,6,"Ether / IP / TCP 192.168.0.1:domain > 192.168.0.106:5625 RA"
192.168.0.1,192.168.0.106,53,5624,6,"Ether / IP / TCP 192.168.0.1:domain > 192.168.0.106:5624 RA"
192.168.0.106,116.132.235.228,5601,80,6,"Ether / IP / TCP 192.168.0.106:5601 > 116.132.235.228:http FA"
192.168.0.106,116.132.235.228,5626,80,6,"Ether / IP / TCP 192.168.0.106:5626 > 116.132.235.228:http FA"
192.168.0.106,116.132.235.228,5627,80,6,"Ether / IP / TCP 192.168.0.106:5627 > 116.132.235.228:http S"
116.132.235.228,192.168.0.106,80,5627,6,"Ether / IP / TCP 116.132.235.228:http > 192.168.0.106:5627 SA"
192.168.0.106,116.132.235.228,5627,80,6,"Ether / IP / TCP 192.168.0.106:5627 > 116.132.235.228:http A"
192.168.0.106,116.132.235.228,5627,80,6,"Ether / IP / TCP 192.168.0.106:5627 > 116.132.235.228:http PA / Raw"
192.168.0.106,116.132.235.228,5627,80,6,"Ether / IP / TCP 192.168.0.106:5627 > 116.132.235.228:http A / Raw"
192.168.0.106,116.132.235.228,5627,80,6,"Ether / IP / TCP 192.168.0.106:5627 > 116.132.235.228:http A / Raw"
192.168.0.106,116.132.235.228,5627,80,6,"Ether / IP / TCP 192.168.0.106:5627 > 116.132.235.228:http PA / Raw"
116.132.235.228,192.168.0.106,80,5627,6,"Ether / IP / TCP 116.132.235.228:http > 192.168.0.106:5627 A"
116.132.235.228,192.168.0.106,80,5627,6,"Ether / IP / TCP 116.132.235.228:http > 192.168.0.106:5627 A"
116.132.235.228,192.168.0.106,80,5627,6,"Ether / IP / TCP 116.132.235.228:http > 192.168.0.106:5627 A"
116.132.235.228,192.168.0.106,80,5627,6,"Ether / IP / TCP 116.132.235.228:http > 192.168.0.106:5627 PA / Raw"
116.132.235.228,192.168.0.106,80,5627,6,"Ether / IP / TCP 116.132.235.228:http > 192.168.0.106:5627 FA"
192.168.0.106,116.132.235.228,5627,80,6,"Ether / IP / TCP 192.168.0.106:5627 > 116.132.235.228:http A"
192.168.0.106,116.132.235.228,5627,80,6,"Ether / IP / TCP 192.168.0.106:5627 > 116.132.235.228:http FA"
192.168.0.106,116.132.235.228,5628,80,6,"Ether / IP / TCP 192.168.0.106:5628 > 116.132.235.228:http S"
116.132.235.228,192.168.0.106,80,5628,6,"Ether / IP / TCP 116.132.235.228:http > 192.168.0.106:5628 SA"
192.168.0.106,116.132.235.228,5628,80,6,"Ether / IP / TCP 192.168.0.106:5628 > 116.132.235.228:http A"
192.168.0.106,116.132.235.228,5628,80,6,"Ether / IP / TCP 192.168.0.106:5628 > 116.132.235.228:http PA / Raw"
192.168.0.106,116.132.235.228,5628,80,6,"Ether / IP / TCP 192.168.0.106:5628 > 116.132.235.228:http A / Raw"
192.168.0.106,116.132.235.228,5628,80,6,"Ether / IP / TCP 192.168.0.106:5628 > 116.132.235.228:http A / Raw"
192.168.0.106,116.132.235.228,5628,80,6,"Ether / IP / TCP 192.168.0.106:5628 > 116.132.235.228:http PA / Raw"
116.132.235.228,192.168.0.106,80,5628,6,"Ether / IP / TCP 116.132.235.228:http > 192.168.0.106:5628 A"
116.132.235.228,192.168.0.106,80,5628,6,"Ether / IP / TCP 116.132.235.228:http > 192.168.0.106:5628 A"
116.132.235.228,192.168.0.106,80,5628,6,"Ether / IP / TCP 116.132.235.228:http > 192.168.0.106:5628 A"
116.132.235.228,192.168.0.106,80,5628,6,"Ether / IP / TCP 116.132.235.228:http > 192.168.0.106:5628 PA / Raw"
116.132.235.228,192.168.0.106,80,5628,6,"Ether / IP / TCP 116.132.235.228:http > 192.168.0.106:5628 FA"
192.168.0.106,116.132.235.228,5628,80,6,"Ether / IP / TCP 192.168.0.106:5628 > 116.132.235.228:http A"
192.168.0.106,116.132.235.228,5628,80,6,"Ether / IP / TCP 192.168.0.106:5628 > 116.132.235.228:http FA"
192.168.0.106,192.168.0.1,63684,53,17,"Ether / IP / UDP / DNS Qry ""b'nav-edge.smartscreen.microsoft.com.'"" "
192.168.0.1,192.168.0.106,53,63684,17,"Ether / IP / UDP / DNS Ans ""b'tm-prod-wd-csp-edge.trafficmanager.net.'"" "
192.168.0.106,20.198.213.74,5629,443,6,"Ether / IP / TCP 192.168.0.106:5629 > 20.198.213.74:https S"
192.168.0.106,20.198.213.74,5630,443,6,"Ether / IP / TCP 192.168.0.106:5630 > 20.198.213.74:https S"
192.168.0.106,20.198.213.74,5631,443,6,"Ether / IP / TCP 192.168.0.106:5631 > 20.198.213.74:https S"
20.198.213.74,192.168.0.106,443,5630,6,"Ether / IP / TCP 20.198.213.74:https > 192.168.0.106:5630 SA"
192.168.0.106,20.198.213.74,5630,443,6,"Ether / IP / TCP 192.168.0.106:5630 > 20.198.213.74:https A"
192.168.0.106,20.198.213.74,5630,443,6,"Ether / IP / TCP 192.168.0.106:5630 > 20.198.213.74:https PA / Raw"
20.198.213.74,192.168.0.106,443,5629,6,"Ether / IP / TCP 20.198.213.74:https > 192.168.0.106:5629 SA"
192.168.0.106,20.198.213.74,5629,443,6,"Ether / IP / TCP 192.168.0.106:5629 > 20.198.213.74:https A"
192.168.0.106,20.198.213.74,5629,443,6,"Ether / IP / TCP 192.168.0.106:5629 > 20.198.213.74:https PA / Raw"
192.168.0.106,116.132.235.228,5627,80,6,"Ether / IP / TCP 192.168.0.106:5627 > 116.132.235.228:http FA"
20.198.213.74,192.168.0.106,443,5631,6,"Ether / IP / TCP 20.198.213.74:https > 192.168.0.106:5631 SA"
192.168.0.106,20.198.213.74,5631,443,6,"Ether / IP / TCP 192.168.0.106:5631 > 20.198.213.74:https A"
192.168.0.106,20.198.213.74,5631,443,6,"Ether / IP / TCP 192.168.0.106:5631 > 20.198.213.74:https PA / Raw"
20.198.213.74,192.168.0.106,443,5630,6,"Ether / IP / TCP 20.198.213.74:https > 192.168.0.106:5630 A / Raw"
20.198.213.74,192.168.0.106,443,5630,6,"Ether / IP / TCP 20.198.213.74:https > 192.168.0.106:5630 A / Raw"
20.198.213.74,192.168.0.106,443,5630,6,"Ether / IP / TCP 20.198.213.74:https > 192.168.0.106:5630 A / Raw"
20.198.213.74,192.168.0.106,443,5630,6,"Ether / IP / TCP 20.198.213.74:https > 192.168.0.106:5630 A / Raw"
20.198.213.74,192.168.0.106,443,5630,6,"Ether / IP / TCP 20.198.213.74:https > 192.168.0.106:5630 PA / Raw"
20.198.213.74,192.168.0.106,443,5630,6,"Ether / IP / TCP 20.198.213.74:https > 192.168.0.106:5630 A / Raw"
192.168.0.106,20.198.213.74,5630,443,6,"Ether / IP / TCP 192.168.0.106:5630 > 20.198.213.74:https A"
192.168.0.106,20.198.213.74,5630,443,6,"Ether / IP / TCP 192.168.0.106:5630 > 20.198.213.74:https A"
192.168.0.106,20.198.213.74,5630,443,6,"Ether / IP / TCP 192.168.0.106:5630 > 20.198.213.74:https PA / Raw"
20.198.213.74,192.168.0.106,443,5629,6,"Ether / IP / TCP 20.198.213.74:https > 192.168.0.106:5629 A / Raw"
192.168.0.106,20.198.213.74,5629,443,6,"Ether / IP / TCP 192.168.0.106:5629 > 20.198.213.74:https A"
20.198.213.74,192.168.0.106,443,5629,6,"Ether / IP / TCP 20.198.213.74:https > 192.168.0.106:5629 A / Raw"
20.198.213.74,192.168.0.106,443,5629,6,"Ether / IP / TCP 20.198.213.74:https > 192.168.0.106:5629 PA / Raw"
20.198.213.74,192.168.0.106,443,5629,6,"Ether / IP / TCP 20.198.213.74:https > 192.168.0.106:5629 A / Raw"
20.198.213.74,192.168.0.106,443,5629,6,"Ether / IP / TCP 20.198.213.74:https > 192.168.0.106:5629 A / Raw"
20.198.213.74,192.168.0.106,443,5629,6,"Ether / IP / TCP 20.198.213.74:https > 192.168.0.106:5629 A / Raw"
192.168.0.106,20.198.213.74,5629,443,6,"Ether / IP / TCP 192.168.0.106:5629 > 20.198.213.74:https A"
192.168.0.106,20.198.213.74,5629,443,6,"Ether / IP / TCP 192.168.0.106:5629 > 20.198.213.74:https A"
192.168.0.106,20.198.213.74,5629,443,6,"Ether / IP / TCP 192.168.0.106:5629 > 20.198.213.74:https A"
192.168.0.106,20.198.213.74,5629,443,6,"Ether / IP / TCP 192.168.0.106:5629 > 20.198.213.74:https A"
192.168.0.106,20.198.213.74,5629,443,6,"Ether / IP / TCP 192.168.0.106:5629 > 20.198.213.74:https A"
192.168.0.106,20.198.213.74,5629,443,6,"Ether / IP / TCP 192.168.0.106:5629 > 20.198.213.74:https PA / Raw"
192.168.0.106,116.132.235.228,5628,80,6,"Ether / IP / TCP 192.168.0.106:5628 > 116.132.235.228:http FA"
20.198.213.74,192.168.0.106,443,5631,6,"Ether / IP / TCP 20.198.213.74:https > 192.168.0.106:5631 A / Raw"
20.198.213.74,192.168.0.106,443,5631,6,"Ether / IP / TCP 20.198.213.74:https > 192.168.0.106:5631 A / Raw"
20.198.213.74,192.168.0.106,443,5631,6,"Ether / IP / TCP 20.198.213.74:https > 192.168.0.106:5631 A / Raw"
20.198.213.74,192.168.0.106,443,5631,6,"Ether / IP / TCP 20.198.213.74:https > 192.168.0.106:5631 A / Raw"
20.198.213.74,192.168.0.106,443,5631,6,"Ether / IP / TCP 20.198.213.74:https > 192.168.0.106:5631 A / Raw"
192.168.0.106,20.198.213.74,5631,443,6,"Ether / IP / TCP 192.168.0.106:5631 > 20.198.213.74:https A"
20.198.213.74,192.168.0.106,443,5631,6,"Ether / IP / TCP 20.198.213.74:https > 192.168.0.106:5631 PA / Raw"
192.168.0.106,20.198.213.74,5631,443,6,"Ether / IP / TCP 192.168.0.106:5631 > 20.198.213.74:https A"
192.168.0.106,20.198.213.74,5631,443,6,"Ether / IP / TCP 192.168.0.106:5631 > 20.198.213.74:https PA / Raw"
20.198.213.74,192.168.0.106,443,5630,6,"Ether / IP / TCP 20.198.213.74:https > 192.168.0.106:5630 PA / Raw"
192.168.0.106,20.198.213.74,5630,443,6,"Ether / IP / TCP 192.168.0.106:5630 > 20.198.213.74:https PA / Raw"
192.168.0.106,20.198.213.74,5630,443,6,"Ether / IP / TCP 192.168.0.106:5630 > 20.198.213.74:https A / Raw"
192.168.0.106,20.198.213.74,5630,443,6,"Ether / IP / TCP 192.168.0.106:5630 > 20.198.213.74:https PA / Raw"
20.198.213.74,192.168.0.106,443,5629,6,"Ether / IP / TCP 20.198.213.74:https > 192.168.0.106:5629 PA / Raw"
192.168.0.106,20.198.213.74,5629,443,6,"Ether / IP / TCP 192.168.0.106:5629 > 20.198.213.74:https PA / Raw"
192.168.0.106,20.198.213.74,5629,443,6,"Ether / IP / TCP 192.168.0.106:5629 > 20.198.213.74:https A / Raw"
192.168.0.106,20.198.213.74,5629,443,6,"Ether / IP / TCP 192.168.0.106:5629 > 20.198.213.74:https PA / Raw"
20.198.213.74,192.168.0.106,443,5631,6,"Ether / IP / TCP 20.198.213.74:https > 192.168.0.106:5631 PA / Raw"
20.198.213.74,192.168.0.106,443,5630,6,"Ether / IP / TCP 20.198.213.74:https > 192.168.0.106:5630 A"
20.198.213.74,192.168.0.106,443,5630,6,"Ether / IP / TCP 20.198.213.74:https > 192.168.0.106:5630 FPA / Raw"
192.168.0.106,20.198.213.74,5630,443,6,"Ether / IP / TCP 192.168.0.106:5630 > 20.198.213.74:https A"
192.168.0.106,20.198.213.74,5630,443,6,"Ether / IP / TCP 192.168.0.106:5630 > 20.198.213.74:https FA"
20.198.213.74,192.168.0.106,443,5629,6,"Ether / IP / TCP 20.198.213.74:https > 192.168.0.106:5629 A"
20.198.213.74,192.168.0.106,443,5629,6,"Ether / IP / TCP 20.198.213.74:https > 192.168.0.106:5629 A"
20.198.213.74,192.168.0.106,443,5629,6,"Ether / IP / TCP 20.198.213.74:https > 192.168.0.106:5629 FPA / Raw"
20.198.213.74,192.168.0.106,443,5629,6,"Ether / IP / TCP 20.198.213.74:https > 192.168.0.106:5629 A / Raw"
192.168.0.106,20.198.213.74,5629,443,6,"Ether / IP / TCP 192.168.0.106:5629 > 20.198.213.74:https A"
192.168.0.106,20.198.213.74,5629,443,6,"Ether / IP / TCP 192.168.0.106:5629 > 20.198.213.74:https A"
192.168.0.106,20.198.213.74,5629,443,6,"Ether / IP / TCP 192.168.0.106:5629 > 20.198.213.74:https FA"
192.168.0.106,20.198.213.74,5631,443,6,"Ether / IP / TCP 192.168.0.106:5631 > 20.198.213.74:https A"
192.168.0.106,110.242.68.3,5632,80,6,"Ether / IP / TCP 192.168.0.106:5632 > 110.242.68.3:http S"
110.242.68.3,192.168.0.106,80,5632,6,"Ether / IP / TCP 110.242.68.3:http > 192.168.0.106:5632 SA"
192.168.0.106,110.242.68.3,5632,80,6,"Ether / IP / TCP 192.168.0.106:5632 > 110.242.68.3:http A"
192.168.0.106,110.242.68.3,5632,80,6,"Ether / IP / TCP 192.168.0.106:5632 > 110.242.68.3:http FA"
110.242.68.3,192.168.0.106,80,5632,6,"Ether / IP / TCP 110.242.68.3:http > 192.168.0.106:5632 A"
110.242.68.3,192.168.0.106,80,5632,6,"Ether / IP / TCP 110.242.68.3:http > 192.168.0.106:5632 FA"
192.168.0.106,110.242.68.3,5632,80,6,"Ether / IP / TCP 192.168.0.106:5632 > 110.242.68.3:http A"
192.168.0.106,116.132.235.228,5604,80,6,"Ether / IP / TCP 192.168.0.106:5604 > 116.132.235.228:http FA"
192.168.0.106,20.198.213.74,5630,443,6,"Ether / IP / TCP 192.168.0.106:5630 > 20.198.213.74:https FA"
192.168.0.106,20.198.213.74,5629,443,6,"Ether / IP / TCP 192.168.0.106:5629 > 20.198.213.74:https FA"
192.168.0.106,116.132.235.228,5627,80,6,"Ether / IP / TCP 192.168.0.106:5627 > 116.132.235.228:http FA"
192.168.0.106,116.132.235.228,5605,80,6,"Ether / IP / TCP 192.168.0.106:5605 > 116.132.235.228:http FA"
192.168.0.106,116.132.235.228,5626,80,6,"Ether / IP / TCP 192.168.0.106:5626 > 116.132.235.228:http FA"
192.168.0.106,116.132.235.228,5628,80,6,"Ether / IP / TCP 192.168.0.106:5628 > 116.132.235.228:http FA"
192.168.0.106,116.132.235.228,5633,80,6,"Ether / IP / TCP 192.168.0.106:5633 > 116.132.235.228:http S"
116.132.235.228,192.168.0.106,80,5633,6,"Ether / IP / TCP 116.132.235.228:http > 192.168.0.106:5633 SA"
192.168.0.106,116.132.235.228,5633,80,6,"Ether / IP / TCP 192.168.0.106:5633 > 116.132.235.228:http A"
192.168.0.106,116.132.235.228,5633,80,6,"Ether / IP / TCP 192.168.0.106:5633 > 116.132.235.228:http PA / Raw"
192.168.0.106,116.132.235.228,5633,80,6,"Ether / IP / TCP 192.168.0.106:5633 > 116.132.235.228:http A / Raw"
192.168.0.106,116.132.235.228,5633,80,6,"Ether / IP / TCP 192.168.0.106:5633 > 116.132.235.228:http A / Raw"
192.168.0.106,116.132.235.228,5633,80,6,"Ether / IP / TCP 192.168.0.106:5633 > 116.132.235.228:http PA / Raw"
116.132.235.228,192.168.0.106,80,5633,6,"Ether / IP / TCP 116.132.235.228:http > 192.168.0.106:5633 A"
116.132.235.228,192.168.0.106,80,5633,6,"Ether / IP / TCP 116.132.235.228:http > 192.168.0.106:5633 A"
116.132.235.228,192.168.0.106,80,5633,6,"Ether / IP / TCP 116.132.235.228:http > 192.168.0.106:5633 A"
116.132.235.228,192.168.0.106,80,5633,6,"Ether / IP / TCP 116.132.235.228:http > 192.168.0.106:5633 PA / Raw"
116.132.235.228,192.168.0.106,80,5633,6,"Ether / IP / TCP 116.132.235.228:http > 192.168.0.106:5633 FA"
192.168.0.106,116.132.235.228,5633,80,6,"Ether / IP / TCP 192.168.0.106:5633 > 116.132.235.228:http A"
192.168.0.106,116.132.235.228,5633,80,6,"Ether / IP / TCP 192.168.0.106:5633 > 116.132.235.228:http FA"
192.168.0.106,116.132.235.228,5613,80,6,"Ether / IP / TCP 192.168.0.106:5613 > 116.132.235.228:http FA"
192.168.0.106,20.198.213.74,5630,443,6,"Ether / IP / TCP 192.168.0.106:5630 > 20.198.213.74:https FA"
192.168.0.106,20.198.213.74,5629,443,6,"Ether / IP / TCP 192.168.0.106:5629 > 20.198.213.74:https FA"
192.168.0.106,116.132.235.228,5633,80,6,"Ether / IP / TCP 192.168.0.106:5633 > 116.132.235.228:http FA"
116.130.230.27,192.168.0.106,443,11670,6,"Ether / IP / TCP 116.130.230.27:https > 192.168.0.106:11670 PA / Raw"
192.168.0.106,116.130.230.27,11670,443,6,"Ether / IP / TCP 192.168.0.106:11670 > 116.130.230.27:https A"
192.168.0.106,116.132.235.228,5627,80,6,"Ether / IP / TCP 192.168.0.106:5627 > 116.132.235.228:http FA"
192.168.0.106,116.132.235.228,5633,80,6,"Ether / IP / TCP 192.168.0.106:5633 > 116.132.235.228:http FA"
192.168.0.106,116.132.235.228,5628,80,6,"Ether / IP / TCP 192.168.0.106:5628 > 116.132.235.228:http FA"
192.168.0.106,116.132.235.228,5634,80,6,"Ether / IP / TCP 192.168.0.106:5634 > 116.132.235.228:http S"
116.132.235.228,192.168.0.106,80,5634,6,"Ether / IP / TCP 116.132.235.228:http > 192.168.0.106:5634 SA"
192.168.0.106,116.132.235.228,5634,80,6,"Ether / IP / TCP 192.168.0.106:5634 > 116.132.235.228:http A"
192.168.0.106,116.132.235.228,5634,80,6,"Ether / IP / TCP 192.168.0.106:5634 > 116.132.235.228:http PA / Raw"
192.168.0.106,116.132.235.228,5634,80,6,"Ether / IP / TCP 192.168.0.106:5634 > 116.132.235.228:http A / Raw"
192.168.0.106,116.132.235.228,5634,80,6,"Ether / IP / TCP 192.168.0.106:5634 > 116.132.235.228:http A / Raw"
192.168.0.106,116.132.235.228,5634,80,6,"Ether / IP / TCP 192.168.0.106:5634 > 116.132.235.228:http PA / Raw"
116.132.235.228,192.168.0.106,80,5634,6,"Ether / IP / TCP 116.132.235.228:http > 192.168.0.106:5634 A"
116.132.235.228,192.168.0.106,80,5634,6,"Ether / IP / TCP 116.132.235.228:http > 192.168.0.106:5634 A"
116.132.235.228,192.168.0.106,80,5634,6,"Ether / IP / TCP 116.132.235.228:http > 192.168.0.106:5634 A"
116.132.235.228,192.168.0.106,80,5634,6,"Ether / IP / TCP 116.132.235.228:http > 192.168.0.106:5634 PA / Raw"
116.132.235.228,192.168.0.106,80,5634,6,"Ether / IP / TCP 116.132.235.228:http > 192.168.0.106:5634 FA"
192.168.0.106,116.132.235.228,5634,80,6,"Ether / IP / TCP 192.168.0.106:5634 > 116.132.235.228:http A"
192.168.0.106,116.132.235.228,5634,80,6,"Ether / IP / TCP 192.168.0.106:5634 > 116.132.235.228:http FA"
116.132.235.228,192.168.0.106,80,5634,6,"Ether / IP / TCP 116.132.235.228:http > 192.168.0.106:5634 A"
192.168.0.106,116.132.235.228,5635,80,6,"Ether / IP / TCP 192.168.0.106:5635 > 116.132.235.228:http S"
116.132.235.228,192.168.0.106,80,5635,6,"Ether / IP / TCP 116.132.235.228:http > 192.168.0.106:5635 SA"
192.168.0.106,116.132.235.228,5635,80,6,"Ether / IP / TCP 192.168.0.106:5635 > 116.132.235.228:http A"
192.168.0.106,116.132.235.228,5635,80,6,"Ether / IP / TCP 192.168.0.106:5635 > 116.132.235.228:http PA / Raw"
192.168.0.106,116.132.235.228,5635,80,6,"Ether / IP / TCP 192.168.0.106:5635 > 116.132.235.228:http A / Raw"
192.168.0.106,116.132.235.228,5635,80,6,"Ether / IP / TCP 192.168.0.106:5635 > 116.132.235.228:http A / Raw"
192.168.0.106,116.132.235.228,5635,80,6,"Ether / IP / TCP 192.168.0.106:5635 > 116.132.235.228:http PA / Raw"
116.132.235.228,192.168.0.106,80,5635,6,"Ether / IP / TCP 116.132.235.228:http > 192.168.0.106:5635 A"
116.132.235.228,192.168.0.106,80,5635,6,"Ether / IP / TCP 116.132.235.228:http > 192.168.0.106:5635 A"
116.132.235.228,192.168.0.106,80,5635,6,"Ether / IP / TCP 116.132.235.228:http > 192.168.0.106:5635 A"
116.132.235.228,192.168.0.106,80,5635,6,"Ether / IP / TCP 116.132.235.228:http > 192.168.0.106:5635 PA / Raw"
116.132.235.228,192.168.0.106,80,5635,6,"Ether / IP / TCP 116.132.235.228:http > 192.168.0.106:5635 FA"
192.168.0.106,116.132.235.228,5635,80,6,"Ether / IP / TCP 192.168.0.106:5635 > 116.132.235.228:http A"
192.168.0.106,116.132.235.228,5635,80,6,"Ether / IP / TCP 192.168.0.106:5635 > 116.132.235.228:http FA"
116.132.235.228,192.168.0.106,80,5635,6,"Ether / IP / TCP 116.132.235.228:http > 192.168.0.106:5635 A"
192.168.192.1,192.168.192.2,137,137,17,"Ether / IP / UDP 192.168.192.1:netbios_ns > 192.168.192.2:netbios_ns / NBNSHeader / Raw"
192.168.0.106,20.198.213.74,5630,443,6,"Ether / IP / TCP 192.168.0.106:5630 > 20.198.213.74:https FA"
192.168.0.106,20.198.213.74,5629,443,6,"Ether / IP / TCP 192.168.0.106:5629 > 20.198.213.74:https FA"
192.168.0.106,116.132.235.228,5633,80,6,"Ether / IP / TCP 192.168.0.106:5633 > 116.132.235.228:http FA"
192.168.0.106,116.132.235.228,5626,80,6,"Ether / IP / TCP 192.168.0.106:5626 > 116.132.235.228:http FA"
192.168.0.106,116.132.235.228,5636,80,6,"Ether / IP / TCP 192.168.0.106:5636 > 116.132.235.228:http S"
116.132.235.228,192.168.0.106,80,5636,6,"Ether / IP / TCP 116.132.235.228:http > 192.168.0.106:5636 SA"
192.168.0.106,116.132.235.228,5636,80,6,"Ether / IP / TCP 192.168.0.106:5636 > 116.132.235.228:http A"
192.168.0.106,116.132.235.228,5636,80,6,"Ether / IP / TCP 192.168.0.106:5636 > 116.132.235.228:http PA / Raw"
192.168.0.106,116.132.235.228,5636,80,6,"Ether / IP / TCP 192.168.0.106:5636 > 116.132.235.228:http A / Raw"
192.168.0.106,116.132.235.228,5636,80,6,"Ether / IP / TCP 192.168.0.106:5636 > 116.132.235.228:http A / Raw"
192.168.0.106,116.132.235.228,5636,80,6,"Ether / IP / TCP 192.168.0.106:5636 > 116.132.235.228:http PA / Raw"
116.132.235.228,192.168.0.106,80,5636,6,"Ether / IP / TCP 116.132.235.228:http > 192.168.0.106:5636 A"
116.132.235.228,192.168.0.106,80,5636,6,"Ether / IP / TCP 116.132.235.228:http > 192.168.0.106:5636 A"
116.132.235.228,192.168.0.106,80,5636,6,"Ether / IP / TCP 116.132.235.228:http > 192.168.0.106:5636 A"
116.132.235.228,192.168.0.106,80,5636,6,"Ether / IP / TCP 116.132.235.228:http > 192.168.0.106:5636 PA / Raw"
116.132.235.228,192.168.0.106,80,5636,6,"Ether / IP / TCP 116.132.235.228:http > 192.168.0.106:5636 FA"
192.168.0.106,116.132.235.228,5636,80,6,"Ether / IP / TCP 192.168.0.106:5636 > 116.132.235.228:http A"
192.168.0.106,116.132.235.228,5636,80,6,"Ether / IP / TCP 192.168.0.106:5636 > 116.132.235.228:http FA"
116.132.235.228,192.168.0.106,80,5636,6,"Ether / IP / TCP 116.132.235.228:http > 192.168.0.106:5636 A"
192.168.192.1,192.168.192.2,137,137,17,"Ether / IP / UDP 192.168.192.1:netbios_ns > 192.168.192.2:netbios_ns / NBNSHeader / Raw"
69.16.175.10,192.168.0.106,80,5608,6,"Ether / IP / TCP 69.16.175.10:http > 192.168.0.106:5608 FA"
192.168.0.106,69.16.175.10,5608,80,6,"Ether / IP / TCP 192.168.0.106:5608 > 69.16.175.10:http A"
192.168.0.106,116.132.235.228,5627,80,6,"Ether / IP / TCP 192.168.0.106:5627 > 116.132.235.228:http FA"
192.168.0.106,116.132.235.228,5637,80,6,"Ether / IP / TCP 192.168.0.106:5637 > 116.132.235.228:http S"
192.168.0.106,116.132.235.228,5628,80,6,"Ether / IP / TCP 192.168.0.106:5628 > 116.132.235.228:http FA"
116.132.235.228,192.168.0.106,80,5637,6,"Ether / IP / TCP 116.132.235.228:http > 192.168.0.106:5637 SA"
192.168.0.106,116.132.235.228,5637,80,6,"Ether / IP / TCP 192.168.0.106:5637 > 116.132.235.228:http A"
192.168.0.106,116.132.235.228,5637,80,6,"Ether / IP / TCP 192.168.0.106:5637 > 116.132.235.228:http PA / Raw"
192.168.0.106,116.132.235.228,5637,80,6,"Ether / IP / TCP 192.168.0.106:5637 > 116.132.235.228:http A / Raw"
192.168.0.106,116.132.235.228,5637,80,6,"Ether / IP / TCP 192.168.0.106:5637 > 116.132.235.228:http A / Raw"
192.168.0.106,116.132.235.228,5637,80,6,"Ether / IP / TCP 192.168.0.106:5637 > 116.132.235.228:http PA / Raw"
116.132.235.228,192.168.0.106,80,5637,6,"Ether / IP / TCP 116.132.235.228:http > 192.168.0.106:5637 A"
116.132.235.228,192.168.0.106,80,5637,6,"Ether / IP / TCP 116.132.235.228:http > 192.168.0.106:5637 A"
116.132.235.228,192.168.0.106,80,5637,6,"Ether / IP / TCP 116.132.235.228:http > 192.168.0.106:5637 A"
116.132.235.228,192.168.0.106,80,5637,6,"Ether / IP / TCP 116.132.235.228:http > 192.168.0.106:5637 PA / Raw"
116.132.235.228,192.168.0.106,80,5637,6,"Ether / IP / TCP 116.132.235.228:http > 192.168.0.106:5637 FA"
192.168.0.106,116.132.235.228,5637,80,6,"Ether / IP / TCP 192.168.0.106:5637 > 116.132.235.228:http A"
192.168.0.106,116.132.235.228,5637,80,6,"Ether / IP / TCP 192.168.0.106:5637 > 116.132.235.228:http FA"
192.168.0.106,116.132.235.228,5637,80,6,"Ether / IP / TCP 192.168.0.106:5637 > 116.132.235.228:http FA"
192.168.0.106,20.198.213.74,5630,443,6,"Ether / IP / TCP 192.168.0.106:5630 > 20.198.213.74:https FA"
192.168.0.106,20.198.213.74,5629,443,6,"Ether / IP / TCP 192.168.0.106:5629 > 20.198.213.74:https FA"
192.168.192.1,192.168.192.2,137,137,17,"Ether / IP / UDP 192.168.192.1:netbios_ns > 192.168.192.2:netbios_ns / NBNSHeader / Raw"
192.168.0.106,116.132.235.228,5637,80,6,"Ether / IP / TCP 192.168.0.106:5637 > 116.132.235.228:http FA"
192.168.0.106,116.132.235.228,5633,80,6,"Ether / IP / TCP 192.168.0.106:5633 > 116.132.235.228:http FA"
192.168.0.106,116.132.235.228,5638,80,6,"Ether / IP / TCP 192.168.0.106:5638 > 116.132.235.228:http S"
116.132.235.228,192.168.0.106,80,5638,6,"Ether / IP / TCP 116.132.235.228:http > 192.168.0.106:5638 SA"
192.168.0.106,116.132.235.228,5638,80,6,"Ether / IP / TCP 192.168.0.106:5638 > 116.132.235.228:http A"
192.168.0.106,116.132.235.228,5638,80,6,"Ether / IP / TCP 192.168.0.106:5638 > 116.132.235.228:http PA / Raw"
192.168.0.106,116.132.235.228,5638,80,6,"Ether / IP / TCP 192.168.0.106:5638 > 116.132.235.228:http A / Raw"
192.168.0.106,116.132.235.228,5638,80,6,"Ether / IP / TCP 192.168.0.106:5638 > 116.132.235.228:http A / Raw"
192.168.0.106,116.132.235.228,5638,80,6,"Ether / IP / TCP 192.168.0.106:5638 > 116.132.235.228:http PA / Raw"
116.132.235.228,192.168.0.106,80,5638,6,"Ether / IP / TCP 116.132.235.228:http > 192.168.0.106:5638 A"
116.132.235.228,192.168.0.106,80,5638,6,"Ether / IP / TCP 116.132.235.228:http > 192.168.0.106:5638 A"
116.132.235.228,192.168.0.106,80,5638,6,"Ether / IP / TCP 116.132.235.228:http > 192.168.0.106:5638 PA / Raw"
116.132.235.228,192.168.0.106,80,5638,6,"Ether / IP / TCP 116.132.235.228:http > 192.168.0.106:5638 FA"
192.168.0.106,116.132.235.228,5638,80,6,"Ether / IP / TCP 192.168.0.106:5638 > 116.132.235.228:http A"
192.168.0.106,116.132.235.228,5638,80,6,"Ether / IP / TCP 192.168.0.106:5638 > 116.132.235.228:http FA"
192.168.0.106,116.132.235.228,5639,80,6,"Ether / IP / TCP 192.168.0.106:5639 > 116.132.235.228:http S"
116.132.235.228,192.168.0.106,80,5638,6,"Ether / IP / TCP 116.132.235.228:http > 192.168.0.106:5638 A"
116.132.235.228,192.168.0.106,80,5639,6,"Ether / IP / TCP 116.132.235.228:http > 192.168.0.106:5639 SA"
192.168.0.106,116.132.235.228,5639,80,6,"Ether / IP / TCP 192.168.0.106:5639 > 116.132.235.228:http A"
192.168.0.106,116.132.235.228,5639,80,6,"Ether / IP / TCP 192.168.0.106:5639 > 116.132.235.228:http PA / Raw"
192.168.0.106,116.132.235.228,5639,80,6,"Ether / IP / TCP 192.168.0.106:5639 > 116.132.235.228:http A / Raw"
192.168.0.106,116.132.235.228,5639,80,6,"Ether / IP / TCP 192.168.0.106:5639 > 116.132.235.228:http A / Raw"
192.168.0.106,116.132.235.228,5639,80,6,"Ether / IP / TCP 192.168.0.106:5639 > 116.132.235.228:http PA / Raw"
116.132.235.228,192.168.0.106,80,5639,6,"Ether / IP / TCP 116.132.235.228:http > 192.168.0.106:5639 A"
116.132.235.228,192.168.0.106,80,5639,6,"Ether / IP / TCP 116.132.235.228:http > 192.168.0.106:5639 A"
116.132.235.228,192.168.0.106,80,5639,6,"Ether / IP / TCP 116.132.235.228:http > 192.168.0.106:5639 A"
116.132.235.228,192.168.0.106,80,5639,6,"Ether / IP / TCP 116.132.235.228:http > 192.168.0.106:5639 PA / Raw"
116.132.235.228,192.168.0.106,80,5639,6,"Ether / IP / TCP 116.132.235.228:http > 192.168.0.106:5639 FA"
192.168.0.106,116.132.235.228,5639,80,6,"Ether / IP / TCP 192.168.0.106:5639 > 116.132.235.228:http A"
192.168.0.106,116.132.235.228,5639,80,6,"Ether / IP / TCP 192.168.0.106:5639 > 116.132.235.228:http FA"
116.132.235.228,192.168.0.106,80,5639,6,"Ether / IP / TCP 116.132.235.228:http > 192.168.0.106:5639 A"
192.168.0.106,116.132.235.228,5613,80,6,"Ether / IP / TCP 192.168.0.106:5613 > 116.132.235.228:http FA"
139.224.70.134,192.168.0.106,443,7027,6,"Ether / IP / TCP 139.224.70.134:https > 192.168.0.106:7027 PA / Raw"
192.168.0.106,139.224.70.134,7027,443,6,"Ether / IP / TCP 192.168.0.106:7027 > 139.224.70.134:https PA / Raw"
139.224.70.134,192.168.0.106,443,7027,6,"Ether / IP / TCP 139.224.70.134:https > 192.168.0.106:7027 A / Padding"
192.168.0.106,116.132.235.228,5637,80,6,"Ether / IP / TCP 192.168.0.106:5637 > 116.132.235.228:http FA"
192.168.0.106,116.132.235.228,5640,80,6,"Ether / IP / TCP 192.168.0.106:5640 > 116.132.235.228:http S"
116.132.235.228,192.168.0.106,80,5640,6,"Ether / IP / TCP 116.132.235.228:http > 192.168.0.106:5640 SA"
192.168.0.106,116.132.235.228,5640,80,6,"Ether / IP / TCP 192.168.0.106:5640 > 116.132.235.228:http A"
192.168.0.106,116.132.235.228,5640,80,6,"Ether / IP / TCP 192.168.0.106:5640 > 116.132.235.228:http PA / Raw"
192.168.0.106,116.132.235.228,5640,80,6,"Ether / IP / TCP 192.168.0.106:5640 > 116.132.235.228:http A / Raw"
192.168.0.106,116.132.235.228,5640,80,6,"Ether / IP / TCP 192.168.0.106:5640 > 116.132.235.228:http A / Raw"
192.168.0.106,116.132.235.228,5640,80,6,"Ether / IP / TCP 192.168.0.106:5640 > 116.132.235.228:http PA / Raw"
116.132.235.228,192.168.0.106,80,5640,6,"Ether / IP / TCP 116.132.235.228:http > 192.168.0.106:5640 A"
116.132.235.228,192.168.0.106,80,5640,6,"Ether / IP / TCP 116.132.235.228:http > 192.168.0.106:5640 A"
116.132.235.228,192.168.0.106,80,5640,6,"Ether / IP / TCP 116.132.235.228:http > 192.168.0.106:5640 A"
116.132.235.228,192.168.0.106,80,5640,6,"Ether / IP / TCP 116.132.235.228:http > 192.168.0.106:5640 PA / Raw"
116.132.235.228,192.168.0.106,80,5640,6,"Ether / IP / TCP 116.132.235.228:http > 192.168.0.106:5640 FA"
192.168.0.106,116.132.235.228,5640,80,6,"Ether / IP / TCP 192.168.0.106:5640 > 116.132.235.228:http A"
192.168.0.106,116.132.235.228,5640,80,6,"Ether / IP / TCP 192.168.0.106:5640 > 116.132.235.228:http FA"
192.168.0.106,116.132.235.228,5640,80,6,"Ether / IP / TCP 192.168.0.106:5640 > 116.132.235.228:http FA"
192.168.0.106,116.132.235.228,5640,80,6,"Ether / IP / TCP 192.168.0.106:5640 > 116.132.235.228:http FA"
192.168.0.106,116.132.235.228,5641,80,6,"Ether / IP / TCP 192.168.0.106:5641 > 116.132.235.228:http S"
116.132.235.228,192.168.0.106,80,5641,6,"Ether / IP / TCP 116.132.235.228:http > 192.168.0.106:5641 SA"
192.168.0.106,116.132.235.228,5641,80,6,"Ether / IP / TCP 192.168.0.106:5641 > 116.132.235.228:http A"
192.168.0.106,116.132.235.228,5641,80,6,"Ether / IP / TCP 192.168.0.106:5641 > 116.132.235.228:http PA / Raw"
192.168.0.106,116.132.235.228,5641,80,6,"Ether / IP / TCP 192.168.0.106:5641 > 116.132.235.228:http A / Raw"
192.168.0.106,116.132.235.228,5641,80,6,"Ether / IP / TCP 192.168.0.106:5641 > 116.132.235.228:http A / Raw"
192.168.0.106,116.132.235.228,5641,80,6,"Ether / IP / TCP 192.168.0.106:5641 > 116.132.235.228:http PA / Raw"
116.132.235.228,192.168.0.106,80,5641,6,"Ether / IP / TCP 116.132.235.228:http > 192.168.0.106:5641 A"
116.132.235.228,192.168.0.106,80,5641,6,"Ether / IP / TCP 116.132.235.228:http > 192.168.0.106:5641 A"
116.132.235.228,192.168.0.106,80,5641,6,"Ether / IP / TCP 116.132.235.228:http > 192.168.0.106:5641 A"
116.132.235.228,192.168.0.106,80,5641,6,"Ether / IP / TCP 116.132.235.228:http > 192.168.0.106:5641 PA / Raw"
116.132.235.228,192.168.0.106,80,5641,6,"Ether / IP / TCP 116.132.235.228:http > 192.168.0.106:5641 FA"
192.168.0.106,116.132.235.228,5641,80,6,"Ether / IP / TCP 192.168.0.106:5641 > 116.132.235.228:http A"
192.168.0.106,116.132.235.228,5641,80,6,"Ether / IP / TCP 192.168.0.106:5641 > 116.132.235.228:http FA"
192.168.0.106,116.132.235.228,5626,80,6,"Ether / IP / TCP 192.168.0.106:5626 > 116.132.235.228:http FA"
192.168.0.106,116.132.235.228,5642,80,6,"Ether / IP / TCP 192.168.0.106:5642 > 116.132.235.228:http S"
116.132.235.228,192.168.0.106,80,5642,6,"Ether / IP / TCP 116.132.235.228:http > 192.168.0.106:5642 SA"
192.168.0.106,116.132.235.228,5642,80,6,"Ether / IP / TCP 192.168.0.106:5642 > 116.132.235.228:http A"
192.168.0.106,116.132.235.228,5642,80,6,"Ether / IP / TCP 192.168.0.106:5642 > 116.132.235.228:http PA / Raw"
192.168.0.106,116.132.235.228,5642,80,6,"Ether / IP / TCP 192.168.0.106:5642 > 116.132.235.228:http A / Raw"
192.168.0.106,116.132.235.228,5642,80,6,"Ether / IP / TCP 192.168.0.106:5642 > 116.132.235.228:http A / Raw"
192.168.0.106,116.132.235.228,5642,80,6,"Ether / IP / TCP 192.168.0.106:5642 > 116.132.235.228:http PA / Raw"
116.132.235.228,192.168.0.106,80,5642,6,"Ether / IP / TCP 116.132.235.228:http > 192.168.0.106:5642 A"
116.132.235.228,192.168.0.106,80,5642,6,"Ether / IP / TCP 116.132.235.228:http > 192.168.0.106:5642 A"
116.132.235.228,192.168.0.106,80,5642,6,"Ether / IP / TCP 116.132.235.228:http > 192.168.0.106:5642 A"
116.132.235.228,192.168.0.106,80,5642,6,"Ether / IP / TCP 116.132.235.228:http > 192.168.0.106:5642 PA / Raw"
116.132.235.228,192.168.0.106,80,5642,6,"Ether / IP / TCP 116.132.235.228:http > 192.168.0.106:5642 FA"
192.168.0.106,116.132.235.228,5642,80,6,"Ether / IP / TCP 192.168.0.106:5642 > 116.132.235.228:http A"
192.168.0.106,116.132.235.228,5642,80,6,"Ether / IP / TCP 192.168.0.106:5642 > 116.132.235.228:http FA"
192.168.0.106,116.132.235.228,5641,80,6,"Ether / IP / TCP 192.168.0.106:5641 > 116.132.235.228:http FA"
192.168.0.106,116.132.235.228,5642,80,6,"Ether / IP / TCP 192.168.0.106:5642 > 116.132.235.228:http FA"
192.168.0.106,116.132.235.228,5641,80,6,"Ether / IP / TCP 192.168.0.106:5641 > 116.132.235.228:http FA"
192.168.0.106,116.132.235.228,5640,80,6,"Ether / IP / TCP 192.168.0.106:5640 > 116.132.235.228:http FA"
192.168.0.106,116.132.235.228,5642,80,6,"Ether / IP / TCP 192.168.0.106:5642 > 116.132.235.228:http FA"
192.168.0.106,116.132.235.228,5637,80,6,"Ether / IP / TCP 192.168.0.106:5637 > 116.132.235.228:http FA"
192.168.0.106,116.132.235.228,5601,80,6,"Ether / IP / TCP 192.168.0.106:5601 > 116.132.235.228:http RA"
192.168.0.106,116.132.235.228,5627,80,6,"Ether / IP / TCP 192.168.0.106:5627 > 116.132.235.228:http FA"
192.168.0.106,116.132.235.228,5643,80,6,"Ether / IP / TCP 192.168.0.106:5643 > 116.132.235.228:http S"
116.132.235.228,192.168.0.106,80,5643,6,"Ether / IP / TCP 116.132.235.228:http > 192.168.0.106:5643 SA"
192.168.0.106,116.132.235.228,5643,80,6,"Ether / IP / TCP 192.168.0.106:5643 > 116.132.235.228:http A"
192.168.0.106,116.132.235.228,5643,80,6,"Ether / IP / TCP 192.168.0.106:5643 > 116.132.235.228:http PA / Raw"
192.168.0.106,116.132.235.228,5643,80,6,"Ether / IP / TCP 192.168.0.106:5643 > 116.132.235.228:http A / Raw"
192.168.0.106,116.132.235.228,5643,80,6,"Ether / IP / TCP 192.168.0.106:5643 > 116.132.235.228:http A / Raw"
192.168.0.106,116.132.235.228,5643,80,6,"Ether / IP / TCP 192.168.0.106:5643 > 116.132.235.228:http PA / Raw"
116.132.235.228,192.168.0.106,80,5643,6,"Ether / IP / TCP 116.132.235.228:http > 192.168.0.106:5643 A"
116.132.235.228,192.168.0.106,80,5643,6,"Ether / IP / TCP 116.132.235.228:http > 192.168.0.106:5643 A"
116.132.235.228,192.168.0.106,80,5643,6,"Ether / IP / TCP 116.132.235.228:http > 192.168.0.106:5643 A"
116.132.235.228,192.168.0.106,80,5643,6,"Ether / IP / TCP 116.132.235.228:http > 192.168.0.106:5643 PA / Raw"
116.132.235.228,192.168.0.106,80,5643,6,"Ether / IP / TCP 116.132.235.228:http > 192.168.0.106:5643 FA"
192.168.0.106,116.132.235.228,5643,80,6,"Ether / IP / TCP 192.168.0.106:5643 > 116.132.235.228:http A"
192.168.0.106,116.132.235.228,5643,80,6,"Ether / IP / TCP 192.168.0.106:5643 > 116.132.235.228:http FA"
192.168.0.106,116.132.235.228,5628,80,6,"Ether / IP / TCP 192.168.0.106:5628 > 116.132.235.228:http FA"
116.132.235.228,192.168.0.106,80,5643,6,"Ether / IP / TCP 116.132.235.228:http > 192.168.0.106:5643 A"
192.168.0.106,20.198.213.74,5630,443,6,"Ether / IP / TCP 192.168.0.106:5630 > 20.198.213.74:https FA"
192.168.0.106,20.198.213.74,5629,443,6,"Ether / IP / TCP 192.168.0.106:5629 > 20.198.213.74:https FA"
192.168.0.106,119.3.178.178,6806,21113,6,"Ether / IP / TCP 192.168.0.106:6806 > 119.3.178.178:21113 A / Raw"
119.3.178.178,192.168.0.106,21113,6806,6,"Ether / IP / TCP 119.3.178.178:21113 > 192.168.0.106:6806 A"
192.168.0.106,116.132.235.228,5641,80,6,"Ether / IP / TCP 192.168.0.106:5641 > 116.132.235.228:http FA"
192.168.0.106,116.132.235.228,5642,80,6,"Ether / IP / TCP 192.168.0.106:5642 > 116.132.235.228:http FA"
192.168.0.106,116.132.235.228,5604,80,6,"Ether / IP / TCP 192.168.0.106:5604 > 116.132.235.228:http RA"
192.168.0.106,116.132.235.228,5644,80,6,"Ether / IP / TCP 192.168.0.106:5644 > 116.132.235.228:http S"
116.132.235.228,192.168.0.106,80,5644,6,"Ether / IP / TCP 116.132.235.228:http > 192.168.0.106:5644 SA"
192.168.0.106,116.132.235.228,5644,80,6,"Ether / IP / TCP 192.168.0.106:5644 > 116.132.235.228:http A"
192.168.0.106,116.132.235.228,5644,80,6,"Ether / IP / TCP 192.168.0.106:5644 > 116.132.235.228:http PA / Raw"
192.168.0.106,116.132.235.228,5644,80,6,"Ether / IP / TCP 192.168.0.106:5644 > 116.132.235.228:http A / Raw"
192.168.0.106,116.132.235.228,5644,80,6,"Ether / IP / TCP 192.168.0.106:5644 > 116.132.235.228:http A / Raw"
192.168.0.106,116.132.235.228,5644,80,6,"Ether / IP / TCP 192.168.0.106:5644 > 116.132.235.228:http PA / Raw"
116.132.235.228,192.168.0.106,80,5644,6,"Ether / IP / TCP 116.132.235.228:http > 192.168.0.106:5644 A"
116.132.235.228,192.168.0.106,80,5644,6,"Ether / IP / TCP 116.132.235.228:http > 192.168.0.106:5644 A"
116.132.235.228,192.168.0.106,80,5644,6,"Ether / IP / TCP 116.132.235.228:http > 192.168.0.106:5644 A"
116.132.235.228,192.168.0.106,80,5644,6,"Ether / IP / TCP 116.132.235.228:http > 192.168.0.106:5644 PA / Raw"
116.132.235.228,192.168.0.106,80,5644,6,"Ether / IP / TCP 116.132.235.228:http > 192.168.0.106:5644 FA"
192.168.0.106,116.132.235.228,5644,80,6,"Ether / IP / TCP 192.168.0.106:5644 > 116.132.235.228:http A"
192.168.0.106,116.132.235.228,5644,80,6,"Ether / IP / TCP 192.168.0.106:5644 > 116.132.235.228:http FA"
192.168.0.106,116.132.235.228,5605,80,6,"Ether / IP / TCP 192.168.0.106:5605 > 116.132.235.228:http RA"
192.168.0.106,116.132.235.228,5633,80,6,"Ether / IP / TCP 192.168.0.106:5633 > 116.132.235.228:http FA"
192.168.0.106,110.242.68.3,5645,80,6,"Ether / IP / TCP 192.168.0.106:5645 > 110.242.68.3:http S"
110.242.68.3,192.168.0.106,80,5645,6,"Ether / IP / TCP 110.242.68.3:http > 192.168.0.106:5645 SA"
192.168.0.106,110.242.68.3,5645,80,6,"Ether / IP / TCP 192.168.0.106:5645 > 110.242.68.3:http A"
192.168.0.106,110.242.68.3,5645,80,6,"Ether / IP / TCP 192.168.0.106:5645 > 110.242.68.3:http FA"
110.242.68.3,192.168.0.106,80,5645,6,"Ether / IP / TCP 110.242.68.3:http > 192.168.0.106:5645 A"
110.242.68.3,192.168.0.106,80,5645,6,"Ether / IP / TCP 110.242.68.3:http > 192.168.0.106:5645 FA"
192.168.0.106,110.242.68.3,5645,80,6,"Ether / IP / TCP 192.168.0.106:5645 > 110.242.68.3:http A"
192.168.0.106,116.132.235.228,5644,80,6,"Ether / IP / TCP 192.168.0.106:5644 > 116.132.235.228:http FA"
192.168.0.106,157.148.62.140,5646,80,6,"Ether / IP / TCP 192.168.0.106:5646 > 157.148.62.140:http S"
157.148.62.140,192.168.0.106,80,5646,6,"Ether / IP / TCP 157.148.62.140:http > 192.168.0.106:5646 SA"
192.168.0.106,157.148.62.140,5646,80,6,"Ether / IP / TCP 192.168.0.106:5646 > 157.148.62.140:http A"
