srcip,dstip,sport,dport,proto,data
42.236.89.187,192.168.0.106,443,7704,6,"Ether / IP / TCP 42.236.89.187:https > 192.168.0.106:7704 A / Raw"
42.236.89.187,192.168.0.106,443,7704,6,"Ether / IP / TCP 42.236.89.187:https > 192.168.0.106:7704 A / Raw"
42.236.89.187,192.168.0.106,443,7704,6,"Ether / IP / TCP 42.236.89.187:https > 192.168.0.106:7704 A / Raw"
42.236.89.187,192.168.0.106,443,7704,6,"Ether / IP / TCP 42.236.89.187:https > 192.168.0.106:7704 A / Raw"
42.236.89.187,192.168.0.106,443,7704,6,"Ether / IP / TCP 42.236.89.187:https > 192.168.0.106:7704 A / Raw"
42.236.89.187,192.168.0.106,443,7704,6,"Ether / IP / TCP 42.236.89.187:https > 192.168.0.106:7704 PA / Raw"
192.168.0.106,42.236.89.187,7704,443,6,"Ether / IP / TCP 192.168.0.106:7704 > 42.236.89.187:https A"
192.168.0.106,42.236.89.187,7704,443,6,"Ether / IP / TCP 192.168.0.106:7704 > 42.236.89.187:https PA / Raw"
192.168.0.106,42.236.89.187,7704,443,6,"Ether / IP / TCP 192.168.0.106:7704 > 42.236.89.187:https FA"
42.236.89.187,192.168.0.106,443,7704,6,"Ether / IP / TCP 42.236.89.187:https > 192.168.0.106:7704 FA"
192.168.0.106,42.236.89.187,7704,443,6,"Ether / IP / TCP 192.168.0.106:7704 > 42.236.89.187:https A"
192.168.0.106,157.255.191.46,7705,80,6,"Ether / IP / TCP 192.168.0.106:7705 > 157.255.191.46:http S"
58.223.1.234,192.168.0.106,8080,7647,6,"Ether / IP / TCP 58.223.1.234:8080 > 192.168.0.106:7647 A / Padding"
58.223.1.234,192.168.0.106,8080,7647,6,"Ether / IP / TCP 58.223.1.234:8080 > 192.168.0.106:7647 A / Padding"
58.223.1.234,192.168.0.106,8080,7647,6,"Ether / IP / TCP 58.223.1.234:8080 > 192.168.0.106:7647 PA / Raw"
58.223.1.234,192.168.0.106,8080,7647,6,"Ether / IP / TCP 58.223.1.234:8080 > 192.168.0.106:7647 FA"
192.168.0.106,58.223.1.234,7647,8080,6,"Ether / IP / TCP 192.168.0.106:7647 > 58.223.1.234:8080 RA"
157.255.191.46,192.168.0.106,80,7701,6,"Ether / IP / TCP 157.255.191.46:http > 192.168.0.106:7701 A / Raw"
157.255.191.46,192.168.0.106,80,7701,6,"Ether / IP / TCP 157.255.191.46:http > 192.168.0.106:7701 PA / Raw"
157.255.191.46,192.168.0.106,80,7701,6,"Ether / IP / TCP 157.255.191.46:http > 192.168.0.106:7701 FA"
192.168.0.106,157.255.191.46,7701,80,6,"Ether / IP / TCP 192.168.0.106:7701 > 157.255.191.46:http A"
192.168.0.106,157.255.191.46,7701,80,6,"Ether / IP / TCP 192.168.0.106:7701 > 157.255.191.46:http FA"
192.168.0.106,157.255.191.89,14800,8080,6,"Ether / IP / TCP 192.168.0.106:14800 > 157.255.191.89:8080 A"
192.168.0.106,157.255.191.46,7706,80,6,"Ether / IP / TCP 192.168.0.106:7706 > 157.255.191.46:http S"
192.168.0.106,157.255.191.46,7707,80,6,"Ether / IP / TCP 192.168.0.106:7707 > 157.255.191.46:http S"
157.255.191.46,192.168.0.106,80,7701,6,"Ether / IP / TCP 157.255.191.46:http > 192.168.0.106:7701 R"
157.255.191.46,192.168.0.106,80,7705,6,"Ether / IP / TCP 157.255.191.46:http > 192.168.0.106:7705 SA"
192.168.0.106,157.255.191.46,7705,80,6,"Ether / IP / TCP 192.168.0.106:7705 > 157.255.191.46:http A"
192.168.0.106,157.255.191.46,7705,80,6,"Ether / IP / TCP 192.168.0.106:7705 > 157.255.191.46:http PA / Raw"
157.255.191.46,192.168.0.106,80,7706,6,"Ether / IP / TCP 157.255.191.46:http > 192.168.0.106:7706 SA"
192.168.0.106,157.255.191.46,7706,80,6,"Ether / IP / TCP 192.168.0.106:7706 > 157.255.191.46:http A"
192.168.0.106,157.255.191.46,7706,80,6,"Ether / IP / TCP 192.168.0.106:7706 > 157.255.191.46:http PA / Raw"
157.255.191.46,192.168.0.106,80,7707,6,"Ether / IP / TCP 157.255.191.46:http > 192.168.0.106:7707 SA"
192.168.0.106,157.255.191.46,7707,80,6,"Ether / IP / TCP 192.168.0.106:7707 > 157.255.191.46:http A"
192.168.0.106,157.255.191.46,7707,80,6,"Ether / IP / TCP 192.168.0.106:7707 > 157.255.191.46:http PA / Raw"
157.255.191.46,192.168.0.106,80,7705,6,"Ether / IP / TCP 157.255.191.46:http > 192.168.0.106:7705 A"
157.255.191.46,192.168.0.106,80,7706,6,"Ether / IP / TCP 157.255.191.46:http > 192.168.0.106:7706 A"
192.168.0.106,157.255.191.46,7708,80,6,"Ether / IP / TCP 192.168.0.106:7708 > 157.255.191.46:http S"
157.255.191.46,192.168.0.106,80,7707,6,"Ether / IP / TCP 157.255.191.46:http > 192.168.0.106:7707 A"
157.255.191.46,192.168.0.106,80,7708,6,"Ether / IP / TCP 157.255.191.46:http > 192.168.0.106:7708 SA"
192.168.0.106,157.255.191.46,7708,80,6,"Ether / IP / TCP 192.168.0.106:7708 > 157.255.191.46:http A"
192.168.0.106,157.255.191.46,7708,80,6,"Ether / IP / TCP 192.168.0.106:7708 > 157.255.191.46:http A / Raw"
192.168.0.106,157.255.191.46,7708,80,6,"Ether / IP / TCP 192.168.0.106:7708 > 157.255.191.46:http A / Raw"
192.168.0.106,157.255.191.46,7708,80,6,"Ether / IP / TCP 192.168.0.106:7708 > 157.255.191.46:http A / Raw"
192.168.0.106,157.255.191.46,7708,80,6,"Ether / IP / TCP 192.168.0.106:7708 > 157.255.191.46:http A / Raw"
192.168.0.106,157.255.191.46,7708,80,6,"Ether / IP / TCP 192.168.0.106:7708 > 157.255.191.46:http PA / Raw"
157.255.191.46,192.168.0.106,80,7708,6,"Ether / IP / TCP 157.255.191.46:http > 192.168.0.106:7708 A"
157.255.191.46,192.168.0.106,80,7705,6,"Ether / IP / TCP 157.255.191.46:http > 192.168.0.106:7705 PA / Raw"
157.255.191.46,192.168.0.106,80,7705,6,"Ether / IP / TCP 157.255.191.46:http > 192.168.0.106:7705 FA"
157.255.191.46,192.168.0.106,80,7708,6,"Ether / IP / TCP 157.255.191.46:http > 192.168.0.106:7708 A"
192.168.0.106,157.255.191.46,7705,80,6,"Ether / IP / TCP 192.168.0.106:7705 > 157.255.191.46:http A"
157.255.191.46,192.168.0.106,80,7708,6,"Ether / IP / TCP 157.255.191.46:http > 192.168.0.106:7708 A"
157.255.191.46,192.168.0.106,80,7708,6,"Ether / IP / TCP 157.255.191.46:http > 192.168.0.106:7708 A"
157.255.191.46,192.168.0.106,80,7708,6,"Ether / IP / TCP 157.255.191.46:http > 192.168.0.106:7708 A"
192.168.0.106,157.255.191.46,7705,80,6,"Ether / IP / TCP 192.168.0.106:7705 > 157.255.191.46:http FA"
157.255.191.46,192.168.0.106,80,7707,6,"Ether / IP / TCP 157.255.191.46:http > 192.168.0.106:7707 PA / Raw"
157.255.191.46,192.168.0.106,80,7707,6,"Ether / IP / TCP 157.255.191.46:http > 192.168.0.106:7707 FA"
192.168.0.106,157.255.191.46,7707,80,6,"Ether / IP / TCP 192.168.0.106:7707 > 157.255.191.46:http A"
192.168.0.106,157.255.191.46,7707,80,6,"Ether / IP / TCP 192.168.0.106:7707 > 157.255.191.46:http FA"
157.255.191.46,192.168.0.106,80,7705,6,"Ether / IP / TCP 157.255.191.46:http > 192.168.0.106:7705 R"
192.168.0.106,192.168.0.1,60618,53,17,"Ether / IP / UDP / DNS Qry ""b'dns.msftncsi.com.'"" "
192.168.0.106,157.255.191.46,7698,80,6,"Ether / IP / TCP 192.168.0.106:7698 > 157.255.191.46:http FA"
192.168.0.1,192.168.0.106,53,60618,17,"Ether / IP / UDP / DNS Ans ""fd3e:4f5a:5b81::1"" "
192.168.0.106,192.168.0.1,13404,53,6,"Ether / IP / TCP 192.168.0.106:13404 > 192.168.0.1:domain S"
157.255.191.46,192.168.0.106,80,7707,6,"Ether / IP / TCP 157.255.191.46:http > 192.168.0.106:7707 A"
192.168.0.1,192.168.0.106,53,13404,6,"Ether / IP / TCP 192.168.0.1:domain > 192.168.0.106:13404 RA"
157.255.191.46,192.168.0.106,80,7706,6,"Ether / IP / TCP 157.255.191.46:http > 192.168.0.106:7706 A / Raw"
157.255.191.46,192.168.0.106,80,7706,6,"Ether / IP / TCP 157.255.191.46:http > 192.168.0.106:7706 PA / Raw"
157.255.191.46,192.168.0.106,80,7706,6,"Ether / IP / TCP 157.255.191.46:http > 192.168.0.106:7706 FA"
192.168.0.106,157.255.191.46,7706,80,6,"Ether / IP / TCP 192.168.0.106:7706 > 157.255.191.46:http A"
192.168.0.106,157.255.191.46,7706,80,6,"Ether / IP / TCP 192.168.0.106:7706 > 157.255.191.46:http FA"
192.168.0.106,157.255.4.143,13405,80,6,"Ether / IP / TCP 192.168.0.106:13405 > 157.255.4.143:http S"
157.255.4.143,192.168.0.106,80,13405,6,"Ether / IP / TCP 157.255.4.143:http > 192.168.0.106:13405 SA"
192.168.0.106,157.255.4.143,13405,80,6,"Ether / IP / TCP 192.168.0.106:13405 > 157.255.4.143:http A"
192.168.0.106,157.255.4.143,13405,80,6,"Ether / IP / TCP 192.168.0.106:13405 > 157.255.4.143:http PA / Raw"
157.255.4.143,192.168.0.106,80,13405,6,"Ether / IP / TCP 157.255.4.143:http > 192.168.0.106:13405 A"
157.255.191.46,192.168.0.106,80,7708,6,"Ether / IP / TCP 157.255.191.46:http > 192.168.0.106:7708 A / Raw"
157.255.191.46,192.168.0.106,80,7708,6,"Ether / IP / TCP 157.255.191.46:http > 192.168.0.106:7708 PA / Raw"
157.255.191.46,192.168.0.106,80,7708,6,"Ether / IP / TCP 157.255.191.46:http > 192.168.0.106:7708 FA"
192.168.0.106,157.255.191.46,7708,80,6,"Ether / IP / TCP 192.168.0.106:7708 > 157.255.191.46:http A"
192.168.0.106,157.255.191.46,7708,80,6,"Ether / IP / TCP 192.168.0.106:7708 > 157.255.191.46:http FA"
157.255.4.143,192.168.0.106,80,13405,6,"Ether / IP / TCP 157.255.4.143:http > 192.168.0.106:13405 A / Raw"
157.255.4.143,192.168.0.106,80,13405,6,"Ether / IP / TCP 157.255.4.143:http > 192.168.0.106:13405 A / Raw"
157.255.4.143,192.168.0.106,80,13405,6,"Ether / IP / TCP 157.255.4.143:http > 192.168.0.106:13405 PA / Raw"
192.168.0.106,157.255.4.143,13405,80,6,"Ether / IP / TCP 192.168.0.106:13405 > 157.255.4.143:http A"
192.168.0.106,157.255.4.143,13405,80,6,"Ether / IP / TCP 192.168.0.106:13405 > 157.255.4.143:http A"
192.168.0.106,157.255.4.143,13405,80,6,"Ether / IP / TCP 192.168.0.106:13405 > 157.255.4.143:http FA"
192.168.0.106,157.255.191.46,13406,80,6,"Ether / IP / TCP 192.168.0.106:13406 > 157.255.191.46:http S"
157.255.191.46,192.168.0.106,80,7708,6,"Ether / IP / TCP 157.255.191.46:http > 192.168.0.106:7708 R"
157.255.4.143,192.168.0.106,80,13405,6,"Ether / IP / TCP 157.255.4.143:http > 192.168.0.106:13405 FA"
192.168.0.106,157.255.4.143,13405,80,6,"Ether / IP / TCP 192.168.0.106:13405 > 157.255.4.143:http A"
157.255.191.46,192.168.0.106,80,13406,6,"Ether / IP / TCP 157.255.191.46:http > 192.168.0.106:13406 SA"
192.168.0.106,157.255.191.46,13406,80,6,"Ether / IP / TCP 192.168.0.106:13406 > 157.255.191.46:http A"
192.168.0.106,157.255.191.46,13406,80,6,"Ether / IP / TCP 192.168.0.106:13406 > 157.255.191.46:http A / Raw"
192.168.0.106,157.255.191.46,13406,80,6,"Ether / IP / TCP 192.168.0.106:13406 > 157.255.191.46:http A / Raw"
192.168.0.106,157.255.191.46,13406,80,6,"Ether / IP / TCP 192.168.0.106:13406 > 157.255.191.46:http A / Raw"
192.168.0.106,157.255.191.46,13406,80,6,"Ether / IP / TCP 192.168.0.106:13406 > 157.255.191.46:http A / Raw"
192.168.0.106,157.255.191.46,13406,80,6,"Ether / IP / TCP 192.168.0.106:13406 > 157.255.191.46:http PA / Raw"
157.255.191.46,192.168.0.106,80,13406,6,"Ether / IP / TCP 157.255.191.46:http > 192.168.0.106:13406 A"
157.255.191.46,192.168.0.106,80,13406,6,"Ether / IP / TCP 157.255.191.46:http > 192.168.0.106:13406 A"
157.255.191.46,192.168.0.106,80,13406,6,"Ether / IP / TCP 157.255.191.46:http > 192.168.0.106:13406 A"
157.255.191.46,192.168.0.106,80,13406,6,"Ether / IP / TCP 157.255.191.46:http > 192.168.0.106:13406 A"
157.255.191.46,192.168.0.106,80,13406,6,"Ether / IP / TCP 157.255.191.46:http > 192.168.0.106:13406 A"
192.168.0.106,157.255.191.46,7706,80,6,"Ether / IP / TCP 192.168.0.106:7706 > 157.255.191.46:http FA"
157.255.191.46,192.168.0.106,80,7706,6,"Ether / IP / TCP 157.255.191.46:http > 192.168.0.106:7706 R"
192.168.0.106,157.255.191.46,7678,80,6,"Ether / IP / TCP 192.168.0.106:7678 > 157.255.191.46:http FA"
157.255.191.46,192.168.0.106,80,13406,6,"Ether / IP / TCP 157.255.191.46:http > 192.168.0.106:13406 A / Raw"
157.255.191.46,192.168.0.106,80,13406,6,"Ether / IP / TCP 157.255.191.46:http > 192.168.0.106:13406 PA / Raw"
157.255.191.46,192.168.0.106,80,13406,6,"Ether / IP / TCP 157.255.191.46:http > 192.168.0.106:13406 FA"
192.168.0.106,157.255.191.46,13406,80,6,"Ether / IP / TCP 192.168.0.106:13406 > 157.255.191.46:http A"
192.168.0.106,157.255.191.46,13406,80,6,"Ether / IP / TCP 192.168.0.106:13406 > 157.255.191.46:http FA"
192.168.0.106,192.168.0.1,13404,53,6,"Ether / IP / TCP 192.168.0.106:13404 > 192.168.0.1:domain S"
192.168.0.1,192.168.0.106,53,13404,6,"Ether / IP / TCP 192.168.0.1:domain > 192.168.0.106:13404 RA"
192.168.0.106,192.168.0.1,50337,53,17,"Ether / IP / UDP / DNS Qry ""b'dns.msftncsi.com.'"" "
157.255.191.46,192.168.0.106,80,13406,6,"Ether / IP / TCP 157.255.191.46:http > 192.168.0.106:13406 A"
192.168.0.1,192.168.0.106,53,50337,17,"Ether / IP / UDP / DNS Ans ""fd3e:4f5a:5b81::1"" "
192.168.0.106,157.255.191.46,13407,80,6,"Ether / IP / TCP 192.168.0.106:13407 > 157.255.191.46:http S"
157.255.191.46,192.168.0.106,80,13407,6,"Ether / IP / TCP 157.255.191.46:http > 192.168.0.106:13407 SA"
192.168.0.106,157.255.191.46,13407,80,6,"Ether / IP / TCP 192.168.0.106:13407 > 157.255.191.46:http A"
192.168.0.106,157.255.191.46,13407,80,6,"Ether / IP / TCP 192.168.0.106:13407 > 157.255.191.46:http A / Raw"
192.168.0.106,157.255.191.46,13407,80,6,"Ether / IP / TCP 192.168.0.106:13407 > 157.255.191.46:http A / Raw"
192.168.0.106,157.255.191.46,13407,80,6,"Ether / IP / TCP 192.168.0.106:13407 > 157.255.191.46:http A / Raw"
192.168.0.106,157.255.191.46,13407,80,6,"Ether / IP / TCP 192.168.0.106:13407 > 157.255.191.46:http A / Raw"
192.168.0.106,157.255.191.46,13407,80,6,"Ether / IP / TCP 192.168.0.106:13407 > 157.255.191.46:http PA / Raw"
157.255.191.46,192.168.0.106,80,13407,6,"Ether / IP / TCP 157.255.191.46:http > 192.168.0.106:13407 A"
157.255.191.46,192.168.0.106,80,13407,6,"Ether / IP / TCP 157.255.191.46:http > 192.168.0.106:13407 A"
157.255.191.46,192.168.0.106,80,13407,6,"Ether / IP / TCP 157.255.191.46:http > 192.168.0.106:13407 A"
157.255.191.46,192.168.0.106,80,13407,6,"Ether / IP / TCP 157.255.191.46:http > 192.168.0.106:13407 A"
157.255.191.46,192.168.0.106,80,13407,6,"Ether / IP / TCP 157.255.191.46:http > 192.168.0.106:13407 A"
157.255.191.46,192.168.0.106,80,13407,6,"Ether / IP / TCP 157.255.191.46:http > 192.168.0.106:13407 A / Raw"
157.255.191.46,192.168.0.106,80,13407,6,"Ether / IP / TCP 157.255.191.46:http > 192.168.0.106:13407 PA / Raw"
157.255.191.46,192.168.0.106,80,13407,6,"Ether / IP / TCP 157.255.191.46:http > 192.168.0.106:13407 FA"
192.168.0.106,157.255.191.46,13407,80,6,"Ether / IP / TCP 192.168.0.106:13407 > 157.255.191.46:http A"
192.168.0.106,157.255.191.46,13407,80,6,"Ether / IP / TCP 192.168.0.106:13407 > 157.255.191.46:http FA"
192.168.0.106,116.132.235.204,13408,80,6,"Ether / IP / TCP 192.168.0.106:13408 > 116.132.235.204:http S"
116.132.235.204,192.168.0.106,80,13408,6,"Ether / IP / TCP 116.132.235.204:http > 192.168.0.106:13408 SA"
192.168.0.106,116.132.235.204,13408,80,6,"Ether / IP / TCP 192.168.0.106:13408 > 116.132.235.204:http A"
192.168.0.106,116.132.235.204,13408,80,6,"Ether / IP / TCP 192.168.0.106:13408 > 116.132.235.204:http PA / Raw"
192.168.0.106,116.132.235.204,13408,80,6,"Ether / IP / TCP 192.168.0.106:13408 > 116.132.235.204:http A / Raw"
192.168.0.106,116.132.235.204,13408,80,6,"Ether / IP / TCP 192.168.0.106:13408 > 116.132.235.204:http A / Raw"
192.168.0.106,116.132.235.204,13408,80,6,"Ether / IP / TCP 192.168.0.106:13408 > 116.132.235.204:http PA / Raw"
192.168.0.106,192.168.0.1,13404,53,6,"Ether / IP / TCP 192.168.0.106:13404 > 192.168.0.1:domain S"
192.168.0.1,192.168.0.106,53,13404,6,"Ether / IP / TCP 192.168.0.1:domain > 192.168.0.106:13404 RA"
116.132.235.204,192.168.0.106,80,13408,6,"Ether / IP / TCP 116.132.235.204:http > 192.168.0.106:13408 A"
116.132.235.204,192.168.0.106,80,13408,6,"Ether / IP / TCP 116.132.235.204:http > 192.168.0.106:13408 A"
116.132.235.204,192.168.0.106,80,13408,6,"Ether / IP / TCP 116.132.235.204:http > 192.168.0.106:13408 A"
116.132.235.204,192.168.0.106,80,13408,6,"Ether / IP / TCP 116.132.235.204:http > 192.168.0.106:13408 PA / Raw"
116.132.235.204,192.168.0.106,80,13408,6,"Ether / IP / TCP 116.132.235.204:http > 192.168.0.106:13408 FA"
192.168.0.106,116.132.235.204,13408,80,6,"Ether / IP / TCP 192.168.0.106:13408 > 116.132.235.204:http A"
192.168.0.106,116.132.235.204,13408,80,6,"Ether / IP / TCP 192.168.0.106:13408 > 116.132.235.204:http FA"
116.132.235.204,192.168.0.106,80,13408,6,"Ether / IP / TCP 116.132.235.204:http > 192.168.0.106:13408 A"
192.168.0.106,116.132.235.204,13410,80,6,"Ether / IP / TCP 192.168.0.106:13410 > 116.132.235.204:http S"
116.132.235.204,192.168.0.106,80,13410,6,"Ether / IP / TCP 116.132.235.204:http > 192.168.0.106:13410 SA"
192.168.0.106,116.132.235.204,13410,80,6,"Ether / IP / TCP 192.168.0.106:13410 > 116.132.235.204:http A"
192.168.0.106,116.132.235.204,13410,80,6,"Ether / IP / TCP 192.168.0.106:13410 > 116.132.235.204:http PA / Raw"
192.168.0.106,116.132.235.204,13410,80,6,"Ether / IP / TCP 192.168.0.106:13410 > 116.132.235.204:http A / Raw"
192.168.0.106,116.132.235.204,13410,80,6,"Ether / IP / TCP 192.168.0.106:13410 > 116.132.235.204:http A / Raw"
192.168.0.106,116.132.235.204,13410,80,6,"Ether / IP / TCP 192.168.0.106:13410 > 116.132.235.204:http PA / Raw"
116.132.235.204,192.168.0.106,80,13410,6,"Ether / IP / TCP 116.132.235.204:http > 192.168.0.106:13410 A"
116.132.235.204,192.168.0.106,80,13410,6,"Ether / IP / TCP 116.132.235.204:http > 192.168.0.106:13410 A"
116.132.235.204,192.168.0.106,80,13410,6,"Ether / IP / TCP 116.132.235.204:http > 192.168.0.106:13410 A"
116.132.235.204,192.168.0.106,80,13410,6,"Ether / IP / TCP 116.132.235.204:http > 192.168.0.106:13410 PA / Raw"
116.132.235.204,192.168.0.106,80,13410,6,"Ether / IP / TCP 116.132.235.204:http > 192.168.0.106:13410 FA"
192.168.0.106,116.132.235.204,13410,80,6,"Ether / IP / TCP 192.168.0.106:13410 > 116.132.235.204:http A"
192.168.0.106,116.132.235.204,13410,80,6,"Ether / IP / TCP 192.168.0.106:13410 > 116.132.235.204:http FA"
116.132.235.204,192.168.0.106,80,13410,6,"Ether / IP / TCP 116.132.235.204:http > 192.168.0.106:13410 A"
192.168.0.106,157.255.191.46,13407,80,6,"Ether / IP / TCP 192.168.0.106:13407 > 157.255.191.46:http FA"
192.168.0.106,157.255.191.46,7698,80,6,"Ether / IP / TCP 192.168.0.106:7698 > 157.255.191.46:http FA"
192.168.0.106,192.168.0.1,13404,53,6,"Ether / IP / TCP 192.168.0.106:13404 > 192.168.0.1:domain S"
192.168.0.1,192.168.0.106,53,13404,6,"Ether / IP / TCP 192.168.0.1:domain > 192.168.0.106:13404 RA"
192.168.0.106,157.255.191.46,13407,80,6,"Ether / IP / TCP 192.168.0.106:13407 > 157.255.191.46:http FA"
192.168.0.106,192.168.0.1,63843,53,17,"Ether / IP / UDP / DNS Qry ""b'www.baidu.com.'"" "
192.168.0.1,192.168.0.106,53,63843,17,"Ether / IP / UDP / DNS Ans ""b'www.a.shifen.com.'"" "
192.168.0.106,110.242.68.3,13411,80,6,"Ether / IP / TCP 192.168.0.106:13411 > 110.242.68.3:http S"
110.242.68.3,192.168.0.106,80,13411,6,"Ether / IP / TCP 110.242.68.3:http > 192.168.0.106:13411 SA"
192.168.0.106,110.242.68.3,13411,80,6,"Ether / IP / TCP 192.168.0.106:13411 > 110.242.68.3:http A"
192.168.0.106,110.242.68.3,13411,80,6,"Ether / IP / TCP 192.168.0.106:13411 > 110.242.68.3:http FA"
110.242.68.3,192.168.0.106,80,13411,6,"Ether / IP / TCP 110.242.68.3:http > 192.168.0.106:13411 A"
110.242.68.3,192.168.0.106,80,13411,6,"Ether / IP / TCP 110.242.68.3:http > 192.168.0.106:13411 FA"
192.168.0.106,110.242.68.3,13411,80,6,"Ether / IP / TCP 192.168.0.106:13411 > 110.242.68.3:http A"
192.168.0.106,157.255.191.46,7657,80,6,"Ether / IP / TCP 192.168.0.106:7657 > 157.255.191.46:http FA"
192.168.0.106,116.132.235.204,13412,80,6,"Ether / IP / TCP 192.168.0.106:13412 > 116.132.235.204:http S"
116.132.235.204,192.168.0.106,80,13412,6,"Ether / IP / TCP 116.132.235.204:http > 192.168.0.106:13412 SA"
192.168.0.106,116.132.235.204,13412,80,6,"Ether / IP / TCP 192.168.0.106:13412 > 116.132.235.204:http A"
192.168.0.106,116.132.235.204,13412,80,6,"Ether / IP / TCP 192.168.0.106:13412 > 116.132.235.204:http PA / Raw"
192.168.0.106,116.132.235.204,13412,80,6,"Ether / IP / TCP 192.168.0.106:13412 > 116.132.235.204:http A / Raw"
192.168.0.106,116.132.235.204,13412,80,6,"Ether / IP / TCP 192.168.0.106:13412 > 116.132.235.204:http A / Raw"
192.168.0.106,116.132.235.204,13412,80,6,"Ether / IP / TCP 192.168.0.106:13412 > 116.132.235.204:http PA / Raw"
116.132.235.204,192.168.0.106,80,13412,6,"Ether / IP / TCP 116.132.235.204:http > 192.168.0.106:13412 A"
116.132.235.204,192.168.0.106,80,13412,6,"Ether / IP / TCP 116.132.235.204:http > 192.168.0.106:13412 A"
116.132.235.204,192.168.0.106,80,13412,6,"Ether / IP / TCP 116.132.235.204:http > 192.168.0.106:13412 A"
116.132.235.204,192.168.0.106,80,13412,6,"Ether / IP / TCP 116.132.235.204:http > 192.168.0.106:13412 PA / Raw"
116.132.235.204,192.168.0.106,80,13412,6,"Ether / IP / TCP 116.132.235.204:http > 192.168.0.106:13412 FA"
192.168.0.106,116.132.235.204,13412,80,6,"Ether / IP / TCP 192.168.0.106:13412 > 116.132.235.204:http A"
192.168.0.106,116.132.235.204,13412,80,6,"Ether / IP / TCP 192.168.0.106:13412 > 116.132.235.204:http FA"
116.132.235.204,192.168.0.106,80,13412,6,"Ether / IP / TCP 116.132.235.204:http > 192.168.0.106:13412 A"
192.168.0.106,157.255.191.46,7678,80,6,"Ether / IP / TCP 192.168.0.106:7678 > 157.255.191.46:http FA"
192.168.0.106,157.255.191.46,13407,80,6,"Ether / IP / TCP 192.168.0.106:13407 > 157.255.191.46:http FA"
192.168.0.106,116.132.235.204,13413,80,6,"Ether / IP / TCP 192.168.0.106:13413 > 116.132.235.204:http S"
116.132.235.204,192.168.0.106,80,13413,6,"Ether / IP / TCP 116.132.235.204:http > 192.168.0.106:13413 SA"
192.168.0.106,116.132.235.204,13413,80,6,"Ether / IP / TCP 192.168.0.106:13413 > 116.132.235.204:http A"
192.168.0.106,116.132.235.204,13413,80,6,"Ether / IP / TCP 192.168.0.106:13413 > 116.132.235.204:http PA / Raw"
192.168.0.106,116.132.235.204,13413,80,6,"Ether / IP / TCP 192.168.0.106:13413 > 116.132.235.204:http A / Raw"
192.168.0.106,116.132.235.204,13413,80,6,"Ether / IP / TCP 192.168.0.106:13413 > 116.132.235.204:http A / Raw"
192.168.0.106,116.132.235.204,13413,80,6,"Ether / IP / TCP 192.168.0.106:13413 > 116.132.235.204:http PA / Raw"
116.132.235.204,192.168.0.106,80,13413,6,"Ether / IP / TCP 116.132.235.204:http > 192.168.0.106:13413 A"
116.132.235.204,192.168.0.106,80,13413,6,"Ether / IP / TCP 116.132.235.204:http > 192.168.0.106:13413 A"
116.132.235.204,192.168.0.106,80,13413,6,"Ether / IP / TCP 116.132.235.204:http > 192.168.0.106:13413 PA / Raw"
116.132.235.204,192.168.0.106,80,13413,6,"Ether / IP / TCP 116.132.235.204:http > 192.168.0.106:13413 FA"
192.168.0.106,116.132.235.204,13413,80,6,"Ether / IP / TCP 192.168.0.106:13413 > 116.132.235.204:http A"
192.168.0.106,116.132.235.204,13413,80,6,"Ether / IP / TCP 192.168.0.106:13413 > 116.132.235.204:http FA"
192.168.0.106,157.255.191.46,7698,80,6,"Ether / IP / TCP 192.168.0.106:7698 > 157.255.191.46:http FA"
192.168.0.106,202.112.14.6,7364,443,6,"Ether / IP / TCP 192.168.0.106:7364 > 202.112.14.6:https FA"
192.168.0.106,202.112.14.6,7364,443,6,"Ether / IP / TCP 192.168.0.106:7364 > 202.112.14.6:https RA"
202.112.14.6,192.168.0.106,443,7364,6,"Ether / IP / TCP 202.112.14.6:https > 192.168.0.106:7364 R"
192.168.0.106,13.89.178.26,6981,443,6,"Ether / IP / TCP 192.168.0.106:6981 > 13.89.178.26:https PA / Raw"
192.168.0.106,13.89.178.26,6981,443,6,"Ether / IP / TCP 192.168.0.106:6981 > 13.89.178.26:https PA / Raw"
192.168.0.106,116.132.235.204,13413,80,6,"Ether / IP / TCP 192.168.0.106:13413 > 116.132.235.204:http FA"
13.89.178.26,192.168.0.106,443,6981,6,"Ether / IP / TCP 13.89.178.26:https > 192.168.0.106:6981 A / Padding"
13.89.178.26,192.168.0.106,443,6981,6,"Ether / IP / TCP 13.89.178.26:https > 192.168.0.106:6981 PA / Raw"
13.89.178.26,192.168.0.106,443,6981,6,"Ether / IP / TCP 13.89.178.26:https > 192.168.0.106:6981 PA / Raw"
192.168.0.106,13.89.178.26,6981,443,6,"Ether / IP / TCP 192.168.0.106:6981 > 13.89.178.26:https A"
192.168.0.106,13.89.178.26,6981,443,6,"Ether / IP / TCP 192.168.0.106:6981 > 13.89.178.26:https PA / Raw"
13.89.178.26,192.168.0.106,443,6981,6,"Ether / IP / TCP 13.89.178.26:https > 192.168.0.106:6981 A / Padding"
192.168.0.106,116.132.235.204,13413,80,6,"Ether / IP / TCP 192.168.0.106:13413 > 116.132.235.204:http FA"
192.168.0.106,116.132.235.204,13415,80,6,"Ether / IP / TCP 192.168.0.106:13415 > 116.132.235.204:http S"
116.132.235.204,192.168.0.106,80,13415,6,"Ether / IP / TCP 116.132.235.204:http > 192.168.0.106:13415 SA"
192.168.0.106,116.132.235.204,13415,80,6,"Ether / IP / TCP 192.168.0.106:13415 > 116.132.235.204:http A"
192.168.0.106,116.132.235.204,13415,80,6,"Ether / IP / TCP 192.168.0.106:13415 > 116.132.235.204:http PA / Raw"
192.168.0.106,116.132.235.204,13415,80,6,"Ether / IP / TCP 192.168.0.106:13415 > 116.132.235.204:http A / Raw"
192.168.0.106,116.132.235.204,13415,80,6,"Ether / IP / TCP 192.168.0.106:13415 > 116.132.235.204:http A / Raw"
192.168.0.106,116.132.235.204,13415,80,6,"Ether / IP / TCP 192.168.0.106:13415 > 116.132.235.204:http PA / Raw"
116.132.235.204,192.168.0.106,80,13415,6,"Ether / IP / TCP 116.132.235.204:http > 192.168.0.106:13415 A"
116.132.235.204,192.168.0.106,80,13415,6,"Ether / IP / TCP 116.132.235.204:http > 192.168.0.106:13415 A"
116.132.235.204,192.168.0.106,80,13415,6,"Ether / IP / TCP 116.132.235.204:http > 192.168.0.106:13415 PA / Raw"
116.132.235.204,192.168.0.106,80,13415,6,"Ether / IP / TCP 116.132.235.204:http > 192.168.0.106:13415 FA"
192.168.0.106,116.132.235.204,13415,80,6,"Ether / IP / TCP 192.168.0.106:13415 > 116.132.235.204:http A"
192.168.0.106,116.132.235.204,13415,80,6,"Ether / IP / TCP 192.168.0.106:13415 > 116.132.235.204:http FA"
116.132.235.204,192.168.0.106,80,13415,6,"Ether / IP / TCP 116.132.235.204:http > 192.168.0.106:13415 A"
192.168.0.106,116.132.235.204,13416,80,6,"Ether / IP / TCP 192.168.0.106:13416 > 116.132.235.204:http S"
116.132.235.204,192.168.0.106,80,13416,6,"Ether / IP / TCP 116.132.235.204:http > 192.168.0.106:13416 SA"
192.168.0.106,116.132.235.204,13416,80,6,"Ether / IP / TCP 192.168.0.106:13416 > 116.132.235.204:http A"
192.168.0.106,116.132.235.204,13416,80,6,"Ether / IP / TCP 192.168.0.106:13416 > 116.132.235.204:http PA / Raw"
192.168.0.106,116.132.235.204,13416,80,6,"Ether / IP / TCP 192.168.0.106:13416 > 116.132.235.204:http A / Raw"
192.168.0.106,116.132.235.204,13416,80,6,"Ether / IP / TCP 192.168.0.106:13416 > 116.132.235.204:http A / Raw"
192.168.0.106,116.132.235.204,13416,80,6,"Ether / IP / TCP 192.168.0.106:13416 > 116.132.235.204:http PA / Raw"
116.132.235.204,192.168.0.106,80,13416,6,"Ether / IP / TCP 116.132.235.204:http > 192.168.0.106:13416 A"
116.132.235.204,192.168.0.106,80,13416,6,"Ether / IP / TCP 116.132.235.204:http > 192.168.0.106:13416 A"
116.132.235.204,192.168.0.106,80,13416,6,"Ether / IP / TCP 116.132.235.204:http > 192.168.0.106:13416 PA / Raw"
116.132.235.204,192.168.0.106,80,13416,6,"Ether / IP / TCP 116.132.235.204:http > 192.168.0.106:13416 FA"
192.168.0.106,116.132.235.204,13416,80,6,"Ether / IP / TCP 192.168.0.106:13416 > 116.132.235.204:http A"
192.168.0.106,116.132.235.204,13416,80,6,"Ether / IP / TCP 192.168.0.106:13416 > 116.132.235.204:http FA"
116.132.235.204,192.168.0.106,80,13416,6,"Ether / IP / TCP 116.132.235.204:http > 192.168.0.106:13416 A"
192.168.0.106,13.89.178.26,6981,443,6,"Ether / IP / TCP 192.168.0.106:6981 > 13.89.178.26:https PA / Raw"
192.168.0.106,13.89.178.26,6981,443,6,"Ether / IP / TCP 192.168.0.106:6981 > 13.89.178.26:https PA / Raw"
13.89.178.26,192.168.0.106,443,6981,6,"Ether / IP / TCP 13.89.178.26:https > 192.168.0.106:6981 A / Padding"
13.89.178.26,192.168.0.106,443,6981,6,"Ether / IP / TCP 13.89.178.26:https > 192.168.0.106:6981 PA / Raw"
13.89.178.26,192.168.0.106,443,6981,6,"Ether / IP / TCP 13.89.178.26:https > 192.168.0.106:6981 PA / Raw"
192.168.0.106,13.89.178.26,6981,443,6,"Ether / IP / TCP 192.168.0.106:6981 > 13.89.178.26:https A"
192.168.0.106,157.255.191.46,13407,80,6,"Ether / IP / TCP 192.168.0.106:13407 > 157.255.191.46:http FA"
192.168.0.106,116.132.235.204,13413,80,6,"Ether / IP / TCP 192.168.0.106:13413 > 116.132.235.204:http FA"
192.168.0.106,116.132.235.204,13417,80,6,"Ether / IP / TCP 192.168.0.106:13417 > 116.132.235.204:http S"
116.132.235.204,192.168.0.106,80,13417,6,"Ether / IP / TCP 116.132.235.204:http > 192.168.0.106:13417 SA"
192.168.0.106,116.132.235.204,13417,80,6,"Ether / IP / TCP 192.168.0.106:13417 > 116.132.235.204:http A"
192.168.0.106,116.132.235.204,13417,80,6,"Ether / IP / TCP 192.168.0.106:13417 > 116.132.235.204:http PA / Raw"
192.168.0.106,116.132.235.204,13417,80,6,"Ether / IP / TCP 192.168.0.106:13417 > 116.132.235.204:http A / Raw"
192.168.0.106,116.132.235.204,13417,80,6,"Ether / IP / TCP 192.168.0.106:13417 > 116.132.235.204:http A / Raw"
192.168.0.106,116.132.235.204,13417,80,6,"Ether / IP / TCP 192.168.0.106:13417 > 116.132.235.204:http PA / Raw"
116.132.235.204,192.168.0.106,80,13417,6,"Ether / IP / TCP 116.132.235.204:http > 192.168.0.106:13417 A"
116.132.235.204,192.168.0.106,80,13417,6,"Ether / IP / TCP 116.132.235.204:http > 192.168.0.106:13417 A"
116.132.235.204,192.168.0.106,80,13417,6,"Ether / IP / TCP 116.132.235.204:http > 192.168.0.106:13417 A"
116.132.235.204,192.168.0.106,80,13417,6,"Ether / IP / TCP 116.132.235.204:http > 192.168.0.106:13417 PA / Raw"
116.132.235.204,192.168.0.106,80,13417,6,"Ether / IP / TCP 116.132.235.204:http > 192.168.0.106:13417 FA"
192.168.0.106,116.132.235.204,13417,80,6,"Ether / IP / TCP 192.168.0.106:13417 > 116.132.235.204:http A"
192.168.0.106,116.132.235.204,13417,80,6,"Ether / IP / TCP 192.168.0.106:13417 > 116.132.235.204:http FA"
116.132.235.204,192.168.0.106,80,13417,6,"Ether / IP / TCP 116.132.235.204:http > 192.168.0.106:13417 A"
192.168.0.106,13.89.178.26,6981,443,6,"Ether / IP / TCP 192.168.0.106:6981 > 13.89.178.26:https PA / Raw"
192.168.0.106,13.89.178.26,6981,443,6,"Ether / IP / TCP 192.168.0.106:6981 > 13.89.178.26:https PA / Raw"
13.89.178.26,192.168.0.106,443,6981,6,"Ether / IP / TCP 13.89.178.26:https > 192.168.0.106:6981 A / Padding"
13.89.178.26,192.168.0.106,443,6981,6,"Ether / IP / TCP 13.89.178.26:https > 192.168.0.106:6981 PA / Raw"
13.89.178.26,192.168.0.106,443,6981,6,"Ether / IP / TCP 13.89.178.26:https > 192.168.0.106:6981 PA / Raw"
192.168.0.106,13.89.178.26,6981,443,6,"Ether / IP / TCP 192.168.0.106:6981 > 13.89.178.26:https A"
192.168.0.106,116.132.235.204,13419,80,6,"Ether / IP / TCP 192.168.0.106:13419 > 116.132.235.204:http S"
116.132.235.204,192.168.0.106,80,13419,6,"Ether / IP / TCP 116.132.235.204:http > 192.168.0.106:13419 SA"
192.168.0.106,116.132.235.204,13419,80,6,"Ether / IP / TCP 192.168.0.106:13419 > 116.132.235.204:http A"
192.168.0.106,116.132.235.204,13419,80,6,"Ether / IP / TCP 192.168.0.106:13419 > 116.132.235.204:http PA / Raw"
192.168.0.106,116.132.235.204,13419,80,6,"Ether / IP / TCP 192.168.0.106:13419 > 116.132.235.204:http A / Raw"
192.168.0.106,116.132.235.204,13419,80,6,"Ether / IP / TCP 192.168.0.106:13419 > 116.132.235.204:http A / Raw"
192.168.0.106,116.132.235.204,13419,80,6,"Ether / IP / TCP 192.168.0.106:13419 > 116.132.235.204:http PA / Raw"
116.132.235.204,192.168.0.106,80,13419,6,"Ether / IP / TCP 116.132.235.204:http > 192.168.0.106:13419 A"
116.132.235.204,192.168.0.106,80,13419,6,"Ether / IP / TCP 116.132.235.204:http > 192.168.0.106:13419 A"
116.132.235.204,192.168.0.106,80,13419,6,"Ether / IP / TCP 116.132.235.204:http > 192.168.0.106:13419 A"
116.132.235.204,192.168.0.106,80,13419,6,"Ether / IP / TCP 116.132.235.204:http > 192.168.0.106:13419 PA / Raw"
116.132.235.204,192.168.0.106,80,13419,6,"Ether / IP / TCP 116.132.235.204:http > 192.168.0.106:13419 FA"
192.168.0.106,116.132.235.204,13419,80,6,"Ether / IP / TCP 192.168.0.106:13419 > 116.132.235.204:http A"
192.168.0.106,116.132.235.204,13419,80,6,"Ether / IP / TCP 192.168.0.106:13419 > 116.132.235.204:http FA"
192.168.0.106,157.255.191.46,7657,80,6,"Ether / IP / TCP 192.168.0.106:7657 > 157.255.191.46:http FA"
116.132.235.204,192.168.0.106,80,13419,6,"Ether / IP / TCP 116.132.235.204:http > 192.168.0.106:13419 A"
192.168.0.106,116.132.235.204,13420,80,6,"Ether / IP / TCP 192.168.0.106:13420 > 116.132.235.204:http S"
116.132.235.204,192.168.0.106,80,13420,6,"Ether / IP / TCP 116.132.235.204:http > 192.168.0.106:13420 SA"
192.168.0.106,116.132.235.204,13420,80,6,"Ether / IP / TCP 192.168.0.106:13420 > 116.132.235.204:http A"
192.168.0.106,116.132.235.204,13420,80,6,"Ether / IP / TCP 192.168.0.106:13420 > 116.132.235.204:http PA / Raw"
192.168.0.106,116.132.235.204,13420,80,6,"Ether / IP / TCP 192.168.0.106:13420 > 116.132.235.204:http A / Raw"
192.168.0.106,116.132.235.204,13420,80,6,"Ether / IP / TCP 192.168.0.106:13420 > 116.132.235.204:http A / Raw"
192.168.0.106,116.132.235.204,13420,80,6,"Ether / IP / TCP 192.168.0.106:13420 > 116.132.235.204:http PA / Raw"
116.132.235.204,192.168.0.106,80,13420,6,"Ether / IP / TCP 116.132.235.204:http > 192.168.0.106:13420 A"
116.132.235.204,192.168.0.106,80,13420,6,"Ether / IP / TCP 116.132.235.204:http > 192.168.0.106:13420 A"
116.132.235.204,192.168.0.106,80,13420,6,"Ether / IP / TCP 116.132.235.204:http > 192.168.0.106:13420 A"
116.132.235.204,192.168.0.106,80,13420,6,"Ether / IP / TCP 116.132.235.204:http > 192.168.0.106:13420 PA / Raw"
116.132.235.204,192.168.0.106,80,13420,6,"Ether / IP / TCP 116.132.235.204:http > 192.168.0.106:13420 FA"
192.168.0.106,116.132.235.204,13420,80,6,"Ether / IP / TCP 192.168.0.106:13420 > 116.132.235.204:http A"
192.168.0.106,116.132.235.204,13420,80,6,"Ether / IP / TCP 192.168.0.106:13420 > 116.132.235.204:http FA"
116.132.235.204,192.168.0.106,80,13420,6,"Ether / IP / TCP 116.132.235.204:http > 192.168.0.106:13420 A"
192.168.0.106,157.255.191.46,7678,80,6,"Ether / IP / TCP 192.168.0.106:7678 > 157.255.191.46:http FA"
192.168.0.106,116.132.235.204,13413,80,6,"Ether / IP / TCP 192.168.0.106:13413 > 116.132.235.204:http FA"
192.168.0.106,116.132.235.204,13421,80,6,"Ether / IP / TCP 192.168.0.106:13421 > 116.132.235.204:http S"
116.132.235.204,192.168.0.106,80,13421,6,"Ether / IP / TCP 116.132.235.204:http > 192.168.0.106:13421 SA"
192.168.0.106,116.132.235.204,13421,80,6,"Ether / IP / TCP 192.168.0.106:13421 > 116.132.235.204:http A"
192.168.0.106,116.132.235.204,13421,80,6,"Ether / IP / TCP 192.168.0.106:13421 > 116.132.235.204:http PA / Raw"
192.168.0.106,116.132.235.204,13421,80,6,"Ether / IP / TCP 192.168.0.106:13421 > 116.132.235.204:http A / Raw"
192.168.0.106,116.132.235.204,13421,80,6,"Ether / IP / TCP 192.168.0.106:13421 > 116.132.235.204:http A / Raw"
192.168.0.106,116.132.235.204,13421,80,6,"Ether / IP / TCP 192.168.0.106:13421 > 116.132.235.204:http PA / Raw"
116.132.235.204,192.168.0.106,80,13421,6,"Ether / IP / TCP 116.132.235.204:http > 192.168.0.106:13421 A"
116.132.235.204,192.168.0.106,80,13421,6,"Ether / IP / TCP 116.132.235.204:http > 192.168.0.106:13421 A"
116.132.235.204,192.168.0.106,80,13421,6,"Ether / IP / TCP 116.132.235.204:http > 192.168.0.106:13421 A"
116.132.235.204,192.168.0.106,80,13421,6,"Ether / IP / TCP 116.132.235.204:http > 192.168.0.106:13421 PA / Raw"
116.132.235.204,192.168.0.106,80,13421,6,"Ether / IP / TCP 116.132.235.204:http > 192.168.0.106:13421 FA"
192.168.0.106,116.132.235.204,13421,80,6,"Ether / IP / TCP 192.168.0.106:13421 > 116.132.235.204:http A"
192.168.0.106,116.132.235.204,13421,80,6,"Ether / IP / TCP 192.168.0.106:13421 > 116.132.235.204:http FA"
116.132.235.204,192.168.0.106,80,13421,6,"Ether / IP / TCP 116.132.235.204:http > 192.168.0.106:13421 A"
192.168.0.106,157.255.191.46,7698,80,6,"Ether / IP / TCP 192.168.0.106:7698 > 157.255.191.46:http FA"
192.168.0.106,116.132.235.204,13423,80,6,"Ether / IP / TCP 192.168.0.106:13423 > 116.132.235.204:http S"
116.132.235.204,192.168.0.106,80,13423,6,"Ether / IP / TCP 116.132.235.204:http > 192.168.0.106:13423 SA"
192.168.0.106,116.132.235.204,13423,80,6,"Ether / IP / TCP 192.168.0.106:13423 > 116.132.235.204:http A"
192.168.0.106,116.132.235.204,13423,80,6,"Ether / IP / TCP 192.168.0.106:13423 > 116.132.235.204:http PA / Raw"
192.168.0.106,116.132.235.204,13423,80,6,"Ether / IP / TCP 192.168.0.106:13423 > 116.132.235.204:http A / Raw"
192.168.0.106,116.132.235.204,13423,80,6,"Ether / IP / TCP 192.168.0.106:13423 > 116.132.235.204:http A / Raw"
192.168.0.106,116.132.235.204,13423,80,6,"Ether / IP / TCP 192.168.0.106:13423 > 116.132.235.204:http PA / Raw"
116.132.235.204,192.168.0.106,80,13423,6,"Ether / IP / TCP 116.132.235.204:http > 192.168.0.106:13423 A"
116.132.235.204,192.168.0.106,80,13423,6,"Ether / IP / TCP 116.132.235.204:http > 192.168.0.106:13423 A"
116.132.235.204,192.168.0.106,80,13423,6,"Ether / IP / TCP 116.132.235.204:http > 192.168.0.106:13423 A"
116.132.235.204,192.168.0.106,80,13423,6,"Ether / IP / TCP 116.132.235.204:http > 192.168.0.106:13423 PA / Raw"
116.132.235.204,192.168.0.106,80,13423,6,"Ether / IP / TCP 116.132.235.204:http > 192.168.0.106:13423 FA"
192.168.0.106,116.132.235.204,13423,80,6,"Ether / IP / TCP 192.168.0.106:13423 > 116.132.235.204:http A"
192.168.0.106,116.132.235.204,13423,80,6,"Ether / IP / TCP 192.168.0.106:13423 > 116.132.235.204:http FA"
116.132.235.204,192.168.0.106,80,13423,6,"Ether / IP / TCP 116.132.235.204:http > 192.168.0.106:13423 A"
192.168.0.106,116.132.235.204,13424,80,6,"Ether / IP / TCP 192.168.0.106:13424 > 116.132.235.204:http S"
116.132.235.204,192.168.0.106,80,13424,6,"Ether / IP / TCP 116.132.235.204:http > 192.168.0.106:13424 SA"
192.168.0.106,116.132.235.204,13424,80,6,"Ether / IP / TCP 192.168.0.106:13424 > 116.132.235.204:http A"
192.168.0.106,116.132.235.204,13424,80,6,"Ether / IP / TCP 192.168.0.106:13424 > 116.132.235.204:http PA / Raw"
192.168.0.106,116.132.235.204,13424,80,6,"Ether / IP / TCP 192.168.0.106:13424 > 116.132.235.204:http A / Raw"
192.168.0.106,116.132.235.204,13424,80,6,"Ether / IP / TCP 192.168.0.106:13424 > 116.132.235.204:http A / Raw"
192.168.0.106,116.132.235.204,13424,80,6,"Ether / IP / TCP 192.168.0.106:13424 > 116.132.235.204:http PA / Raw"
116.132.235.204,192.168.0.106,80,13424,6,"Ether / IP / TCP 116.132.235.204:http > 192.168.0.106:13424 A"
116.132.235.204,192.168.0.106,80,13424,6,"Ether / IP / TCP 116.132.235.204:http > 192.168.0.106:13424 A"
116.132.235.204,192.168.0.106,80,13424,6,"Ether / IP / TCP 116.132.235.204:http > 192.168.0.106:13424 A"
116.132.235.204,192.168.0.106,80,13424,6,"Ether / IP / TCP 116.132.235.204:http > 192.168.0.106:13424 PA / Raw"
116.132.235.204,192.168.0.106,80,13424,6,"Ether / IP / TCP 116.132.235.204:http > 192.168.0.106:13424 FA"
192.168.0.106,116.132.235.204,13424,80,6,"Ether / IP / TCP 192.168.0.106:13424 > 116.132.235.204:http A"
192.168.0.106,116.132.235.204,13424,80,6,"Ether / IP / TCP 192.168.0.106:13424 > 116.132.235.204:http FA"
192.168.0.106,116.132.235.204,13424,80,6,"Ether / IP / TCP 192.168.0.106:13424 > 116.132.235.204:http FA"
157.255.191.89,192.168.0.106,8080,14800,6,"Ether / IP / TCP 157.255.191.89:8080 > 192.168.0.106:14800 PA / Raw"
192.168.0.106,157.255.191.89,14800,8080,6,"Ether / IP / TCP 192.168.0.106:14800 > 157.255.191.89:8080 PA / Raw"
157.255.191.89,192.168.0.106,8080,14800,6,"Ether / IP / TCP 157.255.191.89:8080 > 192.168.0.106:14800 PA / Raw"
192.168.0.106,116.132.235.204,13424,80,6,"Ether / IP / TCP 192.168.0.106:13424 > 116.132.235.204:http FA"
192.168.0.106,157.255.191.46,13407,80,6,"Ether / IP / TCP 192.168.0.106:13407 > 157.255.191.46:http FA"
192.168.0.106,157.255.191.89,14800,8080,6,"Ether / IP / TCP 192.168.0.106:14800 > 157.255.191.89:8080 A"
192.168.0.106,116.132.235.204,13426,80,6,"Ether / IP / TCP 192.168.0.106:13426 > 116.132.235.204:http S"
116.132.235.204,192.168.0.106,80,13426,6,"Ether / IP / TCP 116.132.235.204:http > 192.168.0.106:13426 SA"
192.168.0.106,116.132.235.204,13426,80,6,"Ether / IP / TCP 192.168.0.106:13426 > 116.132.235.204:http A"
192.168.0.106,116.132.235.204,13426,80,6,"Ether / IP / TCP 192.168.0.106:13426 > 116.132.235.204:http PA / Raw"
192.168.0.106,116.132.235.204,13426,80,6,"Ether / IP / TCP 192.168.0.106:13426 > 116.132.235.204:http A / Raw"
192.168.0.106,116.132.235.204,13426,80,6,"Ether / IP / TCP 192.168.0.106:13426 > 116.132.235.204:http A / Raw"
192.168.0.106,116.132.235.204,13426,80,6,"Ether / IP / TCP 192.168.0.106:13426 > 116.132.235.204:http PA / Raw"
116.132.235.204,192.168.0.106,80,13426,6,"Ether / IP / TCP 116.132.235.204:http > 192.168.0.106:13426 A"
116.132.235.204,192.168.0.106,80,13426,6,"Ether / IP / TCP 116.132.235.204:http > 192.168.0.106:13426 A"
116.132.235.204,192.168.0.106,80,13426,6,"Ether / IP / TCP 116.132.235.204:http > 192.168.0.106:13426 A"
116.132.235.204,192.168.0.106,80,13426,6,"Ether / IP / TCP 116.132.235.204:http > 192.168.0.106:13426 PA / Raw"
116.132.235.204,192.168.0.106,80,13426,6,"Ether / IP / TCP 116.132.235.204:http > 192.168.0.106:13426 FA"
192.168.0.106,116.132.235.204,13426,80,6,"Ether / IP / TCP 192.168.0.106:13426 > 116.132.235.204:http A"
192.168.0.106,116.132.235.204,13426,80,6,"Ether / IP / TCP 192.168.0.106:13426 > 116.132.235.204:http FA"
116.132.235.204,192.168.0.106,80,13426,6,"Ether / IP / TCP 116.132.235.204:http > 192.168.0.106:13426 A"
192.168.0.106,116.132.235.204,13424,80,6,"Ether / IP / TCP 192.168.0.106:13424 > 116.132.235.204:http FA"
192.168.0.106,116.132.235.204,13427,80,6,"Ether / IP / TCP 192.168.0.106:13427 > 116.132.235.204:http S"
116.132.235.204,192.168.0.106,80,13427,6,"Ether / IP / TCP 116.132.235.204:http > 192.168.0.106:13427 SA"
192.168.0.106,116.132.235.204,13427,80,6,"Ether / IP / TCP 192.168.0.106:13427 > 116.132.235.204:http A"
192.168.0.106,116.132.235.204,13427,80,6,"Ether / IP / TCP 192.168.0.106:13427 > 116.132.235.204:http PA / Raw"
192.168.0.106,116.132.235.204,13427,80,6,"Ether / IP / TCP 192.168.0.106:13427 > 116.132.235.204:http A / Raw"
192.168.0.106,116.132.235.204,13427,80,6,"Ether / IP / TCP 192.168.0.106:13427 > 116.132.235.204:http A / Raw"
192.168.0.106,116.132.235.204,13427,80,6,"Ether / IP / TCP 192.168.0.106:13427 > 116.132.235.204:http PA / Raw"
116.132.235.204,192.168.0.106,80,13427,6,"Ether / IP / TCP 116.132.235.204:http > 192.168.0.106:13427 A"
116.132.235.204,192.168.0.106,80,13427,6,"Ether / IP / TCP 116.132.235.204:http > 192.168.0.106:13427 A"
116.132.235.204,192.168.0.106,80,13427,6,"Ether / IP / TCP 116.132.235.204:http > 192.168.0.106:13427 A"
116.132.235.204,192.168.0.106,80,13427,6,"Ether / IP / TCP 116.132.235.204:http > 192.168.0.106:13427 PA / Raw"
116.132.235.204,192.168.0.106,80,13427,6,"Ether / IP / TCP 116.132.235.204:http > 192.168.0.106:13427 FA"
192.168.0.106,116.132.235.204,13427,80,6,"Ether / IP / TCP 192.168.0.106:13427 > 116.132.235.204:http A"
192.168.0.106,116.132.235.204,13427,80,6,"Ether / IP / TCP 192.168.0.106:13427 > 116.132.235.204:http FA"
116.132.235.204,192.168.0.106,80,13427,6,"Ether / IP / TCP 116.132.235.204:http > 192.168.0.106:13427 A"
192.168.0.103,224.0.0.251,5353,5353,17,"Ether / IP / UDP / DNS Qry ""b'_companion-link._tcp.local.'"" "
0,0,0,0,0,"Ether / IPv6 / UDP / DNS Qry ""b'_companion-link._tcp.local.'"" "
