data,flowmember,label,classes
"b'her / IP / UDP / DNS Qry ""b\'static-pcs-sdk-server.alibaba.com.\'""'",1,,
"b'her / IP / UDP / DNS Qry ""b\'report.url.cn.\'""'",1,,
"b'her / IP / UDP / DNS Ans ""b\'static-pcs-sdk-server.alibaba.com.gds.alibabadns.com.\'""'",2,,
"b'her / IP / UDP / DNS Ans ""116.128.163.211""'",2,,
b'her / IP / TCP 192.168.0.106:12648 > 116.132.235.228:http ',3,,
b'her / IP / TCP 192.168.0.106:12648 > 116.132.235.228:http ',3,,
b'her / IP / TCP 192.168.0.106:12648 > 116.132.235.228:http PA / Ra',3,,
b'her / IP / TCP 192.168.0.106:12648 > 116.132.235.228:http A / Ra',3,,
b'her / IP / TCP 192.168.0.106:12648 > 116.132.235.228:http A / Ra',3,,
b'her / IP / TCP 192.168.0.106:12648 > 116.132.235.228:http PA / Ra',3,,
b'her / IP / TCP 192.168.0.106:12648 > 116.132.235.228:http ',4,,
b'her / IP / TCP 192.168.0.106:12648 > 116.132.235.228:http F',4,,
b'her / IP / TCP 192.168.0.106:12648 > 116.132.235.228:http F',4,,
b'her / IP / TCP 192.168.0.106:12648 > 116.132.235.228:http F',4,,
b'her / IP / TCP 192.168.0.106:12648 > 116.132.235.228:http F',4,,
b'her / IP / TCP 192.168.0.106:12648 > 116.132.235.228:http F',4,,
b'her / IP / TCP 192.168.0.106:12648 > 116.132.235.228:http F',4,,
b'her / IP / TCP 192.168.0.106:12648 > 116.132.235.228:http R',5,,
b'her / IP / TCP 116.132.235.228:http > 192.168.0.106:12648 S',5,,
b'her / IP / TCP 116.132.235.228:http > 192.168.0.106:12648 ',5,,
b'her / IP / TCP 116.132.235.228:http > 192.168.0.106:12648 ',5,,
b'her / IP / TCP 116.132.235.228:http > 192.168.0.106:12648 ',5,,
b'her / IP / TCP 116.132.235.228:http > 192.168.0.106:12648 PA / Ra',5,,
b'her / IP / TCP 116.132.235.228:http > 192.168.0.106:12648 F',5,,
b'her / IP / TCP 20.189.173.9:https > 192.168.0.106:9503 R',6,,
b'her / IP / TCP 192.168.0.106:12649 > 116.132.235.228:http ',7,,
b'her / IP / TCP 192.168.0.106:12649 > 116.132.235.228:http ',7,,
b'her / IP / TCP 192.168.0.106:12649 > 116.132.235.228:http PA / Ra',7,,
b'her / IP / TCP 192.168.0.106:12649 > 116.132.235.228:http A / Ra',7,,
b'her / IP / TCP 192.168.0.106:12649 > 116.132.235.228:http A / Ra',7,,
b'her / IP / TCP 192.168.0.106:12649 > 116.132.235.228:http PA / Ra',7,,
b'her / IP / TCP 192.168.0.106:12649 > 116.132.235.228:http ',8,,
b'her / IP / TCP 192.168.0.106:12649 > 116.132.235.228:http F',8,,
b'her / IP / TCP 116.132.235.228:http > 192.168.0.106:12649 S',9,,
b'her / IP / TCP 116.132.235.228:http > 192.168.0.106:12649 ',9,,
b'her / IP / TCP 116.132.235.228:http > 192.168.0.106:12649 ',9,,
b'her / IP / TCP 116.132.235.228:http > 192.168.0.106:12649 ',9,,
b'her / IP / TCP 116.132.235.228:http > 192.168.0.106:12649 PA / Ra',9,,
b'her / IP / TCP 116.132.235.228:http > 192.168.0.106:12649 F',9,,
b'her / IP / TCP 116.132.235.228:http > 192.168.0.106:12649 ',10,,
b'her / IP / TCP 192.168.0.106:12650 > 116.132.235.228:http ',10,,
b'her / IP / TCP 192.168.0.106:12650 > 116.132.235.228:http ',10,,
b'her / IP / TCP 192.168.0.106:12650 > 116.132.235.228:http PA / Ra',10,,
b'her / IP / TCP 192.168.0.106:12650 > 116.132.235.228:http A / Ra',10,,
b'her / IP / TCP 192.168.0.106:12650 > 116.132.235.228:http A / Ra',10,,
b'her / IP / TCP 192.168.0.106:12650 > 116.132.235.228:http PA / Ra',10,,
b'her / IP / TCP 192.168.0.106:12650 > 116.132.235.228:http ',11,,
b'her / IP / TCP 192.168.0.106:12650 > 116.132.235.228:http F',11,,
b'her / IP / TCP 192.168.0.106:12650 > 116.132.235.228:http F',11,,
b'her / IP / TCP 192.168.0.106:12650 > 116.132.235.228:http F',11,,
b'her / IP / TCP 192.168.0.106:12650 > 116.132.235.228:http F',11,,
b'her / IP / TCP 192.168.0.106:12650 > 116.132.235.228:http F',11,,
b'her / IP / TCP 192.168.0.106:12650 > 116.132.235.228:http F',11,,
b'her / IP / TCP 192.168.0.106:12650 > 116.132.235.228:http R',12,,
b'her / IP / TCP 116.132.235.228:http > 192.168.0.106:12650 S',12,,
b'her / IP / TCP 116.132.235.228:http > 192.168.0.106:12650 ',12,,
b'her / IP / TCP 116.132.235.228:http > 192.168.0.106:12650 ',12,,
b'her / IP / TCP 116.132.235.228:http > 192.168.0.106:12650 ',12,,
b'her / IP / TCP 116.132.235.228:http > 192.168.0.106:12650 PA / Ra',12,,
b'her / IP / TCP 116.132.235.228:http > 192.168.0.106:12650 F',12,,
b'her / IP / TCP 192.168.0.106:12651 > 116.132.235.228:http ',13,,
b'her / IP / TCP 192.168.0.106:12651 > 116.132.235.228:http ',13,,
b'her / IP / TCP 192.168.0.106:12651 > 116.132.235.228:http PA / Ra',13,,
b'her / IP / TCP 192.168.0.106:12651 > 116.132.235.228:http A / Ra',13,,
b'her / IP / TCP 192.168.0.106:12651 > 116.132.235.228:http A / Ra',13,,
b'her / IP / TCP 192.168.0.106:12651 > 116.132.235.228:http PA / Ra',13,,
b'her / IP / TCP 192.168.0.106:12651 > 116.132.235.228:http ',14,,
b'her / IP / TCP 192.168.0.106:12651 > 116.132.235.228:http F',14,,
b'her / IP / TCP 192.168.0.106:12651 > 116.132.235.228:http F',14,,
b'her / IP / TCP 192.168.0.106:12651 > 116.132.235.228:http F',14,,
b'her / IP / TCP 192.168.0.106:12651 > 116.132.235.228:http F',14,,
b'her / IP / TCP 192.168.0.106:12651 > 116.132.235.228:http F',14,,
b'her / IP / TCP 192.168.0.106:12651 > 116.132.235.228:http F',14,,
b'her / IP / TCP 192.168.0.106:12651 > 116.132.235.228:http R',15,,
b'her / IP / TCP 116.132.235.228:http > 192.168.0.106:12651 S',15,,
b'her / IP / TCP 116.132.235.228:http > 192.168.0.106:12651 ',15,,
b'her / IP / TCP 116.132.235.228:http > 192.168.0.106:12651 ',15,,
b'her / IP / TCP 116.132.235.228:http > 192.168.0.106:12651 ',15,,
b'her / IP / TCP 116.132.235.228:http > 192.168.0.106:12651 PA / Ra',15,,
b'her / IP / TCP 116.132.235.228:http > 192.168.0.106:12651 F',15,,
b'her / IP / TCP 192.168.0.106:12652 > 116.132.235.228:http ',16,,
b'her / IP / TCP 192.168.0.106:12652 > 116.132.235.228:http ',16,,
b'her / IP / TCP 192.168.0.106:12652 > 116.132.235.228:http PA / Ra',16,,
b'her / IP / TCP 192.168.0.106:12652 > 116.132.235.228:http A / Ra',16,,
b'her / IP / TCP 192.168.0.106:12652 > 116.132.235.228:http A / Ra',16,,
b'her / IP / TCP 192.168.0.106:12652 > 116.132.235.228:http PA / Ra',16,,
b'her / IP / TCP 192.168.0.106:12652 > 116.132.235.228:http ',17,,
b'her / IP / TCP 192.168.0.106:12652 > 116.132.235.228:http F',17,,
b'her / IP / TCP 192.168.0.106:12652 > 116.132.235.228:http F',17,,
b'her / IP / TCP 192.168.0.106:12652 > 116.132.235.228:http F',17,,
b'her / IP / TCP 192.168.0.106:12652 > 116.132.235.228:http F',17,,
b'her / IP / TCP 192.168.0.106:12652 > 116.132.235.228:http F',17,,
b'her / IP / TCP 192.168.0.106:12652 > 116.132.235.228:http F',17,,
b'her / IP / TCP 192.168.0.106:12652 > 116.132.235.228:http R',18,,
b'her / IP / TCP 116.132.235.228:http > 192.168.0.106:12652 S',18,,
b'her / IP / TCP 116.132.235.228:http > 192.168.0.106:12652 ',18,,
b'her / IP / TCP 116.132.235.228:http > 192.168.0.106:12652 ',18,,
b'her / IP / TCP 116.132.235.228:http > 192.168.0.106:12652 ',18,,
b'her / IP / TCP 116.132.235.228:http > 192.168.0.106:12652 PA / Ra',18,,
b'her / IP / TCP 116.132.235.228:http > 192.168.0.106:12652 F',18,,
"b'her / IP / UDP / DNS Qry ""b\'functional.events.data.microsoft.com.\'""'",19,,
"b'her / IP / UDP / DNS Qry ""b\'functional.events.data.microsoft.com.\'""'",20,,
"b'her / IP / UDP / DNS Qry ""b\'wpad.www.tendawifi.com.\'""'",21,,
"b'her / IP / UDP / DNS Ans ""b\'global.asimov.events.data.trafficmanager.net.\'""'",22,,
b'her / IP / UDP / DNS Ans',23,,
"b'her / IP / UDP / DNS Ans ""b\'global.asimov.events.data.trafficmanager.net.\'""'",24,,
b'her / IP / TCP 192.168.0.106:12653 > 20.189.173.1:https ',25,,
b'her / IP / TCP 192.168.0.106:12653 > 20.189.173.1:https ',25,,
b'her / IP / TCP 192.168.0.106:12653 > 20.189.173.1:https PA / Ra',25,,
b'her / IP / TCP 192.168.0.106:12653 > 20.189.173.1:https ',25,,
b'her / IP / TCP 192.168.0.106:12653 > 20.189.173.1:https PA / Ra',25,,
b'her / IP / TCP 192.168.0.106:12653 > 20.189.173.1:https PA / Ra',25,,
b'her / IP / TCP 192.168.0.106:12653 > 20.189.173.1:https PA / Ra',26,,
b'her / IP / TCP 192.168.0.106:12653 > 20.189.173.1:https ',26,,
b'her / IP / TCP 192.168.0.106:12653 > 20.189.173.1:https PA / Ra',26,,
b'her / IP / TCP 192.168.0.106:12653 > 20.189.173.1:https PA / Ra',26,,
b'her / IP / TCP 192.168.0.106:12653 > 20.189.173.1:https ',26,,
b'her / IP / TCP 20.189.173.1:https > 192.168.0.106:12653 S',27,,
b'her / IP / TCP 20.189.173.1:https > 192.168.0.106:12653 ',27,,
b'her / IP / TCP 20.189.173.1:https > 192.168.0.106:12653 A / Ra',27,,
b'her / IP / TCP 20.189.173.1:https > 192.168.0.106:12653 A / Ra',27,,
b'her / IP / TCP 20.189.173.1:https > 192.168.0.106:12653 A / Ra',27,,
b'her / IP / TCP 20.189.173.1:https > 192.168.0.106:12653 A / Ra',27,,
b'her / IP / TCP 20.189.173.1:https > 192.168.0.106:12653 PA / Ra',28,,
b'her / IP / TCP 20.189.173.1:https > 192.168.0.106:12653 PA / Ra',28,,
b'her / IP / TCP 20.189.173.1:https > 192.168.0.106:12653 ',28,,
b'her / IP / TCP 20.189.173.1:https > 192.168.0.106:12653 PA / Ra',28,,
b'her / IP / TCP 20.189.173.1:https > 192.168.0.106:12653 ',28,,
b'her / IP / TCP 20.189.173.1:https > 192.168.0.106:12653 PA / Ra',28,,
b'her / IP / TCP 192.168.0.106:12654 > 116.132.235.228:http ',29,,
b'her / IP / TCP 192.168.0.106:12654 > 116.132.235.228:http ',29,,
b'her / IP / TCP 192.168.0.106:12654 > 116.132.235.228:http PA / Ra',29,,
b'her / IP / TCP 192.168.0.106:12654 > 116.132.235.228:http A / Ra',29,,
b'her / IP / TCP 192.168.0.106:12654 > 116.132.235.228:http A / Ra',29,,
b'her / IP / TCP 192.168.0.106:12654 > 116.132.235.228:http PA / Ra',29,,
b'her / IP / TCP 192.168.0.106:12654 > 116.132.235.228:http ',30,,
b'her / IP / TCP 192.168.0.106:12654 > 116.132.235.228:http F',30,,
b'her / IP / TCP 192.168.0.106:12654 > 116.132.235.228:http F',30,,
b'her / IP / TCP 192.168.0.106:12654 > 116.132.235.228:http F',30,,
b'her / IP / TCP 192.168.0.106:12654 > 116.132.235.228:http F',30,,
b'her / IP / TCP 192.168.0.106:12654 > 116.132.235.228:http F',30,,
b'her / IP / TCP 192.168.0.106:12654 > 116.132.235.228:http F',30,,
b'her / IP / TCP 192.168.0.106:12654 > 116.132.235.228:http R',31,,
b'her / IP / TCP 116.132.235.228:http > 192.168.0.106:12654 S',31,,
b'her / IP / TCP 116.132.235.228:http > 192.168.0.106:12654 ',31,,
b'her / IP / TCP 116.132.235.228:http > 192.168.0.106:12654 ',31,,
b'her / IP / TCP 116.132.235.228:http > 192.168.0.106:12654 ',31,,
b'her / IP / TCP 116.132.235.228:http > 192.168.0.106:12654 PA / Ra',31,,
b'her / IP / TCP 116.132.235.228:http > 192.168.0.106:12654 F',31,,
b'her / IP / TCP 192.168.0.106:12655 > 116.132.235.228:http ',32,,
b'her / IP / TCP 192.168.0.106:12655 > 116.132.235.228:http ',32,,
b'her / IP / TCP 192.168.0.106:12655 > 116.132.235.228:http PA / Ra',32,,
b'her / IP / TCP 192.168.0.106:12655 > 116.132.235.228:http A / Ra',32,,
b'her / IP / TCP 192.168.0.106:12655 > 116.132.235.228:http A / Ra',32,,
b'her / IP / TCP 192.168.0.106:12655 > 116.132.235.228:http PA / Ra',32,,
b'her / IP / TCP 192.168.0.106:12655 > 116.132.235.228:http ',33,,
b'her / IP / TCP 192.168.0.106:12655 > 116.132.235.228:http F',33,,
b'her / IP / TCP 116.132.235.228:http > 192.168.0.106:12655 S',34,,
b'her / IP / TCP 116.132.235.228:http > 192.168.0.106:12655 ',34,,
b'her / IP / TCP 116.132.235.228:http > 192.168.0.106:12655 ',34,,
b'her / IP / TCP 116.132.235.228:http > 192.168.0.106:12655 ',34,,
b'her / IP / TCP 116.132.235.228:http > 192.168.0.106:12655 PA / Ra',34,,
b'her / IP / TCP 116.132.235.228:http > 192.168.0.106:12655 F',34,,
b'her / IP / TCP 116.132.235.228:http > 192.168.0.106:12655 ',35,,
b'her / IP / TCP 192.168.0.106:12656 > 116.132.235.228:http ',35,,
b'her / IP / TCP 192.168.0.106:12656 > 116.132.235.228:http ',35,,
b'her / IP / TCP 192.168.0.106:12656 > 116.132.235.228:http PA / Ra',35,,
b'her / IP / TCP 192.168.0.106:12656 > 116.132.235.228:http A / Ra',35,,
b'her / IP / TCP 192.168.0.106:12656 > 116.132.235.228:http A / Ra',35,,
b'her / IP / TCP 192.168.0.106:12656 > 116.132.235.228:http PA / Ra',35,,
b'her / IP / TCP 192.168.0.106:12656 > 116.132.235.228:http ',36,,
b'her / IP / TCP 192.168.0.106:12656 > 116.132.235.228:http F',36,,
b'her / IP / TCP 116.132.235.228:http > 192.168.0.106:12656 S',37,,
b'her / IP / TCP 116.132.235.228:http > 192.168.0.106:12656 ',37,,
b'her / IP / TCP 116.132.235.228:http > 192.168.0.106:12656 ',37,,
b'her / IP / TCP 116.132.235.228:http > 192.168.0.106:12656 ',37,,
b'her / IP / TCP 116.132.235.228:http > 192.168.0.106:12656 PA / Ra',37,,
b'her / IP / TCP 116.132.235.228:http > 192.168.0.106:12656 F',37,,
b'her / IP / TCP 116.132.235.228:http > 192.168.0.106:12656 ',38,,
b'her / IP / TCP 192.168.0.106:11670 > 116.130.230.27:https PA / Ra',38,,
b'her / IP / TCP 192.168.0.106:11670 > 116.130.230.27:https ',38,,
b'her / IP / TCP 192.168.0.106:11670 > 116.130.230.27:https ',38,,
b'her / IP / TCP 192.168.0.106:11670 > 116.130.230.27:https ',38,,
b'her / IP / TCP 116.130.230.27:https > 192.168.0.106:11670 PA / Ra',39,,
b'her / IP / TCP 116.130.230.27:https > 192.168.0.106:11670 PA / Ra',39,,
b'her / IP / TCP 116.130.230.27:https > 192.168.0.106:11670 PA / Ra',39,,
b'her / IP / TCP 192.168.0.106:12657 > 116.132.235.228:http ',40,,
b'her / IP / TCP 192.168.0.106:12657 > 116.132.235.228:http ',40,,
b'her / IP / TCP 192.168.0.106:12657 > 116.132.235.228:http PA / Ra',40,,
b'her / IP / TCP 192.168.0.106:12657 > 116.132.235.228:http A / Ra',40,,
b'her / IP / TCP 192.168.0.106:12657 > 116.132.235.228:http A / Ra',40,,
b'her / IP / TCP 192.168.0.106:12657 > 116.132.235.228:http PA / Ra',40,,
b'her / IP / TCP 192.168.0.106:12657 > 116.132.235.228:http ',41,,
b'her / IP / TCP 192.168.0.106:12657 > 116.132.235.228:http F',41,,
b'her / IP / TCP 116.132.235.228:http > 192.168.0.106:12657 S',42,,
b'her / IP / TCP 116.132.235.228:http > 192.168.0.106:12657 ',42,,
b'her / IP / TCP 116.132.235.228:http > 192.168.0.106:12657 ',42,,
b'her / IP / TCP 116.132.235.228:http > 192.168.0.106:12657 ',42,,
b'her / IP / TCP 116.132.235.228:http > 192.168.0.106:12657 PA / Ra',42,,
b'her / IP / TCP 116.132.235.228:http > 192.168.0.106:12657 F',42,,
b'her / IP / TCP 116.132.235.228:http > 192.168.0.106:12657 ',43,,
b'her / IP / TCP 192.168.0.106:12658 > 116.132.235.228:http ',43,,
b'her / IP / TCP 192.168.0.106:12658 > 116.132.235.228:http ',43,,
b'her / IP / TCP 192.168.0.106:12658 > 116.132.235.228:http PA / Ra',43,,
b'her / IP / TCP 192.168.0.106:12658 > 116.132.235.228:http A / Ra',43,,
b'her / IP / TCP 192.168.0.106:12658 > 116.132.235.228:http A / Ra',43,,
b'her / IP / TCP 192.168.0.106:12658 > 116.132.235.228:http PA / Ra',43,,
b'her / IP / TCP 192.168.0.106:12658 > 116.132.235.228:http ',44,,
b'her / IP / TCP 192.168.0.106:12658 > 116.132.235.228:http F',44,,
b'her / IP / TCP 116.132.235.228:http > 192.168.0.106:12658 S',45,,
b'her / IP / TCP 116.132.235.228:http > 192.168.0.106:12658 ',45,,
b'her / IP / TCP 116.132.235.228:http > 192.168.0.106:12658 ',45,,
b'her / IP / TCP 116.132.235.228:http > 192.168.0.106:12658 ',45,,
b'her / IP / TCP 116.132.235.228:http > 192.168.0.106:12658 PA / Ra',45,,
b'her / IP / TCP 116.132.235.228:http > 192.168.0.106:12658 F',45,,
b'her / IP / TCP 116.132.235.228:http > 192.168.0.106:12658 ',46,,
b'her / IP / TCP 192.168.0.106:12659 > 116.132.235.228:http ',46,,
b'her / IP / TCP 192.168.0.106:12659 > 116.132.235.228:http ',46,,
b'her / IP / TCP 192.168.0.106:12659 > 116.132.235.228:http PA / Ra',46,,
b'her / IP / TCP 192.168.0.106:12659 > 116.132.235.228:http A / Ra',46,,
b'her / IP / TCP 192.168.0.106:12659 > 116.132.235.228:http A / Ra',46,,
b'her / IP / TCP 192.168.0.106:12659 > 116.132.235.228:http PA / Ra',46,,
b'her / IP / TCP 192.168.0.106:12659 > 116.132.235.228:http ',47,,
b'her / IP / TCP 192.168.0.106:12659 > 116.132.235.228:http F',47,,
b'her / IP / TCP 192.168.0.106:12659 > 116.132.235.228:http F',47,,
b'her / IP / TCP 192.168.0.106:12659 > 116.132.235.228:http F',47,,
b'her / IP / TCP 192.168.0.106:12659 > 116.132.235.228:http F',47,,
b'her / IP / TCP 192.168.0.106:12659 > 116.132.235.228:http F',47,,
b'her / IP / TCP 192.168.0.106:12659 > 116.132.235.228:http F',47,,
b'her / IP / TCP 192.168.0.106:12659 > 116.132.235.228:http R',48,,
b'her / IP / TCP 116.132.235.228:http > 192.168.0.106:12659 S',48,,
b'her / IP / TCP 116.132.235.228:http > 192.168.0.106:12659 ',48,,
b'her / IP / TCP 116.132.235.228:http > 192.168.0.106:12659 ',48,,
b'her / IP / TCP 116.132.235.228:http > 192.168.0.106:12659 PA / Ra',48,,
b'her / IP / TCP 116.132.235.228:http > 192.168.0.106:12659 F',48,,
b'her / IP / TCP 192.168.0.106:12660 > 110.242.68.4:http ',49,,
b'her / IP / TCP 192.168.0.106:12660 > 110.242.68.4:http ',49,,
b'her / IP / TCP 192.168.0.106:12660 > 110.242.68.4:http F',49,,
b'her / IP / TCP 192.168.0.106:12660 > 110.242.68.4:http ',49,,
b'her / IP / TCP 110.242.68.4:http > 192.168.0.106:12660 S',50,,
b'her / IP / TCP 110.242.68.4:http > 192.168.0.106:12660 ',50,,
b'her / IP / TCP 110.242.68.4:http > 192.168.0.106:12660 F',50,,
b'her / IP / TCP 192.168.0.106:12661 > 116.132.235.228:http ',51,,
b'her / IP / TCP 192.168.0.106:12661 > 116.132.235.228:http ',51,,
b'her / IP / TCP 192.168.0.106:12661 > 116.132.235.228:http PA / Ra',51,,
b'her / IP / TCP 192.168.0.106:12661 > 116.132.235.228:http A / Ra',51,,
b'her / IP / TCP 192.168.0.106:12661 > 116.132.235.228:http A / Ra',51,,
b'her / IP / TCP 192.168.0.106:12661 > 116.132.235.228:http PA / Ra',51,,
b'her / IP / TCP 192.168.0.106:12661 > 116.132.235.228:http ',52,,
b'her / IP / TCP 192.168.0.106:12661 > 116.132.235.228:http F',52,,
b'her / IP / TCP 192.168.0.106:12661 > 116.132.235.228:http F',52,,
b'her / IP / TCP 192.168.0.106:12661 > 116.132.235.228:http F',52,,
b'her / IP / TCP 192.168.0.106:12661 > 116.132.235.228:http F',52,,
b'her / IP / TCP 192.168.0.106:12661 > 116.132.235.228:http F',52,,
b'her / IP / TCP 192.168.0.106:12661 > 116.132.235.228:http F',52,,
b'her / IP / TCP 192.168.0.106:12661 > 116.132.235.228:http R',53,,
b'her / IP / TCP 116.132.235.228:http > 192.168.0.106:12661 S',53,,
b'her / IP / TCP 116.132.235.228:http > 192.168.0.106:12661 ',53,,
b'her / IP / TCP 116.132.235.228:http > 192.168.0.106:12661 ',53,,
b'her / IP / TCP 116.132.235.228:http > 192.168.0.106:12661 ',53,,
b'her / IP / TCP 116.132.235.228:http > 192.168.0.106:12661 PA / Ra',53,,
b'her / IP / TCP 116.132.235.228:http > 192.168.0.106:12661 F',53,,
b'her / IP / TCP 192.168.0.106:12662 > 116.132.235.228:http ',54,,
b'her / IP / TCP 192.168.0.106:12662 > 116.132.235.228:http ',54,,
b'her / IP / TCP 192.168.0.106:12662 > 116.132.235.228:http PA / Ra',54,,
b'her / IP / TCP 192.168.0.106:12662 > 116.132.235.228:http A / Ra',54,,
b'her / IP / TCP 192.168.0.106:12662 > 116.132.235.228:http A / Ra',54,,
b'her / IP / TCP 192.168.0.106:12662 > 116.132.235.228:http PA / Ra',54,,
b'her / IP / TCP 192.168.0.106:12662 > 116.132.235.228:http ',55,,
b'her / IP / TCP 192.168.0.106:12662 > 116.132.235.228:http F',55,,
b'her / IP / TCP 192.168.0.106:12662 > 116.132.235.228:http F',55,,
b'her / IP / TCP 192.168.0.106:12662 > 116.132.235.228:http F',55,,
b'her / IP / TCP 192.168.0.106:12662 > 116.132.235.228:http F',55,,
b'her / IP / TCP 192.168.0.106:12662 > 116.132.235.228:http F',55,,
b'her / IP / TCP 192.168.0.106:12662 > 116.132.235.228:http F',55,,
b'her / IP / TCP 192.168.0.106:12662 > 116.132.235.228:http R',56,,
b'her / IP / TCP 116.132.235.228:http > 192.168.0.106:12662 S',56,,
b'her / IP / TCP 116.132.235.228:http > 192.168.0.106:12662 ',56,,
b'her / IP / TCP 116.132.235.228:http > 192.168.0.106:12662 ',56,,
b'her / IP / TCP 116.132.235.228:http > 192.168.0.106:12662 ',56,,
b'her / IP / TCP 116.132.235.228:http > 192.168.0.106:12662 PA / Ra',56,,
b'her / IP / TCP 116.132.235.228:http > 192.168.0.106:12662 F',56,,
b'her / IP / TCP 192.168.0.106:12663 > 116.132.235.228:http ',57,,
b'her / IP / TCP 192.168.0.106:12663 > 116.132.235.228:http ',57,,
b'her / IP / TCP 192.168.0.106:12663 > 116.132.235.228:http PA / Ra',57,,
b'her / IP / TCP 192.168.0.106:12663 > 116.132.235.228:http A / Ra',57,,
b'her / IP / TCP 192.168.0.106:12663 > 116.132.235.228:http A / Ra',57,,
b'her / IP / TCP 192.168.0.106:12663 > 116.132.235.228:http PA / Ra',57,,
b'her / IP / TCP 192.168.0.106:12663 > 116.132.235.228:http ',58,,
b'her / IP / TCP 192.168.0.106:12663 > 116.132.235.228:http F',58,,
b'her / IP / TCP 192.168.0.106:12663 > 116.132.235.228:http F',58,,
b'her / IP / TCP 192.168.0.106:12663 > 116.132.235.228:http F',58,,
b'her / IP / TCP 192.168.0.106:12663 > 116.132.235.228:http F',58,,
b'her / IP / TCP 192.168.0.106:12663 > 116.132.235.228:http F',58,,
b'her / IP / TCP 192.168.0.106:12663 > 116.132.235.228:http F',58,,
b'her / IP / TCP 192.168.0.106:12663 > 116.132.235.228:http R',59,,
b'her / IP / TCP 116.132.235.228:http > 192.168.0.106:12663 S',59,,
b'her / IP / TCP 116.132.235.228:http > 192.168.0.106:12663 ',59,,
b'her / IP / TCP 116.132.235.228:http > 192.168.0.106:12663 ',59,,
b'her / IP / TCP 116.132.235.228:http > 192.168.0.106:12663 ',59,,
b'her / IP / TCP 116.132.235.228:http > 192.168.0.106:12663 PA / Ra',59,,
b'her / IP / TCP 116.132.235.228:http > 192.168.0.106:12663 F',59,,
b'her / IP / TCP 192.168.0.106:12664 > 116.132.235.228:http ',60,,
b'her / IP / TCP 192.168.0.106:12664 > 116.132.235.228:http ',60,,
b'her / IP / TCP 192.168.0.106:12664 > 116.132.235.228:http PA / Ra',60,,
b'her / IP / TCP 192.168.0.106:12664 > 116.132.235.228:http A / Ra',60,,
b'her / IP / TCP 192.168.0.106:12664 > 116.132.235.228:http A / Ra',60,,
b'her / IP / TCP 192.168.0.106:12664 > 116.132.235.228:http PA / Ra',60,,
b'her / IP / TCP 192.168.0.106:12664 > 116.132.235.228:http ',61,,
b'her / IP / TCP 192.168.0.106:12664 > 116.132.235.228:http F',61,,
b'her / IP / TCP 116.132.235.228:http > 192.168.0.106:12664 S',62,,
b'her / IP / TCP 116.132.235.228:http > 192.168.0.106:12664 ',62,,
b'her / IP / TCP 116.132.235.228:http > 192.168.0.106:12664 ',62,,
b'her / IP / TCP 116.132.235.228:http > 192.168.0.106:12664 ',62,,
b'her / IP / TCP 116.132.235.228:http > 192.168.0.106:12664 PA / Ra',62,,
b'her / IP / TCP 116.132.235.228:http > 192.168.0.106:12664 F',62,,
b'her / IP / TCP 116.132.235.228:http > 192.168.0.106:12664 ',63,,
b'her / IP / TCP 192.168.0.106:12665 > 116.132.235.228:http ',63,,
b'her / IP / TCP 192.168.0.106:12665 > 116.132.235.228:http ',63,,
b'her / IP / TCP 192.168.0.106:12665 > 116.132.235.228:http PA / Ra',63,,
b'her / IP / TCP 192.168.0.106:12665 > 116.132.235.228:http A / Ra',63,,
b'her / IP / TCP 192.168.0.106:12665 > 116.132.235.228:http A / Ra',63,,
b'her / IP / TCP 192.168.0.106:12665 > 116.132.235.228:http PA / Ra',63,,
b'her / IP / TCP 192.168.0.106:12665 > 116.132.235.228:http ',64,,
b'her / IP / TCP 192.168.0.106:12665 > 116.132.235.228:http F',64,,
b'her / IP / TCP 116.132.235.228:http > 192.168.0.106:12665 S',65,,
b'her / IP / TCP 116.132.235.228:http > 192.168.0.106:12665 ',65,,
b'her / IP / TCP 116.132.235.228:http > 192.168.0.106:12665 ',65,,
b'her / IP / TCP 116.132.235.228:http > 192.168.0.106:12665 PA / Ra',65,,
b'her / IP / TCP 116.132.235.228:http > 192.168.0.106:12665 F',65,,
b'her / IP / TCP 116.132.235.228:http > 192.168.0.106:12665 ',65,,
b'her / IP / TCP 192.168.0.106:12666 > 110.242.68.4:http ',66,,
b'her / IP / TCP 192.168.0.106:12666 > 110.242.68.4:http ',66,,
b'her / IP / TCP 192.168.0.106:12666 > 110.242.68.4:http F',66,,
b'her / IP / TCP 192.168.0.106:12666 > 110.242.68.4:http ',66,,
b'her / IP / TCP 110.242.68.4:http > 192.168.0.106:12666 S',67,,
b'her / IP / TCP 110.242.68.4:http > 192.168.0.106:12666 ',67,,
b'her / IP / TCP 110.242.68.4:http > 192.168.0.106:12666 F',67,,
b'her / IP / TCP 192.168.0.106:11726 > 157.255.209.167:http PA / Ra',68,,
b'her / IP / TCP 192.168.0.106:11726 > 157.255.209.167:http ',68,,
b'her / IP / TCP 157.255.209.167:http > 192.168.0.106:11726 PA / Ra',69,,
b'her / IP / TCP 192.168.0.106:12667 > 116.130.230.27:http ',70,,
b'her / IP / TCP 192.168.0.106:12667 > 116.130.230.27:http ',70,,
b'her / IP / TCP 192.168.0.106:12667 > 116.130.230.27:http PA / Ra',70,,
b'her / IP / TCP 192.168.0.106:12667 > 116.130.230.27:http PA / Ra',70,,
b'her / IP / TCP 192.168.0.106:12667 > 116.130.230.27:http F',70,,
b'her / IP / TCP 192.168.0.106:12667 > 116.130.230.27:http ',70,,
b'her / IP / TCP 192.168.0.106:12668 > 116.130.230.27:https ',71,,
b'her / IP / TCP 192.168.0.106:12668 > 116.130.230.27:https ',71,,
b'her / IP / TCP 192.168.0.106:12668 > 116.130.230.27:https PA / Ra',71,,
b'her / IP / TCP 192.168.0.106:12668 > 116.130.230.27:https ',71,,
b'her / IP / TCP 192.168.0.106:12668 > 116.130.230.27:https F',71,,
b'her / IP / TCP 192.168.0.106:12668 > 116.130.230.27:https ',71,,
b'her / IP / TCP 116.130.230.27:http > 192.168.0.106:12667 S',72,,
b'her / IP / TCP 116.130.230.27:http > 192.168.0.106:12667 ',72,,
b'her / IP / TCP 116.130.230.27:http > 192.168.0.106:12667 PA / Ra',72,,
b'her / IP / TCP 116.130.230.27:http > 192.168.0.106:12667 ',72,,
b'her / IP / TCP 116.130.230.27:http > 192.168.0.106:12667 PA / Ra',72,,
b'her / IP / TCP 116.130.230.27:http > 192.168.0.106:12667 F',72,,
b'her / IP / TCP 116.130.230.27:https > 192.168.0.106:12668 S',73,,
b'her / IP / TCP 116.130.230.27:https > 192.168.0.106:12668 ',73,,
b'her / IP / TCP 116.130.230.27:https > 192.168.0.106:12668 PA / Ra',73,,
b'her / IP / TCP 116.130.230.27:https > 192.168.0.106:12668 F',73,,
"b'her / IP / UDP / DNS Ans ""192.168.0.103""'",74,,
"b'her / IP / UDP / DNS Ans ""192.168.0.103""'",74,,
"b'her / IP / UDP / DNS Ans ""192.168.0.103""'",74,,
"b'her / IP / UDP / DNS Ans ""192.168.0.103""'",74,,
"b'her / IPv6 / UDP / DNS Ans ""192.168.0.103""'",75,,
"b'her / IPv6 / UDP / DNS Ans ""192.168.0.103""'",75,,
"b'her / IPv6 / UDP / DNS Ans ""192.168.0.103""'",75,,
"b'her / IPv6 / UDP / DNS Ans ""192.168.0.103""'",75,,
b'her / IP / TCP 192.168.0.106:12669 > 116.128.163.211:https ',76,,
b'her / IP / TCP 192.168.0.106:12669 > 116.128.163.211:https ',76,,
b'her / IP / TCP 192.168.0.106:12669 > 116.128.163.211:https PA / Ra',76,,
b'her / IP / TCP 192.168.0.106:12669 > 116.128.163.211:https ',76,,
b'her / IP / TCP 192.168.0.106:12669 > 116.128.163.211:https PA / Ra',76,,
b'her / IP / TCP 192.168.0.106:12669 > 116.128.163.211:https PA / Ra',76,,
b'her / IP / TCP 192.168.0.106:12669 > 116.128.163.211:https ',77,,
b'her / IP / TCP 192.168.0.106:12669 > 116.128.163.211:https F',77,,
b'her / IP / TCP 192.168.0.106:12669 > 116.128.163.211:https ',77,,
b'her / IP / TCP 116.128.163.211:https > 192.168.0.106:12669 S',78,,
b'her / IP / TCP 116.128.163.211:https > 192.168.0.106:12669 ',78,,
b'her / IP / TCP 116.128.163.211:https > 192.168.0.106:12669 PA / Ra',78,,
b'her / IP / TCP 116.128.163.211:https > 192.168.0.106:12669 ',78,,
b'her / IP / TCP 116.128.163.211:https > 192.168.0.106:12669 ',78,,
b'her / IP / TCP 116.128.163.211:https > 192.168.0.106:12669 PA / Ra',78,,
b'her / IP / TCP 116.128.163.211:https > 192.168.0.106:12669 F',79,,
b'her / IP / TCP 116.128.163.211:https > 192.168.0.106:12669 ',79,,
b'her / IP / UDP 192.168.192.1:netbios_ns > 192.168.192.2:netbios_ns / NBNSHeader / Ra',80,,
b'her / IP / UDP 192.168.192.1:netbios_ns > 192.168.192.2:netbios_ns / NBNSHeader / Ra',80,,
b'her / IP / UDP 192.168.192.1:netbios_ns > 192.168.192.2:netbios_ns / NBNSHeader / Ra',80,,
b'her / IP / TCP 119.3.178.178:21113 > 192.168.0.106:6806 A / Paddin',81,,
b'her / IP / TCP 192.168.0.106:6806 > 119.3.178.178:21113 ',82,,
b'her / IP / TCP 192.168.0.106:12670 > 110.242.68.4:http ',83,,
b'her / IP / TCP 192.168.0.106:12670 > 110.242.68.4:http ',83,,
b'her / IP / TCP 192.168.0.106:12670 > 110.242.68.4:http F',83,,
b'her / IP / TCP 192.168.0.106:12670 > 110.242.68.4:http ',83,,
b'her / IP / TCP 110.242.68.4:http > 192.168.0.106:12670 S',84,,
b'her / IP / TCP 110.242.68.4:http > 192.168.0.106:12670 ',84,,
b'her / IP / TCP 110.242.68.4:http > 192.168.0.106:12670 F',84,,
